nohup: ignoring input
2025-06-01 22:48:49.649933: I tensorflow/core/util/port.cc:110] oneDNN custom operations are on. You may see slightly different numerical results due to floating-point round-off errors from different computation orders. To turn them off, set the environment variable `TF_ENABLE_ONEDNN_OPTS=0`.
2025-06-01 22:48:49.652517: I tensorflow/tsl/cuda/cudart_stub.cc:28] Could not find cuda drivers on your machine, GPU will not be used.
2025-06-01 22:48:49.701384: I tensorflow/tsl/cuda/cudart_stub.cc:28] Could not find cuda drivers on your machine, GPU will not be used.
2025-06-01 22:48:49.702511: I tensorflow/core/platform/cpu_feature_guard.cc:182] This TensorFlow binary is optimized to use available CPU instructions in performance-critical operations.
To enable the following instructions: AVX2 AVX512F AVX512_VNNI AVX512_BF16 FMA, in other operations, rebuild TensorFlow with the appropriate compiler flags.
2025-06-01 22:48:52.067391: W tensorflow/compiler/tf2tensorrt/utils/py_utils.cc:38] TF-TRT Warning: Could not find TensorRT
/home/rhoffmann/.local/lib/python3.10/site-packages/tensorflow_addons/utils/tfa_eol_msg.py:23: UserWarning: 

TensorFlow Addons (TFA) has ended development and introduction of new features.
TFA has entered a minimal maintenance and release mode until a planned end of life in May 2024.
Please modify downstream libraries to take dependencies from other repositories in our TensorFlow community (e.g. Keras, Keras-CV, and Keras-NLP). 

For more information see: https://github.com/tensorflow/addons/issues/2807 

  warnings.warn(
WARNING:tensorflow:From /home/rhoffmann/G3LHalo_python/exampleNotebooks/GMNN_Bayesian_Optimization_2Halo.py:57: is_gpu_available (from tensorflow.python.framework.test_util) is deprecated and will be removed in a future version.
Instructions for updating:
Use `tf.config.list_physical_devices('GPU')` instead.
using cpu device 

Number of test samples is 7500, should be 7500
Number of validation samples is 7500, should be 7500
Number of train samples is 35000, should be 35000
/home/rhoffmann/G3LHalo_python/exampleNotebooks/GMNN_Bayesian_Optimization_2Halo.py:110: UserWarning: No artists with labels found to put in legend.  Note that artists whose label start with an underscore are ignored when legend() is called with no argument.
  axes.legend()
number of training targets: 35000 . Should be 35000
number of validation targets: 7500 . Should be 7500
number of test targets: 7500 . Should be 7500
Shape of training targets: (3, 35000, 50). Should be (3, 35000, 50)
Shape of testing targets: (3, 7500, 50). Should be (3, 7500, 50)
Shape of validation targets: (3, 7500, 50). Should be (3, 7500, 50)
input min/max: 1.168300956697601e-06 16.999974244680363
number of training features: 35000 . Should be 35000
number of validation features: 7500 . Should be 7500
number of test features: 7500 . Should be 7500
Train Rescaled Shape: (3, 35000, 50)
Test Rescaled Shape: (3, 7500, 50)
Val Rescaled Shape: (3, 7500, 50)
Train Rescaled Shape: (35000, 10)
Test Rescaled Shape: (7500, 10)
Val Rescaled Shape: (7500, 10)
using random seed:  144440
[I 2025-06-01 22:49:08,248] A new study created in memory with name: no-name-368a7efa-6048-48de-b4b8-cc48a8c8e1a1
Training model with params: layers=13, units=172, activation=tanh, optimizer=RAdam, lr=0.00967100325641736, batchsize=1198
Finish Trainingstep 1 of 3 with lr=0.00967100325641736 and 1000 epochs
Finish Trainingstep 2 of 3 with lr=0.00967100325641736 and 1000 epochs
Finish Trainingstep 3 of 3 with lr=0.00967100325641736 and 10000 epochs
2025-06-02_00-14-32
[I 2025-06-02 00:14:32,403] Trial 0 finished with value: 0.0017215298721566796 and parameters: {'n_layers': 13, 'n_units': 172, 'activation': 'tanh', 'lr': 0.00967100325641736, 'optimizer': 'RAdam', 'batch_size': 1198}. Best is trial 0 with value: 0.0017215298721566796.
Training model with params: layers=15, units=234, activation=sigmoid, optimizer=rmsprop, lr=6.477035000062379e-06, batchsize=1251
Finish Trainingstep 1 of 3 with lr=6.477035000062379e-06 and 1000 epochs
Finish Trainingstep 2 of 3 with lr=6.477035000062379e-06 and 1000 epochs
Finish Trainingstep 3 of 3 with lr=6.477035000062379e-06 and 10000 epochs
2025-06-02_00-51-54
[I 2025-06-02 00:51:54,630] Trial 1 finished with value: 1.0039070844650269 and parameters: {'n_layers': 15, 'n_units': 234, 'activation': 'sigmoid', 'lr': 6.477035000062379e-06, 'optimizer': 'rmsprop', 'batch_size': 1251}. Best is trial 0 with value: 0.0017215298721566796.
Training model with params: layers=6, units=304, activation=tanh, optimizer=sgd, lr=0.0007686749402629928, batchsize=1241
Finish Trainingstep 1 of 3 with lr=0.0007686749402629928 and 1000 epochs
Finish Trainingstep 2 of 3 with lr=0.0007686749402629928 and 1000 epochs
Finish Trainingstep 3 of 3 with lr=0.0007686749402629928 and 10000 epochs
2025-06-02_03-59-52
[I 2025-06-02 03:59:52,509] Trial 2 finished with value: 0.10911358892917633 and parameters: {'n_layers': 6, 'n_units': 304, 'activation': 'tanh', 'lr': 0.0007686749402629928, 'optimizer': 'sgd', 'batch_size': 1241}. Best is trial 0 with value: 0.0017215298721566796.
Training model with params: layers=2, units=996, activation=sigmoid, optimizer=rmsprop, lr=0.0019794196316849076, batchsize=1336
Finish Trainingstep 1 of 3 with lr=0.0019794196316849076 and 1000 epochs
Finish Trainingstep 2 of 3 with lr=0.0019794196316849076 and 1000 epochs
Finish Trainingstep 3 of 3 with lr=0.0019794196316849076 and 10000 epochs
2025-06-02_06-35-23
[I 2025-06-02 06:35:23,132] Trial 3 finished with value: 0.0027771200984716415 and parameters: {'n_layers': 2, 'n_units': 996, 'activation': 'sigmoid', 'lr': 0.0019794196316849076, 'optimizer': 'rmsprop', 'batch_size': 1336}. Best is trial 0 with value: 0.0017215298721566796.
Training model with params: layers=10, units=59, activation=tanh, optimizer=sgd, lr=2.2664683342434157e-05, batchsize=1276
Finish Trainingstep 1 of 3 with lr=2.2664683342434157e-05 and 1000 epochs
Finish Trainingstep 2 of 3 with lr=2.2664683342434157e-05 and 1000 epochs
Finish Trainingstep 3 of 3 with lr=2.2664683342434157e-05 and 10000 epochs
2025-06-02_07-40-29
[I 2025-06-02 07:40:29,755] Trial 4 finished with value: 0.9424733519554138 and parameters: {'n_layers': 10, 'n_units': 59, 'activation': 'tanh', 'lr': 2.2664683342434157e-05, 'optimizer': 'sgd', 'batch_size': 1276}. Best is trial 0 with value: 0.0017215298721566796.
Training model with params: layers=4, units=154, activation=leaky_relu, optimizer=rmsprop, lr=0.006946974800179531, batchsize=1499
Finish Trainingstep 1 of 3 with lr=0.006946974800179531 and 1000 epochs
Finish Trainingstep 2 of 3 with lr=0.006946974800179531 and 1000 epochs
Finish Trainingstep 3 of 3 with lr=0.006946974800179531 and 10000 epochs
2025-06-02_09-06-12
[I 2025-06-02 09:06:12,366] Trial 5 finished with value: 0.002192610874772072 and parameters: {'n_layers': 4, 'n_units': 154, 'activation': 'leaky_relu', 'lr': 0.006946974800179531, 'optimizer': 'rmsprop', 'batch_size': 1499}. Best is trial 0 with value: 0.0017215298721566796.
Training model with params: layers=10, units=105, activation=relu, optimizer=rmsprop, lr=2.8595335863612854e-06, batchsize=602
Finish Trainingstep 1 of 3 with lr=2.8595335863612854e-06 and 1000 epochs
Finish Trainingstep 2 of 3 with lr=2.8595335863612854e-06 and 1000 epochs
