[I 2025-05-27 05:28:30,272] Trial 28 finished with value: 0.0014693655539304018 and parameters: {'n_layers': 9, 'n_units': 441, 'activation': 'gelu', 'lr': 4.719534198421862e-05, 'optimizer': 'rmsprop', 'batch_size': 692}. Best is trial 24 with value: 0.0010980810038745403.
Training model with params: layers=5, units=240, activation=gelu, optimizer=RAdam, lr=1.959810136041427e-05, batchsize=16
Finish Trainingstep 1 of 3 with lr=1.959810136041427e-05 and 1000 epochs
Finish Trainingstep 2 of 3 with lr=1.959810136041427e-05 and 1000 epochs
Finish Trainingstep 3 of 3 with lr=1.959810136041427e-05 and 10000 epochs
2025-05-28_16-31-13
[I 2025-05-28 16:31:14,152] Trial 29 finished with value: 0.0015080099692568183 and parameters: {'n_layers': 5, 'n_units': 240, 'activation': 'gelu', 'lr': 1.959810136041427e-05, 'optimizer': 'RAdam', 'batch_size': 16}. Best is trial 24 with value: 0.0010980810038745403.
Training model with params: layers=2, units=701, activation=selu, optimizer=RAdam, lr=3.082663472358428e-05, batchsize=1205
Finish Trainingstep 1 of 3 with lr=3.082663472358428e-05 and 1000 epochs
Finish Trainingstep 2 of 3 with lr=3.082663472358428e-05 and 1000 epochs
Finish Trainingstep 3 of 3 with lr=3.082663472358428e-05 and 10000 epochs
2025-05-28_19-15-12
[I 2025-05-28 19:15:12,500] Trial 30 finished with value: 0.004786150995641947 and parameters: {'n_layers': 2, 'n_units': 701, 'activation': 'selu', 'lr': 3.082663472358428e-05, 'optimizer': 'RAdam', 'batch_size': 1205}. Best is trial 24 with value: 0.0010980810038745403.
Training model with params: layers=10, units=539, activation=gelu, optimizer=adam, lr=6.00633795651782e-05, batchsize=972
Finish Trainingstep 1 of 3 with lr=6.00633795651782e-05 and 1000 epochs
Finish Trainingstep 2 of 3 with lr=6.00633795651782e-05 and 1000 epochs
Finish Trainingstep 3 of 3 with lr=6.00633795651782e-05 and 10000 epochs
2025-05-29_01-59-12
[I 2025-05-29 01:59:12,441] Trial 31 finished with value: 0.0012709120055660605 and parameters: {'n_layers': 10, 'n_units': 539, 'activation': 'gelu', 'lr': 6.00633795651782e-05, 'optimizer': 'adam', 'batch_size': 972}. Best is trial 24 with value: 0.0010980810038745403.
Training model with params: layers=10, units=586, activation=gelu, optimizer=adam, lr=7.641892033935078e-05, batchsize=1258
Finish Trainingstep 1 of 3 with lr=7.641892033935078e-05 and 1000 epochs
Finish Trainingstep 2 of 3 with lr=7.641892033935078e-05 and 1000 epochs
Finish Trainingstep 3 of 3 with lr=7.641892033935078e-05 and 10000 epochs
2025-05-29_08-24-51
[I 2025-05-29 08:24:51,539] Trial 32 finished with value: 0.0011926045408472419 and parameters: {'n_layers': 10, 'n_units': 586, 'activation': 'gelu', 'lr': 7.641892033935078e-05, 'optimizer': 'adam', 'batch_size': 1258}. Best is trial 24 with value: 0.0010980810038745403.
Training model with params: layers=12, units=323, activation=sigmoid, optimizer=adam, lr=0.00014706877423306124, batchsize=1429
Finish Trainingstep 1 of 3 with lr=0.00014706877423306124 and 1000 epochs
Finish Trainingstep 2 of 3 with lr=0.00014706877423306124 and 1000 epochs
Finish Trainingstep 3 of 3 with lr=0.00014706877423306124 and 10000 epochs
2025-05-29_09-02-27
[I 2025-05-29 09:02:27,204] Trial 33 finished with value: 0.9981680512428284 and parameters: {'n_layers': 12, 'n_units': 323, 'activation': 'sigmoid', 'lr': 0.00014706877423306124, 'optimizer': 'adam', 'batch_size': 1429}. Best is trial 24 with value: 0.0010980810038745403.
Training model with params: layers=11, units=601, activation=gelu, optimizer=adam, lr=1.6193941288683465e-05, batchsize=1686
Finish Trainingstep 1 of 3 with lr=1.6193941288683465e-05 and 1000 epochs
Finish Trainingstep 2 of 3 with lr=1.6193941288683465e-05 and 1000 epochs
Finish Trainingstep 3 of 3 with lr=1.6193941288683465e-05 and 10000 epochs
2025-05-29_17-53-25
[I 2025-05-29 17:53:25,557] Trial 34 finished with value: 0.0010351293021813035 and parameters: {'n_layers': 11, 'n_units': 601, 'activation': 'gelu', 'lr': 1.6193941288683465e-05, 'optimizer': 'adam', 'batch_size': 1686}. Best is trial 34 with value: 0.0010351293021813035.
Training model with params: layers=11, units=612, activation=gelu, optimizer=adam, lr=1.8458879892285062e-05, batchsize=1698
Finish Trainingstep 1 of 3 with lr=1.8458879892285062e-05 and 1000 epochs
Finish Trainingstep 2 of 3 with lr=1.8458879892285062e-05 and 1000 epochs
Finish Trainingstep 3 of 3 with lr=1.8458879892285062e-05 and 10000 epochs
2025-05-30_02-50-04
[I 2025-05-30 02:50:05,135] Trial 35 finished with value: 0.0010121363447979093 and parameters: {'n_layers': 11, 'n_units': 612, 'activation': 'gelu', 'lr': 1.8458879892285062e-05, 'optimizer': 'adam', 'batch_size': 1698}. Best is trial 35 with value: 0.0010121363447979093.
Training model with params: layers=11, units=466, activation=gelu, optimizer=adam, lr=1.7073845070529437e-05, batchsize=1705
Finish Trainingstep 1 of 3 with lr=1.7073845070529437e-05 and 1000 epochs
Finish Trainingstep 2 of 3 with lr=1.7073845070529437e-05 and 1000 epochs
Finish Trainingstep 3 of 3 with lr=1.7073845070529437e-05 and 10000 epochs
2025-05-30_10-46-57
[I 2025-05-30 10:46:58,172] Trial 36 finished with value: 0.0009797204984351993 and parameters: {'n_layers': 11, 'n_units': 466, 'activation': 'gelu', 'lr': 1.7073845070529437e-05, 'optimizer': 'adam', 'batch_size': 1705}. Best is trial 36 with value: 0.0009797204984351993.
Training model with params: layers=11, units=464, activation=gelu, optimizer=rmsprop, lr=0.002188201262971814, batchsize=1672
Finish Trainingstep 1 of 3 with lr=0.002188201262971814 and 1000 epochs
Finish Trainingstep 2 of 3 with lr=0.002188201262971814 and 1000 epochs
Finish Trainingstep 3 of 3 with lr=0.002188201262971814 and 10000 epochs
2025-05-30_16-25-20
[I 2025-05-30 16:25:20,421] Trial 37 finished with value: 0.0036633326672017574 and parameters: {'n_layers': 11, 'n_units': 464, 'activation': 'gelu', 'lr': 0.002188201262971814, 'optimizer': 'rmsprop', 'batch_size': 1672}. Best is trial 36 with value: 0.0009797204984351993.
Training model with params: layers=11, units=614, activation=gelu, optimizer=adam, lr=1.4745640518831559e-05, batchsize=2001
Finish Trainingstep 1 of 3 with lr=1.4745640518831559e-05 and 1000 epochs
Finish Trainingstep 2 of 3 with lr=1.4745640518831559e-05 and 1000 epochs
Finish Trainingstep 3 of 3 with lr=1.4745640518831559e-05 and 10000 epochs
2025-05-31_03-05-20
[I 2025-05-31 03:05:20,466] Trial 38 finished with value: 0.0011353439185768366 and parameters: {'n_layers': 11, 'n_units': 614, 'activation': 'gelu', 'lr': 1.4745640518831559e-05, 'optimizer': 'adam', 'batch_size': 2001}. Best is trial 36 with value: 0.0009797204984351993.
Training model with params: layers=13, units=376, activation=gelu, optimizer=adam, lr=3.263084666581964e-05, batchsize=1729
Finish Trainingstep 1 of 3 with lr=3.263084666581964e-05 and 1000 epochs
Finish Trainingstep 2 of 3 with lr=3.263084666581964e-05 and 1000 epochs
Finish Trainingstep 3 of 3 with lr=3.263084666581964e-05 and 10000 epochs
2025-05-31_12-05-14
[I 2025-05-31 12:05:14,294] Trial 39 finished with value: 0.0009353283676318824 and parameters: {'n_layers': 13, 'n_units': 376, 'activation': 'gelu', 'lr': 3.263084666581964e-05, 'optimizer': 'adam', 'batch_size': 1729}. Best is trial 39 with value: 0.0009353283676318824.
Training model with params: layers=14, units=369, activation=gelu, optimizer=rmsprop, lr=0.00041338334749477836, batchsize=1769
Finish Trainingstep 1 of 3 with lr=0.00041338334749477836 and 1000 epochs
Finish Trainingstep 2 of 3 with lr=0.00041338334749477836 and 1000 epochs
Finish Trainingstep 3 of 3 with lr=0.00041338334749477836 and 10000 epochs
2025-05-31_18-49-43
[I 2025-05-31 18:49:43,737] Trial 40 finished with value: 0.0018174549331888556 and parameters: {'n_layers': 14, 'n_units': 369, 'activation': 'gelu', 'lr': 0.00041338334749477836, 'optimizer': 'rmsprop', 'batch_size': 1769}. Best is trial 39 with value: 0.0009353283676318824.
Training model with params: layers=13, units=483, activation=gelu, optimizer=adam, lr=3.116652715354908e-05, batchsize=1888
Finish Trainingstep 1 of 3 with lr=3.116652715354908e-05 and 1000 epochs
Finish Trainingstep 2 of 3 with lr=3.116652715354908e-05 and 1000 epochs
Finish Trainingstep 3 of 3 with lr=3.116652715354908e-05 and 10000 epochs
2025-06-01_03-39-51
[I 2025-06-01 03:39:51,397] Trial 41 finished with value: 0.0010012027341872454 and parameters: {'n_layers': 13, 'n_units': 483, 'activation': 'gelu', 'lr': 3.116652715354908e-05, 'optimizer': 'adam', 'batch_size': 1888}. Best is trial 39 with value: 0.0009353283676318824.
Training model with params: layers=13, units=418, activation=gelu, optimizer=adam, lr=2.8009994342270115e-05, batchsize=1886
Finish Trainingstep 1 of 3 with lr=2.8009994342270115e-05 and 1000 epochs
Finish Trainingstep 2 of 3 with lr=2.8009994342270115e-05 and 1000 epochs
Finish Trainingstep 3 of 3 with lr=2.8009994342270115e-05 and 10000 epochs
2025-06-01_13-20-21
[I 2025-06-01 13:20:21,882] Trial 42 finished with value: 0.001152738812379539 and parameters: {'n_layers': 13, 'n_units': 418, 'activation': 'gelu', 'lr': 2.8009994342270115e-05, 'optimizer': 'adam', 'batch_size': 1886}. Best is trial 39 with value: 0.0009353283676318824.
Training model with params: layers=13, units=490, activation=gelu, optimizer=adam, lr=3.305284877794322e-05, batchsize=1681
Finish Trainingstep 1 of 3 with lr=3.305284877794322e-05 and 1000 epochs
Finish Trainingstep 2 of 3 with lr=3.305284877794322e-05 and 1000 epochs
Finish Trainingstep 3 of 3 with lr=3.305284877794322e-05 and 10000 epochs
2025-06-02_01-25-01
[I 2025-06-02 01:25:01,936] Trial 43 finished with value: 0.001043738448061049 and parameters: {'n_layers': 13, 'n_units': 490, 'activation': 'gelu', 'lr': 3.305284877794322e-05, 'optimizer': 'adam', 'batch_size': 1681}. Best is trial 39 with value: 0.0009353283676318824.
Training model with params: layers=15, units=675, activation=tanh, optimizer=adam, lr=1.0110405896424886e-05, batchsize=1856
Finish Trainingstep 1 of 3 with lr=1.0110405896424886e-05 and 1000 epochs
Finish Trainingstep 2 of 3 with lr=1.0110405896424886e-05 and 1000 epochs
