[I 2025-05-27 02:10:41,062] Trial 28 finished with value: 0.0019826197531074286 and parameters: {'n_layers': 13, 'n_units': 790, 'activation': 'tanh', 'lr': 1.0152523010039794e-05, 'optimizer': 'adam', 'batch_size': 2026}. Best is trial 27 with value: 0.0009771148907020688.
Training model with params: layers=10, units=782, activation=elu, optimizer=rmsprop, lr=3.0593898154742735e-05, batchsize=1797
Finish Trainingstep 1 of 3 with lr=3.0593898154742735e-05 and 1000 epochs
Finish Trainingstep 2 of 3 with lr=3.0593898154742735e-05 and 1000 epochs
Finish Trainingstep 3 of 3 with lr=3.0593898154742735e-05 and 10000 epochs
2025-05-27_07-27-02
[I 2025-05-27 07:27:02,788] Trial 29 finished with value: 0.002340027131140232 and parameters: {'n_layers': 10, 'n_units': 782, 'activation': 'elu', 'lr': 3.0593898154742735e-05, 'optimizer': 'rmsprop', 'batch_size': 1797}. Best is trial 27 with value: 0.0009771148907020688.
Training model with params: layers=13, units=614, activation=relu, optimizer=RAdam, lr=5.3590750016719385e-05, batchsize=1815
Finish Trainingstep 1 of 3 with lr=5.3590750016719385e-05 and 1000 epochs
Finish Trainingstep 2 of 3 with lr=5.3590750016719385e-05 and 1000 epochs
Finish Trainingstep 3 of 3 with lr=5.3590750016719385e-05 and 10000 epochs
2025-05-27_11-14-32
[I 2025-05-27 11:14:32,428] Trial 30 finished with value: 0.0090465834364295 and parameters: {'n_layers': 13, 'n_units': 614, 'activation': 'relu', 'lr': 5.3590750016719385e-05, 'optimizer': 'RAdam', 'batch_size': 1815}. Best is trial 27 with value: 0.0009771148907020688.
Training model with params: layers=15, units=734, activation=swish, optimizer=RAdam, lr=2.072073848886234e-05, batchsize=1742
Finish Trainingstep 1 of 3 with lr=2.072073848886234e-05 and 1000 epochs
Finish Trainingstep 2 of 3 with lr=2.072073848886234e-05 and 1000 epochs
Finish Trainingstep 3 of 3 with lr=2.072073848886234e-05 and 10000 epochs
2025-05-27_16-10-37
[I 2025-05-27 16:10:37,851] Trial 31 finished with value: 0.0011590698268264532 and parameters: {'n_layers': 15, 'n_units': 734, 'activation': 'swish', 'lr': 2.072073848886234e-05, 'optimizer': 'RAdam', 'batch_size': 1742}. Best is trial 27 with value: 0.0009771148907020688.
Training model with params: layers=15, units=848, activation=swish, optimizer=RAdam, lr=2.1256477592283705e-05, batchsize=1800
Finish Trainingstep 1 of 3 with lr=2.1256477592283705e-05 and 1000 epochs
Finish Trainingstep 2 of 3 with lr=2.1256477592283705e-05 and 1000 epochs
Finish Trainingstep 3 of 3 with lr=2.1256477592283705e-05 and 10000 epochs
2025-05-27_21-59-41
[I 2025-05-27 21:59:41,391] Trial 32 finished with value: 0.0011730572441592813 and parameters: {'n_layers': 15, 'n_units': 848, 'activation': 'swish', 'lr': 2.1256477592283705e-05, 'optimizer': 'RAdam', 'batch_size': 1800}. Best is trial 27 with value: 0.0009771148907020688.
Training model with params: layers=15, units=866, activation=swish, optimizer=RAdam, lr=2.0358875157232128e-05, batchsize=1775
Finish Trainingstep 1 of 3 with lr=2.0358875157232128e-05 and 1000 epochs
Finish Trainingstep 2 of 3 with lr=2.0358875157232128e-05 and 1000 epochs
Finish Trainingstep 3 of 3 with lr=2.0358875157232128e-05 and 10000 epochs
2025-05-28_02-42-09
[I 2025-05-28 02:42:09,262] Trial 33 finished with value: 0.0012041357113048434 and parameters: {'n_layers': 15, 'n_units': 866, 'activation': 'swish', 'lr': 2.0358875157232128e-05, 'optimizer': 'RAdam', 'batch_size': 1775}. Best is trial 27 with value: 0.0009771148907020688.
Training model with params: layers=15, units=720, activation=swish, optimizer=RAdam, lr=1.6479420298318924e-05, batchsize=1638
Finish Trainingstep 1 of 3 with lr=1.6479420298318924e-05 and 1000 epochs
Finish Trainingstep 2 of 3 with lr=1.6479420298318924e-05 and 1000 epochs
Finish Trainingstep 3 of 3 with lr=1.6479420298318924e-05 and 10000 epochs
2025-05-28_10-27-09
[I 2025-05-28 10:27:09,659] Trial 34 finished with value: 0.001162113156169653 and parameters: {'n_layers': 15, 'n_units': 720, 'activation': 'swish', 'lr': 1.6479420298318924e-05, 'optimizer': 'RAdam', 'batch_size': 1638}. Best is trial 27 with value: 0.0009771148907020688.
Training model with params: layers=13, units=729, activation=leaky_relu, optimizer=RAdam, lr=3.72429406075748e-05, batchsize=1640
Finish Trainingstep 1 of 3 with lr=3.72429406075748e-05 and 1000 epochs
Finish Trainingstep 2 of 3 with lr=3.72429406075748e-05 and 1000 epochs
Finish Trainingstep 3 of 3 with lr=3.72429406075748e-05 and 10000 epochs
2025-05-28_17-33-48
[I 2025-05-28 17:33:49,488] Trial 35 finished with value: 0.006696803495287895 and parameters: {'n_layers': 13, 'n_units': 729, 'activation': 'leaky_relu', 'lr': 3.72429406075748e-05, 'optimizer': 'RAdam', 'batch_size': 1640}. Best is trial 27 with value: 0.0009771148907020688.
Training model with params: layers=11, units=725, activation=gelu, optimizer=RAdam, lr=1.4787173544178756e-05, batchsize=1408
Finish Trainingstep 1 of 3 with lr=1.4787173544178756e-05 and 1000 epochs
Finish Trainingstep 2 of 3 with lr=1.4787173544178756e-05 and 1000 epochs
Finish Trainingstep 3 of 3 with lr=1.4787173544178756e-05 and 10000 epochs
2025-05-29_02-05-26
[I 2025-05-29 02:05:26,200] Trial 36 finished with value: 0.0010755208786576986 and parameters: {'n_layers': 11, 'n_units': 725, 'activation': 'gelu', 'lr': 1.4787173544178756e-05, 'optimizer': 'RAdam', 'batch_size': 1408}. Best is trial 27 with value: 0.0009771148907020688.
Training model with params: layers=11, units=955, activation=gelu, optimizer=adam, lr=1.4857196308294985e-05, batchsize=1438
Finish Trainingstep 1 of 3 with lr=1.4857196308294985e-05 and 1000 epochs
Finish Trainingstep 2 of 3 with lr=1.4857196308294985e-05 and 1000 epochs
Finish Trainingstep 3 of 3 with lr=1.4857196308294985e-05 and 10000 epochs
2025-05-29_10-45-43
[I 2025-05-29 10:45:43,853] Trial 37 finished with value: 0.0010891440324485302 and parameters: {'n_layers': 11, 'n_units': 955, 'activation': 'gelu', 'lr': 1.4857196308294985e-05, 'optimizer': 'adam', 'batch_size': 1438}. Best is trial 27 with value: 0.0009771148907020688.
Training model with params: layers=11, units=1020, activation=gelu, optimizer=adam, lr=1.3416869474237898e-05, batchsize=1418
Finish Trainingstep 1 of 3 with lr=1.3416869474237898e-05 and 1000 epochs
Finish Trainingstep 2 of 3 with lr=1.3416869474237898e-05 and 1000 epochs
Finish Trainingstep 3 of 3 with lr=1.3416869474237898e-05 and 10000 epochs
2025-05-29_21-02-34
[I 2025-05-29 21:02:35,276] Trial 38 finished with value: 0.000979508738964796 and parameters: {'n_layers': 11, 'n_units': 1020, 'activation': 'gelu', 'lr': 1.3416869474237898e-05, 'optimizer': 'adam', 'batch_size': 1418}. Best is trial 27 with value: 0.0009771148907020688.
Training model with params: layers=9, units=984, activation=gelu, optimizer=adam, lr=7.423447418072644e-05, batchsize=1903
Finish Trainingstep 1 of 3 with lr=7.423447418072644e-05 and 1000 epochs
Finish Trainingstep 2 of 3 with lr=7.423447418072644e-05 and 1000 epochs
Finish Trainingstep 3 of 3 with lr=7.423447418072644e-05 and 10000 epochs
2025-05-30_01-12-12
[I 2025-05-30 01:12:13,476] Trial 39 finished with value: 0.0012852275976911187 and parameters: {'n_layers': 9, 'n_units': 984, 'activation': 'gelu', 'lr': 7.423447418072644e-05, 'optimizer': 'adam', 'batch_size': 1903}. Best is trial 27 with value: 0.0009771148907020688.
Training model with params: layers=8, units=1019, activation=gelu, optimizer=adam, lr=5.0270632553503695e-05, batchsize=1374
Finish Trainingstep 1 of 3 with lr=5.0270632553503695e-05 and 1000 epochs
Finish Trainingstep 2 of 3 with lr=5.0270632553503695e-05 and 1000 epochs
Finish Trainingstep 3 of 3 with lr=5.0270632553503695e-05 and 10000 epochs
2025-05-30_05-56-11
[I 2025-05-30 05:56:12,093] Trial 40 finished with value: 0.0012632178841158748 and parameters: {'n_layers': 8, 'n_units': 1019, 'activation': 'gelu', 'lr': 5.0270632553503695e-05, 'optimizer': 'adam', 'batch_size': 1374}. Best is trial 27 with value: 0.0009771148907020688.
Training model with params: layers=11, units=909, activation=gelu, optimizer=adam, lr=1.3927398431657905e-05, batchsize=1485
Finish Trainingstep 1 of 3 with lr=1.3927398431657905e-05 and 1000 epochs
Finish Trainingstep 2 of 3 with lr=1.3927398431657905e-05 and 1000 epochs
Finish Trainingstep 3 of 3 with lr=1.3927398431657905e-05 and 10000 epochs
2025-05-30_15-55-04
[I 2025-05-30 15:55:05,360] Trial 41 finished with value: 0.0009998504538089037 and parameters: {'n_layers': 11, 'n_units': 909, 'activation': 'gelu', 'lr': 1.3927398431657905e-05, 'optimizer': 'adam', 'batch_size': 1485}. Best is trial 27 with value: 0.0009771148907020688.
Training model with params: layers=10, units=921, activation=gelu, optimizer=adam, lr=1.0227977219038117e-05, batchsize=1518
Finish Trainingstep 1 of 3 with lr=1.0227977219038117e-05 and 1000 epochs
Finish Trainingstep 2 of 3 with lr=1.0227977219038117e-05 and 1000 epochs
Finish Trainingstep 3 of 3 with lr=1.0227977219038117e-05 and 10000 epochs
2025-05-30_23-28-15
[I 2025-05-30 23:28:15,862] Trial 42 finished with value: 0.0012475807452574372 and parameters: {'n_layers': 10, 'n_units': 921, 'activation': 'gelu', 'lr': 1.0227977219038117e-05, 'optimizer': 'adam', 'batch_size': 1518}. Best is trial 27 with value: 0.0009771148907020688.
Training model with params: layers=12, units=849, activation=gelu, optimizer=adam, lr=3.168646055571005e-05, batchsize=1580
Finish Trainingstep 1 of 3 with lr=3.168646055571005e-05 and 1000 epochs
Finish Trainingstep 2 of 3 with lr=3.168646055571005e-05 and 1000 epochs
Finish Trainingstep 3 of 3 with lr=3.168646055571005e-05 and 10000 epochs
2025-05-31_07-41-30
[I 2025-05-31 07:41:31,366] Trial 43 finished with value: 0.0011189362267032266 and parameters: {'n_layers': 12, 'n_units': 849, 'activation': 'gelu', 'lr': 3.168646055571005e-05, 'optimizer': 'adam', 'batch_size': 1580}. Best is trial 27 with value: 0.0009771148907020688.
Training model with params: layers=11, units=911, activation=gelu, optimizer=adam, lr=1.3935858130858362e-05, batchsize=1907
Finish Trainingstep 1 of 3 with lr=1.3935858130858362e-05 and 1000 epochs
Finish Trainingstep 2 of 3 with lr=1.3935858130858362e-05 and 1000 epochs
Finish Trainingstep 3 of 3 with lr=1.3935858130858362e-05 and 10000 epochs
2025-05-31_13-13-14
[I 2025-05-31 13:13:15,130] Trial 44 finished with value: 0.0011354616144672036 and parameters: {'n_layers': 11, 'n_units': 911, 'activation': 'gelu', 'lr': 1.3935858130858362e-05, 'optimizer': 'adam', 'batch_size': 1907}. Best is trial 27 with value: 0.0009771148907020688.
Training model with params: layers=10, units=812, activation=gelu, optimizer=adam, lr=2.8645209217508943e-05, batchsize=1357
Finish Trainingstep 1 of 3 with lr=2.8645209217508943e-05 and 1000 epochs
Finish Trainingstep 2 of 3 with lr=2.8645209217508943e-05 and 1000 epochs
Finish Trainingstep 3 of 3 with lr=2.8645209217508943e-05 and 10000 epochs
2025-05-31_23-10-46
[I 2025-05-31 23:10:47,250] Trial 45 finished with value: 0.0010885146912187338 and parameters: {'n_layers': 10, 'n_units': 812, 'activation': 'gelu', 'lr': 2.8645209217508943e-05, 'optimizer': 'adam', 'batch_size': 1357}. Best is trial 27 with value: 0.0009771148907020688.
Training model with params: layers=8, units=959, activation=selu, optimizer=adam, lr=4.387578439278078e-05, batchsize=1712
Finish Trainingstep 1 of 3 with lr=4.387578439278078e-05 and 1000 epochs
Finish Trainingstep 2 of 3 with lr=4.387578439278078e-05 and 1000 epochs
Finish Trainingstep 3 of 3 with lr=4.387578439278078e-05 and 10000 epochs
2025-06-01_03-17-51
[I 2025-06-01 03:17:51,392] Trial 46 finished with value: 0.004585524555295706 and parameters: {'n_layers': 8, 'n_units': 959, 'activation': 'selu', 'lr': 4.387578439278078e-05, 'optimizer': 'adam', 'batch_size': 1712}. Best is trial 27 with value: 0.0009771148907020688.
Training model with params: layers=12, units=626, activation=elu, optimizer=adam, lr=1.735017987885875e-05, batchsize=1932
Finish Trainingstep 1 of 3 with lr=1.735017987885875e-05 and 1000 epochs
Finish Trainingstep 2 of 3 with lr=1.735017987885875e-05 and 1000 epochs
Finish Trainingstep 3 of 3 with lr=1.735017987885875e-05 and 10000 epochs
2025-06-01_08-49-35
[I 2025-06-01 08:49:35,894] Trial 47 finished with value: 0.0020665747579187155 and parameters: {'n_layers': 12, 'n_units': 626, 'activation': 'elu', 'lr': 1.735017987885875e-05, 'optimizer': 'adam', 'batch_size': 1932}. Best is trial 27 with value: 0.0009771148907020688.
Training model with params: layers=9, units=888, activation=sigmoid, optimizer=adam, lr=1.4045439169170919e-05, batchsize=1130
Finish Trainingstep 1 of 3 with lr=1.4045439169170919e-05 and 1000 epochs
Finish Trainingstep 2 of 3 with lr=1.4045439169170919e-05 and 1000 epochs
Finish Trainingstep 3 of 3 with lr=1.4045439169170919e-05 and 10000 epochs
2025-06-01_17-54-19
[I 2025-06-01 17:54:20,217] Trial 48 finished with value: 0.12441010773181915 and parameters: {'n_layers': 9, 'n_units': 888, 'activation': 'sigmoid', 'lr': 1.4045439169170919e-05, 'optimizer': 'adam', 'batch_size': 1130}. Best is trial 27 with value: 0.0009771148907020688.
Training model with params: layers=11, units=750, activation=gelu, optimizer=rmsprop, lr=2.2191619852121875e-05, batchsize=1550
Finish Trainingstep 1 of 3 with lr=2.2191619852121875e-05 and 1000 epochs
Finish Trainingstep 2 of 3 with lr=2.2191619852121875e-05 and 1000 epochs
