[I 2025-05-30 20:16:26,716] Trial 28 finished with value: 0.0017995554953813553 and parameters: {'n_layers': 14, 'n_units': 948, 'activation': 'gelu', 'lr': 0.00019815250329852536, 'optimizer': 'rmsprop', 'batch_size': 882}. Best is trial 15 with value: 0.0008755933959037066.
Training model with params: layers=10, units=928, activation=gelu, optimizer=adam, lr=1.7525061008580633e-05, batchsize=1486
Finish Trainingstep 1 of 3 with lr=1.7525061008580633e-05 and 1000 epochs
Finish Trainingstep 2 of 3 with lr=1.7525061008580633e-05 and 1000 epochs
Finish Trainingstep 3 of 3 with lr=1.7525061008580633e-05 and 10000 epochs
2025-05-31_06-38-12
[I 2025-05-31 06:38:12,960] Trial 29 finished with value: 0.0010390280513092875 and parameters: {'n_layers': 10, 'n_units': 928, 'activation': 'gelu', 'lr': 1.7525061008580633e-05, 'optimizer': 'adam', 'batch_size': 1486}. Best is trial 15 with value: 0.0008755933959037066.
Training model with params: layers=13, units=748, activation=swish, optimizer=adam, lr=2.858067837863024e-05, batchsize=1123
Finish Trainingstep 1 of 3 with lr=2.858067837863024e-05 and 1000 epochs
Finish Trainingstep 2 of 3 with lr=2.858067837863024e-05 and 1000 epochs
Finish Trainingstep 3 of 3 with lr=2.858067837863024e-05 and 10000 epochs
2025-05-31_16-00-15
[I 2025-05-31 16:00:15,628] Trial 30 finished with value: 0.0009728574077598751 and parameters: {'n_layers': 13, 'n_units': 748, 'activation': 'swish', 'lr': 2.858067837863024e-05, 'optimizer': 'adam', 'batch_size': 1123}. Best is trial 15 with value: 0.0008755933959037066.
Training model with params: layers=13, units=679, activation=swish, optimizer=adam, lr=2.80721792374204e-05, batchsize=1111
Finish Trainingstep 1 of 3 with lr=2.80721792374204e-05 and 1000 epochs
Finish Trainingstep 2 of 3 with lr=2.80721792374204e-05 and 1000 epochs
Finish Trainingstep 3 of 3 with lr=2.80721792374204e-05 and 10000 epochs
2025-06-01_01-06-58
[I 2025-06-01 01:06:58,932] Trial 31 finished with value: 0.0009721070528030396 and parameters: {'n_layers': 13, 'n_units': 679, 'activation': 'swish', 'lr': 2.80721792374204e-05, 'optimizer': 'adam', 'batch_size': 1111}. Best is trial 15 with value: 0.0008755933959037066.
Training model with params: layers=13, units=674, activation=swish, optimizer=adam, lr=3.265817791666414e-05, batchsize=1139
Finish Trainingstep 1 of 3 with lr=3.265817791666414e-05 and 1000 epochs
Finish Trainingstep 2 of 3 with lr=3.265817791666414e-05 and 1000 epochs
Finish Trainingstep 3 of 3 with lr=3.265817791666414e-05 and 10000 epochs
2025-06-01_09-57-52
[I 2025-06-01 09:57:53,217] Trial 32 finished with value: 0.0010909296106547117 and parameters: {'n_layers': 13, 'n_units': 674, 'activation': 'swish', 'lr': 3.265817791666414e-05, 'optimizer': 'adam', 'batch_size': 1139}. Best is trial 15 with value: 0.0008755933959037066.
Training model with params: layers=14, units=794, activation=swish, optimizer=adam, lr=2.3327908615397513e-05, batchsize=1272
Finish Trainingstep 1 of 3 with lr=2.3327908615397513e-05 and 1000 epochs
Finish Trainingstep 2 of 3 with lr=2.3327908615397513e-05 and 1000 epochs
Finish Trainingstep 3 of 3 with lr=2.3327908615397513e-05 and 10000 epochs
2025-06-01_19-06-29
[I 2025-06-01 19:06:30,416] Trial 33 finished with value: 0.0010020816698670387 and parameters: {'n_layers': 14, 'n_units': 794, 'activation': 'swish', 'lr': 2.3327908615397513e-05, 'optimizer': 'adam', 'batch_size': 1272}. Best is trial 15 with value: 0.0008755933959037066.
Training model with params: layers=12, units=560, activation=swish, optimizer=adam, lr=4.366544195014426e-05, batchsize=1481
Finish Trainingstep 1 of 3 with lr=4.366544195014426e-05 and 1000 epochs
Finish Trainingstep 2 of 3 with lr=4.366544195014426e-05 and 1000 epochs
Finish Trainingstep 3 of 3 with lr=4.366544195014426e-05 and 10000 epochs
2025-06-02_07-42-03
[I 2025-06-02 07:42:03,872] Trial 34 finished with value: 0.0009603257640264928 and parameters: {'n_layers': 12, 'n_units': 560, 'activation': 'swish', 'lr': 4.366544195014426e-05, 'optimizer': 'adam', 'batch_size': 1481}. Best is trial 15 with value: 0.0008755933959037066.
Training model with params: layers=12, units=541, activation=swish, optimizer=adam, lr=4.9067365949056305e-05, batchsize=1530
Finish Trainingstep 1 of 3 with lr=4.9067365949056305e-05 and 1000 epochs
Finish Trainingstep 2 of 3 with lr=4.9067365949056305e-05 and 1000 epochs
