[I 2025-05-25 03:24:16,153] Trial 63 finished with value: 0.022235505282878876 and parameters: {'n_layers': 4, 'n_units': 34, 'activation': 'swish', 'lr': 0.006551118649749133, 'optimizer': 'sgd', 'batch_size': 1070}. Best is trial 42 with value: 0.0011476419167593122.
Training model with params: layers=6, units=145, activation=swish, optimizer=RAdam, lr=0.00013953460346484387, batchsize=1356
Finish Trainingstep 1 of 3 with lr=0.00013953460346484387 and 1000 epochs
Finish Trainingstep 2 of 3 with lr=0.00013953460346484387 and 1000 epochs
Finish Trainingstep 3 of 3 with lr=0.00013953460346484387 and 10000 epochs
2025-05-25_07-08-15
[I 2025-05-25 07:08:15,239] Trial 64 finished with value: 0.0014106916496530175 and parameters: {'n_layers': 6, 'n_units': 145, 'activation': 'swish', 'lr': 0.00013953460346484387, 'optimizer': 'RAdam', 'batch_size': 1356}. Best is trial 42 with value: 0.0011476419167593122.
Training model with params: layers=5, units=16, activation=gelu, optimizer=adam, lr=0.002405190246000254, batchsize=1123
Finish Trainingstep 1 of 3 with lr=0.002405190246000254 and 1000 epochs
Finish Trainingstep 2 of 3 with lr=0.002405190246000254 and 1000 epochs
Finish Trainingstep 3 of 3 with lr=0.002405190246000254 and 10000 epochs
2025-05-25_08-17-21
[I 2025-05-25 08:17:21,339] Trial 65 finished with value: 0.0023259150329977274 and parameters: {'n_layers': 5, 'n_units': 16, 'activation': 'gelu', 'lr': 0.002405190246000254, 'optimizer': 'adam', 'batch_size': 1123}. Best is trial 42 with value: 0.0011476419167593122.
Training model with params: layers=4, units=54, activation=swish, optimizer=AdamW, lr=0.00047506930568332815, batchsize=1469
Finish Trainingstep 1 of 3 with lr=0.00047506930568332815 and 1000 epochs
Finish Trainingstep 2 of 3 with lr=0.00047506930568332815 and 1000 epochs
Finish Trainingstep 3 of 3 with lr=0.00047506930568332815 and 10000 epochs
2025-05-25_08-36-51
[I 2025-05-25 08:36:51,949] Trial 66 finished with value: 0.006253349594771862 and parameters: {'n_layers': 4, 'n_units': 54, 'activation': 'swish', 'lr': 0.00047506930568332815, 'optimizer': 'AdamW', 'batch_size': 1469}. Best is trial 42 with value: 0.0011476419167593122.
Training model with params: layers=3, units=206, activation=swish, optimizer=RAdam, lr=0.0003003054758176534, batchsize=1277
Finish Trainingstep 1 of 3 with lr=0.0003003054758176534 and 1000 epochs
Finish Trainingstep 2 of 3 with lr=0.0003003054758176534 and 1000 epochs
Finish Trainingstep 3 of 3 with lr=0.0003003054758176534 and 10000 epochs
2025-05-25_11-10-24
[I 2025-05-25 11:10:24,850] Trial 67 finished with value: 0.00149493757635355 and parameters: {'n_layers': 3, 'n_units': 206, 'activation': 'swish', 'lr': 0.0003003054758176534, 'optimizer': 'RAdam', 'batch_size': 1277}. Best is trial 42 with value: 0.0011476419167593122.
Training model with params: layers=9, units=118, activation=swish, optimizer=rmsprop, lr=0.005106339123206108, batchsize=1165
Finish Trainingstep 1 of 3 with lr=0.005106339123206108 and 1000 epochs
Finish Trainingstep 2 of 3 with lr=0.005106339123206108 and 1000 epochs
Finish Trainingstep 3 of 3 with lr=0.005106339123206108 and 10000 epochs
2025-05-25_13-12-20
[I 2025-05-25 13:12:20,159] Trial 68 finished with value: 0.0037009455263614655 and parameters: {'n_layers': 9, 'n_units': 118, 'activation': 'swish', 'lr': 0.005106339123206108, 'optimizer': 'rmsprop', 'batch_size': 1165}. Best is trial 42 with value: 0.0011476419167593122.
Training model with params: layers=4, units=90, activation=selu, optimizer=RAdam, lr=0.0033161263328879177, batchsize=959
Finish Trainingstep 1 of 3 with lr=0.0033161263328879177 and 1000 epochs
Finish Trainingstep 2 of 3 with lr=0.0033161263328879177 and 1000 epochs
Finish Trainingstep 3 of 3 with lr=0.0033161263328879177 and 10000 epochs
2025-05-25_14-04-38
[I 2025-05-25 14:04:38,867] Trial 69 finished with value: 0.0016749730566516519 and parameters: {'n_layers': 4, 'n_units': 90, 'activation': 'selu', 'lr': 0.0033161263328879177, 'optimizer': 'RAdam', 'batch_size': 959}. Best is trial 42 with value: 0.0011476419167593122.
Training model with params: layers=5, units=33, activation=relu, optimizer=RAdam, lr=0.004061823135914453, batchsize=1386
Finish Trainingstep 1 of 3 with lr=0.004061823135914453 and 1000 epochs
Finish Trainingstep 2 of 3 with lr=0.004061823135914453 and 1000 epochs
Finish Trainingstep 3 of 3 with lr=0.004061823135914453 and 10000 epochs
2025-05-25_14-41-14
[I 2025-05-25 14:41:14,934] Trial 70 finished with value: 0.0017627924680709839 and parameters: {'n_layers': 5, 'n_units': 33, 'activation': 'relu', 'lr': 0.004061823135914453, 'optimizer': 'RAdam', 'batch_size': 1386}. Best is trial 42 with value: 0.0011476419167593122.
Training model with params: layers=4, units=90, activation=swish, optimizer=adam, lr=0.00989065357137649, batchsize=916
Finish Trainingstep 1 of 3 with lr=0.00989065357137649 and 1000 epochs
Finish Trainingstep 2 of 3 with lr=0.00989065357137649 and 1000 epochs
Finish Trainingstep 3 of 3 with lr=0.00989065357137649 and 10000 epochs
2025-05-25_15-05-56
[I 2025-05-25 15:05:56,722] Trial 71 finished with value: 0.0015988971572369337 and parameters: {'n_layers': 4, 'n_units': 90, 'activation': 'swish', 'lr': 0.00989065357137649, 'optimizer': 'adam', 'batch_size': 916}. Best is trial 42 with value: 0.0011476419167593122.
Training model with params: layers=4, units=102, activation=swish, optimizer=adam, lr=0.008525956247946644, batchsize=833
Finish Trainingstep 1 of 3 with lr=0.008525956247946644 and 1000 epochs
Finish Trainingstep 2 of 3 with lr=0.008525956247946644 and 1000 epochs
Finish Trainingstep 3 of 3 with lr=0.008525956247946644 and 10000 epochs
2025-05-25_15-29-48
[I 2025-05-25 15:29:48,404] Trial 72 finished with value: 0.0017348236870020628 and parameters: {'n_layers': 4, 'n_units': 102, 'activation': 'swish', 'lr': 0.008525956247946644, 'optimizer': 'adam', 'batch_size': 833}. Best is trial 42 with value: 0.0011476419167593122.
Training model with params: layers=3, units=70, activation=swish, optimizer=adam, lr=0.007169411104718415, batchsize=685
Finish Trainingstep 1 of 3 with lr=0.007169411104718415 and 1000 epochs
Finish Trainingstep 2 of 3 with lr=0.007169411104718415 and 1000 epochs
Finish Trainingstep 3 of 3 with lr=0.007169411104718415 and 10000 epochs
2025-05-25_15-51-19
[I 2025-05-25 15:51:19,422] Trial 73 finished with value: 0.001685686525888741 and parameters: {'n_layers': 3, 'n_units': 70, 'activation': 'swish', 'lr': 0.007169411104718415, 'optimizer': 'adam', 'batch_size': 685}. Best is trial 42 with value: 0.0011476419167593122.
Training model with params: layers=2, units=58, activation=swish, optimizer=adam, lr=0.009391463142047399, batchsize=1060
Finish Trainingstep 1 of 3 with lr=0.009391463142047399 and 1000 epochs
Finish Trainingstep 2 of 3 with lr=0.009391463142047399 and 1000 epochs
Finish Trainingstep 3 of 3 with lr=0.009391463142047399 and 10000 epochs
2025-05-25_16-12-59
[I 2025-05-25 16:12:59,983] Trial 74 finished with value: 0.0017249396769329906 and parameters: {'n_layers': 2, 'n_units': 58, 'activation': 'swish', 'lr': 0.009391463142047399, 'optimizer': 'adam', 'batch_size': 1060}. Best is trial 42 with value: 0.0011476419167593122.
Training model with params: layers=5, units=28, activation=swish, optimizer=adam, lr=0.005699011546502441, batchsize=1199
Finish Trainingstep 1 of 3 with lr=0.005699011546502441 and 1000 epochs
Finish Trainingstep 2 of 3 with lr=0.005699011546502441 and 1000 epochs
Finish Trainingstep 3 of 3 with lr=0.005699011546502441 and 10000 epochs
2025-05-25_16-34-46
[I 2025-05-25 16:34:46,470] Trial 75 finished with value: 0.0010294114472344518 and parameters: {'n_layers': 5, 'n_units': 28, 'activation': 'swish', 'lr': 0.005699011546502441, 'optimizer': 'adam', 'batch_size': 1199}. Best is trial 75 with value: 0.0010294114472344518.
Training model with params: layers=6, units=33, activation=leaky_relu, optimizer=RAdam, lr=0.0006700083359686758, batchsize=1210
Finish Trainingstep 1 of 3 with lr=0.0006700083359686758 and 1000 epochs
Finish Trainingstep 2 of 3 with lr=0.0006700083359686758 and 1000 epochs
Finish Trainingstep 3 of 3 with lr=0.0006700083359686758 and 10000 epochs
2025-05-25_17-23-30
[I 2025-05-25 17:23:30,461] Trial 76 finished with value: 0.0030401975382119417 and parameters: {'n_layers': 6, 'n_units': 33, 'activation': 'leaky_relu', 'lr': 0.0006700083359686758, 'optimizer': 'RAdam', 'batch_size': 1210}. Best is trial 75 with value: 0.0010294114472344518.
Training model with params: layers=5, units=28, activation=tanh, optimizer=adam, lr=0.004775837803798614, batchsize=1248
Finish Trainingstep 1 of 3 with lr=0.004775837803798614 and 1000 epochs
Finish Trainingstep 2 of 3 with lr=0.004775837803798614 and 1000 epochs
Finish Trainingstep 3 of 3 with lr=0.004775837803798614 and 10000 epochs
2025-05-25_17-41-25
[I 2025-05-25 17:41:25,750] Trial 77 finished with value: 0.0012399000115692616 and parameters: {'n_layers': 5, 'n_units': 28, 'activation': 'tanh', 'lr': 0.004775837803798614, 'optimizer': 'adam', 'batch_size': 1248}. Best is trial 75 with value: 0.0010294114472344518.
Training model with params: layers=5, units=50, activation=tanh, optimizer=adam, lr=0.005064000845548888, batchsize=1553
Finish Trainingstep 1 of 3 with lr=0.005064000845548888 and 1000 epochs
Finish Trainingstep 2 of 3 with lr=0.005064000845548888 and 1000 epochs
Finish Trainingstep 3 of 3 with lr=0.005064000845548888 and 10000 epochs
2025-05-25_17-56-25
[I 2025-05-25 17:56:26,038] Trial 78 finished with value: 0.0016852086409926414 and parameters: {'n_layers': 5, 'n_units': 50, 'activation': 'tanh', 'lr': 0.005064000845548888, 'optimizer': 'adam', 'batch_size': 1553}. Best is trial 75 with value: 0.0010294114472344518.
Training model with params: layers=7, units=20, activation=tanh, optimizer=AdamW, lr=0.005927861657255709, batchsize=1275
Finish Trainingstep 1 of 3 with lr=0.005927861657255709 and 1000 epochs
Finish Trainingstep 2 of 3 with lr=0.005927861657255709 and 1000 epochs
Finish Trainingstep 3 of 3 with lr=0.005927861657255709 and 10000 epochs
2025-05-25_18-03-30
[I 2025-05-25 18:03:30,530] Trial 79 finished with value: 0.005166849121451378 and parameters: {'n_layers': 7, 'n_units': 20, 'activation': 'tanh', 'lr': 0.005927861657255709, 'optimizer': 'AdamW', 'batch_size': 1275}. Best is trial 75 with value: 0.0010294114472344518.
Training model with params: layers=6, units=27, activation=tanh, optimizer=sgd, lr=0.004090438419700039, batchsize=1426
Finish Trainingstep 1 of 3 with lr=0.004090438419700039 and 1000 epochs
Finish Trainingstep 2 of 3 with lr=0.004090438419700039 and 1000 epochs
Finish Trainingstep 3 of 3 with lr=0.004090438419700039 and 10000 epochs
2025-05-25_18-53-33
[I 2025-05-25 18:53:34,019] Trial 80 finished with value: 0.043509289622306824 and parameters: {'n_layers': 6, 'n_units': 27, 'activation': 'tanh', 'lr': 0.004090438419700039, 'optimizer': 'sgd', 'batch_size': 1426}. Best is trial 75 with value: 0.0010294114472344518.
Training model with params: layers=5, units=70, activation=tanh, optimizer=adam, lr=0.0067837999537566085, batchsize=1108
Finish Trainingstep 1 of 3 with lr=0.0067837999537566085 and 1000 epochs
Finish Trainingstep 2 of 3 with lr=0.0067837999537566085 and 1000 epochs
Finish Trainingstep 3 of 3 with lr=0.0067837999537566085 and 10000 epochs
2025-05-25_19-14-19
[I 2025-05-25 19:14:19,328] Trial 81 finished with value: 0.0015352849150076509 and parameters: {'n_layers': 5, 'n_units': 70, 'activation': 'tanh', 'lr': 0.0067837999537566085, 'optimizer': 'adam', 'batch_size': 1108}. Best is trial 75 with value: 0.0010294114472344518.
Training model with params: layers=5, units=46, activation=elu, optimizer=adam, lr=0.001112857995030735, batchsize=1184
Finish Trainingstep 1 of 3 with lr=0.001112857995030735 and 1000 epochs
Finish Trainingstep 2 of 3 with lr=0.001112857995030735 and 1000 epochs
Finish Trainingstep 3 of 3 with lr=0.001112857995030735 and 10000 epochs
2025-05-25_19-53-06
[I 2025-05-25 19:53:06,683] Trial 82 finished with value: 0.0012994942953810096 and parameters: {'n_layers': 5, 'n_units': 46, 'activation': 'elu', 'lr': 0.001112857995030735, 'optimizer': 'adam', 'batch_size': 1184}. Best is trial 75 with value: 0.0010294114472344518.
Training model with params: layers=5, units=50, activation=elu, optimizer=adam, lr=0.0014575166800471636, batchsize=1347
Finish Trainingstep 1 of 3 with lr=0.0014575166800471636 and 1000 epochs
Finish Trainingstep 2 of 3 with lr=0.0014575166800471636 and 1000 epochs
Finish Trainingstep 3 of 3 with lr=0.0014575166800471636 and 10000 epochs
2025-05-25_20-45-02
[I 2025-05-25 20:45:02,541] Trial 83 finished with value: 0.0014915146166458726 and parameters: {'n_layers': 5, 'n_units': 50, 'activation': 'elu', 'lr': 0.0014575166800471636, 'optimizer': 'adam', 'batch_size': 1347}. Best is trial 75 with value: 0.0010294114472344518.
Training model with params: layers=5, units=29, activation=elu, optimizer=adam, lr=0.0009893807167801582, batchsize=1189
Finish Trainingstep 1 of 3 with lr=0.0009893807167801582 and 1000 epochs
Finish Trainingstep 2 of 3 with lr=0.0009893807167801582 and 1000 epochs
Finish Trainingstep 3 of 3 with lr=0.0009893807167801582 and 10000 epochs
2025-05-25_21-25-56
[I 2025-05-25 21:25:56,136] Trial 84 finished with value: 0.0015641601057723165 and parameters: {'n_layers': 5, 'n_units': 29, 'activation': 'elu', 'lr': 0.0009893807167801582, 'optimizer': 'adam', 'batch_size': 1189}. Best is trial 75 with value: 0.0010294114472344518.
Training model with params: layers=4, units=61, activation=elu, optimizer=rmsprop, lr=0.002785578161626457, batchsize=1266
Finish Trainingstep 1 of 3 with lr=0.002785578161626457 and 1000 epochs
Finish Trainingstep 2 of 3 with lr=0.002785578161626457 and 1000 epochs
Finish Trainingstep 3 of 3 with lr=0.002785578161626457 and 10000 epochs
2025-05-25_22-28-44
[I 2025-05-25 22:28:44,271] Trial 85 finished with value: 0.0020227255299687386 and parameters: {'n_layers': 4, 'n_units': 61, 'activation': 'elu', 'lr': 0.002785578161626457, 'optimizer': 'rmsprop', 'batch_size': 1266}. Best is trial 75 with value: 0.0010294114472344518.
Training model with params: layers=5, units=77, activation=sigmoid, optimizer=RAdam, lr=0.00748170736435127, batchsize=1037
Finish Trainingstep 1 of 3 with lr=0.00748170736435127 and 1000 epochs
Finish Trainingstep 2 of 3 with lr=0.00748170736435127 and 1000 epochs
Finish Trainingstep 3 of 3 with lr=0.00748170736435127 and 10000 epochs
2025-05-25_23-13-52
[I 2025-05-25 23:13:52,953] Trial 86 finished with value: 0.0011576841352507472 and parameters: {'n_layers': 5, 'n_units': 77, 'activation': 'sigmoid', 'lr': 0.00748170736435127, 'optimizer': 'RAdam', 'batch_size': 1037}. Best is trial 75 with value: 0.0010294114472344518.
Training model with params: layers=6, units=394, activation=sigmoid, optimizer=RAdam, lr=0.005571649829095015, batchsize=1002
Finish Trainingstep 1 of 3 with lr=0.005571649829095015 and 1000 epochs
Finish Trainingstep 2 of 3 with lr=0.005571649829095015 and 1000 epochs
Finish Trainingstep 3 of 3 with lr=0.005571649829095015 and 10000 epochs
2025-05-26_00-27-17
[I 2025-05-26 00:27:17,763] Trial 87 finished with value: 0.0028863619081676006 and parameters: {'n_layers': 6, 'n_units': 394, 'activation': 'sigmoid', 'lr': 0.005571649829095015, 'optimizer': 'RAdam', 'batch_size': 1002}. Best is trial 75 with value: 0.0010294114472344518.
Training model with params: layers=3, units=79, activation=sigmoid, optimizer=RAdam, lr=0.0075366413901107425, batchsize=1030
Finish Trainingstep 1 of 3 with lr=0.0075366413901107425 and 1000 epochs
Finish Trainingstep 2 of 3 with lr=0.0075366413901107425 and 1000 epochs
Finish Trainingstep 3 of 3 with lr=0.0075366413901107425 and 10000 epochs
2025-05-26_00-57-46
[I 2025-05-26 00:57:46,506] Trial 88 finished with value: 0.0015532104298472404 and parameters: {'n_layers': 3, 'n_units': 79, 'activation': 'sigmoid', 'lr': 0.0075366413901107425, 'optimizer': 'RAdam', 'batch_size': 1030}. Best is trial 75 with value: 0.0010294114472344518.
Training model with params: layers=4, units=16, activation=sigmoid, optimizer=RAdam, lr=0.004479886647567007, batchsize=385
Finish Trainingstep 1 of 3 with lr=0.004479886647567007 and 1000 epochs
Finish Trainingstep 2 of 3 with lr=0.004479886647567007 and 1000 epochs
Finish Trainingstep 3 of 3 with lr=0.004479886647567007 and 10000 epochs
2025-05-26_01-51-28
[I 2025-05-26 01:51:28,791] Trial 89 finished with value: 0.002030033618211746 and parameters: {'n_layers': 4, 'n_units': 16, 'activation': 'sigmoid', 'lr': 0.004479886647567007, 'optimizer': 'RAdam', 'batch_size': 385}. Best is trial 75 with value: 0.0010294114472344518.
Training model with params: layers=4, units=40, activation=sigmoid, optimizer=RAdam, lr=0.004851729713363583, batchsize=748
Finish Trainingstep 1 of 3 with lr=0.004851729713363583 and 1000 epochs
Finish Trainingstep 2 of 3 with lr=0.004851729713363583 and 1000 epochs
Finish Trainingstep 3 of 3 with lr=0.004851729713363583 and 10000 epochs
2025-05-26_02-44-57
[I 2025-05-26 02:44:58,011] Trial 90 finished with value: 0.0012803165009245276 and parameters: {'n_layers': 4, 'n_units': 40, 'activation': 'sigmoid', 'lr': 0.004851729713363583, 'optimizer': 'RAdam', 'batch_size': 748}. Best is trial 75 with value: 0.0010294114472344518.
Training model with params: layers=4, units=42, activation=sigmoid, optimizer=RAdam, lr=0.006260866309322735, batchsize=586
Finish Trainingstep 1 of 3 with lr=0.006260866309322735 and 1000 epochs
Finish Trainingstep 2 of 3 with lr=0.006260866309322735 and 1000 epochs
Finish Trainingstep 3 of 3 with lr=0.006260866309322735 and 10000 epochs
2025-05-26_03-14-31
[I 2025-05-26 03:14:31,451] Trial 91 finished with value: 0.001251035020686686 and parameters: {'n_layers': 4, 'n_units': 42, 'activation': 'sigmoid', 'lr': 0.006260866309322735, 'optimizer': 'RAdam', 'batch_size': 586}. Best is trial 75 with value: 0.0010294114472344518.
Training model with params: layers=4, units=40, activation=sigmoid, optimizer=RAdam, lr=0.004820369725663187, batchsize=747
Finish Trainingstep 1 of 3 with lr=0.004820369725663187 and 1000 epochs
Finish Trainingstep 2 of 3 with lr=0.004820369725663187 and 1000 epochs
Finish Trainingstep 3 of 3 with lr=0.004820369725663187 and 10000 epochs
2025-05-26_03-51-50
[I 2025-05-26 03:51:50,160] Trial 92 finished with value: 0.0015130129177123308 and parameters: {'n_layers': 4, 'n_units': 40, 'activation': 'sigmoid', 'lr': 0.004820369725663187, 'optimizer': 'RAdam', 'batch_size': 747}. Best is trial 75 with value: 0.0010294114472344518.
Training model with params: layers=5, units=76, activation=sigmoid, optimizer=RAdam, lr=0.003555354160994381, batchsize=488
Finish Trainingstep 1 of 3 with lr=0.003555354160994381 and 1000 epochs
Finish Trainingstep 2 of 3 with lr=0.003555354160994381 and 1000 epochs
Finish Trainingstep 3 of 3 with lr=0.003555354160994381 and 10000 epochs
2025-05-26_04-36-43
[I 2025-05-26 04:36:43,449] Trial 93 finished with value: 0.001290639629587531 and parameters: {'n_layers': 5, 'n_units': 76, 'activation': 'sigmoid', 'lr': 0.003555354160994381, 'optimizer': 'RAdam', 'batch_size': 488}. Best is trial 75 with value: 0.0010294114472344518.
Training model with params: layers=4, units=60, activation=sigmoid, optimizer=RAdam, lr=0.006104598743963683, batchsize=619
Finish Trainingstep 1 of 3 with lr=0.006104598743963683 and 1000 epochs
Finish Trainingstep 2 of 3 with lr=0.006104598743963683 and 1000 epochs
Finish Trainingstep 3 of 3 with lr=0.006104598743963683 and 10000 epochs
2025-05-26_04-55-30
[I 2025-05-26 04:55:30,394] Trial 94 finished with value: 0.0014514259528368711 and parameters: {'n_layers': 4, 'n_units': 60, 'activation': 'sigmoid', 'lr': 0.006104598743963683, 'optimizer': 'RAdam', 'batch_size': 619}. Best is trial 75 with value: 0.0010294114472344518.
Training model with params: layers=5, units=28, activation=sigmoid, optimizer=RAdam, lr=0.005344300916456615, batchsize=476
Finish Trainingstep 1 of 3 with lr=0.005344300916456615 and 1000 epochs
Finish Trainingstep 2 of 3 with lr=0.005344300916456615 and 1000 epochs
Finish Trainingstep 3 of 3 with lr=0.005344300916456615 and 10000 epochs
2025-05-26_05-47-01
[I 2025-05-26 05:47:01,068] Trial 95 finished with value: 0.000981203280389309 and parameters: {'n_layers': 5, 'n_units': 28, 'activation': 'sigmoid', 'lr': 0.005344300916456615, 'optimizer': 'RAdam', 'batch_size': 476}. Best is trial 95 with value: 0.000981203280389309.
Training model with params: layers=5, units=25, activation=sigmoid, optimizer=RAdam, lr=0.00739574822040766, batchsize=466
Finish Trainingstep 1 of 3 with lr=0.00739574822040766 and 1000 epochs
Finish Trainingstep 2 of 3 with lr=0.00739574822040766 and 1000 epochs
Finish Trainingstep 3 of 3 with lr=0.00739574822040766 and 10000 epochs
2025-05-26_06-44-16
[I 2025-05-26 06:44:16,958] Trial 96 finished with value: 0.0013720394345000386 and parameters: {'n_layers': 5, 'n_units': 25, 'activation': 'sigmoid', 'lr': 0.00739574822040766, 'optimizer': 'RAdam', 'batch_size': 466}. Best is trial 95 with value: 0.000981203280389309.
Training model with params: layers=6, units=52, activation=sigmoid, optimizer=RAdam, lr=0.008582250017360874, batchsize=437
Finish Trainingstep 1 of 3 with lr=0.008582250017360874 and 1000 epochs
Finish Trainingstep 2 of 3 with lr=0.008582250017360874 and 1000 epochs
Finish Trainingstep 3 of 3 with lr=0.008582250017360874 and 10000 epochs
2025-05-26_07-22-16
