nohup: ignoring input
2025-05-20 18:31:00.993133: I tensorflow/core/util/port.cc:110] oneDNN custom operations are on. You may see slightly different numerical results due to floating-point round-off errors from different computation orders. To turn them off, set the environment variable `TF_ENABLE_ONEDNN_OPTS=0`.
2025-05-20 18:31:00.995069: I tensorflow/tsl/cuda/cudart_stub.cc:28] Could not find cuda drivers on your machine, GPU will not be used.
2025-05-20 18:31:01.030579: I tensorflow/tsl/cuda/cudart_stub.cc:28] Could not find cuda drivers on your machine, GPU will not be used.
2025-05-20 18:31:01.031030: I tensorflow/core/platform/cpu_feature_guard.cc:182] This TensorFlow binary is optimized to use available CPU instructions in performance-critical operations.
To enable the following instructions: AVX2 AVX512F AVX512_VNNI AVX512_BF16 FMA, in other operations, rebuild TensorFlow with the appropriate compiler flags.
2025-05-20 18:31:02.532341: W tensorflow/compiler/tf2tensorrt/utils/py_utils.cc:38] TF-TRT Warning: Could not find TensorRT
/home/rhoffmann/.local/lib/python3.10/site-packages/tensorflow_addons/utils/tfa_eol_msg.py:23: UserWarning: 

TensorFlow Addons (TFA) has ended development and introduction of new features.
TFA has entered a minimal maintenance and release mode until a planned end of life in May 2024.
Please modify downstream libraries to take dependencies from other repositories in our TensorFlow community (e.g. Keras, Keras-CV, and Keras-NLP). 

For more information see: https://github.com/tensorflow/addons/issues/2807 

  warnings.warn(
WARNING:tensorflow:From /home/rhoffmann/G3LHalo_python/exampleNotebooks/GMNN_Bayesian_Optimization2.py:53: is_gpu_available (from tensorflow.python.framework.test_util) is deprecated and will be removed in a future version.
Instructions for updating:
Use `tf.config.list_physical_devices('GPU')` instead.
using cpu device 

Number of test samples is 10500, should be 10500
Number of validation samples is 10500, should be 10500
Number of train samples is 49000, should be 49000
/home/rhoffmann/G3LHalo_python/exampleNotebooks/GMNN_Bayesian_Optimization2.py:106: UserWarning: No artists with labels found to put in legend.  Note that artists whose label start with an underscore are ignored when legend() is called with no argument.
  axes.legend()
number of training targets: 49000 . Should be 49000
number of validation targets: 10500 . Should be 10500
number of test targets: 10500 . Should be 10500
Shape of training targets: (3, 49000, 50). Should be (3, 49000, 50)
Shape of testing targets: (3, 10500, 50). Should be (3, 10500, 50)
Shape of validation targets: (3, 10500, 50). Should be (3, 10500, 50)
input min/max: 1.168300956697601e-06 16.999974244680363
number of training features: 49000 . Should be 49000
number of validation features: 10500 . Should be 10500
number of test features: 10500 . Should be 10500
Train Rescaled Shape: (3, 49000, 50)
Test Rescaled Shape: (3, 10500, 50)
Val Rescaled Shape: (3, 10500, 50)
Train Rescaled Shape: (49000, 10)
Test Rescaled Shape: (10500, 10)
Val Rescaled Shape: (10500, 10)
[I 2025-05-20 18:31:22,147] A new study created in memory with name: no-name-1114cf30-7c03-4ff2-9cdf-2291fda38980
Training model with params: layers=3, units=85, activation=tanh, optimizer=rmsprop, lr=0.0003560523064043445, batchsize=662
Finish Trainingstep 1 of 3 with lr=0.0003560523064043445 and 1000 epochs
Finish Trainingstep 2 of 3 with lr=0.0003560523064043445 and 1000 epochs
Finish Trainingstep 3 of 3 with lr=0.0003560523064043445 and 10000 epochs
2025-05-20_19-38-23
[I 2025-05-20 19:38:24,021] Trial 0 finished with value: 0.001975609688088298 and parameters: {'n_layers': 3, 'n_units': 85, 'activation': 'tanh', 'lr': 0.0003560523064043445, 'optimizer': 'rmsprop', 'batch_size': 662}. Best is trial 0 with value: 0.001975609688088298.
Training model with params: layers=2, units=218, activation=gelu, optimizer=AdamW, lr=0.00028175466976637403, batchsize=512
Finish Trainingstep 1 of 3 with lr=0.00028175466976637403 and 1000 epochs
Finish Trainingstep 2 of 3 with lr=0.00028175466976637403 and 1000 epochs
Finish Trainingstep 3 of 3 with lr=0.00028175466976637403 and 10000 epochs
2025-05-20_20-09-01
[I 2025-05-20 20:09:01,352] Trial 1 finished with value: 0.010623295791447163 and parameters: {'n_layers': 2, 'n_units': 218, 'activation': 'gelu', 'lr': 0.00028175466976637403, 'optimizer': 'AdamW', 'batch_size': 512}. Best is trial 0 with value: 0.001975609688088298.
Training model with params: layers=1, units=251, activation=relu, optimizer=adam, lr=0.0019223429928831369, batchsize=107
Finish Trainingstep 1 of 3 with lr=0.0019223429928831369 and 1000 epochs
Finish Trainingstep 2 of 3 with lr=0.0019223429928831369 and 1000 epochs
Finish Trainingstep 3 of 3 with lr=0.0019223429928831369 and 10000 epochs
2025-05-20_21-26-57
[I 2025-05-20 21:26:57,212] Trial 2 finished with value: 0.0016428533708676696 and parameters: {'n_layers': 1, 'n_units': 251, 'activation': 'relu', 'lr': 0.0019223429928831369, 'optimizer': 'adam', 'batch_size': 107}. Best is trial 2 with value: 0.0016428533708676696.
Training model with params: layers=3, units=216, activation=relu, optimizer=sgd, lr=0.001365479480078324, batchsize=1457
Finish Trainingstep 1 of 3 with lr=0.001365479480078324 and 1000 epochs
Finish Trainingstep 2 of 3 with lr=0.001365479480078324 and 1000 epochs
Finish Trainingstep 3 of 3 with lr=0.001365479480078324 and 10000 epochs
2025-05-20_23-00-48
[I 2025-05-20 23:00:48,276] Trial 3 finished with value: 0.062003277242183685 and parameters: {'n_layers': 3, 'n_units': 216, 'activation': 'relu', 'lr': 0.001365479480078324, 'optimizer': 'sgd', 'batch_size': 1457}. Best is trial 2 with value: 0.0016428533708676696.
Training model with params: layers=9, units=215, activation=tanh, optimizer=rmsprop, lr=0.0002924716447158109, batchsize=1266
Finish Trainingstep 1 of 3 with lr=0.0002924716447158109 and 1000 epochs
Finish Trainingstep 2 of 3 with lr=0.0002924716447158109 and 1000 epochs
Finish Trainingstep 3 of 3 with lr=0.0002924716447158109 and 10000 epochs
2025-05-21_01-59-52
[I 2025-05-21 01:59:52,249] Trial 4 finished with value: 0.001959550194442272 and parameters: {'n_layers': 9, 'n_units': 215, 'activation': 'tanh', 'lr': 0.0002924716447158109, 'optimizer': 'rmsprop', 'batch_size': 1266}. Best is trial 2 with value: 0.0016428533708676696.
Training model with params: layers=9, units=264, activation=selu, optimizer=adam, lr=0.000798775547912165, batchsize=1941
Finish Trainingstep 1 of 3 with lr=0.000798775547912165 and 1000 epochs
Finish Trainingstep 2 of 3 with lr=0.000798775547912165 and 1000 epochs
Finish Trainingstep 3 of 3 with lr=0.000798775547912165 and 10000 epochs
2025-05-21_03-31-37
[I 2025-05-21 03:31:37,731] Trial 5 finished with value: 0.003360580885782838 and parameters: {'n_layers': 9, 'n_units': 264, 'activation': 'selu', 'lr': 0.000798775547912165, 'optimizer': 'adam', 'batch_size': 1941}. Best is trial 2 with value: 0.0016428533708676696.
Training model with params: layers=10, units=337, activation=relu, optimizer=rmsprop, lr=0.004466642100646829, batchsize=1878
Finish Trainingstep 1 of 3 with lr=0.004466642100646829 and 1000 epochs
Finish Trainingstep 2 of 3 with lr=0.004466642100646829 and 1000 epochs
Finish Trainingstep 3 of 3 with lr=0.004466642100646829 and 10000 epochs
2025-05-21_07-07-38
[I 2025-05-21 07:07:39,037] Trial 6 finished with value: 0.008149458095431328 and parameters: {'n_layers': 10, 'n_units': 337, 'activation': 'relu', 'lr': 0.004466642100646829, 'optimizer': 'rmsprop', 'batch_size': 1878}. Best is trial 2 with value: 0.0016428533708676696.
Training model with params: layers=7, units=507, activation=leaky_relu, optimizer=rmsprop, lr=0.00011809763997983172, batchsize=1747
Finish Trainingstep 1 of 3 with lr=0.00011809763997983172 and 1000 epochs
Finish Trainingstep 2 of 3 with lr=0.00011809763997983172 and 1000 epochs
Finish Trainingstep 3 of 3 with lr=0.00011809763997983172 and 10000 epochs
2025-05-21_10-35-23
[I 2025-05-21 10:35:23,141] Trial 7 finished with value: 0.005699309054762125 and parameters: {'n_layers': 7, 'n_units': 507, 'activation': 'leaky_relu', 'lr': 0.00011809763997983172, 'optimizer': 'rmsprop', 'batch_size': 1747}. Best is trial 2 with value: 0.0016428533708676696.
Training model with params: layers=7, units=352, activation=relu, optimizer=rmsprop, lr=0.002521587633955412, batchsize=996
Finish Trainingstep 1 of 3 with lr=0.002521587633955412 and 1000 epochs
Finish Trainingstep 2 of 3 with lr=0.002521587633955412 and 1000 epochs
Finish Trainingstep 3 of 3 with lr=0.002521587633955412 and 10000 epochs
2025-05-21_15-54-36
[I 2025-05-21 15:54:37,076] Trial 8 finished with value: 0.007652456406503916 and parameters: {'n_layers': 7, 'n_units': 352, 'activation': 'relu', 'lr': 0.002521587633955412, 'optimizer': 'rmsprop', 'batch_size': 996}. Best is trial 2 with value: 0.0016428533708676696.
Training model with params: layers=5, units=337, activation=gelu, optimizer=sgd, lr=0.009011624405493569, batchsize=1779
Finish Trainingstep 1 of 3 with lr=0.009011624405493569 and 1000 epochs
Finish Trainingstep 2 of 3 with lr=0.009011624405493569 and 1000 epochs
Finish Trainingstep 3 of 3 with lr=0.009011624405493569 and 10000 epochs
2025-05-21_21-02-32
[I 2025-05-21 21:02:32,633] Trial 9 finished with value: 0.01818436197936535 and parameters: {'n_layers': 5, 'n_units': 337, 'activation': 'gelu', 'lr': 0.009011624405493569, 'optimizer': 'sgd', 'batch_size': 1779}. Best is trial 2 with value: 0.0016428533708676696.
Training model with params: layers=1, units=38, activation=sigmoid, optimizer=adam, lr=0.0010905361066279214, batchsize=28
Finish Trainingstep 1 of 3 with lr=0.0010905361066279214 and 1000 epochs
Finish Trainingstep 2 of 3 with lr=0.0010905361066279214 and 1000 epochs
Finish Trainingstep 3 of 3 with lr=0.0010905361066279214 and 10000 epochs
2025-05-22_03-47-21
[I 2025-05-22 03:47:21,121] Trial 10 finished with value: 0.006570869125425816 and parameters: {'n_layers': 1, 'n_units': 38, 'activation': 'sigmoid', 'lr': 0.0010905361066279214, 'optimizer': 'adam', 'batch_size': 28}. Best is trial 2 with value: 0.0016428533708676696.
Training model with params: layers=5, units=136, activation=swish, optimizer=adam, lr=0.00040637340495871843, batchsize=1220
Finish Trainingstep 1 of 3 with lr=0.00040637340495871843 and 1000 epochs
Finish Trainingstep 2 of 3 with lr=0.00040637340495871843 and 1000 epochs
Finish Trainingstep 3 of 3 with lr=0.00040637340495871843 and 10000 epochs
2025-05-22_06-03-48
[I 2025-05-22 06:03:48,514] Trial 11 finished with value: 0.0013333633542060852 and parameters: {'n_layers': 5, 'n_units': 136, 'activation': 'swish', 'lr': 0.00040637340495871843, 'optimizer': 'adam', 'batch_size': 1220}. Best is trial 11 with value: 0.0013333633542060852.
Training model with params: layers=5, units=126, activation=swish, optimizer=RAdam, lr=0.0005665761937940355, batchsize=24
Finish Trainingstep 1 of 3 with lr=0.0005665761937940355 and 1000 epochs
Finish Trainingstep 2 of 3 with lr=0.0005665761937940355 and 1000 epochs
Finish Trainingstep 3 of 3 with lr=0.0005665761937940355 and 10000 epochs
2025-05-22_13-36-59
[I 2025-05-22 13:36:59,346] Trial 12 finished with value: 0.002218568464741111 and parameters: {'n_layers': 5, 'n_units': 126, 'activation': 'swish', 'lr': 0.0005665761937940355, 'optimizer': 'RAdam', 'batch_size': 24}. Best is trial 11 with value: 0.0013333633542060852.
Training model with params: layers=4, units=131, activation=swish, optimizer=adam, lr=0.001986589617856059, batchsize=902
Finish Trainingstep 1 of 3 with lr=0.001986589617856059 and 1000 epochs
Finish Trainingstep 2 of 3 with lr=0.001986589617856059 and 1000 epochs
Finish Trainingstep 3 of 3 with lr=0.001986589617856059 and 10000 epochs
2025-05-22_14-37-44
[I 2025-05-22 14:37:45,232] Trial 13 finished with value: 0.0014584253076463938 and parameters: {'n_layers': 4, 'n_units': 131, 'activation': 'swish', 'lr': 0.001986589617856059, 'optimizer': 'adam', 'batch_size': 902}. Best is trial 11 with value: 0.0013333633542060852.
Training model with params: layers=4, units=139, activation=swish, optimizer=adam, lr=0.003565686564261716, batchsize=859
Finish Trainingstep 1 of 3 with lr=0.003565686564261716 and 1000 epochs
Finish Trainingstep 2 of 3 with lr=0.003565686564261716 and 1000 epochs
Finish Trainingstep 3 of 3 with lr=0.003565686564261716 and 10000 epochs
2025-05-22_15-35-44
[I 2025-05-22 15:35:44,740] Trial 14 finished with value: 0.0015769503079354763 and parameters: {'n_layers': 4, 'n_units': 139, 'activation': 'swish', 'lr': 0.003565686564261716, 'optimizer': 'adam', 'batch_size': 859}. Best is trial 11 with value: 0.0013333633542060852.
Training model with params: layers=7, units=31, activation=elu, optimizer=adam, lr=0.00011366312061549257, batchsize=1324
Finish Trainingstep 1 of 3 with lr=0.00011366312061549257 and 1000 epochs
Finish Trainingstep 2 of 3 with lr=0.00011366312061549257 and 1000 epochs
Finish Trainingstep 3 of 3 with lr=0.00011366312061549257 and 10000 epochs
2025-05-22_16-40-35
[I 2025-05-22 16:40:35,610] Trial 15 finished with value: 0.002961971564218402 and parameters: {'n_layers': 7, 'n_units': 31, 'activation': 'elu', 'lr': 0.00011366312061549257, 'optimizer': 'adam', 'batch_size': 1324}. Best is trial 11 with value: 0.0013333633542060852.
Training model with params: layers=6, units=152, activation=swish, optimizer=AdamW, lr=0.00056212915017935, batchsize=428
Finish Trainingstep 1 of 3 with lr=0.00056212915017935 and 1000 epochs
Finish Trainingstep 2 of 3 with lr=0.00056212915017935 and 1000 epochs
Finish Trainingstep 3 of 3 with lr=0.00056212915017935 and 10000 epochs
2025-05-22_17-42-03
[I 2025-05-22 17:42:03,343] Trial 16 finished with value: 0.005406573414802551 and parameters: {'n_layers': 6, 'n_units': 152, 'activation': 'swish', 'lr': 0.00056212915017935, 'optimizer': 'AdamW', 'batch_size': 428}. Best is trial 11 with value: 0.0013333633542060852.
Training model with params: layers=4, units=90, activation=swish, optimizer=RAdam, lr=0.0070000282097136485, batchsize=1132
Finish Trainingstep 1 of 3 with lr=0.0070000282097136485 and 1000 epochs
Finish Trainingstep 2 of 3 with lr=0.0070000282097136485 and 1000 epochs
Finish Trainingstep 3 of 3 with lr=0.0070000282097136485 and 10000 epochs
2025-05-22_18-31-29
[I 2025-05-22 18:31:30,002] Trial 17 finished with value: 0.0014411781448870897 and parameters: {'n_layers': 4, 'n_units': 90, 'activation': 'swish', 'lr': 0.0070000282097136485, 'optimizer': 'RAdam', 'batch_size': 1132}. Best is trial 11 with value: 0.0013333633542060852.
Training model with params: layers=6, units=77, activation=swish, optimizer=RAdam, lr=0.009363068077032882, batchsize=1514
Finish Trainingstep 1 of 3 with lr=0.009363068077032882 and 1000 epochs
Finish Trainingstep 2 of 3 with lr=0.009363068077032882 and 1000 epochs
Finish Trainingstep 3 of 3 with lr=0.009363068077032882 and 10000 epochs
2025-05-22_19-09-10
[I 2025-05-22 19:09:10,463] Trial 18 finished with value: 0.001388242468237877 and parameters: {'n_layers': 6, 'n_units': 77, 'activation': 'swish', 'lr': 0.009363068077032882, 'optimizer': 'RAdam', 'batch_size': 1514}. Best is trial 11 with value: 0.0013333633542060852.
Training model with params: layers=6, units=78, activation=elu, optimizer=RAdam, lr=0.005153768040706117, batchsize=1559
Finish Trainingstep 1 of 3 with lr=0.005153768040706117 and 1000 epochs
Finish Trainingstep 2 of 3 with lr=0.005153768040706117 and 1000 epochs
Finish Trainingstep 3 of 3 with lr=0.005153768040706117 and 10000 epochs
2025-05-22_19-58-06
[I 2025-05-22 19:58:06,972] Trial 19 finished with value: 0.0016613281331956387 and parameters: {'n_layers': 6, 'n_units': 78, 'activation': 'elu', 'lr': 0.005153768040706117, 'optimizer': 'RAdam', 'batch_size': 1559}. Best is trial 11 with value: 0.0013333633542060852.
Training model with params: layers=8, units=168, activation=selu, optimizer=RAdam, lr=0.00019363672877925812, batchsize=1565
Finish Trainingstep 1 of 3 with lr=0.00019363672877925812 and 1000 epochs
Finish Trainingstep 2 of 3 with lr=0.00019363672877925812 and 1000 epochs
Finish Trainingstep 3 of 3 with lr=0.00019363672877925812 and 10000 epochs
2025-05-22_22-43-00
[I 2025-05-22 22:43:00,345] Trial 20 finished with value: 0.003916156478226185 and parameters: {'n_layers': 8, 'n_units': 168, 'activation': 'selu', 'lr': 0.00019363672877925812, 'optimizer': 'RAdam', 'batch_size': 1565}. Best is trial 11 with value: 0.0013333633542060852.
Training model with params: layers=4, units=83, activation=swish, optimizer=RAdam, lr=0.005295790041291668, batchsize=1211
Finish Trainingstep 1 of 3 with lr=0.005295790041291668 and 1000 epochs
Finish Trainingstep 2 of 3 with lr=0.005295790041291668 and 1000 epochs
Finish Trainingstep 3 of 3 with lr=0.005295790041291668 and 10000 epochs
2025-05-22_23-23-21
[I 2025-05-22 23:23:21,673] Trial 21 finished with value: 0.0013656399678438902 and parameters: {'n_layers': 4, 'n_units': 83, 'activation': 'swish', 'lr': 0.005295790041291668, 'optimizer': 'RAdam', 'batch_size': 1211}. Best is trial 11 with value: 0.0013333633542060852.
Training model with params: layers=5, units=37, activation=swish, optimizer=RAdam, lr=0.009754848154114168, batchsize=1211
Finish Trainingstep 1 of 3 with lr=0.009754848154114168 and 1000 epochs
Finish Trainingstep 2 of 3 with lr=0.009754848154114168 and 1000 epochs
Finish Trainingstep 3 of 3 with lr=0.009754848154114168 and 10000 epochs
2025-05-22_23-59-10
[I 2025-05-22 23:59:10,471] Trial 22 finished with value: 0.00121851428411901 and parameters: {'n_layers': 5, 'n_units': 37, 'activation': 'swish', 'lr': 0.009754848154114168, 'optimizer': 'RAdam', 'batch_size': 1211}. Best is trial 22 with value: 0.00121851428411901.
Training model with params: layers=3, units=23, activation=swish, optimizer=RAdam, lr=0.006412158373699135, batchsize=1138
Finish Trainingstep 1 of 3 with lr=0.006412158373699135 and 1000 epochs
Finish Trainingstep 2 of 3 with lr=0.006412158373699135 and 1000 epochs
Finish Trainingstep 3 of 3 with lr=0.006412158373699135 and 10000 epochs
2025-05-23_00-59-35
[I 2025-05-23 00:59:35,728] Trial 23 finished with value: 0.0012882641749456525 and parameters: {'n_layers': 3, 'n_units': 23, 'activation': 'swish', 'lr': 0.006412158373699135, 'optimizer': 'RAdam', 'batch_size': 1138}. Best is trial 22 with value: 0.00121851428411901.
Training model with params: layers=3, units=33, activation=leaky_relu, optimizer=RAdam, lr=0.002802585997027883, batchsize=749
Finish Trainingstep 1 of 3 with lr=0.002802585997027883 and 1000 epochs
Finish Trainingstep 2 of 3 with lr=0.002802585997027883 and 1000 epochs
Finish Trainingstep 3 of 3 with lr=0.002802585997027883 and 10000 epochs
2025-05-23_01-57-48
[I 2025-05-23 01:57:48,553] Trial 24 finished with value: 0.002212917199358344 and parameters: {'n_layers': 3, 'n_units': 33, 'activation': 'leaky_relu', 'lr': 0.002802585997027883, 'optimizer': 'RAdam', 'batch_size': 749}. Best is trial 22 with value: 0.00121851428411901.
Training model with params: layers=2, units=28, activation=sigmoid, optimizer=RAdam, lr=0.0067887134164715535, batchsize=1063
Finish Trainingstep 1 of 3 with lr=0.0067887134164715535 and 1000 epochs
Finish Trainingstep 2 of 3 with lr=0.0067887134164715535 and 1000 epochs
Finish Trainingstep 3 of 3 with lr=0.0067887134164715535 and 10000 epochs
2025-05-23_02-38-49
[I 2025-05-23 02:38:49,134] Trial 25 finished with value: 0.002292684745043516 and parameters: {'n_layers': 2, 'n_units': 28, 'activation': 'sigmoid', 'lr': 0.0067887134164715535, 'optimizer': 'RAdam', 'batch_size': 1063}. Best is trial 22 with value: 0.00121851428411901.
Training model with params: layers=5, units=182, activation=swish, optimizer=sgd, lr=0.0005278433834929184, batchsize=1349
Finish Trainingstep 1 of 3 with lr=0.0005278433834929184 and 1000 epochs
Finish Trainingstep 2 of 3 with lr=0.0005278433834929184 and 1000 epochs
Finish Trainingstep 3 of 3 with lr=0.0005278433834929184 and 10000 epochs
2025-05-23_06-09-17
[I 2025-05-23 06:09:17,775] Trial 26 finished with value: 0.5686452984809875 and parameters: {'n_layers': 5, 'n_units': 182, 'activation': 'swish', 'lr': 0.0005278433834929184, 'optimizer': 'sgd', 'batch_size': 1349}. Best is trial 22 with value: 0.00121851428411901.
Training model with params: layers=5, units=111, activation=swish, optimizer=AdamW, lr=0.0008607525532730519, batchsize=1020
Finish Trainingstep 1 of 3 with lr=0.0008607525532730519 and 1000 epochs
Finish Trainingstep 2 of 3 with lr=0.0008607525532730519 and 1000 epochs
Finish Trainingstep 3 of 3 with lr=0.0008607525532730519 and 10000 epochs
2025-05-23_06-38-25
[I 2025-05-23 06:38:25,574] Trial 27 finished with value: 0.004115470685064793 and parameters: {'n_layers': 5, 'n_units': 111, 'activation': 'swish', 'lr': 0.0008607525532730519, 'optimizer': 'AdamW', 'batch_size': 1020}. Best is trial 22 with value: 0.00121851428411901.
Training model with params: layers=2, units=16, activation=swish, optimizer=RAdam, lr=0.00017805937115882503, batchsize=1149
Finish Trainingstep 1 of 3 with lr=0.00017805937115882503 and 1000 epochs
Finish Trainingstep 2 of 3 with lr=0.00017805937115882503 and 1000 epochs
Finish Trainingstep 3 of 3 with lr=0.00017805937115882503 and 10000 epochs
2025-05-23_07-32-32
[I 2025-05-23 07:32:32,718] Trial 28 finished with value: 0.0067688459530472755 and parameters: {'n_layers': 2, 'n_units': 16, 'activation': 'swish', 'lr': 0.00017805937115882503, 'optimizer': 'RAdam', 'batch_size': 1149}. Best is trial 22 with value: 0.00121851428411901.
Training model with params: layers=4, units=58, activation=tanh, optimizer=RAdam, lr=0.0035778169379003916, batchsize=703
Finish Trainingstep 1 of 3 with lr=0.0035778169379003916 and 1000 epochs
Finish Trainingstep 2 of 3 with lr=0.0035778169379003916 and 1000 epochs
Finish Trainingstep 3 of 3 with lr=0.0035778169379003916 and 10000 epochs
2025-05-23_07-54-59
