[I 2025-05-26 07:22:16,999] Trial 97 finished with value: 0.0012605091324076056 and parameters: {'n_layers': 6, 'n_units': 52, 'activation': 'sigmoid', 'lr': 0.008582250017360874, 'optimizer': 'RAdam', 'batch_size': 437}. Best is trial 95 with value: 0.000981203280389309.
Training model with params: layers=6, units=64, activation=sigmoid, optimizer=RAdam, lr=0.008761343021479821, batchsize=330
Finish Trainingstep 1 of 3 with lr=0.008761343021479821 and 1000 epochs
Finish Trainingstep 2 of 3 with lr=0.008761343021479821 and 1000 epochs
Finish Trainingstep 3 of 3 with lr=0.008761343021479821 and 10000 epochs
2025-05-26_07-52-48
[I 2025-05-26 07:52:48,768] Trial 98 finished with value: 0.001982081215828657 and parameters: {'n_layers': 6, 'n_units': 64, 'activation': 'sigmoid', 'lr': 0.008761343021479821, 'optimizer': 'RAdam', 'batch_size': 330}. Best is trial 95 with value: 0.000981203280389309.
Training model with params: layers=5, units=98, activation=sigmoid, optimizer=rmsprop, lr=0.008121748428888981, batchsize=536
Finish Trainingstep 1 of 3 with lr=0.008121748428888981 and 1000 epochs
Finish Trainingstep 2 of 3 with lr=0.008121748428888981 and 1000 epochs
Finish Trainingstep 3 of 3 with lr=0.008121748428888981 and 10000 epochs
2025-05-26_09-03-47
[I 2025-05-26 09:03:47,821] Trial 99 finished with value: 0.0017626640619710088 and parameters: {'n_layers': 5, 'n_units': 98, 'activation': 'sigmoid', 'lr': 0.008121748428888981, 'optimizer': 'rmsprop', 'batch_size': 536}. Best is trial 95 with value: 0.000981203280389309.
Beste Parameter:
{'n_layers': 5, 'n_units': 28, 'activation': 'sigmoid', 'lr': 0.005344300916456615, 'optimizer': 'RAdam', 'batch_size': 476}
