[I 2025-05-23 07:54:59,156] Trial 29 finished with value: 0.0015934697585180402 and parameters: {'n_layers': 4, 'n_units': 58, 'activation': 'tanh', 'lr': 0.0035778169379003916, 'optimizer': 'RAdam', 'batch_size': 703}. Best is trial 22 with value: 0.00121851428411901.
Training model with params: layers=3, units=466, activation=swish, optimizer=adam, lr=0.00040942058721774087, batchsize=1411
Finish Trainingstep 1 of 3 with lr=0.00040942058721774087 and 1000 epochs
Finish Trainingstep 2 of 3 with lr=0.00040942058721774087 and 1000 epochs
Finish Trainingstep 3 of 3 with lr=0.00040942058721774087 and 10000 epochs
2025-05-23_09-56-53
[I 2025-05-23 09:56:54,068] Trial 30 finished with value: 0.0014432596508413553 and parameters: {'n_layers': 3, 'n_units': 466, 'activation': 'swish', 'lr': 0.00040942058721774087, 'optimizer': 'adam', 'batch_size': 1411}. Best is trial 22 with value: 0.00121851428411901.
Training model with params: layers=4, units=65, activation=swish, optimizer=RAdam, lr=0.006056217805275974, batchsize=1228
Finish Trainingstep 1 of 3 with lr=0.006056217805275974 and 1000 epochs
Finish Trainingstep 2 of 3 with lr=0.006056217805275974 and 1000 epochs
Finish Trainingstep 3 of 3 with lr=0.006056217805275974 and 10000 epochs
2025-05-23_11-19-15
[I 2025-05-23 11:19:15,992] Trial 31 finished with value: 0.0012137441663071513 and parameters: {'n_layers': 4, 'n_units': 65, 'activation': 'swish', 'lr': 0.006056217805275974, 'optimizer': 'RAdam', 'batch_size': 1228}. Best is trial 31 with value: 0.0012137441663071513.
Training model with params: layers=3, units=58, activation=gelu, optimizer=RAdam, lr=0.009753403085403786, batchsize=901
Finish Trainingstep 1 of 3 with lr=0.009753403085403786 and 1000 epochs
Finish Trainingstep 2 of 3 with lr=0.009753403085403786 and 1000 epochs
Finish Trainingstep 3 of 3 with lr=0.009753403085403786 and 10000 epochs
2025-05-23_12-10-52
[I 2025-05-23 12:10:52,899] Trial 32 finished with value: 0.0016674542566761374 and parameters: {'n_layers': 3, 'n_units': 58, 'activation': 'gelu', 'lr': 0.009753403085403786, 'optimizer': 'RAdam', 'batch_size': 901}. Best is trial 31 with value: 0.0012137441663071513.
Training model with params: layers=5, units=104, activation=swish, optimizer=RAdam, lr=0.006857242872575893, batchsize=520
Finish Trainingstep 1 of 3 with lr=0.006857242872575893 and 1000 epochs
Finish Trainingstep 2 of 3 with lr=0.006857242872575893 and 1000 epochs
Finish Trainingstep 3 of 3 with lr=0.006857242872575893 and 10000 epochs
2025-05-23_12-56-55
[I 2025-05-23 12:56:55,354] Trial 33 finished with value: 0.0016257097013294697 and parameters: {'n_layers': 5, 'n_units': 104, 'activation': 'swish', 'lr': 0.006857242872575893, 'optimizer': 'RAdam', 'batch_size': 520}. Best is trial 31 with value: 0.0012137441663071513.
Training model with params: layers=2, units=57, activation=swish, optimizer=AdamW, lr=0.0017238452866962745, batchsize=1230
Finish Trainingstep 1 of 3 with lr=0.0017238452866962745 and 1000 epochs
Finish Trainingstep 2 of 3 with lr=0.0017238452866962745 and 1000 epochs
Finish Trainingstep 3 of 3 with lr=0.0017238452866962745 and 10000 epochs
2025-05-23_13-12-46
[I 2025-05-23 13:12:46,168] Trial 34 finished with value: 0.006615136284381151 and parameters: {'n_layers': 2, 'n_units': 57, 'activation': 'swish', 'lr': 0.0017238452866962745, 'optimizer': 'AdamW', 'batch_size': 1230}. Best is trial 31 with value: 0.0012137441663071513.
Training model with params: layers=3, units=191, activation=tanh, optimizer=sgd, lr=0.00412807154646542, batchsize=1693
Finish Trainingstep 1 of 3 with lr=0.00412807154646542 and 1000 epochs
Finish Trainingstep 2 of 3 with lr=0.00412807154646542 and 1000 epochs
Finish Trainingstep 3 of 3 with lr=0.00412807154646542 and 10000 epochs
2025-05-23_15-17-11
[I 2025-05-23 15:17:11,809] Trial 35 finished with value: 0.04837118834257126 and parameters: {'n_layers': 3, 'n_units': 191, 'activation': 'tanh', 'lr': 0.00412807154646542, 'optimizer': 'sgd', 'batch_size': 1693}. Best is trial 31 with value: 0.0012137441663071513.
Training model with params: layers=1, units=107, activation=selu, optimizer=RAdam, lr=0.005794946389882288, batchsize=1407
Finish Trainingstep 1 of 3 with lr=0.005794946389882288 and 1000 epochs
Finish Trainingstep 2 of 3 with lr=0.005794946389882288 and 1000 epochs
Finish Trainingstep 3 of 3 with lr=0.005794946389882288 and 10000 epochs
2025-05-23_16-15-16
[I 2025-05-23 16:15:16,654] Trial 36 finished with value: 0.0049470714293420315 and parameters: {'n_layers': 1, 'n_units': 107, 'activation': 'selu', 'lr': 0.005794946389882288, 'optimizer': 'RAdam', 'batch_size': 1407}. Best is trial 31 with value: 0.0012137441663071513.
Training model with params: layers=4, units=302, activation=leaky_relu, optimizer=adam, lr=0.0029038492655582807, batchsize=1255
Finish Trainingstep 1 of 3 with lr=0.0029038492655582807 and 1000 epochs
Finish Trainingstep 2 of 3 with lr=0.0029038492655582807 and 1000 epochs
Finish Trainingstep 3 of 3 with lr=0.0029038492655582807 and 10000 epochs
2025-05-23_16-58-38
[I 2025-05-23 16:58:38,985] Trial 37 finished with value: 0.002643631538376212 and parameters: {'n_layers': 4, 'n_units': 302, 'activation': 'leaky_relu', 'lr': 0.0029038492655582807, 'optimizer': 'adam', 'batch_size': 1255}. Best is trial 31 with value: 0.0012137441663071513.
Training model with params: layers=6, units=238, activation=sigmoid, optimizer=RAdam, lr=0.0002456157803289157, batchsize=1133
Finish Trainingstep 1 of 3 with lr=0.0002456157803289157 and 1000 epochs
Finish Trainingstep 2 of 3 with lr=0.0002456157803289157 and 1000 epochs
Finish Trainingstep 3 of 3 with lr=0.0002456157803289157 and 10000 epochs
2025-05-23_20-32-42
[I 2025-05-23 20:32:42,297] Trial 38 finished with value: 0.0024588790256530046 and parameters: {'n_layers': 6, 'n_units': 238, 'activation': 'sigmoid', 'lr': 0.0002456157803289157, 'optimizer': 'RAdam', 'batch_size': 1133}. Best is trial 31 with value: 0.0012137441663071513.
Training model with params: layers=2, units=56, activation=elu, optimizer=rmsprop, lr=0.0012994386605344897, batchsize=1664
Finish Trainingstep 1 of 3 with lr=0.0012994386605344897 and 1000 epochs
Finish Trainingstep 2 of 3 with lr=0.0012994386605344897 and 1000 epochs
Finish Trainingstep 3 of 3 with lr=0.0012994386605344897 and 10000 epochs
2025-05-23_21-24-34
[I 2025-05-23 21:24:34,155] Trial 39 finished with value: 0.002997590461745858 and parameters: {'n_layers': 2, 'n_units': 56, 'activation': 'elu', 'lr': 0.0012994386605344897, 'optimizer': 'rmsprop', 'batch_size': 1664}. Best is trial 31 with value: 0.0012137441663071513.
Training model with params: layers=5, units=162, activation=relu, optimizer=AdamW, lr=0.007912017029258471, batchsize=789
Finish Trainingstep 1 of 3 with lr=0.007912017029258471 and 1000 epochs
Finish Trainingstep 2 of 3 with lr=0.007912017029258471 and 1000 epochs
Finish Trainingstep 3 of 3 with lr=0.007912017029258471 and 10000 epochs
2025-05-23_22-05-25
[I 2025-05-23 22:05:25,307] Trial 40 finished with value: 0.004160905722528696 and parameters: {'n_layers': 5, 'n_units': 162, 'activation': 'relu', 'lr': 0.007912017029258471, 'optimizer': 'AdamW', 'batch_size': 789}. Best is trial 31 with value: 0.0012137441663071513.
Training model with params: layers=4, units=83, activation=swish, optimizer=RAdam, lr=0.005349395680217385, batchsize=1177
Finish Trainingstep 1 of 3 with lr=0.005349395680217385 and 1000 epochs
Finish Trainingstep 2 of 3 with lr=0.005349395680217385 and 1000 epochs
Finish Trainingstep 3 of 3 with lr=0.005349395680217385 and 10000 epochs
2025-05-23_22-54-13
[I 2025-05-23 22:54:13,673] Trial 41 finished with value: 0.0015419382834807038 and parameters: {'n_layers': 4, 'n_units': 83, 'activation': 'swish', 'lr': 0.005349395680217385, 'optimizer': 'RAdam', 'batch_size': 1177}. Best is trial 31 with value: 0.0012137441663071513.
Training model with params: layers=4, units=46, activation=swish, optimizer=RAdam, lr=0.004540355556230772, batchsize=1007
Finish Trainingstep 1 of 3 with lr=0.004540355556230772 and 1000 epochs
Finish Trainingstep 2 of 3 with lr=0.004540355556230772 and 1000 epochs
Finish Trainingstep 3 of 3 with lr=0.004540355556230772 and 10000 epochs
2025-05-23_23-34-29
[I 2025-05-23 23:34:29,041] Trial 42 finished with value: 0.0011476419167593122 and parameters: {'n_layers': 4, 'n_units': 46, 'activation': 'swish', 'lr': 0.004540355556230772, 'optimizer': 'RAdam', 'batch_size': 1007}. Best is trial 42 with value: 0.0011476419167593122.
Training model with params: layers=3, units=46, activation=swish, optimizer=RAdam, lr=0.0039705716391393005, batchsize=1004
Finish Trainingstep 1 of 3 with lr=0.0039705716391393005 and 1000 epochs
Finish Trainingstep 2 of 3 with lr=0.0039705716391393005 and 1000 epochs
Finish Trainingstep 3 of 3 with lr=0.0039705716391393005 and 10000 epochs
2025-05-24_00-13-37
[I 2025-05-24 00:13:37,719] Trial 43 finished with value: 0.0014858319191262126 and parameters: {'n_layers': 3, 'n_units': 46, 'activation': 'swish', 'lr': 0.0039705716391393005, 'optimizer': 'RAdam', 'batch_size': 1004}. Best is trial 42 with value: 0.0011476419167593122.
Training model with params: layers=5, units=21, activation=gelu, optimizer=RAdam, lr=0.007416563287178228, batchsize=2030
Finish Trainingstep 1 of 3 with lr=0.007416563287178228 and 1000 epochs
Finish Trainingstep 2 of 3 with lr=0.007416563287178228 and 1000 epochs
Finish Trainingstep 3 of 3 with lr=0.007416563287178228 and 10000 epochs
2025-05-24_00-41-15
[I 2025-05-24 00:41:15,654] Trial 44 finished with value: 0.0014988583279773593 and parameters: {'n_layers': 5, 'n_units': 21, 'activation': 'gelu', 'lr': 0.007416563287178228, 'optimizer': 'RAdam', 'batch_size': 2030}. Best is trial 42 with value: 0.0011476419167593122.
Training model with params: layers=3, units=111, activation=swish, optimizer=adam, lr=0.002454580658584609, batchsize=1320
Finish Trainingstep 1 of 3 with lr=0.002454580658584609 and 1000 epochs
Finish Trainingstep 2 of 3 with lr=0.002454580658584609 and 1000 epochs
Finish Trainingstep 3 of 3 with lr=0.002454580658584609 and 10000 epochs
2025-05-24_01-15-39
[I 2025-05-24 01:15:40,039] Trial 45 finished with value: 0.0015188923571258783 and parameters: {'n_layers': 3, 'n_units': 111, 'activation': 'swish', 'lr': 0.002454580658584609, 'optimizer': 'adam', 'batch_size': 1320}. Best is trial 42 with value: 0.0011476419167593122.
Training model with params: layers=4, units=57, activation=swish, optimizer=rmsprop, lr=0.0046511611422747155, batchsize=603
Finish Trainingstep 1 of 3 with lr=0.0046511611422747155 and 1000 epochs
Finish Trainingstep 2 of 3 with lr=0.0046511611422747155 and 1000 epochs
Finish Trainingstep 3 of 3 with lr=0.0046511611422747155 and 10000 epochs
2025-05-24_02-40-09
[I 2025-05-24 02:40:10,049] Trial 46 finished with value: 0.0012702547246590257 and parameters: {'n_layers': 4, 'n_units': 57, 'activation': 'swish', 'lr': 0.0046511611422747155, 'optimizer': 'rmsprop', 'batch_size': 603}. Best is trial 42 with value: 0.0011476419167593122.
Training model with params: layers=4, units=408, activation=swish, optimizer=rmsprop, lr=0.00472094467337161, batchsize=256
Finish Trainingstep 1 of 3 with lr=0.00472094467337161 and 1000 epochs
Finish Trainingstep 2 of 3 with lr=0.00472094467337161 and 1000 epochs
Finish Trainingstep 3 of 3 with lr=0.00472094467337161 and 10000 epochs
2025-05-24_06-14-37
[I 2025-05-24 06:14:37,132] Trial 47 finished with value: 0.0020583353471010923 and parameters: {'n_layers': 4, 'n_units': 408, 'activation': 'swish', 'lr': 0.00472094467337161, 'optimizer': 'rmsprop', 'batch_size': 256}. Best is trial 42 with value: 0.0011476419167593122.
Training model with params: layers=3, units=66, activation=relu, optimizer=rmsprop, lr=0.0062788519612647165, batchsize=594
Finish Trainingstep 1 of 3 with lr=0.0062788519612647165 and 1000 epochs
Finish Trainingstep 2 of 3 with lr=0.0062788519612647165 and 1000 epochs
Finish Trainingstep 3 of 3 with lr=0.0062788519612647165 and 10000 epochs
2025-05-24_06-43-34
[I 2025-05-24 06:43:34,082] Trial 48 finished with value: 0.003771416377276182 and parameters: {'n_layers': 3, 'n_units': 66, 'activation': 'relu', 'lr': 0.0062788519612647165, 'optimizer': 'rmsprop', 'batch_size': 594}. Best is trial 42 with value: 0.0011476419167593122.
Training model with params: layers=4, units=16, activation=tanh, optimizer=rmsprop, lr=0.003176254808714123, batchsize=819
Finish Trainingstep 1 of 3 with lr=0.003176254808714123 and 1000 epochs
Finish Trainingstep 2 of 3 with lr=0.003176254808714123 and 1000 epochs
Finish Trainingstep 3 of 3 with lr=0.003176254808714123 and 10000 epochs
2025-05-24_07-33-39
[I 2025-05-24 07:33:39,880] Trial 49 finished with value: 0.0029640127904713154 and parameters: {'n_layers': 4, 'n_units': 16, 'activation': 'tanh', 'lr': 0.003176254808714123, 'optimizer': 'rmsprop', 'batch_size': 819}. Best is trial 42 with value: 0.0011476419167593122.
Training model with params: layers=6, units=45, activation=swish, optimizer=rmsprop, lr=0.008169506900775513, batchsize=387
Finish Trainingstep 1 of 3 with lr=0.008169506900775513 and 1000 epochs
Finish Trainingstep 2 of 3 with lr=0.008169506900775513 and 1000 epochs
Finish Trainingstep 3 of 3 with lr=0.008169506900775513 and 10000 epochs
2025-05-24_08-22-51
[I 2025-05-24 08:22:52,009] Trial 50 finished with value: 0.0017162261065095663 and parameters: {'n_layers': 6, 'n_units': 45, 'activation': 'swish', 'lr': 0.008169506900775513, 'optimizer': 'rmsprop', 'batch_size': 387}. Best is trial 42 with value: 0.0011476419167593122.
Training model with params: layers=5, units=134, activation=swish, optimizer=sgd, lr=0.0020247516120500877, batchsize=1082
Finish Trainingstep 1 of 3 with lr=0.0020247516120500877 and 1000 epochs
Finish Trainingstep 2 of 3 with lr=0.0020247516120500877 and 1000 epochs
Finish Trainingstep 3 of 3 with lr=0.0020247516120500877 and 10000 epochs
2025-05-24_12-56-18
[I 2025-05-24 12:56:18,294] Trial 51 finished with value: 0.04756597429513931 and parameters: {'n_layers': 5, 'n_units': 134, 'activation': 'swish', 'lr': 0.0020247516120500877, 'optimizer': 'sgd', 'batch_size': 1082}. Best is trial 42 with value: 0.0011476419167593122.
Training model with params: layers=4, units=95, activation=swish, optimizer=adam, lr=0.009785490348916456, batchsize=918
Finish Trainingstep 1 of 3 with lr=0.009785490348916456 and 1000 epochs
Finish Trainingstep 2 of 3 with lr=0.009785490348916456 and 1000 epochs
Finish Trainingstep 3 of 3 with lr=0.009785490348916456 and 10000 epochs
2025-05-24_13-44-29
[I 2025-05-24 13:44:29,486] Trial 52 finished with value: 0.001347266836091876 and parameters: {'n_layers': 4, 'n_units': 95, 'activation': 'swish', 'lr': 0.009785490348916456, 'optimizer': 'adam', 'batch_size': 918}. Best is trial 42 with value: 0.0011476419167593122.
Training model with params: layers=7, units=39, activation=swish, optimizer=RAdam, lr=0.005865071742959999, batchsize=1479
Finish Trainingstep 1 of 3 with lr=0.005865071742959999 and 1000 epochs
Finish Trainingstep 2 of 3 with lr=0.005865071742959999 and 1000 epochs
Finish Trainingstep 3 of 3 with lr=0.005865071742959999 and 10000 epochs
2025-05-24_14-55-58
[I 2025-05-24 14:55:58,136] Trial 53 finished with value: 0.0012799857649952173 and parameters: {'n_layers': 7, 'n_units': 39, 'activation': 'swish', 'lr': 0.005865071742959999, 'optimizer': 'RAdam', 'batch_size': 1479}. Best is trial 42 with value: 0.0011476419167593122.
Training model with params: layers=7, units=39, activation=selu, optimizer=RAdam, lr=0.004644952813026036, batchsize=1494
Finish Trainingstep 1 of 3 with lr=0.004644952813026036 and 1000 epochs
Finish Trainingstep 2 of 3 with lr=0.004644952813026036 and 1000 epochs
Finish Trainingstep 3 of 3 with lr=0.004644952813026036 and 10000 epochs
2025-05-24_15-46-40
[I 2025-05-24 15:46:40,956] Trial 54 finished with value: 0.0013875599252060056 and parameters: {'n_layers': 7, 'n_units': 39, 'activation': 'selu', 'lr': 0.004644952813026036, 'optimizer': 'RAdam', 'batch_size': 1494}. Best is trial 42 with value: 0.0011476419167593122.
Training model with params: layers=8, units=68, activation=swish, optimizer=RAdam, lr=0.006158424555224393, batchsize=965
Finish Trainingstep 1 of 3 with lr=0.006158424555224393 and 1000 epochs
Finish Trainingstep 2 of 3 with lr=0.006158424555224393 and 1000 epochs
Finish Trainingstep 3 of 3 with lr=0.006158424555224393 and 10000 epochs
2025-05-24_16-26-49
[I 2025-05-24 16:26:49,368] Trial 55 finished with value: 0.0016754163661971688 and parameters: {'n_layers': 8, 'n_units': 68, 'activation': 'swish', 'lr': 0.006158424555224393, 'optimizer': 'RAdam', 'batch_size': 965}. Best is trial 42 with value: 0.0011476419167593122.
Training model with params: layers=10, units=39, activation=leaky_relu, optimizer=RAdam, lr=0.0036535834304433673, batchsize=1608
Finish Trainingstep 1 of 3 with lr=0.0036535834304433673 and 1000 epochs
Finish Trainingstep 2 of 3 with lr=0.0036535834304433673 and 1000 epochs
Finish Trainingstep 3 of 3 with lr=0.0036535834304433673 and 10000 epochs
2025-05-24_17-32-40
[I 2025-05-24 17:32:40,704] Trial 56 finished with value: 0.002124706283211708 and parameters: {'n_layers': 10, 'n_units': 39, 'activation': 'leaky_relu', 'lr': 0.0036535834304433673, 'optimizer': 'RAdam', 'batch_size': 1608}. Best is trial 42 with value: 0.0011476419167593122.
Training model with params: layers=7, units=284, activation=swish, optimizer=RAdam, lr=0.007949033308559485, batchsize=203
Finish Trainingstep 1 of 3 with lr=0.007949033308559485 and 1000 epochs
Finish Trainingstep 2 of 3 with lr=0.007949033308559485 and 1000 epochs
Finish Trainingstep 3 of 3 with lr=0.007949033308559485 and 10000 epochs
2025-05-24_19-56-08
[I 2025-05-24 19:56:08,633] Trial 57 finished with value: 0.9981197714805603 and parameters: {'n_layers': 7, 'n_units': 284, 'activation': 'swish', 'lr': 0.007949033308559485, 'optimizer': 'RAdam', 'batch_size': 203}. Best is trial 42 with value: 0.0011476419167593122.
Training model with params: layers=6, units=79, activation=sigmoid, optimizer=rmsprop, lr=0.004487098494035022, batchsize=1306
Finish Trainingstep 1 of 3 with lr=0.004487098494035022 and 1000 epochs
Finish Trainingstep 2 of 3 with lr=0.004487098494035022 and 1000 epochs
Finish Trainingstep 3 of 3 with lr=0.004487098494035022 and 10000 epochs
2025-05-24_21-27-18
[I 2025-05-24 21:27:19,042] Trial 58 finished with value: 0.0020323044154793024 and parameters: {'n_layers': 6, 'n_units': 79, 'activation': 'sigmoid', 'lr': 0.004487098494035022, 'optimizer': 'rmsprop', 'batch_size': 1306}. Best is trial 42 with value: 0.0011476419167593122.
Training model with params: layers=4, units=125, activation=elu, optimizer=RAdam, lr=0.005720040477554265, batchsize=1802
Finish Trainingstep 1 of 3 with lr=0.005720040477554265 and 1000 epochs
Finish Trainingstep 2 of 3 with lr=0.005720040477554265 and 1000 epochs
Finish Trainingstep 3 of 3 with lr=0.005720040477554265 and 10000 epochs
2025-05-24_21-53-23
[I 2025-05-24 21:53:23,060] Trial 59 finished with value: 0.0018297049682587385 and parameters: {'n_layers': 4, 'n_units': 125, 'activation': 'elu', 'lr': 0.005720040477554265, 'optimizer': 'RAdam', 'batch_size': 1802}. Best is trial 42 with value: 0.0011476419167593122.
Training model with params: layers=8, units=45, activation=swish, optimizer=RAdam, lr=0.008757718086307537, batchsize=601
Finish Trainingstep 1 of 3 with lr=0.008757718086307537 and 1000 epochs
Finish Trainingstep 2 of 3 with lr=0.008757718086307537 and 1000 epochs
Finish Trainingstep 3 of 3 with lr=0.008757718086307537 and 10000 epochs
2025-05-24_22-36-43
[I 2025-05-24 22:36:43,465] Trial 60 finished with value: 0.0014948914758861065 and parameters: {'n_layers': 8, 'n_units': 45, 'activation': 'swish', 'lr': 0.008757718086307537, 'optimizer': 'RAdam', 'batch_size': 601}. Best is trial 42 with value: 0.0011476419167593122.
Training model with params: layers=5, units=70, activation=swish, optimizer=adam, lr=0.0007462466732292444, batchsize=1408
Finish Trainingstep 1 of 3 with lr=0.0007462466732292444 and 1000 epochs
Finish Trainingstep 2 of 3 with lr=0.0007462466732292444 and 1000 epochs
Finish Trainingstep 3 of 3 with lr=0.0007462466732292444 and 10000 epochs
2025-05-25_00-25-20
[I 2025-05-25 00:25:20,903] Trial 61 finished with value: 0.0014470901805907488 and parameters: {'n_layers': 5, 'n_units': 70, 'activation': 'swish', 'lr': 0.0007462466732292444, 'optimizer': 'adam', 'batch_size': 1408}. Best is trial 42 with value: 0.0011476419167593122.
Training model with params: layers=5, units=94, activation=swish, optimizer=RAdam, lr=0.00038228129284225207, batchsize=1220
Finish Trainingstep 1 of 3 with lr=0.00038228129284225207 and 1000 epochs
Finish Trainingstep 2 of 3 with lr=0.00038228129284225207 and 1000 epochs
Finish Trainingstep 3 of 3 with lr=0.00038228129284225207 and 10000 epochs
2025-05-25_01-55-24
[I 2025-05-25 01:55:24,709] Trial 62 finished with value: 0.0015017775585874915 and parameters: {'n_layers': 5, 'n_units': 94, 'activation': 'swish', 'lr': 0.00038228129284225207, 'optimizer': 'RAdam', 'batch_size': 1220}. Best is trial 42 with value: 0.0011476419167593122.
Training model with params: layers=4, units=34, activation=swish, optimizer=sgd, lr=0.006551118649749133, batchsize=1070
Finish Trainingstep 1 of 3 with lr=0.006551118649749133 and 1000 epochs
Finish Trainingstep 2 of 3 with lr=0.006551118649749133 and 1000 epochs
Finish Trainingstep 3 of 3 with lr=0.006551118649749133 and 10000 epochs
2025-05-25_03-24-16
