[I 2025-05-30 19:32:51,985] Trial 28 finished with value: 0.001092329970560968 and parameters: {'n_layers': 11, 'n_units': 276, 'activation': 'swish', 'lr': 6.88822439705839e-05, 'optimizer': 'adam', 'batch_size': 880}. Best is trial 28 with value: 0.001092329970560968.
Training model with params: layers=9, units=421, activation=sigmoid, optimizer=adam, lr=6.825276869210609e-05, batchsize=947
Finish Trainingstep 1 of 3 with lr=6.825276869210609e-05 and 1000 epochs
Finish Trainingstep 2 of 3 with lr=6.825276869210609e-05 and 1000 epochs
Finish Trainingstep 3 of 3 with lr=6.825276869210609e-05 and 10000 epochs
2025-05-31_04-01-28
[I 2025-05-31 04:01:28,740] Trial 29 finished with value: 0.009481147862970829 and parameters: {'n_layers': 9, 'n_units': 421, 'activation': 'sigmoid', 'lr': 6.825276869210609e-05, 'optimizer': 'adam', 'batch_size': 947}. Best is trial 28 with value: 0.001092329970560968.
Training model with params: layers=11, units=154, activation=elu, optimizer=adam, lr=1.8038400951997067e-05, batchsize=909
Finish Trainingstep 1 of 3 with lr=1.8038400951997067e-05 and 1000 epochs
Finish Trainingstep 2 of 3 with lr=1.8038400951997067e-05 and 1000 epochs
Finish Trainingstep 3 of 3 with lr=1.8038400951997067e-05 and 10000 epochs
2025-05-31_10-00-54
[I 2025-05-31 10:00:54,484] Trial 30 finished with value: 0.0027942166198045015 and parameters: {'n_layers': 11, 'n_units': 154, 'activation': 'elu', 'lr': 1.8038400951997067e-05, 'optimizer': 'adam', 'batch_size': 909}. Best is trial 28 with value: 0.001092329970560968.
Training model with params: layers=14, units=306, activation=swish, optimizer=adam, lr=4.405314410133334e-05, batchsize=629
Finish Trainingstep 1 of 3 with lr=4.405314410133334e-05 and 1000 epochs
Finish Trainingstep 2 of 3 with lr=4.405314410133334e-05 and 1000 epochs
Finish Trainingstep 3 of 3 with lr=4.405314410133334e-05 and 10000 epochs
2025-05-31_18-58-55
[I 2025-05-31 18:58:56,008] Trial 31 finished with value: 0.0011030832538381219 and parameters: {'n_layers': 14, 'n_units': 306, 'activation': 'swish', 'lr': 4.405314410133334e-05, 'optimizer': 'adam', 'batch_size': 629}. Best is trial 28 with value: 0.001092329970560968.
Training model with params: layers=14, units=369, activation=swish, optimizer=adam, lr=4.6341907531479676e-05, batchsize=588
Finish Trainingstep 1 of 3 with lr=4.6341907531479676e-05 and 1000 epochs
Finish Trainingstep 2 of 3 with lr=4.6341907531479676e-05 and 1000 epochs
Finish Trainingstep 3 of 3 with lr=4.6341907531479676e-05 and 10000 epochs
2025-06-01_08-34-46
[I 2025-06-01 08:34:46,950] Trial 32 finished with value: 0.001054559019394219 and parameters: {'n_layers': 14, 'n_units': 369, 'activation': 'swish', 'lr': 4.6341907531479676e-05, 'optimizer': 'adam', 'batch_size': 588}. Best is trial 32 with value: 0.001054559019394219.
Training model with params: layers=14, units=411, activation=swish, optimizer=adam, lr=4.651161032783473e-05, batchsize=605
Finish Trainingstep 1 of 3 with lr=4.651161032783473e-05 and 1000 epochs
Finish Trainingstep 2 of 3 with lr=4.651161032783473e-05 and 1000 epochs
Finish Trainingstep 3 of 3 with lr=4.651161032783473e-05 and 10000 epochs
2025-06-01_17-38-36
[I 2025-06-01 17:38:36,519] Trial 33 finished with value: 0.0011204106267541647 and parameters: {'n_layers': 14, 'n_units': 411, 'activation': 'swish', 'lr': 4.651161032783473e-05, 'optimizer': 'adam', 'batch_size': 605}. Best is trial 32 with value: 0.001054559019394219.
Training model with params: layers=14, units=369, activation=selu, optimizer=adam, lr=4.80359772517849e-05, batchsize=581
Finish Trainingstep 1 of 3 with lr=4.80359772517849e-05 and 1000 epochs
Finish Trainingstep 2 of 3 with lr=4.80359772517849e-05 and 1000 epochs
Finish Trainingstep 3 of 3 with lr=4.80359772517849e-05 and 10000 epochs
2025-06-02_08-25-53
[I 2025-06-02 08:25:53,495] Trial 34 finished with value: 0.005165829788893461 and parameters: {'n_layers': 14, 'n_units': 369, 'activation': 'selu', 'lr': 4.80359772517849e-05, 'optimizer': 'adam', 'batch_size': 581}. Best is trial 32 with value: 0.001054559019394219.
Training model with params: layers=15, units=320, activation=leaky_relu, optimizer=adam, lr=7.118584707501173e-05, batchsize=375
Finish Trainingstep 1 of 3 with lr=7.118584707501173e-05 and 1000 epochs
