[I 2025-05-09 14:32:53,663] Trial 45 finished with value: 0.0016621476970613003 and parameters: {'n_layers': 6, 'n_units': 86, 'activation': 'selu', 'lr': 0.0004789797632568035, 'optimizer': 'adam'}. Best is trial 31 with value: 0.0008228346123360097.
Training model with trial #46 and params: {'n_layers': 5, 'n_units': 198, 'activation': 'elu', 'lr': 0.00038626457498995483, 'optimizer': 'adam'}
[I 2025-05-09 15:16:24,256] Trial 46 finished with value: 0.0013855634024366736 and parameters: {'n_layers': 5, 'n_units': 198, 'activation': 'elu', 'lr': 0.00038626457498995483, 'optimizer': 'adam'}. Best is trial 31 with value: 0.0008228346123360097.
Training model with trial #47 and params: {'n_layers': 4, 'n_units': 50, 'activation': 'relu', 'lr': 0.0012022113836956663, 'optimizer': 'rmsprop'}
[I 2025-05-09 15:47:43,561] Trial 47 finished with value: 0.0025069224648177624 and parameters: {'n_layers': 4, 'n_units': 50, 'activation': 'relu', 'lr': 0.0012022113836956663, 'optimizer': 'rmsprop'}. Best is trial 31 with value: 0.0008228346123360097.
Training model with trial #48 and params: {'n_layers': 3, 'n_units': 160, 'activation': 'sigmoid', 'lr': 0.004417073667748514, 'optimizer': 'adam'}
[I 2025-05-09 16:08:55,002] Trial 48 finished with value: 0.0011322727659717202 and parameters: {'n_layers': 3, 'n_units': 160, 'activation': 'sigmoid', 'lr': 0.004417073667748514, 'optimizer': 'adam'}. Best is trial 31 with value: 0.0008228346123360097.
Training model with trial #49 and params: {'n_layers': 7, 'n_units': 258, 'activation': 'gelu', 'lr': 0.0007197487476019967, 'optimizer': 'sgd'}
[I 2025-05-09 19:32:57,269] Trial 49 finished with value: 0.01462283730506897 and parameters: {'n_layers': 7, 'n_units': 258, 'activation': 'gelu', 'lr': 0.0007197487476019967, 'optimizer': 'sgd'}. Best is trial 31 with value: 0.0008228346123360097.
Training model with trial #50 and params: {'n_layers': 5, 'n_units': 76, 'activation': 'sigmoid', 'lr': 0.002154992025051633, 'optimizer': 'AdamW'}
[I 2025-05-09 19:50:10,240] Trial 50 finished with value: 1.0276975631713867 and parameters: {'n_layers': 5, 'n_units': 76, 'activation': 'sigmoid', 'lr': 0.002154992025051633, 'optimizer': 'AdamW'}. Best is trial 31 with value: 0.0008228346123360097.
Training model with trial #51 and params: {'n_layers': 4, 'n_units': 128, 'activation': 'sigmoid', 'lr': 0.0009113872241226835, 'optimizer': 'adam'}
[I 2025-05-09 20:15:24,296] Trial 51 finished with value: 0.0008528770413249731 and parameters: {'n_layers': 4, 'n_units': 128, 'activation': 'sigmoid', 'lr': 0.0009113872241226835, 'optimizer': 'adam'}. Best is trial 31 with value: 0.0008228346123360097.
Training model with trial #52 and params: {'n_layers': 3, 'n_units': 120, 'activation': 'sigmoid', 'lr': 0.0009005197963726911, 'optimizer': 'adam'}
[I 2025-05-09 20:45:13,705] Trial 52 finished with value: 0.0007487854454666376 and parameters: {'n_layers': 3, 'n_units': 120, 'activation': 'sigmoid', 'lr': 0.0009005197963726911, 'optimizer': 'adam'}. Best is trial 52 with value: 0.0007487854454666376.
Training model with trial #53 and params: {'n_layers': 3, 'n_units': 128, 'activation': 'sigmoid', 'lr': 0.0008805996059469268, 'optimizer': 'adam'}
[I 2025-05-09 21:21:37,209] Trial 53 finished with value: 0.0008030167082324624 and parameters: {'n_layers': 3, 'n_units': 128, 'activation': 'sigmoid', 'lr': 0.0008805996059469268, 'optimizer': 'adam'}. Best is trial 52 with value: 0.0007487854454666376.
Training model with trial #54 and params: {'n_layers': 3, 'n_units': 125, 'activation': 'swish', 'lr': 0.0009026931222881117, 'optimizer': 'adam'}
[I 2025-05-09 22:58:20,793] Trial 54 finished with value: 0.0011565475724637508 and parameters: {'n_layers': 3, 'n_units': 125, 'activation': 'swish', 'lr': 0.0009026931222881117, 'optimizer': 'adam'}. Best is trial 52 with value: 0.0007487854454666376.
Training model with trial #55 and params: {'n_layers': 2, 'n_units': 189, 'activation': 'leaky_relu', 'lr': 0.0005381215068723771, 'optimizer': 'adam'}
[I 2025-05-09 23:51:41,892] Trial 55 finished with value: 0.0019131960580125451 and parameters: {'n_layers': 2, 'n_units': 189, 'activation': 'leaky_relu', 'lr': 0.0005381215068723771, 'optimizer': 'adam'}. Best is trial 52 with value: 0.0007487854454666376.
Training model with trial #56 and params: {'n_layers': 3, 'n_units': 224, 'activation': 'sigmoid', 'lr': 0.00011943082354986227, 'optimizer': 'rmsprop'}
[I 2025-05-10 00:37:42,084] Trial 56 finished with value: 0.007008352782577276 and parameters: {'n_layers': 3, 'n_units': 224, 'activation': 'sigmoid', 'lr': 0.00011943082354986227, 'optimizer': 'rmsprop'}. Best is trial 52 with value: 0.0007487854454666376.
Training model with trial #57 and params: {'n_layers': 2, 'n_units': 136, 'activation': 'relu', 'lr': 0.0016899018179438675, 'optimizer': 'adam'}
[I 2025-05-10 01:11:31,103] Trial 57 finished with value: 0.0020222861785441637 and parameters: {'n_layers': 2, 'n_units': 136, 'activation': 'relu', 'lr': 0.0016899018179438675, 'optimizer': 'adam'}. Best is trial 52 with value: 0.0007487854454666376.
Training model with trial #58 and params: {'n_layers': 3, 'n_units': 157, 'activation': 'tanh', 'lr': 0.0008614019487247766, 'optimizer': 'sgd'}
[I 2025-05-10 01:57:44,268] Trial 58 finished with value: 0.03971395269036293 and parameters: {'n_layers': 3, 'n_units': 157, 'activation': 'tanh', 'lr': 0.0008614019487247766, 'optimizer': 'sgd'}. Best is trial 52 with value: 0.0007487854454666376.
Training model with trial #59 and params: {'n_layers': 1, 'n_units': 124, 'activation': 'sigmoid', 'lr': 0.00044395676296202555, 'optimizer': 'adam'}
[I 2025-05-10 02:32:11,734] Trial 59 finished with value: 0.007378034759312868 and parameters: {'n_layers': 1, 'n_units': 124, 'activation': 'sigmoid', 'lr': 0.00044395676296202555, 'optimizer': 'adam'}. Best is trial 52 with value: 0.0007487854454666376.
Training model with trial #60 and params: {'n_layers': 3, 'n_units': 59, 'activation': 'gelu', 'lr': 0.0010498266060056825, 'optimizer': 'adam'}
[I 2025-05-10 02:56:04,333] Trial 60 finished with value: 0.0009347284212708473 and parameters: {'n_layers': 3, 'n_units': 59, 'activation': 'gelu', 'lr': 0.0010498266060056825, 'optimizer': 'adam'}. Best is trial 52 with value: 0.0007487854454666376.
Training model with trial #61 and params: {'n_layers': 3, 'n_units': 36, 'activation': 'gelu', 'lr': 0.001129751692028555, 'optimizer': 'adam'}
[I 2025-05-10 03:30:31,600] Trial 61 finished with value: 0.0008031364995986223 and parameters: {'n_layers': 3, 'n_units': 36, 'activation': 'gelu', 'lr': 0.001129751692028555, 'optimizer': 'adam'}. Best is trial 52 with value: 0.0007487854454666376.
Training model with trial #62 and params: {'n_layers': 2, 'n_units': 34, 'activation': 'gelu', 'lr': 0.0013473935610460277, 'optimizer': 'adam'}
[I 2025-05-10 03:55:45,328] Trial 62 finished with value: 0.001364625641144812 and parameters: {'n_layers': 2, 'n_units': 34, 'activation': 'gelu', 'lr': 0.0013473935610460277, 'optimizer': 'adam'}. Best is trial 52 with value: 0.0007487854454666376.
Training model with trial #63 and params: {'n_layers': 4, 'n_units': 66, 'activation': 'gelu', 'lr': 0.0005803298054849595, 'optimizer': 'adam'}
[I 2025-05-10 04:09:12,921] Trial 63 finished with value: 0.0017532974015921354 and parameters: {'n_layers': 4, 'n_units': 66, 'activation': 'gelu', 'lr': 0.0005803298054849595, 'optimizer': 'adam'}. Best is trial 52 with value: 0.0007487854454666376.
Training model with trial #64 and params: {'n_layers': 3, 'n_units': 37, 'activation': 'sigmoid', 'lr': 0.000750669134816034, 'optimizer': 'adam'}
[I 2025-05-10 04:40:38,890] Trial 64 finished with value: 0.0010022789938375354 and parameters: {'n_layers': 3, 'n_units': 37, 'activation': 'sigmoid', 'lr': 0.000750669134816034, 'optimizer': 'adam'}. Best is trial 52 with value: 0.0007487854454666376.
Training model with trial #65 and params: {'n_layers': 4, 'n_units': 142, 'activation': 'gelu', 'lr': 0.0034260856189021467, 'optimizer': 'RAdam'}
[I 2025-05-10 04:59:50,624] Trial 65 finished with value: 0.002084167441353202 and parameters: {'n_layers': 4, 'n_units': 142, 'activation': 'gelu', 'lr': 0.0034260856189021467, 'optimizer': 'RAdam'}. Best is trial 52 with value: 0.0007487854454666376.
Training model with trial #66 and params: {'n_layers': 1, 'n_units': 96, 'activation': 'sigmoid', 'lr': 0.0011029758770879387, 'optimizer': 'adam'}
[I 2025-05-10 05:33:02,331] Trial 66 finished with value: 0.004733583424240351 and parameters: {'n_layers': 1, 'n_units': 96, 'activation': 'sigmoid', 'lr': 0.0011029758770879387, 'optimizer': 'adam'}. Best is trial 52 with value: 0.0007487854454666376.
Training model with trial #67 and params: {'n_layers': 2, 'n_units': 183, 'activation': 'swish', 'lr': 0.0015794488813755854, 'optimizer': 'AdamW'}
[I 2025-05-10 05:50:24,236] Trial 67 finished with value: 0.045500822365283966 and parameters: {'n_layers': 2, 'n_units': 183, 'activation': 'swish', 'lr': 0.0015794488813755854, 'optimizer': 'AdamW'}. Best is trial 52 with value: 0.0007487854454666376.
Training model with trial #68 and params: {'n_layers': 4, 'n_units': 163, 'activation': 'selu', 'lr': 0.005939969538776506, 'optimizer': 'adam'}
[I 2025-05-10 06:03:17,034] Trial 68 finished with value: 0.0021259337663650513 and parameters: {'n_layers': 4, 'n_units': 163, 'activation': 'selu', 'lr': 0.005939969538776506, 'optimizer': 'adam'}. Best is trial 52 with value: 0.0007487854454666376.
Training model with trial #69 and params: {'n_layers': 3, 'n_units': 81, 'activation': 'elu', 'lr': 0.0008776077068857612, 'optimizer': 'RAdam'}
[I 2025-05-10 06:31:30,653] Trial 69 finished with value: 0.0009103770717047155 and parameters: {'n_layers': 3, 'n_units': 81, 'activation': 'elu', 'lr': 0.0008776077068857612, 'optimizer': 'RAdam'}. Best is trial 52 with value: 0.0007487854454666376.
Training model with trial #70 and params: {'n_layers': 3, 'n_units': 81, 'activation': 'elu', 'lr': 0.0003134433605315803, 'optimizer': 'RAdam'}
[I 2025-05-10 07:01:59,031] Trial 70 finished with value: 0.0008638323051854968 and parameters: {'n_layers': 3, 'n_units': 81, 'activation': 'elu', 'lr': 0.0003134433605315803, 'optimizer': 'RAdam'}. Best is trial 52 with value: 0.0007487854454666376.
Training model with trial #71 and params: {'n_layers': 3, 'n_units': 75, 'activation': 'elu', 'lr': 0.00030471431882339307, 'optimizer': 'RAdam'}
[I 2025-05-10 07:33:22,864] Trial 71 finished with value: 0.0009339469252154231 and parameters: {'n_layers': 3, 'n_units': 75, 'activation': 'elu', 'lr': 0.00030471431882339307, 'optimizer': 'RAdam'}. Best is trial 52 with value: 0.0007487854454666376.
Training model with trial #72 and params: {'n_layers': 2, 'n_units': 41, 'activation': 'elu', 'lr': 0.00021760272931708996, 'optimizer': 'RAdam'}
[I 2025-05-10 08:03:08,819] Trial 72 finished with value: 0.0029330216348171234 and parameters: {'n_layers': 2, 'n_units': 41, 'activation': 'elu', 'lr': 0.00021760272931708996, 'optimizer': 'RAdam'}. Best is trial 52 with value: 0.0007487854454666376.
Training model with trial #73 and params: {'n_layers': 3, 'n_units': 85, 'activation': 'elu', 'lr': 0.0026158041976745835, 'optimizer': 'RAdam'}
[I 2025-05-10 08:13:25,740] Trial 73 finished with value: 0.0012140074977651238 and parameters: {'n_layers': 3, 'n_units': 85, 'activation': 'elu', 'lr': 0.0026158041976745835, 'optimizer': 'RAdam'}. Best is trial 52 with value: 0.0007487854454666376.
Training model with trial #74 and params: {'n_layers': 2, 'n_units': 113, 'activation': 'elu', 'lr': 0.0002149255777279932, 'optimizer': 'RAdam'}
[I 2025-05-10 09:06:14,304] Trial 74 finished with value: 0.001222091494128108 and parameters: {'n_layers': 2, 'n_units': 113, 'activation': 'elu', 'lr': 0.0002149255777279932, 'optimizer': 'RAdam'}. Best is trial 52 with value: 0.0007487854454666376.
Training model with trial #75 and params: {'n_layers': 3, 'n_units': 386, 'activation': 'elu', 'lr': 0.0009038451162181474, 'optimizer': 'RAdam'}
[I 2025-05-10 09:46:59,661] Trial 75 finished with value: 0.001233697752468288 and parameters: {'n_layers': 3, 'n_units': 386, 'activation': 'elu', 'lr': 0.0009038451162181474, 'optimizer': 'RAdam'}. Best is trial 52 with value: 0.0007487854454666376.
Training model with trial #76 and params: {'n_layers': 3, 'n_units': 69, 'activation': 'elu', 'lr': 0.0006659791127870579, 'optimizer': 'RAdam'}
[I 2025-05-10 10:09:54,259] Trial 76 finished with value: 0.00097176170675084 and parameters: {'n_layers': 3, 'n_units': 69, 'activation': 'elu', 'lr': 0.0006659791127870579, 'optimizer': 'RAdam'}. Best is trial 52 with value: 0.0007487854454666376.
Training model with trial #77 and params: {'n_layers': 4, 'n_units': 30, 'activation': 'elu', 'lr': 0.00013388285466389496, 'optimizer': 'RAdam'}
[I 2025-05-10 10:43:24,523] Trial 77 finished with value: 0.0024739617947489023 and parameters: {'n_layers': 4, 'n_units': 30, 'activation': 'elu', 'lr': 0.00013388285466389496, 'optimizer': 'RAdam'}. Best is trial 52 with value: 0.0007487854454666376.
Training model with trial #78 and params: {'n_layers': 3, 'n_units': 97, 'activation': 'leaky_relu', 'lr': 0.008384802789305857, 'optimizer': 'RAdam'}
[I 2025-05-10 11:04:11,306] Trial 78 finished with value: 0.0020873872563242912 and parameters: {'n_layers': 3, 'n_units': 97, 'activation': 'leaky_relu', 'lr': 0.008384802789305857, 'optimizer': 'RAdam'}. Best is trial 52 with value: 0.0007487854454666376.
Training model with trial #79 and params: {'n_layers': 2, 'n_units': 125, 'activation': 'sigmoid', 'lr': 0.0004941971231654148, 'optimizer': 'RAdam'}
[I 2025-05-10 11:56:25,324] Trial 79 finished with value: 0.0011869556037709117 and parameters: {'n_layers': 2, 'n_units': 125, 'activation': 'sigmoid', 'lr': 0.0004941971231654148, 'optimizer': 'RAdam'}. Best is trial 52 with value: 0.0007487854454666376.
Training model with trial #80 and params: {'n_layers': 4, 'n_units': 83, 'activation': 'gelu', 'lr': 0.00034060908699607876, 'optimizer': 'sgd'}
[I 2025-05-10 12:54:37,745] Trial 80 finished with value: 0.046025920659303665 and parameters: {'n_layers': 4, 'n_units': 83, 'activation': 'gelu', 'lr': 0.00034060908699607876, 'optimizer': 'sgd'}. Best is trial 52 with value: 0.0007487854454666376.
Training model with trial #81 and params: {'n_layers': 4, 'n_units': 141, 'activation': 'sigmoid', 'lr': 0.0013162859275473884, 'optimizer': 'adam'}
[I 2025-05-10 13:21:09,324] Trial 81 finished with value: 0.0012089736992493272 and parameters: {'n_layers': 4, 'n_units': 141, 'activation': 'sigmoid', 'lr': 0.0013162859275473884, 'optimizer': 'adam'}. Best is trial 52 with value: 0.0007487854454666376.
Training model with trial #82 and params: {'n_layers': 3, 'n_units': 110, 'activation': 'sigmoid', 'lr': 0.001129920280437618, 'optimizer': 'adam'}
[I 2025-05-10 13:48:06,787] Trial 82 finished with value: 0.000902641040738672 and parameters: {'n_layers': 3, 'n_units': 110, 'activation': 'sigmoid', 'lr': 0.001129920280437618, 'optimizer': 'adam'}. Best is trial 52 with value: 0.0007487854454666376.
Training model with trial #83 and params: {'n_layers': 3, 'n_units': 104, 'activation': 'sigmoid', 'lr': 0.0001510171230367392, 'optimizer': 'adam'}
[I 2025-05-10 14:34:07,966] Trial 83 finished with value: 0.0018200107151642442 and parameters: {'n_layers': 3, 'n_units': 104, 'activation': 'sigmoid', 'lr': 0.0001510171230367392, 'optimizer': 'adam'}. Best is trial 52 with value: 0.0007487854454666376.
Training model with trial #84 and params: {'n_layers': 2, 'n_units': 62, 'activation': 'sigmoid', 'lr': 0.0008014778978577701, 'optimizer': 'adam'}
[I 2025-05-10 15:08:33,222] Trial 84 finished with value: 0.0014401923399418592 and parameters: {'n_layers': 2, 'n_units': 62, 'activation': 'sigmoid', 'lr': 0.0008014778978577701, 'optimizer': 'adam'}. Best is trial 52 with value: 0.0007487854454666376.
Training model with trial #85 and params: {'n_layers': 3, 'n_units': 115, 'activation': 'relu', 'lr': 0.0009342898944275786, 'optimizer': 'rmsprop'}
[I 2025-05-10 15:29:43,463] Trial 85 finished with value: 0.0032226513139903545 and parameters: {'n_layers': 3, 'n_units': 115, 'activation': 'relu', 'lr': 0.0009342898944275786, 'optimizer': 'rmsprop'}. Best is trial 52 with value: 0.0007487854454666376.
Training model with trial #86 and params: {'n_layers': 2, 'n_units': 49, 'activation': 'sigmoid', 'lr': 0.002241359252957377, 'optimizer': 'RAdam'}
[I 2025-05-10 15:55:37,557] Trial 86 finished with value: 0.0009209345444105566 and parameters: {'n_layers': 2, 'n_units': 49, 'activation': 'sigmoid', 'lr': 0.002241359252957377, 'optimizer': 'RAdam'}. Best is trial 52 with value: 0.0007487854454666376.
Training model with trial #87 and params: {'n_layers': 4, 'n_units': 295, 'activation': 'tanh', 'lr': 0.0011074571450112106, 'optimizer': 'adam'}
[I 2025-05-10 16:22:36,779] Trial 87 finished with value: 0.0020474076736718416 and parameters: {'n_layers': 4, 'n_units': 295, 'activation': 'tanh', 'lr': 0.0011074571450112106, 'optimizer': 'adam'}. Best is trial 52 with value: 0.0007487854454666376.
Training model with trial #88 and params: {'n_layers': 10, 'n_units': 26, 'activation': 'elu', 'lr': 0.0018401881867099487, 'optimizer': 'AdamW'}
[I 2025-05-10 16:33:45,521] Trial 88 finished with value: 0.03871617093682289 and parameters: {'n_layers': 10, 'n_units': 26, 'activation': 'elu', 'lr': 0.0018401881867099487, 'optimizer': 'AdamW'}. Best is trial 52 with value: 0.0007487854454666376.
Training model with trial #89 and params: {'n_layers': 3, 'n_units': 93, 'activation': 'sigmoid', 'lr': 0.0006385152179407935, 'optimizer': 'adam'}
[I 2025-05-10 17:13:54,718] Trial 89 finished with value: 0.001009306637570262 and parameters: {'n_layers': 3, 'n_units': 93, 'activation': 'sigmoid', 'lr': 0.0006385152179407935, 'optimizer': 'adam'}. Best is trial 52 with value: 0.0007487854454666376.
Training model with trial #90 and params: {'n_layers': 2, 'n_units': 132, 'activation': 'selu', 'lr': 0.0007876678333773572, 'optimizer': 'RAdam'}
[I 2025-05-10 17:52:26,536] Trial 90 finished with value: 0.0017495086649432778 and parameters: {'n_layers': 2, 'n_units': 132, 'activation': 'selu', 'lr': 0.0007876678333773572, 'optimizer': 'RAdam'}. Best is trial 52 with value: 0.0007487854454666376.
Training model with trial #91 and params: {'n_layers': 4, 'n_units': 165, 'activation': 'sigmoid', 'lr': 0.0011660974582352952, 'optimizer': 'adam'}
[I 2025-05-10 18:15:58,127] Trial 91 finished with value: 0.0010177504736930132 and parameters: {'n_layers': 4, 'n_units': 165, 'activation': 'sigmoid', 'lr': 0.0011660974582352952, 'optimizer': 'adam'}. Best is trial 52 with value: 0.0007487854454666376.
Training model with trial #92 and params: {'n_layers': 3, 'n_units': 481, 'activation': 'sigmoid', 'lr': 0.0014297221970023667, 'optimizer': 'adam'}
[I 2025-05-10 19:18:49,009] Trial 92 finished with value: 0.0008035533828660846 and parameters: {'n_layers': 3, 'n_units': 481, 'activation': 'sigmoid', 'lr': 0.0014297221970023667, 'optimizer': 'adam'}. Best is trial 52 with value: 0.0007487854454666376.
Training model with trial #93 and params: {'n_layers': 3, 'n_units': 457, 'activation': 'sigmoid', 'lr': 0.0014963690068412942, 'optimizer': 'adam'}
[I 2025-05-10 20:22:32,254] Trial 93 finished with value: 0.0012158979661762714 and parameters: {'n_layers': 3, 'n_units': 457, 'activation': 'sigmoid', 'lr': 0.0014963690068412942, 'optimizer': 'adam'}. Best is trial 52 with value: 0.0007487854454666376.
Training model with trial #94 and params: {'n_layers': 3, 'n_units': 474, 'activation': 'sigmoid', 'lr': 0.0012932829811849406, 'optimizer': 'adam'}
[I 2025-05-10 21:25:16,652] Trial 94 finished with value: 0.0007725422037765384 and parameters: {'n_layers': 3, 'n_units': 474, 'activation': 'sigmoid', 'lr': 0.0012932829811849406, 'optimizer': 'adam'}. Best is trial 52 with value: 0.0007487854454666376.
Training model with trial #95 and params: {'n_layers': 1, 'n_units': 494, 'activation': 'sigmoid', 'lr': 0.0013012849068681587, 'optimizer': 'adam'}
[I 2025-05-10 22:16:48,567] Trial 95 finished with value: 0.004084708634763956 and parameters: {'n_layers': 1, 'n_units': 494, 'activation': 'sigmoid', 'lr': 0.0013012849068681587, 'optimizer': 'adam'}. Best is trial 52 with value: 0.0007487854454666376.
Training model with trial #96 and params: {'n_layers': 3, 'n_units': 472, 'activation': 'sigmoid', 'lr': 0.004792433143470051, 'optimizer': 'adam'}
[I 2025-05-10 22:57:54,087] Trial 96 finished with value: 0.0015005199238657951 and parameters: {'n_layers': 3, 'n_units': 472, 'activation': 'sigmoid', 'lr': 0.004792433143470051, 'optimizer': 'adam'}. Best is trial 52 with value: 0.0007487854454666376.
Training model with trial #97 and params: {'n_layers': 2, 'n_units': 482, 'activation': 'sigmoid', 'lr': 0.0018297830452430575, 'optimizer': 'adam'}
[I 2025-05-11 00:08:11,977] Trial 97 finished with value: 0.0010934292804449797 and parameters: {'n_layers': 2, 'n_units': 482, 'activation': 'sigmoid', 'lr': 0.0018297830452430575, 'optimizer': 'adam'}. Best is trial 52 with value: 0.0007487854454666376.
Training model with trial #98 and params: {'n_layers': 4, 'n_units': 466, 'activation': 'sigmoid', 'lr': 0.0009962398247892461, 'optimizer': 'adam'}
[I 2025-05-11 01:48:39,077] Trial 98 finished with value: 0.0010328313801437616 and parameters: {'n_layers': 4, 'n_units': 466, 'activation': 'sigmoid', 'lr': 0.0009962398247892461, 'optimizer': 'adam'}. Best is trial 52 with value: 0.0007487854454666376.
Training model with trial #99 and params: {'n_layers': 3, 'n_units': 429, 'activation': 'sigmoid', 'lr': 0.0013788406461429437, 'optimizer': 'adam'}
