[I 2025-05-11 02:47:23,920] Trial 99 finished with value: 0.0008220691233873367 and parameters: {'n_layers': 3, 'n_units': 429, 'activation': 'sigmoid', 'lr': 0.0013788406461429437, 'optimizer': 'adam'}. Best is trial 52 with value: 0.0007487854454666376.
Beste Parameter:
{'n_layers': 3, 'n_units': 120, 'activation': 'sigmoid', 'lr': 0.0009005197963726911, 'optimizer': 'adam'}
