nohup: ignoring input
2025-05-08 19:29:11.955192: I tensorflow/core/util/port.cc:110] oneDNN custom operations are on. You may see slightly different numerical results due to floating-point round-off errors from different computation orders. To turn them off, set the environment variable `TF_ENABLE_ONEDNN_OPTS=0`.
2025-05-08 19:29:13.036020: I tensorflow/tsl/cuda/cudart_stub.cc:28] Could not find cuda drivers on your machine, GPU will not be used.
2025-05-08 19:29:14.154294: I tensorflow/tsl/cuda/cudart_stub.cc:28] Could not find cuda drivers on your machine, GPU will not be used.
2025-05-08 19:29:14.181310: I tensorflow/core/platform/cpu_feature_guard.cc:182] This TensorFlow binary is optimized to use available CPU instructions in performance-critical operations.
To enable the following instructions: AVX2 AVX512F AVX512_VNNI AVX512_BF16 FMA, in other operations, rebuild TensorFlow with the appropriate compiler flags.
2025-05-08 19:29:30.384554: W tensorflow/compiler/tf2tensorrt/utils/py_utils.cc:38] TF-TRT Warning: Could not find TensorRT
/home/rhoffmann/.local/lib/python3.10/site-packages/tensorflow_addons/utils/tfa_eol_msg.py:23: UserWarning: 

TensorFlow Addons (TFA) has ended development and introduction of new features.
TFA has entered a minimal maintenance and release mode until a planned end of life in May 2024.
Please modify downstream libraries to take dependencies from other repositories in our TensorFlow community (e.g. Keras, Keras-CV, and Keras-NLP). 

For more information see: https://github.com/tensorflow/addons/issues/2807 

  warnings.warn(
WARNING:tensorflow:From /home/rhoffmann/G3LHalo_python/exampleNotebooks/GMNN_Bayesian_Optimization.py:54: is_gpu_available (from tensorflow.python.framework.test_util) is deprecated and will be removed in a future version.
Instructions for updating:
Use `tf.config.list_physical_devices('GPU')` instead.
using cpu device 

Number of test samples is 7500, should be 7500
Number of validation samples is 7500, should be 7500
Number of train samples is 35000, should be 35000
number of training samples: 35000 . Should be 35000
number of validation samples: 7500 . Should be 7500
number of test samples: 7500 . Should be 7500
Shape of training data: (3, 35000, 50). Should be (3, 35000, 50)
Shape of testing data: (3, 7500, 50). Should be (3, 7500, 50)
Shape of validation data: (3, 7500, 50). Should be (3, 7500, 50)
number of training samples: 35000 . Should be 35000
number of validation samples: 7500 . Should be 7500
number of test samples: 7500 . Should be 7500
Shape of training data: (1, 35000, 50). Should be (1, 35000, 50)
Shape of testing data: (1, 7500, 50). Should be (1, 7500, 50)
Shape of validation data: (1, 7500, 50). Should be (1, 7500, 50)
number of training samples: 35000 . Should be 35000
number of validation samples: 7500 . Should be 7500
number of test samples: 7500 . Should be 7500
/home/rhoffmann/G3LHalo_python/exampleNotebooks/GMNN_Bayesian_Optimization.py:289: UserWarning: No artists with labels found to put in legend.  Note that artists whose label start with an underscore are ignored when legend() is called with no argument.
  axes.legend()
Train Rescaled Shape: (3, 35000, 50)
Test Rescaled Shape: (3, 7500, 50)
Val Rescaled Shape: (3, 7500, 50)
input min/max: 1.168300956697601e-06 16.999974244680363
output min/max: -14.015791574574829 4.437317596591866
[I 2025-05-08 19:30:16,559] A new study created in memory with name: no-name-a322fa02-4639-4924-aebe-2a3f689006c9
Training model with trial #0 and params: {'n_layers': 2, 'n_units': 281, 'activation': 'elu', 'lr': 0.0023565002202747816, 'optimizer': 'rmsprop'}
[I 2025-05-08 20:00:50,767] Trial 0 finished with value: 0.002452692249789834 and parameters: {'n_layers': 2, 'n_units': 281, 'activation': 'elu', 'lr': 0.0023565002202747816, 'optimizer': 'rmsprop'}. Best is trial 0 with value: 0.002452692249789834.
Training model with trial #1 and params: {'n_layers': 6, 'n_units': 280, 'activation': 'leaky_relu', 'lr': 0.0007838061076039424, 'optimizer': 'RAdam'}
[I 2025-05-08 21:08:00,696] Trial 1 finished with value: 0.0016687377355992794 and parameters: {'n_layers': 6, 'n_units': 280, 'activation': 'leaky_relu', 'lr': 0.0007838061076039424, 'optimizer': 'RAdam'}. Best is trial 1 with value: 0.0016687377355992794.
Training model with trial #2 and params: {'n_layers': 7, 'n_units': 398, 'activation': 'selu', 'lr': 0.0006740122168012393, 'optimizer': 'AdamW'}
[I 2025-05-08 22:05:30,905] Trial 2 finished with value: 0.01976957730948925 and parameters: {'n_layers': 7, 'n_units': 398, 'activation': 'selu', 'lr': 0.0006740122168012393, 'optimizer': 'AdamW'}. Best is trial 1 with value: 0.0016687377355992794.
Training model with trial #3 and params: {'n_layers': 7, 'n_units': 201, 'activation': 'relu', 'lr': 0.0009136258953649835, 'optimizer': 'RAdam'}
[I 2025-05-08 22:54:39,210] Trial 3 finished with value: 0.001956719206646085 and parameters: {'n_layers': 7, 'n_units': 201, 'activation': 'relu', 'lr': 0.0009136258953649835, 'optimizer': 'RAdam'}. Best is trial 1 with value: 0.0016687377355992794.
Training model with trial #4 and params: {'n_layers': 6, 'n_units': 505, 'activation': 'sigmoid', 'lr': 0.006941153223309899, 'optimizer': 'adam'}
[I 2025-05-09 00:02:41,036] Trial 4 finished with value: 1.02762770652771 and parameters: {'n_layers': 6, 'n_units': 505, 'activation': 'sigmoid', 'lr': 0.006941153223309899, 'optimizer': 'adam'}. Best is trial 1 with value: 0.0016687377355992794.
Training model with trial #5 and params: {'n_layers': 7, 'n_units': 16, 'activation': 'tanh', 'lr': 0.00026185534234550646, 'optimizer': 'RAdam'}
[I 2025-05-09 00:47:38,753] Trial 5 finished with value: 0.0019549543503671885 and parameters: {'n_layers': 7, 'n_units': 16, 'activation': 'tanh', 'lr': 0.00026185534234550646, 'optimizer': 'RAdam'}. Best is trial 1 with value: 0.0016687377355992794.
Training model with trial #6 and params: {'n_layers': 4, 'n_units': 190, 'activation': 'relu', 'lr': 0.002653894386059018, 'optimizer': 'AdamW'}
[I 2025-05-09 00:58:57,121] Trial 6 finished with value: 0.0358617827296257 and parameters: {'n_layers': 4, 'n_units': 190, 'activation': 'relu', 'lr': 0.002653894386059018, 'optimizer': 'AdamW'}. Best is trial 1 with value: 0.0016687377355992794.
Training model with trial #7 and params: {'n_layers': 8, 'n_units': 143, 'activation': 'sigmoid', 'lr': 0.0007907944106674059, 'optimizer': 'AdamW'}
[I 2025-05-09 01:12:12,092] Trial 7 finished with value: 1.027663230895996 and parameters: {'n_layers': 8, 'n_units': 143, 'activation': 'sigmoid', 'lr': 0.0007907944106674059, 'optimizer': 'AdamW'}. Best is trial 1 with value: 0.0016687377355992794.
Training model with trial #8 and params: {'n_layers': 1, 'n_units': 397, 'activation': 'relu', 'lr': 0.0008325153920446373, 'optimizer': 'sgd'}
[I 2025-05-09 02:02:31,992] Trial 8 finished with value: 0.1497555524110794 and parameters: {'n_layers': 1, 'n_units': 397, 'activation': 'relu', 'lr': 0.0008325153920446373, 'optimizer': 'sgd'}. Best is trial 1 with value: 0.0016687377355992794.
Training model with trial #9 and params: {'n_layers': 5, 'n_units': 472, 'activation': 'tanh', 'lr': 0.0003610369864207531, 'optimizer': 'RAdam'}
[I 2025-05-09 04:01:56,541] Trial 9 finished with value: 0.0020246265921741724 and parameters: {'n_layers': 5, 'n_units': 472, 'activation': 'tanh', 'lr': 0.0003610369864207531, 'optimizer': 'RAdam'}. Best is trial 1 with value: 0.0016687377355992794.
Training model with trial #10 and params: {'n_layers': 10, 'n_units': 313, 'activation': 'leaky_relu', 'lr': 0.00012036716780892407, 'optimizer': 'adam'}
[I 2025-05-09 05:39:41,420] Trial 10 finished with value: 0.002799984999001026 and parameters: {'n_layers': 10, 'n_units': 313, 'activation': 'leaky_relu', 'lr': 0.00012036716780892407, 'optimizer': 'adam'}. Best is trial 1 with value: 0.0016687377355992794.
Training model with trial #11 and params: {'n_layers': 9, 'n_units': 20, 'activation': 'tanh', 'lr': 0.0002131381842224521, 'optimizer': 'RAdam'}
[I 2025-05-09 06:08:30,393] Trial 11 finished with value: 0.0016426608199253678 and parameters: {'n_layers': 9, 'n_units': 20, 'activation': 'tanh', 'lr': 0.0002131381842224521, 'optimizer': 'RAdam'}. Best is trial 11 with value: 0.0016426608199253678.
Training model with trial #12 and params: {'n_layers': 10, 'n_units': 22, 'activation': 'gelu', 'lr': 0.00010683546779866956, 'optimizer': 'RAdam'}
[I 2025-05-09 07:17:42,747] Trial 12 finished with value: 0.002194602508097887 and parameters: {'n_layers': 10, 'n_units': 22, 'activation': 'gelu', 'lr': 0.00010683546779866956, 'optimizer': 'RAdam'}. Best is trial 11 with value: 0.0016426608199253678.
Training model with trial #13 and params: {'n_layers': 9, 'n_units': 144, 'activation': 'swish', 'lr': 0.0002571866162529914, 'optimizer': 'RAdam'}
[I 2025-05-09 09:16:08,832] Trial 13 finished with value: 0.0012922438327223063 and parameters: {'n_layers': 9, 'n_units': 144, 'activation': 'swish', 'lr': 0.0002571866162529914, 'optimizer': 'RAdam'}. Best is trial 13 with value: 0.0012922438327223063.
Training model with trial #14 and params: {'n_layers': 9, 'n_units': 93, 'activation': 'swish', 'lr': 0.0002501834032294207, 'optimizer': 'sgd'}
[I 2025-05-09 16:35:45,019] Trial 14 finished with value: 0.11970186233520508 and parameters: {'n_layers': 9, 'n_units': 93, 'activation': 'swish', 'lr': 0.0002501834032294207, 'optimizer': 'sgd'}. Best is trial 13 with value: 0.0012922438327223063.
Training model with trial #15 and params: {'n_layers': 9, 'n_units': 85, 'activation': 'swish', 'lr': 0.00038490163545797486, 'optimizer': 'rmsprop'}
[I 2025-05-09 20:19:53,832] Trial 15 finished with value: 0.002225501462817192 and parameters: {'n_layers': 9, 'n_units': 85, 'activation': 'swish', 'lr': 0.00038490163545797486, 'optimizer': 'rmsprop'}. Best is trial 13 with value: 0.0012922438327223063.
Training model with trial #16 and params: {'n_layers': 9, 'n_units': 97, 'activation': 'tanh', 'lr': 0.00018048817422513876, 'optimizer': 'RAdam'}
[I 2025-05-09 21:12:14,697] Trial 16 finished with value: 0.002494656480848789 and parameters: {'n_layers': 9, 'n_units': 97, 'activation': 'tanh', 'lr': 0.00018048817422513876, 'optimizer': 'RAdam'}. Best is trial 13 with value: 0.0012922438327223063.
Training model with trial #17 and params: {'n_layers': 4, 'n_units': 204, 'activation': 'swish', 'lr': 0.00015915504297568805, 'optimizer': 'RAdam'}
[I 2025-05-09 22:58:14,439] Trial 17 finished with value: 0.001270859269425273 and parameters: {'n_layers': 4, 'n_units': 204, 'activation': 'swish', 'lr': 0.00015915504297568805, 'optimizer': 'RAdam'}. Best is trial 17 with value: 0.001270859269425273.
Training model with trial #18 and params: {'n_layers': 4, 'n_units': 217, 'activation': 'swish', 'lr': 0.0017961364320970123, 'optimizer': 'RAdam'}
[I 2025-05-09 23:54:09,536] Trial 18 finished with value: 0.0020634804386645555 and parameters: {'n_layers': 4, 'n_units': 217, 'activation': 'swish', 'lr': 0.0017961364320970123, 'optimizer': 'RAdam'}. Best is trial 17 with value: 0.001270859269425273.
Training model with trial #19 and params: {'n_layers': 3, 'n_units': 140, 'activation': 'swish', 'lr': 0.00036325236319198966, 'optimizer': 'sgd'}
[I 2025-05-10 02:57:50,526] Trial 19 finished with value: 0.05957227945327759 and parameters: {'n_layers': 3, 'n_units': 140, 'activation': 'swish', 'lr': 0.00036325236319198966, 'optimizer': 'sgd'}. Best is trial 17 with value: 0.001270859269425273.
Training model with trial #20 and params: {'n_layers': 5, 'n_units': 340, 'activation': 'swish', 'lr': 0.00015213572253435496, 'optimizer': 'rmsprop'}
[I 2025-05-10 05:21:25,974] Trial 20 finished with value: 0.0023842237424105406 and parameters: {'n_layers': 5, 'n_units': 340, 'activation': 'swish', 'lr': 0.00015213572253435496, 'optimizer': 'rmsprop'}. Best is trial 17 with value: 0.001270859269425273.
Training model with trial #21 and params: {'n_layers': 8, 'n_units': 152, 'activation': 'selu', 'lr': 0.00020570204446905113, 'optimizer': 'RAdam'}
[I 2025-05-10 05:54:57,827] Trial 21 finished with value: 0.0017125620506703854 and parameters: {'n_layers': 8, 'n_units': 152, 'activation': 'selu', 'lr': 0.00020570204446905113, 'optimizer': 'RAdam'}. Best is trial 17 with value: 0.001270859269425273.
Training model with trial #22 and params: {'n_layers': 3, 'n_units': 231, 'activation': 'gelu', 'lr': 0.00010668604475210327, 'optimizer': 'RAdam'}
[I 2025-05-10 07:31:50,561] Trial 22 finished with value: 0.000948670320212841 and parameters: {'n_layers': 3, 'n_units': 231, 'activation': 'gelu', 'lr': 0.00010668604475210327, 'optimizer': 'RAdam'}. Best is trial 22 with value: 0.000948670320212841.
Training model with trial #23 and params: {'n_layers': 3, 'n_units': 226, 'activation': 'gelu', 'lr': 0.00013182491543839182, 'optimizer': 'RAdam'}
[I 2025-05-10 08:38:08,062] Trial 23 finished with value: 0.001188335008919239 and parameters: {'n_layers': 3, 'n_units': 226, 'activation': 'gelu', 'lr': 0.00013182491543839182, 'optimizer': 'RAdam'}. Best is trial 22 with value: 0.000948670320212841.
Training model with trial #24 and params: {'n_layers': 3, 'n_units': 238, 'activation': 'gelu', 'lr': 0.00010159721861008843, 'optimizer': 'RAdam'}
[I 2025-05-10 09:56:09,968] Trial 24 finished with value: 0.0010165204294025898 and parameters: {'n_layers': 3, 'n_units': 238, 'activation': 'gelu', 'lr': 0.00010159721861008843, 'optimizer': 'RAdam'}. Best is trial 22 with value: 0.000948670320212841.
Training model with trial #25 and params: {'n_layers': 2, 'n_units': 244, 'activation': 'gelu', 'lr': 0.00011801240892990511, 'optimizer': 'adam'}
[I 2025-05-10 11:39:38,281] Trial 25 finished with value: 0.0012879358837381005 and parameters: {'n_layers': 2, 'n_units': 244, 'activation': 'gelu', 'lr': 0.00011801240892990511, 'optimizer': 'adam'}. Best is trial 22 with value: 0.000948670320212841.
Training model with trial #26 and params: {'n_layers': 3, 'n_units': 346, 'activation': 'gelu', 'lr': 0.00010353532825157836, 'optimizer': 'RAdam'}
[I 2025-05-10 13:54:51,941] Trial 26 finished with value: 0.0012851619394496083 and parameters: {'n_layers': 3, 'n_units': 346, 'activation': 'gelu', 'lr': 0.00010353532825157836, 'optimizer': 'RAdam'}. Best is trial 22 with value: 0.000948670320212841.
Training model with trial #27 and params: {'n_layers': 1, 'n_units': 225, 'activation': 'gelu', 'lr': 0.0005178542236348271, 'optimizer': 'RAdam'}
[I 2025-05-10 14:15:09,089] Trial 27 finished with value: 0.008136522956192493 and parameters: {'n_layers': 1, 'n_units': 225, 'activation': 'gelu', 'lr': 0.0005178542236348271, 'optimizer': 'RAdam'}. Best is trial 22 with value: 0.000948670320212841.
Training model with trial #28 and params: {'n_layers': 3, 'n_units': 260, 'activation': 'gelu', 'lr': 0.00014342647746465355, 'optimizer': 'RAdam'}
[I 2025-05-10 15:35:55,761] Trial 28 finished with value: 0.0012057560961693525 and parameters: {'n_layers': 3, 'n_units': 260, 'activation': 'gelu', 'lr': 0.00014342647746465355, 'optimizer': 'RAdam'}. Best is trial 22 with value: 0.000948670320212841.
Training model with trial #29 and params: {'n_layers': 2, 'n_units': 295, 'activation': 'elu', 'lr': 0.0016966344612226734, 'optimizer': 'rmsprop'}
[I 2025-05-10 16:39:37,113] Trial 29 finished with value: 0.0018629499245435 and parameters: {'n_layers': 2, 'n_units': 295, 'activation': 'elu', 'lr': 0.0016966344612226734, 'optimizer': 'rmsprop'}. Best is trial 22 with value: 0.000948670320212841.
Training model with trial #30 and params: {'n_layers': 2, 'n_units': 172, 'activation': 'gelu', 'lr': 0.007888848112133588, 'optimizer': 'adam'}
[I 2025-05-10 17:08:52,383] Trial 30 finished with value: 0.004952097777277231 and parameters: {'n_layers': 2, 'n_units': 172, 'activation': 'gelu', 'lr': 0.007888848112133588, 'optimizer': 'adam'}. Best is trial 22 with value: 0.000948670320212841.
Training model with trial #31 and params: {'n_layers': 3, 'n_units': 249, 'activation': 'gelu', 'lr': 0.00015652354319702053, 'optimizer': 'RAdam'}
[I 2025-05-10 18:09:11,311] Trial 31 finished with value: 0.0013652521884068847 and parameters: {'n_layers': 3, 'n_units': 249, 'activation': 'gelu', 'lr': 0.00015652354319702053, 'optimizer': 'RAdam'}. Best is trial 22 with value: 0.000948670320212841.
Training model with trial #32 and params: {'n_layers': 3, 'n_units': 269, 'activation': 'gelu', 'lr': 0.0001380894292448778, 'optimizer': 'RAdam'}
[I 2025-05-10 19:35:23,924] Trial 32 finished with value: 0.0009893127717077732 and parameters: {'n_layers': 3, 'n_units': 269, 'activation': 'gelu', 'lr': 0.0001380894292448778, 'optimizer': 'RAdam'}. Best is trial 22 with value: 0.000948670320212841.
Training model with trial #33 and params: {'n_layers': 4, 'n_units': 278, 'activation': 'gelu', 'lr': 0.00010354806374755267, 'optimizer': 'RAdam'}
[I 2025-05-10 20:39:21,994] Trial 33 finished with value: 0.001117398962378502 and parameters: {'n_layers': 4, 'n_units': 278, 'activation': 'gelu', 'lr': 0.00010354806374755267, 'optimizer': 'RAdam'}. Best is trial 22 with value: 0.000948670320212841.
Training model with trial #34 and params: {'n_layers': 4, 'n_units': 278, 'activation': 'gelu', 'lr': 0.0001015653727399234, 'optimizer': 'AdamW'}
[I 2025-05-10 21:03:56,910] Trial 34 finished with value: 0.22152511775493622 and parameters: {'n_layers': 4, 'n_units': 278, 'activation': 'gelu', 'lr': 0.0001015653727399234, 'optimizer': 'AdamW'}. Best is trial 22 with value: 0.000948670320212841.
Training model with trial #35 and params: {'n_layers': 5, 'n_units': 321, 'activation': 'elu', 'lr': 0.003765502581437261, 'optimizer': 'RAdam'}
[I 2025-05-10 21:42:28,526] Trial 35 finished with value: 0.002229943871498108 and parameters: {'n_layers': 5, 'n_units': 321, 'activation': 'elu', 'lr': 0.003765502581437261, 'optimizer': 'RAdam'}. Best is trial 22 with value: 0.000948670320212841.
Training model with trial #36 and params: {'n_layers': 2, 'n_units': 384, 'activation': 'gelu', 'lr': 0.00030685778698561226, 'optimizer': 'RAdam'}
[I 2025-05-10 22:46:47,379] Trial 36 finished with value: 0.0013632598565891385 and parameters: {'n_layers': 2, 'n_units': 384, 'activation': 'gelu', 'lr': 0.00030685778698561226, 'optimizer': 'RAdam'}. Best is trial 22 with value: 0.000948670320212841.
Training model with trial #37 and params: {'n_layers': 4, 'n_units': 369, 'activation': 'leaky_relu', 'lr': 0.00021502663298460903, 'optimizer': 'RAdam'}
[I 2025-05-11 01:16:57,504] Trial 37 finished with value: 0.0019266273593530059 and parameters: {'n_layers': 4, 'n_units': 369, 'activation': 'leaky_relu', 'lr': 0.00021502663298460903, 'optimizer': 'RAdam'}. Best is trial 22 with value: 0.000948670320212841.
Training model with trial #38 and params: {'n_layers': 6, 'n_units': 434, 'activation': 'sigmoid', 'lr': 0.00017387271195232375, 'optimizer': 'AdamW'}
[I 2025-05-11 01:43:46,879] Trial 38 finished with value: 0.5145016312599182 and parameters: {'n_layers': 6, 'n_units': 434, 'activation': 'sigmoid', 'lr': 0.00017387271195232375, 'optimizer': 'AdamW'}. Best is trial 22 with value: 0.000948670320212841.
Training model with trial #39 and params: {'n_layers': 1, 'n_units': 281, 'activation': 'selu', 'lr': 0.001359032994148267, 'optimizer': 'sgd'}
[I 2025-05-11 02:32:41,091] Trial 39 finished with value: 0.07694604247808456 and parameters: {'n_layers': 1, 'n_units': 281, 'activation': 'selu', 'lr': 0.001359032994148267, 'optimizer': 'sgd'}. Best is trial 22 with value: 0.000948670320212841.
Training model with trial #40 and params: {'n_layers': 5, 'n_units': 182, 'activation': 'gelu', 'lr': 0.00012848796515116422, 'optimizer': 'rmsprop'}
[I 2025-05-11 03:22:52,114] Trial 40 finished with value: 0.0022665485739707947 and parameters: {'n_layers': 5, 'n_units': 182, 'activation': 'gelu', 'lr': 0.00012848796515116422, 'optimizer': 'rmsprop'}. Best is trial 22 with value: 0.000948670320212841.
Training model with trial #41 and params: {'n_layers': 3, 'n_units': 231, 'activation': 'gelu', 'lr': 0.0001335250231764121, 'optimizer': 'RAdam'}
[I 2025-05-11 04:18:23,407] Trial 41 finished with value: 0.0009718679939396679 and parameters: {'n_layers': 3, 'n_units': 231, 'activation': 'gelu', 'lr': 0.0001335250231764121, 'optimizer': 'RAdam'}. Best is trial 22 with value: 0.000948670320212841.
Training model with trial #42 and params: {'n_layers': 3, 'n_units': 306, 'activation': 'gelu', 'lr': 0.0005341408228447834, 'optimizer': 'RAdam'}
[I 2025-05-11 05:26:24,123] Trial 42 finished with value: 0.0015656471950933337 and parameters: {'n_layers': 3, 'n_units': 306, 'activation': 'gelu', 'lr': 0.0005341408228447834, 'optimizer': 'RAdam'}. Best is trial 22 with value: 0.000948670320212841.
Training model with trial #43 and params: {'n_layers': 4, 'n_units': 243, 'activation': 'gelu', 'lr': 0.00019440013839719687, 'optimizer': 'RAdam'}
[I 2025-05-11 06:06:47,580] Trial 43 finished with value: 0.001446096459403634 and parameters: {'n_layers': 4, 'n_units': 243, 'activation': 'gelu', 'lr': 0.00019440013839719687, 'optimizer': 'RAdam'}. Best is trial 22 with value: 0.000948670320212841.
Training model with trial #44 and params: {'n_layers': 3, 'n_units': 276, 'activation': 'relu', 'lr': 0.00012858647138249405, 'optimizer': 'RAdam'}
[I 2025-05-11 07:10:57,222] Trial 44 finished with value: 0.0013388117076829076 and parameters: {'n_layers': 3, 'n_units': 276, 'activation': 'relu', 'lr': 0.00012858647138249405, 'optimizer': 'RAdam'}. Best is trial 22 with value: 0.000948670320212841.
Training model with trial #45 and params: {'n_layers': 2, 'n_units': 330, 'activation': 'gelu', 'lr': 0.00010363743084712715, 'optimizer': 'RAdam'}
