[I 2025-05-13 05:15:40,256] Trial 99 finished with value: 0.002639767248183489 and parameters: {'n_layers': 3, 'n_units': 121, 'activation': 'selu', 'lr': 0.003594839345873188, 'optimizer': 'rmsprop'}. Best is trial 62 with value: 0.0007213951903395355.
Beste Parameter:
{'n_layers': 4, 'n_units': 119, 'activation': 'selu', 'lr': 0.00013856078561462902, 'optimizer': 'RAdam'}
