[I 2025-05-11 09:38:21,614] Trial 45 finished with value: 0.0008535598171874881 and parameters: {'n_layers': 2, 'n_units': 330, 'activation': 'gelu', 'lr': 0.00010363743084712715, 'optimizer': 'RAdam'}. Best is trial 45 with value: 0.0008535598171874881.
Training model with trial #46 and params: {'n_layers': 2, 'n_units': 333, 'activation': 'leaky_relu', 'lr': 0.0002654664267560516, 'optimizer': 'adam'}
[I 2025-05-11 11:19:19,483] Trial 46 finished with value: 0.0019257698440924287 and parameters: {'n_layers': 2, 'n_units': 333, 'activation': 'leaky_relu', 'lr': 0.0002654664267560516, 'optimizer': 'adam'}. Best is trial 45 with value: 0.0008535598171874881.
Training model with trial #47 and params: {'n_layers': 1, 'n_units': 431, 'activation': 'sigmoid', 'lr': 0.00015687580015568336, 'optimizer': 'RAdam'}
[I 2025-05-11 12:53:29,618] Trial 47 finished with value: 0.014189308509230614 and parameters: {'n_layers': 1, 'n_units': 431, 'activation': 'sigmoid', 'lr': 0.00015687580015568336, 'optimizer': 'RAdam'}. Best is trial 45 with value: 0.0008535598171874881.
Training model with trial #48 and params: {'n_layers': 2, 'n_units': 357, 'activation': 'gelu', 'lr': 0.003978171738765152, 'optimizer': 'AdamW'}
[I 2025-05-11 13:16:18,522] Trial 48 finished with value: 0.01221699733287096 and parameters: {'n_layers': 2, 'n_units': 357, 'activation': 'gelu', 'lr': 0.003978171738765152, 'optimizer': 'AdamW'}. Best is trial 45 with value: 0.0008535598171874881.
Training model with trial #49 and params: {'n_layers': 1, 'n_units': 200, 'activation': 'gelu', 'lr': 0.00047350742057177816, 'optimizer': 'RAdam'}
[I 2025-05-11 13:47:23,831] Trial 49 finished with value: 0.005139429587870836 and parameters: {'n_layers': 1, 'n_units': 200, 'activation': 'gelu', 'lr': 0.00047350742057177816, 'optimizer': 'RAdam'}. Best is trial 45 with value: 0.0008535598171874881.
Training model with trial #50 and params: {'n_layers': 2, 'n_units': 298, 'activation': 'relu', 'lr': 0.001092320315320972, 'optimizer': 'sgd'}
[I 2025-05-11 15:10:13,693] Trial 50 finished with value: 0.03876280039548874 and parameters: {'n_layers': 2, 'n_units': 298, 'activation': 'relu', 'lr': 0.001092320315320972, 'optimizer': 'sgd'}. Best is trial 45 with value: 0.0008535598171874881.
Training model with trial #51 and params: {'n_layers': 4, 'n_units': 263, 'activation': 'gelu', 'lr': 0.00010167141722971868, 'optimizer': 'RAdam'}
[I 2025-05-11 16:22:03,332] Trial 51 finished with value: 0.0012364387512207031 and parameters: {'n_layers': 4, 'n_units': 263, 'activation': 'gelu', 'lr': 0.00010167141722971868, 'optimizer': 'RAdam'}. Best is trial 45 with value: 0.0008535598171874881.
Training model with trial #52 and params: {'n_layers': 3, 'n_units': 228, 'activation': 'gelu', 'lr': 0.00011620034559630572, 'optimizer': 'RAdam'}
[I 2025-05-11 17:30:32,523] Trial 52 finished with value: 0.0010584491537883878 and parameters: {'n_layers': 3, 'n_units': 228, 'activation': 'gelu', 'lr': 0.00011620034559630572, 'optimizer': 'RAdam'}. Best is trial 45 with value: 0.0008535598171874881.
Training model with trial #53 and params: {'n_layers': 3, 'n_units': 164, 'activation': 'gelu', 'lr': 0.00012678190766605852, 'optimizer': 'RAdam'}
[I 2025-05-11 18:20:48,516] Trial 53 finished with value: 0.0011077058734372258 and parameters: {'n_layers': 3, 'n_units': 164, 'activation': 'gelu', 'lr': 0.00012678190766605852, 'optimizer': 'RAdam'}. Best is trial 45 with value: 0.0008535598171874881.
Training model with trial #54 and params: {'n_layers': 2, 'n_units': 217, 'activation': 'gelu', 'lr': 0.00023448683330676214, 'optimizer': 'RAdam'}
[I 2025-05-11 19:30:30,072] Trial 54 finished with value: 0.0012568457750603557 and parameters: {'n_layers': 2, 'n_units': 217, 'activation': 'gelu', 'lr': 0.00023448683330676214, 'optimizer': 'RAdam'}. Best is trial 45 with value: 0.0008535598171874881.
Training model with trial #55 and params: {'n_layers': 3, 'n_units': 127, 'activation': 'tanh', 'lr': 0.0001809441779502901, 'optimizer': 'RAdam'}
[I 2025-05-11 20:14:25,024] Trial 55 finished with value: 0.0010624807327985764 and parameters: {'n_layers': 3, 'n_units': 127, 'activation': 'tanh', 'lr': 0.0001809441779502901, 'optimizer': 'RAdam'}. Best is trial 45 with value: 0.0008535598171874881.
Training model with trial #56 and params: {'n_layers': 3, 'n_units': 235, 'activation': 'gelu', 'lr': 0.00030181668921023126, 'optimizer': 'RAdam'}
[I 2025-05-11 21:14:43,577] Trial 56 finished with value: 0.0013583172112703323 and parameters: {'n_layers': 3, 'n_units': 235, 'activation': 'gelu', 'lr': 0.00030181668921023126, 'optimizer': 'RAdam'}. Best is trial 45 with value: 0.0008535598171874881.
Training model with trial #57 and params: {'n_layers': 3, 'n_units': 194, 'activation': 'selu', 'lr': 0.00014000160904153848, 'optimizer': 'RAdam'}
[I 2025-05-11 22:20:55,824] Trial 57 finished with value: 0.0007644507568329573 and parameters: {'n_layers': 3, 'n_units': 194, 'activation': 'selu', 'lr': 0.00014000160904153848, 'optimizer': 'RAdam'}. Best is trial 57 with value: 0.0007644507568329573.
Training model with trial #58 and params: {'n_layers': 4, 'n_units': 199, 'activation': 'selu', 'lr': 0.00014357160690972685, 'optimizer': 'RAdam'}
[I 2025-05-11 23:03:33,348] Trial 58 finished with value: 0.0008547526085749269 and parameters: {'n_layers': 4, 'n_units': 199, 'activation': 'selu', 'lr': 0.00014357160690972685, 'optimizer': 'RAdam'}. Best is trial 57 with value: 0.0007644507568329573.
Training model with trial #59 and params: {'n_layers': 5, 'n_units': 192, 'activation': 'selu', 'lr': 0.00014830100144295927, 'optimizer': 'rmsprop'}
[I 2025-05-11 23:50:39,121] Trial 59 finished with value: 0.0010762966703623533 and parameters: {'n_layers': 5, 'n_units': 192, 'activation': 'selu', 'lr': 0.00014830100144295927, 'optimizer': 'rmsprop'}. Best is trial 57 with value: 0.0007644507568329573.
Training model with trial #60 and params: {'n_layers': 4, 'n_units': 204, 'activation': 'selu', 'lr': 0.00017872179522244154, 'optimizer': 'RAdam'}
[I 2025-05-12 00:49:32,730] Trial 60 finished with value: 0.0007739537977613509 and parameters: {'n_layers': 4, 'n_units': 204, 'activation': 'selu', 'lr': 0.00017872179522244154, 'optimizer': 'RAdam'}. Best is trial 57 with value: 0.0007644507568329573.
Training model with trial #61 and params: {'n_layers': 4, 'n_units': 208, 'activation': 'selu', 'lr': 0.00017990290954415677, 'optimizer': 'RAdam'}
[I 2025-05-12 01:55:18,456] Trial 61 finished with value: 0.0014485527062788606 and parameters: {'n_layers': 4, 'n_units': 208, 'activation': 'selu', 'lr': 0.00017990290954415677, 'optimizer': 'RAdam'}. Best is trial 57 with value: 0.0007644507568329573.
Training model with trial #62 and params: {'n_layers': 4, 'n_units': 119, 'activation': 'selu', 'lr': 0.00013856078561462902, 'optimizer': 'RAdam'}
[I 2025-05-12 02:52:19,069] Trial 62 finished with value: 0.0007213951903395355 and parameters: {'n_layers': 4, 'n_units': 119, 'activation': 'selu', 'lr': 0.00013856078561462902, 'optimizer': 'RAdam'}. Best is trial 62 with value: 0.0007213951903395355.
Training model with trial #63 and params: {'n_layers': 6, 'n_units': 116, 'activation': 'selu', 'lr': 0.000212634111797656, 'optimizer': 'RAdam'}
[I 2025-05-12 03:27:08,947] Trial 63 finished with value: 0.0014104547444730997 and parameters: {'n_layers': 6, 'n_units': 116, 'activation': 'selu', 'lr': 0.000212634111797656, 'optimizer': 'RAdam'}. Best is trial 62 with value: 0.0007213951903395355.
Training model with trial #64 and params: {'n_layers': 4, 'n_units': 46, 'activation': 'selu', 'lr': 0.00012036899869266819, 'optimizer': 'RAdam'}
[I 2025-05-12 04:13:55,046] Trial 64 finished with value: 0.001400098204612732 and parameters: {'n_layers': 4, 'n_units': 46, 'activation': 'selu', 'lr': 0.00012036899869266819, 'optimizer': 'RAdam'}. Best is trial 62 with value: 0.0007213951903395355.
Training model with trial #65 and params: {'n_layers': 5, 'n_units': 68, 'activation': 'selu', 'lr': 0.00016765583320819762, 'optimizer': 'adam'}
[I 2025-05-12 04:43:49,030] Trial 65 finished with value: 0.0013821028405800462 and parameters: {'n_layers': 5, 'n_units': 68, 'activation': 'selu', 'lr': 0.00016765583320819762, 'optimizer': 'adam'}. Best is trial 62 with value: 0.0007213951903395355.
Training model with trial #66 and params: {'n_layers': 4, 'n_units': 161, 'activation': 'selu', 'lr': 0.0002941089292714323, 'optimizer': 'RAdam'}
[I 2025-05-12 05:06:00,635] Trial 66 finished with value: 0.0011361577780917287 and parameters: {'n_layers': 4, 'n_units': 161, 'activation': 'selu', 'lr': 0.0002941089292714323, 'optimizer': 'RAdam'}. Best is trial 62 with value: 0.0007213951903395355.
Training model with trial #67 and params: {'n_layers': 4, 'n_units': 182, 'activation': 'selu', 'lr': 0.00014833645711341282, 'optimizer': 'sgd'}
[I 2025-05-12 06:20:39,385] Trial 67 finished with value: 0.05534224212169647 and parameters: {'n_layers': 4, 'n_units': 182, 'activation': 'selu', 'lr': 0.00014833645711341282, 'optimizer': 'sgd'}. Best is trial 62 with value: 0.0007213951903395355.
Training model with trial #68 and params: {'n_layers': 5, 'n_units': 112, 'activation': 'selu', 'lr': 0.0006478115781863799, 'optimizer': 'RAdam'}
[I 2025-05-12 07:00:14,092] Trial 68 finished with value: 0.0007499268394894898 and parameters: {'n_layers': 5, 'n_units': 112, 'activation': 'selu', 'lr': 0.0006478115781863799, 'optimizer': 'RAdam'}. Best is trial 62 with value: 0.0007213951903395355.
Training model with trial #69 and params: {'n_layers': 6, 'n_units': 117, 'activation': 'selu', 'lr': 0.00043295517139656383, 'optimizer': 'AdamW'}
[I 2025-05-12 07:20:16,581] Trial 69 finished with value: 0.030810227617621422 and parameters: {'n_layers': 6, 'n_units': 117, 'activation': 'selu', 'lr': 0.00043295517139656383, 'optimizer': 'AdamW'}. Best is trial 62 with value: 0.0007213951903395355.
Training model with trial #70 and params: {'n_layers': 5, 'n_units': 68, 'activation': 'selu', 'lr': 0.0006712849895620107, 'optimizer': 'RAdam'}
[I 2025-05-12 07:50:19,076] Trial 70 finished with value: 0.0009024699102155864 and parameters: {'n_layers': 5, 'n_units': 68, 'activation': 'selu', 'lr': 0.0006712849895620107, 'optimizer': 'RAdam'}. Best is trial 62 with value: 0.0007213951903395355.
Training model with trial #71 and params: {'n_layers': 5, 'n_units': 133, 'activation': 'selu', 'lr': 0.0006401822771568396, 'optimizer': 'RAdam'}
[I 2025-05-12 08:22:31,167] Trial 71 finished with value: 0.0011273566633462906 and parameters: {'n_layers': 5, 'n_units': 133, 'activation': 'selu', 'lr': 0.0006401822771568396, 'optimizer': 'RAdam'}. Best is trial 62 with value: 0.0007213951903395355.
Training model with trial #72 and params: {'n_layers': 5, 'n_units': 57, 'activation': 'selu', 'lr': 0.0007003430448831946, 'optimizer': 'RAdam'}
[I 2025-05-12 08:51:43,474] Trial 72 finished with value: 0.001586869009770453 and parameters: {'n_layers': 5, 'n_units': 57, 'activation': 'selu', 'lr': 0.0007003430448831946, 'optimizer': 'RAdam'}. Best is trial 62 with value: 0.0007213951903395355.
Training model with trial #73 and params: {'n_layers': 7, 'n_units': 100, 'activation': 'selu', 'lr': 0.0009204916535927486, 'optimizer': 'RAdam'}
[I 2025-05-12 09:22:30,448] Trial 73 finished with value: 0.0014176088152453303 and parameters: {'n_layers': 7, 'n_units': 100, 'activation': 'selu', 'lr': 0.0009204916535927486, 'optimizer': 'RAdam'}. Best is trial 62 with value: 0.0007213951903395355.
Training model with trial #74 and params: {'n_layers': 5, 'n_units': 78, 'activation': 'selu', 'lr': 0.00011616431010046626, 'optimizer': 'RAdam'}
[I 2025-05-12 09:58:58,485] Trial 74 finished with value: 0.0009127315133810043 and parameters: {'n_layers': 5, 'n_units': 78, 'activation': 'selu', 'lr': 0.00011616431010046626, 'optimizer': 'RAdam'}. Best is trial 62 with value: 0.0007213951903395355.
Training model with trial #75 and params: {'n_layers': 5, 'n_units': 31, 'activation': 'selu', 'lr': 0.0011955651589143509, 'optimizer': 'RAdam'}
[I 2025-05-12 10:31:41,153] Trial 75 finished with value: 0.0011435411870479584 and parameters: {'n_layers': 5, 'n_units': 31, 'activation': 'selu', 'lr': 0.0011955651589143509, 'optimizer': 'RAdam'}. Best is trial 62 with value: 0.0007213951903395355.
Training model with trial #76 and params: {'n_layers': 6, 'n_units': 87, 'activation': 'selu', 'lr': 0.0003806760630641037, 'optimizer': 'RAdam'}
[I 2025-05-12 11:04:49,869] Trial 76 finished with value: 0.0016733526717871428 and parameters: {'n_layers': 6, 'n_units': 87, 'activation': 'selu', 'lr': 0.0003806760630641037, 'optimizer': 'RAdam'}. Best is trial 62 with value: 0.0007213951903395355.
Training model with trial #77 and params: {'n_layers': 6, 'n_units': 76, 'activation': 'selu', 'lr': 0.0006576794785545056, 'optimizer': 'RAdam'}
[I 2025-05-12 11:30:45,506] Trial 77 finished with value: 0.0011536816600710154 and parameters: {'n_layers': 6, 'n_units': 76, 'activation': 'selu', 'lr': 0.0006576794785545056, 'optimizer': 'RAdam'}. Best is trial 62 with value: 0.0007213951903395355.
Training model with trial #78 and params: {'n_layers': 5, 'n_units': 101, 'activation': 'selu', 'lr': 0.00023171288020215427, 'optimizer': 'RAdam'}
[I 2025-05-12 12:14:28,235] Trial 78 finished with value: 0.00110262306407094 and parameters: {'n_layers': 5, 'n_units': 101, 'activation': 'selu', 'lr': 0.00023171288020215427, 'optimizer': 'RAdam'}. Best is trial 62 with value: 0.0007213951903395355.
Training model with trial #79 and params: {'n_layers': 4, 'n_units': 148, 'activation': 'elu', 'lr': 0.00011187708443669798, 'optimizer': 'rmsprop'}
[I 2025-05-12 13:04:42,837] Trial 79 finished with value: 0.0025004022754728794 and parameters: {'n_layers': 4, 'n_units': 148, 'activation': 'elu', 'lr': 0.00011187708443669798, 'optimizer': 'rmsprop'}. Best is trial 62 with value: 0.0007213951903395355.
Training model with trial #80 and params: {'n_layers': 5, 'n_units': 113, 'activation': 'selu', 'lr': 0.0007956350273452747, 'optimizer': 'adam'}
[I 2025-05-12 13:32:10,605] Trial 80 finished with value: 0.0010677246609702706 and parameters: {'n_layers': 5, 'n_units': 113, 'activation': 'selu', 'lr': 0.0007956350273452747, 'optimizer': 'adam'}. Best is trial 62 with value: 0.0007213951903395355.
Training model with trial #81 and params: {'n_layers': 4, 'n_units': 57, 'activation': 'selu', 'lr': 0.00013647229739469446, 'optimizer': 'RAdam'}
[I 2025-05-12 14:07:32,715] Trial 81 finished with value: 0.000999935669824481 and parameters: {'n_layers': 4, 'n_units': 57, 'activation': 'selu', 'lr': 0.00013647229739469446, 'optimizer': 'RAdam'}. Best is trial 62 with value: 0.0007213951903395355.
Training model with trial #82 and params: {'n_layers': 5, 'n_units': 31, 'activation': 'selu', 'lr': 0.00018821933177005928, 'optimizer': 'RAdam'}
[I 2025-05-12 14:43:25,913] Trial 82 finished with value: 0.0016748849302530289 and parameters: {'n_layers': 5, 'n_units': 31, 'activation': 'selu', 'lr': 0.00018821933177005928, 'optimizer': 'RAdam'}. Best is trial 62 with value: 0.0007213951903395355.
Training model with trial #83 and params: {'n_layers': 4, 'n_units': 72, 'activation': 'tanh', 'lr': 0.0001130427475514404, 'optimizer': 'RAdam'}
[I 2025-05-12 15:45:04,371] Trial 83 finished with value: 0.0011195680126547813 and parameters: {'n_layers': 4, 'n_units': 72, 'activation': 'tanh', 'lr': 0.0001130427475514404, 'optimizer': 'RAdam'}. Best is trial 62 with value: 0.0007213951903395355.
Training model with trial #84 and params: {'n_layers': 5, 'n_units': 172, 'activation': 'leaky_relu', 'lr': 0.002443317996242605, 'optimizer': 'RAdam'}
[I 2025-05-12 16:35:40,631] Trial 84 finished with value: 0.0010845422511920333 and parameters: {'n_layers': 5, 'n_units': 172, 'activation': 'leaky_relu', 'lr': 0.002443317996242605, 'optimizer': 'RAdam'}. Best is trial 62 with value: 0.0007213951903395355.
Training model with trial #85 and params: {'n_layers': 7, 'n_units': 212, 'activation': 'sigmoid', 'lr': 0.00016751793798597893, 'optimizer': 'RAdam'}
[I 2025-05-12 19:14:23,791] Trial 85 finished with value: 0.0012867782497778535 and parameters: {'n_layers': 7, 'n_units': 212, 'activation': 'sigmoid', 'lr': 0.00016751793798597893, 'optimizer': 'RAdam'}. Best is trial 62 with value: 0.0007213951903395355.
Training model with trial #86 and params: {'n_layers': 4, 'n_units': 190, 'activation': 'selu', 'lr': 0.0005647972279869186, 'optimizer': 'RAdam'}
[I 2025-05-12 20:07:47,674] Trial 86 finished with value: 0.0009365624864585698 and parameters: {'n_layers': 4, 'n_units': 190, 'activation': 'selu', 'lr': 0.0005647972279869186, 'optimizer': 'RAdam'}. Best is trial 62 with value: 0.0007213951903395355.
Training model with trial #87 and params: {'n_layers': 4, 'n_units': 130, 'activation': 'selu', 'lr': 0.000619137679625572, 'optimizer': 'RAdam'}
[I 2025-05-12 20:29:13,952] Trial 87 finished with value: 0.0011741133639588952 and parameters: {'n_layers': 4, 'n_units': 130, 'activation': 'selu', 'lr': 0.000619137679625572, 'optimizer': 'RAdam'}. Best is trial 62 with value: 0.0007213951903395355.
Training model with trial #88 and params: {'n_layers': 4, 'n_units': 151, 'activation': 'selu', 'lr': 0.0008974637828226811, 'optimizer': 'sgd'}
[I 2025-05-12 21:45:52,277] Trial 88 finished with value: 0.015353300608694553 and parameters: {'n_layers': 4, 'n_units': 151, 'activation': 'selu', 'lr': 0.0008974637828226811, 'optimizer': 'sgd'}. Best is trial 62 with value: 0.0007213951903395355.
Training model with trial #89 and params: {'n_layers': 6, 'n_units': 198, 'activation': 'selu', 'lr': 0.0005595292868422718, 'optimizer': 'AdamW'}
[I 2025-05-12 22:00:12,672] Trial 89 finished with value: 0.024873776361346245 and parameters: {'n_layers': 6, 'n_units': 198, 'activation': 'selu', 'lr': 0.0005595292868422718, 'optimizer': 'AdamW'}. Best is trial 62 with value: 0.0007213951903395355.
Training model with trial #90 and params: {'n_layers': 5, 'n_units': 180, 'activation': 'relu', 'lr': 0.0007349654114031064, 'optimizer': 'RAdam'}
[I 2025-05-12 22:42:56,875] Trial 90 finished with value: 0.0017556707607582211 and parameters: {'n_layers': 5, 'n_units': 180, 'activation': 'relu', 'lr': 0.0007349654114031064, 'optimizer': 'RAdam'}. Best is trial 62 with value: 0.0007213951903395355.
Training model with trial #91 and params: {'n_layers': 3, 'n_units': 164, 'activation': 'selu', 'lr': 0.00014014740428348803, 'optimizer': 'RAdam'}
[I 2025-05-12 23:31:47,708] Trial 91 finished with value: 0.0008432915201410651 and parameters: {'n_layers': 3, 'n_units': 164, 'activation': 'selu', 'lr': 0.00014014740428348803, 'optimizer': 'RAdam'}. Best is trial 62 with value: 0.0007213951903395355.
Training model with trial #92 and params: {'n_layers': 4, 'n_units': 163, 'activation': 'selu', 'lr': 0.00012177806542713799, 'optimizer': 'RAdam'}
[I 2025-05-13 00:44:12,414] Trial 92 finished with value: 0.0009710529120638967 and parameters: {'n_layers': 4, 'n_units': 163, 'activation': 'selu', 'lr': 0.00012177806542713799, 'optimizer': 'RAdam'}. Best is trial 62 with value: 0.0007213951903395355.
Training model with trial #93 and params: {'n_layers': 3, 'n_units': 140, 'activation': 'selu', 'lr': 0.00042029402202673047, 'optimizer': 'RAdam'}
[I 2025-05-13 01:09:53,999] Trial 93 finished with value: 0.0012341942638158798 and parameters: {'n_layers': 3, 'n_units': 140, 'activation': 'selu', 'lr': 0.00042029402202673047, 'optimizer': 'RAdam'}. Best is trial 62 with value: 0.0007213951903395355.
Training model with trial #94 and params: {'n_layers': 4, 'n_units': 82, 'activation': 'selu', 'lr': 0.00014294988752632553, 'optimizer': 'RAdam'}
[I 2025-05-13 01:48:44,076] Trial 94 finished with value: 0.0007313887472264469 and parameters: {'n_layers': 4, 'n_units': 82, 'activation': 'selu', 'lr': 0.00014294988752632553, 'optimizer': 'RAdam'}. Best is trial 62 with value: 0.0007213951903395355.
Training model with trial #95 and params: {'n_layers': 2, 'n_units': 108, 'activation': 'swish', 'lr': 0.00014800673360741058, 'optimizer': 'RAdam'}
[I 2025-05-13 03:05:34,923] Trial 95 finished with value: 0.003395801642909646 and parameters: {'n_layers': 2, 'n_units': 108, 'activation': 'swish', 'lr': 0.00014800673360741058, 'optimizer': 'RAdam'}. Best is trial 62 with value: 0.0007213951903395355.
Training model with trial #96 and params: {'n_layers': 3, 'n_units': 84, 'activation': 'selu', 'lr': 0.00013611966512979643, 'optimizer': 'RAdam'}
[I 2025-05-13 03:42:48,996] Trial 96 finished with value: 0.0010767835192382336 and parameters: {'n_layers': 3, 'n_units': 84, 'activation': 'selu', 'lr': 0.00013611966512979643, 'optimizer': 'RAdam'}. Best is trial 62 with value: 0.0007213951903395355.
Training model with trial #97 and params: {'n_layers': 5, 'n_units': 60, 'activation': 'elu', 'lr': 0.00019668976637654407, 'optimizer': 'RAdam'}
[I 2025-05-13 04:08:14,223] Trial 97 finished with value: 0.0011217715218663216 and parameters: {'n_layers': 5, 'n_units': 60, 'activation': 'elu', 'lr': 0.00019668976637654407, 'optimizer': 'RAdam'}. Best is trial 62 with value: 0.0007213951903395355.
Training model with trial #98 and params: {'n_layers': 4, 'n_units': 46, 'activation': 'selu', 'lr': 0.0001648713228758663, 'optimizer': 'RAdam'}
[I 2025-05-13 04:55:40,706] Trial 98 finished with value: 0.0013297704281285405 and parameters: {'n_layers': 4, 'n_units': 46, 'activation': 'selu', 'lr': 0.0001648713228758663, 'optimizer': 'RAdam'}. Best is trial 62 with value: 0.0007213951903395355.
Training model with trial #99 and params: {'n_layers': 3, 'n_units': 121, 'activation': 'selu', 'lr': 0.003594839345873188, 'optimizer': 'rmsprop'}
