[I 2025-05-11 14:43:51,950] Trial 45 finished with value: 0.021474869921803474 and parameters: {'n_layers': 2, 'n_units': 18, 'activation': 'swish', 'lr': 0.0001501537671235599, 'optimizer': 'RAdam'}. Best is trial 32 with value: 0.0008725158404558897.
Training model with trial #46 and params: {'n_layers': 4, 'n_units': 117, 'activation': 'swish', 'lr': 0.0009349679234120717, 'optimizer': 'rmsprop'}
[I 2025-05-11 15:53:04,068] Trial 46 finished with value: 0.0027997076977044344 and parameters: {'n_layers': 4, 'n_units': 117, 'activation': 'swish', 'lr': 0.0009349679234120717, 'optimizer': 'rmsprop'}. Best is trial 32 with value: 0.0008725158404558897.
Training model with trial #47 and params: {'n_layers': 5, 'n_units': 76, 'activation': 'gelu', 'lr': 0.00038364051426513474, 'optimizer': 'RAdam'}
[I 2025-05-11 16:16:46,272] Trial 47 finished with value: 0.0009993077255785465 and parameters: {'n_layers': 5, 'n_units': 76, 'activation': 'gelu', 'lr': 0.00038364051426513474, 'optimizer': 'RAdam'}. Best is trial 32 with value: 0.0008725158404558897.
Training model with trial #48 and params: {'n_layers': 5, 'n_units': 426, 'activation': 'gelu', 'lr': 0.00041381895526404244, 'optimizer': 'sgd'}
[I 2025-05-11 20:18:09,172] Trial 48 finished with value: 0.02524728514254093 and parameters: {'n_layers': 5, 'n_units': 426, 'activation': 'gelu', 'lr': 0.00041381895526404244, 'optimizer': 'sgd'}. Best is trial 32 with value: 0.0008725158404558897.
Training model with trial #49 and params: {'n_layers': 4, 'n_units': 86, 'activation': 'gelu', 'lr': 0.00034264176995970355, 'optimizer': 'RAdam'}
[I 2025-05-11 20:40:39,781] Trial 49 finished with value: 0.0010915030725300312 and parameters: {'n_layers': 4, 'n_units': 86, 'activation': 'gelu', 'lr': 0.00034264176995970355, 'optimizer': 'RAdam'}. Best is trial 32 with value: 0.0008725158404558897.
Training model with trial #50 and params: {'n_layers': 3, 'n_units': 499, 'activation': 'gelu', 'lr': 0.0006390279730106855, 'optimizer': 'RAdam'}
[I 2025-05-11 22:00:03,199] Trial 50 finished with value: 0.00130760099273175 and parameters: {'n_layers': 3, 'n_units': 499, 'activation': 'gelu', 'lr': 0.0006390279730106855, 'optimizer': 'RAdam'}. Best is trial 32 with value: 0.0008725158404558897.
Training model with trial #51 and params: {'n_layers': 4, 'n_units': 38, 'activation': 'elu', 'lr': 0.001392616226349606, 'optimizer': 'RAdam'}
[I 2025-05-11 22:10:24,219] Trial 51 finished with value: 0.001152892131358385 and parameters: {'n_layers': 4, 'n_units': 38, 'activation': 'elu', 'lr': 0.001392616226349606, 'optimizer': 'RAdam'}. Best is trial 32 with value: 0.0008725158404558897.
Training model with trial #52 and params: {'n_layers': 5, 'n_units': 76, 'activation': 'sigmoid', 'lr': 0.001043237713088503, 'optimizer': 'RAdam'}
[I 2025-05-11 22:41:36,287] Trial 52 finished with value: 0.0010194911155849695 and parameters: {'n_layers': 5, 'n_units': 76, 'activation': 'sigmoid', 'lr': 0.001043237713088503, 'optimizer': 'RAdam'}. Best is trial 32 with value: 0.0008725158404558897.
Training model with trial #53 and params: {'n_layers': 5, 'n_units': 74, 'activation': 'sigmoid', 'lr': 0.00074065696934279, 'optimizer': 'RAdam'}
[I 2025-05-11 23:09:07,385] Trial 53 finished with value: 0.0008625967311672866 and parameters: {'n_layers': 5, 'n_units': 74, 'activation': 'sigmoid', 'lr': 0.00074065696934279, 'optimizer': 'RAdam'}. Best is trial 53 with value: 0.0008625967311672866.
Training model with trial #54 and params: {'n_layers': 5, 'n_units': 118, 'activation': 'sigmoid', 'lr': 0.0005918293869740195, 'optimizer': 'RAdam'}
[I 2025-05-11 23:45:17,968] Trial 54 finished with value: 0.0012836832320317626 and parameters: {'n_layers': 5, 'n_units': 118, 'activation': 'sigmoid', 'lr': 0.0005918293869740195, 'optimizer': 'RAdam'}. Best is trial 53 with value: 0.0008625967311672866.
Training model with trial #55 and params: {'n_layers': 4, 'n_units': 65, 'activation': 'sigmoid', 'lr': 0.0007270938362226716, 'optimizer': 'AdamW'}
[I 2025-05-11 23:59:05,956] Trial 55 finished with value: 0.37038713693618774 and parameters: {'n_layers': 4, 'n_units': 65, 'activation': 'sigmoid', 'lr': 0.0007270938362226716, 'optimizer': 'AdamW'}. Best is trial 53 with value: 0.0008625967311672866.
Training model with trial #56 and params: {'n_layers': 6, 'n_units': 153, 'activation': 'gelu', 'lr': 0.0003347855375065407, 'optimizer': 'adam'}
[I 2025-05-12 00:24:30,685] Trial 56 finished with value: 0.001772823859937489 and parameters: {'n_layers': 6, 'n_units': 153, 'activation': 'gelu', 'lr': 0.0003347855375065407, 'optimizer': 'adam'}. Best is trial 53 with value: 0.0008625967311672866.
Training model with trial #57 and params: {'n_layers': 2, 'n_units': 33, 'activation': 'leaky_relu', 'lr': 0.00044307161261023713, 'optimizer': 'RAdam'}
[I 2025-05-12 00:51:44,015] Trial 57 finished with value: 0.006185551173985004 and parameters: {'n_layers': 2, 'n_units': 33, 'activation': 'leaky_relu', 'lr': 0.00044307161261023713, 'optimizer': 'RAdam'}. Best is trial 53 with value: 0.0008625967311672866.
Training model with trial #58 and params: {'n_layers': 5, 'n_units': 223, 'activation': 'sigmoid', 'lr': 0.0005218876352713461, 'optimizer': 'RAdam'}
[I 2025-05-12 01:43:19,946] Trial 58 finished with value: 0.001489913440309465 and parameters: {'n_layers': 5, 'n_units': 223, 'activation': 'sigmoid', 'lr': 0.0005218876352713461, 'optimizer': 'RAdam'}. Best is trial 53 with value: 0.0008625967311672866.
Training model with trial #59 and params: {'n_layers': 3, 'n_units': 97, 'activation': 'tanh', 'lr': 0.0002635002106115584, 'optimizer': 'RAdam'}
[I 2025-05-12 02:18:51,111] Trial 59 finished with value: 0.0010768818901851773 and parameters: {'n_layers': 3, 'n_units': 97, 'activation': 'tanh', 'lr': 0.0002635002106115584, 'optimizer': 'RAdam'}. Best is trial 53 with value: 0.0008625967311672866.
Training model with trial #60 and params: {'n_layers': 5, 'n_units': 181, 'activation': 'relu', 'lr': 0.0009231634164830557, 'optimizer': 'RAdam'}
[I 2025-05-12 02:43:16,785] Trial 60 finished with value: 0.0017184808384627104 and parameters: {'n_layers': 5, 'n_units': 181, 'activation': 'relu', 'lr': 0.0009231634164830557, 'optimizer': 'RAdam'}. Best is trial 53 with value: 0.0008625967311672866.
Training model with trial #61 and params: {'n_layers': 5, 'n_units': 74, 'activation': 'sigmoid', 'lr': 0.0010405816838078448, 'optimizer': 'RAdam'}
[I 2025-05-12 03:09:39,636] Trial 61 finished with value: 0.0013830297393724322 and parameters: {'n_layers': 5, 'n_units': 74, 'activation': 'sigmoid', 'lr': 0.0010405816838078448, 'optimizer': 'RAdam'}. Best is trial 53 with value: 0.0008625967311672866.
Training model with trial #62 and params: {'n_layers': 5, 'n_units': 70, 'activation': 'sigmoid', 'lr': 0.0005742915961194507, 'optimizer': 'RAdam'}
[I 2025-05-12 03:50:54,778] Trial 62 finished with value: 0.0010528294369578362 and parameters: {'n_layers': 5, 'n_units': 70, 'activation': 'sigmoid', 'lr': 0.0005742915961194507, 'optimizer': 'RAdam'}. Best is trial 53 with value: 0.0008625967311672866.
Training model with trial #63 and params: {'n_layers': 4, 'n_units': 54, 'activation': 'sigmoid', 'lr': 0.0003949905099245013, 'optimizer': 'RAdam'}
[I 2025-05-12 04:33:01,952] Trial 63 finished with value: 0.0016977465711534023 and parameters: {'n_layers': 4, 'n_units': 54, 'activation': 'sigmoid', 'lr': 0.0003949905099245013, 'optimizer': 'RAdam'}. Best is trial 53 with value: 0.0008625967311672866.
Training model with trial #64 and params: {'n_layers': 6, 'n_units': 130, 'activation': 'sigmoid', 'lr': 0.0008061860347601847, 'optimizer': 'RAdam'}
[I 2025-05-12 05:08:06,867] Trial 64 finished with value: 0.0013678829418495297 and parameters: {'n_layers': 6, 'n_units': 130, 'activation': 'sigmoid', 'lr': 0.0008061860347601847, 'optimizer': 'RAdam'}. Best is trial 53 with value: 0.0008625967311672866.
Training model with trial #65 and params: {'n_layers': 4, 'n_units': 29, 'activation': 'gelu', 'lr': 0.0007326170947532666, 'optimizer': 'RAdam'}
[I 2025-05-12 05:24:29,368] Trial 65 finished with value: 0.0011572203366085887 and parameters: {'n_layers': 4, 'n_units': 29, 'activation': 'gelu', 'lr': 0.0007326170947532666, 'optimizer': 'RAdam'}. Best is trial 53 with value: 0.0008625967311672866.
Training model with trial #66 and params: {'n_layers': 6, 'n_units': 81, 'activation': 'swish', 'lr': 0.00135877500308618, 'optimizer': 'AdamW'}
[I 2025-05-12 06:28:36,050] Trial 66 finished with value: 0.023884715512394905 and parameters: {'n_layers': 6, 'n_units': 81, 'activation': 'swish', 'lr': 0.00135877500308618, 'optimizer': 'AdamW'}. Best is trial 53 with value: 0.0008625967311672866.
Training model with trial #67 and params: {'n_layers': 9, 'n_units': 304, 'activation': 'selu', 'lr': 0.00108637716406956, 'optimizer': 'RAdam'}
[I 2025-05-12 07:59:18,269] Trial 67 finished with value: 0.0017311943229287863 and parameters: {'n_layers': 9, 'n_units': 304, 'activation': 'selu', 'lr': 0.00108637716406956, 'optimizer': 'RAdam'}. Best is trial 53 with value: 0.0008625967311672866.
Training model with trial #68 and params: {'n_layers': 5, 'n_units': 107, 'activation': 'elu', 'lr': 0.00030859790781437475, 'optimizer': 'rmsprop'}
[I 2025-05-12 08:23:19,108] Trial 68 finished with value: 0.0024245656095445156 and parameters: {'n_layers': 5, 'n_units': 107, 'activation': 'elu', 'lr': 0.00030859790781437475, 'optimizer': 'rmsprop'}. Best is trial 53 with value: 0.0008625967311672866.
Training model with trial #69 and params: {'n_layers': 4, 'n_units': 55, 'activation': 'swish', 'lr': 0.00020910724021252794, 'optimizer': 'adam'}
[I 2025-05-12 10:16:20,157] Trial 69 finished with value: 0.0009374519577249885 and parameters: {'n_layers': 4, 'n_units': 55, 'activation': 'swish', 'lr': 0.00020910724021252794, 'optimizer': 'adam'}. Best is trial 53 with value: 0.0008625967311672866.
Training model with trial #70 and params: {'n_layers': 3, 'n_units': 56, 'activation': 'swish', 'lr': 0.00021092782861028542, 'optimizer': 'adam'}
[I 2025-05-12 12:20:13,540] Trial 70 finished with value: 0.0012132684933021665 and parameters: {'n_layers': 3, 'n_units': 56, 'activation': 'swish', 'lr': 0.00021092782861028542, 'optimizer': 'adam'}. Best is trial 53 with value: 0.0008625967311672866.
Training model with trial #71 and params: {'n_layers': 4, 'n_units': 33, 'activation': 'swish', 'lr': 0.0001562969891932227, 'optimizer': 'adam'}
[I 2025-05-12 14:32:15,371] Trial 71 finished with value: 0.0022002030164003372 and parameters: {'n_layers': 4, 'n_units': 33, 'activation': 'swish', 'lr': 0.0001562969891932227, 'optimizer': 'adam'}. Best is trial 53 with value: 0.0008625967311672866.
Training model with trial #72 and params: {'n_layers': 5, 'n_units': 73, 'activation': 'swish', 'lr': 0.0008821265951473453, 'optimizer': 'adam'}
[I 2025-05-12 15:16:12,436] Trial 72 finished with value: 0.0021083028987050056 and parameters: {'n_layers': 5, 'n_units': 73, 'activation': 'swish', 'lr': 0.0008821265951473453, 'optimizer': 'adam'}. Best is trial 53 with value: 0.0008625967311672866.
Training model with trial #73 and params: {'n_layers': 4, 'n_units': 17, 'activation': 'elu', 'lr': 0.00022668950512003862, 'optimizer': 'adam'}
[I 2025-05-12 15:50:16,080] Trial 73 finished with value: 0.004221756011247635 and parameters: {'n_layers': 4, 'n_units': 17, 'activation': 'elu', 'lr': 0.00022668950512003862, 'optimizer': 'adam'}. Best is trial 53 with value: 0.0008625967311672866.
Training model with trial #74 and params: {'n_layers': 8, 'n_units': 97, 'activation': 'swish', 'lr': 0.0005516935517996943, 'optimizer': 'sgd'}
[I 2025-05-12 21:05:13,766] Trial 74 finished with value: 0.02553650364279747 and parameters: {'n_layers': 8, 'n_units': 97, 'activation': 'swish', 'lr': 0.0005516935517996943, 'optimizer': 'sgd'}. Best is trial 53 with value: 0.0008625967311672866.
Training model with trial #75 and params: {'n_layers': 5, 'n_units': 48, 'activation': 'leaky_relu', 'lr': 0.0002869832297314904, 'optimizer': 'RAdam'}
[I 2025-05-12 21:36:52,695] Trial 75 finished with value: 0.0014486962463706732 and parameters: {'n_layers': 5, 'n_units': 48, 'activation': 'leaky_relu', 'lr': 0.0002869832297314904, 'optimizer': 'RAdam'}. Best is trial 53 with value: 0.0008625967311672866.
Training model with trial #76 and params: {'n_layers': 4, 'n_units': 122, 'activation': 'sigmoid', 'lr': 0.00017905444934552872, 'optimizer': 'RAdam'}
[I 2025-05-12 22:39:25,231] Trial 76 finished with value: 0.0014361902140080929 and parameters: {'n_layers': 4, 'n_units': 122, 'activation': 'sigmoid', 'lr': 0.00017905444934552872, 'optimizer': 'RAdam'}. Best is trial 53 with value: 0.0008625967311672866.
Training model with trial #77 and params: {'n_layers': 3, 'n_units': 145, 'activation': 'swish', 'lr': 0.008920002992916759, 'optimizer': 'adam'}
[I 2025-05-12 23:20:58,275] Trial 77 finished with value: 0.0012579434551298618 and parameters: {'n_layers': 3, 'n_units': 145, 'activation': 'swish', 'lr': 0.008920002992916759, 'optimizer': 'adam'}. Best is trial 53 with value: 0.0008625967311672866.
Training model with trial #78 and params: {'n_layers': 5, 'n_units': 61, 'activation': 'elu', 'lr': 0.0006652281356108881, 'optimizer': 'RAdam'}
[I 2025-05-12 23:53:30,641] Trial 78 finished with value: 0.0009178633335977793 and parameters: {'n_layers': 5, 'n_units': 61, 'activation': 'elu', 'lr': 0.0006652281356108881, 'optimizer': 'RAdam'}. Best is trial 53 with value: 0.0008625967311672866.
Training model with trial #79 and params: {'n_layers': 10, 'n_units': 56, 'activation': 'elu', 'lr': 0.00036042419029502846, 'optimizer': 'RAdam'}
[I 2025-05-13 00:17:57,523] Trial 79 finished with value: 0.0013539684005081654 and parameters: {'n_layers': 10, 'n_units': 56, 'activation': 'elu', 'lr': 0.00036042419029502846, 'optimizer': 'RAdam'}. Best is trial 53 with value: 0.0008625967311672866.
Training model with trial #80 and params: {'n_layers': 9, 'n_units': 31, 'activation': 'elu', 'lr': 0.0006302892180450974, 'optimizer': 'RAdam'}
[I 2025-05-13 00:42:54,587] Trial 80 finished with value: 0.0009763569687493145 and parameters: {'n_layers': 9, 'n_units': 31, 'activation': 'elu', 'lr': 0.0006302892180450974, 'optimizer': 'RAdam'}. Best is trial 53 with value: 0.0008625967311672866.
Training model with trial #81 and params: {'n_layers': 9, 'n_units': 29, 'activation': 'elu', 'lr': 0.000668700934537364, 'optimizer': 'RAdam'}
[I 2025-05-13 00:54:58,582] Trial 81 finished with value: 0.0013679133262485266 and parameters: {'n_layers': 9, 'n_units': 29, 'activation': 'elu', 'lr': 0.000668700934537364, 'optimizer': 'RAdam'}. Best is trial 53 with value: 0.0008625967311672866.
Training model with trial #82 and params: {'n_layers': 9, 'n_units': 44, 'activation': 'elu', 'lr': 0.000487231929562148, 'optimizer': 'RAdam'}
[I 2025-05-13 01:15:01,141] Trial 82 finished with value: 0.0010668545728549361 and parameters: {'n_layers': 9, 'n_units': 44, 'activation': 'elu', 'lr': 0.000487231929562148, 'optimizer': 'RAdam'}. Best is trial 53 with value: 0.0008625967311672866.
Training model with trial #83 and params: {'n_layers': 8, 'n_units': 377, 'activation': 'elu', 'lr': 0.0006119796984629647, 'optimizer': 'RAdam'}
[I 2025-05-13 03:43:25,045] Trial 83 finished with value: 0.00127986294683069 and parameters: {'n_layers': 8, 'n_units': 377, 'activation': 'elu', 'lr': 0.0006119796984629647, 'optimizer': 'RAdam'}. Best is trial 53 with value: 0.0008625967311672866.
Training model with trial #84 and params: {'n_layers': 9, 'n_units': 63, 'activation': 'elu', 'lr': 0.00040278461254494705, 'optimizer': 'RAdam'}
[I 2025-05-13 03:58:18,570] Trial 84 finished with value: 0.0012033402454108 and parameters: {'n_layers': 9, 'n_units': 63, 'activation': 'elu', 'lr': 0.00040278461254494705, 'optimizer': 'RAdam'}. Best is trial 53 with value: 0.0008625967311672866.
Training model with trial #85 and params: {'n_layers': 10, 'n_units': 92, 'activation': 'elu', 'lr': 0.0007412693598448983, 'optimizer': 'RAdam'}
[I 2025-05-13 04:13:38,916] Trial 85 finished with value: 0.0015675619943067431 and parameters: {'n_layers': 10, 'n_units': 92, 'activation': 'elu', 'lr': 0.0007412693598448983, 'optimizer': 'RAdam'}. Best is trial 53 with value: 0.0008625967311672866.
Training model with trial #86 and params: {'n_layers': 7, 'n_units': 16, 'activation': 'elu', 'lr': 0.00043795468225666864, 'optimizer': 'rmsprop'}
[I 2025-05-13 04:41:22,590] Trial 86 finished with value: 0.00653135497123003 and parameters: {'n_layers': 7, 'n_units': 16, 'activation': 'elu', 'lr': 0.00043795468225666864, 'optimizer': 'rmsprop'}. Best is trial 53 with value: 0.0008625967311672866.
Training model with trial #87 and params: {'n_layers': 4, 'n_units': 35, 'activation': 'gelu', 'lr': 0.0003266730193115617, 'optimizer': 'RAdam'}
[I 2025-05-13 05:06:55,855] Trial 87 finished with value: 0.0011623748578131199 and parameters: {'n_layers': 4, 'n_units': 35, 'activation': 'gelu', 'lr': 0.0003266730193115617, 'optimizer': 'RAdam'}. Best is trial 53 with value: 0.0008625967311672866.
Training model with trial #88 and params: {'n_layers': 8, 'n_units': 83, 'activation': 'relu', 'lr': 0.0005210030512770833, 'optimizer': 'AdamW'}
[I 2025-05-13 05:16:49,667] Trial 88 finished with value: 0.05738791450858116 and parameters: {'n_layers': 8, 'n_units': 83, 'activation': 'relu', 'lr': 0.0005210030512770833, 'optimizer': 'AdamW'}. Best is trial 53 with value: 0.0008625967311672866.
Training model with trial #89 and params: {'n_layers': 9, 'n_units': 51, 'activation': 'tanh', 'lr': 0.000669865382963933, 'optimizer': 'sgd'}
[I 2025-05-13 05:58:41,257] Trial 89 finished with value: 0.03637431189417839 and parameters: {'n_layers': 9, 'n_units': 51, 'activation': 'tanh', 'lr': 0.000669865382963933, 'optimizer': 'sgd'}. Best is trial 53 with value: 0.0008625967311672866.
Training model with trial #90 and params: {'n_layers': 6, 'n_units': 102, 'activation': 'selu', 'lr': 0.0003744240744467838, 'optimizer': 'RAdam'}
[I 2025-05-13 06:44:39,411] Trial 90 finished with value: 0.0011055156355723739 and parameters: {'n_layers': 6, 'n_units': 102, 'activation': 'selu', 'lr': 0.0003744240744467838, 'optimizer': 'RAdam'}. Best is trial 53 with value: 0.0008625967311672866.
Training model with trial #91 and params: {'n_layers': 5, 'n_units': 76, 'activation': 'swish', 'lr': 0.0008509715681408754, 'optimizer': 'RAdam'}
[I 2025-05-13 07:48:06,687] Trial 91 finished with value: 0.0011924058198928833 and parameters: {'n_layers': 5, 'n_units': 76, 'activation': 'swish', 'lr': 0.0008509715681408754, 'optimizer': 'RAdam'}. Best is trial 53 with value: 0.0008625967311672866.
Training model with trial #92 and params: {'n_layers': 5, 'n_units': 42, 'activation': 'elu', 'lr': 0.0010229053957157954, 'optimizer': 'RAdam'}
[I 2025-05-13 07:59:11,543] Trial 92 finished with value: 0.0015772986225783825 and parameters: {'n_layers': 5, 'n_units': 42, 'activation': 'elu', 'lr': 0.0010229053957157954, 'optimizer': 'RAdam'}. Best is trial 53 with value: 0.0008625967311672866.
Training model with trial #93 and params: {'n_layers': 5, 'n_units': 63, 'activation': 'sigmoid', 'lr': 0.0012717778187910271, 'optimizer': 'RAdam'}
[I 2025-05-13 08:24:15,339] Trial 93 finished with value: 0.0013894618023186922 and parameters: {'n_layers': 5, 'n_units': 63, 'activation': 'sigmoid', 'lr': 0.0012717778187910271, 'optimizer': 'RAdam'}. Best is trial 53 with value: 0.0008625967311672866.
Training model with trial #94 and params: {'n_layers': 4, 'n_units': 29, 'activation': 'gelu', 'lr': 0.000738198368293485, 'optimizer': 'RAdam'}
[I 2025-05-13 08:46:23,943] Trial 94 finished with value: 0.0011689966777339578 and parameters: {'n_layers': 4, 'n_units': 29, 'activation': 'gelu', 'lr': 0.000738198368293485, 'optimizer': 'RAdam'}. Best is trial 53 with value: 0.0008625967311672866.
Training model with trial #95 and params: {'n_layers': 6, 'n_units': 73, 'activation': 'elu', 'lr': 0.0002475154021748114, 'optimizer': 'RAdam'}
[I 2025-05-13 09:20:32,300] Trial 95 finished with value: 0.0008276471053250134 and parameters: {'n_layers': 6, 'n_units': 73, 'activation': 'elu', 'lr': 0.0002475154021748114, 'optimizer': 'RAdam'}. Best is trial 95 with value: 0.0008276471053250134.
Training model with trial #96 and params: {'n_layers': 3, 'n_units': 66, 'activation': 'elu', 'lr': 0.00025428816765282996, 'optimizer': 'RAdam'}
[I 2025-05-13 09:47:32,243] Trial 96 finished with value: 0.001063646050170064 and parameters: {'n_layers': 3, 'n_units': 66, 'activation': 'elu', 'lr': 0.00025428816765282996, 'optimizer': 'RAdam'}. Best is trial 95 with value: 0.0008276471053250134.
Training model with trial #97 and params: {'n_layers': 8, 'n_units': 112, 'activation': 'elu', 'lr': 0.0001273861811664777, 'optimizer': 'adam'}
[I 2025-05-13 10:10:30,065] Trial 97 finished with value: 0.001521485741250217 and parameters: {'n_layers': 8, 'n_units': 112, 'activation': 'elu', 'lr': 0.0001273861811664777, 'optimizer': 'adam'}. Best is trial 95 with value: 0.0008276471053250134.
Training model with trial #98 and params: {'n_layers': 6, 'n_units': 258, 'activation': 'elu', 'lr': 0.00022448913598993632, 'optimizer': 'RAdam'}
[I 2025-05-13 10:52:30,087] Trial 98 finished with value: 0.0013386656064540148 and parameters: {'n_layers': 6, 'n_units': 258, 'activation': 'elu', 'lr': 0.00022448913598993632, 'optimizer': 'RAdam'}. Best is trial 95 with value: 0.0008276471053250134.
Training model with trial #99 and params: {'n_layers': 9, 'n_units': 25, 'activation': 'swish', 'lr': 0.0002971348004941889, 'optimizer': 'RAdam'}
[I 2025-05-13 13:40:31,844] Trial 99 finished with value: 0.0013269836781546474 and parameters: {'n_layers': 9, 'n_units': 25, 'activation': 'swish', 'lr': 0.0002971348004941889, 'optimizer': 'RAdam'}. Best is trial 95 with value: 0.0008276471053250134.
Beste Parameter:
{'n_layers': 6, 'n_units': 73, 'activation': 'elu', 'lr': 0.0002475154021748114, 'optimizer': 'RAdam'}
