[I 2025-05-12 04:20:55,761] Trial 45 finished with value: 0.0010615036590024829 and parameters: {'n_layers': 3, 'n_units': 274, 'activation': 'sigmoid', 'lr': 0.00013270353349669663, 'optimizer': 'adam'}. Best is trial 17 with value: 0.0007272888324223459.
Training model with trial #46 and params: {'n_layers': 7, 'n_units': 313, 'activation': 'selu', 'lr': 0.0001965058882589197, 'optimizer': 'adam'}
[I 2025-05-12 05:17:07,176] Trial 46 finished with value: 0.0019291656790301204 and parameters: {'n_layers': 7, 'n_units': 313, 'activation': 'selu', 'lr': 0.0001965058882589197, 'optimizer': 'adam'}. Best is trial 17 with value: 0.0007272888324223459.
Training model with trial #47 and params: {'n_layers': 4, 'n_units': 242, 'activation': 'sigmoid', 'lr': 0.00034313596693274156, 'optimizer': 'adam'}
[I 2025-05-12 06:07:01,351] Trial 47 finished with value: 0.0009115000138990581 and parameters: {'n_layers': 4, 'n_units': 242, 'activation': 'sigmoid', 'lr': 0.00034313596693274156, 'optimizer': 'adam'}. Best is trial 17 with value: 0.0007272888324223459.
Training model with trial #48 and params: {'n_layers': 2, 'n_units': 52, 'activation': 'relu', 'lr': 0.000652629040752974, 'optimizer': 'rmsprop'}
[I 2025-05-12 06:24:53,596] Trial 48 finished with value: 0.003926947247236967 and parameters: {'n_layers': 2, 'n_units': 52, 'activation': 'relu', 'lr': 0.000652629040752974, 'optimizer': 'rmsprop'}. Best is trial 17 with value: 0.0007272888324223459.
Training model with trial #49 and params: {'n_layers': 5, 'n_units': 355, 'activation': 'sigmoid', 'lr': 0.00024078681484197682, 'optimizer': 'AdamW'}
[I 2025-05-12 06:39:24,066] Trial 49 finished with value: 0.38774019479751587 and parameters: {'n_layers': 5, 'n_units': 355, 'activation': 'sigmoid', 'lr': 0.00024078681484197682, 'optimizer': 'AdamW'}. Best is trial 17 with value: 0.0007272888324223459.
Training model with trial #50 and params: {'n_layers': 10, 'n_units': 114, 'activation': 'sigmoid', 'lr': 0.0005413304488556801, 'optimizer': 'adam'}
[I 2025-05-12 06:49:08,190] Trial 50 finished with value: 1.0276519060134888 and parameters: {'n_layers': 10, 'n_units': 114, 'activation': 'sigmoid', 'lr': 0.0005413304488556801, 'optimizer': 'adam'}. Best is trial 17 with value: 0.0007272888324223459.
Training model with trial #51 and params: {'n_layers': 5, 'n_units': 395, 'activation': 'sigmoid', 'lr': 0.00012650432733242375, 'optimizer': 'adam'}
[I 2025-05-12 09:14:55,872] Trial 51 finished with value: 0.0010693598305806518 and parameters: {'n_layers': 5, 'n_units': 395, 'activation': 'sigmoid', 'lr': 0.00012650432733242375, 'optimizer': 'adam'}. Best is trial 17 with value: 0.0007272888324223459.
Training model with trial #52 and params: {'n_layers': 4, 'n_units': 430, 'activation': 'sigmoid', 'lr': 0.00017034713130820953, 'optimizer': 'adam'}
[I 2025-05-12 11:21:22,295] Trial 52 finished with value: 0.0008436347125098109 and parameters: {'n_layers': 4, 'n_units': 430, 'activation': 'sigmoid', 'lr': 0.00017034713130820953, 'optimizer': 'adam'}. Best is trial 17 with value: 0.0007272888324223459.
Training model with trial #53 and params: {'n_layers': 3, 'n_units': 446, 'activation': 'sigmoid', 'lr': 0.00016318021629536185, 'optimizer': 'adam'}
[I 2025-05-12 14:09:37,767] Trial 53 finished with value: 0.0007691672071814537 and parameters: {'n_layers': 3, 'n_units': 446, 'activation': 'sigmoid', 'lr': 0.00016318021629536185, 'optimizer': 'adam'}. Best is trial 17 with value: 0.0007272888324223459.
Training model with trial #54 and params: {'n_layers': 3, 'n_units': 466, 'activation': 'sigmoid', 'lr': 0.0001873928510922887, 'optimizer': 'adam'}
[I 2025-05-12 16:53:59,665] Trial 54 finished with value: 0.0007234361255541444 and parameters: {'n_layers': 3, 'n_units': 466, 'activation': 'sigmoid', 'lr': 0.0001873928510922887, 'optimizer': 'adam'}. Best is trial 54 with value: 0.0007234361255541444.
Training model with trial #55 and params: {'n_layers': 3, 'n_units': 489, 'activation': 'gelu', 'lr': 0.00019027178883584118, 'optimizer': 'sgd'}
[I 2025-05-12 21:22:30,552] Trial 55 finished with value: 0.09119085222482681 and parameters: {'n_layers': 3, 'n_units': 489, 'activation': 'gelu', 'lr': 0.00019027178883584118, 'optimizer': 'sgd'}. Best is trial 54 with value: 0.0007234361255541444.
Training model with trial #56 and params: {'n_layers': 2, 'n_units': 465, 'activation': 'leaky_relu', 'lr': 0.00011703110071247372, 'optimizer': 'adam'}
[I 2025-05-12 23:46:24,010] Trial 56 finished with value: 0.0018085745396092534 and parameters: {'n_layers': 2, 'n_units': 465, 'activation': 'leaky_relu', 'lr': 0.00011703110071247372, 'optimizer': 'adam'}. Best is trial 54 with value: 0.0007234361255541444.
Training model with trial #57 and params: {'n_layers': 1, 'n_units': 462, 'activation': 'sigmoid', 'lr': 0.00035946295569330396, 'optimizer': 'adam'}
[I 2025-05-13 00:45:46,423] Trial 57 finished with value: 0.006510683801025152 and parameters: {'n_layers': 1, 'n_units': 462, 'activation': 'sigmoid', 'lr': 0.00035946295569330396, 'optimizer': 'adam'}. Best is trial 54 with value: 0.0007234361255541444.
Training model with trial #58 and params: {'n_layers': 3, 'n_units': 443, 'activation': 'elu', 'lr': 0.0004461169164880352, 'optimizer': 'RAdam'}
[I 2025-05-13 01:33:51,814] Trial 58 finished with value: 0.0013625440187752247 and parameters: {'n_layers': 3, 'n_units': 443, 'activation': 'elu', 'lr': 0.0004461169164880352, 'optimizer': 'RAdam'}. Best is trial 54 with value: 0.0007234361255541444.
Training model with trial #59 and params: {'n_layers': 2, 'n_units': 485, 'activation': 'sigmoid', 'lr': 0.007955715101057897, 'optimizer': 'adam'}
[I 2025-05-13 02:35:29,653] Trial 59 finished with value: 0.001003333367407322 and parameters: {'n_layers': 2, 'n_units': 485, 'activation': 'sigmoid', 'lr': 0.007955715101057897, 'optimizer': 'adam'}. Best is trial 54 with value: 0.0007234361255541444.
Training model with trial #60 and params: {'n_layers': 3, 'n_units': 229, 'activation': 'swish', 'lr': 0.00029401903985176644, 'optimizer': 'adam'}
[I 2025-05-13 03:36:19,602] Trial 60 finished with value: 0.001074400614015758 and parameters: {'n_layers': 3, 'n_units': 229, 'activation': 'swish', 'lr': 0.00029401903985176644, 'optimizer': 'adam'}. Best is trial 54 with value: 0.0007234361255541444.
Training model with trial #61 and params: {'n_layers': 4, 'n_units': 512, 'activation': 'sigmoid', 'lr': 0.00015978794920735328, 'optimizer': 'adam'}
[I 2025-05-13 07:04:14,271] Trial 61 finished with value: 0.000801766465883702 and parameters: {'n_layers': 4, 'n_units': 512, 'activation': 'sigmoid', 'lr': 0.00015978794920735328, 'optimizer': 'adam'}. Best is trial 54 with value: 0.0007234361255541444.
Training model with trial #62 and params: {'n_layers': 3, 'n_units': 478, 'activation': 'sigmoid', 'lr': 0.0001468093210329907, 'optimizer': 'adam'}
[I 2025-05-13 10:23:38,257] Trial 62 finished with value: 0.0008690253598615527 and parameters: {'n_layers': 3, 'n_units': 478, 'activation': 'sigmoid', 'lr': 0.0001468093210329907, 'optimizer': 'adam'}. Best is trial 54 with value: 0.0007234361255541444.
Training model with trial #63 and params: {'n_layers': 4, 'n_units': 499, 'activation': 'sigmoid', 'lr': 0.00020751260926479118, 'optimizer': 'adam'}
[I 2025-05-13 14:02:17,303] Trial 63 finished with value: 0.0011353843146935105 and parameters: {'n_layers': 4, 'n_units': 499, 'activation': 'sigmoid', 'lr': 0.00020751260926479118, 'optimizer': 'adam'}. Best is trial 54 with value: 0.0007234361255541444.
Training model with trial #64 and params: {'n_layers': 3, 'n_units': 504, 'activation': 'sigmoid', 'lr': 0.00011083700866954153, 'optimizer': 'adam'}
[I 2025-05-13 19:19:08,476] Trial 64 finished with value: 0.0009404177544638515 and parameters: {'n_layers': 3, 'n_units': 504, 'activation': 'sigmoid', 'lr': 0.00011083700866954153, 'optimizer': 'adam'}. Best is trial 54 with value: 0.0007234361255541444.
Training model with trial #65 and params: {'n_layers': 4, 'n_units': 410, 'activation': 'tanh', 'lr': 0.00016458624262893863, 'optimizer': 'AdamW'}
[I 2025-05-13 20:01:32,624] Trial 65 finished with value: 0.08639679849147797 and parameters: {'n_layers': 4, 'n_units': 410, 'activation': 'tanh', 'lr': 0.00016458624262893863, 'optimizer': 'AdamW'}. Best is trial 54 with value: 0.0007234361255541444.
Training model with trial #66 and params: {'n_layers': 2, 'n_units': 193, 'activation': 'sigmoid', 'lr': 0.00021765974580848838, 'optimizer': 'adam'}
[I 2025-05-13 20:56:17,110] Trial 66 finished with value: 0.001973613165318966 and parameters: {'n_layers': 2, 'n_units': 193, 'activation': 'sigmoid', 'lr': 0.00021765974580848838, 'optimizer': 'adam'}. Best is trial 54 with value: 0.0007234361255541444.
Training model with trial #67 and params: {'n_layers': 4, 'n_units': 158, 'activation': 'sigmoid', 'lr': 0.0002626491182187174, 'optimizer': 'adam'}
[I 2025-05-13 21:52:00,795] Trial 67 finished with value: 0.0007322576129809022 and parameters: {'n_layers': 4, 'n_units': 158, 'activation': 'sigmoid', 'lr': 0.0002626491182187174, 'optimizer': 'adam'}. Best is trial 54 with value: 0.0007234361255541444.
Training model with trial #68 and params: {'n_layers': 5, 'n_units': 148, 'activation': 'selu', 'lr': 0.0004065194883736081, 'optimizer': 'rmsprop'}
[I 2025-05-13 22:10:55,665] Trial 68 finished with value: 0.0021632586140185595 and parameters: {'n_layers': 5, 'n_units': 148, 'activation': 'selu', 'lr': 0.0004065194883736081, 'optimizer': 'rmsprop'}. Best is trial 54 with value: 0.0007234361255541444.
Training model with trial #69 and params: {'n_layers': 2, 'n_units': 377, 'activation': 'relu', 'lr': 0.00017913027804395995, 'optimizer': 'sgd'}
[I 2025-05-13 23:33:41,323] Trial 69 finished with value: 0.22865599393844604 and parameters: {'n_layers': 2, 'n_units': 377, 'activation': 'relu', 'lr': 0.00017913027804395995, 'optimizer': 'sgd'}. Best is trial 54 with value: 0.0007234361255541444.
Training model with trial #70 and params: {'n_layers': 9, 'n_units': 456, 'activation': 'sigmoid', 'lr': 0.00014702745186504995, 'optimizer': 'adam'}
[I 2025-05-14 00:15:42,388] Trial 70 finished with value: 1.0277281999588013 and parameters: {'n_layers': 9, 'n_units': 456, 'activation': 'sigmoid', 'lr': 0.00014702745186504995, 'optimizer': 'adam'}. Best is trial 54 with value: 0.0007234361255541444.
Training model with trial #71 and params: {'n_layers': 3, 'n_units': 511, 'activation': 'sigmoid', 'lr': 0.00026683340935856333, 'optimizer': 'adam'}
[I 2025-05-14 03:38:54,484] Trial 71 finished with value: 0.0006741808610968292 and parameters: {'n_layers': 3, 'n_units': 511, 'activation': 'sigmoid', 'lr': 0.00026683340935856333, 'optimizer': 'adam'}. Best is trial 71 with value: 0.0006741808610968292.
Training model with trial #72 and params: {'n_layers': 3, 'n_units': 445, 'activation': 'sigmoid', 'lr': 0.0003295288839418817, 'optimizer': 'adam'}
[I 2025-05-14 05:20:43,949] Trial 72 finished with value: 0.0006995011935941875 and parameters: {'n_layers': 3, 'n_units': 445, 'activation': 'sigmoid', 'lr': 0.0003295288839418817, 'optimizer': 'adam'}. Best is trial 71 with value: 0.0006741808610968292.
Training model with trial #73 and params: {'n_layers': 3, 'n_units': 439, 'activation': 'sigmoid', 'lr': 0.00032620289950693827, 'optimizer': 'adam'}
[I 2025-05-14 07:13:45,620] Trial 73 finished with value: 0.0007203381392173469 and parameters: {'n_layers': 3, 'n_units': 439, 'activation': 'sigmoid', 'lr': 0.00032620289950693827, 'optimizer': 'adam'}. Best is trial 71 with value: 0.0006741808610968292.
Training model with trial #74 and params: {'n_layers': 3, 'n_units': 441, 'activation': 'sigmoid', 'lr': 0.0003231671169407837, 'optimizer': 'adam'}
[I 2025-05-14 08:58:27,422] Trial 74 finished with value: 0.0006831838982179761 and parameters: {'n_layers': 3, 'n_units': 441, 'activation': 'sigmoid', 'lr': 0.0003231671169407837, 'optimizer': 'adam'}. Best is trial 71 with value: 0.0006741808610968292.
Training model with trial #75 and params: {'n_layers': 3, 'n_units': 445, 'activation': 'sigmoid', 'lr': 0.00032094035382007537, 'optimizer': 'adam'}
[I 2025-05-14 10:42:42,472] Trial 75 finished with value: 0.0007138337823562324 and parameters: {'n_layers': 3, 'n_units': 445, 'activation': 'sigmoid', 'lr': 0.00032094035382007537, 'optimizer': 'adam'}. Best is trial 71 with value: 0.0006741808610968292.
Training model with trial #76 and params: {'n_layers': 2, 'n_units': 424, 'activation': 'sigmoid', 'lr': 0.0003313964755549902, 'optimizer': 'adam'}
[I 2025-05-14 12:22:34,411] Trial 76 finished with value: 0.0008935548248700798 and parameters: {'n_layers': 2, 'n_units': 424, 'activation': 'sigmoid', 'lr': 0.0003313964755549902, 'optimizer': 'adam'}. Best is trial 71 with value: 0.0006741808610968292.
Training model with trial #77 and params: {'n_layers': 3, 'n_units': 438, 'activation': 'leaky_relu', 'lr': 0.00038871649317488336, 'optimizer': 'RAdam'}
