[I 2025-05-12 07:49:27,471] Trial 45 finished with value: 0.0008169919601641595 and parameters: {'n_layers': 3, 'n_units': 361, 'activation': 'sigmoid', 'lr': 0.00016527205756402237, 'optimizer': 'adam'}. Best is trial 24 with value: 0.0006855232641100883.
Training model with trial #46 and params: {'n_layers': 2, 'n_units': 435, 'activation': 'sigmoid', 'lr': 0.000210717201453481, 'optimizer': 'adam'}
[I 2025-05-12 09:54:13,048] Trial 46 finished with value: 0.0012874406529590487 and parameters: {'n_layers': 2, 'n_units': 435, 'activation': 'sigmoid', 'lr': 0.000210717201453481, 'optimizer': 'adam'}. Best is trial 24 with value: 0.0006855232641100883.
Training model with trial #47 and params: {'n_layers': 1, 'n_units': 392, 'activation': 'elu', 'lr': 0.00040157531857034815, 'optimizer': 'rmsprop'}
[I 2025-05-12 10:35:47,418] Trial 47 finished with value: 0.014563140459358692 and parameters: {'n_layers': 1, 'n_units': 392, 'activation': 'elu', 'lr': 0.00040157531857034815, 'optimizer': 'rmsprop'}. Best is trial 24 with value: 0.0006855232641100883.
Training model with trial #48 and params: {'n_layers': 3, 'n_units': 359, 'activation': 'relu', 'lr': 0.00010196878560887844, 'optimizer': 'sgd'}
[I 2025-05-12 12:13:43,013] Trial 48 finished with value: 0.28087204694747925 and parameters: {'n_layers': 3, 'n_units': 359, 'activation': 'relu', 'lr': 0.00010196878560887844, 'optimizer': 'sgd'}. Best is trial 24 with value: 0.0006855232641100883.
Training model with trial #49 and params: {'n_layers': 3, 'n_units': 311, 'activation': 'gelu', 'lr': 0.00016992723955785617, 'optimizer': 'adam'}
[I 2025-05-12 12:49:56,160] Trial 49 finished with value: 0.0011141560971736908 and parameters: {'n_layers': 3, 'n_units': 311, 'activation': 'gelu', 'lr': 0.00016992723955785617, 'optimizer': 'adam'}. Best is trial 24 with value: 0.0006855232641100883.
Training model with trial #50 and params: {'n_layers': 2, 'n_units': 23, 'activation': 'selu', 'lr': 0.00028036717227720043, 'optimizer': 'adam'}
[I 2025-05-12 13:17:06,983] Trial 50 finished with value: 0.00827321968972683 and parameters: {'n_layers': 2, 'n_units': 23, 'activation': 'selu', 'lr': 0.00028036717227720043, 'optimizer': 'adam'}. Best is trial 24 with value: 0.0006855232641100883.
Training model with trial #51 and params: {'n_layers': 4, 'n_units': 327, 'activation': 'sigmoid', 'lr': 0.0001249835378696844, 'optimizer': 'adam'}
[I 2025-05-12 15:44:33,284] Trial 51 finished with value: 0.0007972198072820902 and parameters: {'n_layers': 4, 'n_units': 327, 'activation': 'sigmoid', 'lr': 0.0001249835378696844, 'optimizer': 'adam'}. Best is trial 24 with value: 0.0006855232641100883.
Training model with trial #52 and params: {'n_layers': 4, 'n_units': 284, 'activation': 'sigmoid', 'lr': 0.00011965404941094021, 'optimizer': 'adam'}
[I 2025-05-12 17:46:38,141] Trial 52 finished with value: 0.0008673025877214968 and parameters: {'n_layers': 4, 'n_units': 284, 'activation': 'sigmoid', 'lr': 0.00011965404941094021, 'optimizer': 'adam'}. Best is trial 24 with value: 0.0006855232641100883.
Training model with trial #53 and params: {'n_layers': 5, 'n_units': 364, 'activation': 'sigmoid', 'lr': 0.0001747184901158942, 'optimizer': 'adam'}
[I 2025-05-12 19:43:00,596] Trial 53 finished with value: 0.001132700010202825 and parameters: {'n_layers': 5, 'n_units': 364, 'activation': 'sigmoid', 'lr': 0.0001747184901158942, 'optimizer': 'adam'}. Best is trial 24 with value: 0.0006855232641100883.
Training model with trial #54 and params: {'n_layers': 3, 'n_units': 323, 'activation': 'swish', 'lr': 0.00021266438348241636, 'optimizer': 'adam'}
[I 2025-05-12 21:07:00,021] Trial 54 finished with value: 0.0012130850227549672 and parameters: {'n_layers': 3, 'n_units': 323, 'activation': 'swish', 'lr': 0.00021266438348241636, 'optimizer': 'adam'}. Best is trial 24 with value: 0.0006855232641100883.
Training model with trial #55 and params: {'n_layers': 4, 'n_units': 304, 'activation': 'sigmoid', 'lr': 0.00011508275702500463, 'optimizer': 'RAdam'}
[I 2025-05-12 23:35:35,060] Trial 55 finished with value: 0.0008682449697516859 and parameters: {'n_layers': 4, 'n_units': 304, 'activation': 'sigmoid', 'lr': 0.00011508275702500463, 'optimizer': 'RAdam'}. Best is trial 24 with value: 0.0006855232641100883.
Training model with trial #56 and params: {'n_layers': 5, 'n_units': 395, 'activation': 'sigmoid', 'lr': 0.00024447605240956495, 'optimizer': 'adam'}
[I 2025-05-13 01:27:33,532] Trial 56 finished with value: 0.0011139939306303859 and parameters: {'n_layers': 5, 'n_units': 395, 'activation': 'sigmoid', 'lr': 0.00024447605240956495, 'optimizer': 'adam'}. Best is trial 24 with value: 0.0006855232641100883.
Training model with trial #57 and params: {'n_layers': 4, 'n_units': 356, 'activation': 'leaky_relu', 'lr': 0.00016827520109934278, 'optimizer': 'rmsprop'}
[I 2025-05-13 03:09:00,630] Trial 57 finished with value: 0.0022698536049574614 and parameters: {'n_layers': 4, 'n_units': 356, 'activation': 'leaky_relu', 'lr': 0.00016827520109934278, 'optimizer': 'rmsprop'}. Best is trial 24 with value: 0.0006855232641100883.
Training model with trial #58 and params: {'n_layers': 3, 'n_units': 421, 'activation': 'sigmoid', 'lr': 0.0052175796346410706, 'optimizer': 'adam'}
[I 2025-05-13 04:11:37,901] Trial 58 finished with value: 0.001328785321675241 and parameters: {'n_layers': 3, 'n_units': 421, 'activation': 'sigmoid', 'lr': 0.0052175796346410706, 'optimizer': 'adam'}. Best is trial 24 with value: 0.0006855232641100883.
Training model with trial #59 and params: {'n_layers': 3, 'n_units': 235, 'activation': 'sigmoid', 'lr': 0.0001331049027849961, 'optimizer': 'AdamW'}
[I 2025-05-13 04:20:07,300] Trial 59 finished with value: 0.4787171483039856 and parameters: {'n_layers': 3, 'n_units': 235, 'activation': 'sigmoid', 'lr': 0.0001331049027849961, 'optimizer': 'AdamW'}. Best is trial 24 with value: 0.0006855232641100883.
Training model with trial #60 and params: {'n_layers': 7, 'n_units': 344, 'activation': 'sigmoid', 'lr': 0.0004499941497477039, 'optimizer': 'adam'}
[I 2025-05-13 04:47:03,584] Trial 60 finished with value: 1.0276626348495483 and parameters: {'n_layers': 7, 'n_units': 344, 'activation': 'sigmoid', 'lr': 0.0004499941497477039, 'optimizer': 'adam'}. Best is trial 24 with value: 0.0006855232641100883.
Training model with trial #61 and params: {'n_layers': 4, 'n_units': 330, 'activation': 'sigmoid', 'lr': 0.00015568069630174678, 'optimizer': 'adam'}
[I 2025-05-13 06:45:34,026] Trial 61 finished with value: 0.0007682691793888807 and parameters: {'n_layers': 4, 'n_units': 330, 'activation': 'sigmoid', 'lr': 0.00015568069630174678, 'optimizer': 'adam'}. Best is trial 24 with value: 0.0006855232641100883.
Training model with trial #62 and params: {'n_layers': 4, 'n_units': 297, 'activation': 'sigmoid', 'lr': 0.000162998976197352, 'optimizer': 'adam'}
[I 2025-05-13 08:44:51,912] Trial 62 finished with value: 0.0007501488435082138 and parameters: {'n_layers': 4, 'n_units': 297, 'activation': 'sigmoid', 'lr': 0.000162998976197352, 'optimizer': 'adam'}. Best is trial 24 with value: 0.0006855232641100883.
Training model with trial #63 and params: {'n_layers': 4, 'n_units': 297, 'activation': 'sigmoid', 'lr': 0.0003181513553950422, 'optimizer': 'adam'}
[I 2025-05-13 09:45:11,134] Trial 63 finished with value: 0.0008702168124727905 and parameters: {'n_layers': 4, 'n_units': 297, 'activation': 'sigmoid', 'lr': 0.0003181513553950422, 'optimizer': 'adam'}. Best is trial 24 with value: 0.0006855232641100883.
Training model with trial #64 and params: {'n_layers': 5, 'n_units': 267, 'activation': 'selu', 'lr': 0.0001008881996423117, 'optimizer': 'adam'}
[I 2025-05-13 10:41:42,631] Trial 64 finished with value: 0.0012669372372329235 and parameters: {'n_layers': 5, 'n_units': 267, 'activation': 'selu', 'lr': 0.0001008881996423117, 'optimizer': 'adam'}. Best is trial 24 with value: 0.0006855232641100883.
Training model with trial #65 and params: {'n_layers': 4, 'n_units': 284, 'activation': 'sigmoid', 'lr': 0.0001975506498866563, 'optimizer': 'adam'}
[I 2025-05-13 11:57:01,594] Trial 65 finished with value: 0.0008344275993295014 and parameters: {'n_layers': 4, 'n_units': 284, 'activation': 'sigmoid', 'lr': 0.0001975506498866563, 'optimizer': 'adam'}. Best is trial 24 with value: 0.0006855232641100883.
Training model with trial #66 and params: {'n_layers': 6, 'n_units': 328, 'activation': 'tanh', 'lr': 0.0001263725819078432, 'optimizer': 'RAdam'}
[I 2025-05-13 13:05:41,328] Trial 66 finished with value: 0.0027548435609787703 and parameters: {'n_layers': 6, 'n_units': 328, 'activation': 'tanh', 'lr': 0.0001263725819078432, 'optimizer': 'RAdam'}. Best is trial 24 with value: 0.0006855232641100883.
Training model with trial #67 and params: {'n_layers': 5, 'n_units': 74, 'activation': 'sigmoid', 'lr': 0.0001506077317293464, 'optimizer': 'sgd'}
[I 2025-05-13 13:12:59,562] Trial 67 finished with value: 1.0277769565582275 and parameters: {'n_layers': 5, 'n_units': 74, 'activation': 'sigmoid', 'lr': 0.0001506077317293464, 'optimizer': 'sgd'}. Best is trial 24 with value: 0.0006855232641100883.
Training model with trial #68 and params: {'n_layers': 4, 'n_units': 380, 'activation': 'sigmoid', 'lr': 0.0002656292292410444, 'optimizer': 'adam'}
[I 2025-05-13 14:44:20,467] Trial 68 finished with value: 0.0008910445612855256 and parameters: {'n_layers': 4, 'n_units': 380, 'activation': 'sigmoid', 'lr': 0.0002656292292410444, 'optimizer': 'adam'}. Best is trial 24 with value: 0.0006855232641100883.
Training model with trial #69 and params: {'n_layers': 4, 'n_units': 341, 'activation': 'elu', 'lr': 0.0002147142638723957, 'optimizer': 'adam'}
[I 2025-05-13 15:51:50,533] Trial 69 finished with value: 0.001070006052032113 and parameters: {'n_layers': 4, 'n_units': 341, 'activation': 'elu', 'lr': 0.0002147142638723957, 'optimizer': 'adam'}. Best is trial 24 with value: 0.0006855232641100883.
Training model with trial #70 and params: {'n_layers': 9, 'n_units': 300, 'activation': 'swish', 'lr': 0.000564091641774545, 'optimizer': 'adam'}
[I 2025-05-13 17:45:27,636] Trial 70 finished with value: 0.001870986190624535 and parameters: {'n_layers': 9, 'n_units': 300, 'activation': 'swish', 'lr': 0.000564091641774545, 'optimizer': 'adam'}. Best is trial 24 with value: 0.0006855232641100883.
Training model with trial #71 and params: {'n_layers': 3, 'n_units': 370, 'activation': 'sigmoid', 'lr': 0.00016896363035963117, 'optimizer': 'adam'}
[I 2025-05-13 20:02:32,695] Trial 71 finished with value: 0.0008756055613048375 and parameters: {'n_layers': 3, 'n_units': 370, 'activation': 'sigmoid', 'lr': 0.00016896363035963117, 'optimizer': 'adam'}. Best is trial 24 with value: 0.0006855232641100883.
Training model with trial #72 and params: {'n_layers': 3, 'n_units': 321, 'activation': 'sigmoid', 'lr': 0.00011234194911228421, 'optimizer': 'adam'}
[I 2025-05-13 22:01:43,522] Trial 72 finished with value: 0.0011150224599987268 and parameters: {'n_layers': 3, 'n_units': 321, 'activation': 'sigmoid', 'lr': 0.00011234194911228421, 'optimizer': 'adam'}. Best is trial 24 with value: 0.0006855232641100883.
Training model with trial #73 and params: {'n_layers': 2, 'n_units': 347, 'activation': 'sigmoid', 'lr': 0.00015890245726301328, 'optimizer': 'adam'}
[I 2025-05-13 23:45:13,170] Trial 73 finished with value: 0.0017735252622514963 and parameters: {'n_layers': 2, 'n_units': 347, 'activation': 'sigmoid', 'lr': 0.00015890245726301328, 'optimizer': 'adam'}. Best is trial 24 with value: 0.0006855232641100883.
Training model with trial #74 and params: {'n_layers': 4, 'n_units': 392, 'activation': 'sigmoid', 'lr': 0.00018602787401886733, 'optimizer': 'adam'}
[I 2025-05-14 01:36:49,502] Trial 74 finished with value: 0.000754993874579668 and parameters: {'n_layers': 4, 'n_units': 392, 'activation': 'sigmoid', 'lr': 0.00018602787401886733, 'optimizer': 'adam'}. Best is trial 24 with value: 0.0006855232641100883.
Training model with trial #75 and params: {'n_layers': 4, 'n_units': 397, 'activation': 'sigmoid', 'lr': 0.00018642109852562837, 'optimizer': 'adam'}
[I 2025-05-14 03:19:29,766] Trial 75 finished with value: 0.0007710389327257872 and parameters: {'n_layers': 4, 'n_units': 397, 'activation': 'sigmoid', 'lr': 0.00018642109852562837, 'optimizer': 'adam'}. Best is trial 24 with value: 0.0006855232641100883.
Training model with trial #76 and params: {'n_layers': 5, 'n_units': 462, 'activation': 'gelu', 'lr': 0.00018478032131192848, 'optimizer': 'adam'}
[I 2025-05-14 04:30:40,215] Trial 76 finished with value: 0.0020286848302930593 and parameters: {'n_layers': 5, 'n_units': 462, 'activation': 'gelu', 'lr': 0.00018478032131192848, 'optimizer': 'adam'}. Best is trial 24 with value: 0.0006855232641100883.
Training model with trial #77 and params: {'n_layers': 4, 'n_units': 276, 'activation': 'sigmoid', 'lr': 0.000238346885637728, 'optimizer': 'adam'}
[I 2025-05-14 05:46:36,365] Trial 77 finished with value: 0.0008392432355321944 and parameters: {'n_layers': 4, 'n_units': 276, 'activation': 'sigmoid', 'lr': 0.000238346885637728, 'optimizer': 'adam'}. Best is trial 24 with value: 0.0006855232641100883.
Training model with trial #78 and params: {'n_layers': 4, 'n_units': 396, 'activation': 'relu', 'lr': 0.00032244457436458076, 'optimizer': 'AdamW'}
[I 2025-05-14 06:06:03,324] Trial 78 finished with value: 0.045421238988637924 and parameters: {'n_layers': 4, 'n_units': 396, 'activation': 'relu', 'lr': 0.00032244457436458076, 'optimizer': 'AdamW'}. Best is trial 24 with value: 0.0006855232641100883.
Training model with trial #79 and params: {'n_layers': 5, 'n_units': 449, 'activation': 'sigmoid', 'lr': 0.00040950284579883105, 'optimizer': 'adam'}
[I 2025-05-14 08:03:00,430] Trial 79 finished with value: 0.0016324068419635296 and parameters: {'n_layers': 5, 'n_units': 449, 'activation': 'sigmoid', 'lr': 0.00040950284579883105, 'optimizer': 'adam'}. Best is trial 24 with value: 0.0006855232641100883.
Training model with trial #80 and params: {'n_layers': 4, 'n_units': 328, 'activation': 'leaky_relu', 'lr': 0.0007265328639258714, 'optimizer': 'rmsprop'}
[I 2025-05-14 09:01:16,081] Trial 80 finished with value: 0.0035586077719926834 and parameters: {'n_layers': 4, 'n_units': 328, 'activation': 'leaky_relu', 'lr': 0.0007265328639258714, 'optimizer': 'rmsprop'}. Best is trial 24 with value: 0.0006855232641100883.
Training model with trial #81 and params: {'n_layers': 4, 'n_units': 416, 'activation': 'sigmoid', 'lr': 0.00013453288443076515, 'optimizer': 'adam'}
[I 2025-05-14 11:30:41,040] Trial 81 finished with value: 0.0007765355403535068 and parameters: {'n_layers': 4, 'n_units': 416, 'activation': 'sigmoid', 'lr': 0.00013453288443076515, 'optimizer': 'adam'}. Best is trial 24 with value: 0.0006855232641100883.
Training model with trial #82 and params: {'n_layers': 4, 'n_units': 416, 'activation': 'sigmoid', 'lr': 0.00014882569916869318, 'optimizer': 'adam'}
