[I 2025-05-13 04:23:51,047] Trial 45 finished with value: 0.1029825508594513 and parameters: {'n_layers': 2, 'n_units': 443, 'activation': 'swish', 'lr': 0.0003521716238767853, 'optimizer': 'sgd'}. Best is trial 33 with value: 0.0007122000097297132.
Training model with trial #46 and params: {'n_layers': 6, 'n_units': 285, 'activation': 'sigmoid', 'lr': 0.00016952224209015906, 'optimizer': 'rmsprop'}
[I 2025-05-13 06:39:59,895] Trial 46 finished with value: 0.009493854828178883 and parameters: {'n_layers': 6, 'n_units': 285, 'activation': 'sigmoid', 'lr': 0.00016952224209015906, 'optimizer': 'rmsprop'}. Best is trial 33 with value: 0.0007122000097297132.
Training model with trial #47 and params: {'n_layers': 4, 'n_units': 361, 'activation': 'sigmoid', 'lr': 0.0014766015330933899, 'optimizer': 'RAdam'}
[I 2025-05-13 08:13:31,308] Trial 47 finished with value: 0.0009298025397583842 and parameters: {'n_layers': 4, 'n_units': 361, 'activation': 'sigmoid', 'lr': 0.0014766015330933899, 'optimizer': 'RAdam'}. Best is trial 33 with value: 0.0007122000097297132.
Training model with trial #48 and params: {'n_layers': 5, 'n_units': 413, 'activation': 'tanh', 'lr': 0.0006787995705949949, 'optimizer': 'RAdam'}
[I 2025-05-13 09:09:28,797] Trial 48 finished with value: 0.0018701998051255941 and parameters: {'n_layers': 5, 'n_units': 413, 'activation': 'tanh', 'lr': 0.0006787995705949949, 'optimizer': 'RAdam'}. Best is trial 33 with value: 0.0007122000097297132.
Training model with trial #49 and params: {'n_layers': 3, 'n_units': 386, 'activation': 'selu', 'lr': 0.0002955008083253876, 'optimizer': 'RAdam'}
[I 2025-05-13 10:04:47,661] Trial 49 finished with value: 0.0011962174903601408 and parameters: {'n_layers': 3, 'n_units': 386, 'activation': 'selu', 'lr': 0.0002955008083253876, 'optimizer': 'RAdam'}. Best is trial 33 with value: 0.0007122000097297132.
Training model with trial #50 and params: {'n_layers': 4, 'n_units': 157, 'activation': 'sigmoid', 'lr': 0.00023012374739799074, 'optimizer': 'sgd'}
[I 2025-05-13 10:37:07,191] Trial 50 finished with value: 1.02777099609375 and parameters: {'n_layers': 4, 'n_units': 157, 'activation': 'sigmoid', 'lr': 0.00023012374739799074, 'optimizer': 'sgd'}. Best is trial 33 with value: 0.0007122000097297132.
Training model with trial #51 and params: {'n_layers': 3, 'n_units': 367, 'activation': 'sigmoid', 'lr': 0.00016296153688301996, 'optimizer': 'RAdam'}
[I 2025-05-13 13:21:49,845] Trial 51 finished with value: 0.0008759161573834717 and parameters: {'n_layers': 3, 'n_units': 367, 'activation': 'sigmoid', 'lr': 0.00016296153688301996, 'optimizer': 'RAdam'}. Best is trial 33 with value: 0.0007122000097297132.
Training model with trial #52 and params: {'n_layers': 2, 'n_units': 306, 'activation': 'sigmoid', 'lr': 0.00012629189044011251, 'optimizer': 'RAdam'}
[I 2025-05-13 15:13:51,773] Trial 52 finished with value: 0.0021687811240553856 and parameters: {'n_layers': 2, 'n_units': 306, 'activation': 'sigmoid', 'lr': 0.00012629189044011251, 'optimizer': 'RAdam'}. Best is trial 33 with value: 0.0007122000097297132.
Training model with trial #53 and params: {'n_layers': 3, 'n_units': 357, 'activation': 'sigmoid', 'lr': 0.00020400839568153128, 'optimizer': 'RAdam'}
[I 2025-05-13 17:55:55,994] Trial 53 finished with value: 0.0006988785462453961 and parameters: {'n_layers': 3, 'n_units': 357, 'activation': 'sigmoid', 'lr': 0.00020400839568153128, 'optimizer': 'RAdam'}. Best is trial 53 with value: 0.0006988785462453961.
Training model with trial #54 and params: {'n_layers': 4, 'n_units': 335, 'activation': 'gelu', 'lr': 0.00018816664211749058, 'optimizer': 'RAdam'}
[I 2025-05-13 19:03:04,112] Trial 54 finished with value: 0.0015328668523579836 and parameters: {'n_layers': 4, 'n_units': 335, 'activation': 'gelu', 'lr': 0.00018816664211749058, 'optimizer': 'RAdam'}. Best is trial 53 with value: 0.0006988785462453961.
Training model with trial #55 and params: {'n_layers': 3, 'n_units': 451, 'activation': 'sigmoid', 'lr': 0.003378291846331587, 'optimizer': 'adam'}
[I 2025-05-13 19:43:03,184] Trial 55 finished with value: 0.0016586448764428496 and parameters: {'n_layers': 3, 'n_units': 451, 'activation': 'sigmoid', 'lr': 0.003378291846331587, 'optimizer': 'adam'}. Best is trial 53 with value: 0.0006988785462453961.
Training model with trial #56 and params: {'n_layers': 2, 'n_units': 244, 'activation': 'elu', 'lr': 0.0004897261990711397, 'optimizer': 'RAdam'}
[I 2025-05-13 20:31:20,148] Trial 56 finished with value: 0.0007691708742640913 and parameters: {'n_layers': 2, 'n_units': 244, 'activation': 'elu', 'lr': 0.0004897261990711397, 'optimizer': 'RAdam'}. Best is trial 53 with value: 0.0006988785462453961.
Training model with trial #57 and params: {'n_layers': 1, 'n_units': 236, 'activation': 'elu', 'lr': 0.0005003329259363751, 'optimizer': 'RAdam'}
[I 2025-05-13 21:17:04,109] Trial 57 finished with value: 0.008869897574186325 and parameters: {'n_layers': 1, 'n_units': 236, 'activation': 'elu', 'lr': 0.0005003329259363751, 'optimizer': 'RAdam'}. Best is trial 53 with value: 0.0006988785462453961.
Training model with trial #58 and params: {'n_layers': 2, 'n_units': 163, 'activation': 'elu', 'lr': 0.00041789684444371175, 'optimizer': 'AdamW'}
[I 2025-05-13 21:24:23,419] Trial 58 finished with value: 0.11808715015649796 and parameters: {'n_layers': 2, 'n_units': 163, 'activation': 'elu', 'lr': 0.00041789684444371175, 'optimizer': 'AdamW'}. Best is trial 53 with value: 0.0006988785462453961.
Training model with trial #59 and params: {'n_layers': 2, 'n_units': 239, 'activation': 'elu', 'lr': 0.0002726604407786119, 'optimizer': 'rmsprop'}
[I 2025-05-13 21:49:36,424] Trial 59 finished with value: 0.003687927732244134 and parameters: {'n_layers': 2, 'n_units': 239, 'activation': 'elu', 'lr': 0.0002726604407786119, 'optimizer': 'rmsprop'}. Best is trial 53 with value: 0.0006988785462453961.
Training model with trial #60 and params: {'n_layers': 1, 'n_units': 293, 'activation': 'relu', 'lr': 0.0003709077407077416, 'optimizer': 'RAdam'}
[I 2025-05-13 22:38:12,068] Trial 60 finished with value: 0.003564411774277687 and parameters: {'n_layers': 1, 'n_units': 293, 'activation': 'relu', 'lr': 0.0003709077407077416, 'optimizer': 'RAdam'}. Best is trial 53 with value: 0.0006988785462453961.
Training model with trial #61 and params: {'n_layers': 3, 'n_units': 425, 'activation': 'sigmoid', 'lr': 0.00020819326880409917, 'optimizer': 'RAdam'}
[I 2025-05-14 01:12:45,902] Trial 61 finished with value: 0.0007217184756882489 and parameters: {'n_layers': 3, 'n_units': 425, 'activation': 'sigmoid', 'lr': 0.00020819326880409917, 'optimizer': 'RAdam'}. Best is trial 53 with value: 0.0006988785462453961.
Training model with trial #62 and params: {'n_layers': 3, 'n_units': 423, 'activation': 'leaky_relu', 'lr': 0.00021442957531765788, 'optimizer': 'RAdam'}
[I 2025-05-14 02:45:34,571] Trial 62 finished with value: 0.0018239355413243175 and parameters: {'n_layers': 3, 'n_units': 423, 'activation': 'leaky_relu', 'lr': 0.00021442957531765788, 'optimizer': 'RAdam'}. Best is trial 53 with value: 0.0006988785462453961.
Training model with trial #63 and params: {'n_layers': 2, 'n_units': 473, 'activation': 'sigmoid', 'lr': 0.00030919588839573725, 'optimizer': 'RAdam'}
[I 2025-05-14 04:25:56,887] Trial 63 finished with value: 0.001037755748257041 and parameters: {'n_layers': 2, 'n_units': 473, 'activation': 'sigmoid', 'lr': 0.00030919588839573725, 'optimizer': 'RAdam'}. Best is trial 53 with value: 0.0006988785462453961.
Training model with trial #64 and params: {'n_layers': 3, 'n_units': 396, 'activation': 'elu', 'lr': 0.00022363876706044166, 'optimizer': 'RAdam'}
[I 2025-05-14 05:16:11,906] Trial 64 finished with value: 0.0011700489558279514 and parameters: {'n_layers': 3, 'n_units': 396, 'activation': 'elu', 'lr': 0.00022363876706044166, 'optimizer': 'RAdam'}. Best is trial 53 with value: 0.0006988785462453961.
Training model with trial #65 and params: {'n_layers': 2, 'n_units': 432, 'activation': 'sigmoid', 'lr': 0.0001227590343616726, 'optimizer': 'RAdam'}
[I 2025-05-14 07:20:53,574] Trial 65 finished with value: 0.0021243616938591003 and parameters: {'n_layers': 2, 'n_units': 432, 'activation': 'sigmoid', 'lr': 0.0001227590343616726, 'optimizer': 'RAdam'}. Best is trial 53 with value: 0.0006988785462453961.
Training model with trial #66 and params: {'n_layers': 4, 'n_units': 283, 'activation': 'swish', 'lr': 0.00010010641560614978, 'optimizer': 'adam'}
[I 2025-05-14 09:11:30,905] Trial 66 finished with value: 0.0010227389866486192 and parameters: {'n_layers': 4, 'n_units': 283, 'activation': 'swish', 'lr': 0.00010010641560614978, 'optimizer': 'adam'}. Best is trial 53 with value: 0.0006988785462453961.
Training model with trial #67 and params: {'n_layers': 3, 'n_units': 353, 'activation': 'sigmoid', 'lr': 0.0007388825696740204, 'optimizer': 'RAdam'}
[I 2025-05-14 10:19:42,011] Trial 67 finished with value: 0.0007489584968425333 and parameters: {'n_layers': 3, 'n_units': 353, 'activation': 'sigmoid', 'lr': 0.0007388825696740204, 'optimizer': 'RAdam'}. Best is trial 53 with value: 0.0006988785462453961.
Training model with trial #68 and params: {'n_layers': 3, 'n_units': 350, 'activation': 'sigmoid', 'lr': 0.0010373441231673803, 'optimizer': 'RAdam'}
[I 2025-05-14 11:35:51,772] Trial 68 finished with value: 0.0008374612662009895 and parameters: {'n_layers': 3, 'n_units': 350, 'activation': 'sigmoid', 'lr': 0.0010373441231673803, 'optimizer': 'RAdam'}. Best is trial 53 with value: 0.0006988785462453961.
Training model with trial #69 and params: {'n_layers': 3, 'n_units': 327, 'activation': 'relu', 'lr': 0.0007680037421510246, 'optimizer': 'RAdam'}
[I 2025-05-14 12:20:19,147] Trial 69 finished with value: 0.0017204445321112871 and parameters: {'n_layers': 3, 'n_units': 327, 'activation': 'relu', 'lr': 0.0007680037421510246, 'optimizer': 'RAdam'}. Best is trial 53 with value: 0.0006988785462453961.
Training model with trial #70 and params: {'n_layers': 2, 'n_units': 193, 'activation': 'tanh', 'lr': 0.0005423571465511048, 'optimizer': 'RAdam'}
