[I 2025-05-11 09:48:35,977] Trial 45 finished with value: 0.0011068412568420172 and parameters: {'n_layers': 3, 'n_units': 291, 'activation': 'elu', 'lr': 0.0004656667437335959, 'optimizer': 'RAdam'}. Best is trial 15 with value: 0.0010094376048073173.
Training model with trial #46 and params: {'n_layers': 1, 'n_units': 301, 'activation': 'elu', 'lr': 0.0003546080306943396, 'optimizer': 'RAdam'}
[I 2025-05-11 10:39:26,217] Trial 46 finished with value: 0.01039194781333208 and parameters: {'n_layers': 1, 'n_units': 301, 'activation': 'elu', 'lr': 0.0003546080306943396, 'optimizer': 'RAdam'}. Best is trial 15 with value: 0.0010094376048073173.
Training model with trial #47 and params: {'n_layers': 4, 'n_units': 327, 'activation': 'elu', 'lr': 0.0004268523120221755, 'optimizer': 'AdamW'}
[I 2025-05-11 10:54:02,114] Trial 47 finished with value: 0.032421499490737915 and parameters: {'n_layers': 4, 'n_units': 327, 'activation': 'elu', 'lr': 0.0004268523120221755, 'optimizer': 'AdamW'}. Best is trial 15 with value: 0.0010094376048073173.
Training model with trial #48 and params: {'n_layers': 5, 'n_units': 62, 'activation': 'elu', 'lr': 0.0002529789643518315, 'optimizer': 'RAdam'}
[I 2025-05-11 11:12:59,578] Trial 48 finished with value: 0.0010812290711328387 and parameters: {'n_layers': 5, 'n_units': 62, 'activation': 'elu', 'lr': 0.0002529789643518315, 'optimizer': 'RAdam'}. Best is trial 15 with value: 0.0010094376048073173.
Training model with trial #49 and params: {'n_layers': 5, 'n_units': 348, 'activation': 'tanh', 'lr': 0.0002855492909780229, 'optimizer': 'RAdam'}
[I 2025-05-11 11:53:57,169] Trial 49 finished with value: 0.002235487336292863 and parameters: {'n_layers': 5, 'n_units': 348, 'activation': 'tanh', 'lr': 0.0002855492909780229, 'optimizer': 'RAdam'}. Best is trial 15 with value: 0.0010094376048073173.
Training model with trial #50 and params: {'n_layers': 8, 'n_units': 63, 'activation': 'sigmoid', 'lr': 0.0005211634469378903, 'optimizer': 'RAdam'}
[I 2025-05-11 12:00:26,883] Trial 50 finished with value: 1.0276976823806763 and parameters: {'n_layers': 8, 'n_units': 63, 'activation': 'sigmoid', 'lr': 0.0005211634469378903, 'optimizer': 'RAdam'}. Best is trial 15 with value: 0.0010094376048073173.
Training model with trial #51 and params: {'n_layers': 4, 'n_units': 224, 'activation': 'elu', 'lr': 0.00025648650380990146, 'optimizer': 'RAdam'}
[I 2025-05-11 12:32:47,984] Trial 51 finished with value: 0.0011063165729865432 and parameters: {'n_layers': 4, 'n_units': 224, 'activation': 'elu', 'lr': 0.00025648650380990146, 'optimizer': 'RAdam'}. Best is trial 15 with value: 0.0010094376048073173.
Training model with trial #52 and params: {'n_layers': 5, 'n_units': 296, 'activation': 'elu', 'lr': 0.0002526097050969589, 'optimizer': 'RAdam'}
[I 2025-05-11 13:23:49,262] Trial 52 finished with value: 0.0009758936939761043 and parameters: {'n_layers': 5, 'n_units': 296, 'activation': 'elu', 'lr': 0.0002526097050969589, 'optimizer': 'RAdam'}. Best is trial 52 with value: 0.0009758936939761043.
Training model with trial #53 and params: {'n_layers': 5, 'n_units': 288, 'activation': 'elu', 'lr': 0.00022342264193412617, 'optimizer': 'RAdam'}
[I 2025-05-11 14:27:06,975] Trial 53 finished with value: 0.0014386421535164118 and parameters: {'n_layers': 5, 'n_units': 288, 'activation': 'elu', 'lr': 0.00022342264193412617, 'optimizer': 'RAdam'}. Best is trial 52 with value: 0.0009758936939761043.
Training model with trial #54 and params: {'n_layers': 6, 'n_units': 381, 'activation': 'elu', 'lr': 0.000252821081204815, 'optimizer': 'RAdam'}
[I 2025-05-11 16:01:20,807] Trial 54 finished with value: 0.0010586823336780071 and parameters: {'n_layers': 6, 'n_units': 381, 'activation': 'elu', 'lr': 0.000252821081204815, 'optimizer': 'RAdam'}. Best is trial 52 with value: 0.0009758936939761043.
Training model with trial #55 and params: {'n_layers': 6, 'n_units': 420, 'activation': 'elu', 'lr': 0.0001533710957255528, 'optimizer': 'RAdam'}
[I 2025-05-11 17:21:24,959] Trial 55 finished with value: 0.0013581239618360996 and parameters: {'n_layers': 6, 'n_units': 420, 'activation': 'elu', 'lr': 0.0001533710957255528, 'optimizer': 'RAdam'}. Best is trial 52 with value: 0.0009758936939761043.
Training model with trial #56 and params: {'n_layers': 7, 'n_units': 377, 'activation': 'elu', 'lr': 0.0002633635260854595, 'optimizer': 'RAdam'}
[I 2025-05-11 19:48:11,057] Trial 56 finished with value: 0.001355488202534616 and parameters: {'n_layers': 7, 'n_units': 377, 'activation': 'elu', 'lr': 0.0002633635260854595, 'optimizer': 'RAdam'}. Best is trial 52 with value: 0.0009758936939761043.
Training model with trial #57 and params: {'n_layers': 6, 'n_units': 452, 'activation': 'elu', 'lr': 0.00010555824727827295, 'optimizer': 'RAdam'}
[I 2025-05-11 22:12:43,974] Trial 57 finished with value: 0.001648607081733644 and parameters: {'n_layers': 6, 'n_units': 452, 'activation': 'elu', 'lr': 0.00010555824727827295, 'optimizer': 'RAdam'}. Best is trial 52 with value: 0.0009758936939761043.
Training model with trial #58 and params: {'n_layers': 8, 'n_units': 18, 'activation': 'elu', 'lr': 0.00016167169699715677, 'optimizer': 'rmsprop'}
[I 2025-05-11 22:54:35,745] Trial 58 finished with value: 0.004901816137135029 and parameters: {'n_layers': 8, 'n_units': 18, 'activation': 'elu', 'lr': 0.00016167169699715677, 'optimizer': 'rmsprop'}. Best is trial 52 with value: 0.0009758936939761043.
Training model with trial #59 and params: {'n_layers': 5, 'n_units': 398, 'activation': 'elu', 'lr': 0.00041830722020597854, 'optimizer': 'RAdam'}
[I 2025-05-11 23:47:01,029] Trial 59 finished with value: 0.0011581738945096731 and parameters: {'n_layers': 5, 'n_units': 398, 'activation': 'elu', 'lr': 0.00041830722020597854, 'optimizer': 'RAdam'}. Best is trial 52 with value: 0.0009758936939761043.
Training model with trial #60 and params: {'n_layers': 4, 'n_units': 366, 'activation': 'elu', 'lr': 0.00019029278412145462, 'optimizer': 'RAdam'}
[I 2025-05-12 00:35:20,561] Trial 60 finished with value: 0.0012370540061965585 and parameters: {'n_layers': 4, 'n_units': 366, 'activation': 'elu', 'lr': 0.00019029278412145462, 'optimizer': 'RAdam'}. Best is trial 52 with value: 0.0009758936939761043.
Training model with trial #61 and params: {'n_layers': 5, 'n_units': 384, 'activation': 'elu', 'lr': 0.00040866551753133165, 'optimizer': 'RAdam'}
[I 2025-05-12 02:08:21,313] Trial 61 finished with value: 0.0007928260019980371 and parameters: {'n_layers': 5, 'n_units': 384, 'activation': 'elu', 'lr': 0.00040866551753133165, 'optimizer': 'RAdam'}. Best is trial 61 with value: 0.0007928260019980371.
Training model with trial #62 and params: {'n_layers': 6, 'n_units': 466, 'activation': 'elu', 'lr': 0.0002599961037172996, 'optimizer': 'RAdam'}
[I 2025-05-12 04:20:15,564] Trial 62 finished with value: 0.0008842126117087901 and parameters: {'n_layers': 6, 'n_units': 466, 'activation': 'elu', 'lr': 0.0002599961037172996, 'optimizer': 'RAdam'}. Best is trial 61 with value: 0.0007928260019980371.
Training model with trial #63 and params: {'n_layers': 6, 'n_units': 489, 'activation': 'elu', 'lr': 0.0002553796841533879, 'optimizer': 'RAdam'}
[I 2025-05-12 10:20:46,453] Trial 63 finished with value: 0.0009448543423786759 and parameters: {'n_layers': 6, 'n_units': 489, 'activation': 'elu', 'lr': 0.0002553796841533879, 'optimizer': 'RAdam'}. Best is trial 61 with value: 0.0007928260019980371.
Training model with trial #64 and params: {'n_layers': 7, 'n_units': 493, 'activation': 'relu', 'lr': 0.00018776168348295672, 'optimizer': 'RAdam'}
[I 2025-05-12 13:13:03,208] Trial 64 finished with value: 0.001686709700152278 and parameters: {'n_layers': 7, 'n_units': 493, 'activation': 'relu', 'lr': 0.00018776168348295672, 'optimizer': 'RAdam'}. Best is trial 61 with value: 0.0007928260019980371.
Training model with trial #65 and params: {'n_layers': 6, 'n_units': 481, 'activation': 'swish', 'lr': 0.00035270450510995475, 'optimizer': 'sgd'}
[I 2025-05-12 21:20:28,942] Trial 65 finished with value: 0.04920437932014465 and parameters: {'n_layers': 6, 'n_units': 481, 'activation': 'swish', 'lr': 0.00035270450510995475, 'optimizer': 'sgd'}. Best is trial 61 with value: 0.0007928260019980371.
Training model with trial #66 and params: {'n_layers': 6, 'n_units': 452, 'activation': 'elu', 'lr': 0.00023866372469825067, 'optimizer': 'RAdam'}
[I 2025-05-13 00:05:54,041] Trial 66 finished with value: 0.0007831401890143752 and parameters: {'n_layers': 6, 'n_units': 452, 'activation': 'elu', 'lr': 0.00023866372469825067, 'optimizer': 'RAdam'}. Best is trial 66 with value: 0.0007831401890143752.
Training model with trial #67 and params: {'n_layers': 7, 'n_units': 464, 'activation': 'elu', 'lr': 0.00029989828949784594, 'optimizer': 'RAdam'}
[I 2025-05-13 01:56:14,539] Trial 67 finished with value: 0.0013414127752184868 and parameters: {'n_layers': 7, 'n_units': 464, 'activation': 'elu', 'lr': 0.00029989828949784594, 'optimizer': 'RAdam'}. Best is trial 66 with value: 0.0007831401890143752.
Training model with trial #68 and params: {'n_layers': 8, 'n_units': 441, 'activation': 'tanh', 'lr': 0.00015985864112872495, 'optimizer': 'RAdam'}
[I 2025-05-13 04:54:09,052] Trial 68 finished with value: 0.0029070801101624966 and parameters: {'n_layers': 8, 'n_units': 441, 'activation': 'tanh', 'lr': 0.00015985864112872495, 'optimizer': 'RAdam'}. Best is trial 66 with value: 0.0007831401890143752.
Training model with trial #69 and params: {'n_layers': 6, 'n_units': 402, 'activation': 'gelu', 'lr': 0.0006211468137898026, 'optimizer': 'AdamW'}
[I 2025-05-13 05:37:08,442] Trial 69 finished with value: 0.017323214560747147 and parameters: {'n_layers': 6, 'n_units': 402, 'activation': 'gelu', 'lr': 0.0006211468137898026, 'optimizer': 'AdamW'}. Best is trial 66 with value: 0.0007831401890143752.
Training model with trial #70 and params: {'n_layers': 6, 'n_units': 470, 'activation': 'selu', 'lr': 0.00011644614929089273, 'optimizer': 'RAdam'}
[I 2025-05-13 06:54:14,275] Trial 70 finished with value: 0.0015492744278162718 and parameters: {'n_layers': 6, 'n_units': 470, 'activation': 'selu', 'lr': 0.00011644614929089273, 'optimizer': 'RAdam'}. Best is trial 66 with value: 0.0007831401890143752.
Training model with trial #71 and params: {'n_layers': 6, 'n_units': 497, 'activation': 'elu', 'lr': 0.00024468203695498543, 'optimizer': 'RAdam'}
[I 2025-05-13 09:09:09,713] Trial 71 finished with value: 0.0010326476767659187 and parameters: {'n_layers': 6, 'n_units': 497, 'activation': 'elu', 'lr': 0.00024468203695498543, 'optimizer': 'RAdam'}. Best is trial 66 with value: 0.0007831401890143752.
Training model with trial #72 and params: {'n_layers': 6, 'n_units': 512, 'activation': 'elu', 'lr': 0.00022591283179319537, 'optimizer': 'RAdam'}
[I 2025-05-13 14:50:04,806] Trial 72 finished with value: 0.0010577087523415685 and parameters: {'n_layers': 6, 'n_units': 512, 'activation': 'elu', 'lr': 0.00022591283179319537, 'optimizer': 'RAdam'}. Best is trial 66 with value: 0.0007831401890143752.
Training model with trial #73 and params: {'n_layers': 7, 'n_units': 509, 'activation': 'elu', 'lr': 0.00022877152395795348, 'optimizer': 'RAdam'}
[I 2025-05-13 19:43:59,863] Trial 73 finished with value: 0.0011333707952871919 and parameters: {'n_layers': 7, 'n_units': 509, 'activation': 'elu', 'lr': 0.00022877152395795348, 'optimizer': 'RAdam'}. Best is trial 66 with value: 0.0007831401890143752.
Training model with trial #74 and params: {'n_layers': 7, 'n_units': 493, 'activation': 'elu', 'lr': 0.00018149677955170616, 'optimizer': 'RAdam'}
[I 2025-05-13 22:41:46,009] Trial 74 finished with value: 0.0015484289033338428 and parameters: {'n_layers': 7, 'n_units': 493, 'activation': 'elu', 'lr': 0.00018149677955170616, 'optimizer': 'RAdam'}. Best is trial 66 with value: 0.0007831401890143752.
Training model with trial #75 and params: {'n_layers': 6, 'n_units': 481, 'activation': 'elu', 'lr': 0.000134521422738933, 'optimizer': 'RAdam'}
[I 2025-05-14 00:42:40,811] Trial 75 finished with value: 0.0015026964247226715 and parameters: {'n_layers': 6, 'n_units': 481, 'activation': 'elu', 'lr': 0.000134521422738933, 'optimizer': 'RAdam'}. Best is trial 66 with value: 0.0007831401890143752.
Training model with trial #76 and params: {'n_layers': 6, 'n_units': 438, 'activation': 'elu', 'lr': 0.00037256712041387687, 'optimizer': 'rmsprop'}
[I 2025-05-14 02:58:39,628] Trial 76 finished with value: 0.005044793244451284 and parameters: {'n_layers': 6, 'n_units': 438, 'activation': 'elu', 'lr': 0.00037256712041387687, 'optimizer': 'rmsprop'}. Best is trial 66 with value: 0.0007831401890143752.
Training model with trial #77 and params: {'n_layers': 5, 'n_units': 421, 'activation': 'selu', 'lr': 0.0002899980683487961, 'optimizer': 'sgd'}
[I 2025-05-14 06:30:31,770] Trial 77 finished with value: 0.019586995244026184 and parameters: {'n_layers': 5, 'n_units': 421, 'activation': 'selu', 'lr': 0.0002899980683487961, 'optimizer': 'sgd'}. Best is trial 66 with value: 0.0007831401890143752.
Training model with trial #78 and params: {'n_layers': 7, 'n_units': 494, 'activation': 'sigmoid', 'lr': 0.0002051770486308162, 'optimizer': 'RAdam'}
