[I 2025-05-11 15:58:28,239] Trial 45 finished with value: 0.004050698596984148 and parameters: {'n_layers': 4, 'n_units': 433, 'activation': 'elu', 'lr': 0.009674795930953274, 'optimizer': 'adam'}. Best is trial 43 with value: 0.0008483233395963907.
Training model with trial #46 and params: {'n_layers': 5, 'n_units': 429, 'activation': 'elu', 'lr': 0.00039384623546589943, 'optimizer': 'adam'}
[I 2025-05-11 16:39:27,464] Trial 46 finished with value: 0.0014335490996018052 and parameters: {'n_layers': 5, 'n_units': 429, 'activation': 'elu', 'lr': 0.00039384623546589943, 'optimizer': 'adam'}. Best is trial 43 with value: 0.0008483233395963907.
Training model with trial #47 and params: {'n_layers': 4, 'n_units': 511, 'activation': 'elu', 'lr': 0.0007920647064485327, 'optimizer': 'adam'}
[I 2025-05-11 18:04:27,397] Trial 47 finished with value: 0.0016112449811771512 and parameters: {'n_layers': 4, 'n_units': 511, 'activation': 'elu', 'lr': 0.0007920647064485327, 'optimizer': 'adam'}. Best is trial 43 with value: 0.0008483233395963907.
Training model with trial #48 and params: {'n_layers': 6, 'n_units': 371, 'activation': 'elu', 'lr': 0.0005653841851716874, 'optimizer': 'adam'}
[I 2025-05-11 19:28:34,035] Trial 48 finished with value: 0.0015475691761821508 and parameters: {'n_layers': 6, 'n_units': 371, 'activation': 'elu', 'lr': 0.0005653841851716874, 'optimizer': 'adam'}. Best is trial 43 with value: 0.0008483233395963907.
Training model with trial #49 and params: {'n_layers': 3, 'n_units': 474, 'activation': 'elu', 'lr': 0.00013978846186978735, 'optimizer': 'rmsprop'}
[I 2025-05-11 21:15:43,820] Trial 49 finished with value: 0.0024312215391546488 and parameters: {'n_layers': 3, 'n_units': 474, 'activation': 'elu', 'lr': 0.00013978846186978735, 'optimizer': 'rmsprop'}. Best is trial 43 with value: 0.0008483233395963907.
Training model with trial #50 and params: {'n_layers': 4, 'n_units': 233, 'activation': 'elu', 'lr': 0.000455567981333618, 'optimizer': 'adam'}
[I 2025-05-11 21:40:45,442] Trial 50 finished with value: 0.0016050842823460698 and parameters: {'n_layers': 4, 'n_units': 233, 'activation': 'elu', 'lr': 0.000455567981333618, 'optimizer': 'adam'}. Best is trial 43 with value: 0.0008483233395963907.
Training model with trial #51 and params: {'n_layers': 3, 'n_units': 322, 'activation': 'relu', 'lr': 0.00030831768460995896, 'optimizer': 'RAdam'}
[I 2025-05-11 22:43:24,808] Trial 51 finished with value: 0.0016539492644369602 and parameters: {'n_layers': 3, 'n_units': 322, 'activation': 'relu', 'lr': 0.00030831768460995896, 'optimizer': 'RAdam'}. Best is trial 43 with value: 0.0008483233395963907.
Training model with trial #52 and params: {'n_layers': 3, 'n_units': 282, 'activation': 'gelu', 'lr': 0.00037307543173141326, 'optimizer': 'RAdam'}
[I 2025-05-11 23:15:57,263] Trial 52 finished with value: 0.0015994991408661008 and parameters: {'n_layers': 3, 'n_units': 282, 'activation': 'gelu', 'lr': 0.00037307543173141326, 'optimizer': 'RAdam'}. Best is trial 43 with value: 0.0008483233395963907.
Training model with trial #53 and params: {'n_layers': 3, 'n_units': 407, 'activation': 'elu', 'lr': 0.0002752933934152355, 'optimizer': 'RAdam'}
[I 2025-05-12 00:21:21,215] Trial 53 finished with value: 0.0013041456695646048 and parameters: {'n_layers': 3, 'n_units': 407, 'activation': 'elu', 'lr': 0.0002752933934152355, 'optimizer': 'RAdam'}. Best is trial 43 with value: 0.0008483233395963907.
Training model with trial #54 and params: {'n_layers': 5, 'n_units': 243, 'activation': 'swish', 'lr': 0.003910762284690029, 'optimizer': 'adam'}
[I 2025-05-12 00:55:53,715] Trial 54 finished with value: 0.002811962738633156 and parameters: {'n_layers': 5, 'n_units': 243, 'activation': 'swish', 'lr': 0.003910762284690029, 'optimizer': 'adam'}. Best is trial 43 with value: 0.0008483233395963907.
Training model with trial #55 and params: {'n_layers': 3, 'n_units': 468, 'activation': 'selu', 'lr': 0.0003705599071622206, 'optimizer': 'RAdam'}
[I 2025-05-12 01:58:56,365] Trial 55 finished with value: 0.0010408902307972312 and parameters: {'n_layers': 3, 'n_units': 468, 'activation': 'selu', 'lr': 0.0003705599071622206, 'optimizer': 'RAdam'}. Best is trial 43 with value: 0.0008483233395963907.
Training model with trial #56 and params: {'n_layers': 4, 'n_units': 467, 'activation': 'selu', 'lr': 0.00025442138280631747, 'optimizer': 'RAdam'}
[I 2025-05-12 03:26:43,844] Trial 56 finished with value: 0.0010285819880664349 and parameters: {'n_layers': 4, 'n_units': 467, 'activation': 'selu', 'lr': 0.00025442138280631747, 'optimizer': 'RAdam'}. Best is trial 43 with value: 0.0008483233395963907.
Training model with trial #57 and params: {'n_layers': 4, 'n_units': 472, 'activation': 'selu', 'lr': 0.00017670795149227298, 'optimizer': 'rmsprop'}
[I 2025-05-12 05:18:15,163] Trial 57 finished with value: 0.0015175016596913338 and parameters: {'n_layers': 4, 'n_units': 472, 'activation': 'selu', 'lr': 0.00017670795149227298, 'optimizer': 'rmsprop'}. Best is trial 43 with value: 0.0008483233395963907.
Training model with trial #58 and params: {'n_layers': 10, 'n_units': 486, 'activation': 'selu', 'lr': 0.0002613510534280201, 'optimizer': 'RAdam'}
[I 2025-05-12 14:01:04,535] Trial 58 finished with value: 0.0009601758792996407 and parameters: {'n_layers': 10, 'n_units': 486, 'activation': 'selu', 'lr': 0.0002613510534280201, 'optimizer': 'RAdam'}. Best is trial 43 with value: 0.0008483233395963907.
Training model with trial #59 and params: {'n_layers': 8, 'n_units': 490, 'activation': 'selu', 'lr': 0.0002472072410421182, 'optimizer': 'RAdam'}
[I 2025-05-12 16:45:22,938] Trial 59 finished with value: 0.0015140109462663531 and parameters: {'n_layers': 8, 'n_units': 490, 'activation': 'selu', 'lr': 0.0002472072410421182, 'optimizer': 'RAdam'}. Best is trial 43 with value: 0.0008483233395963907.
Training model with trial #60 and params: {'n_layers': 10, 'n_units': 454, 'activation': 'selu', 'lr': 0.00011135206460101273, 'optimizer': 'RAdam'}
[I 2025-05-12 18:52:09,499] Trial 60 finished with value: 0.0013206680305302143 and parameters: {'n_layers': 10, 'n_units': 454, 'activation': 'selu', 'lr': 0.00011135206460101273, 'optimizer': 'RAdam'}. Best is trial 43 with value: 0.0008483233395963907.
Training model with trial #61 and params: {'n_layers': 9, 'n_units': 450, 'activation': 'selu', 'lr': 0.0003640218788059794, 'optimizer': 'RAdam'}
[I 2025-05-12 20:39:37,006] Trial 61 finished with value: 0.001445336383767426 and parameters: {'n_layers': 9, 'n_units': 450, 'activation': 'selu', 'lr': 0.0003640218788059794, 'optimizer': 'RAdam'}. Best is trial 43 with value: 0.0008483233395963907.
Training model with trial #62 and params: {'n_layers': 2, 'n_units': 486, 'activation': 'selu', 'lr': 0.00020015688521444664, 'optimizer': 'sgd'}
[I 2025-05-12 23:22:57,902] Trial 62 finished with value: 0.11109906435012817 and parameters: {'n_layers': 2, 'n_units': 486, 'activation': 'selu', 'lr': 0.00020015688521444664, 'optimizer': 'sgd'}. Best is trial 43 with value: 0.0008483233395963907.
Training model with trial #63 and params: {'n_layers': 9, 'n_units': 450, 'activation': 'selu', 'lr': 0.00029022900624298495, 'optimizer': 'RAdam'}
[I 2025-05-13 02:16:33,194] Trial 63 finished with value: 0.0011376566253602505 and parameters: {'n_layers': 9, 'n_units': 450, 'activation': 'selu', 'lr': 0.00029022900624298495, 'optimizer': 'RAdam'}. Best is trial 43 with value: 0.0008483233395963907.
Training model with trial #64 and params: {'n_layers': 4, 'n_units': 511, 'activation': 'selu', 'lr': 0.00024203519959691133, 'optimizer': 'RAdam'}
[I 2025-05-13 04:38:08,084] Trial 64 finished with value: 0.001121077104471624 and parameters: {'n_layers': 4, 'n_units': 511, 'activation': 'selu', 'lr': 0.00024203519959691133, 'optimizer': 'RAdam'}. Best is trial 43 with value: 0.0008483233395963907.
Training model with trial #65 and params: {'n_layers': 3, 'n_units': 491, 'activation': 'selu', 'lr': 0.00014961103634207194, 'optimizer': 'RAdam'}
[I 2025-05-13 06:20:28,983] Trial 65 finished with value: 0.0007770961383357644 and parameters: {'n_layers': 3, 'n_units': 491, 'activation': 'selu', 'lr': 0.00014961103634207194, 'optimizer': 'RAdam'}. Best is trial 65 with value: 0.0007770961383357644.
Training model with trial #66 and params: {'n_layers': 2, 'n_units': 410, 'activation': 'selu', 'lr': 0.00015359382291374945, 'optimizer': 'RAdam'}
[I 2025-05-13 08:28:54,922] Trial 66 finished with value: 0.0007580164819955826 and parameters: {'n_layers': 2, 'n_units': 410, 'activation': 'selu', 'lr': 0.00015359382291374945, 'optimizer': 'RAdam'}. Best is trial 66 with value: 0.0007580164819955826.
Training model with trial #67 and params: {'n_layers': 2, 'n_units': 411, 'activation': 'selu', 'lr': 0.00015473466267516402, 'optimizer': 'RAdam'}
[I 2025-05-13 10:35:17,980] Trial 67 finished with value: 0.0008225748315453529 and parameters: {'n_layers': 2, 'n_units': 411, 'activation': 'selu', 'lr': 0.00015473466267516402, 'optimizer': 'RAdam'}. Best is trial 66 with value: 0.0007580164819955826.
Training model with trial #68 and params: {'n_layers': 2, 'n_units': 418, 'activation': 'selu', 'lr': 0.00012552692743347598, 'optimizer': 'RAdam'}
[I 2025-05-13 12:48:04,891] Trial 68 finished with value: 0.0009158718748949468 and parameters: {'n_layers': 2, 'n_units': 418, 'activation': 'selu', 'lr': 0.00012552692743347598, 'optimizer': 'RAdam'}. Best is trial 66 with value: 0.0007580164819955826.
Training model with trial #69 and params: {'n_layers': 1, 'n_units': 404, 'activation': 'selu', 'lr': 0.00012557243621632956, 'optimizer': 'RAdam'}
[I 2025-05-13 13:59:45,221] Trial 69 finished with value: 0.01150423102080822 and parameters: {'n_layers': 1, 'n_units': 404, 'activation': 'selu', 'lr': 0.00012557243621632956, 'optimizer': 'RAdam'}. Best is trial 66 with value: 0.0007580164819955826.
Training model with trial #70 and params: {'n_layers': 2, 'n_units': 412, 'activation': 'selu', 'lr': 0.00015388278804015254, 'optimizer': 'RAdam'}
[I 2025-05-13 16:05:59,065] Trial 70 finished with value: 0.0009515043930150568 and parameters: {'n_layers': 2, 'n_units': 412, 'activation': 'selu', 'lr': 0.00015388278804015254, 'optimizer': 'RAdam'}. Best is trial 66 with value: 0.0007580164819955826.
Training model with trial #71 and params: {'n_layers': 2, 'n_units': 417, 'activation': 'selu', 'lr': 0.0001571132665309688, 'optimizer': 'RAdam'}
[I 2025-05-13 18:34:36,672] Trial 71 finished with value: 0.0009104848140850663 and parameters: {'n_layers': 2, 'n_units': 417, 'activation': 'selu', 'lr': 0.0001571132665309688, 'optimizer': 'RAdam'}. Best is trial 66 with value: 0.0007580164819955826.
Training model with trial #72 and params: {'n_layers': 2, 'n_units': 413, 'activation': 'selu', 'lr': 0.00015531072559693646, 'optimizer': 'RAdam'}
[I 2025-05-13 20:16:14,849] Trial 72 finished with value: 0.0008651129901409149 and parameters: {'n_layers': 2, 'n_units': 413, 'activation': 'selu', 'lr': 0.00015531072559693646, 'optimizer': 'RAdam'}. Best is trial 66 with value: 0.0007580164819955826.
Training model with trial #73 and params: {'n_layers': 2, 'n_units': 413, 'activation': 'selu', 'lr': 0.00016021374960584415, 'optimizer': 'RAdam'}
[I 2025-05-13 22:18:24,767] Trial 73 finished with value: 0.0008546945755369961 and parameters: {'n_layers': 2, 'n_units': 413, 'activation': 'selu', 'lr': 0.00016021374960584415, 'optimizer': 'RAdam'}. Best is trial 66 with value: 0.0007580164819955826.
Training model with trial #74 and params: {'n_layers': 1, 'n_units': 412, 'activation': 'selu', 'lr': 0.0001263135689634651, 'optimizer': 'RAdam'}
[I 2025-05-13 23:22:02,394] Trial 74 finished with value: 0.011936373077332973 and parameters: {'n_layers': 1, 'n_units': 412, 'activation': 'selu', 'lr': 0.0001263135689634651, 'optimizer': 'RAdam'}. Best is trial 66 with value: 0.0007580164819955826.
Training model with trial #75 and params: {'n_layers': 2, 'n_units': 421, 'activation': 'selu', 'lr': 0.00010118783543449287, 'optimizer': 'AdamW'}
[I 2025-05-13 23:33:51,341] Trial 75 finished with value: 0.15294356644153595 and parameters: {'n_layers': 2, 'n_units': 421, 'activation': 'selu', 'lr': 0.00010118783543449287, 'optimizer': 'AdamW'}. Best is trial 66 with value: 0.0007580164819955826.
Training model with trial #76 and params: {'n_layers': 2, 'n_units': 385, 'activation': 'selu', 'lr': 0.00015914540165670708, 'optimizer': 'RAdam'}
[I 2025-05-14 01:06:55,717] Trial 76 finished with value: 0.0008236196590587497 and parameters: {'n_layers': 2, 'n_units': 385, 'activation': 'selu', 'lr': 0.00015914540165670708, 'optimizer': 'RAdam'}. Best is trial 66 with value: 0.0007580164819955826.
Training model with trial #77 and params: {'n_layers': 1, 'n_units': 391, 'activation': 'selu', 'lr': 0.00014914890684177373, 'optimizer': 'RAdam'}
[I 2025-05-14 02:13:09,389] Trial 77 finished with value: 0.011086691170930862 and parameters: {'n_layers': 1, 'n_units': 391, 'activation': 'selu', 'lr': 0.00014914890684177373, 'optimizer': 'RAdam'}. Best is trial 66 with value: 0.0007580164819955826.
Training model with trial #78 and params: {'n_layers': 2, 'n_units': 388, 'activation': 'leaky_relu', 'lr': 0.00016026432918951774, 'optimizer': 'RAdam'}
[I 2025-05-14 04:03:04,231] Trial 78 finished with value: 0.0019524127710610628 and parameters: {'n_layers': 2, 'n_units': 388, 'activation': 'leaky_relu', 'lr': 0.00016026432918951774, 'optimizer': 'RAdam'}. Best is trial 66 with value: 0.0007580164819955826.
Training model with trial #79 and params: {'n_layers': 2, 'n_units': 383, 'activation': 'gelu', 'lr': 0.0001782420319256888, 'optimizer': 'RAdam'}
[I 2025-05-14 05:09:24,372] Trial 79 finished with value: 0.0013410208048298955 and parameters: {'n_layers': 2, 'n_units': 383, 'activation': 'gelu', 'lr': 0.0001782420319256888, 'optimizer': 'RAdam'}. Best is trial 66 with value: 0.0007580164819955826.
Training model with trial #80 and params: {'n_layers': 1, 'n_units': 380, 'activation': 'selu', 'lr': 0.0001973976653811533, 'optimizer': 'sgd'}
[I 2025-05-14 05:56:55,383] Trial 80 finished with value: 0.441842257976532 and parameters: {'n_layers': 1, 'n_units': 380, 'activation': 'selu', 'lr': 0.0001973976653811533, 'optimizer': 'sgd'}. Best is trial 66 with value: 0.0007580164819955826.
Training model with trial #81 and params: {'n_layers': 2, 'n_units': 345, 'activation': 'selu', 'lr': 0.00011904883822024192, 'optimizer': 'RAdam'}
[I 2025-05-14 07:49:37,147] Trial 81 finished with value: 0.0010519798379391432 and parameters: {'n_layers': 2, 'n_units': 345, 'activation': 'selu', 'lr': 0.00011904883822024192, 'optimizer': 'RAdam'}. Best is trial 66 with value: 0.0007580164819955826.
Training model with trial #82 and params: {'n_layers': 2, 'n_units': 418, 'activation': 'selu', 'lr': 0.00013652993448051611, 'optimizer': 'RAdam'}
[I 2025-05-14 09:39:38,945] Trial 82 finished with value: 0.0008090106421150267 and parameters: {'n_layers': 2, 'n_units': 418, 'activation': 'selu', 'lr': 0.00013652993448051611, 'optimizer': 'RAdam'}. Best is trial 66 with value: 0.0007580164819955826.
Training model with trial #83 and params: {'n_layers': 2, 'n_units': 444, 'activation': 'selu', 'lr': 0.00014035222700113786, 'optimizer': 'RAdam'}
[I 2025-05-14 11:58:30,284] Trial 83 finished with value: 0.0009583982755430043 and parameters: {'n_layers': 2, 'n_units': 444, 'activation': 'selu', 'lr': 0.00014035222700113786, 'optimizer': 'RAdam'}. Best is trial 66 with value: 0.0007580164819955826.
Training model with trial #84 and params: {'n_layers': 1, 'n_units': 429, 'activation': 'relu', 'lr': 0.0001640751493876617, 'optimizer': 'RAdam'}
