[I 2025-05-20 09:35:53,820] Trial 96 finished with value: 0.0010371209355071187 and parameters: {'n_layers': 6, 'n_units': 400, 'activation': 'gelu', 'lr': 0.00021819427623453208, 'optimizer': 'RAdam', 'batch_size': 1724}. Best is trial 7 with value: 0.0007263197330757976.
Training model with params: layers=4, units=144, activation=selu, optimizer=RAdam, lr=0.00011040119944673237, batchsize=1809
Finish Trainingstep 1 of 3 with lr=0.00011040119944673237 and 1000 epochs
Finish Trainingstep 2 of 3 with lr=0.00011040119944673237 and 1000 epochs
Finish Trainingstep 3 of 3 with lr=0.00011040119944673237 and 10000 epochs
2025-05-20_10-34-42
[I 2025-05-20 10:34:42,232] Trial 97 finished with value: 0.0029832227155566216 and parameters: {'n_layers': 4, 'n_units': 144, 'activation': 'selu', 'lr': 0.00011040119944673237, 'optimizer': 'RAdam', 'batch_size': 1809}. Best is trial 7 with value: 0.0007263197330757976.
Training model with params: layers=5, units=377, activation=elu, optimizer=adam, lr=0.00019325402618581696, batchsize=1840
Finish Trainingstep 1 of 3 with lr=0.00019325402618581696 and 1000 epochs
Finish Trainingstep 2 of 3 with lr=0.00019325402618581696 and 1000 epochs
Finish Trainingstep 3 of 3 with lr=0.00019325402618581696 and 10000 epochs
2025-05-20_11-13-47
[I 2025-05-20 11:13:48,012] Trial 98 finished with value: 0.001103091286495328 and parameters: {'n_layers': 5, 'n_units': 377, 'activation': 'elu', 'lr': 0.00019325402618581696, 'optimizer': 'adam', 'batch_size': 1840}. Best is trial 7 with value: 0.0007263197330757976.
Training model with params: layers=3, units=326, activation=sigmoid, optimizer=rmsprop, lr=0.0002538578039435199, batchsize=2048
Finish Trainingstep 1 of 3 with lr=0.0002538578039435199 and 1000 epochs
Finish Trainingstep 2 of 3 with lr=0.0002538578039435199 and 1000 epochs
Finish Trainingstep 3 of 3 with lr=0.0002538578039435199 and 10000 epochs
2025-05-20_12-10-07
[I 2025-05-20 12:10:07,655] Trial 99 finished with value: 0.00612275768071413 and parameters: {'n_layers': 3, 'n_units': 326, 'activation': 'sigmoid', 'lr': 0.0002538578039435199, 'optimizer': 'rmsprop', 'batch_size': 2048}. Best is trial 7 with value: 0.0007263197330757976.
Beste Parameter:
{'n_layers': 9, 'n_units': 286, 'activation': 'swish', 'lr': 0.00014406076176223185, 'optimizer': 'adam', 'batch_size': 1631}
