[I 2025-05-17 14:40:11,079] Trial 28 finished with value: 0.0025214077904820442 and parameters: {'n_layers': 9, 'n_units': 226, 'activation': 'elu', 'lr': 0.0019685839201724676, 'optimizer': 'adam', 'batch_size': 1797}. Best is trial 7 with value: 0.0007263197330757976.
Training model with params: layers=4, units=355, activation=swish, optimizer=AdamW, lr=0.004457271205316503, batchsize=1027
Finish Trainingstep 1 of 3 with lr=0.004457271205316503 and 1000 epochs
Finish Trainingstep 2 of 3 with lr=0.004457271205316503 and 1000 epochs
Finish Trainingstep 3 of 3 with lr=0.004457271205316503 and 10000 epochs
2025-05-17_15-00-23
[I 2025-05-17 15:00:24,003] Trial 29 finished with value: 0.002093804068863392 and parameters: {'n_layers': 4, 'n_units': 355, 'activation': 'swish', 'lr': 0.004457271205316503, 'optimizer': 'AdamW', 'batch_size': 1027}. Best is trial 7 with value: 0.0007263197330757976.
Training model with params: layers=2, units=43, activation=elu, optimizer=rmsprop, lr=0.0019224107555455739, batchsize=1332
Finish Trainingstep 1 of 3 with lr=0.0019224107555455739 and 1000 epochs
Finish Trainingstep 2 of 3 with lr=0.0019224107555455739 and 1000 epochs
Finish Trainingstep 3 of 3 with lr=0.0019224107555455739 and 10000 epochs
2025-05-17_15-23-35
[I 2025-05-17 15:23:35,610] Trial 30 finished with value: 0.003281553741544485 and parameters: {'n_layers': 2, 'n_units': 43, 'activation': 'elu', 'lr': 0.0019224107555455739, 'optimizer': 'rmsprop', 'batch_size': 1332}. Best is trial 7 with value: 0.0007263197330757976.
Training model with params: layers=4, units=126, activation=tanh, optimizer=adam, lr=0.00018639829495604562, batchsize=1789
Finish Trainingstep 1 of 3 with lr=0.00018639829495604562 and 1000 epochs
Finish Trainingstep 2 of 3 with lr=0.00018639829495604562 and 1000 epochs
Finish Trainingstep 3 of 3 with lr=0.00018639829495604562 and 10000 epochs
2025-05-17_16-12-35
[I 2025-05-17 16:12:35,591] Trial 31 finished with value: 0.0012195734307169914 and parameters: {'n_layers': 4, 'n_units': 126, 'activation': 'tanh', 'lr': 0.00018639829495604562, 'optimizer': 'adam', 'batch_size': 1789}. Best is trial 7 with value: 0.0007263197330757976.
Training model with params: layers=5, units=156, activation=gelu, optimizer=adam, lr=0.00010006343959761987, batchsize=170
Finish Trainingstep 1 of 3 with lr=0.00010006343959761987 and 1000 epochs
Finish Trainingstep 2 of 3 with lr=0.00010006343959761987 and 1000 epochs
Finish Trainingstep 3 of 3 with lr=0.00010006343959761987 and 10000 epochs
2025-05-17_18-30-30
[I 2025-05-17 18:30:30,171] Trial 32 finished with value: 0.001401999150402844 and parameters: {'n_layers': 5, 'n_units': 156, 'activation': 'gelu', 'lr': 0.00010006343959761987, 'optimizer': 'adam', 'batch_size': 170}. Best is trial 7 with value: 0.0007263197330757976.
Training model with params: layers=4, units=292, activation=gelu, optimizer=adam, lr=0.000378059415568589, batchsize=1648
Finish Trainingstep 1 of 3 with lr=0.000378059415568589 and 1000 epochs
Finish Trainingstep 2 of 3 with lr=0.000378059415568589 and 1000 epochs
Finish Trainingstep 3 of 3 with lr=0.000378059415568589 and 10000 epochs
2025-05-17_19-39-26
[I 2025-05-17 19:39:26,458] Trial 33 finished with value: 0.0012834661174565554 and parameters: {'n_layers': 4, 'n_units': 292, 'activation': 'gelu', 'lr': 0.000378059415568589, 'optimizer': 'adam', 'batch_size': 1648}. Best is trial 7 with value: 0.0007263197330757976.
Training model with params: layers=6, units=223, activation=leaky_relu, optimizer=adam, lr=0.0006629906264519265, batchsize=1445
Finish Trainingstep 1 of 3 with lr=0.0006629906264519265 and 1000 epochs
Finish Trainingstep 2 of 3 with lr=0.0006629906264519265 and 1000 epochs
Finish Trainingstep 3 of 3 with lr=0.0006629906264519265 and 10000 epochs
2025-05-17_20-15-00
[I 2025-05-17 20:15:00,743] Trial 34 finished with value: 0.00460124621167779 and parameters: {'n_layers': 6, 'n_units': 223, 'activation': 'leaky_relu', 'lr': 0.0006629906264519265, 'optimizer': 'adam', 'batch_size': 1445}. Best is trial 7 with value: 0.0007263197330757976.
Training model with params: layers=3, units=315, activation=tanh, optimizer=RAdam, lr=0.00030306685004103035, batchsize=1915
Finish Trainingstep 1 of 3 with lr=0.00030306685004103035 and 1000 epochs
Finish Trainingstep 2 of 3 with lr=0.00030306685004103035 and 1000 epochs
Finish Trainingstep 3 of 3 with lr=0.00030306685004103035 and 10000 epochs
2025-05-17_20-51-56
[I 2025-05-17 20:51:56,222] Trial 35 finished with value: 0.001074149738997221 and parameters: {'n_layers': 3, 'n_units': 315, 'activation': 'tanh', 'lr': 0.00030306685004103035, 'optimizer': 'RAdam', 'batch_size': 1915}. Best is trial 7 with value: 0.0007263197330757976.
Training model with params: layers=5, units=71, activation=relu, optimizer=adam, lr=0.0005131477345823957, batchsize=1753
Finish Trainingstep 1 of 3 with lr=0.0005131477345823957 and 1000 epochs
Finish Trainingstep 2 of 3 with lr=0.0005131477345823957 and 1000 epochs
Finish Trainingstep 3 of 3 with lr=0.0005131477345823957 and 10000 epochs
2025-05-17_21-15-59
[I 2025-05-17 21:16:00,033] Trial 36 finished with value: 0.0042442032136023045 and parameters: {'n_layers': 5, 'n_units': 71, 'activation': 'relu', 'lr': 0.0005131477345823957, 'optimizer': 'adam', 'batch_size': 1753}. Best is trial 7 with value: 0.0007263197330757976.
Training model with params: layers=2, units=249, activation=sigmoid, optimizer=AdamW, lr=0.00015061860714184102, batchsize=1543
Finish Trainingstep 1 of 3 with lr=0.00015061860714184102 and 1000 epochs
Finish Trainingstep 2 of 3 with lr=0.00015061860714184102 and 1000 epochs
Finish Trainingstep 3 of 3 with lr=0.00015061860714184102 and 10000 epochs
2025-05-17_21-26-14
[I 2025-05-17 21:26:14,104] Trial 37 finished with value: 0.01974048651754856 and parameters: {'n_layers': 2, 'n_units': 249, 'activation': 'sigmoid', 'lr': 0.00015061860714184102, 'optimizer': 'AdamW', 'batch_size': 1543}. Best is trial 7 with value: 0.0007263197330757976.
Training model with params: layers=6, units=202, activation=selu, optimizer=adam, lr=0.00021300359340416247, batchsize=1369
Finish Trainingstep 1 of 3 with lr=0.00021300359340416247 and 1000 epochs
Finish Trainingstep 2 of 3 with lr=0.00021300359340416247 and 1000 epochs
Finish Trainingstep 3 of 3 with lr=0.00021300359340416247 and 10000 epochs
2025-05-17_22-52-09
[I 2025-05-17 22:52:09,719] Trial 38 finished with value: 0.003898212220519781 and parameters: {'n_layers': 6, 'n_units': 202, 'activation': 'selu', 'lr': 0.00021300359340416247, 'optimizer': 'adam', 'batch_size': 1369}. Best is trial 7 with value: 0.0007263197330757976.
Training model with params: layers=5, units=283, activation=leaky_relu, optimizer=sgd, lr=0.0011209787605243578, batchsize=1893
Finish Trainingstep 1 of 3 with lr=0.0011209787605243578 and 1000 epochs
Finish Trainingstep 2 of 3 with lr=0.0011209787605243578 and 1000 epochs
Finish Trainingstep 3 of 3 with lr=0.0011209787605243578 and 10000 epochs
2025-05-18_00-16-04
[I 2025-05-18 00:16:04,127] Trial 39 finished with value: 0.08458048850297928 and parameters: {'n_layers': 5, 'n_units': 283, 'activation': 'leaky_relu', 'lr': 0.0011209787605243578, 'optimizer': 'sgd', 'batch_size': 1893}. Best is trial 7 with value: 0.0007263197330757976.
Training model with params: layers=4, units=118, activation=swish, optimizer=adam, lr=0.00032690086090766236, batchsize=1435
Finish Trainingstep 1 of 3 with lr=0.00032690086090766236 and 1000 epochs
Finish Trainingstep 2 of 3 with lr=0.00032690086090766236 and 1000 epochs
Finish Trainingstep 3 of 3 with lr=0.00032690086090766236 and 10000 epochs
2025-05-18_01-05-58
[I 2025-05-18 01:05:58,900] Trial 40 finished with value: 0.0011978113325312734 and parameters: {'n_layers': 4, 'n_units': 118, 'activation': 'swish', 'lr': 0.00032690086090766236, 'optimizer': 'adam', 'batch_size': 1435}. Best is trial 7 with value: 0.0007263197330757976.
Training model with params: layers=3, units=310, activation=tanh, optimizer=RAdam, lr=0.00028933895510621486, batchsize=2033
Finish Trainingstep 1 of 3 with lr=0.00028933895510621486 and 1000 epochs
Finish Trainingstep 2 of 3 with lr=0.00028933895510621486 and 1000 epochs
Finish Trainingstep 3 of 3 with lr=0.00028933895510621486 and 10000 epochs
2025-05-18_01-52-17
[I 2025-05-18 01:52:17,897] Trial 41 finished with value: 0.0010038079926744103 and parameters: {'n_layers': 3, 'n_units': 310, 'activation': 'tanh', 'lr': 0.00028933895510621486, 'optimizer': 'RAdam', 'batch_size': 2033}. Best is trial 7 with value: 0.0007263197330757976.
Training model with params: layers=3, units=344, activation=tanh, optimizer=RAdam, lr=0.0002407596623712548, batchsize=2027
Finish Trainingstep 1 of 3 with lr=0.0002407596623712548 and 1000 epochs
Finish Trainingstep 2 of 3 with lr=0.0002407596623712548 and 1000 epochs
Finish Trainingstep 3 of 3 with lr=0.0002407596623712548 and 10000 epochs
2025-05-18_02-40-06
[I 2025-05-18 02:40:07,034] Trial 42 finished with value: 0.0009466783376410604 and parameters: {'n_layers': 3, 'n_units': 344, 'activation': 'tanh', 'lr': 0.0002407596623712548, 'optimizer': 'RAdam', 'batch_size': 2027}. Best is trial 7 with value: 0.0007263197330757976.
Training model with params: layers=2, units=337, activation=tanh, optimizer=RAdam, lr=0.0001271805876248171, batchsize=1853
Finish Trainingstep 1 of 3 with lr=0.0001271805876248171 and 1000 epochs
Finish Trainingstep 2 of 3 with lr=0.0001271805876248171 and 1000 epochs
Finish Trainingstep 3 of 3 with lr=0.0001271805876248171 and 10000 epochs
2025-05-18_04-29-07
[I 2025-05-18 04:29:07,327] Trial 43 finished with value: 0.002175046131014824 and parameters: {'n_layers': 2, 'n_units': 337, 'activation': 'tanh', 'lr': 0.0001271805876248171, 'optimizer': 'RAdam', 'batch_size': 1853}. Best is trial 7 with value: 0.0007263197330757976.
Training model with params: layers=3, units=267, activation=tanh, optimizer=RAdam, lr=0.0002333360067213538, batchsize=1950
Finish Trainingstep 1 of 3 with lr=0.0002333360067213538 and 1000 epochs
Finish Trainingstep 2 of 3 with lr=0.0002333360067213538 and 1000 epochs
Finish Trainingstep 3 of 3 with lr=0.0002333360067213538 and 10000 epochs
2025-05-18_06-04-18
[I 2025-05-18 06:04:18,307] Trial 44 finished with value: 0.001018062001094222 and parameters: {'n_layers': 3, 'n_units': 267, 'activation': 'tanh', 'lr': 0.0002333360067213538, 'optimizer': 'RAdam', 'batch_size': 1950}. Best is trial 7 with value: 0.0007263197330757976.
Training model with params: layers=7, units=392, activation=gelu, optimizer=RAdam, lr=0.00043530193787698357, batchsize=785
Finish Trainingstep 1 of 3 with lr=0.00043530193787698357 and 1000 epochs
Finish Trainingstep 2 of 3 with lr=0.00043530193787698357 and 1000 epochs
Finish Trainingstep 3 of 3 with lr=0.00043530193787698357 and 10000 epochs
2025-05-18_07-17-49
[I 2025-05-18 07:17:50,032] Trial 45 finished with value: 0.0015376951778307557 and parameters: {'n_layers': 7, 'n_units': 392, 'activation': 'gelu', 'lr': 0.00043530193787698357, 'optimizer': 'RAdam', 'batch_size': 785}. Best is trial 7 with value: 0.0007263197330757976.
Training model with params: layers=4, units=430, activation=relu, optimizer=sgd, lr=0.0006580183787332252, batchsize=1729
Finish Trainingstep 1 of 3 with lr=0.0006580183787332252 and 1000 epochs
Finish Trainingstep 2 of 3 with lr=0.0006580183787332252 and 1000 epochs
Finish Trainingstep 3 of 3 with lr=0.0006580183787332252 and 10000 epochs
2025-05-18_08-34-00
[I 2025-05-18 08:34:00,352] Trial 46 finished with value: 0.11325746029615402 and parameters: {'n_layers': 4, 'n_units': 430, 'activation': 'relu', 'lr': 0.0006580183787332252, 'optimizer': 'sgd', 'batch_size': 1729}. Best is trial 7 with value: 0.0007263197330757976.
Training model with params: layers=1, units=337, activation=elu, optimizer=rmsprop, lr=0.0001672036101604606, batchsize=1602
Finish Trainingstep 1 of 3 with lr=0.0001672036101604606 and 1000 epochs
Finish Trainingstep 2 of 3 with lr=0.0001672036101604606 and 1000 epochs
Finish Trainingstep 3 of 3 with lr=0.0001672036101604606 and 10000 epochs
2025-05-18_09-06-12
[I 2025-05-18 09:06:12,304] Trial 47 finished with value: 0.013937551528215408 and parameters: {'n_layers': 1, 'n_units': 337, 'activation': 'elu', 'lr': 0.0001672036101604606, 'optimizer': 'rmsprop', 'batch_size': 1602}. Best is trial 7 with value: 0.0007263197330757976.
Training model with params: layers=8, units=162, activation=sigmoid, optimizer=adam, lr=0.0026213915974738467, batchsize=330
Finish Trainingstep 1 of 3 with lr=0.0026213915974738467 and 1000 epochs
Finish Trainingstep 2 of 3 with lr=0.0026213915974738467 and 1000 epochs
Finish Trainingstep 3 of 3 with lr=0.0026213915974738467 and 10000 epochs
2025-05-18_09-21-06
[I 2025-05-18 09:21:06,148] Trial 48 finished with value: 1.0254113674163818 and parameters: {'n_layers': 8, 'n_units': 162, 'activation': 'sigmoid', 'lr': 0.0026213915974738467, 'optimizer': 'adam', 'batch_size': 330}. Best is trial 7 with value: 0.0007263197330757976.
Training model with params: layers=3, units=240, activation=swish, optimizer=RAdam, lr=0.00012178929424670629, batchsize=1961
Finish Trainingstep 1 of 3 with lr=0.00012178929424670629 and 1000 epochs
Finish Trainingstep 2 of 3 with lr=0.00012178929424670629 and 1000 epochs
Finish Trainingstep 3 of 3 with lr=0.00012178929424670629 and 10000 epochs
2025-05-18_10-24-30
[I 2025-05-18 10:24:30,088] Trial 49 finished with value: 0.0018062922172248363 and parameters: {'n_layers': 3, 'n_units': 240, 'activation': 'swish', 'lr': 0.00012178929424670629, 'optimizer': 'RAdam', 'batch_size': 1961}. Best is trial 7 with value: 0.0007263197330757976.
Training model with params: layers=5, units=271, activation=selu, optimizer=AdamW, lr=0.00025660530112857366, batchsize=1679
Finish Trainingstep 1 of 3 with lr=0.00025660530112857366 and 1000 epochs
Finish Trainingstep 2 of 3 with lr=0.00025660530112857366 and 1000 epochs
Finish Trainingstep 3 of 3 with lr=0.00025660530112857366 and 10000 epochs
2025-05-18_10-40-11
[I 2025-05-18 10:40:11,308] Trial 50 finished with value: 0.005855003837496042 and parameters: {'n_layers': 5, 'n_units': 271, 'activation': 'selu', 'lr': 0.00025660530112857366, 'optimizer': 'AdamW', 'batch_size': 1679}. Best is trial 7 with value: 0.0007263197330757976.
Training model with params: layers=3, units=301, activation=tanh, optimizer=RAdam, lr=0.00028184160210223115, batchsize=2018
Finish Trainingstep 1 of 3 with lr=0.00028184160210223115 and 1000 epochs
Finish Trainingstep 2 of 3 with lr=0.00028184160210223115 and 1000 epochs
Finish Trainingstep 3 of 3 with lr=0.00028184160210223115 and 10000 epochs
2025-05-18_11-34-23
[I 2025-05-18 11:34:23,375] Trial 51 finished with value: 0.0009515113197267056 and parameters: {'n_layers': 3, 'n_units': 301, 'activation': 'tanh', 'lr': 0.00028184160210223115, 'optimizer': 'RAdam', 'batch_size': 2018}. Best is trial 7 with value: 0.0007263197330757976.
Training model with params: layers=3, units=368, activation=tanh, optimizer=RAdam, lr=0.00018417907238810105, batchsize=1843
Finish Trainingstep 1 of 3 with lr=0.00018417907238810105 and 1000 epochs
Finish Trainingstep 2 of 3 with lr=0.00018417907238810105 and 1000 epochs
Finish Trainingstep 3 of 3 with lr=0.00018417907238810105 and 10000 epochs
2025-05-18_12-26-26
[I 2025-05-18 12:26:26,805] Trial 52 finished with value: 0.0008564080926589668 and parameters: {'n_layers': 3, 'n_units': 368, 'activation': 'tanh', 'lr': 0.00018417907238810105, 'optimizer': 'RAdam', 'batch_size': 1843}. Best is trial 7 with value: 0.0007263197330757976.
Training model with params: layers=2, units=367, activation=tanh, optimizer=RAdam, lr=0.00018695160565872123, batchsize=2044
Finish Trainingstep 1 of 3 with lr=0.00018695160565872123 and 1000 epochs
Finish Trainingstep 2 of 3 with lr=0.00018695160565872123 and 1000 epochs
Finish Trainingstep 3 of 3 with lr=0.00018695160565872123 and 10000 epochs
2025-05-18_13-14-28
[I 2025-05-18 13:14:28,443] Trial 53 finished with value: 0.0021609978284686804 and parameters: {'n_layers': 2, 'n_units': 367, 'activation': 'tanh', 'lr': 0.00018695160565872123, 'optimizer': 'RAdam', 'batch_size': 2044}. Best is trial 7 with value: 0.0007263197330757976.
Training model with params: layers=3, units=422, activation=tanh, optimizer=RAdam, lr=0.0001315265686846878, batchsize=1853
Finish Trainingstep 1 of 3 with lr=0.0001315265686846878 and 1000 epochs
Finish Trainingstep 2 of 3 with lr=0.0001315265686846878 and 1000 epochs
Finish Trainingstep 3 of 3 with lr=0.0001315265686846878 and 10000 epochs
2025-05-18_14-13-22
[I 2025-05-18 14:13:23,037] Trial 54 finished with value: 0.0008717085001990199 and parameters: {'n_layers': 3, 'n_units': 422, 'activation': 'tanh', 'lr': 0.0001315265686846878, 'optimizer': 'RAdam', 'batch_size': 1853}. Best is trial 7 with value: 0.0007263197330757976.
Training model with params: layers=1, units=434, activation=tanh, optimizer=RAdam, lr=0.00012044828010171554, batchsize=1798
Finish Trainingstep 1 of 3 with lr=0.00012044828010171554 and 1000 epochs
Finish Trainingstep 2 of 3 with lr=0.00012044828010171554 and 1000 epochs
Finish Trainingstep 3 of 3 with lr=0.00012044828010171554 and 10000 epochs
2025-05-18_14-50-46
[I 2025-05-18 14:50:46,646] Trial 55 finished with value: 0.013411416672170162 and parameters: {'n_layers': 1, 'n_units': 434, 'activation': 'tanh', 'lr': 0.00012044828010171554, 'optimizer': 'RAdam', 'batch_size': 1798}. Best is trial 7 with value: 0.0007263197330757976.
Training model with params: layers=10, units=384, activation=tanh, optimizer=RAdam, lr=0.00015007537391475937, batchsize=1853
Finish Trainingstep 1 of 3 with lr=0.00015007537391475937 and 1000 epochs
Finish Trainingstep 2 of 3 with lr=0.00015007537391475937 and 1000 epochs
Finish Trainingstep 3 of 3 with lr=0.00015007537391475937 and 10000 epochs
2025-05-18_16-23-41
[I 2025-05-18 16:23:41,062] Trial 56 finished with value: 0.0018859953852370381 and parameters: {'n_layers': 10, 'n_units': 384, 'activation': 'tanh', 'lr': 0.00015007537391475937, 'optimizer': 'RAdam', 'batch_size': 1853}. Best is trial 7 with value: 0.0007263197330757976.
Training model with params: layers=9, units=419, activation=tanh, optimizer=RAdam, lr=0.0011859804784711608, batchsize=1542
Finish Trainingstep 1 of 3 with lr=0.0011859804784711608 and 1000 epochs
Finish Trainingstep 2 of 3 with lr=0.0011859804784711608 and 1000 epochs
Finish Trainingstep 3 of 3 with lr=0.0011859804784711608 and 10000 epochs
2025-05-18_16-59-58
[I 2025-05-18 16:59:58,654] Trial 57 finished with value: 0.0035282454919070005 and parameters: {'n_layers': 9, 'n_units': 419, 'activation': 'tanh', 'lr': 0.0011859804784711608, 'optimizer': 'RAdam', 'batch_size': 1542}. Best is trial 7 with value: 0.0007263197330757976.
Training model with params: layers=3, units=478, activation=elu, optimizer=RAdam, lr=0.00011018624049853873, batchsize=1712
Finish Trainingstep 1 of 3 with lr=0.00011018624049853873 and 1000 epochs
Finish Trainingstep 2 of 3 with lr=0.00011018624049853873 and 1000 epochs
Finish Trainingstep 3 of 3 with lr=0.00011018624049853873 and 10000 epochs
2025-05-18_18-07-15
[I 2025-05-18 18:07:15,523] Trial 58 finished with value: 0.0010196521179750562 and parameters: {'n_layers': 3, 'n_units': 478, 'activation': 'elu', 'lr': 0.00011018624049853873, 'optimizer': 'RAdam', 'batch_size': 1712}. Best is trial 7 with value: 0.0007263197330757976.
Training model with params: layers=2, units=340, activation=tanh, optimizer=RAdam, lr=0.0015243047889988894, batchsize=1618
Finish Trainingstep 1 of 3 with lr=0.0015243047889988894 and 1000 epochs
Finish Trainingstep 2 of 3 with lr=0.0015243047889988894 and 1000 epochs
Finish Trainingstep 3 of 3 with lr=0.0015243047889988894 and 10000 epochs
2025-05-18_18-40-52
[I 2025-05-18 18:40:52,643] Trial 59 finished with value: 0.001707648509182036 and parameters: {'n_layers': 2, 'n_units': 340, 'activation': 'tanh', 'lr': 0.0015243047889988894, 'optimizer': 'RAdam', 'batch_size': 1618}. Best is trial 7 with value: 0.0007263197330757976.
Training model with params: layers=4, units=412, activation=elu, optimizer=rmsprop, lr=0.00020957178137619807, batchsize=864
Finish Trainingstep 1 of 3 with lr=0.00020957178137619807 and 1000 epochs
Finish Trainingstep 2 of 3 with lr=0.00020957178137619807 and 1000 epochs
Finish Trainingstep 3 of 3 with lr=0.00020957178137619807 and 10000 epochs
2025-05-18_20-18-38
[I 2025-05-18 20:18:38,319] Trial 60 finished with value: 0.001828404376283288 and parameters: {'n_layers': 4, 'n_units': 412, 'activation': 'elu', 'lr': 0.00020957178137619807, 'optimizer': 'rmsprop', 'batch_size': 864}. Best is trial 7 with value: 0.0007263197330757976.
Training model with params: layers=3, units=304, activation=tanh, optimizer=RAdam, lr=0.0007459627333723911, batchsize=1961
Finish Trainingstep 1 of 3 with lr=0.0007459627333723911 and 1000 epochs
Finish Trainingstep 2 of 3 with lr=0.0007459627333723911 and 1000 epochs
Finish Trainingstep 3 of 3 with lr=0.0007459627333723911 and 10000 epochs
2025-05-18_20-58-03
[I 2025-05-18 20:58:03,717] Trial 61 finished with value: 0.0011545278830453753 and parameters: {'n_layers': 3, 'n_units': 304, 'activation': 'tanh', 'lr': 0.0007459627333723911, 'optimizer': 'RAdam', 'batch_size': 1961}. Best is trial 7 with value: 0.0007263197330757976.
Training model with params: layers=3, units=290, activation=tanh, optimizer=RAdam, lr=0.00015853679144106923, batchsize=1859
Finish Trainingstep 1 of 3 with lr=0.00015853679144106923 and 1000 epochs
Finish Trainingstep 2 of 3 with lr=0.00015853679144106923 and 1000 epochs
Finish Trainingstep 3 of 3 with lr=0.00015853679144106923 and 10000 epochs
2025-05-18_22-58-18
