[I 2025-05-18 22:58:18,928] Trial 62 finished with value: 0.0009081442258320749 and parameters: {'n_layers': 3, 'n_units': 290, 'activation': 'tanh', 'lr': 0.00015853679144106923, 'optimizer': 'RAdam', 'batch_size': 1859}. Best is trial 7 with value: 0.0007263197330757976.
Training model with params: layers=3, units=358, activation=tanh, optimizer=RAdam, lr=0.00014350660328873923, batchsize=1837
Finish Trainingstep 1 of 3 with lr=0.00014350660328873923 and 1000 epochs
Finish Trainingstep 2 of 3 with lr=0.00014350660328873923 and 1000 epochs
Finish Trainingstep 3 of 3 with lr=0.00014350660328873923 and 10000 epochs
2025-05-18_23-57-57
[I 2025-05-18 23:57:57,259] Trial 63 finished with value: 0.0011356916511431336 and parameters: {'n_layers': 3, 'n_units': 358, 'activation': 'tanh', 'lr': 0.00014350660328873923, 'optimizer': 'RAdam', 'batch_size': 1837}. Best is trial 7 with value: 0.0007263197330757976.
Training model with params: layers=4, units=456, activation=swish, optimizer=RAdam, lr=0.00017054402912929415, batchsize=1897
Finish Trainingstep 1 of 3 with lr=0.00017054402912929415 and 1000 epochs
Finish Trainingstep 2 of 3 with lr=0.00017054402912929415 and 1000 epochs
Finish Trainingstep 3 of 3 with lr=0.00017054402912929415 and 10000 epochs
2025-05-19_00-52-35
[I 2025-05-19 00:52:35,451] Trial 64 finished with value: 0.0008906592847779393 and parameters: {'n_layers': 4, 'n_units': 456, 'activation': 'swish', 'lr': 0.00017054402912929415, 'optimizer': 'RAdam', 'batch_size': 1897}. Best is trial 7 with value: 0.0007263197330757976.
Training model with params: layers=4, units=463, activation=swish, optimizer=RAdam, lr=0.00017433329739022644, batchsize=1742
Finish Trainingstep 1 of 3 with lr=0.00017433329739022644 and 1000 epochs
Finish Trainingstep 2 of 3 with lr=0.00017433329739022644 and 1000 epochs
Finish Trainingstep 3 of 3 with lr=0.00017433329739022644 and 10000 epochs
2025-05-19_02-05-15
[I 2025-05-19 02:05:16,028] Trial 65 finished with value: 0.0007530682487413287 and parameters: {'n_layers': 4, 'n_units': 463, 'activation': 'swish', 'lr': 0.00017433329739022644, 'optimizer': 'RAdam', 'batch_size': 1742}. Best is trial 7 with value: 0.0007263197330757976.
Training model with params: layers=4, units=474, activation=swish, optimizer=RAdam, lr=0.00016234403076187298, batchsize=1747
Finish Trainingstep 1 of 3 with lr=0.00016234403076187298 and 1000 epochs
Finish Trainingstep 2 of 3 with lr=0.00016234403076187298 and 1000 epochs
Finish Trainingstep 3 of 3 with lr=0.00016234403076187298 and 10000 epochs
2025-05-19_03-34-45
[I 2025-05-19 03:34:45,759] Trial 66 finished with value: 0.0010426337830722332 and parameters: {'n_layers': 4, 'n_units': 474, 'activation': 'swish', 'lr': 0.00016234403076187298, 'optimizer': 'RAdam', 'batch_size': 1747}. Best is trial 7 with value: 0.0007263197330757976.
Training model with params: layers=5, units=501, activation=swish, optimizer=RAdam, lr=0.00013556206470152952, batchsize=595
Finish Trainingstep 1 of 3 with lr=0.00013556206470152952 and 1000 epochs
Finish Trainingstep 2 of 3 with lr=0.00013556206470152952 and 1000 epochs
Finish Trainingstep 3 of 3 with lr=0.00013556206470152952 and 10000 epochs
2025-05-19_05-27-29
[I 2025-05-19 05:27:29,932] Trial 67 finished with value: 0.0010757212294265628 and parameters: {'n_layers': 5, 'n_units': 501, 'activation': 'swish', 'lr': 0.00013556206470152952, 'optimizer': 'RAdam', 'batch_size': 595}. Best is trial 7 with value: 0.0007263197330757976.
Training model with params: layers=4, units=492, activation=swish, optimizer=RAdam, lr=0.00017783203003293583, batchsize=1912
Finish Trainingstep 1 of 3 with lr=0.00017783203003293583 and 1000 epochs
Finish Trainingstep 2 of 3 with lr=0.00017783203003293583 and 1000 epochs
Finish Trainingstep 3 of 3 with lr=0.00017783203003293583 and 10000 epochs
2025-05-19_06-29-54
[I 2025-05-19 06:29:54,052] Trial 68 finished with value: 0.0009347429731860757 and parameters: {'n_layers': 4, 'n_units': 492, 'activation': 'swish', 'lr': 0.00017783203003293583, 'optimizer': 'RAdam', 'batch_size': 1912}. Best is trial 7 with value: 0.0007263197330757976.
Training model with params: layers=5, units=450, activation=swish, optimizer=RAdam, lr=0.00011174459472752827, batchsize=1674
Finish Trainingstep 1 of 3 with lr=0.00011174459472752827 and 1000 epochs
Finish Trainingstep 2 of 3 with lr=0.00011174459472752827 and 1000 epochs
Finish Trainingstep 3 of 3 with lr=0.00011174459472752827 and 10000 epochs
2025-05-19_08-03-07
[I 2025-05-19 08:03:07,447] Trial 69 finished with value: 0.001098207081668079 and parameters: {'n_layers': 5, 'n_units': 450, 'activation': 'swish', 'lr': 0.00011174459472752827, 'optimizer': 'RAdam', 'batch_size': 1674}. Best is trial 7 with value: 0.0007263197330757976.
Training model with params: layers=6, units=451, activation=swish, optimizer=sgd, lr=0.0054250462585026275, batchsize=1492
Finish Trainingstep 1 of 3 with lr=0.0054250462585026275 and 1000 epochs
Finish Trainingstep 2 of 3 with lr=0.0054250462585026275 and 1000 epochs
Finish Trainingstep 3 of 3 with lr=0.0054250462585026275 and 10000 epochs
2025-05-19_10-56-08
[I 2025-05-19 10:56:08,862] Trial 70 finished with value: 0.03972993418574333 and parameters: {'n_layers': 6, 'n_units': 451, 'activation': 'swish', 'lr': 0.0054250462585026275, 'optimizer': 'sgd', 'batch_size': 1492}. Best is trial 7 with value: 0.0007263197330757976.
Training model with params: layers=4, units=468, activation=swish, optimizer=adam, lr=0.00020663333006861717, batchsize=1585
Finish Trainingstep 1 of 3 with lr=0.00020663333006861717 and 1000 epochs
Finish Trainingstep 2 of 3 with lr=0.00020663333006861717 and 1000 epochs
Finish Trainingstep 3 of 3 with lr=0.00020663333006861717 and 10000 epochs
2025-05-19_12-21-45
[I 2025-05-19 12:21:45,579] Trial 71 finished with value: 0.000998291652649641 and parameters: {'n_layers': 4, 'n_units': 468, 'activation': 'swish', 'lr': 0.00020663333006861717, 'optimizer': 'adam', 'batch_size': 1585}. Best is trial 7 with value: 0.0007263197330757976.
Training model with params: layers=4, units=418, activation=leaky_relu, optimizer=adam, lr=0.0016805877281655013, batchsize=1814
Finish Trainingstep 1 of 3 with lr=0.0016805877281655013 and 1000 epochs
Finish Trainingstep 2 of 3 with lr=0.0016805877281655013 and 1000 epochs
Finish Trainingstep 3 of 3 with lr=0.0016805877281655013 and 10000 epochs
2025-05-19_12-54-37
[I 2025-05-19 12:54:37,736] Trial 72 finished with value: 0.004331046715378761 and parameters: {'n_layers': 4, 'n_units': 418, 'activation': 'leaky_relu', 'lr': 0.0016805877281655013, 'optimizer': 'adam', 'batch_size': 1814}. Best is trial 7 with value: 0.0007263197330757976.
Training model with params: layers=5, units=377, activation=elu, optimizer=AdamW, lr=0.0001336057952100535, batchsize=1740
Finish Trainingstep 1 of 3 with lr=0.0001336057952100535 and 1000 epochs
Finish Trainingstep 2 of 3 with lr=0.0001336057952100535 and 1000 epochs
Finish Trainingstep 3 of 3 with lr=0.0001336057952100535 and 10000 epochs
2025-05-19_13-22-21
[I 2025-05-19 13:22:21,650] Trial 73 finished with value: 0.004869072698056698 and parameters: {'n_layers': 5, 'n_units': 377, 'activation': 'elu', 'lr': 0.0001336057952100535, 'optimizer': 'AdamW', 'batch_size': 1740}. Best is trial 7 with value: 0.0007263197330757976.
Training model with params: layers=2, units=439, activation=swish, optimizer=RAdam, lr=0.000961751937899294, batchsize=1887
Finish Trainingstep 1 of 3 with lr=0.000961751937899294 and 1000 epochs
Finish Trainingstep 2 of 3 with lr=0.000961751937899294 and 1000 epochs
Finish Trainingstep 3 of 3 with lr=0.000961751937899294 and 10000 epochs
2025-05-19_14-11-21
[I 2025-05-19 14:11:21,626] Trial 74 finished with value: 0.002041920553892851 and parameters: {'n_layers': 2, 'n_units': 439, 'activation': 'swish', 'lr': 0.000961751937899294, 'optimizer': 'RAdam', 'batch_size': 1887}. Best is trial 7 with value: 0.0007263197330757976.
Training model with params: layers=4, units=491, activation=relu, optimizer=adam, lr=0.00010137513184684457, batchsize=1969
Finish Trainingstep 1 of 3 with lr=0.00010137513184684457 and 1000 epochs
Finish Trainingstep 2 of 3 with lr=0.00010137513184684457 and 1000 epochs
Finish Trainingstep 3 of 3 with lr=0.00010137513184684457 and 10000 epochs
2025-05-19_15-09-16
[I 2025-05-19 15:09:16,439] Trial 75 finished with value: 0.008882196620106697 and parameters: {'n_layers': 4, 'n_units': 491, 'activation': 'relu', 'lr': 0.00010137513184684457, 'optimizer': 'adam', 'batch_size': 1969}. Best is trial 7 with value: 0.0007263197330757976.
Training model with params: layers=4, units=93, activation=elu, optimizer=RAdam, lr=0.00016517916906629221, batchsize=1633
Finish Trainingstep 1 of 3 with lr=0.00016517916906629221 and 1000 epochs
Finish Trainingstep 2 of 3 with lr=0.00016517916906629221 and 1000 epochs
Finish Trainingstep 3 of 3 with lr=0.00016517916906629221 and 10000 epochs
2025-05-19_16-12-38
[I 2025-05-19 16:12:38,706] Trial 76 finished with value: 0.0013868969399482012 and parameters: {'n_layers': 4, 'n_units': 93, 'activation': 'elu', 'lr': 0.00016517916906629221, 'optimizer': 'RAdam', 'batch_size': 1633}. Best is trial 7 with value: 0.0007263197330757976.
Training model with params: layers=3, units=40, activation=sigmoid, optimizer=adam, lr=0.0003621822855464792, batchsize=1164
Finish Trainingstep 1 of 3 with lr=0.0003621822855464792 and 1000 epochs
Finish Trainingstep 2 of 3 with lr=0.0003621822855464792 and 1000 epochs
Finish Trainingstep 3 of 3 with lr=0.0003621822855464792 and 10000 epochs
2025-05-19_16-45-17
[I 2025-05-19 16:45:17,679] Trial 77 finished with value: 0.0034358352422714233 and parameters: {'n_layers': 3, 'n_units': 40, 'activation': 'sigmoid', 'lr': 0.0003621822855464792, 'optimizer': 'adam', 'batch_size': 1164}. Best is trial 7 with value: 0.0007263197330757976.
Training model with params: layers=3, units=281, activation=selu, optimizer=rmsprop, lr=0.0002032850879703982, batchsize=1403
Finish Trainingstep 1 of 3 with lr=0.0002032850879703982 and 1000 epochs
Finish Trainingstep 2 of 3 with lr=0.0002032850879703982 and 1000 epochs
Finish Trainingstep 3 of 3 with lr=0.0002032850879703982 and 10000 epochs
2025-05-19_17-50-06
[I 2025-05-19 17:50:06,886] Trial 78 finished with value: 0.004881029948592186 and parameters: {'n_layers': 3, 'n_units': 281, 'activation': 'selu', 'lr': 0.0002032850879703982, 'optimizer': 'rmsprop', 'batch_size': 1403}. Best is trial 7 with value: 0.0007263197330757976.
Training model with params: layers=5, units=406, activation=swish, optimizer=RAdam, lr=0.00026262733366582704, batchsize=1779
Finish Trainingstep 1 of 3 with lr=0.00026262733366582704 and 1000 epochs
Finish Trainingstep 2 of 3 with lr=0.00026262733366582704 and 1000 epochs
Finish Trainingstep 3 of 3 with lr=0.00026262733366582704 and 10000 epochs
2025-05-19_18-33-13
[I 2025-05-19 18:33:13,841] Trial 79 finished with value: 0.0010937709594145417 and parameters: {'n_layers': 5, 'n_units': 406, 'activation': 'swish', 'lr': 0.00026262733366582704, 'optimizer': 'RAdam', 'batch_size': 1779}. Best is trial 7 with value: 0.0007263197330757976.
Training model with params: layers=7, units=182, activation=elu, optimizer=adam, lr=0.00014832114772958863, batchsize=1703
Finish Trainingstep 1 of 3 with lr=0.00014832114772958863 and 1000 epochs
Finish Trainingstep 2 of 3 with lr=0.00014832114772958863 and 1000 epochs
Finish Trainingstep 3 of 3 with lr=0.00014832114772958863 and 10000 epochs
2025-05-19_19-19-10
[I 2025-05-19 19:19:10,816] Trial 80 finished with value: 0.0021627177484333515 and parameters: {'n_layers': 7, 'n_units': 182, 'activation': 'elu', 'lr': 0.00014832114772958863, 'optimizer': 'adam', 'batch_size': 1703}. Best is trial 7 with value: 0.0007263197330757976.
Training model with params: layers=4, units=511, activation=swish, optimizer=RAdam, lr=0.00018771456929425723, batchsize=1903
Finish Trainingstep 1 of 3 with lr=0.00018771456929425723 and 1000 epochs
Finish Trainingstep 2 of 3 with lr=0.00018771456929425723 and 1000 epochs
Finish Trainingstep 3 of 3 with lr=0.00018771456929425723 and 10000 epochs
2025-05-19_20-12-23
[I 2025-05-19 20:12:23,815] Trial 81 finished with value: 0.0009988037636503577 and parameters: {'n_layers': 4, 'n_units': 511, 'activation': 'swish', 'lr': 0.00018771456929425723, 'optimizer': 'RAdam', 'batch_size': 1903}. Best is trial 7 with value: 0.0007263197330757976.
Training model with params: layers=4, units=485, activation=swish, optimizer=RAdam, lr=0.0001719027935507113, batchsize=1863
Finish Trainingstep 1 of 3 with lr=0.0001719027935507113 and 1000 epochs
Finish Trainingstep 2 of 3 with lr=0.0001719027935507113 and 1000 epochs
Finish Trainingstep 3 of 3 with lr=0.0001719027935507113 and 10000 epochs
2025-05-19_21-10-09
[I 2025-05-19 21:10:09,234] Trial 82 finished with value: 0.0009441694710403681 and parameters: {'n_layers': 4, 'n_units': 485, 'activation': 'swish', 'lr': 0.0001719027935507113, 'optimizer': 'RAdam', 'batch_size': 1863}. Best is trial 7 with value: 0.0007263197330757976.
Training model with params: layers=5, units=458, activation=swish, optimizer=RAdam, lr=0.00012160963254405128, batchsize=1925
Finish Trainingstep 1 of 3 with lr=0.00012160963254405128 and 1000 epochs
Finish Trainingstep 2 of 3 with lr=0.00012160963254405128 and 1000 epochs
Finish Trainingstep 3 of 3 with lr=0.00012160963254405128 and 10000 epochs
2025-05-19_22-42-20
[I 2025-05-19 22:42:20,667] Trial 83 finished with value: 0.0010843111667782068 and parameters: {'n_layers': 5, 'n_units': 458, 'activation': 'swish', 'lr': 0.00012160963254405128, 'optimizer': 'RAdam', 'batch_size': 1925}. Best is trial 7 with value: 0.0007263197330757976.
Training model with params: layers=4, units=323, activation=swish, optimizer=RAdam, lr=0.00017207312707287153, batchsize=1480
Finish Trainingstep 1 of 3 with lr=0.00017207312707287153 and 1000 epochs
Finish Trainingstep 2 of 3 with lr=0.00017207312707287153 and 1000 epochs
Finish Trainingstep 3 of 3 with lr=0.00017207312707287153 and 10000 epochs
2025-05-19_23-55-25
[I 2025-05-19 23:55:25,342] Trial 84 finished with value: 0.0009803817374631763 and parameters: {'n_layers': 4, 'n_units': 323, 'activation': 'swish', 'lr': 0.00017207312707287153, 'optimizer': 'RAdam', 'batch_size': 1480}. Best is trial 7 with value: 0.0007263197330757976.
Training model with params: layers=2, units=252, activation=leaky_relu, optimizer=RAdam, lr=0.0004213503872738717, batchsize=1825
Finish Trainingstep 1 of 3 with lr=0.0004213503872738717 and 1000 epochs
Finish Trainingstep 2 of 3 with lr=0.0004213503872738717 and 1000 epochs
Finish Trainingstep 3 of 3 with lr=0.0004213503872738717 and 10000 epochs
2025-05-20_00-36-54
[I 2025-05-20 00:36:54,494] Trial 85 finished with value: 0.004739178344607353 and parameters: {'n_layers': 2, 'n_units': 252, 'activation': 'leaky_relu', 'lr': 0.0004213503872738717, 'optimizer': 'RAdam', 'batch_size': 1825}. Best is trial 7 with value: 0.0007263197330757976.
Training model with params: layers=3, units=492, activation=swish, optimizer=sgd, lr=0.00022843011435204482, batchsize=1976
Finish Trainingstep 1 of 3 with lr=0.00022843011435204482 and 1000 epochs
Finish Trainingstep 2 of 3 with lr=0.00022843011435204482 and 1000 epochs
Finish Trainingstep 3 of 3 with lr=0.00022843011435204482 and 10000 epochs
2025-05-20_01-49-34
[I 2025-05-20 01:49:34,686] Trial 86 finished with value: 0.9815036058425903 and parameters: {'n_layers': 3, 'n_units': 492, 'activation': 'swish', 'lr': 0.00022843011435204482, 'optimizer': 'sgd', 'batch_size': 1976}. Best is trial 7 with value: 0.0007263197330757976.
Training model with params: layers=4, units=460, activation=tanh, optimizer=adam, lr=0.0034467677207456206, batchsize=1759
Finish Trainingstep 1 of 3 with lr=0.0034467677207456206 and 1000 epochs
Finish Trainingstep 2 of 3 with lr=0.0034467677207456206 and 1000 epochs
Finish Trainingstep 3 of 3 with lr=0.0034467677207456206 and 10000 epochs
2025-05-20_02-11-08
[I 2025-05-20 02:11:08,678] Trial 87 finished with value: 0.002753317588940263 and parameters: {'n_layers': 4, 'n_units': 460, 'activation': 'tanh', 'lr': 0.0034467677207456206, 'optimizer': 'adam', 'batch_size': 1759}. Best is trial 7 with value: 0.0007263197330757976.
Training model with params: layers=8, units=232, activation=elu, optimizer=AdamW, lr=0.009290746149396763, batchsize=1672
Finish Trainingstep 1 of 3 with lr=0.009290746149396763 and 1000 epochs
Finish Trainingstep 2 of 3 with lr=0.009290746149396763 and 1000 epochs
Finish Trainingstep 3 of 3 with lr=0.009290746149396763 and 10000 epochs
2025-05-20_02-43-36
[I 2025-05-20 02:43:36,186] Trial 88 finished with value: 0.00330215971916914 and parameters: {'n_layers': 8, 'n_units': 232, 'activation': 'elu', 'lr': 0.009290746149396763, 'optimizer': 'AdamW', 'batch_size': 1672}. Best is trial 7 with value: 0.0007263197330757976.
Training model with params: layers=3, units=442, activation=relu, optimizer=RAdam, lr=0.0010720849678971045, batchsize=1586
Finish Trainingstep 1 of 3 with lr=0.0010720849678971045 and 1000 epochs
Finish Trainingstep 2 of 3 with lr=0.0010720849678971045 and 1000 epochs
Finish Trainingstep 3 of 3 with lr=0.0010720849678971045 and 10000 epochs
2025-05-20_02-57-48
[I 2025-05-20 02:57:48,371] Trial 89 finished with value: 0.004848121199756861 and parameters: {'n_layers': 3, 'n_units': 442, 'activation': 'relu', 'lr': 0.0010720849678971045, 'optimizer': 'RAdam', 'batch_size': 1586}. Best is trial 7 with value: 0.0007263197330757976.
Training model with params: layers=9, units=214, activation=swish, optimizer=adam, lr=0.0008274255098607056, batchsize=1909
Finish Trainingstep 1 of 3 with lr=0.0008274255098607056 and 1000 epochs
Finish Trainingstep 2 of 3 with lr=0.0008274255098607056 and 1000 epochs
Finish Trainingstep 3 of 3 with lr=0.0008274255098607056 and 10000 epochs
2025-05-20_03-40-48
[I 2025-05-20 03:40:48,877] Trial 90 finished with value: 0.0009844086598604918 and parameters: {'n_layers': 9, 'n_units': 214, 'activation': 'swish', 'lr': 0.0008274255098607056, 'optimizer': 'adam', 'batch_size': 1909}. Best is trial 7 with value: 0.0007263197330757976.
Training model with params: layers=4, units=485, activation=swish, optimizer=RAdam, lr=0.00017655294275491638, batchsize=1848
Finish Trainingstep 1 of 3 with lr=0.00017655294275491638 and 1000 epochs
Finish Trainingstep 2 of 3 with lr=0.00017655294275491638 and 1000 epochs
Finish Trainingstep 3 of 3 with lr=0.00017655294275491638 and 10000 epochs
2025-05-20_04-47-32
[I 2025-05-20 04:47:32,285] Trial 91 finished with value: 0.0008060603868216276 and parameters: {'n_layers': 4, 'n_units': 485, 'activation': 'swish', 'lr': 0.00017655294275491638, 'optimizer': 'RAdam', 'batch_size': 1848}. Best is trial 7 with value: 0.0007263197330757976.
Training model with params: layers=5, units=469, activation=swish, optimizer=RAdam, lr=0.00013815259241594483, batchsize=1861
Finish Trainingstep 1 of 3 with lr=0.00013815259241594483 and 1000 epochs
Finish Trainingstep 2 of 3 with lr=0.00013815259241594483 and 1000 epochs
Finish Trainingstep 3 of 3 with lr=0.00013815259241594483 and 10000 epochs
2025-05-20_05-48-57
[I 2025-05-20 05:48:57,403] Trial 92 finished with value: 0.0010705229360610247 and parameters: {'n_layers': 5, 'n_units': 469, 'activation': 'swish', 'lr': 0.00013815259241594483, 'optimizer': 'RAdam', 'batch_size': 1861}. Best is trial 7 with value: 0.0007263197330757976.
Training model with params: layers=4, units=498, activation=swish, optimizer=RAdam, lr=0.00015440336483901081, batchsize=1785
Finish Trainingstep 1 of 3 with lr=0.00015440336483901081 and 1000 epochs
Finish Trainingstep 2 of 3 with lr=0.00015440336483901081 and 1000 epochs
Finish Trainingstep 3 of 3 with lr=0.00015440336483901081 and 10000 epochs
2025-05-20_06-26-49
[I 2025-05-20 06:26:49,847] Trial 93 finished with value: 0.0010874279541894794 and parameters: {'n_layers': 4, 'n_units': 498, 'activation': 'swish', 'lr': 0.00015440336483901081, 'optimizer': 'RAdam', 'batch_size': 1785}. Best is trial 7 with value: 0.0007263197330757976.
Training model with params: layers=4, units=428, activation=swish, optimizer=RAdam, lr=0.0001854288472545158, batchsize=1998
Finish Trainingstep 1 of 3 with lr=0.0001854288472545158 and 1000 epochs
Finish Trainingstep 2 of 3 with lr=0.0001854288472545158 and 1000 epochs
Finish Trainingstep 3 of 3 with lr=0.0001854288472545158 and 10000 epochs
2025-05-20_07-12-04
[I 2025-05-20 07:12:04,557] Trial 94 finished with value: 0.0009004987659864128 and parameters: {'n_layers': 4, 'n_units': 428, 'activation': 'swish', 'lr': 0.0001854288472545158, 'optimizer': 'RAdam', 'batch_size': 1998}. Best is trial 7 with value: 0.0007263197330757976.
Training model with params: layers=3, units=430, activation=tanh, optimizer=RAdam, lr=0.0003249250681656294, batchsize=1993
Finish Trainingstep 1 of 3 with lr=0.0003249250681656294 and 1000 epochs
Finish Trainingstep 2 of 3 with lr=0.0003249250681656294 and 1000 epochs
Finish Trainingstep 3 of 3 with lr=0.0003249250681656294 and 10000 epochs
2025-05-20_07-46-33
[I 2025-05-20 07:46:33,324] Trial 95 finished with value: 0.00109767890535295 and parameters: {'n_layers': 3, 'n_units': 430, 'activation': 'tanh', 'lr': 0.0003249250681656294, 'optimizer': 'RAdam', 'batch_size': 1993}. Best is trial 7 with value: 0.0007263197330757976.
Training model with params: layers=6, units=400, activation=gelu, optimizer=RAdam, lr=0.00021819427623453208, batchsize=1724
Finish Trainingstep 1 of 3 with lr=0.00021819427623453208 and 1000 epochs
Finish Trainingstep 2 of 3 with lr=0.00021819427623453208 and 1000 epochs
Finish Trainingstep 3 of 3 with lr=0.00021819427623453208 and 10000 epochs
2025-05-20_09-35-53
