nohup: ignoring input
2025-05-16 12:31:19.011651: I tensorflow/core/util/port.cc:110] oneDNN custom operations are on. You may see slightly different numerical results due to floating-point round-off errors from different computation orders. To turn them off, set the environment variable `TF_ENABLE_ONEDNN_OPTS=0`.
2025-05-16 12:31:19.013670: I tensorflow/tsl/cuda/cudart_stub.cc:28] Could not find cuda drivers on your machine, GPU will not be used.
2025-05-16 12:31:19.048332: I tensorflow/tsl/cuda/cudart_stub.cc:28] Could not find cuda drivers on your machine, GPU will not be used.
2025-05-16 12:31:19.048864: I tensorflow/core/platform/cpu_feature_guard.cc:182] This TensorFlow binary is optimized to use available CPU instructions in performance-critical operations.
To enable the following instructions: AVX2 AVX512F AVX512_VNNI AVX512_BF16 FMA, in other operations, rebuild TensorFlow with the appropriate compiler flags.
2025-05-16 12:31:21.597267: W tensorflow/compiler/tf2tensorrt/utils/py_utils.cc:38] TF-TRT Warning: Could not find TensorRT
/home/rhoffmann/.local/lib/python3.10/site-packages/tensorflow_addons/utils/tfa_eol_msg.py:23: UserWarning: 

TensorFlow Addons (TFA) has ended development and introduction of new features.
TFA has entered a minimal maintenance and release mode until a planned end of life in May 2024.
Please modify downstream libraries to take dependencies from other repositories in our TensorFlow community (e.g. Keras, Keras-CV, and Keras-NLP). 

For more information see: https://github.com/tensorflow/addons/issues/2807 

  warnings.warn(
WARNING:tensorflow:From /home/rhoffmann/G3LHalo_python/exampleNotebooks/GMNN_Bayesian_Optimization1.py:53: is_gpu_available (from tensorflow.python.framework.test_util) is deprecated and will be removed in a future version.
Instructions for updating:
Use `tf.config.list_physical_devices('GPU')` instead.
using cpu device 

Number of test samples is 7500, should be 7500
Number of validation samples is 7500, should be 7500
Number of train samples is 35000, should be 35000
/home/rhoffmann/G3LHalo_python/exampleNotebooks/GMNN_Bayesian_Optimization1.py:106: UserWarning: No artists with labels found to put in legend.  Note that artists whose label start with an underscore are ignored when legend() is called with no argument.
  axes.legend()
number of training targets: 35000 . Should be 35000
number of validation targets: 7500 . Should be 7500
number of test targets: 7500 . Should be 7500
Shape of training targets: (3, 35000, 50). Should be (3, 35000, 50)
Shape of testing targets: (3, 7500, 50). Should be (3, 7500, 50)
Shape of validation targets: (3, 7500, 50). Should be (3, 7500, 50)
input min/max: 1.168300956697601e-06 16.999974244680363
number of training features: 35000 . Should be 35000
number of validation features: 7500 . Should be 7500
number of test features: 7500 . Should be 7500
Train Rescaled Shape: (3, 35000, 50)
Test Rescaled Shape: (3, 7500, 50)
Val Rescaled Shape: (3, 7500, 50)
Train Rescaled Shape: (35000, 10)
Test Rescaled Shape: (7500, 10)
Val Rescaled Shape: (7500, 10)
[I 2025-05-16 12:31:36,456] A new study created in memory with name: no-name-f1e19caa-d04a-48c7-98df-0122b191e65e
Training model with params: layers=1, units=261, activation=leaky_relu, optimizer=AdamW, lr=0.002026873797471395, batchsize=973
Finish Trainingstep 1 of 3 with lr=0.002026873797471395 and 1000 epochs
Finish Trainingstep 2 of 3 with lr=0.002026873797471395 and 1000 epochs
Finish Trainingstep 3 of 3 with lr=0.002026873797471395 and 10000 epochs
2025-05-16_12-38-34
[I 2025-05-16 12:38:35,018] Trial 0 finished with value: 0.009400749579071999 and parameters: {'n_layers': 1, 'n_units': 261, 'activation': 'leaky_relu', 'lr': 0.002026873797471395, 'optimizer': 'AdamW', 'batch_size': 973}. Best is trial 0 with value: 0.009400749579071999.
Training model with params: layers=6, units=287, activation=tanh, optimizer=adam, lr=0.00048583821060752176, batchsize=159
Finish Trainingstep 1 of 3 with lr=0.00048583821060752176 and 1000 epochs
Finish Trainingstep 2 of 3 with lr=0.00048583821060752176 and 1000 epochs
Finish Trainingstep 3 of 3 with lr=0.00048583821060752176 and 10000 epochs
2025-05-16_13-29-01
[I 2025-05-16 13:29:01,801] Trial 1 finished with value: 0.003818082856014371 and parameters: {'n_layers': 6, 'n_units': 287, 'activation': 'tanh', 'lr': 0.00048583821060752176, 'optimizer': 'adam', 'batch_size': 159}. Best is trial 1 with value: 0.003818082856014371.
Training model with params: layers=5, units=293, activation=tanh, optimizer=adam, lr=0.00029129663135192357, batchsize=1451
Finish Trainingstep 1 of 3 with lr=0.00029129663135192357 and 1000 epochs
Finish Trainingstep 2 of 3 with lr=0.00029129663135192357 and 1000 epochs
Finish Trainingstep 3 of 3 with lr=0.00029129663135192357 and 10000 epochs
2025-05-16_14-25-09
[I 2025-05-16 14:25:09,411] Trial 2 finished with value: 0.0012835277011618018 and parameters: {'n_layers': 5, 'n_units': 293, 'activation': 'tanh', 'lr': 0.00029129663135192357, 'optimizer': 'adam', 'batch_size': 1451}. Best is trial 2 with value: 0.0012835277011618018.
Training model with params: layers=1, units=321, activation=leaky_relu, optimizer=RAdam, lr=0.0006019145789377468, batchsize=1441
Finish Trainingstep 1 of 3 with lr=0.0006019145789377468 and 1000 epochs
Finish Trainingstep 2 of 3 with lr=0.0006019145789377468 and 1000 epochs
Finish Trainingstep 3 of 3 with lr=0.0006019145789377468 and 10000 epochs
2025-05-16_15-04-47
[I 2025-05-16 15:04:47,643] Trial 3 finished with value: 0.00437628710642457 and parameters: {'n_layers': 1, 'n_units': 321, 'activation': 'leaky_relu', 'lr': 0.0006019145789377468, 'optimizer': 'RAdam', 'batch_size': 1441}. Best is trial 2 with value: 0.0012835277011618018.
Training model with params: layers=1, units=246, activation=leaky_relu, optimizer=adam, lr=0.004481611779364725, batchsize=750
Finish Trainingstep 1 of 3 with lr=0.004481611779364725 and 1000 epochs
Finish Trainingstep 2 of 3 with lr=0.004481611779364725 and 1000 epochs
Finish Trainingstep 3 of 3 with lr=0.004481611779364725 and 10000 epochs
2025-05-16_15-46-47
[I 2025-05-16 15:46:47,195] Trial 4 finished with value: 0.002528902841731906 and parameters: {'n_layers': 1, 'n_units': 246, 'activation': 'leaky_relu', 'lr': 0.004481611779364725, 'optimizer': 'adam', 'batch_size': 750}. Best is trial 2 with value: 0.0012835277011618018.
Training model with params: layers=7, units=263, activation=sigmoid, optimizer=AdamW, lr=0.0024235840846559675, batchsize=1365
Finish Trainingstep 1 of 3 with lr=0.0024235840846559675 and 1000 epochs
Finish Trainingstep 2 of 3 with lr=0.0024235840846559675 and 1000 epochs
Finish Trainingstep 3 of 3 with lr=0.0024235840846559675 and 10000 epochs
2025-05-16_16-13-10
[I 2025-05-16 16:13:11,196] Trial 5 finished with value: 0.0072095333598554134 and parameters: {'n_layers': 7, 'n_units': 263, 'activation': 'sigmoid', 'lr': 0.0024235840846559675, 'optimizer': 'AdamW', 'batch_size': 1365}. Best is trial 2 with value: 0.0012835277011618018.
Training model with params: layers=1, units=103, activation=selu, optimizer=rmsprop, lr=0.0069659350459131755, batchsize=966
Finish Trainingstep 1 of 3 with lr=0.0069659350459131755 and 1000 epochs
Finish Trainingstep 2 of 3 with lr=0.0069659350459131755 and 1000 epochs
Finish Trainingstep 3 of 3 with lr=0.0069659350459131755 and 10000 epochs
2025-05-16_16-38-19
[I 2025-05-16 16:38:20,158] Trial 6 finished with value: 0.008421625010669231 and parameters: {'n_layers': 1, 'n_units': 103, 'activation': 'selu', 'lr': 0.0069659350459131755, 'optimizer': 'rmsprop', 'batch_size': 966}. Best is trial 2 with value: 0.0012835277011618018.
Training model with params: layers=9, units=286, activation=swish, optimizer=adam, lr=0.00014406076176223185, batchsize=1631
Finish Trainingstep 1 of 3 with lr=0.00014406076176223185 and 1000 epochs
Finish Trainingstep 2 of 3 with lr=0.00014406076176223185 and 1000 epochs
Finish Trainingstep 3 of 3 with lr=0.00014406076176223185 and 10000 epochs
2025-05-16_18-33-53
[I 2025-05-16 18:33:53,803] Trial 7 finished with value: 0.0007263197330757976 and parameters: {'n_layers': 9, 'n_units': 286, 'activation': 'swish', 'lr': 0.00014406076176223185, 'optimizer': 'adam', 'batch_size': 1631}. Best is trial 7 with value: 0.0007263197330757976.
Training model with params: layers=9, units=460, activation=relu, optimizer=sgd, lr=0.00025953680521800446, batchsize=535
Finish Trainingstep 1 of 3 with lr=0.00025953680521800446 and 1000 epochs
Finish Trainingstep 2 of 3 with lr=0.00025953680521800446 and 1000 epochs
Finish Trainingstep 3 of 3 with lr=0.00025953680521800446 and 10000 epochs
2025-05-16_23-43-32
[I 2025-05-16 23:43:32,278] Trial 8 finished with value: 0.08571279793977737 and parameters: {'n_layers': 9, 'n_units': 460, 'activation': 'relu', 'lr': 0.00025953680521800446, 'optimizer': 'sgd', 'batch_size': 535}. Best is trial 7 with value: 0.0007263197330757976.
Training model with params: layers=10, units=397, activation=relu, optimizer=RAdam, lr=0.00012999403665178667, batchsize=711
Finish Trainingstep 1 of 3 with lr=0.00012999403665178667 and 1000 epochs
Finish Trainingstep 2 of 3 with lr=0.00012999403665178667 and 1000 epochs
Finish Trainingstep 3 of 3 with lr=0.00012999403665178667 and 10000 epochs
2025-05-17_01-37-51
[I 2025-05-17 01:37:51,153] Trial 9 finished with value: 0.008379806764423847 and parameters: {'n_layers': 10, 'n_units': 397, 'activation': 'relu', 'lr': 0.00012999403665178667, 'optimizer': 'RAdam', 'batch_size': 711}. Best is trial 7 with value: 0.0007263197330757976.
Training model with params: layers=8, units=101, activation=swish, optimizer=sgd, lr=0.00010408015895984857, batchsize=1938
Finish Trainingstep 1 of 3 with lr=0.00010408015895984857 and 1000 epochs
Finish Trainingstep 2 of 3 with lr=0.00010408015895984857 and 1000 epochs
Finish Trainingstep 3 of 3 with lr=0.00010408015895984857 and 10000 epochs
2025-05-17_02-03-03
[I 2025-05-17 02:03:03,430] Trial 10 finished with value: 1.0253751277923584 and parameters: {'n_layers': 8, 'n_units': 101, 'activation': 'swish', 'lr': 0.00010408015895984857, 'optimizer': 'sgd', 'batch_size': 1938}. Best is trial 7 with value: 0.0007263197330757976.
Training model with params: layers=4, units=158, activation=gelu, optimizer=adam, lr=0.00024174429137703178, batchsize=1794
Finish Trainingstep 1 of 3 with lr=0.00024174429137703178 and 1000 epochs
Finish Trainingstep 2 of 3 with lr=0.00024174429137703178 and 1000 epochs
Finish Trainingstep 3 of 3 with lr=0.00024174429137703178 and 10000 epochs
2025-05-17_03-06-03
[I 2025-05-17 03:06:03,592] Trial 11 finished with value: 0.0009849173948168755 and parameters: {'n_layers': 4, 'n_units': 158, 'activation': 'gelu', 'lr': 0.00024174429137703178, 'optimizer': 'adam', 'batch_size': 1794}. Best is trial 7 with value: 0.0007263197330757976.
Training model with params: layers=3, units=170, activation=gelu, optimizer=adam, lr=0.00022874701772414172, batchsize=2010
Finish Trainingstep 1 of 3 with lr=0.00022874701772414172 and 1000 epochs
Finish Trainingstep 2 of 3 with lr=0.00022874701772414172 and 1000 epochs
Finish Trainingstep 3 of 3 with lr=0.00022874701772414172 and 10000 epochs
2025-05-17_03-43-05
[I 2025-05-17 03:43:05,941] Trial 12 finished with value: 0.0025066426023840904 and parameters: {'n_layers': 3, 'n_units': 170, 'activation': 'gelu', 'lr': 0.00022874701772414172, 'optimizer': 'adam', 'batch_size': 2010}. Best is trial 7 with value: 0.0007263197330757976.
Training model with params: layers=5, units=35, activation=elu, optimizer=adam, lr=0.0009690583561206089, batchsize=1690
Finish Trainingstep 1 of 3 with lr=0.0009690583561206089 and 1000 epochs
Finish Trainingstep 2 of 3 with lr=0.0009690583561206089 and 1000 epochs
Finish Trainingstep 3 of 3 with lr=0.0009690583561206089 and 10000 epochs
2025-05-17_04-12-14
[I 2025-05-17 04:12:14,731] Trial 13 finished with value: 0.0007563114631921053 and parameters: {'n_layers': 5, 'n_units': 35, 'activation': 'elu', 'lr': 0.0009690583561206089, 'optimizer': 'adam', 'batch_size': 1690}. Best is trial 7 with value: 0.0007263197330757976.
Training model with params: layers=7, units=23, activation=elu, optimizer=rmsprop, lr=0.001409938142685323, batchsize=1649
Finish Trainingstep 1 of 3 with lr=0.001409938142685323 and 1000 epochs
Finish Trainingstep 2 of 3 with lr=0.001409938142685323 and 1000 epochs
Finish Trainingstep 3 of 3 with lr=0.001409938142685323 and 10000 epochs
2025-05-17_04-38-54
[I 2025-05-17 04:38:54,703] Trial 14 finished with value: 0.003151079872623086 and parameters: {'n_layers': 7, 'n_units': 23, 'activation': 'elu', 'lr': 0.001409938142685323, 'optimizer': 'rmsprop', 'batch_size': 1649}. Best is trial 7 with value: 0.0007263197330757976.
Training model with params: layers=3, units=363, activation=swish, optimizer=adam, lr=0.0007691612374169739, batchsize=1202
Finish Trainingstep 1 of 3 with lr=0.0007691612374169739 and 1000 epochs
Finish Trainingstep 2 of 3 with lr=0.0007691612374169739 and 1000 epochs
Finish Trainingstep 3 of 3 with lr=0.0007691612374169739 and 10000 epochs
2025-05-17_05-15-21
[I 2025-05-17 05:15:21,399] Trial 15 finished with value: 0.001426905975677073 and parameters: {'n_layers': 3, 'n_units': 363, 'activation': 'swish', 'lr': 0.0007691612374169739, 'optimizer': 'adam', 'batch_size': 1202}. Best is trial 7 with value: 0.0007263197330757976.
Training model with params: layers=10, units=189, activation=elu, optimizer=adam, lr=0.0012695097151784321, batchsize=1667
Finish Trainingstep 1 of 3 with lr=0.0012695097151784321 and 1000 epochs
Finish Trainingstep 2 of 3 with lr=0.0012695097151784321 and 1000 epochs
Finish Trainingstep 3 of 3 with lr=0.0012695097151784321 and 10000 epochs
2025-05-17_05-40-15
[I 2025-05-17 05:40:15,598] Trial 16 finished with value: 0.0025009990204125643 and parameters: {'n_layers': 10, 'n_units': 189, 'activation': 'elu', 'lr': 0.0012695097151784321, 'optimizer': 'adam', 'batch_size': 1667}. Best is trial 7 with value: 0.0007263197330757976.
Training model with params: layers=5, units=20, activation=elu, optimizer=adam, lr=0.0032066401056327965, batchsize=1217
Finish Trainingstep 1 of 3 with lr=0.0032066401056327965 and 1000 epochs
Finish Trainingstep 2 of 3 with lr=0.0032066401056327965 and 1000 epochs
Finish Trainingstep 3 of 3 with lr=0.0032066401056327965 and 10000 epochs
2025-05-17_06-02-56
[I 2025-05-17 06:02:56,228] Trial 17 finished with value: 0.0018190030241385102 and parameters: {'n_layers': 5, 'n_units': 20, 'activation': 'elu', 'lr': 0.0032066401056327965, 'optimizer': 'adam', 'batch_size': 1217}. Best is trial 7 with value: 0.0007263197330757976.
Training model with params: layers=8, units=505, activation=swish, optimizer=rmsprop, lr=0.0004290189745193901, batchsize=1706
Finish Trainingstep 1 of 3 with lr=0.0004290189745193901 and 1000 epochs
Finish Trainingstep 2 of 3 with lr=0.0004290189745193901 and 1000 epochs
Finish Trainingstep 3 of 3 with lr=0.0004290189745193901 and 10000 epochs
2025-05-17_08-10-13
[I 2025-05-17 08:10:13,901] Trial 18 finished with value: 0.0012116117868572474 and parameters: {'n_layers': 8, 'n_units': 505, 'activation': 'swish', 'lr': 0.0004290189745193901, 'optimizer': 'rmsprop', 'batch_size': 1706}. Best is trial 7 with value: 0.0007263197330757976.
Training model with params: layers=6, units=396, activation=sigmoid, optimizer=AdamW, lr=0.0001486708119783066, batchsize=1527
Finish Trainingstep 1 of 3 with lr=0.0001486708119783066 and 1000 epochs
Finish Trainingstep 2 of 3 with lr=0.0001486708119783066 and 1000 epochs
Finish Trainingstep 3 of 3 with lr=0.0001486708119783066 and 10000 epochs
2025-05-17_08-33-32
[I 2025-05-17 08:33:32,385] Trial 19 finished with value: 0.03418575972318649 and parameters: {'n_layers': 6, 'n_units': 396, 'activation': 'sigmoid', 'lr': 0.0001486708119783066, 'optimizer': 'AdamW', 'batch_size': 1527}. Best is trial 7 with value: 0.0007263197330757976.
Training model with params: layers=3, units=90, activation=selu, optimizer=RAdam, lr=0.008590345436784204, batchsize=1868
Finish Trainingstep 1 of 3 with lr=0.008590345436784204 and 1000 epochs
Finish Trainingstep 2 of 3 with lr=0.008590345436784204 and 1000 epochs
Finish Trainingstep 3 of 3 with lr=0.008590345436784204 and 10000 epochs
2025-05-17_08-54-00
[I 2025-05-17 08:54:00,273] Trial 20 finished with value: 0.0020673824474215508 and parameters: {'n_layers': 3, 'n_units': 90, 'activation': 'selu', 'lr': 0.008590345436784204, 'optimizer': 'RAdam', 'batch_size': 1868}. Best is trial 7 with value: 0.0007263197330757976.
Training model with params: layers=4, units=185, activation=gelu, optimizer=adam, lr=0.00018923022635375215, batchsize=1795
Finish Trainingstep 1 of 3 with lr=0.00018923022635375215 and 1000 epochs
Finish Trainingstep 2 of 3 with lr=0.00018923022635375215 and 1000 epochs
Finish Trainingstep 3 of 3 with lr=0.00018923022635375215 and 10000 epochs
2025-05-17_09-47-15
[I 2025-05-17 09:47:15,338] Trial 21 finished with value: 0.0014450466260313988 and parameters: {'n_layers': 4, 'n_units': 185, 'activation': 'gelu', 'lr': 0.00018923022635375215, 'optimizer': 'adam', 'batch_size': 1795}. Best is trial 7 with value: 0.0007263197330757976.
Training model with params: layers=4, units=73, activation=gelu, optimizer=adam, lr=0.00036016318509247177, batchsize=2016
Finish Trainingstep 1 of 3 with lr=0.00036016318509247177 and 1000 epochs
Finish Trainingstep 2 of 3 with lr=0.00036016318509247177 and 1000 epochs
Finish Trainingstep 3 of 3 with lr=0.00036016318509247177 and 10000 epochs
2025-05-17_10-25-44
[I 2025-05-17 10:25:44,776] Trial 22 finished with value: 0.0016625376883894205 and parameters: {'n_layers': 4, 'n_units': 73, 'activation': 'gelu', 'lr': 0.00036016318509247177, 'optimizer': 'adam', 'batch_size': 2016}. Best is trial 7 with value: 0.0007263197330757976.
Training model with params: layers=4, units=150, activation=elu, optimizer=adam, lr=0.0008289193758290938, batchsize=1585
Finish Trainingstep 1 of 3 with lr=0.0008289193758290938 and 1000 epochs
Finish Trainingstep 2 of 3 with lr=0.0008289193758290938 and 1000 epochs
Finish Trainingstep 3 of 3 with lr=0.0008289193758290938 and 10000 epochs
2025-05-17_11-08-46
[I 2025-05-17 11:08:46,121] Trial 23 finished with value: 0.0009152981801889837 and parameters: {'n_layers': 4, 'n_units': 150, 'activation': 'elu', 'lr': 0.0008289193758290938, 'optimizer': 'adam', 'batch_size': 1585}. Best is trial 7 with value: 0.0007263197330757976.
Training model with params: layers=7, units=210, activation=elu, optimizer=adam, lr=0.000922226103656517, batchsize=1274
Finish Trainingstep 1 of 3 with lr=0.000922226103656517 and 1000 epochs
Finish Trainingstep 2 of 3 with lr=0.000922226103656517 and 1000 epochs
Finish Trainingstep 3 of 3 with lr=0.000922226103656517 and 10000 epochs
2025-05-17_11-41-16
[I 2025-05-17 11:41:16,925] Trial 24 finished with value: 0.0017357415053993464 and parameters: {'n_layers': 7, 'n_units': 210, 'activation': 'elu', 'lr': 0.000922226103656517, 'optimizer': 'adam', 'batch_size': 1274}. Best is trial 7 with value: 0.0007263197330757976.
Training model with params: layers=5, units=141, activation=elu, optimizer=sgd, lr=0.0014379423804688118, batchsize=1522
Finish Trainingstep 1 of 3 with lr=0.0014379423804688118 and 1000 epochs
Finish Trainingstep 2 of 3 with lr=0.0014379423804688118 and 1000 epochs
Finish Trainingstep 3 of 3 with lr=0.0014379423804688118 and 10000 epochs
2025-05-17_12-55-01
[I 2025-05-17 12:55:01,664] Trial 25 finished with value: 0.06787919253110886 and parameters: {'n_layers': 5, 'n_units': 141, 'activation': 'elu', 'lr': 0.0014379423804688118, 'optimizer': 'sgd', 'batch_size': 1522}. Best is trial 7 with value: 0.0007263197330757976.
Training model with params: layers=2, units=55, activation=swish, optimizer=adam, lr=0.0005666566660418391, batchsize=1593
Finish Trainingstep 1 of 3 with lr=0.0005666566660418391 and 1000 epochs
Finish Trainingstep 2 of 3 with lr=0.0005666566660418391 and 1000 epochs
Finish Trainingstep 3 of 3 with lr=0.0005666566660418391 and 10000 epochs
2025-05-17_13-35-15
[I 2025-05-17 13:35:15,337] Trial 26 finished with value: 0.00246545672416687 and parameters: {'n_layers': 2, 'n_units': 55, 'activation': 'swish', 'lr': 0.0005666566660418391, 'optimizer': 'adam', 'batch_size': 1593}. Best is trial 7 with value: 0.0007263197330757976.
Training model with params: layers=6, units=129, activation=elu, optimizer=adam, lr=0.0008566096627605653, batchsize=1083
Finish Trainingstep 1 of 3 with lr=0.0008566096627605653 and 1000 epochs
Finish Trainingstep 2 of 3 with lr=0.0008566096627605653 and 1000 epochs
Finish Trainingstep 3 of 3 with lr=0.0008566096627605653 and 10000 epochs
2025-05-17_14-11-06
[I 2025-05-17 14:11:06,672] Trial 27 finished with value: 0.0015291740419343114 and parameters: {'n_layers': 6, 'n_units': 129, 'activation': 'elu', 'lr': 0.0008566096627605653, 'optimizer': 'adam', 'batch_size': 1083}. Best is trial 7 with value: 0.0007263197330757976.
Training model with params: layers=9, units=226, activation=elu, optimizer=adam, lr=0.0019685839201724676, batchsize=1797
Finish Trainingstep 1 of 3 with lr=0.0019685839201724676 and 1000 epochs
Finish Trainingstep 2 of 3 with lr=0.0019685839201724676 and 1000 epochs
Finish Trainingstep 3 of 3 with lr=0.0019685839201724676 and 10000 epochs
2025-05-17_14-40-11
