nohup: ignoring input
2025-05-16 12:31:21.944954: I tensorflow/core/util/port.cc:110] oneDNN custom operations are on. You may see slightly different numerical results due to floating-point round-off errors from different computation orders. To turn them off, set the environment variable `TF_ENABLE_ONEDNN_OPTS=0`.
2025-05-16 12:31:21.946828: I tensorflow/tsl/cuda/cudart_stub.cc:28] Could not find cuda drivers on your machine, GPU will not be used.
2025-05-16 12:31:21.981918: I tensorflow/tsl/cuda/cudart_stub.cc:28] Could not find cuda drivers on your machine, GPU will not be used.
2025-05-16 12:31:21.982346: I tensorflow/core/platform/cpu_feature_guard.cc:182] This TensorFlow binary is optimized to use available CPU instructions in performance-critical operations.
To enable the following instructions: AVX2 AVX512F AVX512_VNNI AVX512_BF16 FMA, in other operations, rebuild TensorFlow with the appropriate compiler flags.
2025-05-16 12:31:22.871944: W tensorflow/compiler/tf2tensorrt/utils/py_utils.cc:38] TF-TRT Warning: Could not find TensorRT
/home/rhoffmann/.local/lib/python3.10/site-packages/tensorflow_addons/utils/tfa_eol_msg.py:23: UserWarning: 

TensorFlow Addons (TFA) has ended development and introduction of new features.
TFA has entered a minimal maintenance and release mode until a planned end of life in May 2024.
Please modify downstream libraries to take dependencies from other repositories in our TensorFlow community (e.g. Keras, Keras-CV, and Keras-NLP). 

For more information see: https://github.com/tensorflow/addons/issues/2807 

  warnings.warn(
WARNING:tensorflow:From /home/rhoffmann/G3LHalo_python/exampleNotebooks/GMNN_Bayesian_Optimization1.py:53: is_gpu_available (from tensorflow.python.framework.test_util) is deprecated and will be removed in a future version.
Instructions for updating:
Use `tf.config.list_physical_devices('GPU')` instead.
using cpu device 

Number of test samples is 7500, should be 7500
Number of validation samples is 7500, should be 7500
Number of train samples is 35000, should be 35000
/home/rhoffmann/G3LHalo_python/exampleNotebooks/GMNN_Bayesian_Optimization1.py:106: UserWarning: No artists with labels found to put in legend.  Note that artists whose label start with an underscore are ignored when legend() is called with no argument.
  axes.legend()
number of training targets: 35000 . Should be 35000
number of validation targets: 7500 . Should be 7500
number of test targets: 7500 . Should be 7500
Shape of training targets: (3, 35000, 50). Should be (3, 35000, 50)
Shape of testing targets: (3, 7500, 50). Should be (3, 7500, 50)
Shape of validation targets: (3, 7500, 50). Should be (3, 7500, 50)
input min/max: 1.168300956697601e-06 16.999974244680363
number of training features: 35000 . Should be 35000
number of validation features: 7500 . Should be 7500
number of test features: 7500 . Should be 7500
Train Rescaled Shape: (3, 35000, 50)
Test Rescaled Shape: (3, 7500, 50)
Val Rescaled Shape: (3, 7500, 50)
Train Rescaled Shape: (35000, 10)
Test Rescaled Shape: (7500, 10)
Val Rescaled Shape: (7500, 10)
[I 2025-05-16 12:31:36,416] A new study created in memory with name: no-name-0cd207f6-865c-4cbf-b65f-95e0814f6b69
Training model with params: layers=3, units=288, activation=leaky_relu, optimizer=adam, lr=0.00011798102792937772, batchsize=335
Finish Trainingstep 1 of 3 with lr=0.00011798102792937772 and 1000 epochs
Finish Trainingstep 2 of 3 with lr=0.00011798102792937772 and 1000 epochs
Finish Trainingstep 3 of 3 with lr=0.00011798102792937772 and 10000 epochs
2025-05-16_14-46-32
[I 2025-05-16 14:46:32,767] Trial 0 finished with value: 0.004967700690031052 and parameters: {'n_layers': 3, 'n_units': 288, 'activation': 'leaky_relu', 'lr': 0.00011798102792937772, 'optimizer': 'adam', 'batch_size': 335}. Best is trial 0 with value: 0.004967700690031052.
Training model with params: layers=1, units=213, activation=leaky_relu, optimizer=adam, lr=0.0005779830454040984, batchsize=1044
Finish Trainingstep 1 of 3 with lr=0.0005779830454040984 and 1000 epochs
Finish Trainingstep 2 of 3 with lr=0.0005779830454040984 and 1000 epochs
Finish Trainingstep 3 of 3 with lr=0.0005779830454040984 and 10000 epochs
2025-05-16_15-22-04
[I 2025-05-16 15:22:04,728] Trial 1 finished with value: 0.00427178805693984 and parameters: {'n_layers': 1, 'n_units': 213, 'activation': 'leaky_relu', 'lr': 0.0005779830454040984, 'optimizer': 'adam', 'batch_size': 1044}. Best is trial 1 with value: 0.00427178805693984.
Training model with params: layers=10, units=302, activation=relu, optimizer=RAdam, lr=0.00025397773354838594, batchsize=696
Finish Trainingstep 1 of 3 with lr=0.00025397773354838594 and 1000 epochs
Finish Trainingstep 2 of 3 with lr=0.00025397773354838594 and 1000 epochs
Finish Trainingstep 3 of 3 with lr=0.00025397773354838594 and 10000 epochs
2025-05-16_17-04-49
[I 2025-05-16 17:04:49,278] Trial 2 finished with value: 0.007278315722942352 and parameters: {'n_layers': 10, 'n_units': 302, 'activation': 'relu', 'lr': 0.00025397773354838594, 'optimizer': 'RAdam', 'batch_size': 696}. Best is trial 1 with value: 0.00427178805693984.
Training model with params: layers=4, units=372, activation=tanh, optimizer=AdamW, lr=0.0043504527093615524, batchsize=1660
Finish Trainingstep 1 of 3 with lr=0.0043504527093615524 and 1000 epochs
Finish Trainingstep 2 of 3 with lr=0.0043504527093615524 and 1000 epochs
Finish Trainingstep 3 of 3 with lr=0.0043504527093615524 and 10000 epochs
2025-05-16_17-18-20
[I 2025-05-16 17:18:20,674] Trial 3 finished with value: 0.004177089314907789 and parameters: {'n_layers': 4, 'n_units': 372, 'activation': 'tanh', 'lr': 0.0043504527093615524, 'optimizer': 'AdamW', 'batch_size': 1660}. Best is trial 3 with value: 0.004177089314907789.
Training model with params: layers=4, units=77, activation=swish, optimizer=AdamW, lr=0.0020980858313010883, batchsize=1609
Finish Trainingstep 1 of 3 with lr=0.0020980858313010883 and 1000 epochs
Finish Trainingstep 2 of 3 with lr=0.0020980858313010883 and 1000 epochs
Finish Trainingstep 3 of 3 with lr=0.0020980858313010883 and 10000 epochs
2025-05-16_17-29-51
[I 2025-05-16 17:29:51,970] Trial 4 finished with value: 0.003350675804540515 and parameters: {'n_layers': 4, 'n_units': 77, 'activation': 'swish', 'lr': 0.0020980858313010883, 'optimizer': 'AdamW', 'batch_size': 1609}. Best is trial 4 with value: 0.003350675804540515.
Training model with params: layers=7, units=453, activation=leaky_relu, optimizer=RAdam, lr=0.002261476269512031, batchsize=793
Finish Trainingstep 1 of 3 with lr=0.002261476269512031 and 1000 epochs
Finish Trainingstep 2 of 3 with lr=0.002261476269512031 and 1000 epochs
Finish Trainingstep 3 of 3 with lr=0.002261476269512031 and 10000 epochs
2025-05-16_18-25-05
[I 2025-05-16 18:25:05,357] Trial 5 finished with value: 0.0042569455690681934 and parameters: {'n_layers': 7, 'n_units': 453, 'activation': 'leaky_relu', 'lr': 0.002261476269512031, 'optimizer': 'RAdam', 'batch_size': 793}. Best is trial 4 with value: 0.003350675804540515.
Training model with params: layers=1, units=426, activation=swish, optimizer=RAdam, lr=0.0016196975983522911, batchsize=1415
Finish Trainingstep 1 of 3 with lr=0.0016196975983522911 and 1000 epochs
Finish Trainingstep 2 of 3 with lr=0.0016196975983522911 and 1000 epochs
Finish Trainingstep 3 of 3 with lr=0.0016196975983522911 and 10000 epochs
2025-05-16_19-06-11
[I 2025-05-16 19:06:11,809] Trial 6 finished with value: 0.006546615157276392 and parameters: {'n_layers': 1, 'n_units': 426, 'activation': 'swish', 'lr': 0.0016196975983522911, 'optimizer': 'RAdam', 'batch_size': 1415}. Best is trial 4 with value: 0.003350675804540515.
Training model with params: layers=6, units=178, activation=tanh, optimizer=adam, lr=0.004801236117306179, batchsize=975
Finish Trainingstep 1 of 3 with lr=0.004801236117306179 and 1000 epochs
Finish Trainingstep 2 of 3 with lr=0.004801236117306179 and 1000 epochs
Finish Trainingstep 3 of 3 with lr=0.004801236117306179 and 10000 epochs
2025-05-16_19-52-27
[I 2025-05-16 19:52:27,967] Trial 7 finished with value: 0.0037913674023002386 and parameters: {'n_layers': 6, 'n_units': 178, 'activation': 'tanh', 'lr': 0.004801236117306179, 'optimizer': 'adam', 'batch_size': 975}. Best is trial 4 with value: 0.003350675804540515.
Training model with params: layers=1, units=104, activation=gelu, optimizer=adam, lr=0.001044249962561089, batchsize=1384
Finish Trainingstep 1 of 3 with lr=0.001044249962561089 and 1000 epochs
Finish Trainingstep 2 of 3 with lr=0.001044249962561089 and 1000 epochs
Finish Trainingstep 3 of 3 with lr=0.001044249962561089 and 10000 epochs
2025-05-16_20-23-05
[I 2025-05-16 20:23:05,614] Trial 8 finished with value: 0.00522633409127593 and parameters: {'n_layers': 1, 'n_units': 104, 'activation': 'gelu', 'lr': 0.001044249962561089, 'optimizer': 'adam', 'batch_size': 1384}. Best is trial 4 with value: 0.003350675804540515.
Training model with params: layers=8, units=252, activation=tanh, optimizer=rmsprop, lr=0.0023783866276074314, batchsize=1487
Finish Trainingstep 1 of 3 with lr=0.0023783866276074314 and 1000 epochs
Finish Trainingstep 2 of 3 with lr=0.0023783866276074314 and 1000 epochs
Finish Trainingstep 3 of 3 with lr=0.0023783866276074314 and 10000 epochs
2025-05-16_22-04-44
[I 2025-05-16 22:04:44,737] Trial 9 finished with value: 0.02302563562989235 and parameters: {'n_layers': 8, 'n_units': 252, 'activation': 'tanh', 'lr': 0.0023783866276074314, 'optimizer': 'rmsprop', 'batch_size': 1487}. Best is trial 4 with value: 0.003350675804540515.
Training model with params: layers=4, units=42, activation=swish, optimizer=sgd, lr=0.009719547025949179, batchsize=1932
Finish Trainingstep 1 of 3 with lr=0.009719547025949179 and 1000 epochs
Finish Trainingstep 2 of 3 with lr=0.009719547025949179 and 1000 epochs
Finish Trainingstep 3 of 3 with lr=0.009719547025949179 and 10000 epochs
2025-05-16_22-53-16
[I 2025-05-16 22:53:16,915] Trial 10 finished with value: 0.027593372389674187 and parameters: {'n_layers': 4, 'n_units': 42, 'activation': 'swish', 'lr': 0.009719547025949179, 'optimizer': 'sgd', 'batch_size': 1932}. Best is trial 4 with value: 0.003350675804540515.
Training model with params: layers=6, units=139, activation=elu, optimizer=AdamW, lr=0.006363971751261021, batchsize=1068
Finish Trainingstep 1 of 3 with lr=0.006363971751261021 and 1000 epochs
Finish Trainingstep 2 of 3 with lr=0.006363971751261021 and 1000 epochs
Finish Trainingstep 3 of 3 with lr=0.006363971751261021 and 10000 epochs
2025-05-16_23-10-13
[I 2025-05-16 23:10:13,409] Trial 11 finished with value: 0.0029527833685278893 and parameters: {'n_layers': 6, 'n_units': 139, 'activation': 'elu', 'lr': 0.006363971751261021, 'optimizer': 'AdamW', 'batch_size': 1068}. Best is trial 11 with value: 0.0029527833685278893.
Training model with params: layers=5, units=122, activation=elu, optimizer=AdamW, lr=0.009389416700410932, batchsize=1972
Finish Trainingstep 1 of 3 with lr=0.009389416700410932 and 1000 epochs
Finish Trainingstep 2 of 3 with lr=0.009389416700410932 and 1000 epochs
Finish Trainingstep 3 of 3 with lr=0.009389416700410932 and 10000 epochs
2025-05-16_23-33-35
[I 2025-05-16 23:33:35,144] Trial 12 finished with value: 0.0031513627618551254 and parameters: {'n_layers': 5, 'n_units': 122, 'activation': 'elu', 'lr': 0.009389416700410932, 'optimizer': 'AdamW', 'batch_size': 1972}. Best is trial 11 with value: 0.0029527833685278893.
Training model with params: layers=8, units=158, activation=elu, optimizer=AdamW, lr=0.008249367254123978, batchsize=45
Finish Trainingstep 1 of 3 with lr=0.008249367254123978 and 1000 epochs
Finish Trainingstep 2 of 3 with lr=0.008249367254123978 and 1000 epochs
Finish Trainingstep 3 of 3 with lr=0.008249367254123978 and 10000 epochs
2025-05-17_00-59-00
[I 2025-05-17 00:59:00,802] Trial 13 finished with value: 0.011188345029950142 and parameters: {'n_layers': 8, 'n_units': 158, 'activation': 'elu', 'lr': 0.008249367254123978, 'optimizer': 'AdamW', 'batch_size': 45}. Best is trial 11 with value: 0.0029527833685278893.
Training model with params: layers=6, units=125, activation=elu, optimizer=AdamW, lr=0.005124163580876808, batchsize=1896
Finish Trainingstep 1 of 3 with lr=0.005124163580876808 and 1000 epochs
Finish Trainingstep 2 of 3 with lr=0.005124163580876808 and 1000 epochs
Finish Trainingstep 3 of 3 with lr=0.005124163580876808 and 10000 epochs
2025-05-17_01-10-48
[I 2025-05-17 01:10:48,921] Trial 14 finished with value: 0.003203300293534994 and parameters: {'n_layers': 6, 'n_units': 125, 'activation': 'elu', 'lr': 0.005124163580876808, 'optimizer': 'AdamW', 'batch_size': 1896}. Best is trial 11 with value: 0.0029527833685278893.
Training model with params: layers=5, units=31, activation=selu, optimizer=AdamW, lr=0.009805390619194138, batchsize=1176
Finish Trainingstep 1 of 3 with lr=0.009805390619194138 and 1000 epochs
Finish Trainingstep 2 of 3 with lr=0.009805390619194138 and 1000 epochs
Finish Trainingstep 3 of 3 with lr=0.009805390619194138 and 10000 epochs
2025-05-17_01-15-52
[I 2025-05-17 01:15:52,727] Trial 15 finished with value: 0.0045558069832623005 and parameters: {'n_layers': 5, 'n_units': 31, 'activation': 'selu', 'lr': 0.009805390619194138, 'optimizer': 'AdamW', 'batch_size': 1176}. Best is trial 11 with value: 0.0029527833685278893.
Training model with params: layers=10, units=205, activation=sigmoid, optimizer=sgd, lr=0.0005039194932053359, batchsize=2039
Finish Trainingstep 1 of 3 with lr=0.0005039194932053359 and 1000 epochs
Finish Trainingstep 2 of 3 with lr=0.0005039194932053359 and 1000 epochs
Finish Trainingstep 3 of 3 with lr=0.0005039194932053359 and 10000 epochs
2025-05-17_01-34-20
[I 2025-05-17 01:34:20,950] Trial 16 finished with value: 1.0255351066589355 and parameters: {'n_layers': 10, 'n_units': 205, 'activation': 'sigmoid', 'lr': 0.0005039194932053359, 'optimizer': 'sgd', 'batch_size': 2039}. Best is trial 11 with value: 0.0029527833685278893.
Training model with params: layers=8, units=128, activation=elu, optimizer=rmsprop, lr=0.004116771849774209, batchsize=514
Finish Trainingstep 1 of 3 with lr=0.004116771849774209 and 1000 epochs
Finish Trainingstep 2 of 3 with lr=0.004116771849774209 and 1000 epochs
Finish Trainingstep 3 of 3 with lr=0.004116771849774209 and 10000 epochs
2025-05-17_02-43-13
[I 2025-05-17 02:43:13,683] Trial 17 finished with value: 0.00632599787786603 and parameters: {'n_layers': 8, 'n_units': 128, 'activation': 'elu', 'lr': 0.004116771849774209, 'optimizer': 'rmsprop', 'batch_size': 514}. Best is trial 11 with value: 0.0029527833685278893.
Training model with params: layers=3, units=509, activation=elu, optimizer=AdamW, lr=0.006454203949348046, batchsize=1782
Finish Trainingstep 1 of 3 with lr=0.006454203949348046 and 1000 epochs
Finish Trainingstep 2 of 3 with lr=0.006454203949348046 and 1000 epochs
Finish Trainingstep 3 of 3 with lr=0.006454203949348046 and 10000 epochs
2025-05-17_03-00-01
[I 2025-05-17 03:00:01,101] Trial 18 finished with value: 0.0035677284467965364 and parameters: {'n_layers': 3, 'n_units': 509, 'activation': 'elu', 'lr': 0.006454203949348046, 'optimizer': 'AdamW', 'batch_size': 1782}. Best is trial 11 with value: 0.0029527833685278893.
Training model with params: layers=7, units=75, activation=elu, optimizer=AdamW, lr=0.003043891882537358, batchsize=1216
Finish Trainingstep 1 of 3 with lr=0.003043891882537358 and 1000 epochs
Finish Trainingstep 2 of 3 with lr=0.003043891882537358 and 1000 epochs
Finish Trainingstep 3 of 3 with lr=0.003043891882537358 and 10000 epochs
2025-05-17_03-10-54
[I 2025-05-17 03:10:54,637] Trial 19 finished with value: 0.00319475494325161 and parameters: {'n_layers': 7, 'n_units': 75, 'activation': 'elu', 'lr': 0.003043891882537358, 'optimizer': 'AdamW', 'batch_size': 1216}. Best is trial 11 with value: 0.0029527833685278893.
Training model with params: layers=5, units=245, activation=selu, optimizer=AdamW, lr=0.0013498691029093287, batchsize=848
Finish Trainingstep 1 of 3 with lr=0.0013498691029093287 and 1000 epochs
Finish Trainingstep 2 of 3 with lr=0.0013498691029093287 and 1000 epochs
Finish Trainingstep 3 of 3 with lr=0.0013498691029093287 and 10000 epochs
2025-05-17_03-30-25
[I 2025-05-17 03:30:25,355] Trial 20 finished with value: 0.003730849362909794 and parameters: {'n_layers': 5, 'n_units': 245, 'activation': 'selu', 'lr': 0.0013498691029093287, 'optimizer': 'AdamW', 'batch_size': 848}. Best is trial 11 with value: 0.0029527833685278893.
Training model with params: layers=7, units=60, activation=elu, optimizer=AdamW, lr=0.003191834317237278, batchsize=1202
Finish Trainingstep 1 of 3 with lr=0.003191834317237278 and 1000 epochs
Finish Trainingstep 2 of 3 with lr=0.003191834317237278 and 1000 epochs
Finish Trainingstep 3 of 3 with lr=0.003191834317237278 and 10000 epochs
2025-05-17_03-38-26
[I 2025-05-17 03:38:26,846] Trial 21 finished with value: 0.0033632181584835052 and parameters: {'n_layers': 7, 'n_units': 60, 'activation': 'elu', 'lr': 0.003191834317237278, 'optimizer': 'AdamW', 'batch_size': 1202}. Best is trial 11 with value: 0.0029527833685278893.
Training model with params: layers=7, units=17, activation=elu, optimizer=AdamW, lr=0.006618337857355322, batchsize=1232
Finish Trainingstep 1 of 3 with lr=0.006618337857355322 and 1000 epochs
Finish Trainingstep 2 of 3 with lr=0.006618337857355322 and 1000 epochs
Finish Trainingstep 3 of 3 with lr=0.006618337857355322 and 10000 epochs
2025-05-17_03-42-50
[I 2025-05-17 03:42:50,071] Trial 22 finished with value: 0.005000274628400803 and parameters: {'n_layers': 7, 'n_units': 17, 'activation': 'elu', 'lr': 0.006618337857355322, 'optimizer': 'AdamW', 'batch_size': 1232}. Best is trial 11 with value: 0.0029527833685278893.
Training model with params: layers=9, units=90, activation=elu, optimizer=AdamW, lr=0.0033465579240193805, batchsize=564
Finish Trainingstep 1 of 3 with lr=0.0033465579240193805 and 1000 epochs
Finish Trainingstep 2 of 3 with lr=0.0033465579240193805 and 1000 epochs
Finish Trainingstep 3 of 3 with lr=0.0033465579240193805 and 10000 epochs
2025-05-17_03-53-27
[I 2025-05-17 03:53:27,788] Trial 23 finished with value: 0.0031406551133841276 and parameters: {'n_layers': 9, 'n_units': 90, 'activation': 'elu', 'lr': 0.0033465579240193805, 'optimizer': 'AdamW', 'batch_size': 564}. Best is trial 11 with value: 0.0029527833685278893.
Training model with params: layers=9, units=158, activation=relu, optimizer=rmsprop, lr=0.006588647116400478, batchsize=285
Finish Trainingstep 1 of 3 with lr=0.006588647116400478 and 1000 epochs
Finish Trainingstep 2 of 3 with lr=0.006588647116400478 and 1000 epochs
Finish Trainingstep 3 of 3 with lr=0.006588647116400478 and 10000 epochs
2025-05-17_04-54-01
[I 2025-05-17 04:54:02,029] Trial 24 finished with value: 0.008935915306210518 and parameters: {'n_layers': 9, 'n_units': 158, 'activation': 'relu', 'lr': 0.006588647116400478, 'optimizer': 'rmsprop', 'batch_size': 285}. Best is trial 11 with value: 0.0029527833685278893.
Training model with params: layers=9, units=103, activation=gelu, optimizer=AdamW, lr=0.0007003353300753235, batchsize=557
Finish Trainingstep 1 of 3 with lr=0.0007003353300753235 and 1000 epochs
Finish Trainingstep 2 of 3 with lr=0.0007003353300753235 and 1000 epochs
Finish Trainingstep 3 of 3 with lr=0.0007003353300753235 and 10000 epochs
2025-05-17_05-16-16
[I 2025-05-17 05:16:16,729] Trial 25 finished with value: 0.004539484158158302 and parameters: {'n_layers': 9, 'n_units': 103, 'activation': 'gelu', 'lr': 0.0007003353300753235, 'optimizer': 'AdamW', 'batch_size': 557}. Best is trial 11 with value: 0.0029527833685278893.
Training model with params: layers=3, units=193, activation=sigmoid, optimizer=sgd, lr=0.003179922251000901, batchsize=100
Finish Trainingstep 1 of 3 with lr=0.003179922251000901 and 1000 epochs
Finish Trainingstep 2 of 3 with lr=0.003179922251000901 and 1000 epochs
Finish Trainingstep 3 of 3 with lr=0.003179922251000901 and 10000 epochs
2025-05-17_07-42-51
[I 2025-05-17 07:42:51,368] Trial 26 finished with value: 0.0666767954826355 and parameters: {'n_layers': 3, 'n_units': 193, 'activation': 'sigmoid', 'lr': 0.003179922251000901, 'optimizer': 'sgd', 'batch_size': 100}. Best is trial 11 with value: 0.0029527833685278893.
Training model with params: layers=6, units=339, activation=elu, optimizer=AdamW, lr=0.006160455687962795, batchsize=442
Finish Trainingstep 1 of 3 with lr=0.006160455687962795 and 1000 epochs
Finish Trainingstep 2 of 3 with lr=0.006160455687962795 and 1000 epochs
Finish Trainingstep 3 of 3 with lr=0.006160455687962795 and 10000 epochs
2025-05-17_08-21-37
[I 2025-05-17 08:21:37,318] Trial 27 finished with value: 0.004264954477548599 and parameters: {'n_layers': 6, 'n_units': 339, 'activation': 'elu', 'lr': 0.006160455687962795, 'optimizer': 'AdamW', 'batch_size': 442}. Best is trial 11 with value: 0.0029527833685278893.
Training model with params: layers=5, units=137, activation=elu, optimizer=AdamW, lr=0.00368288240610586, batchsize=664
Finish Trainingstep 1 of 3 with lr=0.00368288240610586 and 1000 epochs
Finish Trainingstep 2 of 3 with lr=0.00368288240610586 and 1000 epochs
Finish Trainingstep 3 of 3 with lr=0.00368288240610586 and 10000 epochs
2025-05-17_08-37-03
[I 2025-05-17 08:37:03,127] Trial 28 finished with value: 0.0033388815354555845 and parameters: {'n_layers': 5, 'n_units': 137, 'activation': 'elu', 'lr': 0.00368288240610586, 'optimizer': 'AdamW', 'batch_size': 664}. Best is trial 11 with value: 0.0029527833685278893.
Training model with params: layers=9, units=93, activation=elu, optimizer=AdamW, lr=0.00020211667334894408, batchsize=267
Finish Trainingstep 1 of 3 with lr=0.00020211667334894408 and 1000 epochs
Finish Trainingstep 2 of 3 with lr=0.00020211667334894408 and 1000 epochs
Finish Trainingstep 3 of 3 with lr=0.00020211667334894408 and 10000 epochs
2025-05-17_08-55-33
