[I 2025-05-17 08:55:33,942] Trial 29 finished with value: 0.008852276019752026 and parameters: {'n_layers': 9, 'n_units': 93, 'activation': 'elu', 'lr': 0.00020211667334894408, 'optimizer': 'AdamW', 'batch_size': 267}. Best is trial 11 with value: 0.0029527833685278893.
Training model with params: layers=2, units=282, activation=elu, optimizer=sgd, lr=0.00010503517725064396, batchsize=989
Finish Trainingstep 1 of 3 with lr=0.00010503517725064396 and 1000 epochs
Finish Trainingstep 2 of 3 with lr=0.00010503517725064396 and 1000 epochs
Finish Trainingstep 3 of 3 with lr=0.00010503517725064396 and 10000 epochs
2025-05-17_09-59-10
[I 2025-05-17 09:59:10,168] Trial 30 finished with value: 0.24485403299331665 and parameters: {'n_layers': 2, 'n_units': 282, 'activation': 'elu', 'lr': 0.00010503517725064396, 'optimizer': 'sgd', 'batch_size': 989}. Best is trial 11 with value: 0.0029527833685278893.
Training model with params: layers=7, units=77, activation=elu, optimizer=AdamW, lr=0.0027787287117916376, batchsize=844
Finish Trainingstep 1 of 3 with lr=0.0027787287117916376 and 1000 epochs
Finish Trainingstep 2 of 3 with lr=0.0027787287117916376 and 1000 epochs
Finish Trainingstep 3 of 3 with lr=0.0027787287117916376 and 10000 epochs
2025-05-17_10-08-30
[I 2025-05-17 10:08:30,376] Trial 31 finished with value: 0.00327643402852118 and parameters: {'n_layers': 7, 'n_units': 77, 'activation': 'elu', 'lr': 0.0027787287117916376, 'optimizer': 'AdamW', 'batch_size': 844}. Best is trial 11 with value: 0.0029527833685278893.
Training model with params: layers=6, units=57, activation=leaky_relu, optimizer=AdamW, lr=0.007825010716275026, batchsize=1086
Finish Trainingstep 1 of 3 with lr=0.007825010716275026 and 1000 epochs
Finish Trainingstep 2 of 3 with lr=0.007825010716275026 and 1000 epochs
Finish Trainingstep 3 of 3 with lr=0.007825010716275026 and 10000 epochs
2025-05-17_10-15-13
[I 2025-05-17 10:15:13,434] Trial 32 finished with value: 0.004170480649918318 and parameters: {'n_layers': 6, 'n_units': 57, 'activation': 'leaky_relu', 'lr': 0.007825010716275026, 'optimizer': 'AdamW', 'batch_size': 1086}. Best is trial 11 with value: 0.0029527833685278893.
Training model with params: layers=8, units=220, activation=elu, optimizer=adam, lr=0.0017125977629887255, batchsize=1286
Finish Trainingstep 1 of 3 with lr=0.0017125977629887255 and 1000 epochs
Finish Trainingstep 2 of 3 with lr=0.0017125977629887255 and 1000 epochs
Finish Trainingstep 3 of 3 with lr=0.0017125977629887255 and 10000 epochs
2025-05-17_10-37-47
[I 2025-05-17 10:37:47,321] Trial 33 finished with value: 0.002619541948661208 and parameters: {'n_layers': 8, 'n_units': 220, 'activation': 'elu', 'lr': 0.0017125977629887255, 'optimizer': 'adam', 'batch_size': 1286}. Best is trial 33 with value: 0.002619541948661208.
Training model with params: layers=10, units=231, activation=relu, optimizer=adam, lr=0.001204743597103706, batchsize=1336
Finish Trainingstep 1 of 3 with lr=0.001204743597103706 and 1000 epochs
Finish Trainingstep 2 of 3 with lr=0.001204743597103706 and 1000 epochs
Finish Trainingstep 3 of 3 with lr=0.001204743597103706 and 10000 epochs
2025-05-17_11-24-41
[I 2025-05-17 11:24:41,405] Trial 34 finished with value: 0.00785417202860117 and parameters: {'n_layers': 10, 'n_units': 231, 'activation': 'relu', 'lr': 0.001204743597103706, 'optimizer': 'adam', 'batch_size': 1336}. Best is trial 33 with value: 0.002619541948661208.
Training model with params: layers=9, units=174, activation=elu, optimizer=adam, lr=0.001744562201215978, batchsize=1553
Finish Trainingstep 1 of 3 with lr=0.001744562201215978 and 1000 epochs
Finish Trainingstep 2 of 3 with lr=0.001744562201215978 and 1000 epochs
Finish Trainingstep 3 of 3 with lr=0.001744562201215978 and 10000 epochs
2025-05-17_12-01-26
[I 2025-05-17 12:01:26,992] Trial 35 finished with value: 0.002800051821395755 and parameters: {'n_layers': 9, 'n_units': 174, 'activation': 'elu', 'lr': 0.001744562201215978, 'optimizer': 'adam', 'batch_size': 1553}. Best is trial 33 with value: 0.002619541948661208.
Training model with params: layers=9, units=319, activation=gelu, optimizer=adam, lr=0.0016442919087556998, batchsize=1565
Finish Trainingstep 1 of 3 with lr=0.0016442919087556998 and 1000 epochs
Finish Trainingstep 2 of 3 with lr=0.0016442919087556998 and 1000 epochs
Finish Trainingstep 3 of 3 with lr=0.0016442919087556998 and 10000 epochs
2025-05-17_12-40-49
[I 2025-05-17 12:40:49,774] Trial 36 finished with value: 0.0013615689240396023 and parameters: {'n_layers': 9, 'n_units': 319, 'activation': 'gelu', 'lr': 0.0016442919087556998, 'optimizer': 'adam', 'batch_size': 1565}. Best is trial 36 with value: 0.0013615689240396023.
Training model with params: layers=8, units=347, activation=gelu, optimizer=adam, lr=0.0008010279005053158, batchsize=1658
Finish Trainingstep 1 of 3 with lr=0.0008010279005053158 and 1000 epochs
Finish Trainingstep 2 of 3 with lr=0.0008010279005053158 and 1000 epochs
Finish Trainingstep 3 of 3 with lr=0.0008010279005053158 and 10000 epochs
2025-05-17_13-38-10
[I 2025-05-17 13:38:10,135] Trial 37 finished with value: 0.001041045063175261 and parameters: {'n_layers': 8, 'n_units': 347, 'activation': 'gelu', 'lr': 0.0008010279005053158, 'optimizer': 'adam', 'batch_size': 1658}. Best is trial 37 with value: 0.001041045063175261.
Training model with params: layers=8, units=362, activation=gelu, optimizer=adam, lr=0.0007702549702858938, batchsize=1573
Finish Trainingstep 1 of 3 with lr=0.0007702549702858938 and 1000 epochs
Finish Trainingstep 2 of 3 with lr=0.0007702549702858938 and 1000 epochs
Finish Trainingstep 3 of 3 with lr=0.0007702549702858938 and 10000 epochs
2025-05-17_14-21-41
[I 2025-05-17 14:21:41,237] Trial 38 finished with value: 0.0011077162344008684 and parameters: {'n_layers': 8, 'n_units': 362, 'activation': 'gelu', 'lr': 0.0007702549702858938, 'optimizer': 'adam', 'batch_size': 1573}. Best is trial 37 with value: 0.001041045063175261.
Training model with params: layers=8, units=337, activation=gelu, optimizer=adam, lr=0.0007526854606883861, batchsize=1725
Finish Trainingstep 1 of 3 with lr=0.0007526854606883861 and 1000 epochs
Finish Trainingstep 2 of 3 with lr=0.0007526854606883861 and 1000 epochs
Finish Trainingstep 3 of 3 with lr=0.0007526854606883861 and 10000 epochs
2025-05-17_15-03-46
[I 2025-05-17 15:03:46,476] Trial 39 finished with value: 0.0016008736565709114 and parameters: {'n_layers': 8, 'n_units': 337, 'activation': 'gelu', 'lr': 0.0007526854606883861, 'optimizer': 'adam', 'batch_size': 1725}. Best is trial 37 with value: 0.001041045063175261.
Training model with params: layers=8, units=371, activation=gelu, optimizer=adam, lr=0.0007023405250481186, batchsize=1728
Finish Trainingstep 1 of 3 with lr=0.0007023405250481186 and 1000 epochs
Finish Trainingstep 2 of 3 with lr=0.0007023405250481186 and 1000 epochs
Finish Trainingstep 3 of 3 with lr=0.0007023405250481186 and 10000 epochs
2025-05-17_15-40-17
[I 2025-05-17 15:40:17,628] Trial 40 finished with value: 0.0014093900099396706 and parameters: {'n_layers': 8, 'n_units': 371, 'activation': 'gelu', 'lr': 0.0007023405250481186, 'optimizer': 'adam', 'batch_size': 1728}. Best is trial 37 with value: 0.001041045063175261.
Training model with params: layers=8, units=364, activation=gelu, optimizer=adam, lr=0.0007595502759231389, batchsize=1707
Finish Trainingstep 1 of 3 with lr=0.0007595502759231389 and 1000 epochs
Finish Trainingstep 2 of 3 with lr=0.0007595502759231389 and 1000 epochs
Finish Trainingstep 3 of 3 with lr=0.0007595502759231389 and 10000 epochs
2025-05-17_16-27-56
[I 2025-05-17 16:27:56,384] Trial 41 finished with value: 0.001218738267198205 and parameters: {'n_layers': 8, 'n_units': 364, 'activation': 'gelu', 'lr': 0.0007595502759231389, 'optimizer': 'adam', 'batch_size': 1707}. Best is trial 37 with value: 0.001041045063175261.
Training model with params: layers=8, units=406, activation=gelu, optimizer=adam, lr=0.0004726445969339016, batchsize=1819
Finish Trainingstep 1 of 3 with lr=0.0004726445969339016 and 1000 epochs
Finish Trainingstep 2 of 3 with lr=0.0004726445969339016 and 1000 epochs
Finish Trainingstep 3 of 3 with lr=0.0004726445969339016 and 10000 epochs
2025-05-17_17-12-08
[I 2025-05-17 17:12:08,459] Trial 42 finished with value: 0.0011344848899170756 and parameters: {'n_layers': 8, 'n_units': 406, 'activation': 'gelu', 'lr': 0.0004726445969339016, 'optimizer': 'adam', 'batch_size': 1819}. Best is trial 37 with value: 0.001041045063175261.
Training model with params: layers=10, units=414, activation=gelu, optimizer=adam, lr=0.0003773728191004733, batchsize=1826
Finish Trainingstep 1 of 3 with lr=0.0003773728191004733 and 1000 epochs
Finish Trainingstep 2 of 3 with lr=0.0003773728191004733 and 1000 epochs
Finish Trainingstep 3 of 3 with lr=0.0003773728191004733 and 10000 epochs
2025-05-17_18-51-40
[I 2025-05-17 18:51:40,670] Trial 43 finished with value: 0.0009858505800366402 and parameters: {'n_layers': 10, 'n_units': 414, 'activation': 'gelu', 'lr': 0.0003773728191004733, 'optimizer': 'adam', 'batch_size': 1826}. Best is trial 43 with value: 0.0009858505800366402.
Training model with params: layers=10, units=415, activation=gelu, optimizer=adam, lr=0.00035054448360618184, batchsize=1802
Finish Trainingstep 1 of 3 with lr=0.00035054448360618184 and 1000 epochs
Finish Trainingstep 2 of 3 with lr=0.00035054448360618184 and 1000 epochs
Finish Trainingstep 3 of 3 with lr=0.00035054448360618184 and 10000 epochs
2025-05-17_20-11-19
[I 2025-05-17 20:11:19,307] Trial 44 finished with value: 0.0012647981056943536 and parameters: {'n_layers': 10, 'n_units': 415, 'activation': 'gelu', 'lr': 0.00035054448360618184, 'optimizer': 'adam', 'batch_size': 1802}. Best is trial 43 with value: 0.0009858505800366402.
Training model with params: layers=10, units=400, activation=gelu, optimizer=adam, lr=0.00043304600208467724, batchsize=1469
Finish Trainingstep 1 of 3 with lr=0.00043304600208467724 and 1000 epochs
Finish Trainingstep 2 of 3 with lr=0.00043304600208467724 and 1000 epochs
Finish Trainingstep 3 of 3 with lr=0.00043304600208467724 and 10000 epochs
2025-05-17_21-26-38
[I 2025-05-17 21:26:38,809] Trial 45 finished with value: 0.0009462592424824834 and parameters: {'n_layers': 10, 'n_units': 400, 'activation': 'gelu', 'lr': 0.00043304600208467724, 'optimizer': 'adam', 'batch_size': 1469}. Best is trial 45 with value: 0.0009462592424824834.
Training model with params: layers=10, units=430, activation=gelu, optimizer=RAdam, lr=0.0004279797990088083, batchsize=1489
Finish Trainingstep 1 of 3 with lr=0.0004279797990088083 and 1000 epochs
Finish Trainingstep 2 of 3 with lr=0.0004279797990088083 and 1000 epochs
Finish Trainingstep 3 of 3 with lr=0.0004279797990088083 and 10000 epochs
2025-05-17_23-00-05
[I 2025-05-17 23:00:05,119] Trial 46 finished with value: 0.001011715386994183 and parameters: {'n_layers': 10, 'n_units': 430, 'activation': 'gelu', 'lr': 0.0004279797990088083, 'optimizer': 'RAdam', 'batch_size': 1489}. Best is trial 45 with value: 0.0009462592424824834.
Training model with params: layers=10, units=453, activation=gelu, optimizer=RAdam, lr=0.00023568025134085253, batchsize=1470
Finish Trainingstep 1 of 3 with lr=0.00023568025134085253 and 1000 epochs
Finish Trainingstep 2 of 3 with lr=0.00023568025134085253 and 1000 epochs
Finish Trainingstep 3 of 3 with lr=0.00023568025134085253 and 10000 epochs
2025-05-18_00-28-27
[I 2025-05-18 00:28:27,945] Trial 47 finished with value: 0.001070957980118692 and parameters: {'n_layers': 10, 'n_units': 453, 'activation': 'gelu', 'lr': 0.00023568025134085253, 'optimizer': 'RAdam', 'batch_size': 1470}. Best is trial 45 with value: 0.0009462592424824834.
Training model with params: layers=10, units=472, activation=gelu, optimizer=RAdam, lr=0.00017203088576375641, batchsize=1433
Finish Trainingstep 1 of 3 with lr=0.00017203088576375641 and 1000 epochs
Finish Trainingstep 2 of 3 with lr=0.00017203088576375641 and 1000 epochs
Finish Trainingstep 3 of 3 with lr=0.00017203088576375641 and 10000 epochs
2025-05-18_02-03-55
[I 2025-05-18 02:03:56,005] Trial 48 finished with value: 0.0008083803695626557 and parameters: {'n_layers': 10, 'n_units': 472, 'activation': 'gelu', 'lr': 0.00017203088576375641, 'optimizer': 'RAdam', 'batch_size': 1433}. Best is trial 48 with value: 0.0008083803695626557.
Training model with params: layers=10, units=510, activation=gelu, optimizer=RAdam, lr=0.0001436036878973182, batchsize=1442
Finish Trainingstep 1 of 3 with lr=0.0001436036878973182 and 1000 epochs
Finish Trainingstep 2 of 3 with lr=0.0001436036878973182 and 1000 epochs
Finish Trainingstep 3 of 3 with lr=0.0001436036878973182 and 10000 epochs
2025-05-18_05-47-25
[I 2025-05-18 05:47:25,432] Trial 49 finished with value: 0.0008896513027139008 and parameters: {'n_layers': 10, 'n_units': 510, 'activation': 'gelu', 'lr': 0.0001436036878973182, 'optimizer': 'RAdam', 'batch_size': 1442}. Best is trial 48 with value: 0.0008083803695626557.
Training model with params: layers=10, units=501, activation=gelu, optimizer=RAdam, lr=0.00014465180789263144, batchsize=1398
Finish Trainingstep 1 of 3 with lr=0.00014465180789263144 and 1000 epochs
Finish Trainingstep 2 of 3 with lr=0.00014465180789263144 and 1000 epochs
Finish Trainingstep 3 of 3 with lr=0.00014465180789263144 and 10000 epochs
2025-05-18_08-34-51
[I 2025-05-18 08:34:51,309] Trial 50 finished with value: 0.0006871324731037021 and parameters: {'n_layers': 10, 'n_units': 501, 'activation': 'gelu', 'lr': 0.00014465180789263144, 'optimizer': 'RAdam', 'batch_size': 1398}. Best is trial 50 with value: 0.0006871324731037021.
Training model with params: layers=10, units=509, activation=gelu, optimizer=RAdam, lr=0.00014859834498110112, batchsize=1397
Finish Trainingstep 1 of 3 with lr=0.00014859834498110112 and 1000 epochs
Finish Trainingstep 2 of 3 with lr=0.00014859834498110112 and 1000 epochs
Finish Trainingstep 3 of 3 with lr=0.00014859834498110112 and 10000 epochs
2025-05-18_11-56-10
[I 2025-05-18 11:56:10,128] Trial 51 finished with value: 0.0006792032509110868 and parameters: {'n_layers': 10, 'n_units': 509, 'activation': 'gelu', 'lr': 0.00014859834498110112, 'optimizer': 'RAdam', 'batch_size': 1397}. Best is trial 51 with value: 0.0006792032509110868.
Training model with params: layers=10, units=505, activation=tanh, optimizer=RAdam, lr=0.00014738045619337806, batchsize=1396
Finish Trainingstep 1 of 3 with lr=0.00014738045619337806 and 1000 epochs
Finish Trainingstep 2 of 3 with lr=0.00014738045619337806 and 1000 epochs
Finish Trainingstep 3 of 3 with lr=0.00014738045619337806 and 10000 epochs
2025-05-18_13-05-33
[I 2025-05-18 13:05:33,440] Trial 52 finished with value: 0.002200047019869089 and parameters: {'n_layers': 10, 'n_units': 505, 'activation': 'tanh', 'lr': 0.00014738045619337806, 'optimizer': 'RAdam', 'batch_size': 1396}. Best is trial 51 with value: 0.0006792032509110868.
Training model with params: layers=10, units=481, activation=swish, optimizer=RAdam, lr=0.00014888772555276714, batchsize=1464
Finish Trainingstep 1 of 3 with lr=0.00014888772555276714 and 1000 epochs
Finish Trainingstep 2 of 3 with lr=0.00014888772555276714 and 1000 epochs
Finish Trainingstep 3 of 3 with lr=0.00014888772555276714 and 10000 epochs
2025-05-18_14-16-59
[I 2025-05-18 14:16:59,794] Trial 53 finished with value: 0.000753004162106663 and parameters: {'n_layers': 10, 'n_units': 481, 'activation': 'swish', 'lr': 0.00014888772555276714, 'optimizer': 'RAdam', 'batch_size': 1464}. Best is trial 51 with value: 0.0006792032509110868.
Training model with params: layers=10, units=482, activation=swish, optimizer=RAdam, lr=0.0001438366513256337, batchsize=1449
Finish Trainingstep 1 of 3 with lr=0.0001438366513256337 and 1000 epochs
Finish Trainingstep 2 of 3 with lr=0.0001438366513256337 and 1000 epochs
Finish Trainingstep 3 of 3 with lr=0.0001438366513256337 and 10000 epochs
2025-05-18_16-17-57
[I 2025-05-18 16:17:57,130] Trial 54 finished with value: 0.0007480148924514651 and parameters: {'n_layers': 10, 'n_units': 482, 'activation': 'swish', 'lr': 0.0001438366513256337, 'optimizer': 'RAdam', 'batch_size': 1449}. Best is trial 51 with value: 0.0006792032509110868.
Training model with params: layers=9, units=484, activation=swish, optimizer=RAdam, lr=0.00014981382764327113, batchsize=1294
Finish Trainingstep 1 of 3 with lr=0.00014981382764327113 and 1000 epochs
Finish Trainingstep 2 of 3 with lr=0.00014981382764327113 and 1000 epochs
Finish Trainingstep 3 of 3 with lr=0.00014981382764327113 and 10000 epochs
2025-05-18_18-22-08
[I 2025-05-18 18:22:08,510] Trial 55 finished with value: 0.0006623346707783639 and parameters: {'n_layers': 9, 'n_units': 484, 'activation': 'swish', 'lr': 0.00014981382764327113, 'optimizer': 'RAdam', 'batch_size': 1294}. Best is trial 55 with value: 0.0006623346707783639.
Training model with params: layers=9, units=481, activation=swish, optimizer=RAdam, lr=0.00016804702376853686, batchsize=1312
Finish Trainingstep 1 of 3 with lr=0.00016804702376853686 and 1000 epochs
Finish Trainingstep 2 of 3 with lr=0.00016804702376853686 and 1000 epochs
Finish Trainingstep 3 of 3 with lr=0.00016804702376853686 and 10000 epochs
2025-05-18_19-57-22
[I 2025-05-18 19:57:22,758] Trial 56 finished with value: 0.0008560643764212728 and parameters: {'n_layers': 9, 'n_units': 481, 'activation': 'swish', 'lr': 0.00016804702376853686, 'optimizer': 'RAdam', 'batch_size': 1312}. Best is trial 55 with value: 0.0006623346707783639.
Training model with params: layers=9, units=475, activation=swish, optimizer=RAdam, lr=0.0001251464969860791, batchsize=1147
Finish Trainingstep 1 of 3 with lr=0.0001251464969860791 and 1000 epochs
Finish Trainingstep 2 of 3 with lr=0.0001251464969860791 and 1000 epochs
Finish Trainingstep 3 of 3 with lr=0.0001251464969860791 and 10000 epochs
2025-05-18_23-30-35
[I 2025-05-18 23:30:35,889] Trial 57 finished with value: 0.0008369486895389855 and parameters: {'n_layers': 9, 'n_units': 475, 'activation': 'swish', 'lr': 0.0001251464969860791, 'optimizer': 'RAdam', 'batch_size': 1147}. Best is trial 55 with value: 0.0006623346707783639.
Training model with params: layers=10, units=481, activation=swish, optimizer=RAdam, lr=0.00027103080469759064, batchsize=1369
Finish Trainingstep 1 of 3 with lr=0.00027103080469759064 and 1000 epochs
Finish Trainingstep 2 of 3 with lr=0.00027103080469759064 and 1000 epochs
Finish Trainingstep 3 of 3 with lr=0.00027103080469759064 and 10000 epochs
2025-05-19_00-40-33
[I 2025-05-19 00:40:33,331] Trial 58 finished with value: 0.0008554891683161259 and parameters: {'n_layers': 10, 'n_units': 481, 'activation': 'swish', 'lr': 0.00027103080469759064, 'optimizer': 'RAdam', 'batch_size': 1369}. Best is trial 55 with value: 0.0006623346707783639.
Training model with params: layers=9, units=457, activation=swish, optimizer=RAdam, lr=0.00019051783320364374, batchsize=1275
Finish Trainingstep 1 of 3 with lr=0.00019051783320364374 and 1000 epochs
Finish Trainingstep 2 of 3 with lr=0.00019051783320364374 and 1000 epochs
Finish Trainingstep 3 of 3 with lr=0.00019051783320364374 and 10000 epochs
2025-05-19_01-43-29
[I 2025-05-19 01:43:29,195] Trial 59 finished with value: 0.0007978255744092166 and parameters: {'n_layers': 9, 'n_units': 457, 'activation': 'swish', 'lr': 0.00019051783320364374, 'optimizer': 'RAdam', 'batch_size': 1275}. Best is trial 55 with value: 0.0006623346707783639.
Training model with params: layers=9, units=442, activation=swish, optimizer=RAdam, lr=0.00011319304393115195, batchsize=1267
Finish Trainingstep 1 of 3 with lr=0.00011319304393115195 and 1000 epochs
Finish Trainingstep 2 of 3 with lr=0.00011319304393115195 and 1000 epochs
Finish Trainingstep 3 of 3 with lr=0.00011319304393115195 and 10000 epochs
2025-05-19_04-24-03
[I 2025-05-19 04:24:03,791] Trial 60 finished with value: 0.0007572065806016326 and parameters: {'n_layers': 9, 'n_units': 442, 'activation': 'swish', 'lr': 0.00011319304393115195, 'optimizer': 'RAdam', 'batch_size': 1267}. Best is trial 55 with value: 0.0006623346707783639.
Training model with params: layers=9, units=444, activation=swish, optimizer=RAdam, lr=0.00010334763494858408, batchsize=1267
Finish Trainingstep 1 of 3 with lr=0.00010334763494858408 and 1000 epochs
Finish Trainingstep 2 of 3 with lr=0.00010334763494858408 and 1000 epochs
Finish Trainingstep 3 of 3 with lr=0.00010334763494858408 and 10000 epochs
2025-05-19_05-47-26
[I 2025-05-19 05:47:26,772] Trial 61 finished with value: 0.0007130472222343087 and parameters: {'n_layers': 9, 'n_units': 444, 'activation': 'swish', 'lr': 0.00010334763494858408, 'optimizer': 'RAdam', 'batch_size': 1267}. Best is trial 55 with value: 0.0006623346707783639.
Training model with params: layers=9, units=445, activation=swish, optimizer=RAdam, lr=0.0001105402335052633, batchsize=1135
Finish Trainingstep 1 of 3 with lr=0.0001105402335052633 and 1000 epochs
Finish Trainingstep 2 of 3 with lr=0.0001105402335052633 and 1000 epochs
Finish Trainingstep 3 of 3 with lr=0.0001105402335052633 and 10000 epochs
2025-05-19_08-30-01
[I 2025-05-19 08:30:01,747] Trial 62 finished with value: 0.0009570064721629024 and parameters: {'n_layers': 9, 'n_units': 445, 'activation': 'swish', 'lr': 0.0001105402335052633, 'optimizer': 'RAdam', 'batch_size': 1135}. Best is trial 55 with value: 0.0006623346707783639.
Training model with params: layers=9, units=495, activation=swish, optimizer=RAdam, lr=0.0001285364652464322, batchsize=1251
Finish Trainingstep 1 of 3 with lr=0.0001285364652464322 and 1000 epochs
Finish Trainingstep 2 of 3 with lr=0.0001285364652464322 and 1000 epochs
Finish Trainingstep 3 of 3 with lr=0.0001285364652464322 and 10000 epochs
2025-05-19_10-46-32
