[I 2025-05-22 21:02:58,057] Trial 97 finished with value: 0.0011632031528279185 and parameters: {'n_layers': 7, 'n_units': 473, 'activation': 'swish', 'lr': 0.0002425670640773005, 'optimizer': 'RAdam', 'batch_size': 1400}. Best is trial 83 with value: 0.0006438998389057815.
Training model with params: layers=10, units=438, activation=swish, optimizer=RAdam, lr=0.00010872576101997798, batchsize=1347
Finish Trainingstep 1 of 3 with lr=0.00010872576101997798 and 1000 epochs
Finish Trainingstep 2 of 3 with lr=0.00010872576101997798 and 1000 epochs
Finish Trainingstep 3 of 3 with lr=0.00010872576101997798 and 10000 epochs
2025-05-23_00-25-03
[I 2025-05-23 00:25:03,326] Trial 98 finished with value: 0.000616528675891459 and parameters: {'n_layers': 10, 'n_units': 438, 'activation': 'swish', 'lr': 0.00010872576101997798, 'optimizer': 'RAdam', 'batch_size': 1347}. Best is trial 98 with value: 0.000616528675891459.
Training model with params: layers=10, units=505, activation=selu, optimizer=RAdam, lr=0.00013670445554516905, batchsize=1606
Finish Trainingstep 1 of 3 with lr=0.00013670445554516905 and 1000 epochs
Finish Trainingstep 2 of 3 with lr=0.00013670445554516905 and 1000 epochs
Finish Trainingstep 3 of 3 with lr=0.00013670445554516905 and 10000 epochs
2025-05-23_02-16-36
[I 2025-05-23 02:16:36,684] Trial 99 finished with value: 0.004550803918391466 and parameters: {'n_layers': 10, 'n_units': 505, 'activation': 'selu', 'lr': 0.00013670445554516905, 'optimizer': 'RAdam', 'batch_size': 1606}. Best is trial 98 with value: 0.000616528675891459.
Beste Parameter:
{'n_layers': 10, 'n_units': 438, 'activation': 'swish', 'lr': 0.00010872576101997798, 'optimizer': 'RAdam', 'batch_size': 1347}
