[I 2025-05-19 10:46:32,383] Trial 63 finished with value: 0.0007459492771886289 and parameters: {'n_layers': 9, 'n_units': 495, 'activation': 'swish', 'lr': 0.0001285364652464322, 'optimizer': 'RAdam', 'batch_size': 1251}. Best is trial 55 with value: 0.0006623346707783639.
Training model with params: layers=10, units=494, activation=swish, optimizer=RAdam, lr=0.000131570899501818, batchsize=1032
Finish Trainingstep 1 of 3 with lr=0.000131570899501818 and 1000 epochs
Finish Trainingstep 2 of 3 with lr=0.000131570899501818 and 1000 epochs
Finish Trainingstep 3 of 3 with lr=0.000131570899501818 and 10000 epochs
2025-05-19_13-06-22
[I 2025-05-19 13:06:22,425] Trial 64 finished with value: 0.0008113604271784425 and parameters: {'n_layers': 10, 'n_units': 494, 'activation': 'swish', 'lr': 0.000131570899501818, 'optimizer': 'RAdam', 'batch_size': 1032}. Best is trial 55 with value: 0.0006623346707783639.
Training model with params: layers=9, units=496, activation=swish, optimizer=RAdam, lr=0.00026654963746010254, batchsize=1515
Finish Trainingstep 1 of 3 with lr=0.00026654963746010254 and 1000 epochs
Finish Trainingstep 2 of 3 with lr=0.00026654963746010254 and 1000 epochs
Finish Trainingstep 3 of 3 with lr=0.00026654963746010254 and 10000 epochs
2025-05-19_15-22-53
[I 2025-05-19 15:22:53,997] Trial 65 finished with value: 0.000859042804222554 and parameters: {'n_layers': 9, 'n_units': 496, 'activation': 'swish', 'lr': 0.00026654963746010254, 'optimizer': 'RAdam', 'batch_size': 1515}. Best is trial 55 with value: 0.0006623346707783639.
Training model with params: layers=10, units=491, activation=swish, optimizer=RAdam, lr=0.00010060390288570615, batchsize=935
Finish Trainingstep 1 of 3 with lr=0.00010060390288570615 and 1000 epochs
Finish Trainingstep 2 of 3 with lr=0.00010060390288570615 and 1000 epochs
Finish Trainingstep 3 of 3 with lr=0.00010060390288570615 and 10000 epochs
2025-05-19_17-46-36
[I 2025-05-19 17:46:36,629] Trial 66 finished with value: 0.0006549914251081645 and parameters: {'n_layers': 10, 'n_units': 491, 'activation': 'swish', 'lr': 0.00010060390288570615, 'optimizer': 'RAdam', 'batch_size': 935}. Best is trial 66 with value: 0.0006549914251081645.
Training model with params: layers=9, units=464, activation=swish, optimizer=RAdam, lr=0.00010383633588026444, batchsize=944
Finish Trainingstep 1 of 3 with lr=0.00010383633588026444 and 1000 epochs
Finish Trainingstep 2 of 3 with lr=0.00010383633588026444 and 1000 epochs
Finish Trainingstep 3 of 3 with lr=0.00010383633588026444 and 10000 epochs
2025-05-19_19-28-57
[I 2025-05-19 19:28:58,023] Trial 67 finished with value: 0.0006921041058376431 and parameters: {'n_layers': 9, 'n_units': 464, 'activation': 'swish', 'lr': 0.00010383633588026444, 'optimizer': 'RAdam', 'batch_size': 944}. Best is trial 66 with value: 0.0006549914251081645.
Training model with params: layers=9, units=463, activation=selu, optimizer=rmsprop, lr=0.00010078629095476136, batchsize=926
Finish Trainingstep 1 of 3 with lr=0.00010078629095476136 and 1000 epochs
Finish Trainingstep 2 of 3 with lr=0.00010078629095476136 and 1000 epochs
Finish Trainingstep 3 of 3 with lr=0.00010078629095476136 and 10000 epochs
2025-05-19_23-20-49
[I 2025-05-19 23:20:49,486] Trial 68 finished with value: 0.005510115996003151 and parameters: {'n_layers': 9, 'n_units': 463, 'activation': 'selu', 'lr': 0.00010078629095476136, 'optimizer': 'rmsprop', 'batch_size': 926}. Best is trial 66 with value: 0.0006549914251081645.
Training model with params: layers=9, units=392, activation=leaky_relu, optimizer=RAdam, lr=0.0002250370306898537, batchsize=699
Finish Trainingstep 1 of 3 with lr=0.0002250370306898537 and 1000 epochs
Finish Trainingstep 2 of 3 with lr=0.0002250370306898537 and 1000 epochs
Finish Trainingstep 3 of 3 with lr=0.0002250370306898537 and 10000 epochs
2025-05-20_01-22-40
[I 2025-05-20 01:22:40,439] Trial 69 finished with value: 0.00522116431966424 and parameters: {'n_layers': 9, 'n_units': 392, 'activation': 'leaky_relu', 'lr': 0.0002250370306898537, 'optimizer': 'RAdam', 'batch_size': 699}. Best is trial 66 with value: 0.0006549914251081645.
Training model with params: layers=9, units=433, activation=sigmoid, optimizer=RAdam, lr=0.0001236325701384328, batchsize=926
Finish Trainingstep 1 of 3 with lr=0.0001236325701384328 and 1000 epochs
Finish Trainingstep 2 of 3 with lr=0.0001236325701384328 and 1000 epochs
Finish Trainingstep 3 of 3 with lr=0.0001236325701384328 and 10000 epochs
2025-05-20_04-55-09
[I 2025-05-20 04:55:09,649] Trial 70 finished with value: 0.008941262029111385 and parameters: {'n_layers': 9, 'n_units': 433, 'activation': 'sigmoid', 'lr': 0.0001236325701384328, 'optimizer': 'RAdam', 'batch_size': 926}. Best is trial 66 with value: 0.0006549914251081645.
Training model with params: layers=10, units=494, activation=swish, optimizer=RAdam, lr=0.00016437314701267712, batchsize=1202
Finish Trainingstep 1 of 3 with lr=0.00016437314701267712 and 1000 epochs
Finish Trainingstep 2 of 3 with lr=0.00016437314701267712 and 1000 epochs
Finish Trainingstep 3 of 3 with lr=0.00016437314701267712 and 10000 epochs
2025-05-20_06-35-50
[I 2025-05-20 06:35:50,579] Trial 71 finished with value: 0.000705667189322412 and parameters: {'n_layers': 10, 'n_units': 494, 'activation': 'swish', 'lr': 0.00016437314701267712, 'optimizer': 'RAdam', 'batch_size': 1202}. Best is trial 66 with value: 0.0006549914251081645.
Training model with params: layers=10, units=495, activation=swish, optimizer=RAdam, lr=0.00018226731344769785, batchsize=1094
Finish Trainingstep 1 of 3 with lr=0.00018226731344769785 and 1000 epochs
Finish Trainingstep 2 of 3 with lr=0.00018226731344769785 and 1000 epochs
Finish Trainingstep 3 of 3 with lr=0.00018226731344769785 and 10000 epochs
2025-05-20_07-55-34
[I 2025-05-20 07:55:34,557] Trial 72 finished with value: 0.0007674397784285247 and parameters: {'n_layers': 10, 'n_units': 495, 'activation': 'swish', 'lr': 0.00018226731344769785, 'optimizer': 'RAdam', 'batch_size': 1094}. Best is trial 66 with value: 0.0006549914251081645.
Training model with params: layers=10, units=465, activation=swish, optimizer=RAdam, lr=0.00016141176963399694, batchsize=1031
Finish Trainingstep 1 of 3 with lr=0.00016141176963399694 and 1000 epochs
Finish Trainingstep 2 of 3 with lr=0.00016141176963399694 and 1000 epochs
Finish Trainingstep 3 of 3 with lr=0.00016141176963399694 and 10000 epochs
2025-05-20_09-51-29
[I 2025-05-20 09:51:30,046] Trial 73 finished with value: 0.0006449513603001833 and parameters: {'n_layers': 10, 'n_units': 465, 'activation': 'swish', 'lr': 0.00016141176963399694, 'optimizer': 'RAdam', 'batch_size': 1031}. Best is trial 73 with value: 0.0006449513603001833.
Training model with params: layers=10, units=464, activation=swish, optimizer=RAdam, lr=0.00016689950088920978, batchsize=812
Finish Trainingstep 1 of 3 with lr=0.00016689950088920978 and 1000 epochs
Finish Trainingstep 2 of 3 with lr=0.00016689950088920978 and 1000 epochs
Finish Trainingstep 3 of 3 with lr=0.00016689950088920978 and 10000 epochs
2025-05-20_12-16-35
[I 2025-05-20 12:16:35,640] Trial 74 finished with value: 0.0007229239563457668 and parameters: {'n_layers': 10, 'n_units': 464, 'activation': 'swish', 'lr': 0.00016689950088920978, 'optimizer': 'RAdam', 'batch_size': 812}. Best is trial 73 with value: 0.0006449513603001833.
Training model with params: layers=10, units=442, activation=swish, optimizer=RAdam, lr=0.0002080992267298827, batchsize=936
Finish Trainingstep 1 of 3 with lr=0.0002080992267298827 and 1000 epochs
Finish Trainingstep 2 of 3 with lr=0.0002080992267298827 and 1000 epochs
Finish Trainingstep 3 of 3 with lr=0.0002080992267298827 and 10000 epochs
2025-05-20_14-01-34
[I 2025-05-20 14:01:34,890] Trial 75 finished with value: 0.0008460477693006396 and parameters: {'n_layers': 10, 'n_units': 442, 'activation': 'swish', 'lr': 0.0002080992267298827, 'optimizer': 'RAdam', 'batch_size': 936}. Best is trial 73 with value: 0.0006449513603001833.
Training model with params: layers=4, units=510, activation=relu, optimizer=sgd, lr=0.0003056296216619345, batchsize=1193
Finish Trainingstep 1 of 3 with lr=0.0003056296216619345 and 1000 epochs
Finish Trainingstep 2 of 3 with lr=0.0003056296216619345 and 1000 epochs
Finish Trainingstep 3 of 3 with lr=0.0003056296216619345 and 10000 epochs
2025-05-20_15-59-13
[I 2025-05-20 15:59:13,308] Trial 76 finished with value: 0.1716395765542984 and parameters: {'n_layers': 4, 'n_units': 510, 'activation': 'relu', 'lr': 0.0003056296216619345, 'optimizer': 'sgd', 'batch_size': 1193}. Best is trial 73 with value: 0.0006449513603001833.
Training model with params: layers=10, units=464, activation=tanh, optimizer=RAdam, lr=0.00010140041550679531, batchsize=1008
Finish Trainingstep 1 of 3 with lr=0.00010140041550679531 and 1000 epochs
Finish Trainingstep 2 of 3 with lr=0.00010140041550679531 and 1000 epochs
Finish Trainingstep 3 of 3 with lr=0.00010140041550679531 and 10000 epochs
2025-05-20_17-50-05
[I 2025-05-20 17:50:06,078] Trial 77 finished with value: 0.0023191042710095644 and parameters: {'n_layers': 10, 'n_units': 464, 'activation': 'tanh', 'lr': 0.00010140041550679531, 'optimizer': 'RAdam', 'batch_size': 1008}. Best is trial 73 with value: 0.0006449513603001833.
Training model with params: layers=9, units=388, activation=swish, optimizer=RAdam, lr=0.000159947154505021, batchsize=1111
Finish Trainingstep 1 of 3 with lr=0.000159947154505021 and 1000 epochs
Finish Trainingstep 2 of 3 with lr=0.000159947154505021 and 1000 epochs
Finish Trainingstep 3 of 3 with lr=0.000159947154505021 and 10000 epochs
2025-05-20_19-44-56
[I 2025-05-20 19:44:56,439] Trial 78 finished with value: 0.000719984236638993 and parameters: {'n_layers': 9, 'n_units': 388, 'activation': 'swish', 'lr': 0.000159947154505021, 'optimizer': 'RAdam', 'batch_size': 1111}. Best is trial 73 with value: 0.0006449513603001833.
Training model with params: layers=10, units=492, activation=swish, optimizer=rmsprop, lr=0.00012007036186690646, batchsize=1350
Finish Trainingstep 1 of 3 with lr=0.00012007036186690646 and 1000 epochs
Finish Trainingstep 2 of 3 with lr=0.00012007036186690646 and 1000 epochs
Finish Trainingstep 3 of 3 with lr=0.00012007036186690646 and 10000 epochs
2025-05-21_01-14-37
[I 2025-05-21 01:14:37,141] Trial 79 finished with value: 0.0012059484142810106 and parameters: {'n_layers': 10, 'n_units': 492, 'activation': 'swish', 'lr': 0.00012007036186690646, 'optimizer': 'rmsprop', 'batch_size': 1350}. Best is trial 73 with value: 0.0006449513603001833.
Training model with params: layers=9, units=424, activation=leaky_relu, optimizer=RAdam, lr=0.00019343108654160882, batchsize=722
Finish Trainingstep 1 of 3 with lr=0.00019343108654160882 and 1000 epochs
Finish Trainingstep 2 of 3 with lr=0.00019343108654160882 and 1000 epochs
Finish Trainingstep 3 of 3 with lr=0.00019343108654160882 and 10000 epochs
2025-05-21_04-33-56
[I 2025-05-21 04:33:56,999] Trial 80 finished with value: 0.006231505423784256 and parameters: {'n_layers': 9, 'n_units': 424, 'activation': 'leaky_relu', 'lr': 0.00019343108654160882, 'optimizer': 'RAdam', 'batch_size': 722}. Best is trial 73 with value: 0.0006449513603001833.
Training model with params: layers=9, units=388, activation=swish, optimizer=RAdam, lr=0.00015815789190891494, batchsize=1092
Finish Trainingstep 1 of 3 with lr=0.00015815789190891494 and 1000 epochs
Finish Trainingstep 2 of 3 with lr=0.00015815789190891494 and 1000 epochs
Finish Trainingstep 3 of 3 with lr=0.00015815789190891494 and 10000 epochs
2025-05-21_06-39-25
[I 2025-05-21 06:39:25,717] Trial 81 finished with value: 0.0007242723950184882 and parameters: {'n_layers': 9, 'n_units': 388, 'activation': 'swish', 'lr': 0.00015815789190891494, 'optimizer': 'RAdam', 'batch_size': 1092}. Best is trial 73 with value: 0.0006449513603001833.
Training model with params: layers=8, units=468, activation=swish, optimizer=RAdam, lr=0.00013258964863595207, batchsize=1157
Finish Trainingstep 1 of 3 with lr=0.00013258964863595207 and 1000 epochs
Finish Trainingstep 2 of 3 with lr=0.00013258964863595207 and 1000 epochs
Finish Trainingstep 3 of 3 with lr=0.00013258964863595207 and 10000 epochs
2025-05-21_08-17-18
[I 2025-05-21 08:17:18,763] Trial 82 finished with value: 0.0008753153961151838 and parameters: {'n_layers': 8, 'n_units': 468, 'activation': 'swish', 'lr': 0.00013258964863595207, 'optimizer': 'RAdam', 'batch_size': 1157}. Best is trial 73 with value: 0.0006449513603001833.
Training model with params: layers=10, units=449, activation=swish, optimizer=RAdam, lr=0.00011514616228470686, batchsize=963
Finish Trainingstep 1 of 3 with lr=0.00011514616228470686 and 1000 epochs
Finish Trainingstep 2 of 3 with lr=0.00011514616228470686 and 1000 epochs
Finish Trainingstep 3 of 3 with lr=0.00011514616228470686 and 10000 epochs
2025-05-21_10-54-29
[I 2025-05-21 10:54:29,954] Trial 83 finished with value: 0.0006438998389057815 and parameters: {'n_layers': 10, 'n_units': 449, 'activation': 'swish', 'lr': 0.00011514616228470686, 'optimizer': 'RAdam', 'batch_size': 963}. Best is trial 83 with value: 0.0006438998389057815.
Training model with params: layers=10, units=452, activation=selu, optimizer=RAdam, lr=0.00011459956192370111, batchsize=873
Finish Trainingstep 1 of 3 with lr=0.00011459956192370111 and 1000 epochs
Finish Trainingstep 2 of 3 with lr=0.00011459956192370111 and 1000 epochs
Finish Trainingstep 3 of 3 with lr=0.00011459956192370111 and 10000 epochs
2025-05-21_14-16-06
[I 2025-05-21 14:16:06,965] Trial 84 finished with value: 0.004646891728043556 and parameters: {'n_layers': 10, 'n_units': 452, 'activation': 'selu', 'lr': 0.00011459956192370111, 'optimizer': 'RAdam', 'batch_size': 873}. Best is trial 83 with value: 0.0006438998389057815.
Training model with params: layers=10, units=485, activation=sigmoid, optimizer=RAdam, lr=0.00010006562580584689, batchsize=751
Finish Trainingstep 1 of 3 with lr=0.00010006562580584689 and 1000 epochs
Finish Trainingstep 2 of 3 with lr=0.00010006562580584689 and 1000 epochs
Finish Trainingstep 3 of 3 with lr=0.00010006562580584689 and 10000 epochs
2025-05-21_15-22-54
[I 2025-05-21 15:22:54,482] Trial 85 finished with value: 1.025478482246399 and parameters: {'n_layers': 10, 'n_units': 485, 'activation': 'sigmoid', 'lr': 0.00010006562580584689, 'optimizer': 'RAdam', 'batch_size': 751}. Best is trial 83 with value: 0.0006438998389057815.
Training model with params: layers=10, units=504, activation=swish, optimizer=RAdam, lr=0.0002233789525733212, batchsize=985
Finish Trainingstep 1 of 3 with lr=0.0002233789525733212 and 1000 epochs
Finish Trainingstep 2 of 3 with lr=0.0002233789525733212 and 1000 epochs
Finish Trainingstep 3 of 3 with lr=0.0002233789525733212 and 10000 epochs
2025-05-21_17-54-03
[I 2025-05-21 17:54:03,566] Trial 86 finished with value: 0.0008581546135246754 and parameters: {'n_layers': 10, 'n_units': 504, 'activation': 'swish', 'lr': 0.0002233789525733212, 'optimizer': 'RAdam', 'batch_size': 985}. Best is trial 83 with value: 0.0006438998389057815.
Training model with params: layers=10, units=449, activation=swish, optimizer=sgd, lr=0.00014066480381747477, batchsize=1209
Finish Trainingstep 1 of 3 with lr=0.00014066480381747477 and 1000 epochs
Finish Trainingstep 2 of 3 with lr=0.00014066480381747477 and 1000 epochs
Finish Trainingstep 3 of 3 with lr=0.00014066480381747477 and 10000 epochs
2025-05-21_18-52-40
[I 2025-05-21 18:52:41,155] Trial 87 finished with value: 1.0255365371704102 and parameters: {'n_layers': 10, 'n_units': 449, 'activation': 'swish', 'lr': 0.00014066480381747477, 'optimizer': 'sgd', 'batch_size': 1209}. Best is trial 83 with value: 0.0006438998389057815.
Training model with params: layers=10, units=433, activation=swish, optimizer=RAdam, lr=0.00011510838014854011, batchsize=627
Finish Trainingstep 1 of 3 with lr=0.00011510838014854011 and 1000 epochs
Finish Trainingstep 2 of 3 with lr=0.00011510838014854011 and 1000 epochs
Finish Trainingstep 3 of 3 with lr=0.00011510838014854011 and 10000 epochs
2025-05-21_22-36-11
[I 2025-05-21 22:36:11,764] Trial 88 finished with value: 0.0008127583423629403 and parameters: {'n_layers': 10, 'n_units': 433, 'activation': 'swish', 'lr': 0.00011510838014854011, 'optimizer': 'RAdam', 'batch_size': 627}. Best is trial 83 with value: 0.0006438998389057815.
Training model with params: layers=9, units=417, activation=swish, optimizer=RAdam, lr=0.00017265905678165775, batchsize=1048
Finish Trainingstep 1 of 3 with lr=0.00017265905678165775 and 1000 epochs
Finish Trainingstep 2 of 3 with lr=0.00017265905678165775 and 1000 epochs
Finish Trainingstep 3 of 3 with lr=0.00017265905678165775 and 10000 epochs
2025-05-22_01-08-50
[I 2025-05-22 01:08:50,400] Trial 89 finished with value: 0.000793436833191663 and parameters: {'n_layers': 9, 'n_units': 417, 'activation': 'swish', 'lr': 0.00017265905678165775, 'optimizer': 'RAdam', 'batch_size': 1048}. Best is trial 83 with value: 0.0006438998389057815.
Training model with params: layers=10, units=512, activation=relu, optimizer=RAdam, lr=0.00013739929373853473, batchsize=871
Finish Trainingstep 1 of 3 with lr=0.00013739929373853473 and 1000 epochs
Finish Trainingstep 2 of 3 with lr=0.00013739929373853473 and 1000 epochs
Finish Trainingstep 3 of 3 with lr=0.00013739929373853473 and 10000 epochs
2025-05-22_03-37-14
[I 2025-05-22 03:37:14,957] Trial 90 finished with value: 0.009076479822397232 and parameters: {'n_layers': 10, 'n_units': 512, 'activation': 'relu', 'lr': 0.00013739929373853473, 'optimizer': 'RAdam', 'batch_size': 871}. Best is trial 83 with value: 0.0006438998389057815.
Training model with params: layers=9, units=474, activation=swish, optimizer=RAdam, lr=0.0001583683530364676, batchsize=1104
Finish Trainingstep 1 of 3 with lr=0.0001583683530364676 and 1000 epochs
Finish Trainingstep 2 of 3 with lr=0.0001583683530364676 and 1000 epochs
Finish Trainingstep 3 of 3 with lr=0.0001583683530364676 and 10000 epochs
2025-05-22_05-52-31
[I 2025-05-22 05:52:31,638] Trial 91 finished with value: 0.0008430902380496264 and parameters: {'n_layers': 9, 'n_units': 474, 'activation': 'swish', 'lr': 0.0001583683530364676, 'optimizer': 'RAdam', 'batch_size': 1104}. Best is trial 83 with value: 0.0006438998389057815.
Training model with params: layers=9, units=488, activation=swish, optimizer=RAdam, lr=0.00015375781378070122, batchsize=954
Finish Trainingstep 1 of 3 with lr=0.00015375781378070122 and 1000 epochs
Finish Trainingstep 2 of 3 with lr=0.00015375781378070122 and 1000 epochs
Finish Trainingstep 3 of 3 with lr=0.00015375781378070122 and 10000 epochs
2025-05-22_08-51-48
[I 2025-05-22 08:51:48,251] Trial 92 finished with value: 0.0008281802874989808 and parameters: {'n_layers': 9, 'n_units': 488, 'activation': 'swish', 'lr': 0.00015375781378070122, 'optimizer': 'RAdam', 'batch_size': 954}. Best is trial 83 with value: 0.0006438998389057815.
Training model with params: layers=8, units=275, activation=swish, optimizer=RAdam, lr=0.00020846074850665314, batchsize=1047
Finish Trainingstep 1 of 3 with lr=0.00020846074850665314 and 1000 epochs
Finish Trainingstep 2 of 3 with lr=0.00020846074850665314 and 1000 epochs
Finish Trainingstep 3 of 3 with lr=0.00020846074850665314 and 10000 epochs
2025-05-22_11-31-58
[I 2025-05-22 11:31:59,120] Trial 93 finished with value: 0.0007970348815433681 and parameters: {'n_layers': 8, 'n_units': 275, 'activation': 'swish', 'lr': 0.00020846074850665314, 'optimizer': 'RAdam', 'batch_size': 1047}. Best is trial 83 with value: 0.0006438998389057815.
Training model with params: layers=10, units=459, activation=tanh, optimizer=RAdam, lr=0.0001193894685553327, batchsize=1301
Finish Trainingstep 1 of 3 with lr=0.0001193894685553327 and 1000 epochs
Finish Trainingstep 2 of 3 with lr=0.0001193894685553327 and 1000 epochs
Finish Trainingstep 3 of 3 with lr=0.0001193894685553327 and 10000 epochs
2025-05-22_14-19-45
[I 2025-05-22 14:19:45,560] Trial 94 finished with value: 0.002403785241767764 and parameters: {'n_layers': 10, 'n_units': 459, 'activation': 'tanh', 'lr': 0.0001193894685553327, 'optimizer': 'RAdam', 'batch_size': 1301}. Best is trial 83 with value: 0.0006438998389057815.
Training model with params: layers=9, units=309, activation=swish, optimizer=RAdam, lr=0.00018397086198150916, batchsize=1234
Finish Trainingstep 1 of 3 with lr=0.00018397086198150916 and 1000 epochs
Finish Trainingstep 2 of 3 with lr=0.00018397086198150916 and 1000 epochs
Finish Trainingstep 3 of 3 with lr=0.00018397086198150916 and 10000 epochs
2025-05-22_16-56-19
[I 2025-05-22 16:56:19,941] Trial 95 finished with value: 0.0006713226321153343 and parameters: {'n_layers': 9, 'n_units': 309, 'activation': 'swish', 'lr': 0.00018397086198150916, 'optimizer': 'RAdam', 'batch_size': 1234}. Best is trial 83 with value: 0.0006438998389057815.
Training model with params: layers=2, units=254, activation=swish, optimizer=rmsprop, lr=0.0001857387081924102, batchsize=1232
Finish Trainingstep 1 of 3 with lr=0.0001857387081924102 and 1000 epochs
Finish Trainingstep 2 of 3 with lr=0.0001857387081924102 and 1000 epochs
Finish Trainingstep 3 of 3 with lr=0.0001857387081924102 and 10000 epochs
2025-05-22_19-18-33
[I 2025-05-22 19:18:33,493] Trial 96 finished with value: 0.0034064443316310644 and parameters: {'n_layers': 2, 'n_units': 254, 'activation': 'swish', 'lr': 0.0001857387081924102, 'optimizer': 'rmsprop', 'batch_size': 1232}. Best is trial 83 with value: 0.0006438998389057815.
Training model with params: layers=7, units=473, activation=swish, optimizer=RAdam, lr=0.0002425670640773005, batchsize=1400
Finish Trainingstep 1 of 3 with lr=0.0002425670640773005 and 1000 epochs
Finish Trainingstep 2 of 3 with lr=0.0002425670640773005 and 1000 epochs
Finish Trainingstep 3 of 3 with lr=0.0002425670640773005 and 10000 epochs
2025-05-22_21-02-57
