[I 2025-05-19 13:36:16,990] Trial 62 finished with value: 0.0008144911844283342 and parameters: {'n_layers': 4, 'n_units': 419, 'activation': 'sigmoid', 'lr': 0.0003959661770213219, 'optimizer': 'adam', 'batch_size': 1211}. Best is trial 53 with value: 0.0005671430844813585.
Training model with params: layers=5, units=393, activation=sigmoid, optimizer=adam, lr=0.0004095269668259729, batchsize=1209
Finish Trainingstep 1 of 3 with lr=0.0004095269668259729 and 1000 epochs
Finish Trainingstep 2 of 3 with lr=0.0004095269668259729 and 1000 epochs
Finish Trainingstep 3 of 3 with lr=0.0004095269668259729 and 10000 epochs
2025-05-19_15-28-46
[I 2025-05-19 15:28:47,060] Trial 63 finished with value: 0.0008796405745670199 and parameters: {'n_layers': 5, 'n_units': 393, 'activation': 'sigmoid', 'lr': 0.0004095269668259729, 'optimizer': 'adam', 'batch_size': 1209}. Best is trial 53 with value: 0.0005671430844813585.
Training model with params: layers=4, units=376, activation=sigmoid, optimizer=adam, lr=0.0005145126975897333, batchsize=1108
Finish Trainingstep 1 of 3 with lr=0.0005145126975897333 and 1000 epochs
Finish Trainingstep 2 of 3 with lr=0.0005145126975897333 and 1000 epochs
Finish Trainingstep 3 of 3 with lr=0.0005145126975897333 and 10000 epochs
2025-05-19_16-43-14
[I 2025-05-19 16:43:15,819] Trial 64 finished with value: 0.0007644176366738975 and parameters: {'n_layers': 4, 'n_units': 376, 'activation': 'sigmoid', 'lr': 0.0005145126975897333, 'optimizer': 'adam', 'batch_size': 1108}. Best is trial 53 with value: 0.0005671430844813585.
Training model with params: layers=4, units=347, activation=swish, optimizer=adam, lr=0.0005045116984648393, batchsize=1130
Finish Trainingstep 1 of 3 with lr=0.0005045116984648393 and 1000 epochs
Finish Trainingstep 2 of 3 with lr=0.0005045116984648393 and 1000 epochs
Finish Trainingstep 3 of 3 with lr=0.0005045116984648393 and 10000 epochs
2025-05-19_17-26-44
[I 2025-05-19 17:26:44,827] Trial 65 finished with value: 0.0014044311828911304 and parameters: {'n_layers': 4, 'n_units': 347, 'activation': 'swish', 'lr': 0.0005045116984648393, 'optimizer': 'adam', 'batch_size': 1130}. Best is trial 53 with value: 0.0005671430844813585.
Training model with params: layers=3, units=372, activation=sigmoid, optimizer=adam, lr=0.00032184120070736805, batchsize=1328
Finish Trainingstep 1 of 3 with lr=0.00032184120070736805 and 1000 epochs
Finish Trainingstep 2 of 3 with lr=0.00032184120070736805 and 1000 epochs
Finish Trainingstep 3 of 3 with lr=0.00032184120070736805 and 10000 epochs
2025-05-19_18-33-17
[I 2025-05-19 18:33:17,388] Trial 66 finished with value: 0.0012712160823866725 and parameters: {'n_layers': 3, 'n_units': 372, 'activation': 'sigmoid', 'lr': 0.00032184120070736805, 'optimizer': 'adam', 'batch_size': 1328}. Best is trial 53 with value: 0.0005671430844813585.
Training model with params: layers=5, units=411, activation=selu, optimizer=adam, lr=0.0007381490562348422, batchsize=1624
Finish Trainingstep 1 of 3 with lr=0.0007381490562348422 and 1000 epochs
Finish Trainingstep 2 of 3 with lr=0.0007381490562348422 and 1000 epochs
Finish Trainingstep 3 of 3 with lr=0.0007381490562348422 and 10000 epochs
2025-05-19_19-07-42
[I 2025-05-19 19:07:42,478] Trial 67 finished with value: 0.0033105791080743074 and parameters: {'n_layers': 5, 'n_units': 411, 'activation': 'selu', 'lr': 0.0007381490562348422, 'optimizer': 'adam', 'batch_size': 1624}. Best is trial 53 with value: 0.0005671430844813585.
Training model with params: layers=4, units=292, activation=leaky_relu, optimizer=adam, lr=0.000579722016188054, batchsize=1103
Finish Trainingstep 1 of 3 with lr=0.000579722016188054 and 1000 epochs
Finish Trainingstep 2 of 3 with lr=0.000579722016188054 and 1000 epochs
Finish Trainingstep 3 of 3 with lr=0.000579722016188054 and 10000 epochs
2025-05-19_19-43-43
[I 2025-05-19 19:43:43,500] Trial 68 finished with value: 0.004738276824355125 and parameters: {'n_layers': 4, 'n_units': 292, 'activation': 'leaky_relu', 'lr': 0.000579722016188054, 'optimizer': 'adam', 'batch_size': 1103}. Best is trial 53 with value: 0.0005671430844813585.
Training model with params: layers=5, units=236, activation=sigmoid, optimizer=RAdam, lr=0.000258161266329554, batchsize=1015
Finish Trainingstep 1 of 3 with lr=0.000258161266329554 and 1000 epochs
Finish Trainingstep 2 of 3 with lr=0.000258161266329554 and 1000 epochs
Finish Trainingstep 3 of 3 with lr=0.000258161266329554 and 10000 epochs
2025-05-19_21-26-02
[I 2025-05-19 21:26:02,819] Trial 69 finished with value: 0.000987462350167334 and parameters: {'n_layers': 5, 'n_units': 236, 'activation': 'sigmoid', 'lr': 0.000258161266329554, 'optimizer': 'RAdam', 'batch_size': 1015}. Best is trial 53 with value: 0.0005671430844813585.
Training model with params: layers=3, units=328, activation=sigmoid, optimizer=rmsprop, lr=0.00047924394348449904, batchsize=1369
Finish Trainingstep 1 of 3 with lr=0.00047924394348449904 and 1000 epochs
Finish Trainingstep 2 of 3 with lr=0.00047924394348449904 and 1000 epochs
Finish Trainingstep 3 of 3 with lr=0.00047924394348449904 and 10000 epochs
2025-05-19_22-29-15
[I 2025-05-19 22:29:15,128] Trial 70 finished with value: 0.0033548560459166765 and parameters: {'n_layers': 3, 'n_units': 328, 'activation': 'sigmoid', 'lr': 0.00047924394348449904, 'optimizer': 'rmsprop', 'batch_size': 1369}. Best is trial 53 with value: 0.0005671430844813585.
Training model with params: layers=4, units=423, activation=sigmoid, optimizer=adam, lr=0.0003897628063989596, batchsize=1192
Finish Trainingstep 1 of 3 with lr=0.0003897628063989596 and 1000 epochs
Finish Trainingstep 2 of 3 with lr=0.0003897628063989596 and 1000 epochs
Finish Trainingstep 3 of 3 with lr=0.0003897628063989596 and 10000 epochs
2025-05-19_23-50-57
[I 2025-05-19 23:50:57,270] Trial 71 finished with value: 0.0006544644711539149 and parameters: {'n_layers': 4, 'n_units': 423, 'activation': 'sigmoid', 'lr': 0.0003897628063989596, 'optimizer': 'adam', 'batch_size': 1192}. Best is trial 53 with value: 0.0005671430844813585.
Training model with params: layers=4, units=380, activation=sigmoid, optimizer=adam, lr=0.00031642890263432, batchsize=847
Finish Trainingstep 1 of 3 with lr=0.00031642890263432 and 1000 epochs
Finish Trainingstep 2 of 3 with lr=0.00031642890263432 and 1000 epochs
Finish Trainingstep 3 of 3 with lr=0.00031642890263432 and 10000 epochs
2025-05-20_00-51-44
[I 2025-05-20 00:51:44,494] Trial 72 finished with value: 0.0011056065559387207 and parameters: {'n_layers': 4, 'n_units': 380, 'activation': 'sigmoid', 'lr': 0.00031642890263432, 'optimizer': 'adam', 'batch_size': 847}. Best is trial 53 with value: 0.0005671430844813585.
Training model with params: layers=4, units=401, activation=sigmoid, optimizer=adam, lr=0.0005991277107860384, batchsize=1064
Finish Trainingstep 1 of 3 with lr=0.0005991277107860384 and 1000 epochs
Finish Trainingstep 2 of 3 with lr=0.0005991277107860384 and 1000 epochs
Finish Trainingstep 3 of 3 with lr=0.0005991277107860384 and 10000 epochs
2025-05-20_01-44-59
[I 2025-05-20 01:45:00,044] Trial 73 finished with value: 0.0008603926980867982 and parameters: {'n_layers': 4, 'n_units': 401, 'activation': 'sigmoid', 'lr': 0.0005991277107860384, 'optimizer': 'adam', 'batch_size': 1064}. Best is trial 53 with value: 0.0005671430844813585.
Training model with params: layers=5, units=353, activation=sigmoid, optimizer=adam, lr=0.00019850098380504955, batchsize=969
Finish Trainingstep 1 of 3 with lr=0.00019850098380504955 and 1000 epochs
Finish Trainingstep 2 of 3 with lr=0.00019850098380504955 and 1000 epochs
Finish Trainingstep 3 of 3 with lr=0.00019850098380504955 and 10000 epochs
2025-05-20_03-44-11
[I 2025-05-20 03:44:11,664] Trial 74 finished with value: 0.0009283316903747618 and parameters: {'n_layers': 5, 'n_units': 353, 'activation': 'sigmoid', 'lr': 0.00019850098380504955, 'optimizer': 'adam', 'batch_size': 969}. Best is trial 53 with value: 0.0005671430844813585.
Training model with params: layers=4, units=438, activation=gelu, optimizer=adam, lr=0.0004506772075185529, batchsize=1278
Finish Trainingstep 1 of 3 with lr=0.0004506772075185529 and 1000 epochs
Finish Trainingstep 2 of 3 with lr=0.0004506772075185529 and 1000 epochs
Finish Trainingstep 3 of 3 with lr=0.0004506772075185529 and 10000 epochs
2025-05-20_04-24-44
[I 2025-05-20 04:24:44,936] Trial 75 finished with value: 0.0013768698554486036 and parameters: {'n_layers': 4, 'n_units': 438, 'activation': 'gelu', 'lr': 0.0004506772075185529, 'optimizer': 'adam', 'batch_size': 1278}. Best is trial 53 with value: 0.0005671430844813585.
Training model with params: layers=9, units=423, activation=sigmoid, optimizer=sgd, lr=0.0008511650563198572, batchsize=1222
Finish Trainingstep 1 of 3 with lr=0.0008511650563198572 and 1000 epochs
Finish Trainingstep 2 of 3 with lr=0.0008511650563198572 and 1000 epochs
Finish Trainingstep 3 of 3 with lr=0.0008511650563198572 and 10000 epochs
2025-05-20_04-44-22
[I 2025-05-20 04:44:22,454] Trial 76 finished with value: 1.0255401134490967 and parameters: {'n_layers': 9, 'n_units': 423, 'activation': 'sigmoid', 'lr': 0.0008511650563198572, 'optimizer': 'sgd', 'batch_size': 1222}. Best is trial 53 with value: 0.0005671430844813585.
Training model with params: layers=3, units=452, activation=elu, optimizer=adam, lr=0.0003970338066952342, batchsize=1129
Finish Trainingstep 1 of 3 with lr=0.0003970338066952342 and 1000 epochs
Finish Trainingstep 2 of 3 with lr=0.0003970338066952342 and 1000 epochs
Finish Trainingstep 3 of 3 with lr=0.0003970338066952342 and 10000 epochs
2025-05-20_05-22-07
[I 2025-05-20 05:22:07,496] Trial 77 finished with value: 0.0008018249645829201 and parameters: {'n_layers': 3, 'n_units': 452, 'activation': 'elu', 'lr': 0.0003970338066952342, 'optimizer': 'adam', 'batch_size': 1129}. Best is trial 53 with value: 0.0005671430844813585.
Training model with params: layers=4, units=398, activation=sigmoid, optimizer=adam, lr=0.0005164754590732439, batchsize=1437
Finish Trainingstep 1 of 3 with lr=0.0005164754590732439 and 1000 epochs
Finish Trainingstep 2 of 3 with lr=0.0005164754590732439 and 1000 epochs
Finish Trainingstep 3 of 3 with lr=0.0005164754590732439 and 10000 epochs
2025-05-20_06-38-14
[I 2025-05-20 06:38:14,952] Trial 78 finished with value: 0.0008420509402640164 and parameters: {'n_layers': 4, 'n_units': 398, 'activation': 'sigmoid', 'lr': 0.0005164754590732439, 'optimizer': 'adam', 'batch_size': 1437}. Best is trial 53 with value: 0.0005671430844813585.
Training model with params: layers=5, units=381, activation=sigmoid, optimizer=AdamW, lr=0.0007134579040911234, batchsize=1314
Finish Trainingstep 1 of 3 with lr=0.0007134579040911234 and 1000 epochs
Finish Trainingstep 2 of 3 with lr=0.0007134579040911234 and 1000 epochs
Finish Trainingstep 3 of 3 with lr=0.0007134579040911234 and 10000 epochs
2025-05-20_06-55-43
[I 2025-05-20 06:55:43,127] Trial 79 finished with value: 0.012529788538813591 and parameters: {'n_layers': 5, 'n_units': 381, 'activation': 'sigmoid', 'lr': 0.0007134579040911234, 'optimizer': 'AdamW', 'batch_size': 1314}. Best is trial 53 with value: 0.0005671430844813585.
Training model with params: layers=6, units=132, activation=relu, optimizer=adam, lr=0.0002872507895282373, batchsize=1170
Finish Trainingstep 1 of 3 with lr=0.0002872507895282373 and 1000 epochs
Finish Trainingstep 2 of 3 with lr=0.0002872507895282373 and 1000 epochs
Finish Trainingstep 3 of 3 with lr=0.0002872507895282373 and 10000 epochs
2025-05-20_07-12-13
[I 2025-05-20 07:12:13,929] Trial 80 finished with value: 0.0076885768212378025 and parameters: {'n_layers': 6, 'n_units': 132, 'activation': 'relu', 'lr': 0.0002872507895282373, 'optimizer': 'adam', 'batch_size': 1170}. Best is trial 53 with value: 0.0005671430844813585.
Training model with params: layers=3, units=450, activation=elu, optimizer=adam, lr=0.0003860060082052823, batchsize=1117
Finish Trainingstep 1 of 3 with lr=0.0003860060082052823 and 1000 epochs
Finish Trainingstep 2 of 3 with lr=0.0003860060082052823 and 1000 epochs
Finish Trainingstep 3 of 3 with lr=0.0003860060082052823 and 10000 epochs
2025-05-20_08-07-51
[I 2025-05-20 08:07:51,898] Trial 81 finished with value: 0.0008849353180266917 and parameters: {'n_layers': 3, 'n_units': 450, 'activation': 'elu', 'lr': 0.0003860060082052823, 'optimizer': 'adam', 'batch_size': 1117}. Best is trial 53 with value: 0.0005671430844813585.
Training model with params: layers=2, units=461, activation=elu, optimizer=adam, lr=0.00044691068892557985, batchsize=1125
Finish Trainingstep 1 of 3 with lr=0.00044691068892557985 and 1000 epochs
Finish Trainingstep 2 of 3 with lr=0.00044691068892557985 and 1000 epochs
Finish Trainingstep 3 of 3 with lr=0.00044691068892557985 and 10000 epochs
2025-05-20_09-12-36
[I 2025-05-20 09:12:36,229] Trial 82 finished with value: 0.001735141035169363 and parameters: {'n_layers': 2, 'n_units': 461, 'activation': 'elu', 'lr': 0.00044691068892557985, 'optimizer': 'adam', 'batch_size': 1125}. Best is trial 53 with value: 0.0005671430844813585.
Training model with params: layers=3, units=427, activation=elu, optimizer=adam, lr=0.0003271962312508566, batchsize=893
Finish Trainingstep 1 of 3 with lr=0.0003271962312508566 and 1000 epochs
Finish Trainingstep 2 of 3 with lr=0.0003271962312508566 and 1000 epochs
Finish Trainingstep 3 of 3 with lr=0.0003271962312508566 and 10000 epochs
2025-05-20_10-25-34
[I 2025-05-20 10:25:34,207] Trial 83 finished with value: 0.000657810247503221 and parameters: {'n_layers': 3, 'n_units': 427, 'activation': 'elu', 'lr': 0.0003271962312508566, 'optimizer': 'adam', 'batch_size': 893}. Best is trial 53 with value: 0.0005671430844813585.
Training model with params: layers=4, units=410, activation=elu, optimizer=adam, lr=0.0003458411026517782, batchsize=675
Finish Trainingstep 1 of 3 with lr=0.0003458411026517782 and 1000 epochs
Finish Trainingstep 2 of 3 with lr=0.0003458411026517782 and 1000 epochs
Finish Trainingstep 3 of 3 with lr=0.0003458411026517782 and 10000 epochs
2025-05-20_11-43-37
[I 2025-05-20 11:43:37,717] Trial 84 finished with value: 0.0012390773044899106 and parameters: {'n_layers': 4, 'n_units': 410, 'activation': 'elu', 'lr': 0.0003458411026517782, 'optimizer': 'adam', 'batch_size': 675}. Best is trial 53 with value: 0.0005671430844813585.
Training model with params: layers=3, units=361, activation=sigmoid, optimizer=adam, lr=0.00025151194841209197, batchsize=870
Finish Trainingstep 1 of 3 with lr=0.00025151194841209197 and 1000 epochs
Finish Trainingstep 2 of 3 with lr=0.00025151194841209197 and 1000 epochs
Finish Trainingstep 3 of 3 with lr=0.00025151194841209197 and 10000 epochs
2025-05-20_13-36-53
[I 2025-05-20 13:36:53,814] Trial 85 finished with value: 0.0013343829195946455 and parameters: {'n_layers': 3, 'n_units': 361, 'activation': 'sigmoid', 'lr': 0.00025151194841209197, 'optimizer': 'adam', 'batch_size': 870}. Best is trial 53 with value: 0.0005671430844813585.
Training model with params: layers=2, units=432, activation=tanh, optimizer=RAdam, lr=0.00020941530583089117, batchsize=902
Finish Trainingstep 1 of 3 with lr=0.00020941530583089117 and 1000 epochs
Finish Trainingstep 2 of 3 with lr=0.00020941530583089117 and 1000 epochs
Finish Trainingstep 3 of 3 with lr=0.00020941530583089117 and 10000 epochs
2025-05-20_14-57-54
[I 2025-05-20 14:57:54,593] Trial 86 finished with value: 0.0018589567625895143 and parameters: {'n_layers': 2, 'n_units': 432, 'activation': 'tanh', 'lr': 0.00020941530583089117, 'optimizer': 'RAdam', 'batch_size': 902}. Best is trial 53 with value: 0.0005671430844813585.
Training model with params: layers=1, units=430, activation=swish, optimizer=adam, lr=0.000302638739881062, batchsize=969
Finish Trainingstep 1 of 3 with lr=0.000302638739881062 and 1000 epochs
Finish Trainingstep 2 of 3 with lr=0.000302638739881062 and 1000 epochs
Finish Trainingstep 3 of 3 with lr=0.000302638739881062 and 10000 epochs
2025-05-20_16-06-32
[I 2025-05-20 16:06:32,522] Trial 87 finished with value: 0.010410977527499199 and parameters: {'n_layers': 1, 'n_units': 430, 'activation': 'swish', 'lr': 0.000302638739881062, 'optimizer': 'adam', 'batch_size': 969}. Best is trial 53 with value: 0.0005671430844813585.
Training model with params: layers=4, units=390, activation=sigmoid, optimizer=adam, lr=0.0005487948569099614, batchsize=1396
Finish Trainingstep 1 of 3 with lr=0.0005487948569099614 and 1000 epochs
Finish Trainingstep 2 of 3 with lr=0.0005487948569099614 and 1000 epochs
Finish Trainingstep 3 of 3 with lr=0.0005487948569099614 and 10000 epochs
2025-05-20_17-17-35
[I 2025-05-20 17:17:36,032] Trial 88 finished with value: 0.0009520463063381612 and parameters: {'n_layers': 4, 'n_units': 390, 'activation': 'sigmoid', 'lr': 0.0005487948569099614, 'optimizer': 'adam', 'batch_size': 1396}. Best is trial 53 with value: 0.0005671430844813585.
Training model with params: layers=3, units=412, activation=leaky_relu, optimizer=rmsprop, lr=0.0006500214101444582, batchsize=771
Finish Trainingstep 1 of 3 with lr=0.0006500214101444582 and 1000 epochs
Finish Trainingstep 2 of 3 with lr=0.0006500214101444582 and 1000 epochs
Finish Trainingstep 3 of 3 with lr=0.0006500214101444582 and 10000 epochs
2025-05-20_19-09-53
[I 2025-05-20 19:09:53,186] Trial 89 finished with value: 0.006100385449826717 and parameters: {'n_layers': 3, 'n_units': 412, 'activation': 'leaky_relu', 'lr': 0.0006500214101444582, 'optimizer': 'rmsprop', 'batch_size': 771}. Best is trial 53 with value: 0.0005671430844813585.
Training model with params: layers=5, units=471, activation=sigmoid, optimizer=adam, lr=0.0003434377095116134, batchsize=1235
Finish Trainingstep 1 of 3 with lr=0.0003434377095116134 and 1000 epochs
Finish Trainingstep 2 of 3 with lr=0.0003434377095116134 and 1000 epochs
Finish Trainingstep 3 of 3 with lr=0.0003434377095116134 and 10000 epochs
2025-05-20_20-38-05
[I 2025-05-20 20:38:05,718] Trial 90 finished with value: 0.0008371275034733117 and parameters: {'n_layers': 5, 'n_units': 471, 'activation': 'sigmoid', 'lr': 0.0003434377095116134, 'optimizer': 'adam', 'batch_size': 1235}. Best is trial 53 with value: 0.0005671430844813585.
Training model with params: layers=3, units=496, activation=elu, optimizer=adam, lr=0.0004008827301149953, batchsize=1064
Finish Trainingstep 1 of 3 with lr=0.0004008827301149953 and 1000 epochs
Finish Trainingstep 2 of 3 with lr=0.0004008827301149953 and 1000 epochs
Finish Trainingstep 3 of 3 with lr=0.0004008827301149953 and 10000 epochs
2025-05-20_21-32-24
[I 2025-05-20 21:32:24,558] Trial 91 finished with value: 0.0008661770261824131 and parameters: {'n_layers': 3, 'n_units': 496, 'activation': 'elu', 'lr': 0.0004008827301149953, 'optimizer': 'adam', 'batch_size': 1064}. Best is trial 53 with value: 0.0005671430844813585.
Training model with params: layers=4, units=453, activation=elu, optimizer=adam, lr=0.00037172387993385166, batchsize=1315
Finish Trainingstep 1 of 3 with lr=0.00037172387993385166 and 1000 epochs
Finish Trainingstep 2 of 3 with lr=0.00037172387993385166 and 1000 epochs
Finish Trainingstep 3 of 3 with lr=0.00037172387993385166 and 10000 epochs
2025-05-20_22-01-30
[I 2025-05-20 22:01:30,231] Trial 92 finished with value: 0.001135573722422123 and parameters: {'n_layers': 4, 'n_units': 453, 'activation': 'elu', 'lr': 0.00037172387993385166, 'optimizer': 'adam', 'batch_size': 1315}. Best is trial 53 with value: 0.0005671430844813585.
Training model with params: layers=3, units=448, activation=elu, optimizer=adam, lr=0.0004537171095057758, batchsize=1176
Finish Trainingstep 1 of 3 with lr=0.0004537171095057758 and 1000 epochs
Finish Trainingstep 2 of 3 with lr=0.0004537171095057758 and 1000 epochs
Finish Trainingstep 3 of 3 with lr=0.0004537171095057758 and 10000 epochs
2025-05-20_23-01-20
[I 2025-05-20 23:01:20,919] Trial 93 finished with value: 0.0008016411447897553 and parameters: {'n_layers': 3, 'n_units': 448, 'activation': 'elu', 'lr': 0.0004537171095057758, 'optimizer': 'adam', 'batch_size': 1176}. Best is trial 53 with value: 0.0005671430844813585.
Training model with params: layers=4, units=484, activation=elu, optimizer=adam, lr=0.0004564798682584152, batchsize=1189
Finish Trainingstep 1 of 3 with lr=0.0004564798682584152 and 1000 epochs
Finish Trainingstep 2 of 3 with lr=0.0004564798682584152 and 1000 epochs
Finish Trainingstep 3 of 3 with lr=0.0004564798682584152 and 10000 epochs
2025-05-20_23-51-17
[I 2025-05-20 23:51:17,175] Trial 94 finished with value: 0.0012235684553161263 and parameters: {'n_layers': 4, 'n_units': 484, 'activation': 'elu', 'lr': 0.0004564798682584152, 'optimizer': 'adam', 'batch_size': 1189}. Best is trial 53 with value: 0.0005671430844813585.
Training model with params: layers=3, units=429, activation=selu, optimizer=adam, lr=0.0005687535327384097, batchsize=1269
Finish Trainingstep 1 of 3 with lr=0.0005687535327384097 and 1000 epochs
Finish Trainingstep 2 of 3 with lr=0.0005687535327384097 and 1000 epochs
Finish Trainingstep 3 of 3 with lr=0.0005687535327384097 and 10000 epochs
2025-05-21_00-46-22
[I 2025-05-21 00:46:22,368] Trial 95 finished with value: 0.0025868010707199574 and parameters: {'n_layers': 3, 'n_units': 429, 'activation': 'selu', 'lr': 0.0005687535327384097, 'optimizer': 'adam', 'batch_size': 1269}. Best is trial 53 with value: 0.0005671430844813585.
Training model with params: layers=4, units=442, activation=sigmoid, optimizer=sgd, lr=0.0002622990358007023, batchsize=1004
Finish Trainingstep 1 of 3 with lr=0.0002622990358007023 and 1000 epochs
Finish Trainingstep 2 of 3 with lr=0.0002622990358007023 and 1000 epochs
Finish Trainingstep 3 of 3 with lr=0.0002622990358007023 and 10000 epochs
2025-05-21_02-54-03
