[I 2025-05-17 17:42:55,861] Trial 28 finished with value: 0.002477971836924553 and parameters: {'n_layers': 2, 'n_units': 418, 'activation': 'gelu', 'lr': 0.0008703840005933536, 'optimizer': 'adam', 'batch_size': 1003}. Best is trial 21 with value: 0.0007596470532007515.
Training model with params: layers=3, units=511, activation=swish, optimizer=adam, lr=0.0005730925451987675, batchsize=1375
Finish Trainingstep 1 of 3 with lr=0.0005730925451987675 and 1000 epochs
Finish Trainingstep 2 of 3 with lr=0.0005730925451987675 and 1000 epochs
Finish Trainingstep 3 of 3 with lr=0.0005730925451987675 and 10000 epochs
2025-05-17_18-24-39
[I 2025-05-17 18:24:39,973] Trial 29 finished with value: 0.0010246590245515108 and parameters: {'n_layers': 3, 'n_units': 511, 'activation': 'swish', 'lr': 0.0005730925451987675, 'optimizer': 'adam', 'batch_size': 1375}. Best is trial 21 with value: 0.0007596470532007515.
Training model with params: layers=6, units=150, activation=relu, optimizer=adam, lr=0.00010736516719368736, batchsize=1429
Finish Trainingstep 1 of 3 with lr=0.00010736516719368736 and 1000 epochs
Finish Trainingstep 2 of 3 with lr=0.00010736516719368736 and 1000 epochs
Finish Trainingstep 3 of 3 with lr=0.00010736516719368736 and 10000 epochs
2025-05-17_19-49-48
[I 2025-05-17 19:49:48,218] Trial 30 finished with value: 0.008426588028669357 and parameters: {'n_layers': 6, 'n_units': 150, 'activation': 'relu', 'lr': 0.00010736516719368736, 'optimizer': 'adam', 'batch_size': 1429}. Best is trial 21 with value: 0.0007596470532007515.
Training model with params: layers=4, units=385, activation=sigmoid, optimizer=adam, lr=0.000276126957677545, batchsize=1239
Finish Trainingstep 1 of 3 with lr=0.000276126957677545 and 1000 epochs
Finish Trainingstep 2 of 3 with lr=0.000276126957677545 and 1000 epochs
Finish Trainingstep 3 of 3 with lr=0.000276126957677545 and 10000 epochs
2025-05-17_21-12-28
[I 2025-05-17 21:12:28,660] Trial 31 finished with value: 0.0009191654389724135 and parameters: {'n_layers': 4, 'n_units': 385, 'activation': 'sigmoid', 'lr': 0.000276126957677545, 'optimizer': 'adam', 'batch_size': 1239}. Best is trial 21 with value: 0.0007596470532007515.
Training model with params: layers=4, units=434, activation=sigmoid, optimizer=adam, lr=0.00037002249615768375, batchsize=1189
Finish Trainingstep 1 of 3 with lr=0.00037002249615768375 and 1000 epochs
Finish Trainingstep 2 of 3 with lr=0.00037002249615768375 and 1000 epochs
Finish Trainingstep 3 of 3 with lr=0.00037002249615768375 and 10000 epochs
2025-05-17_22-45-45
[I 2025-05-17 22:45:45,383] Trial 32 finished with value: 0.000719240924809128 and parameters: {'n_layers': 4, 'n_units': 434, 'activation': 'sigmoid', 'lr': 0.00037002249615768375, 'optimizer': 'adam', 'batch_size': 1189}. Best is trial 32 with value: 0.000719240924809128.
Training model with params: layers=5, units=446, activation=sigmoid, optimizer=AdamW, lr=0.00045725364031997187, batchsize=1089
Finish Trainingstep 1 of 3 with lr=0.00045725364031997187 and 1000 epochs
Finish Trainingstep 2 of 3 with lr=0.00045725364031997187 and 1000 epochs
Finish Trainingstep 3 of 3 with lr=0.00045725364031997187 and 10000 epochs
2025-05-17_23-09-43
[I 2025-05-17 23:09:43,278] Trial 33 finished with value: 0.014741344377398491 and parameters: {'n_layers': 5, 'n_units': 446, 'activation': 'sigmoid', 'lr': 0.00045725364031997187, 'optimizer': 'AdamW', 'batch_size': 1089}. Best is trial 32 with value: 0.000719240924809128.
Training model with params: layers=3, units=438, activation=sigmoid, optimizer=adam, lr=0.0006850550096616326, batchsize=1280
Finish Trainingstep 1 of 3 with lr=0.0006850550096616326 and 1000 epochs
Finish Trainingstep 2 of 3 with lr=0.0006850550096616326 and 1000 epochs
Finish Trainingstep 3 of 3 with lr=0.0006850550096616326 and 10000 epochs
2025-05-18_00-01-16
[I 2025-05-18 00:01:16,467] Trial 34 finished with value: 0.0011712501291185617 and parameters: {'n_layers': 3, 'n_units': 438, 'activation': 'sigmoid', 'lr': 0.0006850550096616326, 'optimizer': 'adam', 'batch_size': 1280}. Best is trial 32 with value: 0.000719240924809128.
Training model with params: layers=5, units=485, activation=gelu, optimizer=AdamW, lr=0.00019782137450087263, batchsize=1436
Finish Trainingstep 1 of 3 with lr=0.00019782137450087263 and 1000 epochs
Finish Trainingstep 2 of 3 with lr=0.00019782137450087263 and 1000 epochs
Finish Trainingstep 3 of 3 with lr=0.00019782137450087263 and 10000 epochs
2025-05-18_00-33-45
[I 2025-05-18 00:33:46,024] Trial 35 finished with value: 0.003557751886546612 and parameters: {'n_layers': 5, 'n_units': 485, 'activation': 'gelu', 'lr': 0.00019782137450087263, 'optimizer': 'AdamW', 'batch_size': 1436}. Best is trial 32 with value: 0.000719240924809128.
Training model with params: layers=4, units=462, activation=sigmoid, optimizer=sgd, lr=0.00036981454489318926, batchsize=1080
Finish Trainingstep 1 of 3 with lr=0.00036981454489318926 and 1000 epochs
Finish Trainingstep 2 of 3 with lr=0.00036981454489318926 and 1000 epochs
Finish Trainingstep 3 of 3 with lr=0.00036981454489318926 and 10000 epochs
2025-05-18_00-57-27
[I 2025-05-18 00:57:27,513] Trial 36 finished with value: 1.0254825353622437 and parameters: {'n_layers': 4, 'n_units': 462, 'activation': 'sigmoid', 'lr': 0.00036981454489318926, 'optimizer': 'sgd', 'batch_size': 1080}. Best is trial 32 with value: 0.000719240924809128.
Training model with params: layers=6, units=488, activation=sigmoid, optimizer=adam, lr=0.0007748857690048301, batchsize=828
Finish Trainingstep 1 of 3 with lr=0.0007748857690048301 and 1000 epochs
Finish Trainingstep 2 of 3 with lr=0.0007748857690048301 and 1000 epochs
Finish Trainingstep 3 of 3 with lr=0.0007748857690048301 and 10000 epochs
2025-05-18_02-25-29
[I 2025-05-18 02:25:29,330] Trial 37 finished with value: 0.0011073579080402851 and parameters: {'n_layers': 6, 'n_units': 488, 'activation': 'sigmoid', 'lr': 0.0007748857690048301, 'optimizer': 'adam', 'batch_size': 828}. Best is trial 32 with value: 0.000719240924809128.
Training model with params: layers=3, units=434, activation=leaky_relu, optimizer=rmsprop, lr=0.00015628899168356164, batchsize=1769
Finish Trainingstep 1 of 3 with lr=0.00015628899168356164 and 1000 epochs
Finish Trainingstep 2 of 3 with lr=0.00015628899168356164 and 1000 epochs
Finish Trainingstep 3 of 3 with lr=0.00015628899168356164 and 10000 epochs
2025-05-18_04-14-37
[I 2025-05-18 04:14:37,397] Trial 38 finished with value: 0.00659928610548377 and parameters: {'n_layers': 3, 'n_units': 434, 'activation': 'leaky_relu', 'lr': 0.00015628899168356164, 'optimizer': 'rmsprop', 'batch_size': 1769}. Best is trial 32 with value: 0.000719240924809128.
Training model with params: layers=5, units=374, activation=sigmoid, optimizer=adam, lr=0.0011432729256718765, batchsize=479
Finish Trainingstep 1 of 3 with lr=0.0011432729256718765 and 1000 epochs
Finish Trainingstep 2 of 3 with lr=0.0011432729256718765 and 1000 epochs
Finish Trainingstep 3 of 3 with lr=0.0011432729256718765 and 10000 epochs
2025-05-18_05-59-33
[I 2025-05-18 05:59:33,519] Trial 39 finished with value: 0.0014305443037301302 and parameters: {'n_layers': 5, 'n_units': 374, 'activation': 'sigmoid', 'lr': 0.0011432729256718765, 'optimizer': 'adam', 'batch_size': 479}. Best is trial 32 with value: 0.000719240924809128.
Training model with params: layers=2, units=477, activation=relu, optimizer=adam, lr=0.00023305080829289182, batchsize=1156
Finish Trainingstep 1 of 3 with lr=0.00023305080829289182 and 1000 epochs
Finish Trainingstep 2 of 3 with lr=0.00023305080829289182 and 1000 epochs
Finish Trainingstep 3 of 3 with lr=0.00023305080829289182 and 10000 epochs
2025-05-18_06-44-39
[I 2025-05-18 06:44:39,562] Trial 40 finished with value: 0.006046781316399574 and parameters: {'n_layers': 2, 'n_units': 477, 'activation': 'relu', 'lr': 0.00023305080829289182, 'optimizer': 'adam', 'batch_size': 1156}. Best is trial 32 with value: 0.000719240924809128.
Training model with params: layers=4, units=399, activation=sigmoid, optimizer=adam, lr=0.00047562655989677916, batchsize=1469
Finish Trainingstep 1 of 3 with lr=0.00047562655989677916 and 1000 epochs
Finish Trainingstep 2 of 3 with lr=0.00047562655989677916 and 1000 epochs
Finish Trainingstep 3 of 3 with lr=0.00047562655989677916 and 10000 epochs
2025-05-18_08-05-09
[I 2025-05-18 08:05:09,898] Trial 41 finished with value: 0.0011450800811871886 and parameters: {'n_layers': 4, 'n_units': 399, 'activation': 'sigmoid', 'lr': 0.00047562655989677916, 'optimizer': 'adam', 'batch_size': 1469}. Best is trial 32 with value: 0.000719240924809128.
Training model with params: layers=4, units=416, activation=sigmoid, optimizer=adam, lr=0.00033519949168974827, batchsize=1255
Finish Trainingstep 1 of 3 with lr=0.00033519949168974827 and 1000 epochs
Finish Trainingstep 2 of 3 with lr=0.00033519949168974827 and 1000 epochs
Finish Trainingstep 3 of 3 with lr=0.00033519949168974827 and 10000 epochs
2025-05-18_09-24-53
[I 2025-05-18 09:24:53,559] Trial 42 finished with value: 0.0007401811890304089 and parameters: {'n_layers': 4, 'n_units': 416, 'activation': 'sigmoid', 'lr': 0.00033519949168974827, 'optimizer': 'adam', 'batch_size': 1255}. Best is trial 32 with value: 0.000719240924809128.
Training model with params: layers=3, units=428, activation=sigmoid, optimizer=adam, lr=0.00036144656100731376, batchsize=1566
Finish Trainingstep 1 of 3 with lr=0.00036144656100731376 and 1000 epochs
Finish Trainingstep 2 of 3 with lr=0.00036144656100731376 and 1000 epochs
Finish Trainingstep 3 of 3 with lr=0.00036144656100731376 and 10000 epochs
2025-05-18_10-35-07
[I 2025-05-18 10:35:07,329] Trial 43 finished with value: 0.001241174410097301 and parameters: {'n_layers': 3, 'n_units': 428, 'activation': 'sigmoid', 'lr': 0.00036144656100731376, 'optimizer': 'adam', 'batch_size': 1566}. Best is trial 32 with value: 0.000719240924809128.
Training model with params: layers=5, units=460, activation=sigmoid, optimizer=rmsprop, lr=0.000616509387310042, batchsize=1310
Finish Trainingstep 1 of 3 with lr=0.000616509387310042 and 1000 epochs
Finish Trainingstep 2 of 3 with lr=0.000616509387310042 and 1000 epochs
Finish Trainingstep 3 of 3 with lr=0.000616509387310042 and 10000 epochs
2025-05-18_12-28-47
[I 2025-05-18 12:28:47,440] Trial 44 finished with value: 0.003289654618129134 and parameters: {'n_layers': 5, 'n_units': 460, 'activation': 'sigmoid', 'lr': 0.000616509387310042, 'optimizer': 'rmsprop', 'batch_size': 1310}. Best is trial 32 with value: 0.000719240924809128.
Training model with params: layers=4, units=309, activation=swish, optimizer=AdamW, lr=0.00015358318799176275, batchsize=929
Finish Trainingstep 1 of 3 with lr=0.00015358318799176275 and 1000 epochs
Finish Trainingstep 2 of 3 with lr=0.00015358318799176275 and 1000 epochs
Finish Trainingstep 3 of 3 with lr=0.00015358318799176275 and 10000 epochs
2025-05-18_12-53-28
[I 2025-05-18 12:53:28,768] Trial 45 finished with value: 0.006315402686595917 and parameters: {'n_layers': 4, 'n_units': 309, 'activation': 'swish', 'lr': 0.00015358318799176275, 'optimizer': 'AdamW', 'batch_size': 929}. Best is trial 32 with value: 0.000719240924809128.
Training model with params: layers=5, units=360, activation=leaky_relu, optimizer=sgd, lr=0.0005187004920864658, batchsize=1046
Finish Trainingstep 1 of 3 with lr=0.0005187004920864658 and 1000 epochs
Finish Trainingstep 2 of 3 with lr=0.0005187004920864658 and 1000 epochs
Finish Trainingstep 3 of 3 with lr=0.0005187004920864658 and 10000 epochs
2025-05-18_14-57-06
[I 2025-05-18 14:57:06,926] Trial 46 finished with value: 0.09308409690856934 and parameters: {'n_layers': 5, 'n_units': 360, 'activation': 'leaky_relu', 'lr': 0.0005187004920864658, 'optimizer': 'sgd', 'batch_size': 1046}. Best is trial 32 with value: 0.000719240924809128.
Training model with params: layers=4, units=500, activation=sigmoid, optimizer=adam, lr=0.00040252074643529515, batchsize=1192
Finish Trainingstep 1 of 3 with lr=0.00040252074643529515 and 1000 epochs
Finish Trainingstep 2 of 3 with lr=0.00040252074643529515 and 1000 epochs
Finish Trainingstep 3 of 3 with lr=0.00040252074643529515 and 10000 epochs
2025-05-18_16-34-48
[I 2025-05-18 16:34:49,047] Trial 47 finished with value: 0.0006756293005309999 and parameters: {'n_layers': 4, 'n_units': 500, 'activation': 'sigmoid', 'lr': 0.00040252074643529515, 'optimizer': 'adam', 'batch_size': 1192}. Best is trial 47 with value: 0.0006756293005309999.
Training model with params: layers=3, units=501, activation=tanh, optimizer=adam, lr=0.00023526467621434017, batchsize=1169
Finish Trainingstep 1 of 3 with lr=0.00023526467621434017 and 1000 epochs
Finish Trainingstep 2 of 3 with lr=0.00023526467621434017 and 1000 epochs
Finish Trainingstep 3 of 3 with lr=0.00023526467621434017 and 10000 epochs
2025-05-18_17-39-17
[I 2025-05-18 17:39:17,460] Trial 48 finished with value: 0.001094085513614118 and parameters: {'n_layers': 3, 'n_units': 501, 'activation': 'tanh', 'lr': 0.00023526467621434017, 'optimizer': 'adam', 'batch_size': 1169}. Best is trial 47 with value: 0.0006756293005309999.
Training model with params: layers=2, units=477, activation=gelu, optimizer=adam, lr=0.00035737041858571896, batchsize=1498
Finish Trainingstep 1 of 3 with lr=0.00035737041858571896 and 1000 epochs
Finish Trainingstep 2 of 3 with lr=0.00035737041858571896 and 1000 epochs
Finish Trainingstep 3 of 3 with lr=0.00035737041858571896 and 10000 epochs
2025-05-18_18-53-32
[I 2025-05-18 18:53:32,275] Trial 49 finished with value: 0.002045850967988372 and parameters: {'n_layers': 2, 'n_units': 477, 'activation': 'gelu', 'lr': 0.00035737041858571896, 'optimizer': 'adam', 'batch_size': 1498}. Best is trial 47 with value: 0.0006756293005309999.
Training model with params: layers=6, units=451, activation=sigmoid, optimizer=rmsprop, lr=0.0001325982058667207, batchsize=927
Finish Trainingstep 1 of 3 with lr=0.0001325982058667207 and 1000 epochs
Finish Trainingstep 2 of 3 with lr=0.0001325982058667207 and 1000 epochs
Finish Trainingstep 3 of 3 with lr=0.0001325982058667207 and 10000 epochs
2025-05-18_21-57-04
[I 2025-05-18 21:57:04,894] Trial 50 finished with value: 0.03470570594072342 and parameters: {'n_layers': 6, 'n_units': 451, 'activation': 'sigmoid', 'lr': 0.0001325982058667207, 'optimizer': 'rmsprop', 'batch_size': 927}. Best is trial 47 with value: 0.0006756293005309999.
Training model with params: layers=4, units=420, activation=sigmoid, optimizer=adam, lr=0.0004197354649390064, batchsize=1264
Finish Trainingstep 1 of 3 with lr=0.0004197354649390064 and 1000 epochs
Finish Trainingstep 2 of 3 with lr=0.0004197354649390064 and 1000 epochs
Finish Trainingstep 3 of 3 with lr=0.0004197354649390064 and 10000 epochs
2025-05-18_23-29-03
[I 2025-05-18 23:29:03,192] Trial 51 finished with value: 0.0010167621076107025 and parameters: {'n_layers': 4, 'n_units': 420, 'activation': 'sigmoid', 'lr': 0.0004197354649390064, 'optimizer': 'adam', 'batch_size': 1264}. Best is trial 47 with value: 0.0006756293005309999.
Training model with params: layers=4, units=491, activation=sigmoid, optimizer=adam, lr=0.00028687069403145714, batchsize=52
Finish Trainingstep 1 of 3 with lr=0.00028687069403145714 and 1000 epochs
Finish Trainingstep 2 of 3 with lr=0.00028687069403145714 and 1000 epochs
Finish Trainingstep 3 of 3 with lr=0.00028687069403145714 and 10000 epochs
2025-05-19_02-58-47
[I 2025-05-19 02:58:47,408] Trial 52 finished with value: 0.0012722144601866603 and parameters: {'n_layers': 4, 'n_units': 491, 'activation': 'sigmoid', 'lr': 0.00028687069403145714, 'optimizer': 'adam', 'batch_size': 52}. Best is trial 47 with value: 0.0006756293005309999.
Training model with params: layers=5, units=390, activation=sigmoid, optimizer=adam, lr=0.0006532548151044714, batchsize=1368
Finish Trainingstep 1 of 3 with lr=0.0006532548151044714 and 1000 epochs
Finish Trainingstep 2 of 3 with lr=0.0006532548151044714 and 1000 epochs
Finish Trainingstep 3 of 3 with lr=0.0006532548151044714 and 10000 epochs
2025-05-19_04-33-56
[I 2025-05-19 04:33:56,824] Trial 53 finished with value: 0.0005671430844813585 and parameters: {'n_layers': 5, 'n_units': 390, 'activation': 'sigmoid', 'lr': 0.0006532548151044714, 'optimizer': 'adam', 'batch_size': 1368}. Best is trial 53 with value: 0.0005671430844813585.
Training model with params: layers=5, units=389, activation=selu, optimizer=adam, lr=0.000658610862464199, batchsize=1417
Finish Trainingstep 1 of 3 with lr=0.000658610862464199 and 1000 epochs
Finish Trainingstep 2 of 3 with lr=0.000658610862464199 and 1000 epochs
Finish Trainingstep 3 of 3 with lr=0.000658610862464199 and 10000 epochs
2025-05-19_05-12-38
[I 2025-05-19 05:12:38,743] Trial 54 finished with value: 0.0035622005816549063 and parameters: {'n_layers': 5, 'n_units': 389, 'activation': 'selu', 'lr': 0.000658610862464199, 'optimizer': 'adam', 'batch_size': 1417}. Best is trial 53 with value: 0.0005671430844813585.
Training model with params: layers=7, units=318, activation=sigmoid, optimizer=sgd, lr=0.0005352175417205119, batchsize=1175
Finish Trainingstep 1 of 3 with lr=0.0005352175417205119 and 1000 epochs
Finish Trainingstep 2 of 3 with lr=0.0005352175417205119 and 1000 epochs
Finish Trainingstep 3 of 3 with lr=0.0005352175417205119 and 10000 epochs
2025-05-19_05-31-22
[I 2025-05-19 05:31:22,543] Trial 55 finished with value: 1.0255424976348877 and parameters: {'n_layers': 7, 'n_units': 318, 'activation': 'sigmoid', 'lr': 0.0005352175417205119, 'optimizer': 'sgd', 'batch_size': 1175}. Best is trial 53 with value: 0.0005671430844813585.
Training model with params: layers=3, units=274, activation=tanh, optimizer=adam, lr=0.0007877384385492421, batchsize=1760
Finish Trainingstep 1 of 3 with lr=0.0007877384385492421 and 1000 epochs
Finish Trainingstep 2 of 3 with lr=0.0007877384385492421 and 1000 epochs
Finish Trainingstep 3 of 3 with lr=0.0007877384385492421 and 10000 epochs
2025-05-19_05-51-45
[I 2025-05-19 05:51:45,279] Trial 56 finished with value: 0.001441523083485663 and parameters: {'n_layers': 3, 'n_units': 274, 'activation': 'tanh', 'lr': 0.0007877384385492421, 'optimizer': 'adam', 'batch_size': 1760}. Best is trial 53 with value: 0.0005671430844813585.
Training model with params: layers=5, units=471, activation=relu, optimizer=adam, lr=0.00022726138061869463, batchsize=1361
Finish Trainingstep 1 of 3 with lr=0.00022726138061869463 and 1000 epochs
Finish Trainingstep 2 of 3 with lr=0.00022726138061869463 and 1000 epochs
Finish Trainingstep 3 of 3 with lr=0.00022726138061869463 and 10000 epochs
2025-05-19_07-06-48
[I 2025-05-19 07:06:48,512] Trial 57 finished with value: 0.007328371983021498 and parameters: {'n_layers': 5, 'n_units': 471, 'activation': 'relu', 'lr': 0.00022726138061869463, 'optimizer': 'adam', 'batch_size': 1361}. Best is trial 53 with value: 0.0005671430844813585.
Training model with params: layers=6, units=365, activation=sigmoid, optimizer=adam, lr=0.0003134986293204177, batchsize=1535
Finish Trainingstep 1 of 3 with lr=0.0003134986293204177 and 1000 epochs
Finish Trainingstep 2 of 3 with lr=0.0003134986293204177 and 1000 epochs
Finish Trainingstep 3 of 3 with lr=0.0003134986293204177 and 10000 epochs
2025-05-19_08-56-47
[I 2025-05-19 08:56:47,377] Trial 58 finished with value: 0.0016896972665563226 and parameters: {'n_layers': 6, 'n_units': 365, 'activation': 'sigmoid', 'lr': 0.0003134986293204177, 'optimizer': 'adam', 'batch_size': 1535}. Best is trial 53 with value: 0.0005671430844813585.
Training model with params: layers=4, units=338, activation=sigmoid, optimizer=AdamW, lr=0.0009628409392327841, batchsize=1018
Finish Trainingstep 1 of 3 with lr=0.0009628409392327841 and 1000 epochs
Finish Trainingstep 2 of 3 with lr=0.0009628409392327841 and 1000 epochs
Finish Trainingstep 3 of 3 with lr=0.0009628409392327841 and 10000 epochs
2025-05-19_09-12-41
[I 2025-05-19 09:12:41,838] Trial 59 finished with value: 0.007415979169309139 and parameters: {'n_layers': 4, 'n_units': 338, 'activation': 'sigmoid', 'lr': 0.0009628409392327841, 'optimizer': 'AdamW', 'batch_size': 1018}. Best is trial 53 with value: 0.0005671430844813585.
Training model with params: layers=3, units=440, activation=elu, optimizer=adam, lr=0.001356338236070645, batchsize=169
Finish Trainingstep 1 of 3 with lr=0.001356338236070645 and 1000 epochs
Finish Trainingstep 2 of 3 with lr=0.001356338236070645 and 1000 epochs
Finish Trainingstep 3 of 3 with lr=0.001356338236070645 and 10000 epochs
2025-05-19_10-07-34
[I 2025-05-19 10:07:34,108] Trial 60 finished with value: 0.002357355086132884 and parameters: {'n_layers': 3, 'n_units': 440, 'activation': 'elu', 'lr': 0.001356338236070645, 'optimizer': 'adam', 'batch_size': 169}. Best is trial 53 with value: 0.0005671430844813585.
Training model with params: layers=4, units=403, activation=sigmoid, optimizer=adam, lr=0.00040370582753594317, batchsize=1219
Finish Trainingstep 1 of 3 with lr=0.00040370582753594317 and 1000 epochs
Finish Trainingstep 2 of 3 with lr=0.00040370582753594317 and 1000 epochs
Finish Trainingstep 3 of 3 with lr=0.00040370582753594317 and 10000 epochs
2025-05-19_11-32-54
[I 2025-05-19 11:32:54,690] Trial 61 finished with value: 0.0006504848715849221 and parameters: {'n_layers': 4, 'n_units': 403, 'activation': 'sigmoid', 'lr': 0.00040370582753594317, 'optimizer': 'adam', 'batch_size': 1219}. Best is trial 53 with value: 0.0005671430844813585.
Training model with params: layers=4, units=419, activation=sigmoid, optimizer=adam, lr=0.0003959661770213219, batchsize=1211
Finish Trainingstep 1 of 3 with lr=0.0003959661770213219 and 1000 epochs
Finish Trainingstep 2 of 3 with lr=0.0003959661770213219 and 1000 epochs
Finish Trainingstep 3 of 3 with lr=0.0003959661770213219 and 10000 epochs
2025-05-19_13-36-16
