[I 2025-05-21 02:54:03,839] Trial 96 finished with value: 1.0254515409469604 and parameters: {'n_layers': 4, 'n_units': 442, 'activation': 'sigmoid', 'lr': 0.0002622990358007023, 'optimizer': 'sgd', 'batch_size': 1004}. Best is trial 53 with value: 0.0005671430844813585.
Training model with params: layers=2, units=395, activation=elu, optimizer=adam, lr=0.000482263838684372, batchsize=1240
Finish Trainingstep 1 of 3 with lr=0.000482263838684372 and 1000 epochs
Finish Trainingstep 2 of 3 with lr=0.000482263838684372 and 1000 epochs
Finish Trainingstep 3 of 3 with lr=0.000482263838684372 and 10000 epochs
2025-05-21_04-02-04
[I 2025-05-21 04:02:04,794] Trial 97 finished with value: 0.0017100106924772263 and parameters: {'n_layers': 2, 'n_units': 395, 'activation': 'elu', 'lr': 0.000482263838684372, 'optimizer': 'adam', 'batch_size': 1240}. Best is trial 53 with value: 0.0005671430844813585.
Training model with params: layers=4, units=36, activation=gelu, optimizer=adam, lr=0.00032991707801764263, batchsize=1353
Finish Trainingstep 1 of 3 with lr=0.00032991707801764263 and 1000 epochs
Finish Trainingstep 2 of 3 with lr=0.00032991707801764263 and 1000 epochs
Finish Trainingstep 3 of 3 with lr=0.00032991707801764263 and 10000 epochs
2025-05-21_04-53-44
[I 2025-05-21 04:53:44,258] Trial 98 finished with value: 0.0013798032887279987 and parameters: {'n_layers': 4, 'n_units': 36, 'activation': 'gelu', 'lr': 0.00032991707801764263, 'optimizer': 'adam', 'batch_size': 1353}. Best is trial 53 with value: 0.0005671430844813585.
Training model with params: layers=3, units=417, activation=sigmoid, optimizer=AdamW, lr=0.00043062170033791327, batchsize=1484
Finish Trainingstep 1 of 3 with lr=0.00043062170033791327 and 1000 epochs
Finish Trainingstep 2 of 3 with lr=0.00043062170033791327 and 1000 epochs
Finish Trainingstep 3 of 3 with lr=0.00043062170033791327 and 10000 epochs
2025-05-21_05-09-50
[I 2025-05-21 05:09:50,329] Trial 99 finished with value: 0.008690038695931435 and parameters: {'n_layers': 3, 'n_units': 417, 'activation': 'sigmoid', 'lr': 0.00043062170033791327, 'optimizer': 'AdamW', 'batch_size': 1484}. Best is trial 53 with value: 0.0005671430844813585.
Beste Parameter:
{'n_layers': 5, 'n_units': 390, 'activation': 'sigmoid', 'lr': 0.0006532548151044714, 'optimizer': 'adam', 'batch_size': 1368}
