nohup: ignoring input
2025-05-16 12:31:25.694769: I tensorflow/core/util/port.cc:110] oneDNN custom operations are on. You may see slightly different numerical results due to floating-point round-off errors from different computation orders. To turn them off, set the environment variable `TF_ENABLE_ONEDNN_OPTS=0`.
2025-05-16 12:31:25.696626: I tensorflow/tsl/cuda/cudart_stub.cc:28] Could not find cuda drivers on your machine, GPU will not be used.
2025-05-16 12:31:25.731105: I tensorflow/tsl/cuda/cudart_stub.cc:28] Could not find cuda drivers on your machine, GPU will not be used.
2025-05-16 12:31:25.731543: I tensorflow/core/platform/cpu_feature_guard.cc:182] This TensorFlow binary is optimized to use available CPU instructions in performance-critical operations.
To enable the following instructions: AVX2 AVX512F AVX512_VNNI AVX512_BF16 FMA, in other operations, rebuild TensorFlow with the appropriate compiler flags.
2025-05-16 12:31:26.631687: W tensorflow/compiler/tf2tensorrt/utils/py_utils.cc:38] TF-TRT Warning: Could not find TensorRT
/home/rhoffmann/.local/lib/python3.10/site-packages/tensorflow_addons/utils/tfa_eol_msg.py:23: UserWarning: 

TensorFlow Addons (TFA) has ended development and introduction of new features.
TFA has entered a minimal maintenance and release mode until a planned end of life in May 2024.
Please modify downstream libraries to take dependencies from other repositories in our TensorFlow community (e.g. Keras, Keras-CV, and Keras-NLP). 

For more information see: https://github.com/tensorflow/addons/issues/2807 

  warnings.warn(
WARNING:tensorflow:From /home/rhoffmann/G3LHalo_python/exampleNotebooks/GMNN_Bayesian_Optimization1.py:53: is_gpu_available (from tensorflow.python.framework.test_util) is deprecated and will be removed in a future version.
Instructions for updating:
Use `tf.config.list_physical_devices('GPU')` instead.
using cpu device 

Number of test samples is 7500, should be 7500
Number of validation samples is 7500, should be 7500
Number of train samples is 35000, should be 35000
/home/rhoffmann/G3LHalo_python/exampleNotebooks/GMNN_Bayesian_Optimization1.py:106: UserWarning: No artists with labels found to put in legend.  Note that artists whose label start with an underscore are ignored when legend() is called with no argument.
  axes.legend()
number of training targets: 35000 . Should be 35000
number of validation targets: 7500 . Should be 7500
number of test targets: 7500 . Should be 7500
Shape of training targets: (3, 35000, 50). Should be (3, 35000, 50)
Shape of testing targets: (3, 7500, 50). Should be (3, 7500, 50)
Shape of validation targets: (3, 7500, 50). Should be (3, 7500, 50)
input min/max: 1.168300956697601e-06 16.999974244680363
number of training features: 35000 . Should be 35000
number of validation features: 7500 . Should be 7500
number of test features: 7500 . Should be 7500
Train Rescaled Shape: (3, 35000, 50)
Test Rescaled Shape: (3, 7500, 50)
Val Rescaled Shape: (3, 7500, 50)
Train Rescaled Shape: (35000, 10)
Test Rescaled Shape: (7500, 10)
Val Rescaled Shape: (7500, 10)
[I 2025-05-16 12:31:37,926] A new study created in memory with name: no-name-80dc8a1c-ddd6-4aae-bb16-cae5d77010d2
Training model with params: layers=8, units=95, activation=tanh, optimizer=adam, lr=0.002266262652592875, batchsize=1392
Finish Trainingstep 1 of 3 with lr=0.002266262652592875 and 1000 epochs
Finish Trainingstep 2 of 3 with lr=0.002266262652592875 and 1000 epochs
Finish Trainingstep 3 of 3 with lr=0.002266262652592875 and 10000 epochs
2025-05-16_12-56-23
[I 2025-05-16 12:56:23,578] Trial 0 finished with value: 0.0023099426180124283 and parameters: {'n_layers': 8, 'n_units': 95, 'activation': 'tanh', 'lr': 0.002266262652592875, 'optimizer': 'adam', 'batch_size': 1392}. Best is trial 0 with value: 0.0023099426180124283.
Training model with params: layers=6, units=443, activation=gelu, optimizer=AdamW, lr=0.0005913684749836051, batchsize=481
Finish Trainingstep 1 of 3 with lr=0.0005913684749836051 and 1000 epochs
Finish Trainingstep 2 of 3 with lr=0.0005913684749836051 and 1000 epochs
Finish Trainingstep 3 of 3 with lr=0.0005913684749836051 and 10000 epochs
2025-05-16_14-01-58
[I 2025-05-16 14:01:58,967] Trial 1 finished with value: 0.0037732748314738274 and parameters: {'n_layers': 6, 'n_units': 443, 'activation': 'gelu', 'lr': 0.0005913684749836051, 'optimizer': 'AdamW', 'batch_size': 481}. Best is trial 0 with value: 0.0023099426180124283.
Training model with params: layers=3, units=477, activation=sigmoid, optimizer=rmsprop, lr=0.0005341104920548413, batchsize=1890
Finish Trainingstep 1 of 3 with lr=0.0005341104920548413 and 1000 epochs
Finish Trainingstep 2 of 3 with lr=0.0005341104920548413 and 1000 epochs
Finish Trainingstep 3 of 3 with lr=0.0005341104920548413 and 10000 epochs
2025-05-16_15-14-33
[I 2025-05-16 15:14:33,600] Trial 2 finished with value: 0.0031836465932428837 and parameters: {'n_layers': 3, 'n_units': 477, 'activation': 'sigmoid', 'lr': 0.0005341104920548413, 'optimizer': 'rmsprop', 'batch_size': 1890}. Best is trial 0 with value: 0.0023099426180124283.
Training model with params: layers=5, units=490, activation=leaky_relu, optimizer=AdamW, lr=0.0008945506382507034, batchsize=1117
Finish Trainingstep 1 of 3 with lr=0.0008945506382507034 and 1000 epochs
Finish Trainingstep 2 of 3 with lr=0.0008945506382507034 and 1000 epochs
Finish Trainingstep 3 of 3 with lr=0.0008945506382507034 and 10000 epochs
2025-05-16_15-36-50
[I 2025-05-16 15:36:50,334] Trial 3 finished with value: 0.005227266810834408 and parameters: {'n_layers': 5, 'n_units': 490, 'activation': 'leaky_relu', 'lr': 0.0008945506382507034, 'optimizer': 'AdamW', 'batch_size': 1117}. Best is trial 0 with value: 0.0023099426180124283.
Training model with params: layers=5, units=468, activation=leaky_relu, optimizer=RAdam, lr=0.008511457038746065, batchsize=1502
Finish Trainingstep 1 of 3 with lr=0.008511457038746065 and 1000 epochs
Finish Trainingstep 2 of 3 with lr=0.008511457038746065 and 1000 epochs
Finish Trainingstep 3 of 3 with lr=0.008511457038746065 and 10000 epochs
2025-05-16_16-16-04
[I 2025-05-16 16:16:04,089] Trial 4 finished with value: 0.0046135298907756805 and parameters: {'n_layers': 5, 'n_units': 468, 'activation': 'leaky_relu', 'lr': 0.008511457038746065, 'optimizer': 'RAdam', 'batch_size': 1502}. Best is trial 0 with value: 0.0023099426180124283.
Training model with params: layers=9, units=423, activation=tanh, optimizer=sgd, lr=0.001602954266817859, batchsize=664
Finish Trainingstep 1 of 3 with lr=0.001602954266817859 and 1000 epochs
Finish Trainingstep 2 of 3 with lr=0.001602954266817859 and 1000 epochs
Finish Trainingstep 3 of 3 with lr=0.001602954266817859 and 10000 epochs
2025-05-16_20-35-11
[I 2025-05-16 20:35:11,646] Trial 5 finished with value: 0.015532257035374641 and parameters: {'n_layers': 9, 'n_units': 423, 'activation': 'tanh', 'lr': 0.001602954266817859, 'optimizer': 'sgd', 'batch_size': 664}. Best is trial 0 with value: 0.0023099426180124283.
Training model with params: layers=4, units=81, activation=leaky_relu, optimizer=rmsprop, lr=0.00011967066962449507, batchsize=63
Finish Trainingstep 1 of 3 with lr=0.00011967066962449507 and 1000 epochs
Finish Trainingstep 2 of 3 with lr=0.00011967066962449507 and 1000 epochs
Finish Trainingstep 3 of 3 with lr=0.00011967066962449507 and 10000 epochs
2025-05-16_21-41-10
[I 2025-05-16 21:41:10,779] Trial 6 finished with value: 0.005599131342023611 and parameters: {'n_layers': 4, 'n_units': 81, 'activation': 'leaky_relu', 'lr': 0.00011967066962449507, 'optimizer': 'rmsprop', 'batch_size': 63}. Best is trial 0 with value: 0.0023099426180124283.
Training model with params: layers=3, units=62, activation=relu, optimizer=rmsprop, lr=0.0038764551959221596, batchsize=1671
Finish Trainingstep 1 of 3 with lr=0.0038764551959221596 and 1000 epochs
Finish Trainingstep 2 of 3 with lr=0.0038764551959221596 and 1000 epochs
Finish Trainingstep 3 of 3 with lr=0.0038764551959221596 and 10000 epochs
2025-05-16_22-07-52
[I 2025-05-16 22:07:52,219] Trial 7 finished with value: 0.004086301662027836 and parameters: {'n_layers': 3, 'n_units': 62, 'activation': 'relu', 'lr': 0.0038764551959221596, 'optimizer': 'rmsprop', 'batch_size': 1671}. Best is trial 0 with value: 0.0023099426180124283.
Training model with params: layers=2, units=327, activation=selu, optimizer=RAdam, lr=0.0035621869534741856, batchsize=1549
Finish Trainingstep 1 of 3 with lr=0.0035621869534741856 and 1000 epochs
Finish Trainingstep 2 of 3 with lr=0.0035621869534741856 and 1000 epochs
Finish Trainingstep 3 of 3 with lr=0.0035621869534741856 and 10000 epochs
2025-05-16_22-26-35
[I 2025-05-16 22:26:35,154] Trial 8 finished with value: 0.001779225654900074 and parameters: {'n_layers': 2, 'n_units': 327, 'activation': 'selu', 'lr': 0.0035621869534741856, 'optimizer': 'RAdam', 'batch_size': 1549}. Best is trial 8 with value: 0.001779225654900074.
Training model with params: layers=10, units=36, activation=tanh, optimizer=RAdam, lr=0.009774931397790301, batchsize=958
Finish Trainingstep 1 of 3 with lr=0.009774931397790301 and 1000 epochs
Finish Trainingstep 2 of 3 with lr=0.009774931397790301 and 1000 epochs
Finish Trainingstep 3 of 3 with lr=0.009774931397790301 and 10000 epochs
2025-05-16_22-43-57
[I 2025-05-16 22:43:57,251] Trial 9 finished with value: 0.001898028771393001 and parameters: {'n_layers': 10, 'n_units': 36, 'activation': 'tanh', 'lr': 0.009774931397790301, 'optimizer': 'RAdam', 'batch_size': 958}. Best is trial 8 with value: 0.001779225654900074.
Training model with params: layers=1, units=290, activation=selu, optimizer=RAdam, lr=0.000189864844993751, batchsize=1921
Finish Trainingstep 1 of 3 with lr=0.000189864844993751 and 1000 epochs
Finish Trainingstep 2 of 3 with lr=0.000189864844993751 and 1000 epochs
Finish Trainingstep 3 of 3 with lr=0.000189864844993751 and 10000 epochs
2025-05-16_23-23-37
[I 2025-05-16 23:23:37,828] Trial 10 finished with value: 0.009865625761449337 and parameters: {'n_layers': 1, 'n_units': 290, 'activation': 'selu', 'lr': 0.000189864844993751, 'optimizer': 'RAdam', 'batch_size': 1921}. Best is trial 8 with value: 0.001779225654900074.
Training model with params: layers=10, units=232, activation=swish, optimizer=RAdam, lr=0.009172853641855591, batchsize=959
Finish Trainingstep 1 of 3 with lr=0.009172853641855591 and 1000 epochs
Finish Trainingstep 2 of 3 with lr=0.009172853641855591 and 1000 epochs
Finish Trainingstep 3 of 3 with lr=0.009172853641855591 and 10000 epochs
2025-05-17_00-09-54
[I 2025-05-17 00:09:55,027] Trial 11 finished with value: 0.0020024769473820925 and parameters: {'n_layers': 10, 'n_units': 232, 'activation': 'swish', 'lr': 0.009172853641855591, 'optimizer': 'RAdam', 'batch_size': 959}. Best is trial 8 with value: 0.001779225654900074.
Training model with params: layers=1, units=307, activation=selu, optimizer=RAdam, lr=0.003857608779476458, batchsize=1140
Finish Trainingstep 1 of 3 with lr=0.003857608779476458 and 1000 epochs
Finish Trainingstep 2 of 3 with lr=0.003857608779476458 and 1000 epochs
Finish Trainingstep 3 of 3 with lr=0.003857608779476458 and 10000 epochs
2025-05-17_00-50-33
[I 2025-05-17 00:50:33,086] Trial 12 finished with value: 0.005033258348703384 and parameters: {'n_layers': 1, 'n_units': 307, 'activation': 'selu', 'lr': 0.003857608779476458, 'optimizer': 'RAdam', 'batch_size': 1140}. Best is trial 8 with value: 0.001779225654900074.
Training model with params: layers=7, units=204, activation=elu, optimizer=RAdam, lr=0.004972812837016092, batchsize=857
Finish Trainingstep 1 of 3 with lr=0.004972812837016092 and 1000 epochs
Finish Trainingstep 2 of 3 with lr=0.004972812837016092 and 1000 epochs
Finish Trainingstep 3 of 3 with lr=0.004972812837016092 and 10000 epochs
2025-05-17_01-20-10
[I 2025-05-17 01:20:10,552] Trial 13 finished with value: 0.0020509900059551 and parameters: {'n_layers': 7, 'n_units': 204, 'activation': 'elu', 'lr': 0.004972812837016092, 'optimizer': 'RAdam', 'batch_size': 857}. Best is trial 8 with value: 0.001779225654900074.
Training model with params: layers=10, units=370, activation=selu, optimizer=adam, lr=0.0019636801844835293, batchsize=1354
Finish Trainingstep 1 of 3 with lr=0.0019636801844835293 and 1000 epochs
Finish Trainingstep 2 of 3 with lr=0.0019636801844835293 and 1000 epochs
Finish Trainingstep 3 of 3 with lr=0.0019636801844835293 and 10000 epochs
2025-05-17_02-00-29
[I 2025-05-17 02:00:29,977] Trial 14 finished with value: 0.004496721550822258 and parameters: {'n_layers': 10, 'n_units': 370, 'activation': 'selu', 'lr': 0.0019636801844835293, 'optimizer': 'adam', 'batch_size': 1354}. Best is trial 8 with value: 0.001779225654900074.
Training model with params: layers=2, units=168, activation=tanh, optimizer=sgd, lr=0.005809030023126326, batchsize=393
Finish Trainingstep 1 of 3 with lr=0.005809030023126326 and 1000 epochs
Finish Trainingstep 2 of 3 with lr=0.005809030023126326 and 1000 epochs
Finish Trainingstep 3 of 3 with lr=0.005809030023126326 and 10000 epochs
2025-05-17_02-55-18
[I 2025-05-17 02:55:18,590] Trial 15 finished with value: 0.023114176467061043 and parameters: {'n_layers': 2, 'n_units': 168, 'activation': 'tanh', 'lr': 0.005809030023126326, 'optimizer': 'sgd', 'batch_size': 393}. Best is trial 8 with value: 0.001779225654900074.
Training model with params: layers=8, units=343, activation=elu, optimizer=RAdam, lr=0.0028781053912242368, batchsize=1673
Finish Trainingstep 1 of 3 with lr=0.0028781053912242368 and 1000 epochs
Finish Trainingstep 2 of 3 with lr=0.0028781053912242368 and 1000 epochs
Finish Trainingstep 3 of 3 with lr=0.0028781053912242368 and 10000 epochs
2025-05-17_03-17-09
[I 2025-05-17 03:17:10,053] Trial 16 finished with value: 0.0018764013657346368 and parameters: {'n_layers': 8, 'n_units': 343, 'activation': 'elu', 'lr': 0.0028781053912242368, 'optimizer': 'RAdam', 'batch_size': 1673}. Best is trial 8 with value: 0.001779225654900074.
Training model with params: layers=7, units=335, activation=elu, optimizer=RAdam, lr=0.002665625445348298, batchsize=1684
Finish Trainingstep 1 of 3 with lr=0.002665625445348298 and 1000 epochs
Finish Trainingstep 2 of 3 with lr=0.002665625445348298 and 1000 epochs
Finish Trainingstep 3 of 3 with lr=0.002665625445348298 and 10000 epochs
2025-05-17_03-38-40
[I 2025-05-17 03:38:40,842] Trial 17 finished with value: 0.002490283688530326 and parameters: {'n_layers': 7, 'n_units': 335, 'activation': 'elu', 'lr': 0.002665625445348298, 'optimizer': 'RAdam', 'batch_size': 1684}. Best is trial 8 with value: 0.001779225654900074.
Training model with params: layers=8, units=352, activation=elu, optimizer=RAdam, lr=0.0010933906414957713, batchsize=2019
Finish Trainingstep 1 of 3 with lr=0.0010933906414957713 and 1000 epochs
Finish Trainingstep 2 of 3 with lr=0.0010933906414957713 and 1000 epochs
Finish Trainingstep 3 of 3 with lr=0.0010933906414957713 and 10000 epochs
2025-05-17_04-05-10
[I 2025-05-17 04:05:10,532] Trial 18 finished with value: 0.0020137999672442675 and parameters: {'n_layers': 8, 'n_units': 352, 'activation': 'elu', 'lr': 0.0010933906414957713, 'optimizer': 'RAdam', 'batch_size': 2019}. Best is trial 8 with value: 0.001779225654900074.
Training model with params: layers=6, units=386, activation=sigmoid, optimizer=adam, lr=0.0014646776821119365, batchsize=1601
Finish Trainingstep 1 of 3 with lr=0.0014646776821119365 and 1000 epochs
Finish Trainingstep 2 of 3 with lr=0.0014646776821119365 and 1000 epochs
Finish Trainingstep 3 of 3 with lr=0.0014646776821119365 and 10000 epochs
2025-05-17_04-31-41
[I 2025-05-17 04:31:41,343] Trial 19 finished with value: 0.0012199766933918 and parameters: {'n_layers': 6, 'n_units': 386, 'activation': 'sigmoid', 'lr': 0.0014646776821119365, 'optimizer': 'adam', 'batch_size': 1601}. Best is trial 19 with value: 0.0012199766933918.
Training model with params: layers=4, units=408, activation=sigmoid, optimizer=adam, lr=0.00042065821637032495, batchsize=1282
Finish Trainingstep 1 of 3 with lr=0.00042065821637032495 and 1000 epochs
Finish Trainingstep 2 of 3 with lr=0.00042065821637032495 and 1000 epochs
Finish Trainingstep 3 of 3 with lr=0.00042065821637032495 and 10000 epochs
2025-05-17_05-46-13
[I 2025-05-17 05:46:13,520] Trial 20 finished with value: 0.0008853964973241091 and parameters: {'n_layers': 4, 'n_units': 408, 'activation': 'sigmoid', 'lr': 0.00042065821637032495, 'optimizer': 'adam', 'batch_size': 1282}. Best is trial 20 with value: 0.0008853964973241091.
Training model with params: layers=4, units=395, activation=sigmoid, optimizer=adam, lr=0.0003963000545195179, batchsize=1310
Finish Trainingstep 1 of 3 with lr=0.0003963000545195179 and 1000 epochs
Finish Trainingstep 2 of 3 with lr=0.0003963000545195179 and 1000 epochs
Finish Trainingstep 3 of 3 with lr=0.0003963000545195179 and 10000 epochs
2025-05-17_07-28-14
[I 2025-05-17 07:28:14,710] Trial 21 finished with value: 0.0007596470532007515 and parameters: {'n_layers': 4, 'n_units': 395, 'activation': 'sigmoid', 'lr': 0.0003963000545195179, 'optimizer': 'adam', 'batch_size': 1310}. Best is trial 21 with value: 0.0007596470532007515.
Training model with params: layers=4, units=406, activation=sigmoid, optimizer=adam, lr=0.00027155757976528907, batchsize=1197
Finish Trainingstep 1 of 3 with lr=0.00027155757976528907 and 1000 epochs
Finish Trainingstep 2 of 3 with lr=0.00027155757976528907 and 1000 epochs
Finish Trainingstep 3 of 3 with lr=0.00027155757976528907 and 10000 epochs
2025-05-17_08-57-32
[I 2025-05-17 08:57:32,348] Trial 22 finished with value: 0.0009923988254740834 and parameters: {'n_layers': 4, 'n_units': 406, 'activation': 'sigmoid', 'lr': 0.00027155757976528907, 'optimizer': 'adam', 'batch_size': 1197}. Best is trial 21 with value: 0.0007596470532007515.
Training model with params: layers=4, units=408, activation=sigmoid, optimizer=adam, lr=0.00028509846129800285, batchsize=1246
Finish Trainingstep 1 of 3 with lr=0.00028509846129800285 and 1000 epochs
Finish Trainingstep 2 of 3 with lr=0.00028509846129800285 and 1000 epochs
Finish Trainingstep 3 of 3 with lr=0.00028509846129800285 and 10000 epochs
2025-05-17_10-14-05
[I 2025-05-17 10:14:05,936] Trial 23 finished with value: 0.0009013177477754653 and parameters: {'n_layers': 4, 'n_units': 408, 'activation': 'sigmoid', 'lr': 0.00028509846129800285, 'optimizer': 'adam', 'batch_size': 1246}. Best is trial 21 with value: 0.0007596470532007515.
Training model with params: layers=4, units=506, activation=sigmoid, optimizer=adam, lr=0.0003513163966743354, batchsize=1267
Finish Trainingstep 1 of 3 with lr=0.0003513163966743354 and 1000 epochs
Finish Trainingstep 2 of 3 with lr=0.0003513163966743354 and 1000 epochs
Finish Trainingstep 3 of 3 with lr=0.0003513163966743354 and 10000 epochs
2025-05-17_11-31-26
[I 2025-05-17 11:31:26,110] Trial 24 finished with value: 0.0008678733720444143 and parameters: {'n_layers': 4, 'n_units': 506, 'activation': 'sigmoid', 'lr': 0.0003513163966743354, 'optimizer': 'adam', 'batch_size': 1267}. Best is trial 21 with value: 0.0007596470532007515.
Training model with params: layers=3, units=510, activation=sigmoid, optimizer=adam, lr=0.0004297225589701808, batchsize=1337
Finish Trainingstep 1 of 3 with lr=0.0004297225589701808 and 1000 epochs
Finish Trainingstep 2 of 3 with lr=0.0004297225589701808 and 1000 epochs
Finish Trainingstep 3 of 3 with lr=0.0004297225589701808 and 10000 epochs
2025-05-17_12-53-57
[I 2025-05-17 12:53:57,883] Trial 25 finished with value: 0.0012629469856619835 and parameters: {'n_layers': 3, 'n_units': 510, 'activation': 'sigmoid', 'lr': 0.0004297225589701808, 'optimizer': 'adam', 'batch_size': 1337}. Best is trial 21 with value: 0.0007596470532007515.
Training model with params: layers=5, units=456, activation=sigmoid, optimizer=adam, lr=0.000331349158344745, batchsize=693
Finish Trainingstep 1 of 3 with lr=0.000331349158344745 and 1000 epochs
Finish Trainingstep 2 of 3 with lr=0.000331349158344745 and 1000 epochs
Finish Trainingstep 3 of 3 with lr=0.000331349158344745 and 10000 epochs
2025-05-17_15-46-56
[I 2025-05-17 15:46:56,220] Trial 26 finished with value: 0.0009881838923320174 and parameters: {'n_layers': 5, 'n_units': 456, 'activation': 'sigmoid', 'lr': 0.000331349158344745, 'optimizer': 'adam', 'batch_size': 693}. Best is trial 21 with value: 0.0007596470532007515.
Training model with params: layers=4, units=264, activation=sigmoid, optimizer=adam, lr=0.00018186008744152567, batchsize=767
Finish Trainingstep 1 of 3 with lr=0.00018186008744152567 and 1000 epochs
Finish Trainingstep 2 of 3 with lr=0.00018186008744152567 and 1000 epochs
Finish Trainingstep 3 of 3 with lr=0.00018186008744152567 and 10000 epochs
2025-05-17_17-25-33
[I 2025-05-17 17:25:34,021] Trial 27 finished with value: 0.0010308768833056092 and parameters: {'n_layers': 4, 'n_units': 264, 'activation': 'sigmoid', 'lr': 0.00018186008744152567, 'optimizer': 'adam', 'batch_size': 767}. Best is trial 21 with value: 0.0007596470532007515.
Training model with params: layers=2, units=418, activation=gelu, optimizer=adam, lr=0.0008703840005933536, batchsize=1003
Finish Trainingstep 1 of 3 with lr=0.0008703840005933536 and 1000 epochs
Finish Trainingstep 2 of 3 with lr=0.0008703840005933536 and 1000 epochs
Finish Trainingstep 3 of 3 with lr=0.0008703840005933536 and 10000 epochs
2025-05-17_17-42-55
