[I 2025-05-17 20:22:46,491] Trial 29 finished with value: 0.001783090177923441 and parameters: {'n_layers': 8, 'n_units': 88, 'activation': 'elu', 'lr': 0.001071047853777859, 'optimizer': 'RAdam', 'batch_size': 1680}. Best is trial 14 with value: 0.0013181526446714997.
Training model with params: layers=2, units=245, activation=sigmoid, optimizer=adam, lr=0.0008660243333751317, batchsize=961
Finish Trainingstep 1 of 3 with lr=0.0008660243333751317 and 1000 epochs
Finish Trainingstep 2 of 3 with lr=0.0008660243333751317 and 1000 epochs
Finish Trainingstep 3 of 3 with lr=0.0008660243333751317 and 10000 epochs
2025-05-17_21-18-52
[I 2025-05-17 21:18:52,195] Trial 30 finished with value: 0.002339958678930998 and parameters: {'n_layers': 2, 'n_units': 245, 'activation': 'sigmoid', 'lr': 0.0008660243333751317, 'optimizer': 'adam', 'batch_size': 961}. Best is trial 14 with value: 0.0013181526446714997.
Training model with params: layers=6, units=52, activation=elu, optimizer=RAdam, lr=0.006526957650572827, batchsize=407
Finish Trainingstep 1 of 3 with lr=0.006526957650572827 and 1000 epochs
Finish Trainingstep 2 of 3 with lr=0.006526957650572827 and 1000 epochs
Finish Trainingstep 3 of 3 with lr=0.006526957650572827 and 10000 epochs
2025-05-17_21-31-33
[I 2025-05-17 21:31:33,902] Trial 31 finished with value: 0.002144455211237073 and parameters: {'n_layers': 6, 'n_units': 52, 'activation': 'elu', 'lr': 0.006526957650572827, 'optimizer': 'RAdam', 'batch_size': 407}. Best is trial 14 with value: 0.0013181526446714997.
Training model with params: layers=7, units=113, activation=tanh, optimizer=RAdam, lr=0.005560043895726333, batchsize=361
Finish Trainingstep 1 of 3 with lr=0.005560043895726333 and 1000 epochs
Finish Trainingstep 2 of 3 with lr=0.005560043895726333 and 1000 epochs
Finish Trainingstep 3 of 3 with lr=0.005560043895726333 and 10000 epochs
2025-05-17_21-59-37
[I 2025-05-17 21:59:37,042] Trial 32 finished with value: 0.0028695298824459314 and parameters: {'n_layers': 7, 'n_units': 113, 'activation': 'tanh', 'lr': 0.005560043895726333, 'optimizer': 'RAdam', 'batch_size': 361}. Best is trial 14 with value: 0.0013181526446714997.
Training model with params: layers=4, units=65, activation=elu, optimizer=rmsprop, lr=0.00360979973363603, batchsize=628
Finish Trainingstep 1 of 3 with lr=0.00360979973363603 and 1000 epochs
Finish Trainingstep 2 of 3 with lr=0.00360979973363603 and 1000 epochs
Finish Trainingstep 3 of 3 with lr=0.00360979973363603 and 10000 epochs
2025-05-17_22-18-00
[I 2025-05-17 22:18:00,602] Trial 33 finished with value: 0.0014685650821775198 and parameters: {'n_layers': 4, 'n_units': 65, 'activation': 'elu', 'lr': 0.00360979973363603, 'optimizer': 'rmsprop', 'batch_size': 628}. Best is trial 14 with value: 0.0013181526446714997.
Training model with params: layers=4, units=71, activation=elu, optimizer=rmsprop, lr=0.003550471151663795, batchsize=657
Finish Trainingstep 1 of 3 with lr=0.003550471151663795 and 1000 epochs
Finish Trainingstep 2 of 3 with lr=0.003550471151663795 and 1000 epochs
Finish Trainingstep 3 of 3 with lr=0.003550471151663795 and 10000 epochs
2025-05-17_22-46-37
[I 2025-05-17 22:46:37,884] Trial 34 finished with value: 0.0019471512641757727 and parameters: {'n_layers': 4, 'n_units': 71, 'activation': 'elu', 'lr': 0.003550471151663795, 'optimizer': 'rmsprop', 'batch_size': 657}. Best is trial 14 with value: 0.0013181526446714997.
Training model with params: layers=3, units=167, activation=leaky_relu, optimizer=rmsprop, lr=0.0016338636126133886, batchsize=833
Finish Trainingstep 1 of 3 with lr=0.0016338636126133886 and 1000 epochs
Finish Trainingstep 2 of 3 with lr=0.0016338636126133886 and 1000 epochs
Finish Trainingstep 3 of 3 with lr=0.0016338636126133886 and 10000 epochs
2025-05-17_23-36-09
[I 2025-05-17 23:36:09,833] Trial 35 finished with value: 0.004405852407217026 and parameters: {'n_layers': 3, 'n_units': 167, 'activation': 'leaky_relu', 'lr': 0.0016338636126133886, 'optimizer': 'rmsprop', 'batch_size': 833}. Best is trial 14 with value: 0.0013181526446714997.
Training model with params: layers=5, units=299, activation=selu, optimizer=rmsprop, lr=0.0017537759794017155, batchsize=1453
Finish Trainingstep 1 of 3 with lr=0.0017537759794017155 and 1000 epochs
Finish Trainingstep 2 of 3 with lr=0.0017537759794017155 and 1000 epochs
Finish Trainingstep 3 of 3 with lr=0.0017537759794017155 and 10000 epochs
2025-05-18_00-27-03
[I 2025-05-18 00:27:03,367] Trial 36 finished with value: 0.003164686495438218 and parameters: {'n_layers': 5, 'n_units': 299, 'activation': 'selu', 'lr': 0.0017537759794017155, 'optimizer': 'rmsprop', 'batch_size': 1453}. Best is trial 14 with value: 0.0013181526446714997.
Training model with params: layers=4, units=125, activation=gelu, optimizer=rmsprop, lr=0.0027851932318696242, batchsize=1250
Finish Trainingstep 1 of 3 with lr=0.0027851932318696242 and 1000 epochs
Finish Trainingstep 2 of 3 with lr=0.0027851932318696242 and 1000 epochs
Finish Trainingstep 3 of 3 with lr=0.0027851932318696242 and 10000 epochs
2025-05-18_01-04-12
[I 2025-05-18 01:04:12,344] Trial 37 finished with value: 0.0019181318348273635 and parameters: {'n_layers': 4, 'n_units': 125, 'activation': 'gelu', 'lr': 0.0027851932318696242, 'optimizer': 'rmsprop', 'batch_size': 1250}. Best is trial 14 with value: 0.0013181526446714997.
Training model with params: layers=3, units=41, activation=relu, optimizer=rmsprop, lr=0.003920664006044618, batchsize=569
Finish Trainingstep 1 of 3 with lr=0.003920664006044618 and 1000 epochs
Finish Trainingstep 2 of 3 with lr=0.003920664006044618 and 1000 epochs
Finish Trainingstep 3 of 3 with lr=0.003920664006044618 and 10000 epochs
2025-05-18_01-19-15
[I 2025-05-18 01:19:15,402] Trial 38 finished with value: 0.003008280647918582 and parameters: {'n_layers': 3, 'n_units': 41, 'activation': 'relu', 'lr': 0.003920664006044618, 'optimizer': 'rmsprop', 'batch_size': 569}. Best is trial 14 with value: 0.0013181526446714997.
Training model with params: layers=5, units=95, activation=sigmoid, optimizer=AdamW, lr=0.0012613611497039592, batchsize=1057
Finish Trainingstep 1 of 3 with lr=0.0012613611497039592 and 1000 epochs
Finish Trainingstep 2 of 3 with lr=0.0012613611497039592 and 1000 epochs
Finish Trainingstep 3 of 3 with lr=0.0012613611497039592 and 10000 epochs
2025-05-18_01-31-39
[I 2025-05-18 01:31:39,514] Trial 39 finished with value: 0.016635894775390625 and parameters: {'n_layers': 5, 'n_units': 95, 'activation': 'sigmoid', 'lr': 0.0012613611497039592, 'optimizer': 'AdamW', 'batch_size': 1057}. Best is trial 14 with value: 0.0013181526446714997.
Training model with params: layers=1, units=382, activation=elu, optimizer=sgd, lr=0.002546798833931314, batchsize=245
Finish Trainingstep 1 of 3 with lr=0.002546798833931314 and 1000 epochs
Finish Trainingstep 2 of 3 with lr=0.002546798833931314 and 1000 epochs
Finish Trainingstep 3 of 3 with lr=0.002546798833931314 and 10000 epochs
2025-05-18_03-01-02
[I 2025-05-18 03:01:02,369] Trial 40 finished with value: 0.061924293637275696 and parameters: {'n_layers': 1, 'n_units': 382, 'activation': 'elu', 'lr': 0.002546798833931314, 'optimizer': 'sgd', 'batch_size': 245}. Best is trial 14 with value: 0.0013181526446714997.
Training model with params: layers=6, units=75, activation=elu, optimizer=RAdam, lr=0.008460259801999093, batchsize=544
Finish Trainingstep 1 of 3 with lr=0.008460259801999093 and 1000 epochs
Finish Trainingstep 2 of 3 with lr=0.008460259801999093 and 1000 epochs
Finish Trainingstep 3 of 3 with lr=0.008460259801999093 and 10000 epochs
2025-05-18_03-14-58
[I 2025-05-18 03:14:58,327] Trial 41 finished with value: 0.0017514645587652922 and parameters: {'n_layers': 6, 'n_units': 75, 'activation': 'elu', 'lr': 0.008460259801999093, 'optimizer': 'RAdam', 'batch_size': 544}. Best is trial 14 with value: 0.0013181526446714997.
Training model with params: layers=6, units=41, activation=elu, optimizer=rmsprop, lr=0.005286398359971734, batchsize=798
Finish Trainingstep 1 of 3 with lr=0.005286398359971734 and 1000 epochs
Finish Trainingstep 2 of 3 with lr=0.005286398359971734 and 1000 epochs
Finish Trainingstep 3 of 3 with lr=0.005286398359971734 and 10000 epochs
2025-05-18_03-41-33
[I 2025-05-18 03:41:33,168] Trial 42 finished with value: 0.0019797123968601227 and parameters: {'n_layers': 6, 'n_units': 41, 'activation': 'elu', 'lr': 0.005286398359971734, 'optimizer': 'rmsprop', 'batch_size': 798}. Best is trial 14 with value: 0.0013181526446714997.
Training model with params: layers=9, units=457, activation=elu, optimizer=RAdam, lr=0.006675884105620932, batchsize=477
Finish Trainingstep 1 of 3 with lr=0.006675884105620932 and 1000 epochs
Finish Trainingstep 2 of 3 with lr=0.006675884105620932 and 1000 epochs
Finish Trainingstep 3 of 3 with lr=0.006675884105620932 and 10000 epochs
2025-05-18_06-21-25
[I 2025-05-18 06:21:25,849] Trial 43 finished with value: 0.003943744581192732 and parameters: {'n_layers': 9, 'n_units': 457, 'activation': 'elu', 'lr': 0.006675884105620932, 'optimizer': 'RAdam', 'batch_size': 477}. Best is trial 14 with value: 0.0013181526446714997.
Training model with params: layers=7, units=133, activation=swish, optimizer=AdamW, lr=0.00022302868614674232, batchsize=672
Finish Trainingstep 1 of 3 with lr=0.00022302868614674232 and 1000 epochs
Finish Trainingstep 2 of 3 with lr=0.00022302868614674232 and 1000 epochs
Finish Trainingstep 3 of 3 with lr=0.00022302868614674232 and 10000 epochs
2025-05-18_06-50-47
[I 2025-05-18 06:50:47,402] Trial 44 finished with value: 0.006250941660255194 and parameters: {'n_layers': 7, 'n_units': 133, 'activation': 'swish', 'lr': 0.00022302868614674232, 'optimizer': 'AdamW', 'batch_size': 672}. Best is trial 14 with value: 0.0013181526446714997.
Training model with params: layers=5, units=317, activation=leaky_relu, optimizer=RAdam, lr=0.00790811456827697, batchsize=223
Finish Trainingstep 1 of 3 with lr=0.00790811456827697 and 1000 epochs
Finish Trainingstep 2 of 3 with lr=0.00790811456827697 and 1000 epochs
Finish Trainingstep 3 of 3 with lr=0.00790811456827697 and 10000 epochs
2025-05-18_08-02-58
[I 2025-05-18 08:02:58,186] Trial 45 finished with value: 0.0030701393261551857 and parameters: {'n_layers': 5, 'n_units': 317, 'activation': 'leaky_relu', 'lr': 0.00790811456827697, 'optimizer': 'RAdam', 'batch_size': 223}. Best is trial 14 with value: 0.0013181526446714997.
Training model with params: layers=3, units=87, activation=elu, optimizer=sgd, lr=0.003362250800424923, batchsize=294
Finish Trainingstep 1 of 3 with lr=0.003362250800424923 and 1000 epochs
Finish Trainingstep 2 of 3 with lr=0.003362250800424923 and 1000 epochs
Finish Trainingstep 3 of 3 with lr=0.003362250800424923 and 10000 epochs
2025-05-18_08-56-21
[I 2025-05-18 08:56:21,720] Trial 46 finished with value: 0.014646339230239391 and parameters: {'n_layers': 3, 'n_units': 87, 'activation': 'elu', 'lr': 0.003362250800424923, 'optimizer': 'sgd', 'batch_size': 294}. Best is trial 14 with value: 0.0013181526446714997.
Training model with params: layers=4, units=39, activation=tanh, optimizer=RAdam, lr=0.004327338334921354, batchsize=745
Finish Trainingstep 1 of 3 with lr=0.004327338334921354 and 1000 epochs
Finish Trainingstep 2 of 3 with lr=0.004327338334921354 and 1000 epochs
Finish Trainingstep 3 of 3 with lr=0.004327338334921354 and 10000 epochs
2025-05-18_09-23-50
[I 2025-05-18 09:23:50,602] Trial 47 finished with value: 0.0008938547689467669 and parameters: {'n_layers': 4, 'n_units': 39, 'activation': 'tanh', 'lr': 0.004327338334921354, 'optimizer': 'RAdam', 'batch_size': 745}. Best is trial 47 with value: 0.0008938547689467669.
Training model with params: layers=4, units=37, activation=tanh, optimizer=rmsprop, lr=0.00420409976237346, batchsize=1508
Finish Trainingstep 1 of 3 with lr=0.00420409976237346 and 1000 epochs
Finish Trainingstep 2 of 3 with lr=0.00420409976237346 and 1000 epochs
Finish Trainingstep 3 of 3 with lr=0.00420409976237346 and 10000 epochs
2025-05-18_09-49-23
[I 2025-05-18 09:49:23,414] Trial 48 finished with value: 0.001680193468928337 and parameters: {'n_layers': 4, 'n_units': 37, 'activation': 'tanh', 'lr': 0.00420409976237346, 'optimizer': 'rmsprop', 'batch_size': 1508}. Best is trial 47 with value: 0.0008938547689467669.
Training model with params: layers=2, units=116, activation=tanh, optimizer=RAdam, lr=0.0018641881558275058, batchsize=754
Finish Trainingstep 1 of 3 with lr=0.0018641881558275058 and 1000 epochs
Finish Trainingstep 2 of 3 with lr=0.0018641881558275058 and 1000 epochs
Finish Trainingstep 3 of 3 with lr=0.0018641881558275058 and 10000 epochs
2025-05-18_10-17-15
[I 2025-05-18 10:17:15,469] Trial 49 finished with value: 0.0019596044439822435 and parameters: {'n_layers': 2, 'n_units': 116, 'activation': 'tanh', 'lr': 0.0018641881558275058, 'optimizer': 'RAdam', 'batch_size': 754}. Best is trial 47 with value: 0.0008938547689467669.
Training model with params: layers=3, units=17, activation=tanh, optimizer=adam, lr=0.0023314502512188262, batchsize=1119
Finish Trainingstep 1 of 3 with lr=0.0023314502512188262 and 1000 epochs
Finish Trainingstep 2 of 3 with lr=0.0023314502512188262 and 1000 epochs
Finish Trainingstep 3 of 3 with lr=0.0023314502512188262 and 10000 epochs
2025-05-18_10-29-17
[I 2025-05-18 10:29:17,520] Trial 50 finished with value: 0.002527009928599 and parameters: {'n_layers': 3, 'n_units': 17, 'activation': 'tanh', 'lr': 0.0023314502512188262, 'optimizer': 'adam', 'batch_size': 1119}. Best is trial 47 with value: 0.0008938547689467669.
Training model with params: layers=4, units=49, activation=elu, optimizer=RAdam, lr=0.005385597980038482, batchsize=524
Finish Trainingstep 1 of 3 with lr=0.005385597980038482 and 1000 epochs
Finish Trainingstep 2 of 3 with lr=0.005385597980038482 and 1000 epochs
Finish Trainingstep 3 of 3 with lr=0.005385597980038482 and 10000 epochs
2025-05-18_10-46-10
[I 2025-05-18 10:46:11,005] Trial 51 finished with value: 0.001665546908043325 and parameters: {'n_layers': 4, 'n_units': 49, 'activation': 'elu', 'lr': 0.005385597980038482, 'optimizer': 'RAdam', 'batch_size': 524}. Best is trial 47 with value: 0.0008938547689467669.
Training model with params: layers=5, units=79, activation=tanh, optimizer=RAdam, lr=0.003046487451407769, batchsize=851
Finish Trainingstep 1 of 3 with lr=0.003046487451407769 and 1000 epochs
Finish Trainingstep 2 of 3 with lr=0.003046487451407769 and 1000 epochs
Finish Trainingstep 3 of 3 with lr=0.003046487451407769 and 10000 epochs
2025-05-18_11-05-58
[I 2025-05-18 11:05:58,185] Trial 52 finished with value: 0.0016736151883378625 and parameters: {'n_layers': 5, 'n_units': 79, 'activation': 'tanh', 'lr': 0.003046487451407769, 'optimizer': 'RAdam', 'batch_size': 851}. Best is trial 47 with value: 0.0008938547689467669.
Training model with params: layers=7, units=100, activation=swish, optimizer=RAdam, lr=0.004857099253940521, batchsize=634
Finish Trainingstep 1 of 3 with lr=0.004857099253940521 and 1000 epochs
Finish Trainingstep 2 of 3 with lr=0.004857099253940521 and 1000 epochs
Finish Trainingstep 3 of 3 with lr=0.004857099253940521 and 10000 epochs
2025-05-18_11-33-49
[I 2025-05-18 11:33:49,090] Trial 53 finished with value: 0.00247668894007802 and parameters: {'n_layers': 7, 'n_units': 100, 'activation': 'swish', 'lr': 0.004857099253940521, 'optimizer': 'RAdam', 'batch_size': 634}. Best is trial 47 with value: 0.0008938547689467669.
Training model with params: layers=4, units=33, activation=relu, optimizer=RAdam, lr=0.0036440396794073476, batchsize=329
Finish Trainingstep 1 of 3 with lr=0.0036440396794073476 and 1000 epochs
Finish Trainingstep 2 of 3 with lr=0.0036440396794073476 and 1000 epochs
Finish Trainingstep 3 of 3 with lr=0.0036440396794073476 and 10000 epochs
2025-05-18_11-50-19
[I 2025-05-18 11:50:19,998] Trial 54 finished with value: 0.00285741756670177 and parameters: {'n_layers': 4, 'n_units': 33, 'activation': 'relu', 'lr': 0.0036440396794073476, 'optimizer': 'RAdam', 'batch_size': 329}. Best is trial 47 with value: 0.0008938547689467669.
Training model with params: layers=3, units=60, activation=elu, optimizer=RAdam, lr=0.007469642533248669, batchsize=2040
Finish Trainingstep 1 of 3 with lr=0.007469642533248669 and 1000 epochs
Finish Trainingstep 2 of 3 with lr=0.007469642533248669 and 1000 epochs
Finish Trainingstep 3 of 3 with lr=0.007469642533248669 and 10000 epochs
2025-05-18_11-59-47
[I 2025-05-18 11:59:47,546] Trial 55 finished with value: 0.001413316698744893 and parameters: {'n_layers': 3, 'n_units': 60, 'activation': 'elu', 'lr': 0.007469642533248669, 'optimizer': 'RAdam', 'batch_size': 2040}. Best is trial 47 with value: 0.0008938547689467669.
Training model with params: layers=3, units=68, activation=selu, optimizer=RAdam, lr=0.0071750530946738025, batchsize=2029
Finish Trainingstep 1 of 3 with lr=0.0071750530946738025 and 1000 epochs
Finish Trainingstep 2 of 3 with lr=0.0071750530946738025 and 1000 epochs
Finish Trainingstep 3 of 3 with lr=0.0071750530946738025 and 10000 epochs
2025-05-18_12-18-15
[I 2025-05-18 12:18:16,013] Trial 56 finished with value: 0.001673883874900639 and parameters: {'n_layers': 3, 'n_units': 68, 'activation': 'selu', 'lr': 0.0071750530946738025, 'optimizer': 'RAdam', 'batch_size': 2029}. Best is trial 47 with value: 0.0008938547689467669.
Training model with params: layers=2, units=356, activation=gelu, optimizer=RAdam, lr=0.008703979083401177, batchsize=1879
Finish Trainingstep 1 of 3 with lr=0.008703979083401177 and 1000 epochs
Finish Trainingstep 2 of 3 with lr=0.008703979083401177 and 1000 epochs
Finish Trainingstep 3 of 3 with lr=0.008703979083401177 and 10000 epochs
2025-05-18_12-31-34
[I 2025-05-18 12:31:34,897] Trial 57 finished with value: 0.0028381659649312496 and parameters: {'n_layers': 2, 'n_units': 356, 'activation': 'gelu', 'lr': 0.008703979083401177, 'optimizer': 'RAdam', 'batch_size': 1879}. Best is trial 47 with value: 0.0008938547689467669.
Training model with params: layers=3, units=220, activation=elu, optimizer=sgd, lr=0.004297350183444881, batchsize=1731
Finish Trainingstep 1 of 3 with lr=0.004297350183444881 and 1000 epochs
Finish Trainingstep 2 of 3 with lr=0.004297350183444881 and 1000 epochs
Finish Trainingstep 3 of 3 with lr=0.004297350183444881 and 10000 epochs
2025-05-18_13-26-11
[I 2025-05-18 13:26:11,743] Trial 58 finished with value: 0.05467033013701439 and parameters: {'n_layers': 3, 'n_units': 220, 'activation': 'elu', 'lr': 0.004297350183444881, 'optimizer': 'sgd', 'batch_size': 1731}. Best is trial 47 with value: 0.0008938547689467669.
Training model with params: layers=2, units=140, activation=sigmoid, optimizer=RAdam, lr=0.000641570240955395, batchsize=1961
Finish Trainingstep 1 of 3 with lr=0.000641570240955395 and 1000 epochs
Finish Trainingstep 2 of 3 with lr=0.000641570240955395 and 1000 epochs
Finish Trainingstep 3 of 3 with lr=0.000641570240955395 and 10000 epochs
2025-05-18_14-07-04
[I 2025-05-18 14:07:04,449] Trial 59 finished with value: 0.002893639262765646 and parameters: {'n_layers': 2, 'n_units': 140, 'activation': 'sigmoid', 'lr': 0.000641570240955395, 'optimizer': 'RAdam', 'batch_size': 1961}. Best is trial 47 with value: 0.0008938547689467669.
Training model with params: layers=1, units=181, activation=elu, optimizer=AdamW, lr=0.0029134604858306505, batchsize=1637
Finish Trainingstep 1 of 3 with lr=0.0029134604858306505 and 1000 epochs
Finish Trainingstep 2 of 3 with lr=0.0029134604858306505 and 1000 epochs
Finish Trainingstep 3 of 3 with lr=0.0029134604858306505 and 10000 epochs
2025-05-18_14-14-06
[I 2025-05-18 14:14:06,286] Trial 60 finished with value: 0.016352826729416847 and parameters: {'n_layers': 1, 'n_units': 181, 'activation': 'elu', 'lr': 0.0029134604858306505, 'optimizer': 'AdamW', 'batch_size': 1637}. Best is trial 47 with value: 0.0008938547689467669.
Training model with params: layers=5, units=56, activation=elu, optimizer=RAdam, lr=0.005222322455389175, batchsize=1831
Finish Trainingstep 1 of 3 with lr=0.005222322455389175 and 1000 epochs
Finish Trainingstep 2 of 3 with lr=0.005222322455389175 and 1000 epochs
Finish Trainingstep 3 of 3 with lr=0.005222322455389175 and 10000 epochs
2025-05-18_14-31-53
[I 2025-05-18 14:31:53,512] Trial 61 finished with value: 0.001357973087579012 and parameters: {'n_layers': 5, 'n_units': 56, 'activation': 'elu', 'lr': 0.005222322455389175, 'optimizer': 'RAdam', 'batch_size': 1831}. Best is trial 47 with value: 0.0008938547689467669.
Training model with params: layers=4, units=50, activation=elu, optimizer=RAdam, lr=0.00487142434003373, batchsize=2014
Finish Trainingstep 1 of 3 with lr=0.00487142434003373 and 1000 epochs
Finish Trainingstep 2 of 3 with lr=0.00487142434003373 and 1000 epochs
Finish Trainingstep 3 of 3 with lr=0.00487142434003373 and 10000 epochs
2025-05-18_14-53-24
[I 2025-05-18 14:53:24,246] Trial 62 finished with value: 0.0011375469621270895 and parameters: {'n_layers': 4, 'n_units': 50, 'activation': 'elu', 'lr': 0.00487142434003373, 'optimizer': 'RAdam', 'batch_size': 2014}. Best is trial 47 with value: 0.0008938547689467669.
Training model with params: layers=5, units=29, activation=elu, optimizer=RAdam, lr=0.007745086352844225, batchsize=1994
Finish Trainingstep 1 of 3 with lr=0.007745086352844225 and 1000 epochs
Finish Trainingstep 2 of 3 with lr=0.007745086352844225 and 1000 epochs
Finish Trainingstep 3 of 3 with lr=0.007745086352844225 and 10000 epochs
2025-05-18_15-10-48
