[I 2025-05-19 01:53:32,863] Trial 97 finished with value: 0.001498984289355576 and parameters: {'n_layers': 5, 'n_units': 69, 'activation': 'gelu', 'lr': 0.005675923619863386, 'optimizer': 'adam', 'batch_size': 1939}. Best is trial 63 with value: 0.0007619244861416519.
Training model with params: layers=10, units=91, activation=tanh, optimizer=sgd, lr=0.004712617120387356, batchsize=1786
Finish Trainingstep 1 of 3 with lr=0.004712617120387356 and 1000 epochs
Finish Trainingstep 2 of 3 with lr=0.004712617120387356 and 1000 epochs
Finish Trainingstep 3 of 3 with lr=0.004712617120387356 and 10000 epochs
2025-05-19_03-35-44
[I 2025-05-19 03:35:44,191] Trial 98 finished with value: 0.028651708737015724 and parameters: {'n_layers': 10, 'n_units': 91, 'activation': 'tanh', 'lr': 0.004712617120387356, 'optimizer': 'sgd', 'batch_size': 1786}. Best is trial 63 with value: 0.0007619244861416519.
Training model with params: layers=4, units=39, activation=sigmoid, optimizer=AdamW, lr=0.009672004777703587, batchsize=1312
Finish Trainingstep 1 of 3 with lr=0.009672004777703587 and 1000 epochs
Finish Trainingstep 2 of 3 with lr=0.009672004777703587 and 1000 epochs
Finish Trainingstep 3 of 3 with lr=0.009672004777703587 and 10000 epochs
2025-05-19_03-41-29
[I 2025-05-19 03:41:29,252] Trial 99 finished with value: 0.006090124137699604 and parameters: {'n_layers': 4, 'n_units': 39, 'activation': 'sigmoid', 'lr': 0.009672004777703587, 'optimizer': 'AdamW', 'batch_size': 1312}. Best is trial 63 with value: 0.0007619244861416519.
Beste Parameter:
{'n_layers': 5, 'n_units': 29, 'activation': 'elu', 'lr': 0.007745086352844225, 'optimizer': 'RAdam', 'batch_size': 1994}
