[I 2025-05-18 15:10:48,376] Trial 63 finished with value: 0.0007619244861416519 and parameters: {'n_layers': 5, 'n_units': 29, 'activation': 'elu', 'lr': 0.007745086352844225, 'optimizer': 'RAdam', 'batch_size': 1994}. Best is trial 63 with value: 0.0007619244861416519.
Training model with params: layers=5, units=30, activation=elu, optimizer=RAdam, lr=0.009994635332443663, batchsize=1844
Finish Trainingstep 1 of 3 with lr=0.009994635332443663 and 1000 epochs
Finish Trainingstep 2 of 3 with lr=0.009994635332443663 and 1000 epochs
Finish Trainingstep 3 of 3 with lr=0.009994635332443663 and 10000 epochs
2025-05-18_15-23-20
[I 2025-05-18 15:23:20,235] Trial 64 finished with value: 0.0017605485627427697 and parameters: {'n_layers': 5, 'n_units': 30, 'activation': 'elu', 'lr': 0.009994635332443663, 'optimizer': 'RAdam', 'batch_size': 1844}. Best is trial 63 with value: 0.0007619244861416519.
Training model with params: layers=5, units=18, activation=elu, optimizer=RAdam, lr=0.005742310735505733, batchsize=1965
Finish Trainingstep 1 of 3 with lr=0.005742310735505733 and 1000 epochs
Finish Trainingstep 2 of 3 with lr=0.005742310735505733 and 1000 epochs
Finish Trainingstep 3 of 3 with lr=0.005742310735505733 and 10000 epochs
2025-05-18_15-29-23
[I 2025-05-18 15:29:23,630] Trial 65 finished with value: 0.0038723747711628675 and parameters: {'n_layers': 5, 'n_units': 18, 'activation': 'elu', 'lr': 0.005742310735505733, 'optimizer': 'RAdam', 'batch_size': 1965}. Best is trial 63 with value: 0.0007619244861416519.
Training model with params: layers=4, units=41, activation=elu, optimizer=RAdam, lr=0.0050219271939474725, batchsize=1792
Finish Trainingstep 1 of 3 with lr=0.0050219271939474725 and 1000 epochs
Finish Trainingstep 2 of 3 with lr=0.0050219271939474725 and 1000 epochs
Finish Trainingstep 3 of 3 with lr=0.0050219271939474725 and 10000 epochs
2025-05-18_15-46-46
[I 2025-05-18 15:46:46,076] Trial 66 finished with value: 0.0009332784684374928 and parameters: {'n_layers': 4, 'n_units': 41, 'activation': 'elu', 'lr': 0.0050219271939474725, 'optimizer': 'RAdam', 'batch_size': 1792}. Best is trial 63 with value: 0.0007619244861416519.
Training model with params: layers=4, units=50, activation=tanh, optimizer=RAdam, lr=0.0051655077968448485, batchsize=1758
Finish Trainingstep 1 of 3 with lr=0.0051655077968448485 and 1000 epochs
Finish Trainingstep 2 of 3 with lr=0.0051655077968448485 and 1000 epochs
Finish Trainingstep 3 of 3 with lr=0.0051655077968448485 and 10000 epochs
2025-05-18_16-01-20
[I 2025-05-18 16:01:21,029] Trial 67 finished with value: 0.0012376762460917234 and parameters: {'n_layers': 4, 'n_units': 50, 'activation': 'tanh', 'lr': 0.0051655077968448485, 'optimizer': 'RAdam', 'batch_size': 1758}. Best is trial 63 with value: 0.0007619244861416519.
Training model with params: layers=4, units=444, activation=tanh, optimizer=RAdam, lr=0.004557933197921181, batchsize=1753
Finish Trainingstep 1 of 3 with lr=0.004557933197921181 and 1000 epochs
Finish Trainingstep 2 of 3 with lr=0.004557933197921181 and 1000 epochs
Finish Trainingstep 3 of 3 with lr=0.004557933197921181 and 10000 epochs
2025-05-18_16-21-10
[I 2025-05-18 16:21:10,825] Trial 68 finished with value: 0.0034063118509948254 and parameters: {'n_layers': 4, 'n_units': 444, 'activation': 'tanh', 'lr': 0.004557933197921181, 'optimizer': 'RAdam', 'batch_size': 1753}. Best is trial 63 with value: 0.0007619244861416519.
Training model with params: layers=4, units=106, activation=tanh, optimizer=RAdam, lr=0.007410091803986784, batchsize=1892
Finish Trainingstep 1 of 3 with lr=0.007410091803986784 and 1000 epochs
Finish Trainingstep 2 of 3 with lr=0.007410091803986784 and 1000 epochs
Finish Trainingstep 3 of 3 with lr=0.007410091803986784 and 10000 epochs
2025-05-18_16-36-24
[I 2025-05-18 16:36:24,365] Trial 69 finished with value: 0.0026827380061149597 and parameters: {'n_layers': 4, 'n_units': 106, 'activation': 'tanh', 'lr': 0.007410091803986784, 'optimizer': 'RAdam', 'batch_size': 1892}. Best is trial 63 with value: 0.0007619244861416519.
Training model with params: layers=4, units=44, activation=tanh, optimizer=RAdam, lr=0.005795177375179743, batchsize=1971
Finish Trainingstep 1 of 3 with lr=0.005795177375179743 and 1000 epochs
Finish Trainingstep 2 of 3 with lr=0.005795177375179743 and 1000 epochs
Finish Trainingstep 3 of 3 with lr=0.005795177375179743 and 10000 epochs
2025-05-18_16-50-23
[I 2025-05-18 16:50:23,496] Trial 70 finished with value: 0.0010991557501256466 and parameters: {'n_layers': 4, 'n_units': 44, 'activation': 'tanh', 'lr': 0.005795177375179743, 'optimizer': 'RAdam', 'batch_size': 1971}. Best is trial 63 with value: 0.0007619244861416519.
Training model with params: layers=4, units=43, activation=tanh, optimizer=RAdam, lr=0.006492047304095055, batchsize=1996
Finish Trainingstep 1 of 3 with lr=0.006492047304095055 and 1000 epochs
Finish Trainingstep 2 of 3 with lr=0.006492047304095055 and 1000 epochs
Finish Trainingstep 3 of 3 with lr=0.006492047304095055 and 10000 epochs
2025-05-18_17-07-45
[I 2025-05-18 17:07:45,468] Trial 71 finished with value: 0.0008700810139998794 and parameters: {'n_layers': 4, 'n_units': 43, 'activation': 'tanh', 'lr': 0.006492047304095055, 'optimizer': 'RAdam', 'batch_size': 1996}. Best is trial 63 with value: 0.0007619244861416519.
Training model with params: layers=4, units=47, activation=tanh, optimizer=RAdam, lr=0.0060074289857946625, batchsize=1988
Finish Trainingstep 1 of 3 with lr=0.0060074289857946625 and 1000 epochs
Finish Trainingstep 2 of 3 with lr=0.0060074289857946625 and 1000 epochs
Finish Trainingstep 3 of 3 with lr=0.0060074289857946625 and 10000 epochs
2025-05-18_17-27-56
[I 2025-05-18 17:27:56,726] Trial 72 finished with value: 0.0011943094432353973 and parameters: {'n_layers': 4, 'n_units': 47, 'activation': 'tanh', 'lr': 0.0060074289857946625, 'optimizer': 'RAdam', 'batch_size': 1988}. Best is trial 63 with value: 0.0007619244861416519.
Training model with params: layers=4, units=46, activation=tanh, optimizer=RAdam, lr=0.006026324886905546, batchsize=1969
Finish Trainingstep 1 of 3 with lr=0.006026324886905546 and 1000 epochs
Finish Trainingstep 2 of 3 with lr=0.006026324886905546 and 1000 epochs
Finish Trainingstep 3 of 3 with lr=0.006026324886905546 and 10000 epochs
2025-05-18_17-49-02
[I 2025-05-18 17:49:02,593] Trial 73 finished with value: 0.000803055998403579 and parameters: {'n_layers': 4, 'n_units': 46, 'activation': 'tanh', 'lr': 0.006026324886905546, 'optimizer': 'RAdam', 'batch_size': 1969}. Best is trial 63 with value: 0.0007619244861416519.
Training model with params: layers=4, units=83, activation=tanh, optimizer=RAdam, lr=0.006157189321143618, batchsize=1975
Finish Trainingstep 1 of 3 with lr=0.006157189321143618 and 1000 epochs
Finish Trainingstep 2 of 3 with lr=0.006157189321143618 and 1000 epochs
Finish Trainingstep 3 of 3 with lr=0.006157189321143618 and 10000 epochs
2025-05-18_18-03-20
[I 2025-05-18 18:03:20,546] Trial 74 finished with value: 0.002011783653870225 and parameters: {'n_layers': 4, 'n_units': 83, 'activation': 'tanh', 'lr': 0.006157189321143618, 'optimizer': 'RAdam', 'batch_size': 1975}. Best is trial 63 with value: 0.0007619244861416519.
Training model with params: layers=4, units=41, activation=tanh, optimizer=RAdam, lr=0.006194072368141212, batchsize=2000
Finish Trainingstep 1 of 3 with lr=0.006194072368141212 and 1000 epochs
Finish Trainingstep 2 of 3 with lr=0.006194072368141212 and 1000 epochs
Finish Trainingstep 3 of 3 with lr=0.006194072368141212 and 10000 epochs
2025-05-18_18-16-29
[I 2025-05-18 18:16:29,887] Trial 75 finished with value: 0.0012401373824104667 and parameters: {'n_layers': 4, 'n_units': 41, 'activation': 'tanh', 'lr': 0.006194072368141212, 'optimizer': 'RAdam', 'batch_size': 2000}. Best is trial 63 with value: 0.0007619244861416519.
Training model with params: layers=5, units=34, activation=tanh, optimizer=adam, lr=0.008694002504460785, batchsize=1821
Finish Trainingstep 1 of 3 with lr=0.008694002504460785 and 1000 epochs
Finish Trainingstep 2 of 3 with lr=0.008694002504460785 and 1000 epochs
Finish Trainingstep 3 of 3 with lr=0.008694002504460785 and 10000 epochs
2025-05-18_18-31-18
[I 2025-05-18 18:31:18,896] Trial 76 finished with value: 0.0007821464096195996 and parameters: {'n_layers': 5, 'n_units': 34, 'activation': 'tanh', 'lr': 0.008694002504460785, 'optimizer': 'adam', 'batch_size': 1821}. Best is trial 63 with value: 0.0007619244861416519.
Training model with params: layers=5, units=34, activation=tanh, optimizer=adam, lr=0.00871107557403508, batchsize=1899
Finish Trainingstep 1 of 3 with lr=0.00871107557403508 and 1000 epochs
Finish Trainingstep 2 of 3 with lr=0.00871107557403508 and 1000 epochs
Finish Trainingstep 3 of 3 with lr=0.00871107557403508 and 10000 epochs
2025-05-18_18-42-54
[I 2025-05-18 18:42:54,855] Trial 77 finished with value: 0.0010796081041917205 and parameters: {'n_layers': 5, 'n_units': 34, 'activation': 'tanh', 'lr': 0.00871107557403508, 'optimizer': 'adam', 'batch_size': 1899}. Best is trial 63 with value: 0.0007619244861416519.
Training model with params: layers=5, units=33, activation=tanh, optimizer=adam, lr=0.008854413416530661, batchsize=1698
Finish Trainingstep 1 of 3 with lr=0.008854413416530661 and 1000 epochs
Finish Trainingstep 2 of 3 with lr=0.008854413416530661 and 1000 epochs
Finish Trainingstep 3 of 3 with lr=0.008854413416530661 and 10000 epochs
2025-05-18_18-59-29
[I 2025-05-18 18:59:29,885] Trial 78 finished with value: 0.0010079933563247323 and parameters: {'n_layers': 5, 'n_units': 33, 'activation': 'tanh', 'lr': 0.008854413416530661, 'optimizer': 'adam', 'batch_size': 1698}. Best is trial 63 with value: 0.0007619244861416519.
Training model with params: layers=5, units=27, activation=tanh, optimizer=adam, lr=0.009359800348905436, batchsize=1690
Finish Trainingstep 1 of 3 with lr=0.009359800348905436 and 1000 epochs
Finish Trainingstep 2 of 3 with lr=0.009359800348905436 and 1000 epochs
Finish Trainingstep 3 of 3 with lr=0.009359800348905436 and 10000 epochs
2025-05-18_19-22-21
[I 2025-05-18 19:22:21,148] Trial 79 finished with value: 0.0008868206641636789 and parameters: {'n_layers': 5, 'n_units': 27, 'activation': 'tanh', 'lr': 0.009359800348905436, 'optimizer': 'adam', 'batch_size': 1690}. Best is trial 63 with value: 0.0007619244861416519.
Training model with params: layers=6, units=27, activation=tanh, optimizer=adam, lr=0.00921709534368499, batchsize=1683
Finish Trainingstep 1 of 3 with lr=0.00921709534368499 and 1000 epochs
Finish Trainingstep 2 of 3 with lr=0.00921709534368499 and 1000 epochs
Finish Trainingstep 3 of 3 with lr=0.00921709534368499 and 10000 epochs
2025-05-18_19-36-14
[I 2025-05-18 19:36:15,025] Trial 80 finished with value: 0.0012623018119484186 and parameters: {'n_layers': 6, 'n_units': 27, 'activation': 'tanh', 'lr': 0.00921709534368499, 'optimizer': 'adam', 'batch_size': 1683}. Best is trial 63 with value: 0.0007619244861416519.
Training model with params: layers=5, units=31, activation=tanh, optimizer=adam, lr=0.008316390618278621, batchsize=1818
Finish Trainingstep 1 of 3 with lr=0.008316390618278621 and 1000 epochs
Finish Trainingstep 2 of 3 with lr=0.008316390618278621 and 1000 epochs
Finish Trainingstep 3 of 3 with lr=0.008316390618278621 and 10000 epochs
2025-05-18_19-50-49
[I 2025-05-18 19:50:49,354] Trial 81 finished with value: 0.0011979670962318778 and parameters: {'n_layers': 5, 'n_units': 31, 'activation': 'tanh', 'lr': 0.008316390618278621, 'optimizer': 'adam', 'batch_size': 1818}. Best is trial 63 with value: 0.0007619244861416519.
Training model with params: layers=5, units=73, activation=tanh, optimizer=adam, lr=0.008892274880555025, batchsize=1578
Finish Trainingstep 1 of 3 with lr=0.008892274880555025 and 1000 epochs
Finish Trainingstep 2 of 3 with lr=0.008892274880555025 and 1000 epochs
Finish Trainingstep 3 of 3 with lr=0.008892274880555025 and 10000 epochs
2025-05-18_20-05-37
[I 2025-05-18 20:05:37,141] Trial 82 finished with value: 0.002086492720991373 and parameters: {'n_layers': 5, 'n_units': 73, 'activation': 'tanh', 'lr': 0.008892274880555025, 'optimizer': 'adam', 'batch_size': 1578}. Best is trial 63 with value: 0.0007619244861416519.
Training model with params: layers=6, units=17, activation=tanh, optimizer=adam, lr=0.009940690733119829, batchsize=1904
Finish Trainingstep 1 of 3 with lr=0.009940690733119829 and 1000 epochs
Finish Trainingstep 2 of 3 with lr=0.009940690733119829 and 1000 epochs
Finish Trainingstep 3 of 3 with lr=0.009940690733119829 and 10000 epochs
2025-05-18_20-31-37
[I 2025-05-18 20:31:37,275] Trial 83 finished with value: 0.005703356582671404 and parameters: {'n_layers': 6, 'n_units': 17, 'activation': 'tanh', 'lr': 0.009940690733119829, 'optimizer': 'adam', 'batch_size': 1904}. Best is trial 63 with value: 0.0007619244861416519.
Training model with params: layers=5, units=34, activation=tanh, optimizer=adam, lr=0.007119905251112594, batchsize=1698
Finish Trainingstep 1 of 3 with lr=0.007119905251112594 and 1000 epochs
Finish Trainingstep 2 of 3 with lr=0.007119905251112594 and 1000 epochs
Finish Trainingstep 3 of 3 with lr=0.007119905251112594 and 10000 epochs
2025-05-18_20-40-58
[I 2025-05-18 20:40:58,512] Trial 84 finished with value: 0.0014379199128597975 and parameters: {'n_layers': 5, 'n_units': 34, 'activation': 'tanh', 'lr': 0.007119905251112594, 'optimizer': 'adam', 'batch_size': 1698}. Best is trial 63 with value: 0.0007619244861416519.
Training model with params: layers=5, units=63, activation=tanh, optimizer=adam, lr=0.007947045750269846, batchsize=1626
Finish Trainingstep 1 of 3 with lr=0.007947045750269846 and 1000 epochs
Finish Trainingstep 2 of 3 with lr=0.007947045750269846 and 1000 epochs
Finish Trainingstep 3 of 3 with lr=0.007947045750269846 and 10000 epochs
2025-05-18_20-56-28
[I 2025-05-18 20:56:28,765] Trial 85 finished with value: 0.002014828845858574 and parameters: {'n_layers': 5, 'n_units': 63, 'activation': 'tanh', 'lr': 0.007947045750269846, 'optimizer': 'adam', 'batch_size': 1626}. Best is trial 63 with value: 0.0007619244861416519.
Training model with params: layers=6, units=85, activation=tanh, optimizer=adam, lr=0.007045269740144038, batchsize=1917
Finish Trainingstep 1 of 3 with lr=0.007045269740144038 and 1000 epochs
Finish Trainingstep 2 of 3 with lr=0.007045269740144038 and 1000 epochs
Finish Trainingstep 3 of 3 with lr=0.007045269740144038 and 10000 epochs
2025-05-18_21-45-02
[I 2025-05-18 21:45:02,916] Trial 86 finished with value: 0.0023944182321429253 and parameters: {'n_layers': 6, 'n_units': 85, 'activation': 'tanh', 'lr': 0.007045269740144038, 'optimizer': 'adam', 'batch_size': 1917}. Best is trial 63 with value: 0.0007619244861416519.
Training model with params: layers=5, units=30, activation=leaky_relu, optimizer=adam, lr=0.008096336009804878, batchsize=1522
Finish Trainingstep 1 of 3 with lr=0.008096336009804878 and 1000 epochs
Finish Trainingstep 2 of 3 with lr=0.008096336009804878 and 1000 epochs
Finish Trainingstep 3 of 3 with lr=0.008096336009804878 and 10000 epochs
2025-05-18_22-08-53
[I 2025-05-18 22:08:53,693] Trial 87 finished with value: 0.0029611398931592703 and parameters: {'n_layers': 5, 'n_units': 30, 'activation': 'leaky_relu', 'lr': 0.008096336009804878, 'optimizer': 'adam', 'batch_size': 1522}. Best is trial 63 with value: 0.0007619244861416519.
Training model with params: layers=5, units=71, activation=tanh, optimizer=adam, lr=0.008948394592022128, batchsize=1786
Finish Trainingstep 1 of 3 with lr=0.008948394592022128 and 1000 epochs
Finish Trainingstep 2 of 3 with lr=0.008948394592022128 and 1000 epochs
Finish Trainingstep 3 of 3 with lr=0.008948394592022128 and 10000 epochs
2025-05-18_22-40-54
[I 2025-05-18 22:40:54,510] Trial 88 finished with value: 0.0015717585338279605 and parameters: {'n_layers': 5, 'n_units': 71, 'activation': 'tanh', 'lr': 0.008948394592022128, 'optimizer': 'adam', 'batch_size': 1786}. Best is trial 63 with value: 0.0007619244861416519.
Training model with params: layers=5, units=16, activation=tanh, optimizer=adam, lr=0.006659426811008932, batchsize=1868
Finish Trainingstep 1 of 3 with lr=0.006659426811008932 and 1000 epochs
Finish Trainingstep 2 of 3 with lr=0.006659426811008932 and 1000 epochs
Finish Trainingstep 3 of 3 with lr=0.006659426811008932 and 10000 epochs
2025-05-18_23-15-58
[I 2025-05-18 23:15:58,110] Trial 89 finished with value: 0.0014175530523061752 and parameters: {'n_layers': 5, 'n_units': 16, 'activation': 'tanh', 'lr': 0.006659426811008932, 'optimizer': 'adam', 'batch_size': 1868}. Best is trial 63 with value: 0.0007619244861416519.
Training model with params: layers=6, units=101, activation=tanh, optimizer=adam, lr=0.0076720139060810905, batchsize=1805
Finish Trainingstep 1 of 3 with lr=0.0076720139060810905 and 1000 epochs
Finish Trainingstep 2 of 3 with lr=0.0076720139060810905 and 1000 epochs
Finish Trainingstep 3 of 3 with lr=0.0076720139060810905 and 10000 epochs
2025-05-18_23-37-38
[I 2025-05-18 23:37:38,451] Trial 90 finished with value: 0.0022473123390227556 and parameters: {'n_layers': 6, 'n_units': 101, 'activation': 'tanh', 'lr': 0.0076720139060810905, 'optimizer': 'adam', 'batch_size': 1805}. Best is trial 63 with value: 0.0007619244861416519.
Training model with params: layers=4, units=45, activation=tanh, optimizer=adam, lr=0.005755735830998836, batchsize=1949
Finish Trainingstep 1 of 3 with lr=0.005755735830998836 and 1000 epochs
Finish Trainingstep 2 of 3 with lr=0.005755735830998836 and 1000 epochs
Finish Trainingstep 3 of 3 with lr=0.005755735830998836 and 10000 epochs
2025-05-18_23-53-53
[I 2025-05-18 23:53:53,279] Trial 91 finished with value: 0.0009452308295294642 and parameters: {'n_layers': 4, 'n_units': 45, 'activation': 'tanh', 'lr': 0.005755735830998836, 'optimizer': 'adam', 'batch_size': 1949}. Best is trial 63 with value: 0.0007619244861416519.
Training model with params: layers=5, units=57, activation=tanh, optimizer=adam, lr=0.00663495545834847, batchsize=1930
Finish Trainingstep 1 of 3 with lr=0.00663495545834847 and 1000 epochs
Finish Trainingstep 2 of 3 with lr=0.00663495545834847 and 1000 epochs
Finish Trainingstep 3 of 3 with lr=0.00663495545834847 and 10000 epochs
2025-05-19_00-08-48
[I 2025-05-19 00:08:48,949] Trial 92 finished with value: 0.0016602565301582217 and parameters: {'n_layers': 5, 'n_units': 57, 'activation': 'tanh', 'lr': 0.00663495545834847, 'optimizer': 'adam', 'batch_size': 1930}. Best is trial 63 with value: 0.0007619244861416519.
Training model with params: layers=4, units=41, activation=tanh, optimizer=adam, lr=0.008931943284859325, batchsize=1737
Finish Trainingstep 1 of 3 with lr=0.008931943284859325 and 1000 epochs
Finish Trainingstep 2 of 3 with lr=0.008931943284859325 and 1000 epochs
Finish Trainingstep 3 of 3 with lr=0.008931943284859325 and 10000 epochs
2025-05-19_00-21-00
[I 2025-05-19 00:21:00,770] Trial 93 finished with value: 0.0014237425057217479 and parameters: {'n_layers': 4, 'n_units': 41, 'activation': 'tanh', 'lr': 0.008931943284859325, 'optimizer': 'adam', 'batch_size': 1737}. Best is trial 63 with value: 0.0007619244861416519.
Training model with params: layers=5, units=30, activation=relu, optimizer=adam, lr=0.007964861418673277, batchsize=1860
Finish Trainingstep 1 of 3 with lr=0.007964861418673277 and 1000 epochs
Finish Trainingstep 2 of 3 with lr=0.007964861418673277 and 1000 epochs
Finish Trainingstep 3 of 3 with lr=0.007964861418673277 and 10000 epochs
2025-05-19_00-35-42
[I 2025-05-19 00:35:42,586] Trial 94 finished with value: 0.0019345523323863745 and parameters: {'n_layers': 5, 'n_units': 30, 'activation': 'relu', 'lr': 0.007964861418673277, 'optimizer': 'adam', 'batch_size': 1860}. Best is trial 63 with value: 0.0007619244861416519.
Training model with params: layers=4, units=55, activation=swish, optimizer=adam, lr=0.0002452480677165913, batchsize=1703
Finish Trainingstep 1 of 3 with lr=0.0002452480677165913 and 1000 epochs
Finish Trainingstep 2 of 3 with lr=0.0002452480677165913 and 1000 epochs
Finish Trainingstep 3 of 3 with lr=0.0002452480677165913 and 10000 epochs
2025-05-19_01-14-06
[I 2025-05-19 01:14:06,995] Trial 95 finished with value: 0.0014651239616796374 and parameters: {'n_layers': 4, 'n_units': 55, 'activation': 'swish', 'lr': 0.0002452480677165913, 'optimizer': 'adam', 'batch_size': 1703}. Best is trial 63 with value: 0.0007619244861416519.
Training model with params: layers=6, units=79, activation=selu, optimizer=adam, lr=0.004039496134679461, batchsize=1903
Finish Trainingstep 1 of 3 with lr=0.004039496134679461 and 1000 epochs
Finish Trainingstep 2 of 3 with lr=0.004039496134679461 and 1000 epochs
Finish Trainingstep 3 of 3 with lr=0.004039496134679461 and 10000 epochs
2025-05-19_01-28-40
[I 2025-05-19 01:28:40,385] Trial 96 finished with value: 0.0035505779087543488 and parameters: {'n_layers': 6, 'n_units': 79, 'activation': 'selu', 'lr': 0.004039496134679461, 'optimizer': 'adam', 'batch_size': 1903}. Best is trial 63 with value: 0.0007619244861416519.
Training model with params: layers=5, units=69, activation=gelu, optimizer=adam, lr=0.005675923619863386, batchsize=1939
Finish Trainingstep 1 of 3 with lr=0.005675923619863386 and 1000 epochs
Finish Trainingstep 2 of 3 with lr=0.005675923619863386 and 1000 epochs
Finish Trainingstep 3 of 3 with lr=0.005675923619863386 and 10000 epochs
2025-05-19_01-53-32
