nohup: ignoring input
2025-05-16 12:31:34.639391: I tensorflow/core/util/port.cc:110] oneDNN custom operations are on. You may see slightly different numerical results due to floating-point round-off errors from different computation orders. To turn them off, set the environment variable `TF_ENABLE_ONEDNN_OPTS=0`.
2025-05-16 12:31:34.641363: I tensorflow/tsl/cuda/cudart_stub.cc:28] Could not find cuda drivers on your machine, GPU will not be used.
2025-05-16 12:31:34.674968: I tensorflow/tsl/cuda/cudart_stub.cc:28] Could not find cuda drivers on your machine, GPU will not be used.
2025-05-16 12:31:34.675394: I tensorflow/core/platform/cpu_feature_guard.cc:182] This TensorFlow binary is optimized to use available CPU instructions in performance-critical operations.
To enable the following instructions: AVX2 AVX512F AVX512_VNNI AVX512_BF16 FMA, in other operations, rebuild TensorFlow with the appropriate compiler flags.
2025-05-16 12:31:35.630818: W tensorflow/compiler/tf2tensorrt/utils/py_utils.cc:38] TF-TRT Warning: Could not find TensorRT
/home/rhoffmann/.local/lib/python3.10/site-packages/tensorflow_addons/utils/tfa_eol_msg.py:23: UserWarning: 

TensorFlow Addons (TFA) has ended development and introduction of new features.
TFA has entered a minimal maintenance and release mode until a planned end of life in May 2024.
Please modify downstream libraries to take dependencies from other repositories in our TensorFlow community (e.g. Keras, Keras-CV, and Keras-NLP). 

For more information see: https://github.com/tensorflow/addons/issues/2807 

  warnings.warn(
WARNING:tensorflow:From /home/rhoffmann/G3LHalo_python/exampleNotebooks/GMNN_Bayesian_Optimization1.py:53: is_gpu_available (from tensorflow.python.framework.test_util) is deprecated and will be removed in a future version.
Instructions for updating:
Use `tf.config.list_physical_devices('GPU')` instead.
using cpu device 

Number of test samples is 7500, should be 7500
Number of validation samples is 7500, should be 7500
Number of train samples is 35000, should be 35000
/home/rhoffmann/G3LHalo_python/exampleNotebooks/GMNN_Bayesian_Optimization1.py:106: UserWarning: No artists with labels found to put in legend.  Note that artists whose label start with an underscore are ignored when legend() is called with no argument.
  axes.legend()
number of training targets: 35000 . Should be 35000
number of validation targets: 7500 . Should be 7500
number of test targets: 7500 . Should be 7500
Shape of training targets: (3, 35000, 50). Should be (3, 35000, 50)
Shape of testing targets: (3, 7500, 50). Should be (3, 7500, 50)
Shape of validation targets: (3, 7500, 50). Should be (3, 7500, 50)
input min/max: 1.168300956697601e-06 16.999974244680363
number of training features: 35000 . Should be 35000
number of validation features: 7500 . Should be 7500
number of test features: 7500 . Should be 7500
Train Rescaled Shape: (3, 35000, 50)
Test Rescaled Shape: (3, 7500, 50)
Val Rescaled Shape: (3, 7500, 50)
Train Rescaled Shape: (35000, 10)
Test Rescaled Shape: (7500, 10)
Val Rescaled Shape: (7500, 10)
[I 2025-05-16 12:31:46,924] A new study created in memory with name: no-name-d1359708-f2e7-4b48-9b6d-b03619b41b7b
Training model with params: layers=10, units=102, activation=elu, optimizer=rmsprop, lr=0.0009564378938575519, batchsize=921
Finish Trainingstep 1 of 3 with lr=0.0009564378938575519 and 1000 epochs
Finish Trainingstep 2 of 3 with lr=0.0009564378938575519 and 1000 epochs
Finish Trainingstep 3 of 3 with lr=0.0009564378938575519 and 10000 epochs
2025-05-16_13-40-17
[I 2025-05-16 13:40:17,943] Trial 0 finished with value: 0.0024055701214820147 and parameters: {'n_layers': 10, 'n_units': 102, 'activation': 'elu', 'lr': 0.0009564378938575519, 'optimizer': 'rmsprop', 'batch_size': 921}. Best is trial 0 with value: 0.0024055701214820147.
Training model with params: layers=10, units=508, activation=tanh, optimizer=rmsprop, lr=0.00012837072324661502, batchsize=1434
Finish Trainingstep 1 of 3 with lr=0.00012837072324661502 and 1000 epochs
Finish Trainingstep 2 of 3 with lr=0.00012837072324661502 and 1000 epochs
Finish Trainingstep 3 of 3 with lr=0.00012837072324661502 and 10000 epochs
2025-05-16_16-14-54
[I 2025-05-16 16:14:54,376] Trial 1 finished with value: 0.001851314795203507 and parameters: {'n_layers': 10, 'n_units': 508, 'activation': 'tanh', 'lr': 0.00012837072324661502, 'optimizer': 'rmsprop', 'batch_size': 1434}. Best is trial 1 with value: 0.001851314795203507.
Training model with params: layers=3, units=342, activation=swish, optimizer=rmsprop, lr=0.0028312625919432867, batchsize=1602
Finish Trainingstep 1 of 3 with lr=0.0028312625919432867 and 1000 epochs
Finish Trainingstep 2 of 3 with lr=0.0028312625919432867 and 1000 epochs
Finish Trainingstep 3 of 3 with lr=0.0028312625919432867 and 10000 epochs
2025-05-16_17-10-47
[I 2025-05-16 17:10:47,089] Trial 2 finished with value: 0.0016785276820883155 and parameters: {'n_layers': 3, 'n_units': 342, 'activation': 'swish', 'lr': 0.0028312625919432867, 'optimizer': 'rmsprop', 'batch_size': 1602}. Best is trial 2 with value: 0.0016785276820883155.
Training model with params: layers=2, units=95, activation=elu, optimizer=RAdam, lr=0.0023682317537904616, batchsize=1542
Finish Trainingstep 1 of 3 with lr=0.0023682317537904616 and 1000 epochs
Finish Trainingstep 2 of 3 with lr=0.0023682317537904616 and 1000 epochs
Finish Trainingstep 3 of 3 with lr=0.0023682317537904616 and 10000 epochs
2025-05-16_17-43-20
[I 2025-05-16 17:43:20,630] Trial 3 finished with value: 0.0013629584573209286 and parameters: {'n_layers': 2, 'n_units': 95, 'activation': 'elu', 'lr': 0.0023682317537904616, 'optimizer': 'RAdam', 'batch_size': 1542}. Best is trial 3 with value: 0.0013629584573209286.
Training model with params: layers=10, units=335, activation=sigmoid, optimizer=AdamW, lr=0.0015808574318587109, batchsize=1211
Finish Trainingstep 1 of 3 with lr=0.0015808574318587109 and 1000 epochs
Finish Trainingstep 2 of 3 with lr=0.0015808574318587109 and 1000 epochs
Finish Trainingstep 3 of 3 with lr=0.0015808574318587109 and 10000 epochs
2025-05-16_18-05-29
[I 2025-05-16 18:05:29,175] Trial 4 finished with value: 1.025463581085205 and parameters: {'n_layers': 10, 'n_units': 335, 'activation': 'sigmoid', 'lr': 0.0015808574318587109, 'optimizer': 'AdamW', 'batch_size': 1211}. Best is trial 3 with value: 0.0013629584573209286.
Training model with params: layers=5, units=93, activation=leaky_relu, optimizer=RAdam, lr=0.00031323138849731307, batchsize=1093
Finish Trainingstep 1 of 3 with lr=0.00031323138849731307 and 1000 epochs
Finish Trainingstep 2 of 3 with lr=0.00031323138849731307 and 1000 epochs
Finish Trainingstep 3 of 3 with lr=0.00031323138849731307 and 10000 epochs
2025-05-16_18-44-36
[I 2025-05-16 18:44:36,350] Trial 5 finished with value: 0.003563755191862583 and parameters: {'n_layers': 5, 'n_units': 93, 'activation': 'leaky_relu', 'lr': 0.00031323138849731307, 'optimizer': 'RAdam', 'batch_size': 1093}. Best is trial 3 with value: 0.0013629584573209286.
Training model with params: layers=8, units=385, activation=sigmoid, optimizer=rmsprop, lr=0.0012328614788083365, batchsize=96
Finish Trainingstep 1 of 3 with lr=0.0012328614788083365 and 1000 epochs
Finish Trainingstep 2 of 3 with lr=0.0012328614788083365 and 1000 epochs
Finish Trainingstep 3 of 3 with lr=0.0012328614788083365 and 10000 epochs
2025-05-17_05-40-56
[I 2025-05-17 05:40:56,544] Trial 6 finished with value: 0.0033385197166353464 and parameters: {'n_layers': 8, 'n_units': 385, 'activation': 'sigmoid', 'lr': 0.0012328614788083365, 'optimizer': 'rmsprop', 'batch_size': 96}. Best is trial 3 with value: 0.0013629584573209286.
Training model with params: layers=5, units=142, activation=elu, optimizer=sgd, lr=0.00010002226145463836, batchsize=807
Finish Trainingstep 1 of 3 with lr=0.00010002226145463836 and 1000 epochs
Finish Trainingstep 2 of 3 with lr=0.00010002226145463836 and 1000 epochs
Finish Trainingstep 3 of 3 with lr=0.00010002226145463836 and 10000 epochs
2025-05-17_07-25-06
[I 2025-05-17 07:25:06,866] Trial 7 finished with value: 0.2108067274093628 and parameters: {'n_layers': 5, 'n_units': 142, 'activation': 'elu', 'lr': 0.00010002226145463836, 'optimizer': 'sgd', 'batch_size': 807}. Best is trial 3 with value: 0.0013629584573209286.
Training model with params: layers=7, units=503, activation=leaky_relu, optimizer=sgd, lr=0.009315371807216795, batchsize=1117
Finish Trainingstep 1 of 3 with lr=0.009315371807216795 and 1000 epochs
Finish Trainingstep 2 of 3 with lr=0.009315371807216795 and 1000 epochs
Finish Trainingstep 3 of 3 with lr=0.009315371807216795 and 10000 epochs
2025-05-17_10-27-51
[I 2025-05-17 10:27:51,514] Trial 8 finished with value: 0.008852316066622734 and parameters: {'n_layers': 7, 'n_units': 503, 'activation': 'leaky_relu', 'lr': 0.009315371807216795, 'optimizer': 'sgd', 'batch_size': 1117}. Best is trial 3 with value: 0.0013629584573209286.
Training model with params: layers=6, units=103, activation=relu, optimizer=AdamW, lr=0.002000738947239816, batchsize=1224
Finish Trainingstep 1 of 3 with lr=0.002000738947239816 and 1000 epochs
Finish Trainingstep 2 of 3 with lr=0.002000738947239816 and 1000 epochs
Finish Trainingstep 3 of 3 with lr=0.002000738947239816 and 10000 epochs
2025-05-17_10-39-36
[I 2025-05-17 10:39:36,831] Trial 9 finished with value: 0.006653820630162954 and parameters: {'n_layers': 6, 'n_units': 103, 'activation': 'relu', 'lr': 0.002000738947239816, 'optimizer': 'AdamW', 'batch_size': 1224}. Best is trial 3 with value: 0.0013629584573209286.
Training model with params: layers=1, units=207, activation=gelu, optimizer=adam, lr=0.006535067806231773, batchsize=1953
Finish Trainingstep 1 of 3 with lr=0.006535067806231773 and 1000 epochs
Finish Trainingstep 2 of 3 with lr=0.006535067806231773 and 1000 epochs
Finish Trainingstep 3 of 3 with lr=0.006535067806231773 and 10000 epochs
2025-05-17_11-11-19
[I 2025-05-17 11:11:19,957] Trial 10 finished with value: 0.0031549728009849787 and parameters: {'n_layers': 1, 'n_units': 207, 'activation': 'gelu', 'lr': 0.006535067806231773, 'optimizer': 'adam', 'batch_size': 1953}. Best is trial 3 with value: 0.0013629584573209286.
Training model with params: layers=1, units=279, activation=swish, optimizer=RAdam, lr=0.004971784065210506, batchsize=1790
Finish Trainingstep 1 of 3 with lr=0.004971784065210506 and 1000 epochs
Finish Trainingstep 2 of 3 with lr=0.004971784065210506 and 1000 epochs
Finish Trainingstep 3 of 3 with lr=0.004971784065210506 and 10000 epochs
2025-05-17_11-48-47
[I 2025-05-17 11:48:47,450] Trial 11 finished with value: 0.004064194858074188 and parameters: {'n_layers': 1, 'n_units': 279, 'activation': 'swish', 'lr': 0.004971784065210506, 'optimizer': 'RAdam', 'batch_size': 1790}. Best is trial 3 with value: 0.0013629584573209286.
Training model with params: layers=3, units=388, activation=swish, optimizer=RAdam, lr=0.003211664528143048, batchsize=1647
Finish Trainingstep 1 of 3 with lr=0.003211664528143048 and 1000 epochs
Finish Trainingstep 2 of 3 with lr=0.003211664528143048 and 1000 epochs
Finish Trainingstep 3 of 3 with lr=0.003211664528143048 and 10000 epochs
2025-05-17_12-13-07
[I 2025-05-17 12:13:07,585] Trial 12 finished with value: 0.001929428311996162 and parameters: {'n_layers': 3, 'n_units': 388, 'activation': 'swish', 'lr': 0.003211664528143048, 'optimizer': 'RAdam', 'batch_size': 1647}. Best is trial 3 with value: 0.0013629584573209286.
Training model with params: layers=3, units=23, activation=selu, optimizer=adam, lr=0.000505868830039426, batchsize=1556
Finish Trainingstep 1 of 3 with lr=0.000505868830039426 and 1000 epochs
Finish Trainingstep 2 of 3 with lr=0.000505868830039426 and 1000 epochs
Finish Trainingstep 3 of 3 with lr=0.000505868830039426 and 10000 epochs
2025-05-17_12-28-33
[I 2025-05-17 12:28:33,987] Trial 13 finished with value: 0.004534963984042406 and parameters: {'n_layers': 3, 'n_units': 23, 'activation': 'selu', 'lr': 0.000505868830039426, 'optimizer': 'adam', 'batch_size': 1556}. Best is trial 3 with value: 0.0013629584573209286.
Training model with params: layers=3, units=222, activation=elu, optimizer=RAdam, lr=0.0031609522613216864, batchsize=2040
Finish Trainingstep 1 of 3 with lr=0.0031609522613216864 and 1000 epochs
Finish Trainingstep 2 of 3 with lr=0.0031609522613216864 and 1000 epochs
Finish Trainingstep 3 of 3 with lr=0.0031609522613216864 and 10000 epochs
2025-05-17_12-52-33
[I 2025-05-17 12:52:33,533] Trial 14 finished with value: 0.0013181526446714997 and parameters: {'n_layers': 3, 'n_units': 222, 'activation': 'elu', 'lr': 0.0031609522613216864, 'optimizer': 'RAdam', 'batch_size': 2040}. Best is trial 14 with value: 0.0013181526446714997.
Training model with params: layers=2, units=203, activation=elu, optimizer=RAdam, lr=0.0007523823845429305, batchsize=2046
Finish Trainingstep 1 of 3 with lr=0.0007523823845429305 and 1000 epochs
Finish Trainingstep 2 of 3 with lr=0.0007523823845429305 and 1000 epochs
Finish Trainingstep 3 of 3 with lr=0.0007523823845429305 and 10000 epochs
2025-05-17_13-29-42
[I 2025-05-17 13:29:42,560] Trial 15 finished with value: 0.0018949025543406606 and parameters: {'n_layers': 2, 'n_units': 203, 'activation': 'elu', 'lr': 0.0007523823845429305, 'optimizer': 'RAdam', 'batch_size': 2046}. Best is trial 14 with value: 0.0013181526446714997.
Training model with params: layers=4, units=25, activation=elu, optimizer=RAdam, lr=0.0037280411021150903, batchsize=577
Finish Trainingstep 1 of 3 with lr=0.0037280411021150903 and 1000 epochs
Finish Trainingstep 2 of 3 with lr=0.0037280411021150903 and 1000 epochs
Finish Trainingstep 3 of 3 with lr=0.0037280411021150903 and 10000 epochs
2025-05-17_13-43-19
[I 2025-05-17 13:43:19,330] Trial 16 finished with value: 0.0015641778009012341 and parameters: {'n_layers': 4, 'n_units': 25, 'activation': 'elu', 'lr': 0.0037280411021150903, 'optimizer': 'RAdam', 'batch_size': 577}. Best is trial 14 with value: 0.0013181526446714997.
Training model with params: layers=2, units=196, activation=elu, optimizer=RAdam, lr=0.0021408932621538616, batchsize=1832
Finish Trainingstep 1 of 3 with lr=0.0021408932621538616 and 1000 epochs
Finish Trainingstep 2 of 3 with lr=0.0021408932621538616 and 1000 epochs
Finish Trainingstep 3 of 3 with lr=0.0021408932621538616 and 10000 epochs
2025-05-17_14-09-55
[I 2025-05-17 14:09:55,334] Trial 17 finished with value: 0.0016207824228331447 and parameters: {'n_layers': 2, 'n_units': 196, 'activation': 'elu', 'lr': 0.0021408932621538616, 'optimizer': 'RAdam', 'batch_size': 1832}. Best is trial 14 with value: 0.0013181526446714997.
Training model with params: layers=4, units=269, activation=tanh, optimizer=RAdam, lr=0.009880460106588527, batchsize=1373
Finish Trainingstep 1 of 3 with lr=0.009880460106588527 and 1000 epochs
Finish Trainingstep 2 of 3 with lr=0.009880460106588527 and 1000 epochs
Finish Trainingstep 3 of 3 with lr=0.009880460106588527 and 10000 epochs
2025-05-17_14-41-27
[I 2025-05-17 14:41:27,194] Trial 18 finished with value: 0.0049450290389359 and parameters: {'n_layers': 4, 'n_units': 269, 'activation': 'tanh', 'lr': 0.009880460106588527, 'optimizer': 'RAdam', 'batch_size': 1373}. Best is trial 14 with value: 0.0013181526446714997.
Training model with params: layers=2, units=151, activation=selu, optimizer=RAdam, lr=0.00046841877820644006, batchsize=1778
Finish Trainingstep 1 of 3 with lr=0.00046841877820644006 and 1000 epochs
Finish Trainingstep 2 of 3 with lr=0.00046841877820644006 and 1000 epochs
Finish Trainingstep 3 of 3 with lr=0.00046841877820644006 and 10000 epochs
2025-05-17_15-21-06
[I 2025-05-17 15:21:06,434] Trial 19 finished with value: 0.001980141270905733 and parameters: {'n_layers': 2, 'n_units': 151, 'activation': 'selu', 'lr': 0.00046841877820644006, 'optimizer': 'RAdam', 'batch_size': 1778}. Best is trial 14 with value: 0.0013181526446714997.
Training model with params: layers=4, units=157, activation=relu, optimizer=sgd, lr=0.004515496813896895, batchsize=454
Finish Trainingstep 1 of 3 with lr=0.004515496813896895 and 1000 epochs
Finish Trainingstep 2 of 3 with lr=0.004515496813896895 and 1000 epochs
Finish Trainingstep 3 of 3 with lr=0.004515496813896895 and 10000 epochs
2025-05-17_16-36-05
[I 2025-05-17 16:36:05,306] Trial 20 finished with value: 0.01071299146860838 and parameters: {'n_layers': 4, 'n_units': 157, 'activation': 'relu', 'lr': 0.004515496813896895, 'optimizer': 'sgd', 'batch_size': 454}. Best is trial 14 with value: 0.0013181526446714997.
Training model with params: layers=4, units=22, activation=elu, optimizer=RAdam, lr=0.0037013234159298633, batchsize=555
Finish Trainingstep 1 of 3 with lr=0.0037013234159298633 and 1000 epochs
Finish Trainingstep 2 of 3 with lr=0.0037013234159298633 and 1000 epochs
Finish Trainingstep 3 of 3 with lr=0.0037013234159298633 and 10000 epochs
2025-05-17_16-47-33
[I 2025-05-17 16:47:33,041] Trial 21 finished with value: 0.0013489056145772338 and parameters: {'n_layers': 4, 'n_units': 22, 'activation': 'elu', 'lr': 0.0037013234159298633, 'optimizer': 'RAdam', 'batch_size': 555}. Best is trial 14 with value: 0.0013181526446714997.
Training model with params: layers=3, units=61, activation=elu, optimizer=RAdam, lr=0.0021781042767956564, batchsize=101
Finish Trainingstep 1 of 3 with lr=0.0021781042767956564 and 1000 epochs
Finish Trainingstep 2 of 3 with lr=0.0021781042767956564 and 1000 epochs
Finish Trainingstep 3 of 3 with lr=0.0021781042767956564 and 10000 epochs
2025-05-17_17-07-00
[I 2025-05-17 17:07:00,826] Trial 22 finished with value: 0.0017001996748149395 and parameters: {'n_layers': 3, 'n_units': 61, 'activation': 'elu', 'lr': 0.0021781042767956564, 'optimizer': 'RAdam', 'batch_size': 101}. Best is trial 14 with value: 0.0013181526446714997.
Training model with params: layers=6, units=59, activation=elu, optimizer=RAdam, lr=0.006072370964227984, batchsize=425
Finish Trainingstep 1 of 3 with lr=0.006072370964227984 and 1000 epochs
Finish Trainingstep 2 of 3 with lr=0.006072370964227984 and 1000 epochs
Finish Trainingstep 3 of 3 with lr=0.006072370964227984 and 10000 epochs
2025-05-17_17-17-02
[I 2025-05-17 17:17:02,697] Trial 23 finished with value: 0.0015333803603425622 and parameters: {'n_layers': 6, 'n_units': 59, 'activation': 'elu', 'lr': 0.006072370964227984, 'optimizer': 'RAdam', 'batch_size': 425}. Best is trial 14 with value: 0.0013181526446714997.
Training model with params: layers=1, units=63, activation=gelu, optimizer=RAdam, lr=0.002950836180445715, batchsize=710
Finish Trainingstep 1 of 3 with lr=0.002950836180445715 and 1000 epochs
Finish Trainingstep 2 of 3 with lr=0.002950836180445715 and 1000 epochs
Finish Trainingstep 3 of 3 with lr=0.002950836180445715 and 10000 epochs
2025-05-17_17-53-25
[I 2025-05-17 17:53:25,772] Trial 24 finished with value: 0.004376847296953201 and parameters: {'n_layers': 1, 'n_units': 63, 'activation': 'gelu', 'lr': 0.002950836180445715, 'optimizer': 'RAdam', 'batch_size': 710}. Best is trial 14 with value: 0.0013181526446714997.
Training model with params: layers=4, units=234, activation=elu, optimizer=adam, lr=0.0014757911554558753, batchsize=237
Finish Trainingstep 1 of 3 with lr=0.0014757911554558753 and 1000 epochs
Finish Trainingstep 2 of 3 with lr=0.0014757911554558753 and 1000 epochs
Finish Trainingstep 3 of 3 with lr=0.0014757911554558753 and 10000 epochs
2025-05-17_18-46-16
[I 2025-05-17 18:46:17,032] Trial 25 finished with value: 0.0029464401304721832 and parameters: {'n_layers': 4, 'n_units': 234, 'activation': 'elu', 'lr': 0.0014757911554558753, 'optimizer': 'adam', 'batch_size': 237}. Best is trial 14 with value: 0.0013181526446714997.
Training model with params: layers=2, units=16, activation=elu, optimizer=AdamW, lr=0.006513795492590958, batchsize=1357
Finish Trainingstep 1 of 3 with lr=0.006513795492590958 and 1000 epochs
Finish Trainingstep 2 of 3 with lr=0.006513795492590958 and 1000 epochs
Finish Trainingstep 3 of 3 with lr=0.006513795492590958 and 10000 epochs
2025-05-17_18-50-22
[I 2025-05-17 18:50:22,730] Trial 26 finished with value: 0.006373907905071974 and parameters: {'n_layers': 2, 'n_units': 16, 'activation': 'elu', 'lr': 0.006513795492590958, 'optimizer': 'AdamW', 'batch_size': 1357}. Best is trial 14 with value: 0.0013181526446714997.
Training model with params: layers=5, units=126, activation=elu, optimizer=RAdam, lr=0.0024894847595049543, batchsize=927
Finish Trainingstep 1 of 3 with lr=0.0024894847595049543 and 1000 epochs
Finish Trainingstep 2 of 3 with lr=0.0024894847595049543 and 1000 epochs
Finish Trainingstep 3 of 3 with lr=0.0024894847595049543 and 10000 epochs
2025-05-17_19-25-05
[I 2025-05-17 19:25:05,428] Trial 27 finished with value: 0.0019433902343735099 and parameters: {'n_layers': 5, 'n_units': 126, 'activation': 'elu', 'lr': 0.0024894847595049543, 'optimizer': 'RAdam', 'batch_size': 927}. Best is trial 14 with value: 0.0013181526446714997.
Training model with params: layers=3, units=185, activation=elu, optimizer=RAdam, lr=0.004380653032730071, batchsize=1919
Finish Trainingstep 1 of 3 with lr=0.004380653032730071 and 1000 epochs
Finish Trainingstep 2 of 3 with lr=0.004380653032730071 and 1000 epochs
Finish Trainingstep 3 of 3 with lr=0.004380653032730071 and 10000 epochs
2025-05-17_19-40-52
[I 2025-05-17 19:40:52,292] Trial 28 finished with value: 0.0016420470783486962 and parameters: {'n_layers': 3, 'n_units': 185, 'activation': 'elu', 'lr': 0.004380653032730071, 'optimizer': 'RAdam', 'batch_size': 1919}. Best is trial 14 with value: 0.0013181526446714997.
Training model with params: layers=8, units=88, activation=elu, optimizer=RAdam, lr=0.001071047853777859, batchsize=1680
Finish Trainingstep 1 of 3 with lr=0.001071047853777859 and 1000 epochs
Finish Trainingstep 2 of 3 with lr=0.001071047853777859 and 1000 epochs
Finish Trainingstep 3 of 3 with lr=0.001071047853777859 and 10000 epochs
2025-05-17_20-22-46
