[I 2025-05-20 15:54:47,361] Trial 62 finished with value: 0.0009571020491421223 and parameters: {'n_layers': 4, 'n_units': 344, 'activation': 'swish', 'lr': 0.00011998397742135585, 'optimizer': 'adam', 'batch_size': 992}. Best is trial 20 with value: 0.0008192470413632691.
Training model with params: layers=5, units=411, activation=swish, optimizer=adam, lr=0.00011296783619667362, batchsize=182
Finish Trainingstep 1 of 3 with lr=0.00011296783619667362 and 1000 epochs
Finish Trainingstep 2 of 3 with lr=0.00011296783619667362 and 1000 epochs
Finish Trainingstep 3 of 3 with lr=0.00011296783619667362 and 10000 epochs
2025-05-20_20-08-18
[I 2025-05-20 20:08:18,282] Trial 63 finished with value: 0.0010750857181847095 and parameters: {'n_layers': 5, 'n_units': 411, 'activation': 'swish', 'lr': 0.00011296783619667362, 'optimizer': 'adam', 'batch_size': 182}. Best is trial 20 with value: 0.0008192470413632691.
Training model with params: layers=6, units=453, activation=swish, optimizer=adam, lr=0.00014814744752026114, batchsize=798
Finish Trainingstep 1 of 3 with lr=0.00014814744752026114 and 1000 epochs
Finish Trainingstep 2 of 3 with lr=0.00014814744752026114 and 1000 epochs
Finish Trainingstep 3 of 3 with lr=0.00014814744752026114 and 10000 epochs
2025-05-20_22-14-56
[I 2025-05-20 22:14:56,332] Trial 64 finished with value: 0.0010278931586071849 and parameters: {'n_layers': 6, 'n_units': 453, 'activation': 'swish', 'lr': 0.00014814744752026114, 'optimizer': 'adam', 'batch_size': 798}. Best is trial 20 with value: 0.0008192470413632691.
Training model with params: layers=3, units=255, activation=swish, optimizer=adam, lr=0.00010021983489826508, batchsize=1038
Finish Trainingstep 1 of 3 with lr=0.00010021983489826508 and 1000 epochs
Finish Trainingstep 2 of 3 with lr=0.00010021983489826508 and 1000 epochs
Finish Trainingstep 3 of 3 with lr=0.00010021983489826508 and 10000 epochs
2025-05-20_23-31-45
[I 2025-05-20 23:31:45,588] Trial 65 finished with value: 0.001958593726158142 and parameters: {'n_layers': 3, 'n_units': 255, 'activation': 'swish', 'lr': 0.00010021983489826508, 'optimizer': 'adam', 'batch_size': 1038}. Best is trial 20 with value: 0.0008192470413632691.
Training model with params: layers=4, units=434, activation=elu, optimizer=adam, lr=0.0007801097290429224, batchsize=1180
Finish Trainingstep 1 of 3 with lr=0.0007801097290429224 and 1000 epochs
Finish Trainingstep 2 of 3 with lr=0.0007801097290429224 and 1000 epochs
Finish Trainingstep 3 of 3 with lr=0.0007801097290429224 and 10000 epochs
2025-05-21_00-16-07
[I 2025-05-21 00:16:07,237] Trial 66 finished with value: 0.0013231171760708094 and parameters: {'n_layers': 4, 'n_units': 434, 'activation': 'elu', 'lr': 0.0007801097290429224, 'optimizer': 'adam', 'batch_size': 1180}. Best is trial 20 with value: 0.0008192470413632691.
Training model with params: layers=5, units=385, activation=swish, optimizer=adam, lr=0.00014061158069798277, batchsize=901
Finish Trainingstep 1 of 3 with lr=0.00014061158069798277 and 1000 epochs
Finish Trainingstep 2 of 3 with lr=0.00014061158069798277 and 1000 epochs
Finish Trainingstep 3 of 3 with lr=0.00014061158069798277 and 10000 epochs
2025-05-21_01-31-34
[I 2025-05-21 01:31:34,856] Trial 67 finished with value: 0.0012278027134016156 and parameters: {'n_layers': 5, 'n_units': 385, 'activation': 'swish', 'lr': 0.00014061158069798277, 'optimizer': 'adam', 'batch_size': 901}. Best is trial 20 with value: 0.0008192470413632691.
Training model with params: layers=8, units=467, activation=swish, optimizer=sgd, lr=0.00011543604648545253, batchsize=1226
Finish Trainingstep 1 of 3 with lr=0.00011543604648545253 and 1000 epochs
Finish Trainingstep 2 of 3 with lr=0.00011543604648545253 and 1000 epochs
Finish Trainingstep 3 of 3 with lr=0.00011543604648545253 and 10000 epochs
2025-05-21_02-48-04
[I 2025-05-21 02:48:04,347] Trial 68 finished with value: 1.0255143642425537 and parameters: {'n_layers': 8, 'n_units': 467, 'activation': 'swish', 'lr': 0.00011543604648545253, 'optimizer': 'sgd', 'batch_size': 1226}. Best is trial 20 with value: 0.0008192470413632691.
Training model with params: layers=7, units=421, activation=swish, optimizer=rmsprop, lr=0.0001695943732528129, batchsize=1070
Finish Trainingstep 1 of 3 with lr=0.0001695943732528129 and 1000 epochs
Finish Trainingstep 2 of 3 with lr=0.0001695943732528129 and 1000 epochs
Finish Trainingstep 3 of 3 with lr=0.0001695943732528129 and 10000 epochs
2025-05-21_07-30-08
[I 2025-05-21 07:30:08,519] Trial 69 finished with value: 0.0011019767262041569 and parameters: {'n_layers': 7, 'n_units': 421, 'activation': 'swish', 'lr': 0.0001695943732528129, 'optimizer': 'rmsprop', 'batch_size': 1070}. Best is trial 20 with value: 0.0008192470413632691.
Training model with params: layers=6, units=354, activation=selu, optimizer=adam, lr=0.0012266380655075416, batchsize=497
Finish Trainingstep 1 of 3 with lr=0.0012266380655075416 and 1000 epochs
Finish Trainingstep 2 of 3 with lr=0.0012266380655075416 and 1000 epochs
Finish Trainingstep 3 of 3 with lr=0.0012266380655075416 and 10000 epochs
2025-05-21_08-57-31
[I 2025-05-21 08:57:31,484] Trial 70 finished with value: 0.0035926925484091043 and parameters: {'n_layers': 6, 'n_units': 354, 'activation': 'selu', 'lr': 0.0012266380655075416, 'optimizer': 'adam', 'batch_size': 497}. Best is trial 20 with value: 0.0008192470413632691.
Training model with params: layers=6, units=400, activation=swish, optimizer=adam, lr=0.00012367382364497287, batchsize=763
Finish Trainingstep 1 of 3 with lr=0.00012367382364497287 and 1000 epochs
Finish Trainingstep 2 of 3 with lr=0.00012367382364497287 and 1000 epochs
Finish Trainingstep 3 of 3 with lr=0.00012367382364497287 and 10000 epochs
2025-05-21_10-40-00
[I 2025-05-21 10:40:00,944] Trial 71 finished with value: 0.0010786555940285325 and parameters: {'n_layers': 6, 'n_units': 400, 'activation': 'swish', 'lr': 0.00012367382364497287, 'optimizer': 'adam', 'batch_size': 763}. Best is trial 20 with value: 0.0008192470413632691.
Training model with params: layers=7, units=395, activation=gelu, optimizer=adam, lr=0.0001276619576786653, batchsize=710
Finish Trainingstep 1 of 3 with lr=0.0001276619576786653 and 1000 epochs
Finish Trainingstep 2 of 3 with lr=0.0001276619576786653 and 1000 epochs
Finish Trainingstep 3 of 3 with lr=0.0001276619576786653 and 10000 epochs
2025-05-21_14-39-07
[I 2025-05-21 14:39:07,796] Trial 72 finished with value: 0.0010776874842122197 and parameters: {'n_layers': 7, 'n_units': 395, 'activation': 'gelu', 'lr': 0.0001276619576786653, 'optimizer': 'adam', 'batch_size': 710}. Best is trial 20 with value: 0.0008192470413632691.
Training model with params: layers=5, units=447, activation=swish, optimizer=adam, lr=0.00021208317397118263, batchsize=868
Finish Trainingstep 1 of 3 with lr=0.00021208317397118263 and 1000 epochs
Finish Trainingstep 2 of 3 with lr=0.00021208317397118263 and 1000 epochs
Finish Trainingstep 3 of 3 with lr=0.00021208317397118263 and 10000 epochs
2025-05-21_17-13-53
[I 2025-05-21 17:13:54,072] Trial 73 finished with value: 0.0012477198615670204 and parameters: {'n_layers': 5, 'n_units': 447, 'activation': 'swish', 'lr': 0.00021208317397118263, 'optimizer': 'adam', 'batch_size': 868}. Best is trial 20 with value: 0.0008192470413632691.
Training model with params: layers=6, units=377, activation=swish, optimizer=adam, lr=0.00014006881332369542, batchsize=984
Finish Trainingstep 1 of 3 with lr=0.00014006881332369542 and 1000 epochs
Finish Trainingstep 2 of 3 with lr=0.00014006881332369542 and 1000 epochs
Finish Trainingstep 3 of 3 with lr=0.00014006881332369542 and 10000 epochs
2025-05-21_20-20-57
[I 2025-05-21 20:20:57,433] Trial 74 finished with value: 0.0009564338251948357 and parameters: {'n_layers': 6, 'n_units': 377, 'activation': 'swish', 'lr': 0.00014006881332369542, 'optimizer': 'adam', 'batch_size': 984}. Best is trial 20 with value: 0.0008192470413632691.
Training model with params: layers=7, units=406, activation=swish, optimizer=adam, lr=0.00016278223043546806, batchsize=1132
Finish Trainingstep 1 of 3 with lr=0.00016278223043546806 and 1000 epochs
Finish Trainingstep 2 of 3 with lr=0.00016278223043546806 and 1000 epochs
Finish Trainingstep 3 of 3 with lr=0.00016278223043546806 and 10000 epochs
2025-05-21_22-25-46
[I 2025-05-21 22:25:46,724] Trial 75 finished with value: 0.0010985657572746277 and parameters: {'n_layers': 7, 'n_units': 406, 'activation': 'swish', 'lr': 0.00016278223043546806, 'optimizer': 'adam', 'batch_size': 1132}. Best is trial 20 with value: 0.0008192470413632691.
Training model with params: layers=6, units=497, activation=sigmoid, optimizer=adam, lr=0.00010865576960168726, batchsize=638
Finish Trainingstep 1 of 3 with lr=0.00010865576960168726 and 1000 epochs
Finish Trainingstep 2 of 3 with lr=0.00010865576960168726 and 1000 epochs
Finish Trainingstep 3 of 3 with lr=0.00010865576960168726 and 10000 epochs
2025-05-22_04-07-37
[I 2025-05-22 04:07:37,891] Trial 76 finished with value: 0.0011835818877443671 and parameters: {'n_layers': 6, 'n_units': 497, 'activation': 'sigmoid', 'lr': 0.00010865576960168726, 'optimizer': 'adam', 'batch_size': 638}. Best is trial 20 with value: 0.0008192470413632691.
Training model with params: layers=7, units=234, activation=swish, optimizer=RAdam, lr=0.00018774014004152047, batchsize=1021
Finish Trainingstep 1 of 3 with lr=0.00018774014004152047 and 1000 epochs
Finish Trainingstep 2 of 3 with lr=0.00018774014004152047 and 1000 epochs
Finish Trainingstep 3 of 3 with lr=0.00018774014004152047 and 10000 epochs
2025-05-22_06-25-16
[I 2025-05-22 06:25:16,157] Trial 77 finished with value: 0.0009768321178853512 and parameters: {'n_layers': 7, 'n_units': 234, 'activation': 'swish', 'lr': 0.00018774014004152047, 'optimizer': 'RAdam', 'batch_size': 1021}. Best is trial 20 with value: 0.0008192470413632691.
Training model with params: layers=6, units=435, activation=relu, optimizer=AdamW, lr=0.00026588056714402794, batchsize=934
Finish Trainingstep 1 of 3 with lr=0.00026588056714402794 and 1000 epochs
Finish Trainingstep 2 of 3 with lr=0.00026588056714402794 and 1000 epochs
Finish Trainingstep 3 of 3 with lr=0.00026588056714402794 and 10000 epochs
2025-05-22_06-56-14
[I 2025-05-22 06:56:14,811] Trial 78 finished with value: 0.008054540492594242 and parameters: {'n_layers': 6, 'n_units': 435, 'activation': 'relu', 'lr': 0.00026588056714402794, 'optimizer': 'AdamW', 'batch_size': 934}. Best is trial 20 with value: 0.0008192470413632691.
Training model with params: layers=8, units=475, activation=swish, optimizer=adam, lr=0.00011296550045875843, batchsize=768
Finish Trainingstep 1 of 3 with lr=0.00011296550045875843 and 1000 epochs
Finish Trainingstep 2 of 3 with lr=0.00011296550045875843 and 1000 epochs
Finish Trainingstep 3 of 3 with lr=0.00011296550045875843 and 10000 epochs
2025-05-22_10-46-50
[I 2025-05-22 10:46:51,123] Trial 79 finished with value: 0.0008692871779203415 and parameters: {'n_layers': 8, 'n_units': 475, 'activation': 'swish', 'lr': 0.00011296550045875843, 'optimizer': 'adam', 'batch_size': 768}. Best is trial 20 with value: 0.0008192470413632691.
Training model with params: layers=9, units=478, activation=swish, optimizer=adam, lr=0.00011104283741637826, batchsize=1261
Finish Trainingstep 1 of 3 with lr=0.00011104283741637826 and 1000 epochs
Finish Trainingstep 2 of 3 with lr=0.00011104283741637826 and 1000 epochs
Finish Trainingstep 3 of 3 with lr=0.00011104283741637826 and 10000 epochs
2025-05-22_13-41-18
[I 2025-05-22 13:41:18,762] Trial 80 finished with value: 0.0006949075032025576 and parameters: {'n_layers': 9, 'n_units': 478, 'activation': 'swish', 'lr': 0.00011104283741637826, 'optimizer': 'adam', 'batch_size': 1261}. Best is trial 80 with value: 0.0006949075032025576.
Training model with params: layers=9, units=478, activation=swish, optimizer=adam, lr=0.00011185783408543, batchsize=1305
Finish Trainingstep 1 of 3 with lr=0.00011185783408543 and 1000 epochs
Finish Trainingstep 2 of 3 with lr=0.00011185783408543 and 1000 epochs
Finish Trainingstep 3 of 3 with lr=0.00011185783408543 and 10000 epochs
2025-05-22_17-23-47
[I 2025-05-22 17:23:47,565] Trial 81 finished with value: 0.0006900063599459827 and parameters: {'n_layers': 9, 'n_units': 478, 'activation': 'swish', 'lr': 0.00011185783408543, 'optimizer': 'adam', 'batch_size': 1305}. Best is trial 81 with value: 0.0006900063599459827.
Training model with params: layers=9, units=479, activation=swish, optimizer=adam, lr=0.00011399802408549216, batchsize=1270
Finish Trainingstep 1 of 3 with lr=0.00011399802408549216 and 1000 epochs
Finish Trainingstep 2 of 3 with lr=0.00011399802408549216 and 1000 epochs
Finish Trainingstep 3 of 3 with lr=0.00011399802408549216 and 10000 epochs
2025-05-22_20-12-56
[I 2025-05-22 20:12:56,941] Trial 82 finished with value: 0.00083395023830235 and parameters: {'n_layers': 9, 'n_units': 479, 'activation': 'swish', 'lr': 0.00011399802408549216, 'optimizer': 'adam', 'batch_size': 1270}. Best is trial 81 with value: 0.0006900063599459827.
Training model with params: layers=9, units=472, activation=swish, optimizer=adam, lr=0.0001388156983759376, batchsize=1270
Finish Trainingstep 1 of 3 with lr=0.0001388156983759376 and 1000 epochs
Finish Trainingstep 2 of 3 with lr=0.0001388156983759376 and 1000 epochs
Finish Trainingstep 3 of 3 with lr=0.0001388156983759376 and 10000 epochs
2025-05-22_22-53-25
[I 2025-05-22 22:53:26,070] Trial 83 finished with value: 0.0008095033117569983 and parameters: {'n_layers': 9, 'n_units': 472, 'activation': 'swish', 'lr': 0.0001388156983759376, 'optimizer': 'adam', 'batch_size': 1270}. Best is trial 81 with value: 0.0006900063599459827.
Training model with params: layers=10, units=479, activation=swish, optimizer=adam, lr=0.00011163085335154047, batchsize=1524
Finish Trainingstep 1 of 3 with lr=0.00011163085335154047 and 1000 epochs
Finish Trainingstep 2 of 3 with lr=0.00011163085335154047 and 1000 epochs
Finish Trainingstep 3 of 3 with lr=0.00011163085335154047 and 10000 epochs
2025-05-23_02-34-54
[I 2025-05-23 02:34:54,808] Trial 84 finished with value: 0.0005974862142466009 and parameters: {'n_layers': 10, 'n_units': 479, 'activation': 'swish', 'lr': 0.00011163085335154047, 'optimizer': 'adam', 'batch_size': 1524}. Best is trial 84 with value: 0.0005974862142466009.
Training model with params: layers=10, units=510, activation=swish, optimizer=adam, lr=0.00013601730427415196, batchsize=1757
Finish Trainingstep 1 of 3 with lr=0.00013601730427415196 and 1000 epochs
Finish Trainingstep 2 of 3 with lr=0.00013601730427415196 and 1000 epochs
Finish Trainingstep 3 of 3 with lr=0.00013601730427415196 and 10000 epochs
2025-05-23_05-22-07
[I 2025-05-23 05:22:08,122] Trial 85 finished with value: 0.0005673801060765982 and parameters: {'n_layers': 10, 'n_units': 510, 'activation': 'swish', 'lr': 0.00013601730427415196, 'optimizer': 'adam', 'batch_size': 1757}. Best is trial 85 with value: 0.0005673801060765982.
Training model with params: layers=10, units=501, activation=gelu, optimizer=adam, lr=0.00014116646770188937, batchsize=1708
Finish Trainingstep 1 of 3 with lr=0.00014116646770188937 and 1000 epochs
Finish Trainingstep 2 of 3 with lr=0.00014116646770188937 and 1000 epochs
Finish Trainingstep 3 of 3 with lr=0.00014116646770188937 and 10000 epochs
2025-05-23_07-07-28
[I 2025-05-23 07:07:28,886] Trial 86 finished with value: 0.0008323671063408256 and parameters: {'n_layers': 10, 'n_units': 501, 'activation': 'gelu', 'lr': 0.00014116646770188937, 'optimizer': 'adam', 'batch_size': 1708}. Best is trial 85 with value: 0.0005673801060765982.
Training model with params: layers=10, units=509, activation=gelu, optimizer=adam, lr=0.0002204186752613832, batchsize=1743
Finish Trainingstep 1 of 3 with lr=0.0002204186752613832 and 1000 epochs
Finish Trainingstep 2 of 3 with lr=0.0002204186752613832 and 1000 epochs
Finish Trainingstep 3 of 3 with lr=0.0002204186752613832 and 10000 epochs
2025-05-23_09-19-04
[I 2025-05-23 09:19:04,871] Trial 87 finished with value: 0.0008241469622589648 and parameters: {'n_layers': 10, 'n_units': 509, 'activation': 'gelu', 'lr': 0.0002204186752613832, 'optimizer': 'adam', 'batch_size': 1743}. Best is trial 85 with value: 0.0005673801060765982.
Training model with params: layers=10, units=507, activation=gelu, optimizer=adam, lr=0.0001524670314626534, batchsize=1738
Finish Trainingstep 1 of 3 with lr=0.0001524670314626534 and 1000 epochs
Finish Trainingstep 2 of 3 with lr=0.0001524670314626534 and 1000 epochs
Finish Trainingstep 3 of 3 with lr=0.0001524670314626534 and 10000 epochs
2025-05-23_11-33-07
[I 2025-05-23 11:33:07,455] Trial 88 finished with value: 0.0007332648383453488 and parameters: {'n_layers': 10, 'n_units': 507, 'activation': 'gelu', 'lr': 0.0001524670314626534, 'optimizer': 'adam', 'batch_size': 1738}. Best is trial 85 with value: 0.0005673801060765982.
Training model with params: layers=10, units=511, activation=gelu, optimizer=adam, lr=0.007594767264524865, batchsize=1754
Finish Trainingstep 1 of 3 with lr=0.007594767264524865 and 1000 epochs
Finish Trainingstep 2 of 3 with lr=0.007594767264524865 and 1000 epochs
Finish Trainingstep 3 of 3 with lr=0.007594767264524865 and 10000 epochs
2025-05-23_14-19-27
[I 2025-05-23 14:19:27,703] Trial 89 finished with value: 0.005227971822023392 and parameters: {'n_layers': 10, 'n_units': 511, 'activation': 'gelu', 'lr': 0.007594767264524865, 'optimizer': 'adam', 'batch_size': 1754}. Best is trial 85 with value: 0.0005673801060765982.
Training model with params: layers=10, units=498, activation=gelu, optimizer=sgd, lr=0.00022635453958527268, batchsize=1900
Finish Trainingstep 1 of 3 with lr=0.00022635453958527268 and 1000 epochs
Finish Trainingstep 2 of 3 with lr=0.00022635453958527268 and 1000 epochs
Finish Trainingstep 3 of 3 with lr=0.00022635453958527268 and 10000 epochs
2025-05-23_14-56-23
[I 2025-05-23 14:56:23,722] Trial 90 finished with value: 1.0255566835403442 and parameters: {'n_layers': 10, 'n_units': 498, 'activation': 'gelu', 'lr': 0.00022635453958527268, 'optimizer': 'sgd', 'batch_size': 1900}. Best is trial 85 with value: 0.0005673801060765982.
Training model with params: layers=9, units=486, activation=gelu, optimizer=adam, lr=0.0001573664706115278, batchsize=1596
Finish Trainingstep 1 of 3 with lr=0.0001573664706115278 and 1000 epochs
Finish Trainingstep 2 of 3 with lr=0.0001573664706115278 and 1000 epochs
Finish Trainingstep 3 of 3 with lr=0.0001573664706115278 and 10000 epochs
2025-05-23_16-47-08
[I 2025-05-23 16:47:09,213] Trial 91 finished with value: 0.0008359222556464374 and parameters: {'n_layers': 9, 'n_units': 486, 'activation': 'gelu', 'lr': 0.0001573664706115278, 'optimizer': 'adam', 'batch_size': 1596}. Best is trial 85 with value: 0.0005673801060765982.
Training model with params: layers=10, units=512, activation=gelu, optimizer=adam, lr=0.00013938349406603331, batchsize=1673
Finish Trainingstep 1 of 3 with lr=0.00013938349406603331 and 1000 epochs
Finish Trainingstep 2 of 3 with lr=0.00013938349406603331 and 1000 epochs
Finish Trainingstep 3 of 3 with lr=0.00013938349406603331 and 10000 epochs
2025-05-23_19-30-45
[I 2025-05-23 19:30:45,828] Trial 92 finished with value: 0.0007245194865390658 and parameters: {'n_layers': 10, 'n_units': 512, 'activation': 'gelu', 'lr': 0.00013938349406603331, 'optimizer': 'adam', 'batch_size': 1673}. Best is trial 85 with value: 0.0005673801060765982.
Training model with params: layers=10, units=504, activation=gelu, optimizer=adam, lr=0.00014600793450488848, batchsize=1672
Finish Trainingstep 1 of 3 with lr=0.00014600793450488848 and 1000 epochs
Finish Trainingstep 2 of 3 with lr=0.00014600793450488848 and 1000 epochs
Finish Trainingstep 3 of 3 with lr=0.00014600793450488848 and 10000 epochs
2025-05-23_21-20-24
[I 2025-05-23 21:20:24,880] Trial 93 finished with value: 0.0007695364765822887 and parameters: {'n_layers': 10, 'n_units': 504, 'activation': 'gelu', 'lr': 0.00014600793450488848, 'optimizer': 'adam', 'batch_size': 1672}. Best is trial 85 with value: 0.0005673801060765982.
Training model with params: layers=10, units=511, activation=gelu, optimizer=adam, lr=0.00019214033803975375, batchsize=1494
Finish Trainingstep 1 of 3 with lr=0.00019214033803975375 and 1000 epochs
Finish Trainingstep 2 of 3 with lr=0.00019214033803975375 and 1000 epochs
Finish Trainingstep 3 of 3 with lr=0.00019214033803975375 and 10000 epochs
2025-05-24_00-31-47
[I 2025-05-24 00:31:47,626] Trial 94 finished with value: 0.0008040110697038472 and parameters: {'n_layers': 10, 'n_units': 511, 'activation': 'gelu', 'lr': 0.00019214033803975375, 'optimizer': 'adam', 'batch_size': 1494}. Best is trial 85 with value: 0.0005673801060765982.
Training model with params: layers=10, units=492, activation=gelu, optimizer=adam, lr=0.00019488910274344928, batchsize=1531
Finish Trainingstep 1 of 3 with lr=0.00019488910274344928 and 1000 epochs
Finish Trainingstep 2 of 3 with lr=0.00019488910274344928 and 1000 epochs
Finish Trainingstep 3 of 3 with lr=0.00019488910274344928 and 10000 epochs
2025-05-24_02-30-27
[I 2025-05-24 02:30:27,531] Trial 95 finished with value: 0.0007230179035104811 and parameters: {'n_layers': 10, 'n_units': 492, 'activation': 'gelu', 'lr': 0.00019488910274344928, 'optimizer': 'adam', 'batch_size': 1531}. Best is trial 85 with value: 0.0005673801060765982.
Training model with params: layers=10, units=489, activation=gelu, optimizer=adam, lr=0.00019968943909624918, batchsize=1515
Finish Trainingstep 1 of 3 with lr=0.00019968943909624918 and 1000 epochs
Finish Trainingstep 2 of 3 with lr=0.00019968943909624918 and 1000 epochs
Finish Trainingstep 3 of 3 with lr=0.00019968943909624918 and 10000 epochs
2025-05-24_05-53-37
