[I 2025-05-24 05:53:37,955] Trial 96 finished with value: 0.000657938071526587 and parameters: {'n_layers': 10, 'n_units': 489, 'activation': 'gelu', 'lr': 0.00019968943909624918, 'optimizer': 'adam', 'batch_size': 1515}. Best is trial 85 with value: 0.0005673801060765982.
Training model with params: layers=10, units=492, activation=gelu, optimizer=rmsprop, lr=0.00044818957900169597, batchsize=1518
Finish Trainingstep 1 of 3 with lr=0.00044818957900169597 and 1000 epochs
Finish Trainingstep 2 of 3 with lr=0.00044818957900169597 and 1000 epochs
Finish Trainingstep 3 of 3 with lr=0.00044818957900169597 and 10000 epochs
2025-05-24_08-44-37
[I 2025-05-24 08:44:37,570] Trial 97 finished with value: 0.0013155600754544139 and parameters: {'n_layers': 10, 'n_units': 492, 'activation': 'gelu', 'lr': 0.00044818957900169597, 'optimizer': 'rmsprop', 'batch_size': 1518}. Best is trial 85 with value: 0.0005673801060765982.
Training model with params: layers=10, units=487, activation=gelu, optimizer=adam, lr=0.00019726255162325683, batchsize=1622
Finish Trainingstep 1 of 3 with lr=0.00019726255162325683 and 1000 epochs
Finish Trainingstep 2 of 3 with lr=0.00019726255162325683 and 1000 epochs
Finish Trainingstep 3 of 3 with lr=0.00019726255162325683 and 10000 epochs
2025-05-24_10-38-03
[I 2025-05-24 10:38:03,138] Trial 98 finished with value: 0.0007840213365852833 and parameters: {'n_layers': 10, 'n_units': 487, 'activation': 'gelu', 'lr': 0.00019726255162325683, 'optimizer': 'adam', 'batch_size': 1622}. Best is trial 85 with value: 0.0005673801060765982.
Training model with params: layers=10, units=489, activation=gelu, optimizer=RAdam, lr=0.0002860427878112708, batchsize=1878
Finish Trainingstep 1 of 3 with lr=0.0002860427878112708 and 1000 epochs
Finish Trainingstep 2 of 3 with lr=0.0002860427878112708 and 1000 epochs
Finish Trainingstep 3 of 3 with lr=0.0002860427878112708 and 10000 epochs
2025-05-24_13-29-05
[I 2025-05-24 13:29:05,214] Trial 99 finished with value: 0.0008204515906982124 and parameters: {'n_layers': 10, 'n_units': 489, 'activation': 'gelu', 'lr': 0.0002860427878112708, 'optimizer': 'RAdam', 'batch_size': 1878}. Best is trial 85 with value: 0.0005673801060765982.
Beste Parameter:
{'n_layers': 10, 'n_units': 510, 'activation': 'swish', 'lr': 0.00013601730427415196, 'optimizer': 'adam', 'batch_size': 1757}
