[I 2025-05-18 12:51:11,637] Trial 28 finished with value: 0.0009682342642918229 and parameters: {'n_layers': 5, 'n_units': 393, 'activation': 'swish', 'lr': 0.00015643226531125926, 'optimizer': 'adam', 'batch_size': 1033}. Best is trial 20 with value: 0.0008192470413632691.
Training model with params: layers=1, units=290, activation=tanh, optimizer=rmsprop, lr=0.0002483863227014732, batchsize=597
Finish Trainingstep 1 of 3 with lr=0.0002483863227014732 and 1000 epochs
Finish Trainingstep 2 of 3 with lr=0.0002483863227014732 and 1000 epochs
Finish Trainingstep 3 of 3 with lr=0.0002483863227014732 and 10000 epochs
2025-05-18_13-46-13
[I 2025-05-18 13:46:13,723] Trial 29 finished with value: 0.008733759634196758 and parameters: {'n_layers': 1, 'n_units': 290, 'activation': 'tanh', 'lr': 0.0002483863227014732, 'optimizer': 'rmsprop', 'batch_size': 597}. Best is trial 20 with value: 0.0008192470413632691.
Training model with params: layers=9, units=354, activation=elu, optimizer=adam, lr=0.00011960888765713517, batchsize=1563
Finish Trainingstep 1 of 3 with lr=0.00011960888765713517 and 1000 epochs
Finish Trainingstep 2 of 3 with lr=0.00011960888765713517 and 1000 epochs
Finish Trainingstep 3 of 3 with lr=0.00011960888765713517 and 10000 epochs
2025-05-18_15-30-10
[I 2025-05-18 15:30:10,214] Trial 30 finished with value: 0.0016300077550113201 and parameters: {'n_layers': 9, 'n_units': 354, 'activation': 'elu', 'lr': 0.00011960888765713517, 'optimizer': 'adam', 'batch_size': 1563}. Best is trial 20 with value: 0.0008192470413632691.
Training model with params: layers=7, units=422, activation=swish, optimizer=adam, lr=0.00019536639562052051, batchsize=1075
Finish Trainingstep 1 of 3 with lr=0.00019536639562052051 and 1000 epochs
Finish Trainingstep 2 of 3 with lr=0.00019536639562052051 and 1000 epochs
Finish Trainingstep 3 of 3 with lr=0.00019536639562052051 and 10000 epochs
2025-05-18_17-17-22
[I 2025-05-18 17:17:22,802] Trial 31 finished with value: 0.0009581595659255981 and parameters: {'n_layers': 7, 'n_units': 422, 'activation': 'swish', 'lr': 0.00019536639562052051, 'optimizer': 'adam', 'batch_size': 1075}. Best is trial 20 with value: 0.0008192470413632691.
Training model with params: layers=6, units=432, activation=swish, optimizer=adam, lr=0.00014806502643719687, batchsize=1168
Finish Trainingstep 1 of 3 with lr=0.00014806502643719687 and 1000 epochs
Finish Trainingstep 2 of 3 with lr=0.00014806502643719687 and 1000 epochs
Finish Trainingstep 3 of 3 with lr=0.00014806502643719687 and 10000 epochs
2025-05-18_18-39-05
[I 2025-05-18 18:39:05,386] Trial 32 finished with value: 0.0011559923877939582 and parameters: {'n_layers': 6, 'n_units': 432, 'activation': 'swish', 'lr': 0.00014806502643719687, 'optimizer': 'adam', 'batch_size': 1168}. Best is trial 20 with value: 0.0008192470413632691.
Training model with params: layers=8, units=477, activation=swish, optimizer=AdamW, lr=0.00010035299390314276, batchsize=832
Finish Trainingstep 1 of 3 with lr=0.00010035299390314276 and 1000 epochs
Finish Trainingstep 2 of 3 with lr=0.00010035299390314276 and 1000 epochs
Finish Trainingstep 3 of 3 with lr=0.00010035299390314276 and 10000 epochs
2025-05-18_19-26-07
[I 2025-05-18 19:26:07,322] Trial 33 finished with value: 0.005875183269381523 and parameters: {'n_layers': 8, 'n_units': 477, 'activation': 'swish', 'lr': 0.00010035299390314276, 'optimizer': 'AdamW', 'batch_size': 832}. Best is trial 20 with value: 0.0008192470413632691.
Training model with params: layers=6, units=441, activation=swish, optimizer=adam, lr=0.0003425463336911261, batchsize=1313
Finish Trainingstep 1 of 3 with lr=0.0003425463336911261 and 1000 epochs
Finish Trainingstep 2 of 3 with lr=0.0003425463336911261 and 1000 epochs
Finish Trainingstep 3 of 3 with lr=0.0003425463336911261 and 10000 epochs
2025-05-18_20-40-06
[I 2025-05-18 20:40:06,372] Trial 34 finished with value: 0.0010363934561610222 and parameters: {'n_layers': 6, 'n_units': 441, 'activation': 'swish', 'lr': 0.0003425463336911261, 'optimizer': 'adam', 'batch_size': 1313}. Best is trial 20 with value: 0.0008192470413632691.
Training model with params: layers=7, units=408, activation=swish, optimizer=AdamW, lr=0.0001472475626100647, batchsize=998
Finish Trainingstep 1 of 3 with lr=0.0001472475626100647 and 1000 epochs
Finish Trainingstep 2 of 3 with lr=0.0001472475626100647 and 1000 epochs
Finish Trainingstep 3 of 3 with lr=0.0001472475626100647 and 10000 epochs
2025-05-18_21-57-39
[I 2025-05-18 21:57:39,149] Trial 35 finished with value: 0.005068499594926834 and parameters: {'n_layers': 7, 'n_units': 408, 'activation': 'swish', 'lr': 0.0001472475626100647, 'optimizer': 'AdamW', 'batch_size': 998}. Best is trial 20 with value: 0.0008192470413632691.
Training model with params: layers=1, units=369, activation=swish, optimizer=adam, lr=0.0002148381733450582, batchsize=1476
Finish Trainingstep 1 of 3 with lr=0.0002148381733450582 and 1000 epochs
Finish Trainingstep 2 of 3 with lr=0.0002148381733450582 and 1000 epochs
Finish Trainingstep 3 of 3 with lr=0.0002148381733450582 and 10000 epochs
2025-05-18_23-21-02
[I 2025-05-18 23:21:02,867] Trial 36 finished with value: 0.012431922368705273 and parameters: {'n_layers': 1, 'n_units': 369, 'activation': 'swish', 'lr': 0.0002148381733450582, 'optimizer': 'adam', 'batch_size': 1476}. Best is trial 20 with value: 0.0008192470413632691.
Training model with params: layers=4, units=485, activation=swish, optimizer=rmsprop, lr=0.0002880217041317378, batchsize=707
Finish Trainingstep 1 of 3 with lr=0.0002880217041317378 and 1000 epochs
Finish Trainingstep 2 of 3 with lr=0.0002880217041317378 and 1000 epochs
Finish Trainingstep 3 of 3 with lr=0.0002880217041317378 and 10000 epochs
2025-05-19_02-25-56
[I 2025-05-19 02:25:56,987] Trial 37 finished with value: 0.001298199174925685 and parameters: {'n_layers': 4, 'n_units': 485, 'activation': 'swish', 'lr': 0.0002880217041317378, 'optimizer': 'rmsprop', 'batch_size': 707}. Best is trial 20 with value: 0.0008192470413632691.
Training model with params: layers=8, units=403, activation=leaky_relu, optimizer=RAdam, lr=0.00016694847131074945, batchsize=1680
Finish Trainingstep 1 of 3 with lr=0.00016694847131074945 and 1000 epochs
Finish Trainingstep 2 of 3 with lr=0.00016694847131074945 and 1000 epochs
Finish Trainingstep 3 of 3 with lr=0.00016694847131074945 and 10000 epochs
2025-05-19_04-20-40
[I 2025-05-19 04:20:40,432] Trial 38 finished with value: 0.0068962108343839645 and parameters: {'n_layers': 8, 'n_units': 403, 'activation': 'leaky_relu', 'lr': 0.00016694847131074945, 'optimizer': 'RAdam', 'batch_size': 1680}. Best is trial 20 with value: 0.0008192470413632691.
Training model with params: layers=9, units=449, activation=sigmoid, optimizer=sgd, lr=0.005662726583866417, batchsize=457
Finish Trainingstep 1 of 3 with lr=0.005662726583866417 and 1000 epochs
Finish Trainingstep 2 of 3 with lr=0.005662726583866417 and 1000 epochs
Finish Trainingstep 3 of 3 with lr=0.005662726583866417 and 10000 epochs
2025-05-19_04-59-06
[I 2025-05-19 04:59:06,537] Trial 39 finished with value: 1.0255095958709717 and parameters: {'n_layers': 9, 'n_units': 449, 'activation': 'sigmoid', 'lr': 0.005662726583866417, 'optimizer': 'sgd', 'batch_size': 457}. Best is trial 20 with value: 0.0008192470413632691.
Training model with params: layers=6, units=417, activation=selu, optimizer=AdamW, lr=0.00013142029964403483, batchsize=1117
Finish Trainingstep 1 of 3 with lr=0.00013142029964403483 and 1000 epochs
Finish Trainingstep 2 of 3 with lr=0.00013142029964403483 and 1000 epochs
Finish Trainingstep 3 of 3 with lr=0.00013142029964403483 and 10000 epochs
2025-05-19_05-24-19
[I 2025-05-19 05:24:20,009] Trial 40 finished with value: 0.0052416580729186535 and parameters: {'n_layers': 6, 'n_units': 417, 'activation': 'selu', 'lr': 0.00013142029964403483, 'optimizer': 'AdamW', 'batch_size': 1117}. Best is trial 20 with value: 0.0008192470413632691.
Training model with params: layers=7, units=37, activation=swish, optimizer=adam, lr=0.00019375408371179862, batchsize=1087
Finish Trainingstep 1 of 3 with lr=0.00019375408371179862 and 1000 epochs
Finish Trainingstep 2 of 3 with lr=0.00019375408371179862 and 1000 epochs
Finish Trainingstep 3 of 3 with lr=0.00019375408371179862 and 10000 epochs
2025-05-19_06-36-57
[I 2025-05-19 06:36:57,552] Trial 41 finished with value: 0.0013677768874913454 and parameters: {'n_layers': 7, 'n_units': 37, 'activation': 'swish', 'lr': 0.00019375408371179862, 'optimizer': 'adam', 'batch_size': 1087}. Best is trial 20 with value: 0.0008192470413632691.
Training model with params: layers=7, units=511, activation=swish, optimizer=adam, lr=0.00018280298775662378, batchsize=948
Finish Trainingstep 1 of 3 with lr=0.00018280298775662378 and 1000 epochs
Finish Trainingstep 2 of 3 with lr=0.00018280298775662378 and 1000 epochs
Finish Trainingstep 3 of 3 with lr=0.00018280298775662378 and 10000 epochs
2025-05-19_07-47-42
[I 2025-05-19 07:47:42,258] Trial 42 finished with value: 0.0011054578935727477 and parameters: {'n_layers': 7, 'n_units': 511, 'activation': 'swish', 'lr': 0.00018280298775662378, 'optimizer': 'adam', 'batch_size': 948}. Best is trial 20 with value: 0.0008192470413632691.
Training model with params: layers=6, units=428, activation=swish, optimizer=adam, lr=0.00012303198626260884, batchsize=1023
Finish Trainingstep 1 of 3 with lr=0.00012303198626260884 and 1000 epochs
Finish Trainingstep 2 of 3 with lr=0.00012303198626260884 and 1000 epochs
Finish Trainingstep 3 of 3 with lr=0.00012303198626260884 and 10000 epochs
2025-05-19_09-47-32
[I 2025-05-19 09:47:32,191] Trial 43 finished with value: 0.0009255401673726737 and parameters: {'n_layers': 6, 'n_units': 428, 'activation': 'swish', 'lr': 0.00012303198626260884, 'optimizer': 'adam', 'batch_size': 1023}. Best is trial 20 with value: 0.0008192470413632691.
Training model with params: layers=6, units=466, activation=relu, optimizer=adam, lr=0.00012796725492924245, batchsize=845
Finish Trainingstep 1 of 3 with lr=0.00012796725492924245 and 1000 epochs
Finish Trainingstep 2 of 3 with lr=0.00012796725492924245 and 1000 epochs
Finish Trainingstep 3 of 3 with lr=0.00012796725492924245 and 10000 epochs
2025-05-19_12-53-48
[I 2025-05-19 12:53:49,080] Trial 44 finished with value: 0.00717688025906682 and parameters: {'n_layers': 6, 'n_units': 466, 'activation': 'relu', 'lr': 0.00012796725492924245, 'optimizer': 'adam', 'batch_size': 845}. Best is trial 20 with value: 0.0008192470413632691.
Training model with params: layers=5, units=378, activation=swish, optimizer=adam, lr=0.0001023873914707411, batchsize=981
Finish Trainingstep 1 of 3 with lr=0.0001023873914707411 and 1000 epochs
Finish Trainingstep 2 of 3 with lr=0.0001023873914707411 and 1000 epochs
Finish Trainingstep 3 of 3 with lr=0.0001023873914707411 and 10000 epochs
2025-05-19_15-52-42
[I 2025-05-19 15:52:42,428] Trial 45 finished with value: 0.0009545341017656028 and parameters: {'n_layers': 5, 'n_units': 378, 'activation': 'swish', 'lr': 0.0001023873914707411, 'optimizer': 'adam', 'batch_size': 981}. Best is trial 20 with value: 0.0008192470413632691.
Training model with params: layers=8, units=446, activation=leaky_relu, optimizer=RAdam, lr=0.00041167606153372726, batchsize=1287
Finish Trainingstep 1 of 3 with lr=0.00041167606153372726 and 1000 epochs
Finish Trainingstep 2 of 3 with lr=0.00041167606153372726 and 1000 epochs
Finish Trainingstep 3 of 3 with lr=0.00041167606153372726 and 10000 epochs
2025-05-19_16-48-22
[I 2025-05-19 16:48:22,777] Trial 46 finished with value: 0.0055568283423781395 and parameters: {'n_layers': 8, 'n_units': 446, 'activation': 'leaky_relu', 'lr': 0.00041167606153372726, 'optimizer': 'RAdam', 'batch_size': 1287}. Best is trial 20 with value: 0.0008192470413632691.
Training model with params: layers=6, units=485, activation=tanh, optimizer=adam, lr=0.00025798506884172514, batchsize=1448
Finish Trainingstep 1 of 3 with lr=0.00025798506884172514 and 1000 epochs
Finish Trainingstep 2 of 3 with lr=0.00025798506884172514 and 1000 epochs
Finish Trainingstep 3 of 3 with lr=0.00025798506884172514 and 10000 epochs
2025-05-19_17-38-45
[I 2025-05-19 17:38:45,998] Trial 47 finished with value: 0.0022629776503890753 and parameters: {'n_layers': 6, 'n_units': 485, 'activation': 'tanh', 'lr': 0.00025798506884172514, 'optimizer': 'adam', 'batch_size': 1448}. Best is trial 20 with value: 0.0008192470413632691.
Training model with params: layers=8, units=423, activation=elu, optimizer=adam, lr=0.00012505908933612138, batchsize=1184
Finish Trainingstep 1 of 3 with lr=0.00012505908933612138 and 1000 epochs
Finish Trainingstep 2 of 3 with lr=0.00012505908933612138 and 1000 epochs
Finish Trainingstep 3 of 3 with lr=0.00012505908933612138 and 10000 epochs
2025-05-19_18-36-29
[I 2025-05-19 18:36:29,581] Trial 48 finished with value: 0.0014503455022349954 and parameters: {'n_layers': 8, 'n_units': 423, 'activation': 'elu', 'lr': 0.00012505908933612138, 'optimizer': 'adam', 'batch_size': 1184}. Best is trial 20 with value: 0.0008192470413632691.
Training model with params: layers=2, units=337, activation=selu, optimizer=adam, lr=0.0001511190899659867, batchsize=599
Finish Trainingstep 1 of 3 with lr=0.0001511190899659867 and 1000 epochs
Finish Trainingstep 2 of 3 with lr=0.0001511190899659867 and 1000 epochs
Finish Trainingstep 3 of 3 with lr=0.0001511190899659867 and 10000 epochs
2025-05-19_20-04-11
[I 2025-05-19 20:04:11,871] Trial 49 finished with value: 0.0028323447331786156 and parameters: {'n_layers': 2, 'n_units': 337, 'activation': 'selu', 'lr': 0.0001511190899659867, 'optimizer': 'adam', 'batch_size': 599}. Best is trial 20 with value: 0.0008192470413632691.
Training model with params: layers=4, units=300, activation=swish, optimizer=RAdam, lr=0.00024081333202222407, batchsize=1325
Finish Trainingstep 1 of 3 with lr=0.00024081333202222407 and 1000 epochs
Finish Trainingstep 2 of 3 with lr=0.00024081333202222407 and 1000 epochs
Finish Trainingstep 3 of 3 with lr=0.00024081333202222407 and 10000 epochs
2025-05-19_20-58-20
[I 2025-05-19 20:58:20,601] Trial 50 finished with value: 0.0011195441475138068 and parameters: {'n_layers': 4, 'n_units': 300, 'activation': 'swish', 'lr': 0.00024081333202222407, 'optimizer': 'RAdam', 'batch_size': 1325}. Best is trial 20 with value: 0.0008192470413632691.
Training model with params: layers=5, units=370, activation=swish, optimizer=adam, lr=0.00010309569430142161, batchsize=965
Finish Trainingstep 1 of 3 with lr=0.00010309569430142161 and 1000 epochs
Finish Trainingstep 2 of 3 with lr=0.00010309569430142161 and 1000 epochs
Finish Trainingstep 3 of 3 with lr=0.00010309569430142161 and 10000 epochs
2025-05-19_22-39-48
[I 2025-05-19 22:39:48,968] Trial 51 finished with value: 0.001040694653056562 and parameters: {'n_layers': 5, 'n_units': 370, 'activation': 'swish', 'lr': 0.00010309569430142161, 'optimizer': 'adam', 'batch_size': 965}. Best is trial 20 with value: 0.0008192470413632691.
Training model with params: layers=5, units=390, activation=swish, optimizer=adam, lr=0.00012725190163868057, batchsize=789
Finish Trainingstep 1 of 3 with lr=0.00012725190163868057 and 1000 epochs
Finish Trainingstep 2 of 3 with lr=0.00012725190163868057 and 1000 epochs
Finish Trainingstep 3 of 3 with lr=0.00012725190163868057 and 10000 epochs
2025-05-20_00-26-21
[I 2025-05-20 00:26:21,588] Trial 52 finished with value: 0.0008411878952756524 and parameters: {'n_layers': 5, 'n_units': 390, 'activation': 'swish', 'lr': 0.00012725190163868057, 'optimizer': 'adam', 'batch_size': 789}. Best is trial 20 with value: 0.0008192470413632691.
Training model with params: layers=6, units=401, activation=swish, optimizer=adam, lr=0.00012516424672012947, batchsize=758
Finish Trainingstep 1 of 3 with lr=0.00012516424672012947 and 1000 epochs
Finish Trainingstep 2 of 3 with lr=0.00012516424672012947 and 1000 epochs
Finish Trainingstep 3 of 3 with lr=0.00012516424672012947 and 10000 epochs
2025-05-20_02-35-11
[I 2025-05-20 02:35:11,361] Trial 53 finished with value: 0.0009557995363138616 and parameters: {'n_layers': 6, 'n_units': 401, 'activation': 'swish', 'lr': 0.00012516424672012947, 'optimizer': 'adam', 'batch_size': 758}. Best is trial 20 with value: 0.0008192470413632691.
Training model with params: layers=3, units=458, activation=swish, optimizer=adam, lr=0.00016072534107455683, batchsize=896
Finish Trainingstep 1 of 3 with lr=0.00016072534107455683 and 1000 epochs
Finish Trainingstep 2 of 3 with lr=0.00016072534107455683 and 1000 epochs
Finish Trainingstep 3 of 3 with lr=0.00016072534107455683 and 10000 epochs
2025-05-20_04-03-12
[I 2025-05-20 04:03:12,908] Trial 54 finished with value: 0.0013113610912114382 and parameters: {'n_layers': 3, 'n_units': 458, 'activation': 'swish', 'lr': 0.00016072534107455683, 'optimizer': 'adam', 'batch_size': 896}. Best is trial 20 with value: 0.0008192470413632691.
Training model with params: layers=7, units=157, activation=swish, optimizer=sgd, lr=0.001905584943520538, batchsize=820
Finish Trainingstep 1 of 3 with lr=0.001905584943520538 and 1000 epochs
Finish Trainingstep 2 of 3 with lr=0.001905584943520538 and 1000 epochs
Finish Trainingstep 3 of 3 with lr=0.001905584943520538 and 10000 epochs
2025-05-20_07-35-50
[I 2025-05-20 07:35:50,093] Trial 55 finished with value: 0.21120207011699677 and parameters: {'n_layers': 7, 'n_units': 157, 'activation': 'swish', 'lr': 0.001905584943520538, 'optimizer': 'sgd', 'batch_size': 820}. Best is trial 20 with value: 0.0008192470413632691.
Training model with params: layers=5, units=431, activation=relu, optimizer=adam, lr=0.0033732714419369126, batchsize=669
Finish Trainingstep 1 of 3 with lr=0.0033732714419369126 and 1000 epochs
Finish Trainingstep 2 of 3 with lr=0.0033732714419369126 and 1000 epochs
Finish Trainingstep 3 of 3 with lr=0.0033732714419369126 and 10000 epochs
2025-05-20_08-06-56
[I 2025-05-20 08:06:56,310] Trial 56 finished with value: 0.004964729771018028 and parameters: {'n_layers': 5, 'n_units': 431, 'activation': 'relu', 'lr': 0.0033732714419369126, 'optimizer': 'adam', 'batch_size': 669}. Best is trial 20 with value: 0.0008192470413632691.
Training model with params: layers=9, units=476, activation=sigmoid, optimizer=rmsprop, lr=0.00020656126202460909, batchsize=1036
Finish Trainingstep 1 of 3 with lr=0.00020656126202460909 and 1000 epochs
Finish Trainingstep 2 of 3 with lr=0.00020656126202460909 and 1000 epochs
Finish Trainingstep 3 of 3 with lr=0.00020656126202460909 and 10000 epochs
2025-05-20_08-40-54
[I 2025-05-20 08:40:54,868] Trial 57 finished with value: 1.0254343748092651 and parameters: {'n_layers': 9, 'n_units': 476, 'activation': 'sigmoid', 'lr': 0.00020656126202460909, 'optimizer': 'rmsprop', 'batch_size': 1036}. Best is trial 20 with value: 0.0008192470413632691.
Training model with params: layers=6, units=493, activation=swish, optimizer=adam, lr=0.00011758531331129412, batchsize=1238
Finish Trainingstep 1 of 3 with lr=0.00011758531331129412 and 1000 epochs
Finish Trainingstep 2 of 3 with lr=0.00011758531331129412 and 1000 epochs
Finish Trainingstep 3 of 3 with lr=0.00011758531331129412 and 10000 epochs
2025-05-20_10-23-19
[I 2025-05-20 10:23:19,133] Trial 58 finished with value: 0.001147305709309876 and parameters: {'n_layers': 6, 'n_units': 493, 'activation': 'swish', 'lr': 0.00011758531331129412, 'optimizer': 'adam', 'batch_size': 1238}. Best is trial 20 with value: 0.0008192470413632691.
Training model with params: layers=8, units=390, activation=tanh, optimizer=adam, lr=0.00013913111897838513, batchsize=1134
Finish Trainingstep 1 of 3 with lr=0.00013913111897838513 and 1000 epochs
Finish Trainingstep 2 of 3 with lr=0.00013913111897838513 and 1000 epochs
Finish Trainingstep 3 of 3 with lr=0.00013913111897838513 and 10000 epochs
2025-05-20_11-30-12
[I 2025-05-20 11:30:12,911] Trial 59 finished with value: 0.0014613167149946094 and parameters: {'n_layers': 8, 'n_units': 390, 'activation': 'tanh', 'lr': 0.00013913111897838513, 'optimizer': 'adam', 'batch_size': 1134}. Best is trial 20 with value: 0.0008192470413632691.
Training model with params: layers=7, units=314, activation=leaky_relu, optimizer=AdamW, lr=0.00017735426365160728, batchsize=1384
Finish Trainingstep 1 of 3 with lr=0.00017735426365160728 and 1000 epochs
Finish Trainingstep 2 of 3 with lr=0.00017735426365160728 and 1000 epochs
Finish Trainingstep 3 of 3 with lr=0.00017735426365160728 and 10000 epochs
2025-05-20_11-51-16
[I 2025-05-20 11:51:16,255] Trial 60 finished with value: 0.006811995059251785 and parameters: {'n_layers': 7, 'n_units': 314, 'activation': 'leaky_relu', 'lr': 0.00017735426365160728, 'optimizer': 'AdamW', 'batch_size': 1384}. Best is trial 20 with value: 0.0008192470413632691.
Training model with params: layers=5, units=371, activation=swish, optimizer=adam, lr=0.00010081584957933858, batchsize=929
Finish Trainingstep 1 of 3 with lr=0.00010081584957933858 and 1000 epochs
Finish Trainingstep 2 of 3 with lr=0.00010081584957933858 and 1000 epochs
Finish Trainingstep 3 of 3 with lr=0.00010081584957933858 and 10000 epochs
2025-05-20_14-09-09
[I 2025-05-20 14:09:09,296] Trial 61 finished with value: 0.0010457680327817798 and parameters: {'n_layers': 5, 'n_units': 371, 'activation': 'swish', 'lr': 0.00010081584957933858, 'optimizer': 'adam', 'batch_size': 929}. Best is trial 20 with value: 0.0008192470413632691.
Training model with params: layers=4, units=344, activation=swish, optimizer=adam, lr=0.00011998397742135585, batchsize=992
Finish Trainingstep 1 of 3 with lr=0.00011998397742135585 and 1000 epochs
Finish Trainingstep 2 of 3 with lr=0.00011998397742135585 and 1000 epochs
Finish Trainingstep 3 of 3 with lr=0.00011998397742135585 and 10000 epochs
2025-05-20_15-54-47
