nohup: ignoring input
2025-05-16 12:31:38.600575: I tensorflow/core/util/port.cc:110] oneDNN custom operations are on. You may see slightly different numerical results due to floating-point round-off errors from different computation orders. To turn them off, set the environment variable `TF_ENABLE_ONEDNN_OPTS=0`.
2025-05-16 12:31:38.602816: I tensorflow/tsl/cuda/cudart_stub.cc:28] Could not find cuda drivers on your machine, GPU will not be used.
2025-05-16 12:31:38.640497: I tensorflow/tsl/cuda/cudart_stub.cc:28] Could not find cuda drivers on your machine, GPU will not be used.
2025-05-16 12:31:38.641012: I tensorflow/core/platform/cpu_feature_guard.cc:182] This TensorFlow binary is optimized to use available CPU instructions in performance-critical operations.
To enable the following instructions: AVX2 AVX512F AVX512_VNNI AVX512_BF16 FMA, in other operations, rebuild TensorFlow with the appropriate compiler flags.
2025-05-16 12:31:39.719575: W tensorflow/compiler/tf2tensorrt/utils/py_utils.cc:38] TF-TRT Warning: Could not find TensorRT
/home/rhoffmann/.local/lib/python3.10/site-packages/tensorflow_addons/utils/tfa_eol_msg.py:23: UserWarning: 

TensorFlow Addons (TFA) has ended development and introduction of new features.
TFA has entered a minimal maintenance and release mode until a planned end of life in May 2024.
Please modify downstream libraries to take dependencies from other repositories in our TensorFlow community (e.g. Keras, Keras-CV, and Keras-NLP). 

For more information see: https://github.com/tensorflow/addons/issues/2807 

  warnings.warn(
WARNING:tensorflow:From /home/rhoffmann/G3LHalo_python/exampleNotebooks/GMNN_Bayesian_Optimization1.py:53: is_gpu_available (from tensorflow.python.framework.test_util) is deprecated and will be removed in a future version.
Instructions for updating:
Use `tf.config.list_physical_devices('GPU')` instead.
using cpu device 

Number of test samples is 7500, should be 7500
Number of validation samples is 7500, should be 7500
Number of train samples is 35000, should be 35000
/home/rhoffmann/G3LHalo_python/exampleNotebooks/GMNN_Bayesian_Optimization1.py:106: UserWarning: No artists with labels found to put in legend.  Note that artists whose label start with an underscore are ignored when legend() is called with no argument.
  axes.legend()
number of training targets: 35000 . Should be 35000
number of validation targets: 7500 . Should be 7500
number of test targets: 7500 . Should be 7500
Shape of training targets: (3, 35000, 50). Should be (3, 35000, 50)
Shape of testing targets: (3, 7500, 50). Should be (3, 7500, 50)
Shape of validation targets: (3, 7500, 50). Should be (3, 7500, 50)
input min/max: 1.168300956697601e-06 16.999974244680363
number of training features: 35000 . Should be 35000
number of validation features: 7500 . Should be 7500
number of test features: 7500 . Should be 7500
Train Rescaled Shape: (3, 35000, 50)
Test Rescaled Shape: (3, 7500, 50)
Val Rescaled Shape: (3, 7500, 50)
Train Rescaled Shape: (35000, 10)
Test Rescaled Shape: (7500, 10)
Val Rescaled Shape: (7500, 10)
[I 2025-05-16 12:31:51,025] A new study created in memory with name: no-name-3646acd5-b5fc-4d73-8d6c-afda6e7a0425
Training model with params: layers=1, units=260, activation=selu, optimizer=rmsprop, lr=0.005529074040732428, batchsize=1597
Finish Trainingstep 1 of 3 with lr=0.005529074040732428 and 1000 epochs
Finish Trainingstep 2 of 3 with lr=0.005529074040732428 and 1000 epochs
Finish Trainingstep 3 of 3 with lr=0.005529074040732428 and 10000 epochs
2025-05-16_13-05-19
[I 2025-05-16 13:05:19,650] Trial 0 finished with value: 0.00807457696646452 and parameters: {'n_layers': 1, 'n_units': 260, 'activation': 'selu', 'lr': 0.005529074040732428, 'optimizer': 'rmsprop', 'batch_size': 1597}. Best is trial 0 with value: 0.00807457696646452.
Training model with params: layers=3, units=408, activation=swish, optimizer=AdamW, lr=0.0012473620346120724, batchsize=321
Finish Trainingstep 1 of 3 with lr=0.0012473620346120724 and 1000 epochs
Finish Trainingstep 2 of 3 with lr=0.0012473620346120724 and 1000 epochs
Finish Trainingstep 3 of 3 with lr=0.0012473620346120724 and 10000 epochs
2025-05-16_13-42-59
[I 2025-05-16 13:42:59,944] Trial 1 finished with value: 0.004001287277787924 and parameters: {'n_layers': 3, 'n_units': 408, 'activation': 'swish', 'lr': 0.0012473620346120724, 'optimizer': 'AdamW', 'batch_size': 321}. Best is trial 1 with value: 0.004001287277787924.
Training model with params: layers=6, units=381, activation=gelu, optimizer=AdamW, lr=0.008557694394189639, batchsize=1567
Finish Trainingstep 1 of 3 with lr=0.008557694394189639 and 1000 epochs
Finish Trainingstep 2 of 3 with lr=0.008557694394189639 and 1000 epochs
Finish Trainingstep 3 of 3 with lr=0.008557694394189639 and 10000 epochs
2025-05-16_14-14-50
[I 2025-05-16 14:14:50,759] Trial 2 finished with value: 0.002143316436558962 and parameters: {'n_layers': 6, 'n_units': 381, 'activation': 'gelu', 'lr': 0.008557694394189639, 'optimizer': 'AdamW', 'batch_size': 1567}. Best is trial 2 with value: 0.002143316436558962.
Training model with params: layers=6, units=172, activation=selu, optimizer=RAdam, lr=0.002238164792344727, batchsize=376
Finish Trainingstep 1 of 3 with lr=0.002238164792344727 and 1000 epochs
Finish Trainingstep 2 of 3 with lr=0.002238164792344727 and 1000 epochs
Finish Trainingstep 3 of 3 with lr=0.002238164792344727 and 10000 epochs
2025-05-16_15-09-26
[I 2025-05-16 15:09:26,491] Trial 3 finished with value: 0.0037716992665082216 and parameters: {'n_layers': 6, 'n_units': 172, 'activation': 'selu', 'lr': 0.002238164792344727, 'optimizer': 'RAdam', 'batch_size': 376}. Best is trial 2 with value: 0.002143316436558962.
Training model with params: layers=4, units=74, activation=leaky_relu, optimizer=RAdam, lr=0.00023523345317801996, batchsize=485
Finish Trainingstep 1 of 3 with lr=0.00023523345317801996 and 1000 epochs
Finish Trainingstep 2 of 3 with lr=0.00023523345317801996 and 1000 epochs
Finish Trainingstep 3 of 3 with lr=0.00023523345317801996 and 10000 epochs
2025-05-16_16-02-07
[I 2025-05-16 16:02:07,256] Trial 4 finished with value: 0.004544401541352272 and parameters: {'n_layers': 4, 'n_units': 74, 'activation': 'leaky_relu', 'lr': 0.00023523345317801996, 'optimizer': 'RAdam', 'batch_size': 485}. Best is trial 2 with value: 0.002143316436558962.
Training model with params: layers=9, units=418, activation=selu, optimizer=rmsprop, lr=0.0034528960589360813, batchsize=647
Finish Trainingstep 1 of 3 with lr=0.0034528960589360813 and 1000 epochs
Finish Trainingstep 2 of 3 with lr=0.0034528960589360813 and 1000 epochs
Finish Trainingstep 3 of 3 with lr=0.0034528960589360813 and 10000 epochs
2025-05-16_16-44-35
[I 2025-05-16 16:44:35,197] Trial 5 finished with value: 0.02368687465786934 and parameters: {'n_layers': 9, 'n_units': 418, 'activation': 'selu', 'lr': 0.0034528960589360813, 'optimizer': 'rmsprop', 'batch_size': 647}. Best is trial 2 with value: 0.002143316436558962.
Training model with params: layers=9, units=189, activation=sigmoid, optimizer=AdamW, lr=0.002724096271895451, batchsize=774
Finish Trainingstep 1 of 3 with lr=0.002724096271895451 and 1000 epochs
Finish Trainingstep 2 of 3 with lr=0.002724096271895451 and 1000 epochs
Finish Trainingstep 3 of 3 with lr=0.002724096271895451 and 10000 epochs
2025-05-16_17-07-50
[I 2025-05-16 17:07:51,025] Trial 6 finished with value: 1.0254603624343872 and parameters: {'n_layers': 9, 'n_units': 189, 'activation': 'sigmoid', 'lr': 0.002724096271895451, 'optimizer': 'AdamW', 'batch_size': 774}. Best is trial 2 with value: 0.002143316436558962.
Training model with params: layers=5, units=461, activation=leaky_relu, optimizer=RAdam, lr=0.0007233293861944709, batchsize=1841
Finish Trainingstep 1 of 3 with lr=0.0007233293861944709 and 1000 epochs
Finish Trainingstep 2 of 3 with lr=0.0007233293861944709 and 1000 epochs
Finish Trainingstep 3 of 3 with lr=0.0007233293861944709 and 10000 epochs
2025-05-16_17-35-54
[I 2025-05-16 17:35:54,727] Trial 7 finished with value: 0.004405083600431681 and parameters: {'n_layers': 5, 'n_units': 461, 'activation': 'leaky_relu', 'lr': 0.0007233293861944709, 'optimizer': 'RAdam', 'batch_size': 1841}. Best is trial 2 with value: 0.002143316436558962.
Training model with params: layers=6, units=120, activation=selu, optimizer=sgd, lr=0.00023134969576615167, batchsize=905
Finish Trainingstep 1 of 3 with lr=0.00023134969576615167 and 1000 epochs
Finish Trainingstep 2 of 3 with lr=0.00023134969576615167 and 1000 epochs
Finish Trainingstep 3 of 3 with lr=0.00023134969576615167 and 10000 epochs
2025-05-16_18-57-05
[I 2025-05-16 18:57:05,161] Trial 8 finished with value: 0.16015689074993134 and parameters: {'n_layers': 6, 'n_units': 120, 'activation': 'selu', 'lr': 0.00023134969576615167, 'optimizer': 'sgd', 'batch_size': 905}. Best is trial 2 with value: 0.002143316436558962.
Training model with params: layers=4, units=121, activation=relu, optimizer=RAdam, lr=0.008839151958626154, batchsize=949
Finish Trainingstep 1 of 3 with lr=0.008839151958626154 and 1000 epochs
Finish Trainingstep 2 of 3 with lr=0.008839151958626154 and 1000 epochs
Finish Trainingstep 3 of 3 with lr=0.008839151958626154 and 10000 epochs
2025-05-16_19-11-57
[I 2025-05-16 19:11:57,865] Trial 9 finished with value: 0.003105541691184044 and parameters: {'n_layers': 4, 'n_units': 121, 'activation': 'relu', 'lr': 0.008839151958626154, 'optimizer': 'RAdam', 'batch_size': 949}. Best is trial 2 with value: 0.002143316436558962.
Training model with params: layers=8, units=327, activation=gelu, optimizer=adam, lr=0.0005020811249993891, batchsize=1432
Finish Trainingstep 1 of 3 with lr=0.0005020811249993891 and 1000 epochs
Finish Trainingstep 2 of 3 with lr=0.0005020811249993891 and 1000 epochs
Finish Trainingstep 3 of 3 with lr=0.0005020811249993891 and 10000 epochs
2025-05-16_19-53-58
[I 2025-05-16 19:53:58,895] Trial 10 finished with value: 0.001445674104616046 and parameters: {'n_layers': 8, 'n_units': 327, 'activation': 'gelu', 'lr': 0.0005020811249993891, 'optimizer': 'adam', 'batch_size': 1432}. Best is trial 10 with value: 0.001445674104616046.
Training model with params: layers=8, units=332, activation=gelu, optimizer=adam, lr=0.0006535789832837873, batchsize=1392
Finish Trainingstep 1 of 3 with lr=0.0006535789832837873 and 1000 epochs
Finish Trainingstep 2 of 3 with lr=0.0006535789832837873 and 1000 epochs
Finish Trainingstep 3 of 3 with lr=0.0006535789832837873 and 10000 epochs
2025-05-16_20-45-04
[I 2025-05-16 20:45:05,053] Trial 11 finished with value: 0.0010957129998132586 and parameters: {'n_layers': 8, 'n_units': 332, 'activation': 'gelu', 'lr': 0.0006535789832837873, 'optimizer': 'adam', 'batch_size': 1392}. Best is trial 11 with value: 0.0010957129998132586.
Training model with params: layers=8, units=327, activation=gelu, optimizer=adam, lr=0.0005219166299000384, batchsize=1359
Finish Trainingstep 1 of 3 with lr=0.0005219166299000384 and 1000 epochs
Finish Trainingstep 2 of 3 with lr=0.0005219166299000384 and 1000 epochs
Finish Trainingstep 3 of 3 with lr=0.0005219166299000384 and 10000 epochs
2025-05-16_21-28-48
[I 2025-05-16 21:28:48,764] Trial 12 finished with value: 0.0013493421720340848 and parameters: {'n_layers': 8, 'n_units': 327, 'activation': 'gelu', 'lr': 0.0005219166299000384, 'optimizer': 'adam', 'batch_size': 1359}. Best is trial 11 with value: 0.0010957129998132586.
Training model with params: layers=8, units=283, activation=tanh, optimizer=adam, lr=0.00013191891656995453, batchsize=1250
Finish Trainingstep 1 of 3 with lr=0.00013191891656995453 and 1000 epochs
Finish Trainingstep 2 of 3 with lr=0.00013191891656995453 and 1000 epochs
Finish Trainingstep 3 of 3 with lr=0.00013191891656995453 and 10000 epochs
2025-05-16_22-42-22
[I 2025-05-16 22:42:22,332] Trial 13 finished with value: 0.0014812302542850375 and parameters: {'n_layers': 8, 'n_units': 283, 'activation': 'tanh', 'lr': 0.00013191891656995453, 'optimizer': 'adam', 'batch_size': 1250}. Best is trial 11 with value: 0.0010957129998132586.
Training model with params: layers=10, units=502, activation=gelu, optimizer=adam, lr=0.0005150018163452623, batchsize=2003
Finish Trainingstep 1 of 3 with lr=0.0005150018163452623 and 1000 epochs
Finish Trainingstep 2 of 3 with lr=0.0005150018163452623 and 1000 epochs
Finish Trainingstep 3 of 3 with lr=0.0005150018163452623 and 10000 epochs
2025-05-16_23-42-39
[I 2025-05-16 23:42:39,533] Trial 14 finished with value: 0.0012214917223900557 and parameters: {'n_layers': 10, 'n_units': 502, 'activation': 'gelu', 'lr': 0.0005150018163452623, 'optimizer': 'adam', 'batch_size': 2003}. Best is trial 11 with value: 0.0010957129998132586.
Training model with params: layers=10, units=493, activation=gelu, optimizer=adam, lr=0.0015561615679165134, batchsize=2038
Finish Trainingstep 1 of 3 with lr=0.0015561615679165134 and 1000 epochs
Finish Trainingstep 2 of 3 with lr=0.0015561615679165134 and 1000 epochs
Finish Trainingstep 3 of 3 with lr=0.0015561615679165134 and 10000 epochs
2025-05-17_00-26-09
[I 2025-05-17 00:26:09,319] Trial 15 finished with value: 0.00114173605106771 and parameters: {'n_layers': 10, 'n_units': 493, 'activation': 'gelu', 'lr': 0.0015561615679165134, 'optimizer': 'adam', 'batch_size': 2038}. Best is trial 11 with value: 0.0010957129998132586.
Training model with params: layers=10, units=506, activation=elu, optimizer=adam, lr=0.0014321919364557545, batchsize=33
Finish Trainingstep 1 of 3 with lr=0.0014321919364557545 and 1000 epochs
Finish Trainingstep 2 of 3 with lr=0.0014321919364557545 and 1000 epochs
Finish Trainingstep 3 of 3 with lr=0.0014321919364557545 and 10000 epochs
2025-05-17_11-37-42
[I 2025-05-17 11:37:42,303] Trial 16 finished with value: 1.025485634803772 and parameters: {'n_layers': 10, 'n_units': 506, 'activation': 'elu', 'lr': 0.0014321919364557545, 'optimizer': 'adam', 'batch_size': 33}. Best is trial 11 with value: 0.0010957129998132586.
Training model with params: layers=7, units=356, activation=gelu, optimizer=sgd, lr=0.0009138894745926552, batchsize=1805
Finish Trainingstep 1 of 3 with lr=0.0009138894745926552 and 1000 epochs
Finish Trainingstep 2 of 3 with lr=0.0009138894745926552 and 1000 epochs
Finish Trainingstep 3 of 3 with lr=0.0009138894745926552 and 10000 epochs
2025-05-17_14-42-28
[I 2025-05-17 14:42:28,205] Trial 17 finished with value: 1.0238169431686401 and parameters: {'n_layers': 7, 'n_units': 356, 'activation': 'gelu', 'lr': 0.0009138894745926552, 'optimizer': 'sgd', 'batch_size': 1805}. Best is trial 11 with value: 0.0010957129998132586.
Training model with params: layers=10, units=248, activation=sigmoid, optimizer=adam, lr=0.0015141492231436856, batchsize=1224
Finish Trainingstep 1 of 3 with lr=0.0015141492231436856 and 1000 epochs
Finish Trainingstep 2 of 3 with lr=0.0015141492231436856 and 1000 epochs
Finish Trainingstep 3 of 3 with lr=0.0015141492231436856 and 10000 epochs
2025-05-17_15-00-27
[I 2025-05-17 15:00:27,782] Trial 18 finished with value: 1.0254706144332886 and parameters: {'n_layers': 10, 'n_units': 248, 'activation': 'sigmoid', 'lr': 0.0015141492231436856, 'optimizer': 'adam', 'batch_size': 1224}. Best is trial 11 with value: 0.0010957129998132586.
Training model with params: layers=9, units=222, activation=relu, optimizer=adam, lr=0.000361318782835757, batchsize=1978
Finish Trainingstep 1 of 3 with lr=0.000361318782835757 and 1000 epochs
Finish Trainingstep 2 of 3 with lr=0.000361318782835757 and 1000 epochs
Finish Trainingstep 3 of 3 with lr=0.000361318782835757 and 10000 epochs
2025-05-17_16-02-28
[I 2025-05-17 16:02:28,214] Trial 19 finished with value: 0.007887071929872036 and parameters: {'n_layers': 9, 'n_units': 222, 'activation': 'relu', 'lr': 0.000361318782835757, 'optimizer': 'adam', 'batch_size': 1978}. Best is trial 11 with value: 0.0010957129998132586.
Training model with params: layers=8, units=461, activation=swish, optimizer=adam, lr=0.00010447524153200096, batchsize=1065
Finish Trainingstep 1 of 3 with lr=0.00010447524153200096 and 1000 epochs
Finish Trainingstep 2 of 3 with lr=0.00010447524153200096 and 1000 epochs
Finish Trainingstep 3 of 3 with lr=0.00010447524153200096 and 10000 epochs
2025-05-17_17-22-14
[I 2025-05-17 17:22:14,189] Trial 20 finished with value: 0.0008192470413632691 and parameters: {'n_layers': 8, 'n_units': 461, 'activation': 'swish', 'lr': 0.00010447524153200096, 'optimizer': 'adam', 'batch_size': 1065}. Best is trial 20 with value: 0.0008192470413632691.
Training model with params: layers=7, units=464, activation=swish, optimizer=adam, lr=0.00010811757510586601, batchsize=1094
Finish Trainingstep 1 of 3 with lr=0.00010811757510586601 and 1000 epochs
Finish Trainingstep 2 of 3 with lr=0.00010811757510586601 and 1000 epochs
Finish Trainingstep 3 of 3 with lr=0.00010811757510586601 and 10000 epochs
2025-05-17_18-37-39
[I 2025-05-17 18:37:39,217] Trial 21 finished with value: 0.0010209428146481514 and parameters: {'n_layers': 7, 'n_units': 464, 'activation': 'swish', 'lr': 0.00010811757510586601, 'optimizer': 'adam', 'batch_size': 1094}. Best is trial 20 with value: 0.0008192470413632691.
Training model with params: layers=7, units=450, activation=swish, optimizer=adam, lr=0.00010884801029027716, batchsize=1063
Finish Trainingstep 1 of 3 with lr=0.00010884801029027716 and 1000 epochs
Finish Trainingstep 2 of 3 with lr=0.00010884801029027716 and 1000 epochs
Finish Trainingstep 3 of 3 with lr=0.00010884801029027716 and 10000 epochs
2025-05-17_20-52-52
[I 2025-05-17 20:52:53,048] Trial 22 finished with value: 0.0008388404967263341 and parameters: {'n_layers': 7, 'n_units': 450, 'activation': 'swish', 'lr': 0.00010884801029027716, 'optimizer': 'adam', 'batch_size': 1063}. Best is trial 20 with value: 0.0008192470413632691.
Training model with params: layers=7, units=450, activation=swish, optimizer=adam, lr=0.00010054540789662082, batchsize=1149
Finish Trainingstep 1 of 3 with lr=0.00010054540789662082 and 1000 epochs
Finish Trainingstep 2 of 3 with lr=0.00010054540789662082 and 1000 epochs
Finish Trainingstep 3 of 3 with lr=0.00010054540789662082 and 10000 epochs
2025-05-17_22-47-40
[I 2025-05-17 22:47:41,048] Trial 23 finished with value: 0.000870717572979629 and parameters: {'n_layers': 7, 'n_units': 450, 'activation': 'swish', 'lr': 0.00010054540789662082, 'optimizer': 'adam', 'batch_size': 1149}. Best is trial 20 with value: 0.0008192470413632691.
Training model with params: layers=7, units=431, activation=swish, optimizer=adam, lr=0.00017050899058657925, batchsize=1095
Finish Trainingstep 1 of 3 with lr=0.00017050899058657925 and 1000 epochs
Finish Trainingstep 2 of 3 with lr=0.00017050899058657925 and 1000 epochs
Finish Trainingstep 3 of 3 with lr=0.00017050899058657925 and 10000 epochs
2025-05-18_00-37-48
[I 2025-05-18 00:37:48,707] Trial 24 finished with value: 0.0008823364623822272 and parameters: {'n_layers': 7, 'n_units': 431, 'activation': 'swish', 'lr': 0.00017050899058657925, 'optimizer': 'adam', 'batch_size': 1095}. Best is trial 20 with value: 0.0008192470413632691.
Training model with params: layers=5, units=441, activation=swish, optimizer=rmsprop, lr=0.00010168164290707802, batchsize=734
Finish Trainingstep 1 of 3 with lr=0.00010168164290707802 and 1000 epochs
Finish Trainingstep 2 of 3 with lr=0.00010168164290707802 and 1000 epochs
Finish Trainingstep 3 of 3 with lr=0.00010168164290707802 and 10000 epochs
2025-05-18_06-21-48
[I 2025-05-18 06:21:48,618] Trial 25 finished with value: 0.0015104106860235333 and parameters: {'n_layers': 5, 'n_units': 441, 'activation': 'swish', 'lr': 0.00010168164290707802, 'optimizer': 'rmsprop', 'batch_size': 734}. Best is trial 20 with value: 0.0008192470413632691.
Training model with params: layers=7, units=385, activation=swish, optimizer=sgd, lr=0.00018033222062172386, batchsize=877
Finish Trainingstep 1 of 3 with lr=0.00018033222062172386 and 1000 epochs
Finish Trainingstep 2 of 3 with lr=0.00018033222062172386 and 1000 epochs
Finish Trainingstep 3 of 3 with lr=0.00018033222062172386 and 10000 epochs
2025-05-18_10-33-59
[I 2025-05-18 10:33:59,781] Trial 26 finished with value: 1.0251587629318237 and parameters: {'n_layers': 7, 'n_units': 385, 'activation': 'swish', 'lr': 0.00018033222062172386, 'optimizer': 'sgd', 'batch_size': 877}. Best is trial 20 with value: 0.0008192470413632691.
Training model with params: layers=7, units=464, activation=swish, optimizer=adam, lr=0.00031734003567408293, batchsize=1183
Finish Trainingstep 1 of 3 with lr=0.00031734003567408293 and 1000 epochs
Finish Trainingstep 2 of 3 with lr=0.00031734003567408293 and 1000 epochs
Finish Trainingstep 3 of 3 with lr=0.00031734003567408293 and 10000 epochs
2025-05-18_11-28-22
[I 2025-05-18 11:28:22,119] Trial 27 finished with value: 0.0012141334591433406 and parameters: {'n_layers': 7, 'n_units': 464, 'activation': 'swish', 'lr': 0.00031734003567408293, 'optimizer': 'adam', 'batch_size': 1183}. Best is trial 20 with value: 0.0008192470413632691.
Training model with params: layers=5, units=393, activation=swish, optimizer=adam, lr=0.00015643226531125926, batchsize=1033
Finish Trainingstep 1 of 3 with lr=0.00015643226531125926 and 1000 epochs
Finish Trainingstep 2 of 3 with lr=0.00015643226531125926 and 1000 epochs
Finish Trainingstep 3 of 3 with lr=0.00015643226531125926 and 10000 epochs
2025-05-18_12-51-11
