[I 2025-05-18 02:05:47,519] Trial 29 finished with value: 0.0009093706612475216 and parameters: {'n_layers': 6, 'n_units': 113, 'activation': 'sigmoid', 'lr': 0.002242375632561949, 'optimizer': 'RAdam', 'batch_size': 1553}. Best is trial 23 with value: 0.0006139659089967608.
Training model with params: layers=7, units=49, activation=sigmoid, optimizer=RAdam, lr=0.004113513503278014, batchsize=762
Finish Trainingstep 1 of 3 with lr=0.004113513503278014 and 1000 epochs
Finish Trainingstep 2 of 3 with lr=0.004113513503278014 and 1000 epochs
Finish Trainingstep 3 of 3 with lr=0.004113513503278014 and 10000 epochs
2025-05-18_03-02-44
[I 2025-05-18 03:02:44,521] Trial 30 finished with value: 0.0007437900057993829 and parameters: {'n_layers': 7, 'n_units': 49, 'activation': 'sigmoid', 'lr': 0.004113513503278014, 'optimizer': 'RAdam', 'batch_size': 762}. Best is trial 23 with value: 0.0006139659089967608.
Training model with params: layers=7, units=52, activation=sigmoid, optimizer=RAdam, lr=0.0036606340673343077, batchsize=726
Finish Trainingstep 1 of 3 with lr=0.0036606340673343077 and 1000 epochs
Finish Trainingstep 2 of 3 with lr=0.0036606340673343077 and 1000 epochs
Finish Trainingstep 3 of 3 with lr=0.0036606340673343077 and 10000 epochs
2025-05-18_03-54-03
[I 2025-05-18 03:54:03,725] Trial 31 finished with value: 0.0007047344115562737 and parameters: {'n_layers': 7, 'n_units': 52, 'activation': 'sigmoid', 'lr': 0.0036606340673343077, 'optimizer': 'RAdam', 'batch_size': 726}. Best is trial 23 with value: 0.0006139659089967608.
Training model with params: layers=5, units=50, activation=sigmoid, optimizer=RAdam, lr=0.0029709919226223814, batchsize=681
Finish Trainingstep 1 of 3 with lr=0.0029709919226223814 and 1000 epochs
Finish Trainingstep 2 of 3 with lr=0.0029709919226223814 and 1000 epochs
Finish Trainingstep 3 of 3 with lr=0.0029709919226223814 and 10000 epochs
2025-05-18_04-52-32
[I 2025-05-18 04:52:32,529] Trial 32 finished with value: 0.0010578058427199721 and parameters: {'n_layers': 5, 'n_units': 50, 'activation': 'sigmoid', 'lr': 0.0029709919226223814, 'optimizer': 'RAdam', 'batch_size': 681}. Best is trial 23 with value: 0.0006139659089967608.
Training model with params: layers=9, units=147, activation=relu, optimizer=RAdam, lr=0.0011734977618406332, batchsize=938
Finish Trainingstep 1 of 3 with lr=0.0011734977618406332 and 1000 epochs
Finish Trainingstep 2 of 3 with lr=0.0011734977618406332 and 1000 epochs
Finish Trainingstep 3 of 3 with lr=0.0011734977618406332 and 10000 epochs
2025-05-18_07-31-03
[I 2025-05-18 07:31:03,192] Trial 33 finished with value: 0.005760969128459692 and parameters: {'n_layers': 9, 'n_units': 147, 'activation': 'relu', 'lr': 0.0011734977618406332, 'optimizer': 'RAdam', 'batch_size': 938}. Best is trial 23 with value: 0.0006139659089967608.
Training model with params: layers=6, units=97, activation=sigmoid, optimizer=rmsprop, lr=0.003701756796368418, batchsize=1292
Finish Trainingstep 1 of 3 with lr=0.003701756796368418 and 1000 epochs
Finish Trainingstep 2 of 3 with lr=0.003701756796368418 and 1000 epochs
Finish Trainingstep 3 of 3 with lr=0.003701756796368418 and 10000 epochs
2025-05-18_08-36-15
[I 2025-05-18 08:36:15,814] Trial 34 finished with value: 0.0022346910554915667 and parameters: {'n_layers': 6, 'n_units': 97, 'activation': 'sigmoid', 'lr': 0.003701756796368418, 'optimizer': 'rmsprop', 'batch_size': 1292}. Best is trial 23 with value: 0.0006139659089967608.
Training model with params: layers=7, units=27, activation=swish, optimizer=RAdam, lr=0.0062910536132880866, batchsize=1100
Finish Trainingstep 1 of 3 with lr=0.0062910536132880866 and 1000 epochs
Finish Trainingstep 2 of 3 with lr=0.0062910536132880866 and 1000 epochs
Finish Trainingstep 3 of 3 with lr=0.0062910536132880866 and 10000 epochs
2025-05-18_09-10-38
[I 2025-05-18 09:10:38,683] Trial 35 finished with value: 0.0007715158862993121 and parameters: {'n_layers': 7, 'n_units': 27, 'activation': 'swish', 'lr': 0.0062910536132880866, 'optimizer': 'RAdam', 'batch_size': 1100}. Best is trial 23 with value: 0.0006139659089967608.
Training model with params: layers=6, units=62, activation=sigmoid, optimizer=sgd, lr=0.002397912318493935, batchsize=895
Finish Trainingstep 1 of 3 with lr=0.002397912318493935 and 1000 epochs
Finish Trainingstep 2 of 3 with lr=0.002397912318493935 and 1000 epochs
Finish Trainingstep 3 of 3 with lr=0.002397912318493935 and 10000 epochs
2025-05-18_09-16-21
[I 2025-05-18 09:16:21,508] Trial 36 finished with value: 1.0255235433578491 and parameters: {'n_layers': 6, 'n_units': 62, 'activation': 'sigmoid', 'lr': 0.002397912318493935, 'optimizer': 'sgd', 'batch_size': 895}. Best is trial 23 with value: 0.0006139659089967608.
Training model with params: layers=9, units=227, activation=elu, optimizer=AdamW, lr=0.0012905212339363694, batchsize=1504
Finish Trainingstep 1 of 3 with lr=0.0012905212339363694 and 1000 epochs
Finish Trainingstep 2 of 3 with lr=0.0012905212339363694 and 1000 epochs
Finish Trainingstep 3 of 3 with lr=0.0012905212339363694 and 10000 epochs
2025-05-18_09-38-09
[I 2025-05-18 09:38:10,039] Trial 37 finished with value: 0.0025565444957464933 and parameters: {'n_layers': 9, 'n_units': 227, 'activation': 'elu', 'lr': 0.0012905212339363694, 'optimizer': 'AdamW', 'batch_size': 1504}. Best is trial 23 with value: 0.0006139659089967608.
Training model with params: layers=8, units=138, activation=relu, optimizer=RAdam, lr=0.0017025640388264266, batchsize=245
Finish Trainingstep 1 of 3 with lr=0.0017025640388264266 and 1000 epochs
Finish Trainingstep 2 of 3 with lr=0.0017025640388264266 and 1000 epochs
Finish Trainingstep 3 of 3 with lr=0.0017025640388264266 and 10000 epochs
2025-05-18_10-11-46
[I 2025-05-18 10:11:46,501] Trial 38 finished with value: 0.0049081649631261826 and parameters: {'n_layers': 8, 'n_units': 138, 'activation': 'relu', 'lr': 0.0017025640388264266, 'optimizer': 'RAdam', 'batch_size': 245}. Best is trial 23 with value: 0.0006139659089967608.
Training model with params: layers=5, units=202, activation=gelu, optimizer=rmsprop, lr=0.0033988505569720953, batchsize=775
Finish Trainingstep 1 of 3 with lr=0.0033988505569720953 and 1000 epochs
Finish Trainingstep 2 of 3 with lr=0.0033988505569720953 and 1000 epochs
Finish Trainingstep 3 of 3 with lr=0.0033988505569720953 and 10000 epochs
2025-05-18_11-35-38
[I 2025-05-18 11:35:38,792] Trial 39 finished with value: 0.002239924157038331 and parameters: {'n_layers': 5, 'n_units': 202, 'activation': 'gelu', 'lr': 0.0033988505569720953, 'optimizer': 'rmsprop', 'batch_size': 775}. Best is trial 23 with value: 0.0006139659089967608.
Training model with params: layers=6, units=263, activation=sigmoid, optimizer=sgd, lr=0.005257626836902502, batchsize=1661
Finish Trainingstep 1 of 3 with lr=0.005257626836902502 and 1000 epochs
Finish Trainingstep 2 of 3 with lr=0.005257626836902502 and 1000 epochs
Finish Trainingstep 3 of 3 with lr=0.005257626836902502 and 10000 epochs
2025-05-18_11-46-05
[I 2025-05-18 11:46:05,061] Trial 40 finished with value: 1.0254967212677002 and parameters: {'n_layers': 6, 'n_units': 263, 'activation': 'sigmoid', 'lr': 0.005257626836902502, 'optimizer': 'sgd', 'batch_size': 1661}. Best is trial 23 with value: 0.0006139659089967608.
Training model with params: layers=7, units=49, activation=sigmoid, optimizer=RAdam, lr=0.003939527407117105, batchsize=745
Finish Trainingstep 1 of 3 with lr=0.003939527407117105 and 1000 epochs
Finish Trainingstep 2 of 3 with lr=0.003939527407117105 and 1000 epochs
Finish Trainingstep 3 of 3 with lr=0.003939527407117105 and 10000 epochs
2025-05-18_12-32-51
[I 2025-05-18 12:32:52,001] Trial 41 finished with value: 0.0007108651916496456 and parameters: {'n_layers': 7, 'n_units': 49, 'activation': 'sigmoid', 'lr': 0.003939527407117105, 'optimizer': 'RAdam', 'batch_size': 745}. Best is trial 23 with value: 0.0006139659089967608.
Training model with params: layers=7, units=111, activation=sigmoid, optimizer=RAdam, lr=0.0026363085333213944, batchsize=589
Finish Trainingstep 1 of 3 with lr=0.0026363085333213944 and 1000 epochs
Finish Trainingstep 2 of 3 with lr=0.0026363085333213944 and 1000 epochs
Finish Trainingstep 3 of 3 with lr=0.0026363085333213944 and 10000 epochs
2025-05-18_13-23-24
[I 2025-05-18 13:23:24,934] Trial 42 finished with value: 0.0009898659773170948 and parameters: {'n_layers': 7, 'n_units': 111, 'activation': 'sigmoid', 'lr': 0.0026363085333213944, 'optimizer': 'RAdam', 'batch_size': 589}. Best is trial 23 with value: 0.0006139659089967608.
Training model with params: layers=6, units=25, activation=sigmoid, optimizer=RAdam, lr=0.007720581322259785, batchsize=866
Finish Trainingstep 1 of 3 with lr=0.007720581322259785 and 1000 epochs
Finish Trainingstep 2 of 3 with lr=0.007720581322259785 and 1000 epochs
Finish Trainingstep 3 of 3 with lr=0.007720581322259785 and 10000 epochs
2025-05-18_13-55-53
[I 2025-05-18 13:55:53,640] Trial 43 finished with value: 0.001170024974271655 and parameters: {'n_layers': 6, 'n_units': 25, 'activation': 'sigmoid', 'lr': 0.007720581322259785, 'optimizer': 'RAdam', 'batch_size': 866}. Best is trial 23 with value: 0.0006139659089967608.
Training model with params: layers=7, units=56, activation=swish, optimizer=RAdam, lr=0.004285481195370392, batchsize=742
Finish Trainingstep 1 of 3 with lr=0.004285481195370392 and 1000 epochs
Finish Trainingstep 2 of 3 with lr=0.004285481195370392 and 1000 epochs
Finish Trainingstep 3 of 3 with lr=0.004285481195370392 and 10000 epochs
2025-05-18_14-23-23
[I 2025-05-18 14:23:23,857] Trial 44 finished with value: 0.0015621763886883855 and parameters: {'n_layers': 7, 'n_units': 56, 'activation': 'swish', 'lr': 0.004285481195370392, 'optimizer': 'RAdam', 'batch_size': 742}. Best is trial 23 with value: 0.0006139659089967608.
Training model with params: layers=5, units=17, activation=tanh, optimizer=RAdam, lr=0.002953632083993811, batchsize=1085
Finish Trainingstep 1 of 3 with lr=0.002953632083993811 and 1000 epochs
Finish Trainingstep 2 of 3 with lr=0.002953632083993811 and 1000 epochs
Finish Trainingstep 3 of 3 with lr=0.002953632083993811 and 10000 epochs
2025-05-18_14-49-17
[I 2025-05-18 14:49:18,044] Trial 45 finished with value: 0.0022350489161908627 and parameters: {'n_layers': 5, 'n_units': 17, 'activation': 'tanh', 'lr': 0.002953632083993811, 'optimizer': 'RAdam', 'batch_size': 1085}. Best is trial 23 with value: 0.0006139659089967608.
Training model with params: layers=8, units=495, activation=leaky_relu, optimizer=AdamW, lr=0.005984689515609563, batchsize=1264
Finish Trainingstep 1 of 3 with lr=0.005984689515609563 and 1000 epochs
Finish Trainingstep 2 of 3 with lr=0.005984689515609563 and 1000 epochs
Finish Trainingstep 3 of 3 with lr=0.005984689515609563 and 10000 epochs
2025-05-18_15-14-49
[I 2025-05-18 15:14:50,007] Trial 46 finished with value: 0.04099380224943161 and parameters: {'n_layers': 8, 'n_units': 495, 'activation': 'leaky_relu', 'lr': 0.005984689515609563, 'optimizer': 'AdamW', 'batch_size': 1264}. Best is trial 23 with value: 0.0006139659089967608.
Training model with params: layers=6, units=92, activation=sigmoid, optimizer=RAdam, lr=0.0020580056681235395, batchsize=658
Finish Trainingstep 1 of 3 with lr=0.0020580056681235395 and 1000 epochs
Finish Trainingstep 2 of 3 with lr=0.0020580056681235395 and 1000 epochs
Finish Trainingstep 3 of 3 with lr=0.0020580056681235395 and 10000 epochs
2025-05-18_16-19-07
[I 2025-05-18 16:19:07,601] Trial 47 finished with value: 0.000605665787588805 and parameters: {'n_layers': 6, 'n_units': 92, 'activation': 'sigmoid', 'lr': 0.0020580056681235395, 'optimizer': 'RAdam', 'batch_size': 658}. Best is trial 47 with value: 0.000605665787588805.
Training model with params: layers=5, units=93, activation=sigmoid, optimizer=sgd, lr=0.00986146501561379, batchsize=323
Finish Trainingstep 1 of 3 with lr=0.00986146501561379 and 1000 epochs
Finish Trainingstep 2 of 3 with lr=0.00986146501561379 and 1000 epochs
Finish Trainingstep 3 of 3 with lr=0.00986146501561379 and 10000 epochs
2025-05-18_17-30-34
[I 2025-05-18 17:30:35,021] Trial 48 finished with value: 0.4699171781539917 and parameters: {'n_layers': 5, 'n_units': 93, 'activation': 'sigmoid', 'lr': 0.00986146501561379, 'optimizer': 'sgd', 'batch_size': 323}. Best is trial 47 with value: 0.000605665787588805.
Training model with params: layers=4, units=44, activation=selu, optimizer=RAdam, lr=0.003541460807350858, batchsize=513
Finish Trainingstep 1 of 3 with lr=0.003541460807350858 and 1000 epochs
Finish Trainingstep 2 of 3 with lr=0.003541460807350858 and 1000 epochs
Finish Trainingstep 3 of 3 with lr=0.003541460807350858 and 10000 epochs
2025-05-18_17-53-44
[I 2025-05-18 17:53:44,587] Trial 49 finished with value: 0.00171172886621207 and parameters: {'n_layers': 4, 'n_units': 44, 'activation': 'selu', 'lr': 0.003541460807350858, 'optimizer': 'RAdam', 'batch_size': 513}. Best is trial 47 with value: 0.000605665787588805.
Training model with params: layers=6, units=367, activation=gelu, optimizer=RAdam, lr=0.002142422668374801, batchsize=674
Finish Trainingstep 1 of 3 with lr=0.002142422668374801 and 1000 epochs
Finish Trainingstep 2 of 3 with lr=0.002142422668374801 and 1000 epochs
Finish Trainingstep 3 of 3 with lr=0.002142422668374801 and 10000 epochs
2025-05-18_18-35-37
[I 2025-05-18 18:35:37,347] Trial 50 finished with value: 0.0016843437915667892 and parameters: {'n_layers': 6, 'n_units': 367, 'activation': 'gelu', 'lr': 0.002142422668374801, 'optimizer': 'RAdam', 'batch_size': 674}. Best is trial 47 with value: 0.000605665787588805.
Training model with params: layers=7, units=123, activation=sigmoid, optimizer=RAdam, lr=0.0013801284465173279, batchsize=959
Finish Trainingstep 1 of 3 with lr=0.0013801284465173279 and 1000 epochs
Finish Trainingstep 2 of 3 with lr=0.0013801284465173279 and 1000 epochs
Finish Trainingstep 3 of 3 with lr=0.0013801284465173279 and 10000 epochs
2025-05-18_19-31-47
[I 2025-05-18 19:31:47,494] Trial 51 finished with value: 0.0007467824034392834 and parameters: {'n_layers': 7, 'n_units': 123, 'activation': 'sigmoid', 'lr': 0.0013801284465173279, 'optimizer': 'RAdam', 'batch_size': 959}. Best is trial 47 with value: 0.000605665787588805.
Training model with params: layers=9, units=158, activation=sigmoid, optimizer=RAdam, lr=0.00179243069919715, batchsize=620
Finish Trainingstep 1 of 3 with lr=0.00179243069919715 and 1000 epochs
Finish Trainingstep 2 of 3 with lr=0.00179243069919715 and 1000 epochs
Finish Trainingstep 3 of 3 with lr=0.00179243069919715 and 10000 epochs
2025-05-18_21-04-41
[I 2025-05-18 21:04:42,074] Trial 52 finished with value: 0.0014006855199113488 and parameters: {'n_layers': 9, 'n_units': 158, 'activation': 'sigmoid', 'lr': 0.00179243069919715, 'optimizer': 'RAdam', 'batch_size': 620}. Best is trial 47 with value: 0.000605665787588805.
Training model with params: layers=5, units=80, activation=sigmoid, optimizer=RAdam, lr=0.0027043052699034552, batchsize=825
Finish Trainingstep 1 of 3 with lr=0.0027043052699034552 and 1000 epochs
Finish Trainingstep 2 of 3 with lr=0.0027043052699034552 and 1000 epochs
Finish Trainingstep 3 of 3 with lr=0.0027043052699034552 and 10000 epochs
2025-05-18_22-24-10
[I 2025-05-18 22:24:10,332] Trial 53 finished with value: 0.0006003594025969505 and parameters: {'n_layers': 5, 'n_units': 80, 'activation': 'sigmoid', 'lr': 0.0027043052699034552, 'optimizer': 'RAdam', 'batch_size': 825}. Best is trial 53 with value: 0.0006003594025969505.
Training model with params: layers=3, units=72, activation=sigmoid, optimizer=RAdam, lr=0.002684261050358882, batchsize=420
Finish Trainingstep 1 of 3 with lr=0.002684261050358882 and 1000 epochs
Finish Trainingstep 2 of 3 with lr=0.002684261050358882 and 1000 epochs
Finish Trainingstep 3 of 3 with lr=0.002684261050358882 and 10000 epochs
2025-05-18_23-18-38
[I 2025-05-18 23:18:38,823] Trial 54 finished with value: 0.0009032175876200199 and parameters: {'n_layers': 3, 'n_units': 72, 'activation': 'sigmoid', 'lr': 0.002684261050358882, 'optimizer': 'RAdam', 'batch_size': 420}. Best is trial 53 with value: 0.0006003594025969505.
Training model with params: layers=4, units=94, activation=tanh, optimizer=rmsprop, lr=0.0044243395218177915, batchsize=789
Finish Trainingstep 1 of 3 with lr=0.0044243395218177915 and 1000 epochs
Finish Trainingstep 2 of 3 with lr=0.0044243395218177915 and 1000 epochs
Finish Trainingstep 3 of 3 with lr=0.0044243395218177915 and 10000 epochs
2025-05-18_23-42-13
[I 2025-05-18 23:42:13,413] Trial 55 finished with value: 0.003254262264817953 and parameters: {'n_layers': 4, 'n_units': 94, 'activation': 'tanh', 'lr': 0.0044243395218177915, 'optimizer': 'rmsprop', 'batch_size': 789}. Best is trial 53 with value: 0.0006003594025969505.
Training model with params: layers=5, units=75, activation=relu, optimizer=adam, lr=0.003322605806916458, batchsize=683
Finish Trainingstep 1 of 3 with lr=0.003322605806916458 and 1000 epochs
Finish Trainingstep 2 of 3 with lr=0.003322605806916458 and 1000 epochs
Finish Trainingstep 3 of 3 with lr=0.003322605806916458 and 10000 epochs
2025-05-18_23-58-46
[I 2025-05-18 23:58:46,395] Trial 56 finished with value: 0.003130962373688817 and parameters: {'n_layers': 5, 'n_units': 75, 'activation': 'relu', 'lr': 0.003322605806916458, 'optimizer': 'adam', 'batch_size': 683}. Best is trial 53 with value: 0.0006003594025969505.
Training model with params: layers=6, units=35, activation=elu, optimizer=RAdam, lr=0.005191902625148123, batchsize=821
Finish Trainingstep 1 of 3 with lr=0.005191902625148123 and 1000 epochs
Finish Trainingstep 2 of 3 with lr=0.005191902625148123 and 1000 epochs
Finish Trainingstep 3 of 3 with lr=0.005191902625148123 and 10000 epochs
2025-05-19_00-11-06
[I 2025-05-19 00:11:06,993] Trial 57 finished with value: 0.0012867781333625317 and parameters: {'n_layers': 6, 'n_units': 35, 'activation': 'elu', 'lr': 0.005191902625148123, 'optimizer': 'RAdam', 'batch_size': 821}. Best is trial 53 with value: 0.0006003594025969505.
Training model with params: layers=5, units=64, activation=sigmoid, optimizer=AdamW, lr=0.0024793260782104524, batchsize=1141
Finish Trainingstep 1 of 3 with lr=0.0024793260782104524 and 1000 epochs
Finish Trainingstep 2 of 3 with lr=0.0024793260782104524 and 1000 epochs
Finish Trainingstep 3 of 3 with lr=0.0024793260782104524 and 10000 epochs
2025-05-19_00-18-02
[I 2025-05-19 00:18:02,947] Trial 58 finished with value: 0.014158964157104492 and parameters: {'n_layers': 5, 'n_units': 64, 'activation': 'sigmoid', 'lr': 0.0024793260782104524, 'optimizer': 'AdamW', 'batch_size': 1141}. Best is trial 53 with value: 0.0006003594025969505.
Training model with params: layers=4, units=102, activation=sigmoid, optimizer=RAdam, lr=0.0020367186240393617, batchsize=993
Finish Trainingstep 1 of 3 with lr=0.0020367186240393617 and 1000 epochs
Finish Trainingstep 2 of 3 with lr=0.0020367186240393617 and 1000 epochs
Finish Trainingstep 3 of 3 with lr=0.0020367186240393617 and 10000 epochs
2025-05-19_01-12-01
[I 2025-05-19 01:12:01,153] Trial 59 finished with value: 0.0009001079597510397 and parameters: {'n_layers': 4, 'n_units': 102, 'activation': 'sigmoid', 'lr': 0.0020367186240393617, 'optimizer': 'RAdam', 'batch_size': 993}. Best is trial 53 with value: 0.0006003594025969505.
Training model with params: layers=6, units=36, activation=leaky_relu, optimizer=RAdam, lr=0.007036785555862397, batchsize=509
Finish Trainingstep 1 of 3 with lr=0.007036785555862397 and 1000 epochs
Finish Trainingstep 2 of 3 with lr=0.007036785555862397 and 1000 epochs
Finish Trainingstep 3 of 3 with lr=0.007036785555862397 and 10000 epochs
2025-05-19_01-28-50
[I 2025-05-19 01:28:50,712] Trial 60 finished with value: 0.0017143880249932408 and parameters: {'n_layers': 6, 'n_units': 36, 'activation': 'leaky_relu', 'lr': 0.007036785555862397, 'optimizer': 'RAdam', 'batch_size': 509}. Best is trial 53 with value: 0.0006003594025969505.
Training model with params: layers=7, units=123, activation=sigmoid, optimizer=RAdam, lr=0.0015465328149769442, batchsize=906
Finish Trainingstep 1 of 3 with lr=0.0015465328149769442 and 1000 epochs
Finish Trainingstep 2 of 3 with lr=0.0015465328149769442 and 1000 epochs
Finish Trainingstep 3 of 3 with lr=0.0015465328149769442 and 10000 epochs
2025-05-19_02-49-58
[I 2025-05-19 02:49:58,388] Trial 61 finished with value: 0.0006654211902059615 and parameters: {'n_layers': 7, 'n_units': 123, 'activation': 'sigmoid', 'lr': 0.0015465328149769442, 'optimizer': 'RAdam', 'batch_size': 906}. Best is trial 53 with value: 0.0006003594025969505.
Training model with params: layers=7, units=86, activation=sigmoid, optimizer=RAdam, lr=0.0014876323242127953, batchsize=846
Finish Trainingstep 1 of 3 with lr=0.0014876323242127953 and 1000 epochs
Finish Trainingstep 2 of 3 with lr=0.0014876323242127953 and 1000 epochs
Finish Trainingstep 3 of 3 with lr=0.0014876323242127953 and 10000 epochs
2025-05-19_04-03-19
[I 2025-05-19 04:03:19,459] Trial 62 finished with value: 0.0009771372424438596 and parameters: {'n_layers': 7, 'n_units': 86, 'activation': 'sigmoid', 'lr': 0.0014876323242127953, 'optimizer': 'RAdam', 'batch_size': 846}. Best is trial 53 with value: 0.0006003594025969505.
Training model with params: layers=8, units=114, activation=sigmoid, optimizer=RAdam, lr=0.0011432694336813536, batchsize=591
Finish Trainingstep 1 of 3 with lr=0.0011432694336813536 and 1000 epochs
Finish Trainingstep 2 of 3 with lr=0.0011432694336813536 and 1000 epochs
Finish Trainingstep 3 of 3 with lr=0.0011432694336813536 and 10000 epochs
2025-05-19_05-41-15
