nohup: ignoring input
2025-05-16 12:31:44.141577: I tensorflow/core/util/port.cc:110] oneDNN custom operations are on. You may see slightly different numerical results due to floating-point round-off errors from different computation orders. To turn them off, set the environment variable `TF_ENABLE_ONEDNN_OPTS=0`.
2025-05-16 12:31:44.143509: I tensorflow/tsl/cuda/cudart_stub.cc:28] Could not find cuda drivers on your machine, GPU will not be used.
2025-05-16 12:31:44.177444: I tensorflow/tsl/cuda/cudart_stub.cc:28] Could not find cuda drivers on your machine, GPU will not be used.
2025-05-16 12:31:44.177885: I tensorflow/core/platform/cpu_feature_guard.cc:182] This TensorFlow binary is optimized to use available CPU instructions in performance-critical operations.
To enable the following instructions: AVX2 AVX512F AVX512_VNNI AVX512_BF16 FMA, in other operations, rebuild TensorFlow with the appropriate compiler flags.
2025-05-16 12:31:45.269035: W tensorflow/compiler/tf2tensorrt/utils/py_utils.cc:38] TF-TRT Warning: Could not find TensorRT
/home/rhoffmann/.local/lib/python3.10/site-packages/tensorflow_addons/utils/tfa_eol_msg.py:23: UserWarning: 

TensorFlow Addons (TFA) has ended development and introduction of new features.
TFA has entered a minimal maintenance and release mode until a planned end of life in May 2024.
Please modify downstream libraries to take dependencies from other repositories in our TensorFlow community (e.g. Keras, Keras-CV, and Keras-NLP). 

For more information see: https://github.com/tensorflow/addons/issues/2807 

  warnings.warn(
WARNING:tensorflow:From /home/rhoffmann/G3LHalo_python/exampleNotebooks/GMNN_Bayesian_Optimization1.py:53: is_gpu_available (from tensorflow.python.framework.test_util) is deprecated and will be removed in a future version.
Instructions for updating:
Use `tf.config.list_physical_devices('GPU')` instead.
using cpu device 

Number of test samples is 7500, should be 7500
Number of validation samples is 7500, should be 7500
Number of train samples is 35000, should be 35000
/home/rhoffmann/G3LHalo_python/exampleNotebooks/GMNN_Bayesian_Optimization1.py:106: UserWarning: No artists with labels found to put in legend.  Note that artists whose label start with an underscore are ignored when legend() is called with no argument.
  axes.legend()
number of training targets: 35000 . Should be 35000
number of validation targets: 7500 . Should be 7500
number of test targets: 7500 . Should be 7500
Shape of training targets: (3, 35000, 50). Should be (3, 35000, 50)
Shape of testing targets: (3, 7500, 50). Should be (3, 7500, 50)
Shape of validation targets: (3, 7500, 50). Should be (3, 7500, 50)
input min/max: 1.168300956697601e-06 16.999974244680363
number of training features: 35000 . Should be 35000
number of validation features: 7500 . Should be 7500
number of test features: 7500 . Should be 7500
Train Rescaled Shape: (3, 35000, 50)
Test Rescaled Shape: (3, 7500, 50)
Val Rescaled Shape: (3, 7500, 50)
Train Rescaled Shape: (35000, 10)
Test Rescaled Shape: (7500, 10)
Val Rescaled Shape: (7500, 10)
[I 2025-05-16 12:31:56,993] A new study created in memory with name: no-name-c66a0378-23f6-4f52-b130-acaa5439447d
Training model with params: layers=4, units=35, activation=tanh, optimizer=RAdam, lr=0.0027181747209319685, batchsize=550
Finish Trainingstep 1 of 3 with lr=0.0027181747209319685 and 1000 epochs
Finish Trainingstep 2 of 3 with lr=0.0027181747209319685 and 1000 epochs
Finish Trainingstep 3 of 3 with lr=0.0027181747209319685 and 10000 epochs
2025-05-16_12-45-10
[I 2025-05-16 12:45:10,480] Trial 0 finished with value: 0.0009973474079743028 and parameters: {'n_layers': 4, 'n_units': 35, 'activation': 'tanh', 'lr': 0.0027181747209319685, 'optimizer': 'RAdam', 'batch_size': 550}. Best is trial 0 with value: 0.0009973474079743028.
Training model with params: layers=6, units=448, activation=relu, optimizer=rmsprop, lr=0.002680254096035785, batchsize=1579
Finish Trainingstep 1 of 3 with lr=0.002680254096035785 and 1000 epochs
Finish Trainingstep 2 of 3 with lr=0.002680254096035785 and 1000 epochs
Finish Trainingstep 3 of 3 with lr=0.002680254096035785 and 10000 epochs
2025-05-16_14-39-44
[I 2025-05-16 14:39:45,315] Trial 1 finished with value: 0.009940982796251774 and parameters: {'n_layers': 6, 'n_units': 448, 'activation': 'relu', 'lr': 0.002680254096035785, 'optimizer': 'rmsprop', 'batch_size': 1579}. Best is trial 0 with value: 0.0009973474079743028.
Training model with params: layers=10, units=214, activation=selu, optimizer=adam, lr=0.001253576245642443, batchsize=233
Finish Trainingstep 1 of 3 with lr=0.001253576245642443 and 1000 epochs
Finish Trainingstep 2 of 3 with lr=0.001253576245642443 and 1000 epochs
Finish Trainingstep 3 of 3 with lr=0.001253576245642443 and 10000 epochs
2025-05-16_15-40-06
[I 2025-05-16 15:40:06,803] Trial 2 finished with value: 0.003886811900883913 and parameters: {'n_layers': 10, 'n_units': 214, 'activation': 'selu', 'lr': 0.001253576245642443, 'optimizer': 'adam', 'batch_size': 233}. Best is trial 0 with value: 0.0009973474079743028.
Training model with params: layers=6, units=149, activation=swish, optimizer=sgd, lr=0.008399407908651214, batchsize=1452
Finish Trainingstep 1 of 3 with lr=0.008399407908651214 and 1000 epochs
Finish Trainingstep 2 of 3 with lr=0.008399407908651214 and 1000 epochs
Finish Trainingstep 3 of 3 with lr=0.008399407908651214 and 10000 epochs
2025-05-16_17-49-20
[I 2025-05-16 17:49:20,494] Trial 3 finished with value: 0.027156932279467583 and parameters: {'n_layers': 6, 'n_units': 149, 'activation': 'swish', 'lr': 0.008399407908651214, 'optimizer': 'sgd', 'batch_size': 1452}. Best is trial 0 with value: 0.0009973474079743028.
Training model with params: layers=10, units=496, activation=relu, optimizer=AdamW, lr=0.00026875362782018635, batchsize=173
Finish Trainingstep 1 of 3 with lr=0.00026875362782018635 and 1000 epochs
Finish Trainingstep 2 of 3 with lr=0.00026875362782018635 and 1000 epochs
Finish Trainingstep 3 of 3 with lr=0.00026875362782018635 and 10000 epochs
2025-05-16_19-36-57
[I 2025-05-16 19:36:57,817] Trial 4 finished with value: 0.007682155352085829 and parameters: {'n_layers': 10, 'n_units': 496, 'activation': 'relu', 'lr': 0.00026875362782018635, 'optimizer': 'AdamW', 'batch_size': 173}. Best is trial 0 with value: 0.0009973474079743028.
Training model with params: layers=7, units=204, activation=tanh, optimizer=rmsprop, lr=0.003113102809052829, batchsize=820
Finish Trainingstep 1 of 3 with lr=0.003113102809052829 and 1000 epochs
Finish Trainingstep 2 of 3 with lr=0.003113102809052829 and 1000 epochs
Finish Trainingstep 3 of 3 with lr=0.003113102809052829 and 10000 epochs
2025-05-16_21-23-24
[I 2025-05-16 21:23:24,632] Trial 5 finished with value: 0.019106032326817513 and parameters: {'n_layers': 7, 'n_units': 204, 'activation': 'tanh', 'lr': 0.003113102809052829, 'optimizer': 'rmsprop', 'batch_size': 820}. Best is trial 0 with value: 0.0009973474079743028.
Training model with params: layers=1, units=132, activation=elu, optimizer=sgd, lr=0.0038879197377197886, batchsize=66
Finish Trainingstep 1 of 3 with lr=0.0038879197377197886 and 1000 epochs
Finish Trainingstep 2 of 3 with lr=0.0038879197377197886 and 1000 epochs
Finish Trainingstep 3 of 3 with lr=0.0038879197377197886 and 10000 epochs
2025-05-16_22-46-47
[I 2025-05-16 22:46:47,597] Trial 6 finished with value: 0.020141813904047012 and parameters: {'n_layers': 1, 'n_units': 132, 'activation': 'elu', 'lr': 0.0038879197377197886, 'optimizer': 'sgd', 'batch_size': 66}. Best is trial 0 with value: 0.0009973474079743028.
Training model with params: layers=5, units=424, activation=tanh, optimizer=sgd, lr=0.002760132809875818, batchsize=1157
Finish Trainingstep 1 of 3 with lr=0.002760132809875818 and 1000 epochs
Finish Trainingstep 2 of 3 with lr=0.002760132809875818 and 1000 epochs
Finish Trainingstep 3 of 3 with lr=0.002760132809875818 and 10000 epochs
2025-05-17_00-38-04
[I 2025-05-17 00:38:04,185] Trial 7 finished with value: 0.03592965751886368 and parameters: {'n_layers': 5, 'n_units': 424, 'activation': 'tanh', 'lr': 0.002760132809875818, 'optimizer': 'sgd', 'batch_size': 1157}. Best is trial 0 with value: 0.0009973474079743028.
Training model with params: layers=9, units=32, activation=gelu, optimizer=AdamW, lr=0.0014940676037068505, batchsize=1738
Finish Trainingstep 1 of 3 with lr=0.0014940676037068505 and 1000 epochs
Finish Trainingstep 2 of 3 with lr=0.0014940676037068505 and 1000 epochs
Finish Trainingstep 3 of 3 with lr=0.0014940676037068505 and 10000 epochs
2025-05-17_00-47-00
[I 2025-05-17 00:47:00,556] Trial 8 finished with value: 0.004408205859363079 and parameters: {'n_layers': 9, 'n_units': 32, 'activation': 'gelu', 'lr': 0.0014940676037068505, 'optimizer': 'AdamW', 'batch_size': 1738}. Best is trial 0 with value: 0.0009973474079743028.
Training model with params: layers=4, units=377, activation=swish, optimizer=adam, lr=0.007004983506017338, batchsize=20
Finish Trainingstep 1 of 3 with lr=0.007004983506017338 and 1000 epochs
Finish Trainingstep 2 of 3 with lr=0.007004983506017338 and 1000 epochs
Finish Trainingstep 3 of 3 with lr=0.007004983506017338 and 10000 epochs
2025-05-17_09-23-23
[I 2025-05-17 09:23:23,340] Trial 9 finished with value: 1.0253791809082031 and parameters: {'n_layers': 4, 'n_units': 377, 'activation': 'swish', 'lr': 0.007004983506017338, 'optimizer': 'adam', 'batch_size': 20}. Best is trial 0 with value: 0.0009973474079743028.
Training model with params: layers=2, units=20, activation=sigmoid, optimizer=RAdam, lr=0.00037461072428726693, batchsize=697
Finish Trainingstep 1 of 3 with lr=0.00037461072428726693 and 1000 epochs
Finish Trainingstep 2 of 3 with lr=0.00037461072428726693 and 1000 epochs
Finish Trainingstep 3 of 3 with lr=0.00037461072428726693 and 10000 epochs
2025-05-17_09-51-26
[I 2025-05-17 09:51:26,049] Trial 10 finished with value: 0.006599600426852703 and parameters: {'n_layers': 2, 'n_units': 20, 'activation': 'sigmoid', 'lr': 0.00037461072428726693, 'optimizer': 'RAdam', 'batch_size': 697}. Best is trial 0 with value: 0.0009973474079743028.
Training model with params: layers=3, units=306, activation=selu, optimizer=adam, lr=0.0006787997357452418, batchsize=480
Finish Trainingstep 1 of 3 with lr=0.0006787997357452418 and 1000 epochs
Finish Trainingstep 2 of 3 with lr=0.0006787997357452418 and 1000 epochs
Finish Trainingstep 3 of 3 with lr=0.0006787997357452418 and 10000 epochs
2025-05-17_10-50-27
[I 2025-05-17 10:50:27,461] Trial 11 finished with value: 0.0017880585510283709 and parameters: {'n_layers': 3, 'n_units': 306, 'activation': 'selu', 'lr': 0.0006787997357452418, 'optimizer': 'adam', 'batch_size': 480}. Best is trial 0 with value: 0.0009973474079743028.
Training model with params: layers=3, units=315, activation=selu, optimizer=RAdam, lr=0.00010252505510609247, batchsize=537
Finish Trainingstep 1 of 3 with lr=0.00010252505510609247 and 1000 epochs
Finish Trainingstep 2 of 3 with lr=0.00010252505510609247 and 1000 epochs
Finish Trainingstep 3 of 3 with lr=0.00010252505510609247 and 10000 epochs
2025-05-17_12-44-07
[I 2025-05-17 12:44:07,283] Trial 12 finished with value: 0.003138749860227108 and parameters: {'n_layers': 3, 'n_units': 315, 'activation': 'selu', 'lr': 0.00010252505510609247, 'optimizer': 'RAdam', 'batch_size': 537}. Best is trial 0 with value: 0.0009973474079743028.
Training model with params: layers=3, units=292, activation=leaky_relu, optimizer=RAdam, lr=0.0005487439188010195, batchsize=413
Finish Trainingstep 1 of 3 with lr=0.0005487439188010195 and 1000 epochs
Finish Trainingstep 2 of 3 with lr=0.0005487439188010195 and 1000 epochs
Finish Trainingstep 3 of 3 with lr=0.0005487439188010195 and 10000 epochs
2025-05-17_13-48-49
[I 2025-05-17 13:48:49,745] Trial 13 finished with value: 0.003757967846468091 and parameters: {'n_layers': 3, 'n_units': 292, 'activation': 'leaky_relu', 'lr': 0.0005487439188010195, 'optimizer': 'RAdam', 'batch_size': 413}. Best is trial 0 with value: 0.0009973474079743028.
Training model with params: layers=4, units=333, activation=selu, optimizer=adam, lr=0.000691259901944423, batchsize=1038
Finish Trainingstep 1 of 3 with lr=0.000691259901944423 and 1000 epochs
Finish Trainingstep 2 of 3 with lr=0.000691259901944423 and 1000 epochs
Finish Trainingstep 3 of 3 with lr=0.000691259901944423 and 10000 epochs
2025-05-17_14-39-35
[I 2025-05-17 14:39:35,705] Trial 14 finished with value: 0.0027551548555493355 and parameters: {'n_layers': 4, 'n_units': 333, 'activation': 'selu', 'lr': 0.000691259901944423, 'optimizer': 'adam', 'batch_size': 1038}. Best is trial 0 with value: 0.0009973474079743028.
Training model with params: layers=1, units=104, activation=tanh, optimizer=RAdam, lr=0.00020122439798562656, batchsize=826
Finish Trainingstep 1 of 3 with lr=0.00020122439798562656 and 1000 epochs
Finish Trainingstep 2 of 3 with lr=0.00020122439798562656 and 1000 epochs
Finish Trainingstep 3 of 3 with lr=0.00020122439798562656 and 10000 epochs
2025-05-17_15-15-43
[I 2025-05-17 15:15:43,744] Trial 15 finished with value: 0.009287749417126179 and parameters: {'n_layers': 1, 'n_units': 104, 'activation': 'tanh', 'lr': 0.00020122439798562656, 'optimizer': 'RAdam', 'batch_size': 826}. Best is trial 0 with value: 0.0009973474079743028.
Training model with params: layers=8, units=238, activation=gelu, optimizer=adam, lr=0.0015564747729129625, batchsize=388
Finish Trainingstep 1 of 3 with lr=0.0015564747729129625 and 1000 epochs
Finish Trainingstep 2 of 3 with lr=0.0015564747729129625 and 1000 epochs
Finish Trainingstep 3 of 3 with lr=0.0015564747729129625 and 10000 epochs
2025-05-17_16-23-55
[I 2025-05-17 16:23:55,860] Trial 16 finished with value: 0.002990911714732647 and parameters: {'n_layers': 8, 'n_units': 238, 'activation': 'gelu', 'lr': 0.0015564747729129625, 'optimizer': 'adam', 'batch_size': 388}. Best is trial 0 with value: 0.0009973474079743028.
Training model with params: layers=4, units=76, activation=sigmoid, optimizer=adam, lr=0.0008108512952613414, batchsize=618
Finish Trainingstep 1 of 3 with lr=0.0008108512952613414 and 1000 epochs
Finish Trainingstep 2 of 3 with lr=0.0008108512952613414 and 1000 epochs
Finish Trainingstep 3 of 3 with lr=0.0008108512952613414 and 10000 epochs
2025-05-17_17-03-02
[I 2025-05-17 17:03:02,690] Trial 17 finished with value: 0.0008894877973943949 and parameters: {'n_layers': 4, 'n_units': 76, 'activation': 'sigmoid', 'lr': 0.0008108512952613414, 'optimizer': 'adam', 'batch_size': 618}. Best is trial 17 with value: 0.0008894877973943949.
Training model with params: layers=5, units=75, activation=sigmoid, optimizer=RAdam, lr=0.005404054126123087, batchsize=1237
Finish Trainingstep 1 of 3 with lr=0.005404054126123087 and 1000 epochs
Finish Trainingstep 2 of 3 with lr=0.005404054126123087 and 1000 epochs
Finish Trainingstep 3 of 3 with lr=0.005404054126123087 and 10000 epochs
2025-05-17_17-28-00
[I 2025-05-17 17:28:00,685] Trial 18 finished with value: 0.0006778276292607188 and parameters: {'n_layers': 5, 'n_units': 75, 'activation': 'sigmoid', 'lr': 0.005404054126123087, 'optimizer': 'RAdam', 'batch_size': 1237}. Best is trial 18 with value: 0.0006778276292607188.
Training model with params: layers=5, units=85, activation=sigmoid, optimizer=rmsprop, lr=0.006281007408714567, batchsize=1352
Finish Trainingstep 1 of 3 with lr=0.006281007408714567 and 1000 epochs
Finish Trainingstep 2 of 3 with lr=0.006281007408714567 and 1000 epochs
Finish Trainingstep 3 of 3 with lr=0.006281007408714567 and 10000 epochs
2025-05-17_18-18-59
[I 2025-05-17 18:18:59,980] Trial 19 finished with value: 0.001396642648614943 and parameters: {'n_layers': 5, 'n_units': 85, 'activation': 'sigmoid', 'lr': 0.006281007408714567, 'optimizer': 'rmsprop', 'batch_size': 1352}. Best is trial 18 with value: 0.0006778276292607188.
Training model with params: layers=7, units=172, activation=sigmoid, optimizer=AdamW, lr=0.0009002824955199, batchsize=1919
Finish Trainingstep 1 of 3 with lr=0.0009002824955199 and 1000 epochs
Finish Trainingstep 2 of 3 with lr=0.0009002824955199 and 1000 epochs
Finish Trainingstep 3 of 3 with lr=0.0009002824955199 and 10000 epochs
2025-05-17_18-38-00
[I 2025-05-17 18:38:00,458] Trial 20 finished with value: 0.022610994055867195 and parameters: {'n_layers': 7, 'n_units': 172, 'activation': 'sigmoid', 'lr': 0.0009002824955199, 'optimizer': 'AdamW', 'batch_size': 1919}. Best is trial 18 with value: 0.0006778276292607188.
Training model with params: layers=4, units=81, activation=sigmoid, optimizer=RAdam, lr=0.004786053498448516, batchsize=1204
Finish Trainingstep 1 of 3 with lr=0.004786053498448516 and 1000 epochs
Finish Trainingstep 2 of 3 with lr=0.004786053498448516 and 1000 epochs
Finish Trainingstep 3 of 3 with lr=0.004786053498448516 and 10000 epochs
2025-05-17_19-24-02
[I 2025-05-17 19:24:02,597] Trial 21 finished with value: 0.0009654617751948535 and parameters: {'n_layers': 4, 'n_units': 81, 'activation': 'sigmoid', 'lr': 0.004786053498448516, 'optimizer': 'RAdam', 'batch_size': 1204}. Best is trial 18 with value: 0.0006778276292607188.
Training model with params: layers=5, units=74, activation=sigmoid, optimizer=RAdam, lr=0.005053670616136625, batchsize=1187
Finish Trainingstep 1 of 3 with lr=0.005053670616136625 and 1000 epochs
Finish Trainingstep 2 of 3 with lr=0.005053670616136625 and 1000 epochs
Finish Trainingstep 3 of 3 with lr=0.005053670616136625 and 10000 epochs
2025-05-17_19-46-49
[I 2025-05-17 19:46:49,804] Trial 22 finished with value: 0.0008634462719783187 and parameters: {'n_layers': 5, 'n_units': 74, 'activation': 'sigmoid', 'lr': 0.005053670616136625, 'optimizer': 'RAdam', 'batch_size': 1187}. Best is trial 18 with value: 0.0006778276292607188.
Training model with params: layers=5, units=70, activation=sigmoid, optimizer=RAdam, lr=0.0018012867246411806, batchsize=924
Finish Trainingstep 1 of 3 with lr=0.0018012867246411806 and 1000 epochs
Finish Trainingstep 2 of 3 with lr=0.0018012867246411806 and 1000 epochs
Finish Trainingstep 3 of 3 with lr=0.0018012867246411806 and 10000 epochs
2025-05-17_20-32-45
[I 2025-05-17 20:32:45,498] Trial 23 finished with value: 0.0006139659089967608 and parameters: {'n_layers': 5, 'n_units': 70, 'activation': 'sigmoid', 'lr': 0.0018012867246411806, 'optimizer': 'RAdam', 'batch_size': 924}. Best is trial 23 with value: 0.0006139659089967608.
Training model with params: layers=7, units=125, activation=sigmoid, optimizer=RAdam, lr=0.0018447964337920298, batchsize=986
Finish Trainingstep 1 of 3 with lr=0.0018447964337920298 and 1000 epochs
Finish Trainingstep 2 of 3 with lr=0.0018447964337920298 and 1000 epochs
Finish Trainingstep 3 of 3 with lr=0.0018447964337920298 and 10000 epochs
2025-05-17_21-49-53
[I 2025-05-17 21:49:53,469] Trial 24 finished with value: 0.0008562899893149734 and parameters: {'n_layers': 7, 'n_units': 125, 'activation': 'sigmoid', 'lr': 0.0018447964337920298, 'optimizer': 'RAdam', 'batch_size': 986}. Best is trial 23 with value: 0.0006139659089967608.
Training model with params: layers=7, units=129, activation=sigmoid, optimizer=RAdam, lr=0.0016671802676060854, batchsize=913
Finish Trainingstep 1 of 3 with lr=0.0016671802676060854 and 1000 epochs
Finish Trainingstep 2 of 3 with lr=0.0016671802676060854 and 1000 epochs
Finish Trainingstep 3 of 3 with lr=0.0016671802676060854 and 10000 epochs
2025-05-17_23-16-15
[I 2025-05-17 23:16:15,703] Trial 25 finished with value: 0.0007196345832198858 and parameters: {'n_layers': 7, 'n_units': 129, 'activation': 'sigmoid', 'lr': 0.0016671802676060854, 'optimizer': 'RAdam', 'batch_size': 913}. Best is trial 23 with value: 0.0006139659089967608.
Training model with params: layers=8, units=171, activation=leaky_relu, optimizer=RAdam, lr=0.002043531116175252, batchsize=890
Finish Trainingstep 1 of 3 with lr=0.002043531116175252 and 1000 epochs
Finish Trainingstep 2 of 3 with lr=0.002043531116175252 and 1000 epochs
Finish Trainingstep 3 of 3 with lr=0.002043531116175252 and 10000 epochs
2025-05-18_00-04-09
[I 2025-05-18 00:04:09,909] Trial 26 finished with value: 0.004089965019375086 and parameters: {'n_layers': 8, 'n_units': 171, 'activation': 'leaky_relu', 'lr': 0.002043531116175252, 'optimizer': 'RAdam', 'batch_size': 890}. Best is trial 23 with value: 0.0006139659089967608.
Training model with params: layers=6, units=178, activation=elu, optimizer=RAdam, lr=0.009366726624825347, batchsize=1366
Finish Trainingstep 1 of 3 with lr=0.009366726624825347 and 1000 epochs
Finish Trainingstep 2 of 3 with lr=0.009366726624825347 and 1000 epochs
Finish Trainingstep 3 of 3 with lr=0.009366726624825347 and 10000 epochs
2025-05-18_00-20-06
[I 2025-05-18 00:20:06,980] Trial 27 finished with value: 0.0020929297897964716 and parameters: {'n_layers': 6, 'n_units': 178, 'activation': 'elu', 'lr': 0.009366726624825347, 'optimizer': 'RAdam', 'batch_size': 1366}. Best is trial 23 with value: 0.0006139659089967608.
Training model with params: layers=8, units=51, activation=sigmoid, optimizer=RAdam, lr=0.0010238339329899286, batchsize=1041
Finish Trainingstep 1 of 3 with lr=0.0010238339329899286 and 1000 epochs
Finish Trainingstep 2 of 3 with lr=0.0010238339329899286 and 1000 epochs
Finish Trainingstep 3 of 3 with lr=0.0010238339329899286 and 10000 epochs
2025-05-18_01-08-12
[I 2025-05-18 01:08:12,213] Trial 28 finished with value: 0.007419909816235304 and parameters: {'n_layers': 8, 'n_units': 51, 'activation': 'sigmoid', 'lr': 0.0010238339329899286, 'optimizer': 'RAdam', 'batch_size': 1041}. Best is trial 23 with value: 0.0006139659089967608.
Training model with params: layers=6, units=113, activation=sigmoid, optimizer=RAdam, lr=0.002242375632561949, batchsize=1553
Finish Trainingstep 1 of 3 with lr=0.002242375632561949 and 1000 epochs
Finish Trainingstep 2 of 3 with lr=0.002242375632561949 and 1000 epochs
Finish Trainingstep 3 of 3 with lr=0.002242375632561949 and 10000 epochs
2025-05-18_02-05-47
