[I 2025-05-19 05:41:15,694] Trial 63 finished with value: 0.0009447135962545872 and parameters: {'n_layers': 8, 'n_units': 114, 'activation': 'sigmoid', 'lr': 0.0011432694336813536, 'optimizer': 'RAdam', 'batch_size': 591}. Best is trial 53 with value: 0.0006003594025969505.
Training model with params: layers=5, units=67, activation=sigmoid, optimizer=RAdam, lr=0.00384128499403396, batchsize=1022
Finish Trainingstep 1 of 3 with lr=0.00384128499403396 and 1000 epochs
Finish Trainingstep 2 of 3 with lr=0.00384128499403396 and 1000 epochs
Finish Trainingstep 3 of 3 with lr=0.00384128499403396 and 10000 epochs
2025-05-19_06-20-27
[I 2025-05-19 06:20:27,934] Trial 64 finished with value: 0.0005455255741253495 and parameters: {'n_layers': 5, 'n_units': 67, 'activation': 'sigmoid', 'lr': 0.00384128499403396, 'optimizer': 'RAdam', 'batch_size': 1022}. Best is trial 64 with value: 0.0005455255741253495.
Training model with params: layers=5, units=191, activation=selu, optimizer=RAdam, lr=0.0030759546778559173, batchsize=1069
Finish Trainingstep 1 of 3 with lr=0.0030759546778559173 and 1000 epochs
Finish Trainingstep 2 of 3 with lr=0.0030759546778559173 and 1000 epochs
Finish Trainingstep 3 of 3 with lr=0.0030759546778559173 and 10000 epochs
2025-05-19_06-43-17
[I 2025-05-19 06:43:17,820] Trial 65 finished with value: 0.0028113757725805044 and parameters: {'n_layers': 5, 'n_units': 191, 'activation': 'selu', 'lr': 0.0030759546778559173, 'optimizer': 'RAdam', 'batch_size': 1069}. Best is trial 64 with value: 0.0005455255741253495.
Training model with params: layers=4, units=158, activation=sigmoid, optimizer=adam, lr=0.00047144587150053366, batchsize=1388
Finish Trainingstep 1 of 3 with lr=0.00047144587150053366 and 1000 epochs
Finish Trainingstep 2 of 3 with lr=0.00047144587150053366 and 1000 epochs
Finish Trainingstep 3 of 3 with lr=0.00047144587150053366 and 10000 epochs
2025-05-19_07-33-04
[I 2025-05-19 07:33:04,827] Trial 66 finished with value: 0.001983193913474679 and parameters: {'n_layers': 4, 'n_units': 158, 'activation': 'sigmoid', 'lr': 0.00047144587150053366, 'optimizer': 'adam', 'batch_size': 1388}. Best is trial 64 with value: 0.0005455255741253495.
Training model with params: layers=6, units=134, activation=sigmoid, optimizer=RAdam, lr=0.0020035412144825022, batchsize=1247
Finish Trainingstep 1 of 3 with lr=0.0020035412144825022 and 1000 epochs
Finish Trainingstep 2 of 3 with lr=0.0020035412144825022 and 1000 epochs
Finish Trainingstep 3 of 3 with lr=0.0020035412144825022 and 10000 epochs
2025-05-19_08-35-21
[I 2025-05-19 08:35:21,057] Trial 67 finished with value: 0.0007082961383275688 and parameters: {'n_layers': 6, 'n_units': 134, 'activation': 'sigmoid', 'lr': 0.0020035412144825022, 'optimizer': 'RAdam', 'batch_size': 1247}. Best is trial 64 with value: 0.0005455255741253495.
Training model with params: layers=2, units=80, activation=sigmoid, optimizer=RAdam, lr=0.0001036912089227444, batchsize=1143
Finish Trainingstep 1 of 3 with lr=0.0001036912089227444 and 1000 epochs
Finish Trainingstep 2 of 3 with lr=0.0001036912089227444 and 1000 epochs
Finish Trainingstep 3 of 3 with lr=0.0001036912089227444 and 10000 epochs
2025-05-19_09-14-13
[I 2025-05-19 09:14:14,010] Trial 68 finished with value: 0.005963652860373259 and parameters: {'n_layers': 2, 'n_units': 80, 'activation': 'sigmoid', 'lr': 0.0001036912089227444, 'optimizer': 'RAdam', 'batch_size': 1143}. Best is trial 64 with value: 0.0005455255741253495.
Training model with params: layers=5, units=63, activation=swish, optimizer=sgd, lr=0.0009594571591141548, batchsize=1034
Finish Trainingstep 1 of 3 with lr=0.0009594571591141548 and 1000 epochs
Finish Trainingstep 2 of 3 with lr=0.0009594571591141548 and 1000 epochs
Finish Trainingstep 3 of 3 with lr=0.0009594571591141548 and 10000 epochs
2025-05-19_10-29-51
[I 2025-05-19 10:29:51,934] Trial 69 finished with value: 0.25237923860549927 and parameters: {'n_layers': 5, 'n_units': 63, 'activation': 'swish', 'lr': 0.0009594571591141548, 'optimizer': 'sgd', 'batch_size': 1034}. Best is trial 64 with value: 0.0005455255741253495.
Training model with params: layers=4, units=106, activation=sigmoid, optimizer=RAdam, lr=0.0024487563052855376, batchsize=981
Finish Trainingstep 1 of 3 with lr=0.0024487563052855376 and 1000 epochs
Finish Trainingstep 2 of 3 with lr=0.0024487563052855376 and 1000 epochs
Finish Trainingstep 3 of 3 with lr=0.0024487563052855376 and 10000 epochs
2025-05-19_11-28-12
[I 2025-05-19 11:28:13,010] Trial 70 finished with value: 0.0007645530859008431 and parameters: {'n_layers': 4, 'n_units': 106, 'activation': 'sigmoid', 'lr': 0.0024487563052855376, 'optimizer': 'RAdam', 'batch_size': 981}. Best is trial 64 with value: 0.0005455255741253495.
Training model with params: layers=6, units=137, activation=sigmoid, optimizer=RAdam, lr=0.001979807126351434, batchsize=1294
Finish Trainingstep 1 of 3 with lr=0.001979807126351434 and 1000 epochs
Finish Trainingstep 2 of 3 with lr=0.001979807126351434 and 1000 epochs
Finish Trainingstep 3 of 3 with lr=0.001979807126351434 and 10000 epochs
2025-05-19_12-34-53
[I 2025-05-19 12:34:53,261] Trial 71 finished with value: 0.0007682290161028504 and parameters: {'n_layers': 6, 'n_units': 137, 'activation': 'sigmoid', 'lr': 0.001979807126351434, 'optimizer': 'RAdam', 'batch_size': 1294}. Best is trial 64 with value: 0.0005455255741253495.
Training model with params: layers=5, units=91, activation=sigmoid, optimizer=RAdam, lr=0.0015044528670185428, batchsize=916
Finish Trainingstep 1 of 3 with lr=0.0015044528670185428 and 1000 epochs
Finish Trainingstep 2 of 3 with lr=0.0015044528670185428 and 1000 epochs
Finish Trainingstep 3 of 3 with lr=0.0015044528670185428 and 10000 epochs
2025-05-19_13-44-44
[I 2025-05-19 13:44:44,105] Trial 72 finished with value: 0.0019200854003429413 and parameters: {'n_layers': 5, 'n_units': 91, 'activation': 'sigmoid', 'lr': 0.0015044528670185428, 'optimizer': 'RAdam', 'batch_size': 916}. Best is trial 64 with value: 0.0005455255741253495.
Training model with params: layers=6, units=122, activation=sigmoid, optimizer=RAdam, lr=0.0022523340216501877, batchsize=1255
Finish Trainingstep 1 of 3 with lr=0.0022523340216501877 and 1000 epochs
Finish Trainingstep 2 of 3 with lr=0.0022523340216501877 and 1000 epochs
Finish Trainingstep 3 of 3 with lr=0.0022523340216501877 and 10000 epochs
2025-05-19_15-34-29
[I 2025-05-19 15:34:29,952] Trial 73 finished with value: 0.000978890573605895 and parameters: {'n_layers': 6, 'n_units': 122, 'activation': 'sigmoid', 'lr': 0.0022523340216501877, 'optimizer': 'RAdam', 'batch_size': 1255}. Best is trial 64 with value: 0.0005455255741253495.
Training model with params: layers=6, units=150, activation=sigmoid, optimizer=RAdam, lr=0.0018775739408124382, batchsize=1432
Finish Trainingstep 1 of 3 with lr=0.0018775739408124382 and 1000 epochs
Finish Trainingstep 2 of 3 with lr=0.0018775739408124382 and 1000 epochs
Finish Trainingstep 3 of 3 with lr=0.0018775739408124382 and 10000 epochs
2025-05-19_17-04-21
[I 2025-05-19 17:04:22,015] Trial 74 finished with value: 0.0005222858744673431 and parameters: {'n_layers': 6, 'n_units': 150, 'activation': 'sigmoid', 'lr': 0.0018775739408124382, 'optimizer': 'RAdam', 'batch_size': 1432}. Best is trial 74 with value: 0.0005222858744673431.
Training model with params: layers=5, units=69, activation=sigmoid, optimizer=rmsprop, lr=0.00169137642879367, batchsize=1475
Finish Trainingstep 1 of 3 with lr=0.00169137642879367 and 1000 epochs
Finish Trainingstep 2 of 3 with lr=0.00169137642879367 and 1000 epochs
Finish Trainingstep 3 of 3 with lr=0.00169137642879367 and 10000 epochs
2025-05-19_17-49-25
[I 2025-05-19 17:49:26,029] Trial 75 finished with value: 0.0026744112838059664 and parameters: {'n_layers': 5, 'n_units': 69, 'activation': 'sigmoid', 'lr': 0.00169137642879367, 'optimizer': 'rmsprop', 'batch_size': 1475}. Best is trial 74 with value: 0.0005222858744673431.
Training model with params: layers=6, units=147, activation=gelu, optimizer=RAdam, lr=0.0011007883528505126, batchsize=1656
Finish Trainingstep 1 of 3 with lr=0.0011007883528505126 and 1000 epochs
Finish Trainingstep 2 of 3 with lr=0.0011007883528505126 and 1000 epochs
Finish Trainingstep 3 of 3 with lr=0.0011007883528505126 and 10000 epochs
2025-05-19_18-29-27
[I 2025-05-19 18:29:27,366] Trial 76 finished with value: 0.0013981170486658812 and parameters: {'n_layers': 6, 'n_units': 147, 'activation': 'gelu', 'lr': 0.0011007883528505126, 'optimizer': 'RAdam', 'batch_size': 1656}. Best is trial 74 with value: 0.0005222858744673431.
Training model with params: layers=5, units=41, activation=elu, optimizer=RAdam, lr=0.0056300574672495185, batchsize=1187
Finish Trainingstep 1 of 3 with lr=0.0056300574672495185 and 1000 epochs
Finish Trainingstep 2 of 3 with lr=0.0056300574672495185 and 1000 epochs
Finish Trainingstep 3 of 3 with lr=0.0056300574672495185 and 10000 epochs
2025-05-19_18-41-27
[I 2025-05-19 18:41:27,924] Trial 77 finished with value: 0.0020748870447278023 and parameters: {'n_layers': 5, 'n_units': 41, 'activation': 'elu', 'lr': 0.0056300574672495185, 'optimizer': 'RAdam', 'batch_size': 1187}. Best is trial 74 with value: 0.0005222858744673431.
Training model with params: layers=7, units=107, activation=sigmoid, optimizer=RAdam, lr=0.0007917959379290596, batchsize=1833
Finish Trainingstep 1 of 3 with lr=0.0007917959379290596 and 1000 epochs
Finish Trainingstep 2 of 3 with lr=0.0007917959379290596 and 1000 epochs
Finish Trainingstep 3 of 3 with lr=0.0007917959379290596 and 10000 epochs
2025-05-19_19-54-57
[I 2025-05-19 19:54:57,818] Trial 78 finished with value: 0.004052705597132444 and parameters: {'n_layers': 7, 'n_units': 107, 'activation': 'sigmoid', 'lr': 0.0007917959379290596, 'optimizer': 'RAdam', 'batch_size': 1833}. Best is trial 74 with value: 0.0005222858744673431.
Training model with params: layers=6, units=57, activation=relu, optimizer=AdamW, lr=0.0012859960699341286, batchsize=1336
Finish Trainingstep 1 of 3 with lr=0.0012859960699341286 and 1000 epochs
Finish Trainingstep 2 of 3 with lr=0.0012859960699341286 and 1000 epochs
Finish Trainingstep 3 of 3 with lr=0.0012859960699341286 and 10000 epochs
2025-05-19_20-02-27
[I 2025-05-19 20:02:27,486] Trial 79 finished with value: 0.0073178960010409355 and parameters: {'n_layers': 6, 'n_units': 57, 'activation': 'relu', 'lr': 0.0012859960699341286, 'optimizer': 'AdamW', 'batch_size': 1336}. Best is trial 74 with value: 0.0005222858744673431.
Training model with params: layers=10, units=82, activation=tanh, optimizer=RAdam, lr=0.004589560342467835, batchsize=1436
Finish Trainingstep 1 of 3 with lr=0.004589560342467835 and 1000 epochs
Finish Trainingstep 2 of 3 with lr=0.004589560342467835 and 1000 epochs
Finish Trainingstep 3 of 3 with lr=0.004589560342467835 and 10000 epochs
2025-05-19_21-07-55
[I 2025-05-19 21:07:55,875] Trial 80 finished with value: 0.002549158176407218 and parameters: {'n_layers': 10, 'n_units': 82, 'activation': 'tanh', 'lr': 0.004589560342467835, 'optimizer': 'RAdam', 'batch_size': 1436}. Best is trial 74 with value: 0.0005222858744673431.
Training model with params: layers=6, units=134, activation=sigmoid, optimizer=RAdam, lr=0.002739218777014987, batchsize=1204
Finish Trainingstep 1 of 3 with lr=0.002739218777014987 and 1000 epochs
Finish Trainingstep 2 of 3 with lr=0.002739218777014987 and 1000 epochs
Finish Trainingstep 3 of 3 with lr=0.002739218777014987 and 10000 epochs
2025-05-19_22-02-10
[I 2025-05-19 22:02:10,247] Trial 81 finished with value: 0.0007414654828608036 and parameters: {'n_layers': 6, 'n_units': 134, 'activation': 'sigmoid', 'lr': 0.002739218777014987, 'optimizer': 'RAdam', 'batch_size': 1204}. Best is trial 74 with value: 0.0005222858744673431.
Training model with params: layers=6, units=162, activation=sigmoid, optimizer=RAdam, lr=0.0019435325149089325, batchsize=878
Finish Trainingstep 1 of 3 with lr=0.0019435325149089325 and 1000 epochs
Finish Trainingstep 2 of 3 with lr=0.0019435325149089325 and 1000 epochs
Finish Trainingstep 3 of 3 with lr=0.0019435325149089325 and 10000 epochs
2025-05-19_22-43-39
[I 2025-05-19 22:43:39,485] Trial 82 finished with value: 0.0012479223078116775 and parameters: {'n_layers': 6, 'n_units': 162, 'activation': 'sigmoid', 'lr': 0.0019435325149089325, 'optimizer': 'RAdam', 'batch_size': 878}. Best is trial 74 with value: 0.0005222858744673431.
Training model with params: layers=5, units=96, activation=sigmoid, optimizer=RAdam, lr=0.003330499586979903, batchsize=720
Finish Trainingstep 1 of 3 with lr=0.003330499586979903 and 1000 epochs
Finish Trainingstep 2 of 3 with lr=0.003330499586979903 and 1000 epochs
Finish Trainingstep 3 of 3 with lr=0.003330499586979903 and 10000 epochs
2025-05-19_23-11-11
[I 2025-05-19 23:11:11,142] Trial 83 finished with value: 0.0008452569600194693 and parameters: {'n_layers': 5, 'n_units': 96, 'activation': 'sigmoid', 'lr': 0.003330499586979903, 'optimizer': 'RAdam', 'batch_size': 720}. Best is trial 74 with value: 0.0005222858744673431.
Training model with params: layers=7, units=182, activation=sigmoid, optimizer=RAdam, lr=0.0038949431047174948, batchsize=1553
Finish Trainingstep 1 of 3 with lr=0.0038949431047174948 and 1000 epochs
Finish Trainingstep 2 of 3 with lr=0.0038949431047174948 and 1000 epochs
Finish Trainingstep 3 of 3 with lr=0.0038949431047174948 and 10000 epochs
2025-05-19_23-50-04
[I 2025-05-19 23:50:04,344] Trial 84 finished with value: 0.0013750797370448709 and parameters: {'n_layers': 7, 'n_units': 182, 'activation': 'sigmoid', 'lr': 0.0038949431047174948, 'optimizer': 'RAdam', 'batch_size': 1553}. Best is trial 74 with value: 0.0005222858744673431.
Training model with params: layers=5, units=117, activation=sigmoid, optimizer=RAdam, lr=0.0022556745808181124, batchsize=1416
Finish Trainingstep 1 of 3 with lr=0.0022556745808181124 and 1000 epochs
Finish Trainingstep 2 of 3 with lr=0.0022556745808181124 and 1000 epochs
Finish Trainingstep 3 of 3 with lr=0.0022556745808181124 and 10000 epochs
2025-05-20_00-59-03
[I 2025-05-20 00:59:03,475] Trial 85 finished with value: 0.00076817418448627 and parameters: {'n_layers': 5, 'n_units': 117, 'activation': 'sigmoid', 'lr': 0.0022556745808181124, 'optimizer': 'RAdam', 'batch_size': 1416}. Best is trial 74 with value: 0.0005222858744673431.
Training model with params: layers=6, units=250, activation=leaky_relu, optimizer=adam, lr=0.0029768789601969277, batchsize=1101
Finish Trainingstep 1 of 3 with lr=0.0029768789601969277 and 1000 epochs
Finish Trainingstep 2 of 3 with lr=0.0029768789601969277 and 1000 epochs
Finish Trainingstep 3 of 3 with lr=0.0029768789601969277 and 10000 epochs
2025-05-20_01-33-07
[I 2025-05-20 01:33:07,281] Trial 86 finished with value: 0.003907139878720045 and parameters: {'n_layers': 6, 'n_units': 250, 'activation': 'leaky_relu', 'lr': 0.0029768789601969277, 'optimizer': 'adam', 'batch_size': 1101}. Best is trial 74 with value: 0.0005222858744673431.
Training model with params: layers=8, units=30, activation=sigmoid, optimizer=RAdam, lr=0.0016115918496948849, batchsize=802
Finish Trainingstep 1 of 3 with lr=0.0016115918496948849 and 1000 epochs
Finish Trainingstep 2 of 3 with lr=0.0016115918496948849 and 1000 epochs
Finish Trainingstep 3 of 3 with lr=0.0016115918496948849 and 10000 epochs
2025-05-20_02-11-47
[I 2025-05-20 02:11:47,608] Trial 87 finished with value: 0.0042783948592841625 and parameters: {'n_layers': 8, 'n_units': 30, 'activation': 'sigmoid', 'lr': 0.0016115918496948849, 'optimizer': 'RAdam', 'batch_size': 802}. Best is trial 74 with value: 0.0005222858744673431.
Training model with params: layers=7, units=129, activation=selu, optimizer=sgd, lr=0.0036585538501345298, batchsize=1004
Finish Trainingstep 1 of 3 with lr=0.0036585538501345298 and 1000 epochs
Finish Trainingstep 2 of 3 with lr=0.0036585538501345298 and 1000 epochs
Finish Trainingstep 3 of 3 with lr=0.0036585538501345298 and 10000 epochs
2025-05-20_03-52-55
[I 2025-05-20 03:52:55,459] Trial 88 finished with value: 0.01395927183330059 and parameters: {'n_layers': 7, 'n_units': 129, 'activation': 'selu', 'lr': 0.0036585538501345298, 'optimizer': 'sgd', 'batch_size': 1004}. Best is trial 74 with value: 0.0005222858744673431.
Training model with params: layers=4, units=290, activation=swish, optimizer=RAdam, lr=0.0013642999793016725, batchsize=953
Finish Trainingstep 1 of 3 with lr=0.0013642999793016725 and 1000 epochs
Finish Trainingstep 2 of 3 with lr=0.0013642999793016725 and 1000 epochs
Finish Trainingstep 3 of 3 with lr=0.0013642999793016725 and 10000 epochs
2025-05-20_04-17-44
[I 2025-05-20 04:17:44,676] Trial 89 finished with value: 0.0020404215902090073 and parameters: {'n_layers': 4, 'n_units': 290, 'activation': 'swish', 'lr': 0.0013642999793016725, 'optimizer': 'RAdam', 'batch_size': 953}. Best is trial 74 with value: 0.0005222858744673431.
Training model with params: layers=5, units=19, activation=sigmoid, optimizer=rmsprop, lr=0.0019140132679398804, batchsize=1235
Finish Trainingstep 1 of 3 with lr=0.0019140132679398804 and 1000 epochs
Finish Trainingstep 2 of 3 with lr=0.0019140132679398804 and 1000 epochs
Finish Trainingstep 3 of 3 with lr=0.0019140132679398804 and 10000 epochs
2025-05-20_04-48-07
[I 2025-05-20 04:48:07,957] Trial 90 finished with value: 0.006030560005456209 and parameters: {'n_layers': 5, 'n_units': 19, 'activation': 'sigmoid', 'lr': 0.0019140132679398804, 'optimizer': 'rmsprop', 'batch_size': 1235}. Best is trial 74 with value: 0.0005222858744673431.
Training model with params: layers=7, units=46, activation=sigmoid, optimizer=RAdam, lr=0.003808661246199054, batchsize=633
Finish Trainingstep 1 of 3 with lr=0.003808661246199054 and 1000 epochs
Finish Trainingstep 2 of 3 with lr=0.003808661246199054 and 1000 epochs
Finish Trainingstep 3 of 3 with lr=0.003808661246199054 and 10000 epochs
2025-05-20_05-28-54
[I 2025-05-20 05:28:54,762] Trial 91 finished with value: 0.0006124459323473275 and parameters: {'n_layers': 7, 'n_units': 46, 'activation': 'sigmoid', 'lr': 0.003808661246199054, 'optimizer': 'RAdam', 'batch_size': 633}. Best is trial 74 with value: 0.0005222858744673431.
Training model with params: layers=7, units=51, activation=sigmoid, optimizer=RAdam, lr=0.002551381863248084, batchsize=649
Finish Trainingstep 1 of 3 with lr=0.002551381863248084 and 1000 epochs
Finish Trainingstep 2 of 3 with lr=0.002551381863248084 and 1000 epochs
Finish Trainingstep 3 of 3 with lr=0.002551381863248084 and 10000 epochs
2025-05-20_06-12-22
[I 2025-05-20 06:12:22,965] Trial 92 finished with value: 0.000686108076479286 and parameters: {'n_layers': 7, 'n_units': 51, 'activation': 'sigmoid', 'lr': 0.002551381863248084, 'optimizer': 'RAdam', 'batch_size': 649}. Best is trial 74 with value: 0.0005222858744673431.
Training model with params: layers=8, units=51, activation=sigmoid, optimizer=RAdam, lr=0.004701870486959286, batchsize=439
Finish Trainingstep 1 of 3 with lr=0.004701870486959286 and 1000 epochs
Finish Trainingstep 2 of 3 with lr=0.004701870486959286 and 1000 epochs
Finish Trainingstep 3 of 3 with lr=0.004701870486959286 and 10000 epochs
2025-05-20_06-37-49
[I 2025-05-20 06:37:49,642] Trial 93 finished with value: 0.0012161257909610868 and parameters: {'n_layers': 8, 'n_units': 51, 'activation': 'sigmoid', 'lr': 0.004701870486959286, 'optimizer': 'RAdam', 'batch_size': 439}. Best is trial 74 with value: 0.0005222858744673431.
Training model with params: layers=7, units=65, activation=sigmoid, optimizer=RAdam, lr=0.0025664696846240493, batchsize=616
Finish Trainingstep 1 of 3 with lr=0.0025664696846240493 and 1000 epochs
Finish Trainingstep 2 of 3 with lr=0.0025664696846240493 and 1000 epochs
Finish Trainingstep 3 of 3 with lr=0.0025664696846240493 and 10000 epochs
2025-05-20_07-30-25
[I 2025-05-20 07:30:25,748] Trial 94 finished with value: 0.0008673787815496325 and parameters: {'n_layers': 7, 'n_units': 65, 'activation': 'sigmoid', 'lr': 0.0025664696846240493, 'optimizer': 'RAdam', 'batch_size': 616}. Best is trial 74 with value: 0.0005222858744673431.
Training model with params: layers=7, units=74, activation=sigmoid, optimizer=RAdam, lr=0.0032038461107980537, batchsize=542
Finish Trainingstep 1 of 3 with lr=0.0032038461107980537 and 1000 epochs
Finish Trainingstep 2 of 3 with lr=0.0032038461107980537 and 1000 epochs
Finish Trainingstep 3 of 3 with lr=0.0032038461107980537 and 10000 epochs
2025-05-20_08-06-18
[I 2025-05-20 08:06:18,954] Trial 95 finished with value: 0.0008179144933819771 and parameters: {'n_layers': 7, 'n_units': 74, 'activation': 'sigmoid', 'lr': 0.0032038461107980537, 'optimizer': 'RAdam', 'batch_size': 542}. Best is trial 74 with value: 0.0005222858744673431.
Training model with params: layers=8, units=42, activation=sigmoid, optimizer=RAdam, lr=0.0028111638387685964, batchsize=637
Finish Trainingstep 1 of 3 with lr=0.0028111638387685964 and 1000 epochs
Finish Trainingstep 2 of 3 with lr=0.0028111638387685964 and 1000 epochs
Finish Trainingstep 3 of 3 with lr=0.0028111638387685964 and 10000 epochs
2025-05-20_08-43-33
[I 2025-05-20 08:43:33,796] Trial 96 finished with value: 0.0014073436614125967 and parameters: {'n_layers': 8, 'n_units': 42, 'activation': 'sigmoid', 'lr': 0.0028111638387685964, 'optimizer': 'RAdam', 'batch_size': 637}. Best is trial 74 with value: 0.0005222858744673431.
Training model with params: layers=7, units=86, activation=sigmoid, optimizer=RAdam, lr=0.004238547187465051, batchsize=664
Finish Trainingstep 1 of 3 with lr=0.004238547187465051 and 1000 epochs
Finish Trainingstep 2 of 3 with lr=0.004238547187465051 and 1000 epochs
Finish Trainingstep 3 of 3 with lr=0.004238547187465051 and 10000 epochs
2025-05-20_09-08-11
