[I 2025-05-20 09:08:11,978] Trial 97 finished with value: 0.0014071823097765446 and parameters: {'n_layers': 7, 'n_units': 86, 'activation': 'sigmoid', 'lr': 0.004238547187465051, 'optimizer': 'RAdam', 'batch_size': 664}. Best is trial 74 with value: 0.0005222858744673431.
Training model with params: layers=7, units=56, activation=gelu, optimizer=RAdam, lr=0.008511770240480733, batchsize=712
Finish Trainingstep 1 of 3 with lr=0.008511770240480733 and 1000 epochs
Finish Trainingstep 2 of 3 with lr=0.008511770240480733 and 1000 epochs
Finish Trainingstep 3 of 3 with lr=0.008511770240480733 and 10000 epochs
2025-05-20_09-29-13
[I 2025-05-20 09:29:13,645] Trial 98 finished with value: 0.0025233393535017967 and parameters: {'n_layers': 7, 'n_units': 56, 'activation': 'gelu', 'lr': 0.008511770240480733, 'optimizer': 'RAdam', 'batch_size': 712}. Best is trial 74 with value: 0.0005222858744673431.
Training model with params: layers=6, units=27, activation=sigmoid, optimizer=AdamW, lr=0.005825823557900478, batchsize=842
Finish Trainingstep 1 of 3 with lr=0.005825823557900478 and 1000 epochs
Finish Trainingstep 2 of 3 with lr=0.005825823557900478 and 1000 epochs
Finish Trainingstep 3 of 3 with lr=0.005825823557900478 and 10000 epochs
2025-05-20_09-36-46
[I 2025-05-20 09:36:46,797] Trial 99 finished with value: 0.0187373124063015 and parameters: {'n_layers': 6, 'n_units': 27, 'activation': 'sigmoid', 'lr': 0.005825823557900478, 'optimizer': 'AdamW', 'batch_size': 842}. Best is trial 74 with value: 0.0005222858744673431.
Beste Parameter:
{'n_layers': 6, 'n_units': 150, 'activation': 'sigmoid', 'lr': 0.0018775739408124382, 'optimizer': 'RAdam', 'batch_size': 1432}
