nohup: ignoring input
2025-05-16 12:31:48.901938: I tensorflow/core/util/port.cc:110] oneDNN custom operations are on. You may see slightly different numerical results due to floating-point round-off errors from different computation orders. To turn them off, set the environment variable `TF_ENABLE_ONEDNN_OPTS=0`.
2025-05-16 12:31:48.903815: I tensorflow/tsl/cuda/cudart_stub.cc:28] Could not find cuda drivers on your machine, GPU will not be used.
2025-05-16 12:31:48.939083: I tensorflow/tsl/cuda/cudart_stub.cc:28] Could not find cuda drivers on your machine, GPU will not be used.
2025-05-16 12:31:48.939539: I tensorflow/core/platform/cpu_feature_guard.cc:182] This TensorFlow binary is optimized to use available CPU instructions in performance-critical operations.
To enable the following instructions: AVX2 AVX512F AVX512_VNNI AVX512_BF16 FMA, in other operations, rebuild TensorFlow with the appropriate compiler flags.
2025-05-16 12:31:49.990229: W tensorflow/compiler/tf2tensorrt/utils/py_utils.cc:38] TF-TRT Warning: Could not find TensorRT
/home/rhoffmann/.local/lib/python3.10/site-packages/tensorflow_addons/utils/tfa_eol_msg.py:23: UserWarning: 

TensorFlow Addons (TFA) has ended development and introduction of new features.
TFA has entered a minimal maintenance and release mode until a planned end of life in May 2024.
Please modify downstream libraries to take dependencies from other repositories in our TensorFlow community (e.g. Keras, Keras-CV, and Keras-NLP). 

For more information see: https://github.com/tensorflow/addons/issues/2807 

  warnings.warn(
WARNING:tensorflow:From /home/rhoffmann/G3LHalo_python/exampleNotebooks/GMNN_Bayesian_Optimization1.py:53: is_gpu_available (from tensorflow.python.framework.test_util) is deprecated and will be removed in a future version.
Instructions for updating:
Use `tf.config.list_physical_devices('GPU')` instead.
using cpu device 

Number of test samples is 7500, should be 7500
Number of validation samples is 7500, should be 7500
Number of train samples is 35000, should be 35000
/home/rhoffmann/G3LHalo_python/exampleNotebooks/GMNN_Bayesian_Optimization1.py:106: UserWarning: No artists with labels found to put in legend.  Note that artists whose label start with an underscore are ignored when legend() is called with no argument.
  axes.legend()
number of training targets: 35000 . Should be 35000
number of validation targets: 7500 . Should be 7500
number of test targets: 7500 . Should be 7500
Shape of training targets: (3, 35000, 50). Should be (3, 35000, 50)
Shape of testing targets: (3, 7500, 50). Should be (3, 7500, 50)
Shape of validation targets: (3, 7500, 50). Should be (3, 7500, 50)
input min/max: 1.168300956697601e-06 16.999974244680363
number of training features: 35000 . Should be 35000
number of validation features: 7500 . Should be 7500
number of test features: 7500 . Should be 7500
Train Rescaled Shape: (3, 35000, 50)
Test Rescaled Shape: (3, 7500, 50)
Val Rescaled Shape: (3, 7500, 50)
Train Rescaled Shape: (35000, 10)
Test Rescaled Shape: (7500, 10)
Val Rescaled Shape: (7500, 10)
[I 2025-05-16 12:32:01,166] A new study created in memory with name: no-name-8271691b-83bb-415c-9670-b69787631480
Training model with params: layers=8, units=350, activation=relu, optimizer=rmsprop, lr=0.001147875228610006, batchsize=1416
Finish Trainingstep 1 of 3 with lr=0.001147875228610006 and 1000 epochs
Finish Trainingstep 2 of 3 with lr=0.001147875228610006 and 1000 epochs
Finish Trainingstep 3 of 3 with lr=0.001147875228610006 and 10000 epochs
2025-05-16_15-02-03
[I 2025-05-16 15:02:03,650] Trial 0 finished with value: 0.007564873434603214 and parameters: {'n_layers': 8, 'n_units': 350, 'activation': 'relu', 'lr': 0.001147875228610006, 'optimizer': 'rmsprop', 'batch_size': 1416}. Best is trial 0 with value: 0.007564873434603214.
Training model with params: layers=10, units=265, activation=leaky_relu, optimizer=sgd, lr=0.0008930955869123183, batchsize=1940
Finish Trainingstep 1 of 3 with lr=0.0008930955869123183 and 1000 epochs
Finish Trainingstep 2 of 3 with lr=0.0008930955869123183 and 1000 epochs
Finish Trainingstep 3 of 3 with lr=0.0008930955869123183 and 10000 epochs
2025-05-16_17-07-04
[I 2025-05-16 17:07:05,118] Trial 1 finished with value: 0.09379145503044128 and parameters: {'n_layers': 10, 'n_units': 265, 'activation': 'leaky_relu', 'lr': 0.0008930955869123183, 'optimizer': 'sgd', 'batch_size': 1940}. Best is trial 0 with value: 0.007564873434603214.
Training model with params: layers=2, units=286, activation=elu, optimizer=adam, lr=0.0018073224401951463, batchsize=1651
Finish Trainingstep 1 of 3 with lr=0.0018073224401951463 and 1000 epochs
Finish Trainingstep 2 of 3 with lr=0.0018073224401951463 and 1000 epochs
Finish Trainingstep 3 of 3 with lr=0.0018073224401951463 and 10000 epochs
2025-05-16_17-39-54
[I 2025-05-16 17:39:54,049] Trial 2 finished with value: 0.0014627465279772878 and parameters: {'n_layers': 2, 'n_units': 286, 'activation': 'elu', 'lr': 0.0018073224401951463, 'optimizer': 'adam', 'batch_size': 1651}. Best is trial 2 with value: 0.0014627465279772878.
Training model with params: layers=10, units=227, activation=swish, optimizer=sgd, lr=0.00048324453109505495, batchsize=1731
Finish Trainingstep 1 of 3 with lr=0.00048324453109505495 and 1000 epochs
Finish Trainingstep 2 of 3 with lr=0.00048324453109505495 and 1000 epochs
Finish Trainingstep 3 of 3 with lr=0.00048324453109505495 and 10000 epochs
2025-05-16_18-09-34
[I 2025-05-16 18:09:34,122] Trial 3 finished with value: 1.0255454778671265 and parameters: {'n_layers': 10, 'n_units': 227, 'activation': 'swish', 'lr': 0.00048324453109505495, 'optimizer': 'sgd', 'batch_size': 1731}. Best is trial 2 with value: 0.0014627465279772878.
Training model with params: layers=10, units=142, activation=swish, optimizer=RAdam, lr=0.0008421563778083943, batchsize=1783
Finish Trainingstep 1 of 3 with lr=0.0008421563778083943 and 1000 epochs
Finish Trainingstep 2 of 3 with lr=0.0008421563778083943 and 1000 epochs
Finish Trainingstep 3 of 3 with lr=0.0008421563778083943 and 10000 epochs
2025-05-16_19-02-18
[I 2025-05-16 19:02:18,680] Trial 4 finished with value: 0.0010718912817537785 and parameters: {'n_layers': 10, 'n_units': 142, 'activation': 'swish', 'lr': 0.0008421563778083943, 'optimizer': 'RAdam', 'batch_size': 1783}. Best is trial 4 with value: 0.0010718912817537785.
Training model with params: layers=5, units=63, activation=sigmoid, optimizer=rmsprop, lr=0.00983717788484307, batchsize=1415
Finish Trainingstep 1 of 3 with lr=0.00983717788484307 and 1000 epochs
Finish Trainingstep 2 of 3 with lr=0.00983717788484307 and 1000 epochs
Finish Trainingstep 3 of 3 with lr=0.00983717788484307 and 10000 epochs
2025-05-16_19-45-16
[I 2025-05-16 19:45:16,894] Trial 5 finished with value: 0.0014993409859016538 and parameters: {'n_layers': 5, 'n_units': 63, 'activation': 'sigmoid', 'lr': 0.00983717788484307, 'optimizer': 'rmsprop', 'batch_size': 1415}. Best is trial 4 with value: 0.0010718912817537785.
Training model with params: layers=6, units=21, activation=leaky_relu, optimizer=RAdam, lr=0.00012138784774756503, batchsize=498
Finish Trainingstep 1 of 3 with lr=0.00012138784774756503 and 1000 epochs
Finish Trainingstep 2 of 3 with lr=0.00012138784774756503 and 1000 epochs
Finish Trainingstep 3 of 3 with lr=0.00012138784774756503 and 10000 epochs
2025-05-16_20-21-21
[I 2025-05-16 20:21:21,833] Trial 6 finished with value: 0.005964880809187889 and parameters: {'n_layers': 6, 'n_units': 21, 'activation': 'leaky_relu', 'lr': 0.00012138784774756503, 'optimizer': 'RAdam', 'batch_size': 498}. Best is trial 4 with value: 0.0010718912817537785.
Training model with params: layers=2, units=76, activation=elu, optimizer=rmsprop, lr=0.0005133634238947385, batchsize=1925
Finish Trainingstep 1 of 3 with lr=0.0005133634238947385 and 1000 epochs
Finish Trainingstep 2 of 3 with lr=0.0005133634238947385 and 1000 epochs
Finish Trainingstep 3 of 3 with lr=0.0005133634238947385 and 10000 epochs
2025-05-16_20-50-34
[I 2025-05-16 20:50:35,035] Trial 7 finished with value: 0.0037902214098721743 and parameters: {'n_layers': 2, 'n_units': 76, 'activation': 'elu', 'lr': 0.0005133634238947385, 'optimizer': 'rmsprop', 'batch_size': 1925}. Best is trial 4 with value: 0.0010718912817537785.
Training model with params: layers=4, units=280, activation=elu, optimizer=sgd, lr=0.001104311953308453, batchsize=1704
Finish Trainingstep 1 of 3 with lr=0.001104311953308453 and 1000 epochs
Finish Trainingstep 2 of 3 with lr=0.001104311953308453 and 1000 epochs
Finish Trainingstep 3 of 3 with lr=0.001104311953308453 and 10000 epochs
2025-05-16_21-44-50
[I 2025-05-16 21:44:50,900] Trial 8 finished with value: 0.10276253521442413 and parameters: {'n_layers': 4, 'n_units': 280, 'activation': 'elu', 'lr': 0.001104311953308453, 'optimizer': 'sgd', 'batch_size': 1704}. Best is trial 4 with value: 0.0010718912817537785.
Training model with params: layers=2, units=119, activation=sigmoid, optimizer=adam, lr=0.0003364915031613672, batchsize=270
Finish Trainingstep 1 of 3 with lr=0.0003364915031613672 and 1000 epochs
Finish Trainingstep 2 of 3 with lr=0.0003364915031613672 and 1000 epochs
Finish Trainingstep 3 of 3 with lr=0.0003364915031613672 and 10000 epochs
2025-05-16_22-40-43
[I 2025-05-16 22:40:43,155] Trial 9 finished with value: 0.002188858576118946 and parameters: {'n_layers': 2, 'n_units': 119, 'activation': 'sigmoid', 'lr': 0.0003364915031613672, 'optimizer': 'adam', 'batch_size': 270}. Best is trial 4 with value: 0.0010718912817537785.
Training model with params: layers=8, units=424, activation=selu, optimizer=AdamW, lr=0.004000336040407181, batchsize=884
Finish Trainingstep 1 of 3 with lr=0.004000336040407181 and 1000 epochs
Finish Trainingstep 2 of 3 with lr=0.004000336040407181 and 1000 epochs
Finish Trainingstep 3 of 3 with lr=0.004000336040407181 and 10000 epochs
2025-05-16_23-38-00
[I 2025-05-16 23:38:01,063] Trial 10 finished with value: 0.004342473577708006 and parameters: {'n_layers': 8, 'n_units': 424, 'activation': 'selu', 'lr': 0.004000336040407181, 'optimizer': 'AdamW', 'batch_size': 884}. Best is trial 4 with value: 0.0010718912817537785.
Training model with params: layers=1, units=168, activation=swish, optimizer=adam, lr=0.0019377652580421204, batchsize=1156
Finish Trainingstep 1 of 3 with lr=0.0019377652580421204 and 1000 epochs
Finish Trainingstep 2 of 3 with lr=0.0019377652580421204 and 1000 epochs
Finish Trainingstep 3 of 3 with lr=0.0019377652580421204 and 10000 epochs
2025-05-17_00-23-42
[I 2025-05-17 00:23:42,667] Trial 11 finished with value: 0.00592055544257164 and parameters: {'n_layers': 1, 'n_units': 168, 'activation': 'swish', 'lr': 0.0019377652580421204, 'optimizer': 'adam', 'batch_size': 1156}. Best is trial 4 with value: 0.0010718912817537785.
Training model with params: layers=4, units=176, activation=tanh, optimizer=RAdam, lr=0.002904440963352668, batchsize=1458
Finish Trainingstep 1 of 3 with lr=0.002904440963352668 and 1000 epochs
Finish Trainingstep 2 of 3 with lr=0.002904440963352668 and 1000 epochs
Finish Trainingstep 3 of 3 with lr=0.002904440963352668 and 10000 epochs
2025-05-17_00-41-51
[I 2025-05-17 00:41:51,625] Trial 12 finished with value: 0.0015471474034711719 and parameters: {'n_layers': 4, 'n_units': 176, 'activation': 'tanh', 'lr': 0.002904440963352668, 'optimizer': 'RAdam', 'batch_size': 1458}. Best is trial 4 with value: 0.0010718912817537785.
Training model with params: layers=7, units=348, activation=gelu, optimizer=RAdam, lr=0.005648644187769589, batchsize=878
Finish Trainingstep 1 of 3 with lr=0.005648644187769589 and 1000 epochs
Finish Trainingstep 2 of 3 with lr=0.005648644187769589 and 1000 epochs
Finish Trainingstep 3 of 3 with lr=0.005648644187769589 and 10000 epochs
2025-05-17_01-20-37
[I 2025-05-17 01:20:37,689] Trial 13 finished with value: 0.0016443454660475254 and parameters: {'n_layers': 7, 'n_units': 348, 'activation': 'gelu', 'lr': 0.005648644187769589, 'optimizer': 'RAdam', 'batch_size': 878}. Best is trial 4 with value: 0.0010718912817537785.
Training model with params: layers=3, units=429, activation=swish, optimizer=adam, lr=0.00020597358998597056, batchsize=2017
Finish Trainingstep 1 of 3 with lr=0.00020597358998597056 and 1000 epochs
Finish Trainingstep 2 of 3 with lr=0.00020597358998597056 and 1000 epochs
Finish Trainingstep 3 of 3 with lr=0.00020597358998597056 and 10000 epochs
2025-05-17_02-20-19
[I 2025-05-17 02:20:19,435] Trial 14 finished with value: 0.0010707512265071273 and parameters: {'n_layers': 3, 'n_units': 429, 'activation': 'swish', 'lr': 0.00020597358998597056, 'optimizer': 'adam', 'batch_size': 2017}. Best is trial 14 with value: 0.0010707512265071273.
Training model with params: layers=4, units=512, activation=swish, optimizer=AdamW, lr=0.00010355447561614771, batchsize=2002
Finish Trainingstep 1 of 3 with lr=0.00010355447561614771 and 1000 epochs
Finish Trainingstep 2 of 3 with lr=0.00010355447561614771 and 1000 epochs
Finish Trainingstep 3 of 3 with lr=0.00010355447561614771 and 10000 epochs
2025-05-17_02-35-30
[I 2025-05-17 02:35:30,415] Trial 15 finished with value: 0.005476571153849363 and parameters: {'n_layers': 4, 'n_units': 512, 'activation': 'swish', 'lr': 0.00010355447561614771, 'optimizer': 'AdamW', 'batch_size': 2002}. Best is trial 14 with value: 0.0010707512265071273.
Training model with params: layers=6, units=496, activation=swish, optimizer=adam, lr=0.00019098708235799577, batchsize=1176
Finish Trainingstep 1 of 3 with lr=0.00019098708235799577 and 1000 epochs
Finish Trainingstep 2 of 3 with lr=0.00019098708235799577 and 1000 epochs
Finish Trainingstep 3 of 3 with lr=0.00019098708235799577 and 10000 epochs
2025-05-17_04-01-58
[I 2025-05-17 04:01:58,628] Trial 16 finished with value: 0.001011379063129425 and parameters: {'n_layers': 6, 'n_units': 496, 'activation': 'swish', 'lr': 0.00019098708235799577, 'optimizer': 'adam', 'batch_size': 1176}. Best is trial 16 with value: 0.001011379063129425.
Training model with params: layers=6, units=499, activation=swish, optimizer=adam, lr=0.00020293728750445428, batchsize=517
Finish Trainingstep 1 of 3 with lr=0.00020293728750445428 and 1000 epochs
Finish Trainingstep 2 of 3 with lr=0.00020293728750445428 and 1000 epochs
Finish Trainingstep 3 of 3 with lr=0.00020293728750445428 and 10000 epochs
2025-05-17_05-54-47
[I 2025-05-17 05:54:47,620] Trial 17 finished with value: 0.0011818859493359923 and parameters: {'n_layers': 6, 'n_units': 499, 'activation': 'swish', 'lr': 0.00020293728750445428, 'optimizer': 'adam', 'batch_size': 517}. Best is trial 16 with value: 0.001011379063129425.
Training model with params: layers=3, units=436, activation=gelu, optimizer=adam, lr=0.00021642699871047264, batchsize=1153
Finish Trainingstep 1 of 3 with lr=0.00021642699871047264 and 1000 epochs
Finish Trainingstep 2 of 3 with lr=0.00021642699871047264 and 1000 epochs
Finish Trainingstep 3 of 3 with lr=0.00021642699871047264 and 10000 epochs
2025-05-17_07-24-34
[I 2025-05-17 07:24:34,359] Trial 18 finished with value: 0.0016228839522227645 and parameters: {'n_layers': 3, 'n_units': 436, 'activation': 'gelu', 'lr': 0.00021642699871047264, 'optimizer': 'adam', 'batch_size': 1153}. Best is trial 16 with value: 0.001011379063129425.
Training model with params: layers=5, units=443, activation=relu, optimizer=adam, lr=0.00018997401719023871, batchsize=56
Finish Trainingstep 1 of 3 with lr=0.00018997401719023871 and 1000 epochs
Finish Trainingstep 2 of 3 with lr=0.00018997401719023871 and 1000 epochs
Finish Trainingstep 3 of 3 with lr=0.00018997401719023871 and 10000 epochs
2025-05-17_10-26-55
[I 2025-05-17 10:26:55,608] Trial 19 finished with value: 0.0071520572528243065 and parameters: {'n_layers': 5, 'n_units': 443, 'activation': 'relu', 'lr': 0.00018997401719023871, 'optimizer': 'adam', 'batch_size': 56}. Best is trial 16 with value: 0.001011379063129425.
Training model with params: layers=7, units=384, activation=selu, optimizer=adam, lr=0.0003641109485257766, batchsize=657
Finish Trainingstep 1 of 3 with lr=0.0003641109485257766 and 1000 epochs
Finish Trainingstep 2 of 3 with lr=0.0003641109485257766 and 1000 epochs
Finish Trainingstep 3 of 3 with lr=0.0003641109485257766 and 10000 epochs
2025-05-17_11-32-40
[I 2025-05-17 11:32:40,333] Trial 20 finished with value: 0.003532488364726305 and parameters: {'n_layers': 7, 'n_units': 384, 'activation': 'selu', 'lr': 0.0003641109485257766, 'optimizer': 'adam', 'batch_size': 657}. Best is trial 16 with value: 0.001011379063129425.
Training model with params: layers=9, units=463, activation=swish, optimizer=RAdam, lr=0.0006779118196539724, batchsize=2048
Finish Trainingstep 1 of 3 with lr=0.0006779118196539724 and 1000 epochs
Finish Trainingstep 2 of 3 with lr=0.0006779118196539724 and 1000 epochs
Finish Trainingstep 3 of 3 with lr=0.0006779118196539724 and 10000 epochs
2025-05-17_12-07-36
[I 2025-05-17 12:07:36,318] Trial 21 finished with value: 0.0013111979933455586 and parameters: {'n_layers': 9, 'n_units': 463, 'activation': 'swish', 'lr': 0.0006779118196539724, 'optimizer': 'RAdam', 'batch_size': 2048}. Best is trial 16 with value: 0.001011379063129425.
Training model with params: layers=9, units=391, activation=swish, optimizer=RAdam, lr=0.00016398888684038789, batchsize=1587
Finish Trainingstep 1 of 3 with lr=0.00016398888684038789 and 1000 epochs
Finish Trainingstep 2 of 3 with lr=0.00016398888684038789 and 1000 epochs
Finish Trainingstep 3 of 3 with lr=0.00016398888684038789 and 10000 epochs
2025-05-17_13-50-37
[I 2025-05-17 13:50:37,797] Trial 22 finished with value: 0.000691829773131758 and parameters: {'n_layers': 9, 'n_units': 391, 'activation': 'swish', 'lr': 0.00016398888684038789, 'optimizer': 'RAdam', 'batch_size': 1587}. Best is trial 22 with value: 0.000691829773131758.
Training model with params: layers=8, units=391, activation=swish, optimizer=adam, lr=0.00015301932119803042, batchsize=1513
Finish Trainingstep 1 of 3 with lr=0.00015301932119803042 and 1000 epochs
Finish Trainingstep 2 of 3 with lr=0.00015301932119803042 and 1000 epochs
Finish Trainingstep 3 of 3 with lr=0.00015301932119803042 and 10000 epochs
2025-05-17_15-19-03
[I 2025-05-17 15:19:03,549] Trial 23 finished with value: 0.0008776226895861328 and parameters: {'n_layers': 8, 'n_units': 391, 'activation': 'swish', 'lr': 0.00015301932119803042, 'optimizer': 'adam', 'batch_size': 1513}. Best is trial 22 with value: 0.000691829773131758.
Training model with params: layers=8, units=361, activation=tanh, optimizer=AdamW, lr=0.00013428074872489623, batchsize=1274
Finish Trainingstep 1 of 3 with lr=0.00013428074872489623 and 1000 epochs
Finish Trainingstep 2 of 3 with lr=0.00013428074872489623 and 1000 epochs
Finish Trainingstep 3 of 3 with lr=0.00013428074872489623 and 10000 epochs
2025-05-17_15-43-30
[I 2025-05-17 15:43:30,407] Trial 24 finished with value: 0.00627922173589468 and parameters: {'n_layers': 8, 'n_units': 361, 'activation': 'tanh', 'lr': 0.00013428074872489623, 'optimizer': 'AdamW', 'batch_size': 1274}. Best is trial 22 with value: 0.000691829773131758.
Training model with params: layers=9, units=387, activation=swish, optimizer=RAdam, lr=0.00026803172594151465, batchsize=1596
Finish Trainingstep 1 of 3 with lr=0.00026803172594151465 and 1000 epochs
Finish Trainingstep 2 of 3 with lr=0.00026803172594151465 and 1000 epochs
Finish Trainingstep 3 of 3 with lr=0.00026803172594151465 and 10000 epochs
2025-05-17_16-24-40
[I 2025-05-17 16:24:40,871] Trial 25 finished with value: 0.0008533086511306465 and parameters: {'n_layers': 9, 'n_units': 387, 'activation': 'swish', 'lr': 0.00026803172594151465, 'optimizer': 'RAdam', 'batch_size': 1596}. Best is trial 22 with value: 0.000691829773131758.
Training model with params: layers=9, units=311, activation=swish, optimizer=RAdam, lr=0.00029765168506991, batchsize=1539
Finish Trainingstep 1 of 3 with lr=0.00029765168506991 and 1000 epochs
Finish Trainingstep 2 of 3 with lr=0.00029765168506991 and 1000 epochs
Finish Trainingstep 3 of 3 with lr=0.00029765168506991 and 10000 epochs
2025-05-17_17-22-00
[I 2025-05-17 17:22:00,351] Trial 26 finished with value: 0.0008675433928146958 and parameters: {'n_layers': 9, 'n_units': 311, 'activation': 'swish', 'lr': 0.00029765168506991, 'optimizer': 'RAdam', 'batch_size': 1539}. Best is trial 22 with value: 0.000691829773131758.
Training model with params: layers=9, units=304, activation=swish, optimizer=RAdam, lr=0.000311892490665506, batchsize=1600
Finish Trainingstep 1 of 3 with lr=0.000311892490665506 and 1000 epochs
Finish Trainingstep 2 of 3 with lr=0.000311892490665506 and 1000 epochs
Finish Trainingstep 3 of 3 with lr=0.000311892490665506 and 10000 epochs
2025-05-17_18-18-22
[I 2025-05-17 18:18:22,465] Trial 27 finished with value: 0.0007918026531115174 and parameters: {'n_layers': 9, 'n_units': 304, 'activation': 'swish', 'lr': 0.000311892490665506, 'optimizer': 'RAdam', 'batch_size': 1600}. Best is trial 22 with value: 0.000691829773131758.
Training model with params: layers=9, units=321, activation=swish, optimizer=RAdam, lr=0.000306543589126451, batchsize=1807
Finish Trainingstep 1 of 3 with lr=0.000306543589126451 and 1000 epochs
Finish Trainingstep 2 of 3 with lr=0.000306543589126451 and 1000 epochs
Finish Trainingstep 3 of 3 with lr=0.000306543589126451 and 10000 epochs
2025-05-17_19-26-04
