[I 2025-05-17 19:26:04,348] Trial 28 finished with value: 0.0008422311511822045 and parameters: {'n_layers': 9, 'n_units': 321, 'activation': 'swish', 'lr': 0.000306543589126451, 'optimizer': 'RAdam', 'batch_size': 1807}. Best is trial 22 with value: 0.000691829773131758.
Training model with params: layers=7, units=229, activation=relu, optimizer=RAdam, lr=0.0004697694453605523, batchsize=1338
Finish Trainingstep 1 of 3 with lr=0.0004697694453605523 and 1000 epochs
Finish Trainingstep 2 of 3 with lr=0.0004697694453605523 and 1000 epochs
Finish Trainingstep 3 of 3 with lr=0.0004697694453605523 and 10000 epochs
2025-05-17_20-45-56
[I 2025-05-17 20:45:56,737] Trial 29 finished with value: 0.007277477998286486 and parameters: {'n_layers': 7, 'n_units': 229, 'activation': 'relu', 'lr': 0.0004697694453605523, 'optimizer': 'RAdam', 'batch_size': 1338}. Best is trial 22 with value: 0.000691829773131758.
Training model with params: layers=9, units=312, activation=selu, optimizer=RAdam, lr=0.0005732102984592747, batchsize=1812
Finish Trainingstep 1 of 3 with lr=0.0005732102984592747 and 1000 epochs
Finish Trainingstep 2 of 3 with lr=0.0005732102984592747 and 1000 epochs
Finish Trainingstep 3 of 3 with lr=0.0005732102984592747 and 10000 epochs
2025-05-17_21-27-48
[I 2025-05-17 21:27:48,641] Trial 30 finished with value: 0.0037217133212834597 and parameters: {'n_layers': 9, 'n_units': 312, 'activation': 'selu', 'lr': 0.0005732102984592747, 'optimizer': 'RAdam', 'batch_size': 1812}. Best is trial 22 with value: 0.000691829773131758.
Training model with params: layers=9, units=337, activation=swish, optimizer=RAdam, lr=0.0002864166730766051, batchsize=1567
Finish Trainingstep 1 of 3 with lr=0.0002864166730766051 and 1000 epochs
Finish Trainingstep 2 of 3 with lr=0.0002864166730766051 and 1000 epochs
Finish Trainingstep 3 of 3 with lr=0.0002864166730766051 and 10000 epochs
2025-05-17_22-35-44
[I 2025-05-17 22:35:45,056] Trial 31 finished with value: 0.0007907883846201003 and parameters: {'n_layers': 9, 'n_units': 337, 'activation': 'swish', 'lr': 0.0002864166730766051, 'optimizer': 'RAdam', 'batch_size': 1567}. Best is trial 22 with value: 0.000691829773131758.
Training model with params: layers=10, units=328, activation=leaky_relu, optimizer=RAdam, lr=0.0004058553686180972, batchsize=1859
Finish Trainingstep 1 of 3 with lr=0.0004058553686180972 and 1000 epochs
Finish Trainingstep 2 of 3 with lr=0.0004058553686180972 and 1000 epochs
Finish Trainingstep 3 of 3 with lr=0.0004058553686180972 and 10000 epochs
2025-05-18_00-14-28
[I 2025-05-18 00:14:28,726] Trial 32 finished with value: 0.00680842250585556 and parameters: {'n_layers': 10, 'n_units': 328, 'activation': 'leaky_relu', 'lr': 0.0004058553686180972, 'optimizer': 'RAdam', 'batch_size': 1859}. Best is trial 22 with value: 0.000691829773131758.
Training model with params: layers=9, units=227, activation=swish, optimizer=RAdam, lr=0.0002705212973009367, batchsize=1637
Finish Trainingstep 1 of 3 with lr=0.0002705212973009367 and 1000 epochs
Finish Trainingstep 2 of 3 with lr=0.0002705212973009367 and 1000 epochs
Finish Trainingstep 3 of 3 with lr=0.0002705212973009367 and 10000 epochs
2025-05-18_01-38-47
[I 2025-05-18 01:38:47,260] Trial 33 finished with value: 0.0008325897506438196 and parameters: {'n_layers': 9, 'n_units': 227, 'activation': 'swish', 'lr': 0.0002705212973009367, 'optimizer': 'RAdam', 'batch_size': 1637}. Best is trial 22 with value: 0.000691829773131758.
Training model with params: layers=10, units=239, activation=swish, optimizer=RAdam, lr=0.0002564866170252778, batchsize=1630
Finish Trainingstep 1 of 3 with lr=0.0002564866170252778 and 1000 epochs
Finish Trainingstep 2 of 3 with lr=0.0002564866170252778 and 1000 epochs
Finish Trainingstep 3 of 3 with lr=0.0002564866170252778 and 10000 epochs
2025-05-18_03-26-51
[I 2025-05-18 03:26:51,798] Trial 34 finished with value: 0.0007402646588161588 and parameters: {'n_layers': 10, 'n_units': 239, 'activation': 'swish', 'lr': 0.0002564866170252778, 'optimizer': 'RAdam', 'batch_size': 1630}. Best is trial 22 with value: 0.000691829773131758.
Training model with params: layers=10, units=238, activation=swish, optimizer=sgd, lr=0.00015687609509062498, batchsize=1333
Finish Trainingstep 1 of 3 with lr=0.00015687609509062498 and 1000 epochs
Finish Trainingstep 2 of 3 with lr=0.00015687609509062498 and 1000 epochs
Finish Trainingstep 3 of 3 with lr=0.00015687609509062498 and 10000 epochs
2025-05-18_04-08-41
[I 2025-05-18 04:08:42,035] Trial 35 finished with value: 1.0255424976348877 and parameters: {'n_layers': 10, 'n_units': 238, 'activation': 'swish', 'lr': 0.00015687609509062498, 'optimizer': 'sgd', 'batch_size': 1333}. Best is trial 22 with value: 0.000691829773131758.
Training model with params: layers=10, units=255, activation=sigmoid, optimizer=RAdam, lr=0.000742860135186238, batchsize=1646
Finish Trainingstep 1 of 3 with lr=0.000742860135186238 and 1000 epochs
Finish Trainingstep 2 of 3 with lr=0.000742860135186238 and 1000 epochs
Finish Trainingstep 3 of 3 with lr=0.000742860135186238 and 10000 epochs
2025-05-18_07-05-30
[I 2025-05-18 07:05:30,281] Trial 36 finished with value: 0.0020919854287058115 and parameters: {'n_layers': 10, 'n_units': 255, 'activation': 'sigmoid', 'lr': 0.000742860135186238, 'optimizer': 'RAdam', 'batch_size': 1646}. Best is trial 22 with value: 0.000691829773131758.
Training model with params: layers=8, units=185, activation=leaky_relu, optimizer=rmsprop, lr=0.00010670945584935459, batchsize=990
Finish Trainingstep 1 of 3 with lr=0.00010670945584935459 and 1000 epochs
Finish Trainingstep 2 of 3 with lr=0.00010670945584935459 and 1000 epochs
Finish Trainingstep 3 of 3 with lr=0.00010670945584935459 and 10000 epochs
2025-05-18_09-36-29
[I 2025-05-18 09:36:29,741] Trial 37 finished with value: 0.008327752351760864 and parameters: {'n_layers': 8, 'n_units': 185, 'activation': 'leaky_relu', 'lr': 0.00010670945584935459, 'optimizer': 'rmsprop', 'batch_size': 990}. Best is trial 22 with value: 0.000691829773131758.
Training model with params: layers=10, units=354, activation=gelu, optimizer=RAdam, lr=0.0015091477376766424, batchsize=1438
Finish Trainingstep 1 of 3 with lr=0.0015091477376766424 and 1000 epochs
Finish Trainingstep 2 of 3 with lr=0.0015091477376766424 and 1000 epochs
Finish Trainingstep 3 of 3 with lr=0.0015091477376766424 and 10000 epochs
2025-05-18_10-31-12
[I 2025-05-18 10:31:12,890] Trial 38 finished with value: 0.0027808696031570435 and parameters: {'n_layers': 10, 'n_units': 354, 'activation': 'gelu', 'lr': 0.0015091477376766424, 'optimizer': 'RAdam', 'batch_size': 1438}. Best is trial 22 with value: 0.000691829773131758.
Training model with params: layers=7, units=291, activation=elu, optimizer=RAdam, lr=0.00024069188173017817, batchsize=1702
Finish Trainingstep 1 of 3 with lr=0.00024069188173017817 and 1000 epochs
Finish Trainingstep 2 of 3 with lr=0.00024069188173017817 and 1000 epochs
Finish Trainingstep 3 of 3 with lr=0.00024069188173017817 and 10000 epochs
2025-05-18_11-22-10
[I 2025-05-18 11:22:10,180] Trial 39 finished with value: 0.0014313649153336883 and parameters: {'n_layers': 7, 'n_units': 291, 'activation': 'elu', 'lr': 0.00024069188173017817, 'optimizer': 'RAdam', 'batch_size': 1702}. Best is trial 22 with value: 0.000691829773131758.
Training model with params: layers=8, units=278, activation=tanh, optimizer=rmsprop, lr=0.0004108618244155843, batchsize=1553
Finish Trainingstep 1 of 3 with lr=0.0004108618244155843 and 1000 epochs
Finish Trainingstep 2 of 3 with lr=0.0004108618244155843 and 1000 epochs
Finish Trainingstep 3 of 3 with lr=0.0004108618244155843 and 10000 epochs
2025-05-18_12-59-23
[I 2025-05-18 12:59:23,610] Trial 40 finished with value: 0.0016910574631765485 and parameters: {'n_layers': 8, 'n_units': 278, 'activation': 'tanh', 'lr': 0.0004108618244155843, 'optimizer': 'rmsprop', 'batch_size': 1553}. Best is trial 22 with value: 0.000691829773131758.
Training model with params: layers=9, units=200, activation=swish, optimizer=RAdam, lr=0.00014900891392163488, batchsize=1642
Finish Trainingstep 1 of 3 with lr=0.00014900891392163488 and 1000 epochs
Finish Trainingstep 2 of 3 with lr=0.00014900891392163488 and 1000 epochs
Finish Trainingstep 3 of 3 with lr=0.00014900891392163488 and 10000 epochs
2025-05-18_14-51-20
[I 2025-05-18 14:51:20,059] Trial 41 finished with value: 0.000652218353934586 and parameters: {'n_layers': 9, 'n_units': 200, 'activation': 'swish', 'lr': 0.00014900891392163488, 'optimizer': 'RAdam', 'batch_size': 1642}. Best is trial 41 with value: 0.000652218353934586.
Training model with params: layers=9, units=195, activation=swish, optimizer=RAdam, lr=0.00015383149120785046, batchsize=1875
Finish Trainingstep 1 of 3 with lr=0.00015383149120785046 and 1000 epochs
Finish Trainingstep 2 of 3 with lr=0.00015383149120785046 and 1000 epochs
Finish Trainingstep 3 of 3 with lr=0.00015383149120785046 and 10000 epochs
2025-05-18_16-29-08
[I 2025-05-18 16:29:08,497] Trial 42 finished with value: 0.0006728768930770457 and parameters: {'n_layers': 9, 'n_units': 195, 'activation': 'swish', 'lr': 0.00015383149120785046, 'optimizer': 'RAdam', 'batch_size': 1875}. Best is trial 41 with value: 0.000652218353934586.
Training model with params: layers=10, units=207, activation=swish, optimizer=RAdam, lr=0.00014462063826028009, batchsize=1904
Finish Trainingstep 1 of 3 with lr=0.00014462063826028009 and 1000 epochs
Finish Trainingstep 2 of 3 with lr=0.00014462063826028009 and 1000 epochs
Finish Trainingstep 3 of 3 with lr=0.00014462063826028009 and 10000 epochs
2025-05-18_17-28-26
[I 2025-05-18 17:28:26,375] Trial 43 finished with value: 0.0008549779886379838 and parameters: {'n_layers': 10, 'n_units': 207, 'activation': 'swish', 'lr': 0.00014462063826028009, 'optimizer': 'RAdam', 'batch_size': 1904}. Best is trial 41 with value: 0.000652218353934586.
Training model with params: layers=8, units=139, activation=swish, optimizer=sgd, lr=0.00016633627830899228, batchsize=1737
Finish Trainingstep 1 of 3 with lr=0.00016633627830899228 and 1000 epochs
Finish Trainingstep 2 of 3 with lr=0.00016633627830899228 and 1000 epochs
Finish Trainingstep 3 of 3 with lr=0.00016633627830899228 and 10000 epochs
2025-05-18_18-04-19
[I 2025-05-18 18:04:19,576] Trial 44 finished with value: 1.0254899263381958 and parameters: {'n_layers': 8, 'n_units': 139, 'activation': 'swish', 'lr': 0.00016633627830899228, 'optimizer': 'sgd', 'batch_size': 1737}. Best is trial 41 with value: 0.000652218353934586.
Training model with params: layers=10, units=200, activation=sigmoid, optimizer=RAdam, lr=0.00012237304003453624, batchsize=1740
Finish Trainingstep 1 of 3 with lr=0.00012237304003453624 and 1000 epochs
Finish Trainingstep 2 of 3 with lr=0.00012237304003453624 and 1000 epochs
Finish Trainingstep 3 of 3 with lr=0.00012237304003453624 and 10000 epochs
2025-05-18_20-05-26
[I 2025-05-18 20:05:26,467] Trial 45 finished with value: 0.11813580244779587 and parameters: {'n_layers': 10, 'n_units': 200, 'activation': 'sigmoid', 'lr': 0.00012237304003453624, 'optimizer': 'RAdam', 'batch_size': 1740}. Best is trial 41 with value: 0.000652218353934586.
Training model with params: layers=9, units=92, activation=swish, optimizer=RAdam, lr=0.00011517139901828337, batchsize=1922
Finish Trainingstep 1 of 3 with lr=0.00011517139901828337 and 1000 epochs
Finish Trainingstep 2 of 3 with lr=0.00011517139901828337 and 1000 epochs
Finish Trainingstep 3 of 3 with lr=0.00011517139901828337 and 10000 epochs
2025-05-18_22-45-35
[I 2025-05-18 22:45:35,203] Trial 46 finished with value: 0.0012778295204043388 and parameters: {'n_layers': 9, 'n_units': 92, 'activation': 'swish', 'lr': 0.00011517139901828337, 'optimizer': 'RAdam', 'batch_size': 1922}. Best is trial 41 with value: 0.000652218353934586.
Training model with params: layers=8, units=152, activation=relu, optimizer=RAdam, lr=0.00016821148098990194, batchsize=1396
Finish Trainingstep 1 of 3 with lr=0.00016821148098990194 and 1000 epochs
Finish Trainingstep 2 of 3 with lr=0.00016821148098990194 and 1000 epochs
Finish Trainingstep 3 of 3 with lr=0.00016821148098990194 and 10000 epochs
2025-05-18_23-16-30
[I 2025-05-18 23:16:30,188] Trial 47 finished with value: 0.007521063555032015 and parameters: {'n_layers': 8, 'n_units': 152, 'activation': 'relu', 'lr': 0.00016821148098990194, 'optimizer': 'RAdam', 'batch_size': 1396}. Best is trial 41 with value: 0.000652218353934586.
Training model with params: layers=10, units=264, activation=elu, optimizer=AdamW, lr=0.00010080914161612015, batchsize=1471
Finish Trainingstep 1 of 3 with lr=0.00010080914161612015 and 1000 epochs
Finish Trainingstep 2 of 3 with lr=0.00010080914161612015 and 1000 epochs
Finish Trainingstep 3 of 3 with lr=0.00010080914161612015 and 10000 epochs
2025-05-18_23-38-41
[I 2025-05-18 23:38:41,523] Trial 48 finished with value: 0.006794049870222807 and parameters: {'n_layers': 10, 'n_units': 264, 'activation': 'elu', 'lr': 0.00010080914161612015, 'optimizer': 'AdamW', 'batch_size': 1471}. Best is trial 41 with value: 0.000652218353934586.
Training model with params: layers=9, units=251, activation=swish, optimizer=RAdam, lr=0.00023079482096839132, batchsize=1234
Finish Trainingstep 1 of 3 with lr=0.00023079482096839132 and 1000 epochs
Finish Trainingstep 2 of 3 with lr=0.00023079482096839132 and 1000 epochs
Finish Trainingstep 3 of 3 with lr=0.00023079482096839132 and 10000 epochs
2025-05-19_00-45-09
[I 2025-05-19 00:45:09,662] Trial 49 finished with value: 0.0007907354738563299 and parameters: {'n_layers': 9, 'n_units': 251, 'activation': 'swish', 'lr': 0.00023079482096839132, 'optimizer': 'RAdam', 'batch_size': 1234}. Best is trial 41 with value: 0.000652218353934586.
Training model with params: layers=7, units=207, activation=swish, optimizer=sgd, lr=0.0002371765101484849, batchsize=1068
Finish Trainingstep 1 of 3 with lr=0.0002371765101484849 and 1000 epochs
Finish Trainingstep 2 of 3 with lr=0.0002371765101484849 and 1000 epochs
Finish Trainingstep 3 of 3 with lr=0.0002371765101484849 and 10000 epochs
2025-05-19_03-50-57
[I 2025-05-19 03:50:57,281] Trial 50 finished with value: 1.0251697301864624 and parameters: {'n_layers': 7, 'n_units': 207, 'activation': 'swish', 'lr': 0.0002371765101484849, 'optimizer': 'sgd', 'batch_size': 1068}. Best is trial 41 with value: 0.000652218353934586.
Training model with params: layers=9, units=256, activation=swish, optimizer=RAdam, lr=0.0001320533071388574, batchsize=1823
Finish Trainingstep 1 of 3 with lr=0.0001320533071388574 and 1000 epochs
Finish Trainingstep 2 of 3 with lr=0.0001320533071388574 and 1000 epochs
Finish Trainingstep 3 of 3 with lr=0.0001320533071388574 and 10000 epochs
2025-05-19_05-30-46
[I 2025-05-19 05:30:46,739] Trial 51 finished with value: 0.0005635097622871399 and parameters: {'n_layers': 9, 'n_units': 256, 'activation': 'swish', 'lr': 0.0001320533071388574, 'optimizer': 'RAdam', 'batch_size': 1823}. Best is trial 51 with value: 0.0005635097622871399.
Training model with params: layers=9, units=238, activation=swish, optimizer=RAdam, lr=0.00013856926764615592, batchsize=1882
Finish Trainingstep 1 of 3 with lr=0.00013856926764615592 and 1000 epochs
Finish Trainingstep 2 of 3 with lr=0.00013856926764615592 and 1000 epochs
Finish Trainingstep 3 of 3 with lr=0.00013856926764615592 and 10000 epochs
2025-05-19_06-37-41
[I 2025-05-19 06:37:41,506] Trial 52 finished with value: 0.0009103778284043074 and parameters: {'n_layers': 9, 'n_units': 238, 'activation': 'swish', 'lr': 0.00013856926764615592, 'optimizer': 'RAdam', 'batch_size': 1882}. Best is trial 51 with value: 0.0005635097622871399.
Training model with params: layers=10, units=251, activation=swish, optimizer=RAdam, lr=0.00017231117379382368, batchsize=1803
Finish Trainingstep 1 of 3 with lr=0.00017231117379382368 and 1000 epochs
Finish Trainingstep 2 of 3 with lr=0.00017231117379382368 and 1000 epochs
Finish Trainingstep 3 of 3 with lr=0.00017231117379382368 and 10000 epochs
2025-05-19_08-42-07
[I 2025-05-19 08:42:07,086] Trial 53 finished with value: 0.0005886474973522127 and parameters: {'n_layers': 10, 'n_units': 251, 'activation': 'swish', 'lr': 0.00017231117379382368, 'optimizer': 'RAdam', 'batch_size': 1803}. Best is trial 51 with value: 0.0005635097622871399.
Training model with params: layers=10, units=187, activation=swish, optimizer=rmsprop, lr=0.00017867906665233418, batchsize=1795
Finish Trainingstep 1 of 3 with lr=0.00017867906665233418 and 1000 epochs
Finish Trainingstep 2 of 3 with lr=0.00017867906665233418 and 1000 epochs
Finish Trainingstep 3 of 3 with lr=0.00017867906665233418 and 10000 epochs
2025-05-19_11-36-32
[I 2025-05-19 11:36:32,099] Trial 54 finished with value: 0.001584670040756464 and parameters: {'n_layers': 10, 'n_units': 187, 'activation': 'swish', 'lr': 0.00017867906665233418, 'optimizer': 'rmsprop', 'batch_size': 1795}. Best is trial 51 with value: 0.0005635097622871399.
Training model with params: layers=10, units=156, activation=swish, optimizer=RAdam, lr=0.0001230107539470835, batchsize=1989
Finish Trainingstep 1 of 3 with lr=0.0001230107539470835 and 1000 epochs
Finish Trainingstep 2 of 3 with lr=0.0001230107539470835 and 1000 epochs
Finish Trainingstep 3 of 3 with lr=0.0001230107539470835 and 10000 epochs
2025-05-19_13-28-29
[I 2025-05-19 13:28:29,493] Trial 55 finished with value: 0.0009628955740481615 and parameters: {'n_layers': 10, 'n_units': 156, 'activation': 'swish', 'lr': 0.0001230107539470835, 'optimizer': 'RAdam', 'batch_size': 1989}. Best is trial 51 with value: 0.0005635097622871399.
Training model with params: layers=8, units=116, activation=selu, optimizer=RAdam, lr=0.0001910541410543303, batchsize=1658
Finish Trainingstep 1 of 3 with lr=0.0001910541410543303 and 1000 epochs
Finish Trainingstep 2 of 3 with lr=0.0001910541410543303 and 1000 epochs
Finish Trainingstep 3 of 3 with lr=0.0001910541410543303 and 10000 epochs
2025-05-19_15-36-47
[I 2025-05-19 15:36:47,663] Trial 56 finished with value: 0.004507576581090689 and parameters: {'n_layers': 8, 'n_units': 116, 'activation': 'selu', 'lr': 0.0001910541410543303, 'optimizer': 'RAdam', 'batch_size': 1658}. Best is trial 51 with value: 0.0005635097622871399.
Training model with params: layers=10, units=217, activation=gelu, optimizer=RAdam, lr=0.00012798139397561824, batchsize=1857
Finish Trainingstep 1 of 3 with lr=0.00012798139397561824 and 1000 epochs
Finish Trainingstep 2 of 3 with lr=0.00012798139397561824 and 1000 epochs
Finish Trainingstep 3 of 3 with lr=0.00012798139397561824 and 10000 epochs
2025-05-19_16-49-56
[I 2025-05-19 16:49:56,903] Trial 57 finished with value: 0.0009943940676748753 and parameters: {'n_layers': 10, 'n_units': 217, 'activation': 'gelu', 'lr': 0.00012798139397561824, 'optimizer': 'RAdam', 'batch_size': 1857}. Best is trial 51 with value: 0.0005635097622871399.
Training model with params: layers=9, units=274, activation=leaky_relu, optimizer=AdamW, lr=0.00015164007056074077, batchsize=1987
Finish Trainingstep 1 of 3 with lr=0.00015164007056074077 and 1000 epochs
Finish Trainingstep 2 of 3 with lr=0.00015164007056074077 and 1000 epochs
Finish Trainingstep 3 of 3 with lr=0.00015164007056074077 and 10000 epochs
2025-05-19_17-13-51
[I 2025-05-19 17:13:51,871] Trial 58 finished with value: 0.0074310447089374065 and parameters: {'n_layers': 9, 'n_units': 274, 'activation': 'leaky_relu', 'lr': 0.00015164007056074077, 'optimizer': 'AdamW', 'batch_size': 1987}. Best is trial 51 with value: 0.0005635097622871399.
Training model with params: layers=5, units=175, activation=swish, optimizer=RAdam, lr=0.007832095388610669, batchsize=1741
Finish Trainingstep 1 of 3 with lr=0.007832095388610669 and 1000 epochs
Finish Trainingstep 2 of 3 with lr=0.007832095388610669 and 1000 epochs
Finish Trainingstep 3 of 3 with lr=0.007832095388610669 and 10000 epochs
2025-05-19_17-34-17
[I 2025-05-19 17:34:17,887] Trial 59 finished with value: 0.0010423703351989388 and parameters: {'n_layers': 5, 'n_units': 175, 'activation': 'swish', 'lr': 0.007832095388610669, 'optimizer': 'RAdam', 'batch_size': 1741}. Best is trial 51 with value: 0.0005635097622871399.
Training model with params: layers=10, units=288, activation=tanh, optimizer=RAdam, lr=0.00020046427919151734, batchsize=1691
Finish Trainingstep 1 of 3 with lr=0.00020046427919151734 and 1000 epochs
Finish Trainingstep 2 of 3 with lr=0.00020046427919151734 and 1000 epochs
Finish Trainingstep 3 of 3 with lr=0.00020046427919151734 and 10000 epochs
2025-05-19_19-01-11
[I 2025-05-19 19:01:12,006] Trial 60 finished with value: 0.0018382578855380416 and parameters: {'n_layers': 10, 'n_units': 288, 'activation': 'tanh', 'lr': 0.00020046427919151734, 'optimizer': 'RAdam', 'batch_size': 1691}. Best is trial 51 with value: 0.0005635097622871399.
Training model with params: layers=9, units=247, activation=swish, optimizer=RAdam, lr=0.00020802712298311247, batchsize=1264
Finish Trainingstep 1 of 3 with lr=0.00020802712298311247 and 1000 epochs
Finish Trainingstep 2 of 3 with lr=0.00020802712298311247 and 1000 epochs
Finish Trainingstep 3 of 3 with lr=0.00020802712298311247 and 10000 epochs
2025-05-19_20-39-09
[I 2025-05-19 20:39:09,970] Trial 61 finished with value: 0.0006594088044948876 and parameters: {'n_layers': 9, 'n_units': 247, 'activation': 'swish', 'lr': 0.00020802712298311247, 'optimizer': 'RAdam', 'batch_size': 1264}. Best is trial 51 with value: 0.0005635097622871399.
Training model with params: layers=8, units=251, activation=swish, optimizer=RAdam, lr=0.0002459518699234651, batchsize=1513
Finish Trainingstep 1 of 3 with lr=0.0002459518699234651 and 1000 epochs
Finish Trainingstep 2 of 3 with lr=0.0002459518699234651 and 1000 epochs
Finish Trainingstep 3 of 3 with lr=0.0002459518699234651 and 10000 epochs
2025-05-19_21-37-02
