[I 2025-05-19 21:37:02,473] Trial 62 finished with value: 0.0009811720810830593 and parameters: {'n_layers': 8, 'n_units': 251, 'activation': 'swish', 'lr': 0.0002459518699234651, 'optimizer': 'RAdam', 'batch_size': 1513}. Best is trial 51 with value: 0.0005635097622871399.
Training model with params: layers=9, units=220, activation=swish, optimizer=RAdam, lr=0.0001692017487405465, batchsize=1794
Finish Trainingstep 1 of 3 with lr=0.0001692017487405465 and 1000 epochs
Finish Trainingstep 2 of 3 with lr=0.0001692017487405465 and 1000 epochs
Finish Trainingstep 3 of 3 with lr=0.0001692017487405465 and 10000 epochs
2025-05-19_23-05-27
[I 2025-05-19 23:05:27,469] Trial 63 finished with value: 0.0006323985289782286 and parameters: {'n_layers': 9, 'n_units': 220, 'activation': 'swish', 'lr': 0.0001692017487405465, 'optimizer': 'RAdam', 'batch_size': 1794}. Best is trial 51 with value: 0.0005635097622871399.
Training model with params: layers=9, units=189, activation=swish, optimizer=RAdam, lr=0.00013807219245513268, batchsize=1778
Finish Trainingstep 1 of 3 with lr=0.00013807219245513268 and 1000 epochs
Finish Trainingstep 2 of 3 with lr=0.00013807219245513268 and 1000 epochs
Finish Trainingstep 3 of 3 with lr=0.00013807219245513268 and 10000 epochs
2025-05-20_00-55-25
[I 2025-05-20 00:55:25,568] Trial 64 finished with value: 0.0006829745252616704 and parameters: {'n_layers': 9, 'n_units': 189, 'activation': 'swish', 'lr': 0.00013807219245513268, 'optimizer': 'RAdam', 'batch_size': 1778}. Best is trial 51 with value: 0.0005635097622871399.
Training model with params: layers=9, units=203, activation=swish, optimizer=RAdam, lr=0.002507583415259339, batchsize=1948
Finish Trainingstep 1 of 3 with lr=0.002507583415259339 and 1000 epochs
Finish Trainingstep 2 of 3 with lr=0.002507583415259339 and 1000 epochs
Finish Trainingstep 3 of 3 with lr=0.002507583415259339 and 10000 epochs
2025-05-20_01-35-49
[I 2025-05-20 01:35:49,844] Trial 65 finished with value: 0.0012377952225506306 and parameters: {'n_layers': 9, 'n_units': 203, 'activation': 'swish', 'lr': 0.002507583415259339, 'optimizer': 'RAdam', 'batch_size': 1948}. Best is trial 51 with value: 0.0005635097622871399.
Training model with params: layers=9, units=135, activation=swish, optimizer=RAdam, lr=0.00010029891990599013, batchsize=1824
Finish Trainingstep 1 of 3 with lr=0.00010029891990599013 and 1000 epochs
Finish Trainingstep 2 of 3 with lr=0.00010029891990599013 and 1000 epochs
Finish Trainingstep 3 of 3 with lr=0.00010029891990599013 and 10000 epochs
2025-05-20_02-40-31
[I 2025-05-20 02:40:32,025] Trial 66 finished with value: 0.0010914311278611422 and parameters: {'n_layers': 9, 'n_units': 135, 'activation': 'swish', 'lr': 0.00010029891990599013, 'optimizer': 'RAdam', 'batch_size': 1824}. Best is trial 51 with value: 0.0005635097622871399.
Training model with params: layers=8, units=194, activation=sigmoid, optimizer=RAdam, lr=0.0001372826452856798, batchsize=816
Finish Trainingstep 1 of 3 with lr=0.0001372826452856798 and 1000 epochs
Finish Trainingstep 2 of 3 with lr=0.0001372826452856798 and 1000 epochs
Finish Trainingstep 3 of 3 with lr=0.0001372826452856798 and 10000 epochs
2025-05-20_05-17-59
[I 2025-05-20 05:17:59,854] Trial 67 finished with value: 0.008899799548089504 and parameters: {'n_layers': 8, 'n_units': 194, 'activation': 'sigmoid', 'lr': 0.0001372826452856798, 'optimizer': 'RAdam', 'batch_size': 816}. Best is trial 51 with value: 0.0005635097622871399.
Training model with params: layers=9, units=165, activation=swish, optimizer=sgd, lr=0.00021312032870363096, batchsize=1770
Finish Trainingstep 1 of 3 with lr=0.00021312032870363096 and 1000 epochs
Finish Trainingstep 2 of 3 with lr=0.00021312032870363096 and 1000 epochs
Finish Trainingstep 3 of 3 with lr=0.00021312032870363096 and 10000 epochs
2025-05-20_05-47-04
[I 2025-05-20 05:47:04,708] Trial 68 finished with value: 1.0255736112594604 and parameters: {'n_layers': 9, 'n_units': 165, 'activation': 'swish', 'lr': 0.00021312032870363096, 'optimizer': 'sgd', 'batch_size': 1770}. Best is trial 51 with value: 0.0005635097622871399.
Training model with params: layers=1, units=215, activation=relu, optimizer=rmsprop, lr=0.0001743888229485921, batchsize=2044
Finish Trainingstep 1 of 3 with lr=0.0001743888229485921 and 1000 epochs
Finish Trainingstep 2 of 3 with lr=0.0001743888229485921 and 1000 epochs
Finish Trainingstep 3 of 3 with lr=0.0001743888229485921 and 10000 epochs
2025-05-20_06-13-58
[I 2025-05-20 06:13:58,689] Trial 69 finished with value: 0.008813844993710518 and parameters: {'n_layers': 1, 'n_units': 215, 'activation': 'relu', 'lr': 0.0001743888229485921, 'optimizer': 'rmsprop', 'batch_size': 2044}. Best is trial 51 with value: 0.0005635097622871399.
Training model with params: layers=8, units=223, activation=elu, optimizer=RAdam, lr=0.00036832257014590426, batchsize=1930
Finish Trainingstep 1 of 3 with lr=0.00036832257014590426 and 1000 epochs
Finish Trainingstep 2 of 3 with lr=0.00036832257014590426 and 1000 epochs
Finish Trainingstep 3 of 3 with lr=0.00036832257014590426 and 10000 epochs
2025-05-20_07-10-50
[I 2025-05-20 07:10:50,112] Trial 70 finished with value: 0.0014504636637866497 and parameters: {'n_layers': 8, 'n_units': 223, 'activation': 'elu', 'lr': 0.00036832257014590426, 'optimizer': 'RAdam', 'batch_size': 1930}. Best is trial 51 with value: 0.0005635097622871399.
Training model with params: layers=9, units=262, activation=swish, optimizer=RAdam, lr=0.00011496868765931995, batchsize=1850
Finish Trainingstep 1 of 3 with lr=0.00011496868765931995 and 1000 epochs
Finish Trainingstep 2 of 3 with lr=0.00011496868765931995 and 1000 epochs
Finish Trainingstep 3 of 3 with lr=0.00011496868765931995 and 10000 epochs
2025-05-20_08-49-25
[I 2025-05-20 08:49:25,959] Trial 71 finished with value: 0.0007485206006094813 and parameters: {'n_layers': 9, 'n_units': 262, 'activation': 'swish', 'lr': 0.00011496868765931995, 'optimizer': 'RAdam', 'batch_size': 1850}. Best is trial 51 with value: 0.0005635097622871399.
Training model with params: layers=9, units=39, activation=swish, optimizer=RAdam, lr=0.00015140806423769013, batchsize=1682
Finish Trainingstep 1 of 3 with lr=0.00015140806423769013 and 1000 epochs
Finish Trainingstep 2 of 3 with lr=0.00015140806423769013 and 1000 epochs
Finish Trainingstep 3 of 3 with lr=0.00015140806423769013 and 10000 epochs
2025-05-20_10-09-06
[I 2025-05-20 10:09:06,665] Trial 72 finished with value: 0.002368801971897483 and parameters: {'n_layers': 9, 'n_units': 39, 'activation': 'swish', 'lr': 0.00015140806423769013, 'optimizer': 'RAdam', 'batch_size': 1682}. Best is trial 51 with value: 0.0005635097622871399.
Training model with params: layers=8, units=242, activation=swish, optimizer=RAdam, lr=0.00017859353389327212, batchsize=1785
Finish Trainingstep 1 of 3 with lr=0.00017859353389327212 and 1000 epochs
Finish Trainingstep 2 of 3 with lr=0.00017859353389327212 and 1000 epochs
Finish Trainingstep 3 of 3 with lr=0.00017859353389327212 and 10000 epochs
2025-05-20_11-13-48
[I 2025-05-20 11:13:48,130] Trial 73 finished with value: 0.0008000052184797823 and parameters: {'n_layers': 8, 'n_units': 242, 'activation': 'swish', 'lr': 0.00017859353389327212, 'optimizer': 'RAdam', 'batch_size': 1785}. Best is trial 51 with value: 0.0005635097622871399.
Training model with params: layers=9, units=299, activation=swish, optimizer=RAdam, lr=0.0001314205839309544, batchsize=1362
Finish Trainingstep 1 of 3 with lr=0.0001314205839309544 and 1000 epochs
Finish Trainingstep 2 of 3 with lr=0.0001314205839309544 and 1000 epochs
Finish Trainingstep 3 of 3 with lr=0.0001314205839309544 and 10000 epochs
2025-05-20_13-05-57
[I 2025-05-20 13:05:57,779] Trial 74 finished with value: 0.0006071998504921794 and parameters: {'n_layers': 9, 'n_units': 299, 'activation': 'swish', 'lr': 0.0001314205839309544, 'optimizer': 'RAdam', 'batch_size': 1362}. Best is trial 51 with value: 0.0005635097622871399.
Training model with params: layers=9, units=301, activation=swish, optimizer=AdamW, lr=0.00013371405655694977, batchsize=1358
Finish Trainingstep 1 of 3 with lr=0.00013371405655694977 and 1000 epochs
Finish Trainingstep 2 of 3 with lr=0.00013371405655694977 and 1000 epochs
Finish Trainingstep 3 of 3 with lr=0.00013371405655694977 and 10000 epochs
2025-05-20_13-40-32
[I 2025-05-20 13:40:32,971] Trial 75 finished with value: 0.005289274733513594 and parameters: {'n_layers': 9, 'n_units': 301, 'activation': 'swish', 'lr': 0.00013371405655694977, 'optimizer': 'AdamW', 'batch_size': 1358}. Best is trial 51 with value: 0.0005635097622871399.
Training model with params: layers=9, units=277, activation=selu, optimizer=RAdam, lr=0.00020617282654343237, batchsize=1033
Finish Trainingstep 1 of 3 with lr=0.00020617282654343237 and 1000 epochs
Finish Trainingstep 2 of 3 with lr=0.00020617282654343237 and 1000 epochs
Finish Trainingstep 3 of 3 with lr=0.00020617282654343237 and 10000 epochs
2025-05-20_15-17-19
[I 2025-05-20 15:17:19,166] Trial 76 finished with value: 0.0038919963408261538 and parameters: {'n_layers': 9, 'n_units': 277, 'activation': 'selu', 'lr': 0.00020617282654343237, 'optimizer': 'RAdam', 'batch_size': 1033}. Best is trial 51 with value: 0.0005635097622871399.
Training model with params: layers=7, units=174, activation=swish, optimizer=RAdam, lr=0.0012660480284690243, batchsize=1263
Finish Trainingstep 1 of 3 with lr=0.0012660480284690243 and 1000 epochs
Finish Trainingstep 2 of 3 with lr=0.0012660480284690243 and 1000 epochs
Finish Trainingstep 3 of 3 with lr=0.0012660480284690243 and 10000 epochs
2025-05-20_15-57-48
[I 2025-05-20 15:57:48,755] Trial 77 finished with value: 0.0010553061729297042 and parameters: {'n_layers': 7, 'n_units': 174, 'activation': 'swish', 'lr': 0.0012660480284690243, 'optimizer': 'RAdam', 'batch_size': 1263}. Best is trial 51 with value: 0.0005635097622871399.
Training model with params: layers=3, units=186, activation=swish, optimizer=RAdam, lr=0.0001095678167978392, batchsize=1459
Finish Trainingstep 1 of 3 with lr=0.0001095678167978392 and 1000 epochs
Finish Trainingstep 2 of 3 with lr=0.0001095678167978392 and 1000 epochs
Finish Trainingstep 3 of 3 with lr=0.0001095678167978392 and 10000 epochs
2025-05-20_16-18-45
[I 2025-05-20 16:18:45,812] Trial 78 finished with value: 0.0022108640987426043 and parameters: {'n_layers': 3, 'n_units': 186, 'activation': 'swish', 'lr': 0.0001095678167978392, 'optimizer': 'RAdam', 'batch_size': 1459}. Best is trial 51 with value: 0.0005635097622871399.
Training model with params: layers=10, units=268, activation=swish, optimizer=adam, lr=0.0009549066896062082, batchsize=1194
Finish Trainingstep 1 of 3 with lr=0.0009549066896062082 and 1000 epochs
Finish Trainingstep 2 of 3 with lr=0.0009549066896062082 and 1000 epochs
Finish Trainingstep 3 of 3 with lr=0.0009549066896062082 and 10000 epochs
2025-05-20_17-25-29
[I 2025-05-20 17:25:30,110] Trial 79 finished with value: 0.00098622334189713 and parameters: {'n_layers': 10, 'n_units': 268, 'activation': 'swish', 'lr': 0.0009549066896062082, 'optimizer': 'adam', 'batch_size': 1194}. Best is trial 51 with value: 0.0005635097622871399.
Training model with params: layers=9, units=297, activation=gelu, optimizer=RAdam, lr=0.00015505837304780824, batchsize=1603
Finish Trainingstep 1 of 3 with lr=0.00015505837304780824 and 1000 epochs
Finish Trainingstep 2 of 3 with lr=0.00015505837304780824 and 1000 epochs
Finish Trainingstep 3 of 3 with lr=0.00015505837304780824 and 10000 epochs
2025-05-20_19-30-43
[I 2025-05-20 19:30:43,489] Trial 80 finished with value: 0.0008449448505416512 and parameters: {'n_layers': 9, 'n_units': 297, 'activation': 'gelu', 'lr': 0.00015505837304780824, 'optimizer': 'RAdam', 'batch_size': 1603}. Best is trial 51 with value: 0.0005635097622871399.
Training model with params: layers=9, units=229, activation=swish, optimizer=RAdam, lr=0.0001221562426994445, batchsize=1521
Finish Trainingstep 1 of 3 with lr=0.0001221562426994445 and 1000 epochs
Finish Trainingstep 2 of 3 with lr=0.0001221562426994445 and 1000 epochs
Finish Trainingstep 3 of 3 with lr=0.0001221562426994445 and 10000 epochs
2025-05-20_22-23-36
[I 2025-05-20 22:23:36,107] Trial 81 finished with value: 0.0008648554212413728 and parameters: {'n_layers': 9, 'n_units': 229, 'activation': 'swish', 'lr': 0.0001221562426994445, 'optimizer': 'RAdam', 'batch_size': 1521}. Best is trial 51 with value: 0.0005635097622871399.
Training model with params: layers=10, units=376, activation=swish, optimizer=RAdam, lr=0.00016706121830982595, batchsize=1576
Finish Trainingstep 1 of 3 with lr=0.00016706121830982595 and 1000 epochs
Finish Trainingstep 2 of 3 with lr=0.00016706121830982595 and 1000 epochs
Finish Trainingstep 3 of 3 with lr=0.00016706121830982595 and 10000 epochs
2025-05-21_00-34-58
[I 2025-05-21 00:34:58,512] Trial 82 finished with value: 0.0006549670360982418 and parameters: {'n_layers': 10, 'n_units': 376, 'activation': 'swish', 'lr': 0.00016706121830982595, 'optimizer': 'RAdam', 'batch_size': 1576}. Best is trial 51 with value: 0.0005635097622871399.
Training model with params: layers=10, units=420, activation=swish, optimizer=RAdam, lr=0.00018637385555220893, batchsize=1711
Finish Trainingstep 1 of 3 with lr=0.00018637385555220893 and 1000 epochs
Finish Trainingstep 2 of 3 with lr=0.00018637385555220893 and 1000 epochs
Finish Trainingstep 3 of 3 with lr=0.00018637385555220893 and 10000 epochs
2025-05-21_02-38-38
[I 2025-05-21 02:38:38,171] Trial 83 finished with value: 0.000677423900924623 and parameters: {'n_layers': 10, 'n_units': 420, 'activation': 'swish', 'lr': 0.00018637385555220893, 'optimizer': 'RAdam', 'batch_size': 1711}. Best is trial 51 with value: 0.0005635097622871399.
Training model with params: layers=10, units=374, activation=swish, optimizer=RAdam, lr=0.00022270300546614364, batchsize=1308
Finish Trainingstep 1 of 3 with lr=0.00022270300546614364 and 1000 epochs
Finish Trainingstep 2 of 3 with lr=0.00022270300546614364 and 1000 epochs
Finish Trainingstep 3 of 3 with lr=0.00022270300546614364 and 10000 epochs
2025-05-21_04-46-17
[I 2025-05-21 04:46:17,596] Trial 84 finished with value: 0.0007243492873385549 and parameters: {'n_layers': 10, 'n_units': 374, 'activation': 'swish', 'lr': 0.00022270300546614364, 'optimizer': 'RAdam', 'batch_size': 1308}. Best is trial 51 with value: 0.0005635097622871399.
Training model with params: layers=10, units=401, activation=tanh, optimizer=RAdam, lr=0.0001852827025042277, batchsize=1391
Finish Trainingstep 1 of 3 with lr=0.0001852827025042277 and 1000 epochs
Finish Trainingstep 2 of 3 with lr=0.0001852827025042277 and 1000 epochs
Finish Trainingstep 3 of 3 with lr=0.0001852827025042277 and 10000 epochs
2025-05-21_06-00-44
[I 2025-05-21 06:00:44,438] Trial 85 finished with value: 0.002007327741011977 and parameters: {'n_layers': 10, 'n_units': 401, 'activation': 'tanh', 'lr': 0.0001852827025042277, 'optimizer': 'RAdam', 'batch_size': 1391}. Best is trial 51 with value: 0.0005635097622871399.
Training model with params: layers=10, units=448, activation=leaky_relu, optimizer=RAdam, lr=0.0003354491890356466, batchsize=1705
Finish Trainingstep 1 of 3 with lr=0.0003354491890356466 and 1000 epochs
Finish Trainingstep 2 of 3 with lr=0.0003354491890356466 and 1000 epochs
Finish Trainingstep 3 of 3 with lr=0.0003354491890356466 and 10000 epochs
2025-05-21_07-18-27
[I 2025-05-21 07:18:27,483] Trial 86 finished with value: 0.006741659250110388 and parameters: {'n_layers': 10, 'n_units': 448, 'activation': 'leaky_relu', 'lr': 0.0003354491890356466, 'optimizer': 'RAdam', 'batch_size': 1705}. Best is trial 51 with value: 0.0005635097622871399.
Training model with params: layers=10, units=403, activation=swish, optimizer=RAdam, lr=0.000161417663539358, batchsize=1962
Finish Trainingstep 1 of 3 with lr=0.000161417663539358 and 1000 epochs
Finish Trainingstep 2 of 3 with lr=0.000161417663539358 and 1000 epochs
Finish Trainingstep 3 of 3 with lr=0.000161417663539358 and 10000 epochs
2025-05-21_09-43-29
[I 2025-05-21 09:43:29,762] Trial 87 finished with value: 0.0006157017196528614 and parameters: {'n_layers': 10, 'n_units': 403, 'activation': 'swish', 'lr': 0.000161417663539358, 'optimizer': 'RAdam', 'batch_size': 1962}. Best is trial 51 with value: 0.0005635097622871399.
Training model with params: layers=10, units=478, activation=swish, optimizer=RAdam, lr=0.00016120992066630786, batchsize=1966
Finish Trainingstep 1 of 3 with lr=0.00016120992066630786 and 1000 epochs
Finish Trainingstep 2 of 3 with lr=0.00016120992066630786 and 1000 epochs
Finish Trainingstep 3 of 3 with lr=0.00016120992066630786 and 10000 epochs
2025-05-21_11-27-33
[I 2025-05-21 11:27:33,517] Trial 88 finished with value: 0.0006283126422204077 and parameters: {'n_layers': 10, 'n_units': 478, 'activation': 'swish', 'lr': 0.00016120992066630786, 'optimizer': 'RAdam', 'batch_size': 1966}. Best is trial 51 with value: 0.0005635097622871399.
Training model with params: layers=10, units=476, activation=swish, optimizer=rmsprop, lr=0.0002704906466096131, batchsize=1107
Finish Trainingstep 1 of 3 with lr=0.0002704906466096131 and 1000 epochs
Finish Trainingstep 2 of 3 with lr=0.0002704906466096131 and 1000 epochs
Finish Trainingstep 3 of 3 with lr=0.0002704906466096131 and 10000 epochs
2025-05-21_15-03-50
[I 2025-05-21 15:03:50,403] Trial 89 finished with value: 0.0012341029942035675 and parameters: {'n_layers': 10, 'n_units': 476, 'activation': 'swish', 'lr': 0.0002704906466096131, 'optimizer': 'rmsprop', 'batch_size': 1107}. Best is trial 51 with value: 0.0005635097622871399.
Training model with params: layers=10, units=493, activation=relu, optimizer=sgd, lr=0.00016178953685054632, batchsize=1931
Finish Trainingstep 1 of 3 with lr=0.00016178953685054632 and 1000 epochs
Finish Trainingstep 2 of 3 with lr=0.00016178953685054632 and 1000 epochs
Finish Trainingstep 3 of 3 with lr=0.00016178953685054632 and 10000 epochs
2025-05-21_19-00-23
[I 2025-05-21 19:00:23,763] Trial 90 finished with value: 1.0233877897262573 and parameters: {'n_layers': 10, 'n_units': 493, 'activation': 'relu', 'lr': 0.00016178953685054632, 'optimizer': 'sgd', 'batch_size': 1931}. Best is trial 51 with value: 0.0005635097622871399.
Training model with params: layers=10, units=404, activation=swish, optimizer=RAdam, lr=0.00011370633843933123, batchsize=1985
Finish Trainingstep 1 of 3 with lr=0.00011370633843933123 and 1000 epochs
Finish Trainingstep 2 of 3 with lr=0.00011370633843933123 and 1000 epochs
Finish Trainingstep 3 of 3 with lr=0.00011370633843933123 and 10000 epochs
2025-05-21_22-22-27
[I 2025-05-21 22:22:27,467] Trial 91 finished with value: 0.0005490526673384011 and parameters: {'n_layers': 10, 'n_units': 404, 'activation': 'swish', 'lr': 0.00011370633843933123, 'optimizer': 'RAdam', 'batch_size': 1985}. Best is trial 91 with value: 0.0005490526673384011.
Training model with params: layers=10, units=406, activation=swish, optimizer=RAdam, lr=0.00011219029182112141, batchsize=1961
Finish Trainingstep 1 of 3 with lr=0.00011219029182112141 and 1000 epochs
Finish Trainingstep 2 of 3 with lr=0.00011219029182112141 and 1000 epochs
Finish Trainingstep 3 of 3 with lr=0.00011219029182112141 and 10000 epochs
2025-05-22_01-15-05
[I 2025-05-22 01:15:06,041] Trial 92 finished with value: 0.0006442914600484073 and parameters: {'n_layers': 10, 'n_units': 406, 'activation': 'swish', 'lr': 0.00011219029182112141, 'optimizer': 'RAdam', 'batch_size': 1961}. Best is trial 91 with value: 0.0005490526673384011.
Training model with params: layers=10, units=418, activation=swish, optimizer=RAdam, lr=0.00011034857153423028, batchsize=2001
Finish Trainingstep 1 of 3 with lr=0.00011034857153423028 and 1000 epochs
Finish Trainingstep 2 of 3 with lr=0.00011034857153423028 and 1000 epochs
Finish Trainingstep 3 of 3 with lr=0.00011034857153423028 and 10000 epochs
2025-05-22_03-40-14
[I 2025-05-22 03:40:14,871] Trial 93 finished with value: 0.0006384289008565247 and parameters: {'n_layers': 10, 'n_units': 418, 'activation': 'swish', 'lr': 0.00011034857153423028, 'optimizer': 'RAdam', 'batch_size': 2001}. Best is trial 91 with value: 0.0005490526673384011.
Training model with params: layers=10, units=406, activation=swish, optimizer=RAdam, lr=0.00010943729446750919, batchsize=2001
Finish Trainingstep 1 of 3 with lr=0.00010943729446750919 and 1000 epochs
Finish Trainingstep 2 of 3 with lr=0.00010943729446750919 and 1000 epochs
Finish Trainingstep 3 of 3 with lr=0.00010943729446750919 and 10000 epochs
2025-05-22_06-26-28
[I 2025-05-22 06:26:28,481] Trial 94 finished with value: 0.0005468696472235024 and parameters: {'n_layers': 10, 'n_units': 406, 'activation': 'swish', 'lr': 0.00010943729446750919, 'optimizer': 'RAdam', 'batch_size': 2001}. Best is trial 94 with value: 0.0005468696472235024.
Training model with params: layers=10, units=405, activation=sigmoid, optimizer=RAdam, lr=0.00011450466385923691, batchsize=1976
Finish Trainingstep 1 of 3 with lr=0.00011450466385923691 and 1000 epochs
Finish Trainingstep 2 of 3 with lr=0.00011450466385923691 and 1000 epochs
Finish Trainingstep 3 of 3 with lr=0.00011450466385923691 and 10000 epochs
2025-05-22_09-40-14
[I 2025-05-22 09:40:14,223] Trial 95 finished with value: 0.07738319784402847 and parameters: {'n_layers': 10, 'n_units': 405, 'activation': 'sigmoid', 'lr': 0.00011450466385923691, 'optimizer': 'RAdam', 'batch_size': 1976}. Best is trial 94 with value: 0.0005468696472235024.
Training model with params: layers=10, units=417, activation=swish, optimizer=RAdam, lr=0.00010145309183592463, batchsize=2047
Finish Trainingstep 1 of 3 with lr=0.00010145309183592463 and 1000 epochs
Finish Trainingstep 2 of 3 with lr=0.00010145309183592463 and 1000 epochs
Finish Trainingstep 3 of 3 with lr=0.00010145309183592463 and 10000 epochs
2025-05-22_12-52-51
