[I 2025-05-22 12:52:51,708] Trial 96 finished with value: 0.0006156755844131112 and parameters: {'n_layers': 10, 'n_units': 417, 'activation': 'swish', 'lr': 0.00010145309183592463, 'optimizer': 'RAdam', 'batch_size': 2047}. Best is trial 94 with value: 0.0005468696472235024.
Training model with params: layers=10, units=450, activation=elu, optimizer=adam, lr=0.00010093524193335255, batchsize=2048
Finish Trainingstep 1 of 3 with lr=0.00010093524193335255 and 1000 epochs
Finish Trainingstep 2 of 3 with lr=0.00010093524193335255 and 1000 epochs
Finish Trainingstep 3 of 3 with lr=0.00010093524193335255 and 10000 epochs
2025-05-22_15-53-48
[I 2025-05-22 15:53:48,430] Trial 97 finished with value: 0.0018448455957695842 and parameters: {'n_layers': 10, 'n_units': 450, 'activation': 'elu', 'lr': 0.00010093524193335255, 'optimizer': 'adam', 'batch_size': 2048}. Best is trial 94 with value: 0.0005468696472235024.
Training model with params: layers=10, units=431, activation=swish, optimizer=AdamW, lr=0.00012638125242693304, batchsize=2009
Finish Trainingstep 1 of 3 with lr=0.00012638125242693304 and 1000 epochs
Finish Trainingstep 2 of 3 with lr=0.00012638125242693304 and 1000 epochs
Finish Trainingstep 3 of 3 with lr=0.00012638125242693304 and 10000 epochs
2025-05-22_17-00-57
[I 2025-05-22 17:00:57,977] Trial 98 finished with value: 0.004498837050050497 and parameters: {'n_layers': 10, 'n_units': 431, 'activation': 'swish', 'lr': 0.00012638125242693304, 'optimizer': 'AdamW', 'batch_size': 2009}. Best is trial 94 with value: 0.0005468696472235024.
Training model with params: layers=10, units=469, activation=swish, optimizer=RAdam, lr=0.00012803352941960928, batchsize=1893
Finish Trainingstep 1 of 3 with lr=0.00012803352941960928 and 1000 epochs
Finish Trainingstep 2 of 3 with lr=0.00012803352941960928 and 1000 epochs
Finish Trainingstep 3 of 3 with lr=0.00012803352941960928 and 10000 epochs
2025-05-22_19-27-47
[I 2025-05-22 19:27:47,857] Trial 99 finished with value: 0.0007197299273684621 and parameters: {'n_layers': 10, 'n_units': 469, 'activation': 'swish', 'lr': 0.00012803352941960928, 'optimizer': 'RAdam', 'batch_size': 1893}. Best is trial 94 with value: 0.0005468696472235024.
Beste Parameter:
{'n_layers': 10, 'n_units': 406, 'activation': 'swish', 'lr': 0.00010943729446750919, 'optimizer': 'RAdam', 'batch_size': 2001}
